ids,titles,Date
FOVi8g96U5g,HANGING OUT with 20 SLOTHS! Monteverde | Costa Rica,2021-04-26 15:58:43+00:00
zAU7qrRBl88,Is This Place Even Real? | Hidden Wellness Resort in Costa Rica,2021-04-04 16:00:19+00:00
EZla_-n9Y-s,Airstream Renovated into Luxury Costa Rican Beach House,2021-03-28 13:00:03+00:00
Ild0yhCa7Aw,Artist Builds Magical Dome Airbnb in the Jungles of Costa Rica,2021-03-21 13:00:11+00:00
PgJIoLRaCFk,"How We Made $10,000 Our First Month of Being an Airbnb Host | How To Start an Airbnb Business",2021-03-14 13:30:02+00:00
eP0Cwm1AENw,LIVING in a FOOD FOREST | Costa Rica 1 Month Update,2021-02-14 15:00:31+00:00
SFtDYVNo-4s,6 WAYS To PACK Like A PRO!,2021-02-02 14:14:39+00:00
_dpZ6XfPSB0,BLOWN AWAY! First time visiting our land in Alegria Village,2021-01-24 15:00:10+00:00
pvJTtDrlQYk,Flying with a Toddler During a Pandemic | We&#39;ve Arrived in Costa Rica!,2020-12-23 13:00:33+00:00
5z0HA1RyQXE,Emotional Goodbye to Our Airstream,2020-12-13 14:11:22+00:00
IGmCDSysPMY,We Bought Land in a Jungle! | Find Out Where,2020-11-18 15:38:18+00:00
xixDu-g7EQI,Sustainable Living: Making Our Airstream More Organic and Eco Friendly,2020-11-15 15:42:34+00:00
5Z7xMRjJARQ,We Just Needed a Break... | Airstream Living in Autumn,2020-10-26 17:24:51+00:00
6AG25OSodtg,Canada&#39;s RAINBOW FOREST - Airstream Living in Chutes Provincial Park During Autumn,2020-10-17 13:48:32+00:00
W6J-KO3q7PU,FAMILY TRAVELING during COVID-19 - Airstream Road Trip,2020-08-02 23:24:19+00:00
uUwHirWCNZc,7 Days Camping on the WORLD&#39;S LARGEST Fresh Water Island | Airstream Living,2020-07-28 13:00:09+00:00
hCoBPIuwizw,WE MOVED IN! - Full-Time Airstream Living,2020-07-19 14:36:56+00:00
6r1LQK74aec,Airstream Renovation Complete...For Now! | Our Tiny House Tour,2020-07-12 13:39:04+00:00
OrbyI45pNGc,DOUBLED our FLOOR SPACE | Airstream Renovation,2020-07-05 14:53:05+00:00
GFTqW2lwE58,Building our dream TINY HOUSE,2020-06-28 16:41:03+00:00
oTJXRc-4jpA,Airstream Renovation: Making Natural Paint &amp; A Rock Climbing Wall,2020-06-21 13:00:11+00:00
IILh9o3vFmo,a SPA in our TINY HOUSE? ft. Nebia by Moen | Airstream Renovation,2020-06-14 13:04:31+00:00
iBiyoN3iyEk,Airstream Tree House Build | It&#39;s Looking SO Good!,2020-05-24 20:24:14+00:00
QmBB-5-PeTU,Newbie Airstream Renovators | Are We Doing This Right?,2020-05-10 18:10:15+00:00
9CdjTSnN3f8,Building Our Ultimate Tiny House on Wheels - Airstream Renovation | Kids Treehouse Bunk Bed,2020-05-03 14:05:31+00:00
vO7Pxav-IVk,This Changed Our Lives - Ecuador Group Trip Pt. 2,2020-04-22 22:54:15+00:00
LK18QP6jpQk,Taking 12 Subscribers to Ecuador | Part 1,2020-04-08 19:16:48+00:00
n6_KedtZYKo,Extreme Minimalist - 44 Items Only!,2020-04-01 21:07:47+00:00
1PtA9Lpmfrk,7 Ways to Scratch the Travel Itch in Quarantine,2020-03-23 17:43:55+00:00
CnjgJ0i6tbk,We Found a Private Island! - Ocean Cay - MSC Marine Reserve,2020-02-06 17:20:38+00:00
yhFcLQXM5x4,First Caribbean Cruise | Did We Like It? | MSC Meraviglia Tour + More,2020-01-26 17:24:48+00:00
ev1ucMbU7sI,we bought a house with friends | 2020 UPDATES,2020-01-15 17:18:44+00:00
U_updnFf76g,Iceland Travel Guide - Winter Family Road Trip,2019-12-08 15:58:39+00:00
vrO2ZrbSeUk,Staying Healthy While Traveling,2019-09-25 15:00:20+00:00
swgiPfcqT6g,Canada&#39;s NEW National Park | Family Travel Vlog,2019-08-15 13:48:09+00:00
leA1-Bh2vDs,Baby&#39;s First Road Trip! How did it go?,2019-07-24 18:35:16+00:00
tT4O_Q2JA7I,This Is Why I Love Pakistan,2019-07-17 16:45:00+00:00
HSD3UBfob6I,We Are The Only Tourists Here | Skardu - Pakistan,2019-07-10 18:00:02+00:00
IS71sYGRr_Y,STUNNING Hunza Valley - Pakistan Vlog,2019-07-03 16:00:02+00:00
9PzWnuRfnsQ,Hiking Fairy Meadows - Pakistan EP 4,2019-06-26 17:47:53+00:00
jtY4FcfWSWs,"World&#39;s Most Dangerous Highway - Fairy Meadows, Pakistan",2019-06-19 10:57:45+00:00
7m0trH1d1aE,CRAZY Drive on the Roof in PAKISTAN | Besham to Chillas | EP2,2019-06-12 18:00:01+00:00
3EI38bq-RM0,Pakistani Street Food - ISLAMABAD to BESHAM,2019-06-10 17:58:43+00:00
3fEJdastOfE,Shopping Conversion Vehicles: 3 Options,2019-05-15 16:08:06+00:00
FCw_nuS3YU0,10 Ways to Look and Feel Fresh After a Long Flight,2019-05-08 16:00:03+00:00
JAzOGGqh8JY,Rare Jewelry + How We Found Them,2019-05-01 16:00:04+00:00
S3a6_MLhaZM,18 Zero Waste Travel Essentials | Eco Friendly Travel,2019-04-21 17:09:33+00:00
BIbTjJ3lskU,Home Security HACKS when you TRAVEL,2019-03-18 15:30:01+00:00
y9NmX9XBFk0,Baby Travel Packing Checklist | How to Pack,2019-03-06 17:00:16+00:00
7gzQAqss_8o,4 days in Malta: Maltese Food you NEED to Try | Travel Vlog,2019-03-03 16:00:00+00:00
YRqUmQHm024,Toronto in a Day on a Budget | $100 Challenge,2019-02-27 16:00:08+00:00
sDKR6YBKp3g,Wild | A Cinematic Journey from South Africa to Zimbabwe,2019-02-20 16:03:54+00:00
TS2-sB7gv3Q,Flying with a 4 month old BABY | Her first flight,2019-02-11 14:00:07+00:00
iVNBEwccdcE,15 Destinations Told by Solo Female Travellers,2019-02-06 18:30:00+00:00
hwTkuV20dGQ,20 Minute Street Style PAD THAI,2019-02-03 16:15:43+00:00
ggqjK9TXx-Q,10 item Packing Challenge | How to Pack Better,2019-01-30 16:15:01+00:00
DNHHKFGpev0,How to Tell Your Partner You&#39;re Traveling Without Them,2019-01-27 15:20:32+00:00
ZvOyxxpB1Mw,BIZARRE Festivals to Visit | JAN to DEC 2019,2019-01-20 18:00:06+00:00
_voanjsOBm4,How to Travel with Your Dog Internationally  | What You Need to Know,2019-01-16 17:00:09+00:00
O_-FcZ5HR4E,24 Beauty Travel Hacks YOU NEED TO KNOW,2019-01-13 16:00:03+00:00
5X1UTbwC9UY,5 VERY AFFORDABLE Budget Travel Destinations for 2019,2019-01-09 17:00:50+00:00
690YLN1qzso,ONE YEAR in 199 SECONDS | 2018 Travel Montage,2019-01-02 18:01:55+00:00
