comment,id,date,num_likes
the amount of connection i&#39;m having on this journey with you my dear adriene and all the people around here  and pets is so magical !,assia bahassine,2020-01-18T21:18:14Z,1
😍😍😍😍😍😍😍😍😍😍😍😍😍😍😍😍,imane bahassine,2020-01-19T12:19:51Z,1
"“We love you, Warrior 1! Your number one to us!” LOL! But seriously, you’re right it doesn’t happen very much. I’m gonna put in my sequences as much as possible now. I’m bringing it back, baby!",Liz Comstock,2020-01-18T21:05:18Z,6
Have anyone here ever felt yoga drunk? Like smiling and laughing with no reason and filled with joy and incredible energy?<br /><br />That s how i felt after this practice !,Tchina Mameri,2020-01-18T21:00:11Z,110
Yes!,Eliška Č,2021-05-05T07:52:17Z,0
"I had that, not today, but after some other practices. It really is an incredible feeling when you catch that &quot;yogee high&quot; :D",Diana,2021-01-23T19:36:52Z,1
I wish,Helen,2020-08-27T05:48:43Z,0
"That was me yesterday! After the practice I was in such an incredible mood - even at my doctor, then blood work, then house work!",Emily Cochran,2020-03-07T12:49:02Z,1
I love these 30 days of yoga classes. They are very beneficial but I’m having problems actually focusing on the flow and inward on myself with all the talking consistently. Do you have any 30 day challenges that aren’t as chatty??,Shiloh Watford,2020-01-18T20:47:10Z,0
Been busy all day and when I came back home at 9 pm the first thing I said was: OMG I need to do yoga<br />At first I wasn&#39;t really happy about it but as soon as I step on the mat I felt super good<br />I love how yoga is making me love moving my body again ❤️,claudia di stefano,2020-01-18T20:43:33Z,0
Loving this journey so far. today when I did my hand behind me and added the rest my fingers went a bit tingly and then numb in the first direction. I found that odd. Thanks!,nuiddragh17,2020-01-18T20:43:30Z,0
&quot;Stay true to your exhale.&quot;,Mary Friedle,2020-01-18T20:41:33Z,0
"My mind was everywhere, that practice. Meditation follow up required lol Let’s Go Cowboy!",Lemons LRG,2020-01-18T20:37:42Z,0
"Today I had a though workout, so I was pretty sore. The seat pose was really challenging, so I standed up sometimes in middle of it. I listened to my body, but it was challenging to really concenrate on my breath, but I liked this. I breathed deep, and it was something I needed. Thank you Adriene",kaisa,2020-01-18T20:36:23Z,0
"Your silliness makes my day! Makes a wonderful practice even better, if that was even possible! 🧘‍♀️🥰",Kristin Lucernoni,2020-01-18T20:24:42Z,0
I am glad I made this my nighttime ritual. On wednesday I saw a burglar and every since had trouble sleeping (he saw me looking at him while calling police). Yoga helps me clear my mind from panic that I felt. Thank you for young this!,AnnaBeth,2020-01-18T20:23:58Z,0
"This was amazing, i sent u an email lovingly waiting for ur response 💕",Ashima Khalid,2020-01-18T20:21:42Z,0
It&#39;s snowing in Pennsylvania on the 18th day in January 2020.  Home Day 17 completed a little later than usual for me.  I could really feel the energy when I brought my hands together to prayer position.  ~namaste xoxo,A Lochetto,2020-01-18T20:20:12Z,0
I can&#39;t believe we&#39;re 17 days into HOME! I loved the poem you&#39;ve included in today&#39;s email.,Francesca Simonato,2020-01-18T20:19:00Z,0
"So today i had a hard time motivating myself to get on the mat, but i did and I don&#39;t regret it one bit. I really felt this one on a deeper level. Thank you Adriene!",Angela S,2020-01-18T20:14:42Z,0
"Today brought a lot of anxiety. Began roller skate recently and on top of feeling like a true beginner and not confident at all on the wheels, my legs are kind of sore. Couldnt reach the chair pose today, abandonned, felt guilt, guilt brought back my eating habits and my weight back, as i took another kilo. Today, it was hard to love myself during this practice, and not feel like a mess...<br />Can&#39;t wait for more love tomorrow, I need it...",Luci Garcia,2020-01-18T20:14:10Z,0
"Thank you Adriene. What a nice moving meditation! And I like your top today, looks so good. Love from Vancouver. Namaste. :)",Huang Yizhou,2020-01-18T20:12:10Z,0
"BEAUTIFUL!!! I thoroughly enjoyed this sequence. I’ve been in such pain in my shoulders, and this sequence really helped loosen everything up and I can breath without pain now 🥰🥰🥰",Nadia Nanette,2020-01-18T20:09:28Z,0
"I&#39;ve been practicing with Adriene for so long that the thumb I put on top first is almost always the &quot;weird&quot; one! 😃 Ahah love you, namaste! 💖",Princess,2020-01-18T20:08:39Z,0
Something so powerful and relaxing within the first flow ❤️,snow flake,2020-01-18T20:07:14Z,0
"Feel like I’ve said this every time, but this practice blew my mind. So simple and watched it and though “relaxing”, but then when you bring in the mindfulness and attachment to the breath, it actually felt like a really intensive workout. Loved it. Feel so powerful but also light and easy. 💪🏾",Taylor Parris,2020-01-18T20:06:27Z,0
"I remember when &quot;just breathe&quot; sounded like an impossible, silly saying with no meaning. It has meaning for me now!! Dealing with constant, frequent anxiety and worry it has helped me develop a sense of center and self. I am able to find little ways to bring awareness throughout my day.",Krista Beyler,2020-01-18T20:03:11Z,49
Boot scooting boogie!!,pendulousphallus,2020-01-18T20:00:52Z,0
"“We celebrate the weird” made me feel at home. This is why I love and adore your energy, and it makes me feel incredible whenever I tend to not feel my best. Feeling loved and at home. ❤️",LEVI,2020-01-18T19:59:07Z,10
What?  There is no way that that was 30 minutes!,Brittany Ogden,2020-01-18T19:56:52Z,0
"I live in Newfoundland, Canada and yesterday we were bombarded with the snow storm of the century. Over 75cm of snow fell or roughly 2 and a half feet. After hours outside today shoveling I was happy for all the shoulder and back stretches in this video. I know Adriene lives in Texas but I wonder if she has any Yoga for Shoveling Snow videos lol. Thanks again for a wonderful session. 🙏",Nancy Conway,2020-01-18T19:50:49Z,2
"I follow a lot of influencers on Insta who broadcasted that snow! lol, my heart goes out to you guys. I hope you find a chance to go sledding!",Annie Engel,2020-01-18T20:31:17Z,0
Its snowing beautifully in Philly as I did today&#39;s practice. Perfect weekend yoga. ❤️,Elizabeth E,2020-01-18T19:45:58Z,0
I feel like Im actually taller after this practice. Thank you for inspiring me to get on the mat everyday.  Lots of Love to all y&#39;all.,Daniela Ramallo,2020-01-18T19:45:42Z,0
"HOME ROCKS! Really! Each day&#39;s practice seems to be better than previous, while actually all of them are brilliant! You play with energy soooo nicely here, I felt like a Queen of energy, these wonderful winds (this is how I call the feeling) blow everywhere around me, through my palms...awesome. Love you, A! &lt;3",Jelena Kalinic,2020-01-18T19:45:41Z,0
"Thank you so much, I really feel like I&#39;ve changed a lot in this journey so far, I&#39;ve been learning a lot. Thanks!",Yael Mor,2020-01-18T19:44:14Z,0
I really something whisper whilst doing the first bit. It felt like something releasing and I managed to just relax! Felt so good. You are an absolute star Adriene 🌟 Thank you! ❤🙏,Vikki,2020-01-18T19:44:13Z,0
So many connections. Thank you.,Christopher Chun,2020-01-18T19:43:53Z,0
Just completed this practice 💓Its 7.30pm in the uk have finished work and this practice was just what i needed thankyouX,Donna Clark,2020-01-18T19:42:52Z,0
Helping create TOOLS! What a gift to humanity! Go Adriene 🤛🏻👍🏼☀️,Princy Providence,2020-01-18T19:41:54Z,0
Hello to the 2500 other people I did yoga with this afternoon. :),naomi sea wildflower,2020-01-18T19:29:33Z,0
Ahhh another yummy practice! I feel so great doing these every day :D Thank you Adriene for making me feel like I can make yoga a part of my every day routine!,Emily,2020-01-18T19:28:58Z,0
"Ya know, today was not a great practice for me. I&#39;ve been sick all week and can&#39;t breathe very well so a practice completely focused on breath was really frustrating. But I persevered, I adjusted to what I needed to do, and I know tomorrow will be a new day.",readingshell,2020-01-18T19:27:50Z,0
I’ve notice that really slow flow yoga like this with repetitive movements really makes it hard to train the monkey mind for some reason. I definitely have a harder time with it than more of the faster pace stuff. It’s harder for me to not over think and I get frustrated/ bored. I’m not sure what that says about me. Lol,Shawnee,2020-01-18T19:26:39Z,280
"@Gloria Slechta I came to the comments too after 20ish min because I was started to get really frustrated with her constant talking, I thought maybe I’m just irritable today or something. First time I’ve ever struggled with her videos but oh well, she’s def learned over the years since in her recent uploads she doesn’t talk nearly as much and lets you listen to your own breath",Megan P,2021-03-18T17:11:49Z,1
lol I was thinking the same thing that&#39;s why i&#39;m reading the comments here instead of doing whatever she&#39;s instructing me to do at the moment. i don&#39;t think i&#39;ve ever done this before and stopped during one of her yoga vids! glad i&#39;m not the only one struggling with this one.,Gloria Slechta,2021-03-17T22:58:29Z,1
@Yasas Wickramasinghe I really hope it didn&#39;t.,deirdre schwallie,2020-12-16T15:29:54Z,0
This one may have put me off the 30 days.,Yasas Wickramasinghe,2020-09-19T07:54:59Z,0
Same here! First time ever I felt frustrated in a yoga with Adriene practice. This video,Tatiana Murphy,2020-09-18T04:28:22Z,2
Day 17 of Home 🌱 Day 79 of daily practice 🤍 thank you,Elina Singer,2020-01-18T19:25:18Z,0
"A few days ago I had a moment during one of Adriene’s videos where in savasana I went into a blissful trance, I couldn’t even pause the video to have that moment quietly, my body was just guiding me through a dreamy happy blissful trance, and it was very special. Today, at the end of this video when we brought our palms together to put our thumbs in our third eye, I just...I don’t know how to explain it without it sounding weird our obvious haha but the thing is like, I felt, but REALLY felt my palms (?) when they touched the first thought that came to my mind was &quot;wow, these are my palms!&quot; So...yeah I’m just so amazed by the magic of yoga and how it deepens my connection to my body with my mind and spirit ☺️💞 thank you Adriene and thank you yoga for existing &lt;3",Val cami,2020-01-18T19:24:20Z,20
Amazing practice like always🧘🏻‍♀️👌🏼<br />Every  practice it’s my favorite hard to choose ❤️❤️❤️,Eleana Cabrera,2020-01-18T19:20:11Z,0
"Great practice on Saturday afternoon, now looking for something else to match my mood, obviously another adriene video.  Thanks Adriene and Benjie.",Alison Gray,2020-01-18T19:15:23Z,0
Adrienne! Four years ago I was traveling across the country to protest in the women’s march in DC. An acquaintance that I was traveling with mentioned your challenge and we practiced together after the march. Four years and four 30 day yoga challenges later I’m carrying the strength that I have cultivated through your practice in the protest today. What a journey!,Margot Frazier,2020-01-18T19:03:34Z,22
"I&#39;ve posted each day and shared so much. This has been such a terrific week inspite of saying goodbye to my uncle. One of the most beautiful souls to have walked the earth. I didn&#39;t lose myself in grief. I didn&#39;t rely on poor food and or alcohol to dull the loss. I met you, the Kula, myself and my grief on the mat. In turn I was given the gift of celebrating my wonderful memories that a 78 year old man gave me over the past 27 years since marrying my husband his nephew. Thank you for the tools for life&#39;s real journey. Namaste`",kristi shore,2020-01-18T18:57:28Z,9
@raelyn earnest thank you 💜,kristi shore,2020-01-19T15:10:06Z,0
kristi shore deep condolences for the passing of your dear uncle. I like how you chose to remember the joy of his life and celebrate that. We learn to live without them and that takes time.,raelyn earnest,2020-01-19T15:07:35Z,2
"THAT was the toughest practice yet. I&#39;m good at synchronizing breath while moving my whole body or being in a difficult pose or just being still, but for some reason doing it with those simple hand/arm movements was extremely challenging (mentally, I just wanted to move). Did not expect that!! Thank you Adriene for the challenge in a most unexpected way! &lt;3",Kallie Barnes,2020-01-18T18:56:10Z,0
Thank you :) How many pairs of strech pants do you own? have a nice day.,Johan Persson,2020-01-18T18:53:43Z,0
Loving the poems and quotes that come along with the daily emails! Rilke is my favorite!!!,Madelynne Heiss,2020-01-18T18:51:15Z,0
<b>Home - Day 17 :</b> Evening<br />Having a terrible headache today. I think it&#39;s emotional because of all the stress I had to deal with today. It hit home when you talked about anger and disappointment. <br />I still have so much to learn about me. <br />I&#39;m thankful for this challenge and this community.<br />Sending back lots of love. <br />Namaste ☮️❤️🍦🥰,Louna Kiorie,2020-01-18T18:47:42Z,4
"Doing yoga today was a huge challenge, being midst of an axiety attack. The slow movements with the slow breathing was especially difficult cause I felt as I couldn&#39;t breathe. Went into child&#39;s pose and rested there for a good portion of the practice which was just what I needed.",Hanna Jonsson,2020-01-18T18:47:31Z,0
"I love how yoga had become a great part of my life and everyday routine. It changed me so much and opened my eyes to new possibilities. Not to mention ways of self-discovery. Lots of love. Namaste, Adriene ❤",Justyna Nalepa,2020-01-18T18:43:48Z,2
It was so adorable when you asked us to open our eyes and then said &#39;oh hello! &quot; lol!,Jennifer Gillingham,2020-01-18T18:41:50Z,6
"my legs were indeed beginning to hurt after all those warriors, but that Brooks and Dunn reference made me forget all about it! 🎶😂",Esi Ay,2020-01-18T18:40:54Z,5
thank you!,Mello Smith,2020-01-18T18:33:35Z,0
"The human kind is unworthy of your woderful and loving presence, my dear caring woman.",Nikolina Maglić,2020-01-18T18:30:01Z,0
"I don&#39;t know yet if its showing off the mat but def its showing in the mat. thank you you always make me smile, namaste!",kiuka,2020-01-18T18:29:14Z,0
"Thanks, Adrien!! I love this class. I really needed!! Namaste 🙏🏻🙏🏻🙏🏻",Esther Coperías Jiménez,2020-01-18T18:29:12Z,0
Done. Thanks &lt;3,sagi852g7 xxx,2020-01-18T18:24:29Z,0
What happened to the small plant that was in the window?  We loved that cutie!,Amy Schar,2020-01-18T18:21:28Z,0
Exactly what I needed today. You speak to my soul Adriene! 😂,Cher Chavez,2020-01-18T18:20:10Z,0
Adriene we wore the same shirt today! 😊,Cori Lewis,2020-01-18T18:19:41Z,0
After Zumba class last night yoga day 16 a good night sleep and this a good day 17 the rest of day is more work out Saturday all day .The breathing what I needed this afternoon . Have a bless day to all.❤️😇,Fire Works,2020-01-18T18:15:07Z,0
That was a GREAT practice! Thank you! 🌻,Miranda Rose,2020-01-18T18:13:18Z,0
"I was so, so frustrated during today&#39;s practice. I couldn&#39;t find stillness. Again. <br />I had to wipe some tears away. And from the mat as well. But I didn&#39;t expect it to be easy. It wasn&#39;t my day even if I tried to make it better. But thanks to this practice some tension left my body so I&#39;m hoping everything will get better. <br />Thank you Adriene, every day on the mat brings something new.",Osoroshii,2020-01-18T18:11:13Z,8
"I struggled with the same thing, as well as synchronizing my breaths with the movement. I kept inhaling when we were supposed to exhale and visa versa way easier said than done but I can only hope to get better.",Zorianne Grace,2020-02-09T06:25:55Z,0
Cracking us up extra today. Thank you Adriene 😊,Lem Monster Gaming,2020-01-18T18:10:22Z,1
"I had trouble breathing in when extending my arms over my head, palms together. I found myself holding my breath instead of expanding and breathing in. Anyone else feel that today? Something to work on!",Hillside Homestead,2020-01-18T18:07:39Z,33
I found my breath to be very shallow during that move too!,natalyn,2020-04-17T22:33:41Z,1
"For me it&#39;s not that I can&#39;t breathe, but i&#39;m not able to fully extend my arms without my shoulders aching or squeezing, so I have to draw my head back a little 😂😥",a b r i l u z,2020-02-27T13:38:30Z,0
"Me too, was really having trouble getting enough air in",jackbun136,2020-02-25T19:13:43Z,1
Yes. And with hands locked behind my back I can&#39;t breathe at all!  oops!,Alison Wonderland,2020-02-14T21:21:08Z,1
I felt it too. I&#39;m not sure what it means. Just nice to notice... to have the awareness.,Aurora Borealis,2020-01-22T00:36:25Z,1
Hell yes!<br />I’m more mindful when walking my dog.  I’m not as agitated.  I’m making time for me.  Much gratitude Adriene.  Sending 💕 from Colorado.,jessica sandborn,2020-01-18T18:07:08Z,0
Thank you Adriene!,Linda,2020-01-18T17:57:43Z,0
Felt so good! Love you Adriene and Benji!,Jenny K,2020-01-18T17:47:41Z,0
Today was a struggle with my monkey mind and impatience but I found calm and peace in places and feel so much better for having stuck with it. Namaste everyone xx,Laura McMahon,2020-01-18T17:45:38Z,0
The perfect little decompress after spending the day entertaining my little girl 😊 this journey home is super yummy! Namaste 🎉✌️,Roanna Kowal,2020-01-18T17:43:47Z,0
Day 17! Sweet practice of breath awareness. Be with the breath,KarinaVC,2020-01-18T17:34:28Z,0
"This isn&#39;t the first time this has happened, but it&#39;s the first time I&#39;m mentioning it in a comment: I love how there are often times these little moments that make me laugh or at the very least put a smile on my face. Adriene, you have such a lovely personality and such a positive energy and I love when you&#39;re kidding around a bit. It almost makes me forget about how hard chair pose is sometimes ;) So again, another wonderful practice. Thank you ♡",Alena669,2020-01-18T17:30:33Z,0
"I have my birthday coming up here this month, and I have been having mixed feelings about it. This practice along with journalling, art &amp; positive affirmations has helped ground me and made me appreciate my life &amp; body. Now I am happy I am here another year. That&#39;s a huge shift for me. So thankful.",Janelle,2020-01-18T17:27:49Z,0
This class worked its magic on me. I was very emotional when I started and by the end of it I was feeling calm and almost happy you could say. I felt the energy flowing through my arms. Thanks Adriene for this medicine for the soul that you have conjured. See you all tomorrow! Day 17 in!!!,Gabriela F,2020-01-18T17:23:19Z,0
ps we need a t shirt with Benji on it 🐶💖☺️,Helen Ryan,2020-01-18T17:17:07Z,0
"Yoga With Adriene Thank you, unfortunately no delivery to Ireland yet!",Helen Ryan,2020-01-19T16:24:13Z,0
"Hi Helen! You can find Benji shirts at <a href=""http://shop.fwfg.com/"">shop.fwfg.com</a> xx",Yoga With Adriene,2020-01-19T15:25:06Z,1
"The slower practices are harder in so many ways. But, I do love them. Definitely bringing more peace and calm throughout my day. 🙏",Dana Dz,2020-01-18T17:16:51Z,0
Perfect! 🙏🏻,Helen Ryan,2020-01-18T17:15:04Z,0
Think this was my favourite so far :) xx,Melina Giagiozis,2020-01-18T17:14:17Z,0
Your practices are just as much a part of my morning routine as that first cup of coffee! Thanks so much for sharing your gift with the world! &lt;3,Brandon Stoner,2020-01-18T17:09:12Z,0
Thank-you ☺️,stephanie,2020-01-18T17:08:35Z,0
Anyone else have a difficult time keeping up with the beginning sequence?  I can’t inhale slowly enough or can’t take in enough breath to go so slowly.  Having to “free style” during this and similar experiences.,Theresa GoGold,2020-01-18T17:02:10Z,0
"Thank you for this practice, and this quote!! “Letters to a Young Poet” lives on my nightstand, and I quote that particular verse daily. Truly felt like coming home today 💗",Kerri Baker,2020-01-18T16:57:11Z,0
Day 17 -- DONE !,Deb butante,2020-01-18T16:54:42Z,0
"Today has been a bit of a fighting against myself day. I really enjoy how the video keeps me anchored and allows my perspective to shift back to the present.<br /><br />I needed this today. <br /><br />Thank you, Adriene!<br />🧘🏾‍♀️🖤",Bre Anderson,2020-01-18T16:48:25Z,0
"Hello Adriene, I&#39;m finally synchronized with your videos!🤗 You make me laugh (and you&#39;re an awesome teacher too), so happy to be a part of this community!",Chantale Quesnel,2020-01-18T16:48:20Z,0
"HERE’S TO <a href=""http://www.youtube.com/results?search_query=%23CELEBRATINGTHEWEIRD"">#CELEBRATINGTHEWEIRD</a>!!! ADRIENE YOU MADE ME JOYOUSLY LOL TODAY😂😂🤪👏🏽💗✌🏽...",Tina N,2020-01-18T16:44:31Z,2
"This one tested my upper body today, but by the end was feeling wonderful. Thank you! :)",enjoythedaymom,2020-01-18T16:43:23Z,0
"So happy, so contented to know and feel the song of my soul thru the synchronize of my breath and body. I know I am with me and all...Thank u.",Anthony Retodo,2020-01-18T16:38:53Z,0
"&quot;Heel toe, heel toe, come on baby let&#39;s go&quot; - I&#39;m still smiling!",carolom7,2020-01-18T16:35:53Z,22
carolom7 💛,Makaila B.,2020-01-18T18:35:33Z,0
"Today I am tired with a headache but it was still refreshing to be as present as possible and get this done. I feel better and accomplished that I got it done. That, along with a load of laundry. Not every day am I super eager, but that&#39;s alright. Showing up to the mat was all that&#39;s needed.",Terence,2020-01-18T16:35:30Z,0
"Love the word synchronize. Synchronizing the breath with the movement, synchronizing life on the mat with life off the mat. I&#39;ve noticed that since beginning this practice, I focus on the breath more often off the mat,  especially if I get frustrated or nervous or scared.  The breath is always there for me.",Cara Laviola,2020-01-18T16:30:23Z,0
I bought a new mat of cork material. It was the first time I ever enjoyed downward dog today. At first on the ground I was fidgeting and my mind was busy but then the breath took me to a calm and meditative state. And in the end I couldn&#39;t help but smiling. I have felt many emotions on the mat but never before this kind of selflove. It&#39;s truly a coming home journey ❤ thanks Adriene!,Nina R.,2020-01-18T16:26:07Z,0
<b>HOME - day 17/30:</b><br />❤️,Lea Jacobsen,2020-01-18T16:21:51Z,0
Thank you!,Loran Bolding,2020-01-18T16:21:13Z,0
Thank you,carie snyder,2020-01-18T16:20:29Z,0
"It&#39;s been a rough week off the mat, but still showing up for home. I had little glimpses of connection today, mind wondered all over the place throughout the practice. But that&#39;s okay. Grateful to have this practice to ground and center. Thank you so much!",liisiounapuu,2020-01-18T16:19:58Z,0
Did this yummy practice with my husband and our two cats joining in. Namaste!!,PhoenixPinion,2020-01-18T16:16:14Z,0
"wowzAAAA!!!! after that sitting breathing exercise at the beginning, when you instructed for us to open our eyes and said &quot;hello there...&quot; i literally forgot I was in my room, and ur little &quot;hello there&quot; brought me back. (lovingly of course!) I giggled to myself and said &quot;where the hell am I??&quot;",Megan Miller,2020-01-18T16:15:29Z,0
Boot Scootin Boogie 😂 Loved it!,Rachael Haas,2020-01-18T16:14:45Z,0
In afib  since Wednesday. But still doing yoga in hopes to reset and synchronize my heart&#39;s sinus rhythm.,Dan Brannan,2020-01-18T16:10:49Z,0
Love Benji 🤗,Diana Eftaiha,2020-01-18T16:09:53Z,0
"I had a difficult time dropping in today and being present. I’m still proud of showing up and showing myself love, even when it is tough to focus.",Amber Filkins,2020-01-18T16:07:40Z,5
Thank you :),Mitch Brown,2020-01-18T16:05:40Z,0
Thx Adrienne for your great classes. <br /><br />Was there an owl hooting outside?,Derwo der,2020-01-18T15:47:49Z,0
"Hello! Yes there are some moments in a day I remember breathing deep and relaxing the shoulders down, but I must confess I´m doing yoga with adriene (and a few others) for nearly 4 years now, nearly every day and it is an ongoing process, which helps me a lot with my energy. I also got rid auf my lower back pain in the process :-). Love you, Adriene!",Katharina Behrens-von Hobe,2020-01-18T15:46:40Z,2
Yeah warrior one!! Thank you so much for making these videos Adriene!! You&#39;re a life changer!,Sarah Saulnier,2020-01-18T15:46:34Z,0
"I can&#39;t put the magic of HOME into words (but you know I will try in the kula 🤣) I am Synchronizing with the simultaneous needs for aliveness/freedom and safety/security. (the dualistic mind in me prefers the former.) And Savor opened that door by welcoming whatever is present in each moment. Thank you! Fifty times! Love you, soul friend! 🤗✨🙏",Kevin French,2020-01-18T15:39:04Z,0
"Day 17!!! The farthest I&#39;ve come on a 30 day journey, so happy and proud that I&#39;ve kept this promise to myself and grateful for these videos, thank you Adriene and everyone on this journey!! Savouring this Saturday enjoying every moment and every breath🧘‍♀️ See you all tomorrow 🥰",Sarah Murphy,2020-01-18T15:38:13Z,5
