comment,id,date,num_likes
"I don’t know how I could live without you ❤️🙏🏼 I started home 4 days later as I was away .. and you have been in my life , in my home for 4 years now 😱🥳 I left so many comments 🙄 whole these years . Adriene , what more can I add ? I wish that the whole world will meet you and Benji.. 🙏🏼❤️ I wish I could latterly have a coffee ☕️time in real life with you . I loved yoga 🧘‍♀️ for so long but you are and are my favorite yoga teacher in the whole world 🌎 your humor , your approach , your everything is pure beauty and treasure on earth and my spirits connected with it so Thank you 🙏🏼 again and again I couldn’t say it enough😂",isabelle Boutiche,2020-01-23T16:21:00Z,0
So much yes. Great practice to start the day.,Sheila Amir,2020-01-23T13:51:19Z,0
"So far this has been my favorite day, synchronizing the breath doesn&#39;t come naturally to me and this practice really helped me slow down and enjoy the glorious benefits of...breathing 😂!!  Who else thinks there should be a shirt that says &quot;We celebrate the weird here&quot; or something along those lines??",Anna Streicher,2020-01-23T10:36:56Z,0
I started jumping on my mat like a weirdo right before you said that we&#39;re all weird here hahaha! I felt very accepted &lt;3,fourfelines,2020-01-23T01:56:37Z,0
Synchronized :) Thank YOu,Kendra,2020-01-23T01:08:54Z,0
"<a href=""https://www.youtube.com/watch?v=LGEMzfXfj-g&amp;t=13m31s"">13:31</a> lol, poor Benji.  Dog&#39;s are so touchy with their hands aren&#39;t they.",sms52,2020-01-22T22:43:03Z,0
"&quot;Listen to your song&quot;, wow !<br />Merci🙏",J Flobel,2020-01-22T22:23:37Z,1
"Took a short break due to illness but I&#39;m back on the mat now. I felt so restless during this practice, I&#39;ll see what tomorrow is like 😊",Gemma R,2020-01-22T20:14:39Z,0
"I really struggled today. My head was not in the right place and I couldn’t finish the session for first time in this series as a result,  but at least I tried.",LM Betteridge-Dyson,2020-01-22T19:58:29Z,0
"Day 17!!!  Feeling so great, sore but great.  This was a wonderful practice, helped me really get in touch with the breath and movement together.  Thank you for this practice and the laughter and for Benji!!!  Peace and blessing to all beings. :)",Madaline Olson,2020-01-22T14:02:09Z,0
Namaste!,priscila brine,2020-01-22T12:23:21Z,0
"DAY 17- DONE ! Today’s practice was brilliant and much much needed by my yoga deprived body. When you said “bow your mind intelligence to your body intelligence,” Adriene, i really thought about how the mind is actually dependent on the body just as much as the body is dependent on the mind. We can’t think or function well enough unless our bodies and their energies are tended to and neither can we function well unless our bodies tend to our minds ! Being still and just thinking, listening to our minds is how we heed to our minds and moving and shifting our bodies’ energy is how we tap into what feels good. Thank you for sharing your wisdom and perspective so we could get motivated to live better and stay committed. Namaste ❤️",Ranjani Pammi,2020-01-22T10:47:53Z,0
Day 17 what a wonderful practice. Thank you beautiful Adriene🌻... Namaste 🙏🏾🥰❤️,Soraia Hus,2020-01-22T09:13:20Z,0
"I had to take a couple days off, due to being sick, but now I’m back at it! I missed our yoga practice together, finally feeling whole again.❤️🙏",rereloves2,2020-01-22T04:09:31Z,0
"Right after Day 17 synchronize, I slipped into the deepest sleep for hours  in shravasan ( corpse pose) I had few missed calls, my dad to come upstairs to wake me up..strange but I felt relieved.",abhishek rao,2020-01-22T03:42:11Z,0
My shoulders were really sore going into the practice so I&#39;m thankful for all the gentle shoulder movements today 🤗,Erin W,2020-01-22T03:36:59Z,0
Thank you ❤ I needed THIS at THIS moment.,Erica Vincelli Mortgage Agent,2020-01-22T01:28:39Z,0
"I love looking in the pond, I have no idea why it’s my favourite part, but it always makes me happy seeing my imaginary koi.",smurf786able,2020-01-21T23:28:59Z,0
This is a beautiful practice. I love the sequencing. Thank you!,LivChapman80,2020-01-21T20:43:38Z,0
Thank you Adriene!,Thi Do,2020-01-21T14:11:17Z,0
"i feel so peaceful and inspired after this class! you are magical Adriene, thank you for helping me realize my own magic too ✨💙",Linda Vilela,2020-01-21T13:38:24Z,0
Day Seventeen=Day Heaventeen!  Thanks Adriene!,Crash Blakmor,2020-01-21T13:14:32Z,0
Phenomenal,David Williams,2020-01-21T11:47:48Z,0
Missed a few days..but still going strong...Day 17 done.  Looking forward to Day 18 tomorrow.,Lee-Ann Stevenson,2020-01-21T11:01:21Z,0
"<a href=""https://www.youtube.com/watch?v=LGEMzfXfj-g&amp;t=7m40s"">7:40</a> &quot;Let&#39;s giddyup&quot;  HA!    Love those little Texas touches she slips in there to make us giggle.",Arpa de Lluna,2020-01-21T10:39:03Z,0
"One of my favourites so far, namaste x",Emelia Söderlund,2020-01-21T08:31:45Z,0
Here on day 17!,Fen,2020-01-21T04:45:38Z,0
Your Home series is really Awesome!! I look forward to coming to the mat and following your guidance! Thanks!,Donna Maxwell,2020-01-21T02:26:41Z,0
"Combined today and Day 16 for an extra-long stretch and to catch-up a little bit. With the temperatures in the mid-20s tonight in NYC it was nice to get warm all the way to the core. When I started this month I had these big ideas of things I&#39;d like to do with my body but didn&#39;t really think they&#39;d ever be possible. But now I&#39;m starting to see small changes in my flexibility, back pain, and strength. I&#39;m hopeful that everything I imagine I&#39;d like to do will one day really be possible. xoxo",Jenny Kellerhals,2020-01-21T02:16:24Z,0
waiting for the 2nd downward dog ;),S D,2020-01-20T23:56:13Z,0
"I have fallen a few days behind, but sticking with it until the end. Thank you, I really liked this one. My R wrist was having some soreness so I liked the ground work and less on the wrists.",Chiquita,2020-01-20T23:33:26Z,0
Gratitude 🙏🏾,Thiago Messias,2020-01-20T23:26:06Z,0
THANK YOU! ♥,LucX,2020-01-20T23:13:45Z,0
Thank you! It is my favorite one! ❤️,Jaanika Savolainen,2020-01-20T22:59:52Z,0
"Adriene, You had me laughing out loud like I was hanging with an old friend... because that&#39;s exactly what YWA is! I love you with such sincerity, thank you for teaching me to love myself too. Your heart really is so huge. Reflecting the infinite. Thank you for sharing it &lt;3",Ashley Wright,2020-01-20T22:33:21Z,0
This practise was the hardest for me to get through out of all 17 for some reason. Kept on checking of how much time left lol,AnaB,2020-01-20T22:04:34Z,1
"oh dear Adrienne, even though Prince sang, there is joy in repetition this was too much for me - and too much breathing. I don&#39;t know, I am just not so much the breathing, more the moving type. So long, looking forward to 18 (I am a bit behind) whatever it may bring",elnura resiste,2020-01-20T21:58:28Z,0
"I’m a few days behind, but ahhhhh this was the stuff!  I had no idea where we were going with all the breathwork and heart work, but stick with it as you said. Stick with it!  I feel amazing and this little ditty is going in my yoga faves for those days when you most need to challenge your ideas of what we need... today it was exactly this, so many thanks 💛💛💛💛",Erm Nettie,2020-01-20T21:58:24Z,0
??? 🥱,Marian Hickey,2020-01-20T21:42:16Z,0
"This practice was what I really needed this evening. I almost skipped it, but it was the best thing I could have done for myself. 💓",Suzie K,2020-01-20T21:35:50Z,0
"Catching up on this one. That day 17 was great!!! I got to experiment in my practice. I was about to do the cat-cow then you said we would do some. The first synchronizations were done pretty poorly but they relaxed my tensed upper back - it made me feel better! The the synchronizations around the 20-minute mark were a complete experience for me. I did as well as focused on something different each time, which made it more fun and interesting. I also felt like I was playing with actual, invisible energy at some point. Yeah, that was weird!!! I still don&#39;t know whether I&#39;m happy about that or really freaked out...",Sarah S.,2020-01-20T20:38:59Z,0
I absolutely love adding this to my life. I am thankful.,KSchlappi,2020-01-20T19:43:01Z,0
That was beautiful! It felt so special &lt;3,Lisa Licht,2020-01-20T19:41:39Z,0
"I skipped this day, and day 18, but I’m picking it back up again today. I’m so glad I did. Even though I enjoy doing yoga, I think I’m still treating it as another thing on my “to-do” list, which makes me not want to do it. But everytime I finish it, I feel so much better.",Bahareh,2020-01-20T19:01:26Z,0
Namaste Adriene! I am lagging behind two days but catching up whenever i can!!,Sneha Titus,2020-01-20T18:49:00Z,0
Good to slow down and focus on the steps along the way. It is pushing toward spring here and it&#39;s too easy to get caught up in all the energy and forget to ground. Light and joy.,Marsha Chevalier,2020-01-20T18:04:36Z,0
thank you for this lovely one and good night!,Sandra Sunny,2020-01-20T15:55:26Z,0
"yoga, tai chi, wing chu, ballet, budo, whatever is that combination is with lots of love and respect. Thank you my love! forever grateful",Stefanos Tselepos,2020-01-20T13:53:11Z,0
"I would never objectify Adriene but she looks especially beautiful in today’s practice: the orange shirt really bring out her complexion, and the lip colour and dark eye brows: simply stunning",vicky leigh,2020-01-20T13:00:40Z,2
@Aurora Borealis She has the perfect body. I want to have her peachy 🍑,vicky leigh,2020-01-22T02:57:25Z,1
I felt the same about a few practices back! Her booty was looking good.🍑 🤷‍♀️💁‍♀️,Aurora Borealis,2020-01-22T00:35:08Z,1
Thank you Adriene :) missed a couple of days but I&#39;m back ♡,Nicole George,2020-01-20T11:32:09Z,1
Thank🎼AD,malak baguthian,2020-01-20T09:54:28Z,0
Thank you so much. I don&#39;t understand why there are dislikes...you&#39;re awesome :),Fay,2020-01-20T08:03:25Z,0
Thank you 🤗,IEVA Kambarovaite,2020-01-20T07:43:06Z,0
"HEEEELLOOOOO HEART OPENER. My chest and shoulders feel more open and aligned. My spine loved this in the most surprising way. Ready for an amazing night&#39;s rest. Going to catch up tomorrow morning. Thank you so much for these offerings. They&#39;ve been one of the sweetest portions of my day. Reminding myself a little daily love goes a long way, and I am deserving. Namaste ! See you in the morning. 🙏🙏🧘‍♀️🧘‍♀️🧘‍♀️🧘‍♀️💓💓💓💓",Spoonzspins42,2020-01-20T06:55:44Z,0
&quot;Listen to your song&quot;  really stood out for me &lt;3 I really felt something incredible during this practice. I was able to toon all the noise out and listen to my song. Thank you for sharing adriene,Krystine Hamre,2020-01-20T06:21:38Z,0
Was feeling so much stress and anxiety from work and a bit helpless this helped me relieve a lot of stress and feel powerful again.  This was just what I needed .,Sahar Daves,2020-01-20T05:47:30Z,0
"I came to the mat super late (10 pm) and two days behind.....So glad I did. What a lovely, gentle yet powerful practice. Who knew breathing with intention could be such a challenge and release😉. Just when I was feeling bad about not being consecutive in my 30days along comes the practice saying it&#39;s okay, just breath☺️. Thank you Adriene for another Wonderful lesson!❤️",Lisa C,2020-01-20T04:50:35Z,0
"I didn’t really understand the movements today... :/ EDIT: turns out I just needed to repeat this practice today, all good haha!",Elissavet Motoshige,2020-01-20T04:43:01Z,0
Day 17 check. Sometimes you need to just unroll the mat... thanks A.Mish,D Rod,2020-01-20T04:30:13Z,0
"Thanks for the singing, Adriene! You make Yoga fun! 😂😂❤",i.am.fearlessone,2020-01-20T03:10:50Z,0
"I found this one very difficult. I&#39;ve been doing yoga for decades but for some reason, this practice today was my most challenging yet. I felt irritated by the synchronicity and the repetitiveness of the seated posture. My mind wandered to anywhere but &#39;here&#39; because I didn&#39;t want to do this. I made it through to the end, I kept recalling myself back but I wanted to quit, to cry so I appreciate this practice because the harder ones help me to reset and to focus. It&#39;s easy to go through the motions and it feel capable and easy, but that&#39;s not life so this practice was a recall to life lessons. Thanks Benji (and you too Adriene!) :D",Nadia Davis,2020-01-20T02:03:45Z,0
"I am going to EMBRACE THE WEIRD and tell everyone this - I practice wearing AirPods (would recommend this, they never fall out!!) and sometimes when i have the volume up high, i can actually hear your heartbeat, Adriene! It is a comforting reminder that everyone’s hearts are beating as one while we practice ❤️❤️ i freaking love it",Alys Ffion,2020-01-20T01:42:21Z,0
I like that!,Tanya Francis,2020-01-20T01:00:54Z,0
This was hard...ready for bed...I am exhausted,Clara Papaya,2020-01-19T22:55:22Z,0
"Fell behind yesterday, bit just about to move on to day 18 now! 2 practices in a row? I might get too much of a yoga high xx",Sarah Rose,2020-01-19T22:52:19Z,0
"I find in warrior 2 I need to gently remind myself to not let my knee collapse inward, but to actively engage the muscles around the joint to keep in line with my second toe. Thank you, for a fabulous practice and for a dynamic sense of humor that keeps it fun and positive. Adriene, you are awesome! Love your show!",Crystal Rose,2020-01-19T22:04:29Z,0
Day 17   Still with  U.K  cold damp  but dear Adriene you bring light into my life many thanks  x,normajeane clough,2020-01-19T20:32:30Z,0
"I&#39;m a day behind, but this was just what I needed today! Thanks Adriene!",Liz Eaves,2020-01-19T20:15:05Z,0
"I am working on integrating my mind and body intelligence on and especially off the mat, thank you for your role in supporting and deepening my journey!",Chelsea McGuire,2020-01-19T20:10:26Z,0
Thank you for teaching to remember Warrior 1 before moving to warrior 2.,Kitrina Kearfott,2020-01-19T20:03:41Z,0
"Love this thank you Adriene! Powerful and beautiful. Just arrived to Cape Town and am so lucky to be staying in this beach cottage with lots of cork yoga matts, crystals and candles around the place, this was the perfect way for me to ground, synchronize with the new environment and set my intentions for the coming weeks here in South Africa. Love to you and all the fellow yogis out there practicing together and grounding light to Earth. Namaste :-)",victoria jensen,2020-01-19T19:24:17Z,0
"Thanks one more day, Adriene. Doing this journey is coming great.",Emilio Sevilla,2020-01-19T19:24:09Z,0
That nearly 30 minutes went so fast and I wasn’t even feeling connected to my body or breath. It was a great way to wake up and see those disconnections so I can work on that today.,Genevieve McAvoy,2020-01-19T19:20:34Z,0
The amount of relief I felt letting go of that chair variation was religious.,Laura Eigelbach,2020-01-19T19:09:54Z,0
"This year is significantly 17 for me ... Day 17 Synchronize is just what was required to help me focus while on and off the mat -- thank you Adriene and <a href=""http://www.youtube.com/results?search_query=%23YWA"">#YWA</a> : ) Good time to ask this question then: I seem to do very well on the exhaling but I never am certain that I got as much out of the inhale as I would like to ...  sometimes for example when I do a cow pose I feel that most of the breath I&#39;ve been able to take in before I reach the peak of that position Any suggestions? Can anyone relate to this? Thank you: )",SandraR MULMills,2020-01-19T19:01:25Z,0
Yes!,MVMNTFIX LLC,2020-01-19T18:58:43Z,0
"Congrats! If you&#39;ve made it this far, you&#39;re among the 10% of people to still be here on this journey. Day 1 has 1.19 million views, and day 17 has 117,000 views, as of Jan 19. Stick with it everyone, we&#39;re almost home - thank you Adriene for leading us there...",christopher smith,2020-01-19T18:37:21Z,0
Omg. This particular practice kicked my booty! I didn’t feel it till I rolled over in bed the morning after.  My middle and upper back is sooo sore!! It feels so good!,Kristi Guevara,2020-01-19T18:36:08Z,0
"I&#39;m still 1 video behind and wanted to do 2 video&#39;s today. But after this practice my body told me it&#39;s tired and i shouldn&#39;t do that today. This practice made me feel so peaceful, my mind got quit and clear. Today my mind was so busy and chaotic and I was forcing myself thru the day, I feel so much more like myself now.",Miranda,2020-01-19T18:34:17Z,0
"I have been practicing Yoga with Adriene almost every day since the year that 30 days of Yoga came out, have NEVER once commented before, but want to share something happening on Weds Jan 22 2020 at 8 PM EST: <a href=""https://www.ramdass.org/"">https://www.ramdass.org</a>. <br />It&#39;s a moment of BEING HERE NOW to honor the spirit of Ram Dass and ourselves and each other!<br />I&#39;ll be there and I betcha Adriene will be too!  <br />Not to be annoying, but I&#39;ll post the same thing on more of the recent Home videos, as I&#39;m sure many people who love Adriene would also love to be a part of this, and some people are still catching up.<br />Since this is the first, and probably last time, I&#39;ll ever feel moved to share something like this, I just have to say, as so many others have, how miraculous Adriene&#39;s influence has been me. Practicing asana with her has truly changed my life. It has led me into a meditation practice and honestly, a complete transformation of both my inner and outer worlds.<br />Adriene is truly a guiding beacon of light, and I thank her profoundly in my heart at least once during every practice for being who she is and doing what she does. <br />Namaste everyone!<br />Zoë",Zoe Kovel,2020-01-19T18:33:27Z,0
"Weird comment had me laughing out loud.  LOVED this practice! Exactly what I needed.  I fell a day behind because I lost a fur family member on Friday, but I&#39;m hoping to catch day 18 this afternoon. Namaste. Love you Adrienne!",Tracy Jones,2020-01-19T18:01:47Z,0
During this practice I found that my body would not stop trembling! It wasn’t necessarily a bad thing tho. But Is it telling me that I need more synchronization? <br /><br />Btw I love this channel so much! I have been through many fitness channels but this one has a very calm and playful approach in terms of fitness that I dig. Love you Adriene &amp; Benji!,Morgan K,2020-01-19T17:54:12Z,0
Very Qigong today 💕,Shannon Duarte,2020-01-19T17:47:56Z,0
Energy doesn’t mean rush. That’s what I needed in all aspects of my life for oh so long!!!! Thank you! Thank you very much! Also I used to hate practicing in baggy shirts as it seemed uncomfortable and annoying but when you said ‘love fort’ it really changed my mindset in literally few seconds!,Kristin St,2020-01-19T17:21:55Z,0
"today. was. HARD. I was so angry when i showed up to my mat, and i literally cried the entire practice until the last warrior two. The hopping feet together reminded me of cheer and i cracked a smile. Thanks for always having my back, Adriene...and the rest of the YWA crew. The awesome in me acknowledges and bows to the awesome in you. much love",Betty Beretta,2020-01-19T17:21:38Z,0
THANK YOU VERY MUCH.,j18grecco,2020-01-19T17:11:00Z,0
"Today was the day folks. I could not do this today. I had no the time, neither the energy at all. So it is official. Unless I&#39;m able to do 2 on Tuesday, I&#39;m a day late. The heartbreak us real.<br /><br />Ok now I am over it, life continues lmao",PolliitoAle,2020-01-19T16:55:48Z,0
"So funny, I never wear a sweatshirt when I practice, but this morning I did, and was totally enjoying my sweatshirt-downward facing dog cocoon,  and she said almost the same things the very moment! Like how does she KNOW??? 👀 lol.<br />🧘🏾‍♀️💫 Another great session. 🙏🏾✨",Books With B,2020-01-19T16:23:21Z,0
I’m practicing outside with a down jacket wool socks and gloves an a furry hat. My kitty is sitting next to me and the sun is shining. Glorious breath work today. Thank you for the 900th time Adriene.,Stella Haus Films,2020-01-19T16:11:45Z,0
"I can&#39;t believe I forgot that lil&#39; diddy! It&#39;s back in my tool box. And that is how yoga shows up off the mat. I have a mental bucket of tools I can utilize in various situations. It doesn&#39;t mean I don&#39;t forget or handle everything well, but yoga, on or off the mat, helps keep me centered and focused. Love you girl!",Natalie Wadle,2020-01-19T15:51:16Z,0
I can see this being a great practice for when I&#39;m on the verge of an anxiety attack!,Kristina Pugh,2020-01-19T15:50:06Z,0
"Had a procedure this week so I missed one day and then I worked on a class assignment, missed another day. Today I did them both. I notice how much better and stronger I feel. Once again, thank you.",raelyn earnest,2020-01-19T15:12:49Z,0
"A day late, but I’m here! Thank you for this beautiful practice!",Eva Peterson,2020-01-19T15:03:09Z,0
Awesome day 17! Breathe: I hold in when stressed or tense! Will remember to breathe then release! Blessings and much love! Thank you for sharing your love and spirit jourywith us! 🙏🤗❤️,Margarete Kromar,2020-01-19T15:01:05Z,0
I dont know what it was but today was tough.  I know we were suposed to be focusing on the breath but that&#39;s when I find my mind wandering the most lol,Kaila Vogt,2020-01-19T14:54:36Z,0
Hey Adriene :) I noticed that this little journey already changed something in me. Every time I bow down my head for the end of a practice I say thank you to myself and to you. I am so happy about this feeling of gratitude. It makes me feel so connected - it&#39;s awesome. Truly thank you.,SeSeMittens,2020-01-19T14:54:24Z,0
🙏🏻🙏🏻🙏🏻 you make some laughs today..yah you are world&#39;s best subscriber .. here we go with you and just believe all the things you do... <br />Commitment for everything..love you lots,RAJASHREE VIRKAR,2020-01-19T14:45:18Z,1
"I have never freestyled as much as today. I don&#39;t think I actually followed half of the video together. But... It was the best marrying breath to movement ever. I moved my body as felt right at that moment to the rhythm of my breath. It was fantastic and I felt so at peace. <br />I love the way you encourage to freestyle as you and your body need. Because sometimes that&#39;s just exactly what you need. On the mat, but most of all off the mat too. Thank you Adriene!",Kelly Pepels-Stewart,2020-01-19T14:20:01Z,0
"I can feel the power between my hands, it’s really amazing! Thank you so much, Adriene 💞 Have a nice day everyone!",Wanee Seesamrittipon,2020-01-19T14:02:21Z,1
Adrienne or anyone in the yoga community I struggle with the seated position. My legs start to get numb and my hips tighten up even when I&#39;m doing my best to release and sit straight in this pose. Any way to build strength in this area to making sitting crossed legged feel better?,Fadiah Coombs,2020-01-19T13:58:16Z,0
My favourite one of the series!!! Really needed to sync up hehe thanks Adriene x,Von-Luc TJ,2020-01-19T13:52:33Z,0
"Started this practice in my fluffy pyjamas, ended half naked because it was too warm hahaha",anzuanias,2020-01-19T13:20:15Z,0
"Day 17 done. Hello from snowy Bayonne, NJ  ❄️☃️ 🧘🏻‍♀️",Karolina Cuprys,2020-01-19T12:53:24Z,0
"i had a terrible day today, but this practice calmed me down, and I feel so much better now",Carina Chatlani,2020-01-19T12:45:01Z,0
So apparently everyone gives up on there resolutions / new habits on day 17 in January so AYO to everyone who is here!,Tarnie Laska-Wolfe,2020-01-19T12:33:15Z,0
Love your sense of humor and this practice 😁❤,caroline rowland,2020-01-19T12:14:51Z,0
I am so proud of my self for making it this far! Thank you Adriene! Namaste❤️,The Crystalized Life,2020-01-19T11:58:30Z,0
Even the small and simple things that we do adds up to our greatness ☺️ Thank you so much Adriene 💗 Namaste 🙏🏻✨,Rio Mae Blanco,2020-01-19T11:31:22Z,0
I laughed a lot today. Thank you for the joy and movement. Practicing from Denmark ❤,Helene Kemp,2020-01-19T11:04:38Z,0
I am starting to feel that each day brings new possibilities and new charms. Untill few days ago ad for the last 4/5 years I have been afraid of every new day. Wow! What a change. I know there will still be bad days and moments but I am confident yoga is one of my tool to cope with them. Thank you Adriene,Cristiana Pedrali,2020-01-19T10:06:12Z,0
"You guys, I came across this video today, and decided to watch it to see if it is any good, because my best friend struggles allot with tight neck and muscle knots in that area. Lo and behold, Adriene was already working on ours yesterday 🤣 I know you know what you are doing, and I know you know that most of us don&#39;t know and that we simply trust you with it, and all I want to say, Adriene, thank you for taking such good care of us all, and not even once brag about it 💜",Gazelle,2020-01-19T09:31:22Z,0
"Muscle knots video<br /><a href=""https://youtu.be/9PC9Mn0VO00"">https://youtu.be/9PC9Mn0VO00</a>",Gazelle,2020-01-19T09:31:47Z,0
"Awesome, Adriene! Thank you!",Cherryl Thomas,2020-01-19T09:24:54Z,0
So thankful for this 30 days home yoga practice. It really gives me the chance and tools to connect with myself! 🙏🏼🌸💕,Rosanna Stenström,2020-01-19T08:59:50Z,0
No dark clouds around me…I feel like a sunshine above the winter grey clouds of Austria:-) Thank You from Happy me:-),Ludmila Koronakis,2020-01-19T08:34:01Z,0
