comment,id,date,num_likes
Hello my friends! Are you beginning to notice the ways in which your yoga practice is showing up off the mat?,Yoga With Adriene,2020-01-18T12:36:23Z,642
"The way I sit, stand and control my reactions through breathwork 💛",Clare Cavalli,2021-03-13T18:57:22Z,1
"Yes, I became so much more aware of my posture and my body in general!",Diana,2021-01-23T19:33:05Z,0
"Yes!  Never comfortable shitting cross legged I have been pushing myself to follow you and spend as much time cross legged as I can, and finally I not only find it gradually getting easier but my spine is straighter as I walk about.  At least it feels as thought it is.",Anita Marie Shaw,2021-01-22T00:02:23Z,0
"Finally, at 60 years old I know what good posture means! I was just waiting for you Adriene. <br />About time!",Viviane Van Giesen,2020-12-29T14:03:01Z,0
Yes! Awake in the night and remembering to breath! Thanks,Anna Runestad,2020-11-18T20:49:15Z,0
"How did this fly by so fast? When Adriene said pat your pet, I just patted my mat! It just felt natural, haha. She&#39;s supporting me while doing yoga every day, after all! :D Such a wonderful session, I didn&#39;t even expect something so calm and slow when I saw synchronize. Day 17, wohoo! Namaste everyone, we got this!🙏❤️ To everyone reading this: You&#39;re doing great &lt;33 and it&#39;s okay to follow Benji&#39;s practice sometimes too❤️🦴",Eliška Č,2021-05-05T07:58:50Z,0
I&#39;m showing up for myself all in the name of self love and self care.,Archangel Revelations,2021-05-03T16:12:13Z,1
Another great start to the day. My daughter came along for part of the ride. She was climbing around me and did a few poses with me. My heart can&#39;t handle all this cute! Namaste,Steven Smith,2021-04-26T15:48:03Z,0
Adriene: pet your animal<br />Me: pets myself 😂<br />Also Adriene talking about large shirts whilst doing yoga.<br />My boobs free for the public eye in downward dog as my shirt flew off 🤣,Ioana Barbu,2021-04-18T18:42:49Z,0
I woke up feeling so depressed that I doubted yoga would help - but Adrienne did it again. Such an important boost in the right direction 🙏🏻,Lada Zimina,2021-04-18T05:57:44Z,0
I feel like I did a Qigong right there.,Orion Harmon,2021-04-17T18:00:39Z,0
"<a href=""https://www.youtube.com/watch?v=LGEMzfXfj-g&amp;t=1m20s"">1:20</a> Benji took a deep breath. 😄🐶",Orion Harmon,2021-04-17T17:20:31Z,0
My mind was feeling busy at the beginning of practice. After a few rounds of breath the stillness starts to descend. Just keep showing up in all my weirdness ;-) Thank you Adriene  💜,Sally Alli,2021-04-17T09:07:45Z,0
Awww... I feel good 🧡 TYA!,Clare Loveless,2021-04-16T12:40:26Z,0
"Adriene I love your quirkiness, and how it  makes me laugh. 🥰<br />Thank you Adriene, thank you Benji💜",Cheryl Forino,2021-04-15T12:32:41Z,0
I love the way Benji is always near you. While I do this video practice my cat is napping behind me on the couch. :D,Myriam Koralewski,2021-04-15T11:18:39Z,0
Need to shave armpits before i do this excercise,69 69,2021-04-09T12:23:33Z,0
Adding to my favourites playlist. Thank you Adriene &amp; Team🥰,Carise Buitendag,2021-04-02T05:11:06Z,0
I&#39;ve had to quarantine myself in my 17square meter apartment and was feeling very low and apathetic. This truly lifted my spirits! I really needed this and I am very thankful for having these videos at my disposal.,kri S,2021-03-23T17:59:19Z,1
This is definitely my favourite practice in the challenge so far! Thank you Adriene for always offering the best content &lt;3,Emely Sanchez,2021-03-23T01:00:05Z,1
"<a href=""https://www.youtube.com/watch?v=LGEMzfXfj-g&amp;t=23m46s"">23:46</a> rn on day47 I&#39;m still on time let&#39;s goo",Blue Queen,2021-03-20T10:47:54Z,0
Lets goo day77,Blue Queen,2021-04-22T22:57:53Z,0
Havent ecen watched it yet but.. Its all good,Jeremy Richard,2021-03-18T20:38:35Z,0
We need more places that celebrate the weird!,Tamzin Little,2021-03-11T11:01:25Z,0
Great practice today.. Thanks Adriene 💚🌸,Haneen Hassan,2021-03-04T14:09:53Z,0
That was such a cool way to transition into warrior 1. Loved this practice today!,Rene' Yeung,2021-03-03T16:23:46Z,2
I did it :),Nina Attridge,2021-02-22T18:54:18Z,2
Lovely 💕🌸🌸 bless u😇,Banana Bob,2021-02-20T23:06:54Z,1
I commented on your latest video as of today - I started doing yoga with you every day this year and I do hope everything is ok with you in this frozen Texas.,A. Austin,2021-02-20T03:03:32Z,0
🌺🎊🌺🙏What a sublime way to start the day! Thank you Adriene for these daily inspiring pearls! They do make a difference :) Namaste😉🙃🥰,Hong Mei,2021-02-19T09:02:24Z,0
"Wow... 4 years of what felt like frozen shoulder on my mousing arm, and day 17, almost full range of motion. I am in awe.. Thank you Andriene, life changing.",Ja Hause,2021-02-19T06:12:08Z,2
Loving the HOME series 💖🖼✨,Charli Wood,2021-02-17T10:52:23Z,2
I often find myself returning to my breath as well as I find myself trying to keep my front body lifted at all times including in a seated position....,Jacki Siddall,2021-02-17T09:07:42Z,1
Yayy day17 completed n I gotta sweat Abit felt so good especially in my shoulder blades. Damn da stiffness in my back is so tiring,Blue Queen,2021-02-17T05:32:26Z,1
"Ok, this may sound weird but this has been the hardest day so far for me. I really have trouble with controlling and syncing my breath. It makes me a bit insecure.. 😊<br />Also, my breaths are much shorter than Adriene&#39;s. Does anyone recognize this?",Noralyne,2021-02-10T19:46:22Z,2
"@Elle B Thank you for your comment, Elle. I haven&#39;t tried the Breath-journey yet, but I am planning to do this after I finish the Home-journey :) Thanks for the tip!",Noralyne,2021-02-18T19:52:26Z,1
"Today was hard for me too. Have you tried the January 2021 &quot;Breath&quot; 30-day journey? I also have a hard time syncing my breath, but the breathing practices she does in Breath have been super helpful.",Elle B,2021-02-16T13:24:40Z,0
"I&#39;m amazed at how this routine affects my upper arms, shoulders, and upper back. It doesn&#39;t look like much movement, but wow!",Miranda,2021-02-10T19:19:46Z,1
Thank you!,Vicki Johnson,2021-02-06T14:34:53Z,0
Amazing as usual,Ece Goktanir,2021-01-31T12:31:51Z,1
I used to do Tai Chi back before I had my 3 kids. I have been doing yoga for 10 years or so 3-5 times a week and the past 5 with Yoga with Adriene. I love this practice because I feel the energy like Tai Chi when the hands are coming together.  It is revitalizing! I also love a good warrior to feel strong! Thanks Adriene!,Nimisha Clawson,2021-01-29T12:19:08Z,1
"My mom asked me why I was laughing during my exercises... I said that&#39;s because, aside from being the best trainer ever, you&#39;re also a pretty good comedian. :&#39;D",Diana,2021-01-23T19:43:52Z,0
I am still having particular difficulty in keeping my feet down on the downward dog and even in keeping my knees straight in tattasana/fold pose. Is there a way to make them more flexible?,a b,2021-01-23T12:29:49Z,0
i so dont like these slow practices! maybe one day i will get there.. for now im glad its over,Emma S,2021-01-15T01:22:15Z,0
too much trash talk,champagne gxrll,2021-01-08T09:57:10Z,0
"dog lovers don&#39;t eat dogs.<br />cat lovers don&#39;t eat cats.<br />animal lovers don&#39;t eat animals.<br /><br />Go plant-based, everyone!",XRP,2021-01-04T05:22:32Z,1
"Thank You Adriene, your energy is amazing &lt;3",Kristýna Janečková,2020-12-30T23:16:51Z,0
I love you 🥺,Weaam Emara,2020-12-30T08:11:48Z,0
I really really liked this one! The hands movement made me really synchronize with myself! Thanks Adriene for that guidance!! ❤️,Iudex non calculat,2020-12-29T08:28:53Z,0
Love your words “listen to your song” best xx,Jeannie Ward,2020-12-28T23:54:19Z,0
Namaste,Mitrani Mukherjee,2020-12-25T17:53:29Z,0
"It&#39;s Christmas day in the United Kingdom. The sun is shining, in all its beautiful glory, the wind is crisp and the trees are evergreen. I had to fit in time for this healing practise today. Starting my day right. Love you Adriene, and the amazing community that unites us all. Sending love, health and energy to you, your friends and family &lt;3",Daniel Draper,2020-12-25T11:10:13Z,0
Day 17 done :) I love this journey!,Saumya Mathur,2020-12-13T04:11:12Z,0
Love this one extra! You&#39;re always reminding us to sync the breath with the movement and then you dedicate an entire day to this practice. Thank you for also reminding us to bow the mind intelligence to the body intelligence. The reason I started yoga was to practice this and I chose your channel because you teach that so well.,windjourney,2020-12-11T15:37:22Z,0
thank you Adiene! &lt;3,Cathy van daele,2020-12-07T17:56:42Z,0
Thank you for being you Adriene. So many mini accomplishments just by sticking to your programs. Thank you for being apart of my daily life. You’re a friend to all of us. 🥰,Eri's Piano Music,2020-12-07T05:53:05Z,0
"When we did the interlaced hands behind the back my fingers get tingly. Then, when we folded over, they went full numb, so I had to release them and bring them to the mat. Adrienne, and suggestions on how to create space there so that this doesn&#39;t happen? Thank you!",Holly Scott,2020-12-04T15:14:08Z,0
"Thank you Adriene! I really enjoyed this practice! You seemed to have such a good mood this day, it put me in a good mood for today as well!",kisgonoszfules,2020-11-21T08:59:13Z,0
"am I the only one who is yawning so deeply every time when taking those deep breathing exercises? ;) I can&#39;t help it! And day 17th means dozens of yawns to me. And it&#39;s not about being bored or tired... I&#39;m doing this whole 30-days series for the second time now and it&#39;s exactly the same, yawning thing again! Funny but also a bit annoying! ;)",Mar Tar,2020-11-19T13:34:42Z,3
for me I feel the yawning is a release of tension  which comes with the deep breathing,Sally Pheasant,2020-12-10T08:41:43Z,1
So glad our puppies are invited! My little Luna joins me every day.,Anna Runestad,2020-11-19T02:24:35Z,3
"I recognize the beginning of last year&#39;s 30 days:  Dedicate - in this session. Did you notice that, Emily Beauchamp?",L C,2020-11-17T16:44:20Z,0
Namaste :),judith martinez,2020-11-17T12:57:30Z,1
"I used to practice every day and after the whole pandemic started for some reason i let go of my practice. Today i started again, from where i left of and I am so glad I did. My breath, my body and my mind very much needed this.",Myrto H.,2020-11-15T14:35:37Z,0
Ahhhhh. Thanks,Katrina Neal,2020-11-14T00:14:49Z,0
I think my cat loves you.  She lays right by my laptop and listens to your voice.  This is my 2nd time through this series.  I feel so much stronger than the first time around.,Larry Patterson,2020-11-12T21:42:51Z,0
"Oh I just love it when I know I need some Adriene time but not sure just which session to do. Then I click on one I haven’t done before at it has everything I needed. Thanks for the fun &amp; guidance, every time!",Kathryn Loosemore,2020-11-11T19:32:37Z,0
Big thank you to everyone in the community who&#39;s dedicated to makes their lives better while inviting others to do the same ! I love you all,MC Media,2020-11-09T17:10:24Z,0
"Hi Adriene, our practice has been doing me so much good I&#39;ve talking to my Brazilian friends about your youtube channel. Unfortunately many do not speak English here in Brazil. Have you ever thought about having your classes translated to Brazilian Portuguese ?  I could do that for you...I bet it&#39;d be a great success around here, particularly now that everybody&#39;s at home. Thanks for your dedication and joyful guidance.",Fabiene Rocha,2020-11-08T23:28:53Z,0
I love it that around the 24 to 26 minute marker we can hear your heart beating as the base.&lt;3,Adrienne Throssell,2020-11-03T22:06:46Z,0
Anyone else experience 537 emotions in these 30 minutes? Back to the breath... Back to the breath...,C V,2020-11-03T19:02:39Z,0
"I have trouble inhaling and exhaling for as long as adrienne does! Especially on the exhale, I&#39;m like Noooooo morrrreee space! Does anyone else get this?",Mandy M,2020-10-27T08:55:45Z,1
AT the end when she said take a deep breath in then out I sneezed and then she said namaste.,Kylie Bison,2020-10-26T12:30:41Z,0
Its monday for me today and I really wasn&#39;t in the mood to to this today but I knew that doing this would make my day better so I did it!,Kylie Bison,2020-10-26T12:30:06Z,0
Thank you so much and have a blessed day God blesses me everyday,sal ralph,2020-10-22T16:09:48Z,0
Day 17 complete 🌸,Lebo Maroleng,2020-10-21T05:56:43Z,0
"200-hour residential new to ashtanga yoga teacher training course in India with Yoga Alliance USA RYT 200 Certification at Yoga School Tattvaa Yogashala, Rishikesh<br /><br />Tattvaa Yogashala offers the opportunity to journey into the depths of your yoga practice. Located in Rishikesh, the yoga capital of the world, on the banks of the holy Ganges River, our school offers a natural haven for those who seek an experience and environment in which to evolve in body, mind and spirit. We are globally known for world class Yoga Teacher Training in Rishikesh, India. Tattvaa Yogashala is a world renown yoga school specialising in the traditional Ashtanga system of yoga. For years our school has dedicated itself to sharing and spreading the knowledge of this miraculous lineage, continuing to inspire and evolve yoga practitioners around the world.<br /><br /><br /><a href=""https://tattvaayoga.com/"">https://tattvaayoga.com/</a><br /><br /><a href=""https://tattvaayoga.com/200-hour-new-to-yoga-ashtanga-yoga-teacher-training-india.html"">https://tattvaayoga.com/200-hour-new-to-yoga-ashtanga-yoga-teacher-training-india.html</a><br /><br /><a href=""https://tattvaayoga.com/100-hour-ashtanga-yoga-training-india.html"">https://tattvaayoga.com/100-hour-ashtanga-yoga-training-india.html</a><br /><br /><a href=""https://tattvaayoga.com/200-hour-primary-series-ashtanga-yoga-teacher-training-india.html"">https://tattvaayoga.com/200-hour-primary-series-ashtanga-yoga-teacher-training-india.html</a><br /><br /><a href=""https://tattvaayoga.com/300-hour-primary-series-ashtanga-yoga-teacher-training-india.html"">https://tattvaayoga.com/300-hour-primary-series-ashtanga-yoga-teacher-training-india.html</a><br /><br /><a href=""https://tattvaayoga.com/300-hour-intermediate-series-ashtanga-yoga-teacher-training-india.html"">https://tattvaayoga.com/300-hour-intermediate-series-ashtanga-yoga-teacher-training-india.html</a><br /><br /><a href=""https://tattvaayoga.com/500-hour-complete-ashtanga-yoga-teacher-training-india.html"">https://tattvaayoga.com/500-hour-complete-ashtanga-yoga-teacher-training-india.html</a><br /><br /><a href=""https://tattvaayoga.com/yoga-school-teacher-training-goa.html"">https://tattvaayoga.com/yoga-school-teacher-training-goa.html</a><br /><br /><a href=""https://tattvaayoga.com/100-hour-hatha-yoga-teacher-training-india.html"">https://tattvaayoga.com/100-hour-hatha-yoga-teacher-training-india.html</a><br /><br /><a href=""https://tattvaayoga.com/200-hour-hatha-yoga-teacher-training-india.html"">https://tattvaayoga.com/200-hour-hatha-yoga-teacher-training-india.html</a><br /><br /><a href=""https://tattvaayoga.com/overseas-yoga-teacher-training.html"">https://tattvaayoga.com/overseas-yoga-teacher-training.html</a><br /><br /><a href=""https://tattvaayoga.com/multi-style-yoga-teacher-training.html"">https://tattvaayoga.com/multi-style-yoga-teacher-training.html</a><br /><br /><a href=""https://tattvaayoga.com/yoga-retreats-rishikesh.html"">https://tattvaayoga.com/yoga-retreats-rishikesh.html</a><br /><br /><a href=""https://tattvaayoga.com/ashtanga-intensive.html"">https://tattvaayoga.com/ashtanga-intensive.html</a><br /><br /><a href=""https://tattvaayoga.com/hatha-intensive.html"">https://tattvaayoga.com/hatha-intensive.html</a><br /><br /><a href=""https://tattvaayoga.com/art-of-adjustment.html"">https://tattvaayoga.com/art-of-adjustment.html</a>",Tattvaa Yogashala,2020-10-20T08:56:24Z,0
We&#39;re still in lockdown in Melbourne (Australia) but yesterday got the news restrictions are finally easing! During my 100+ days in lockdown I&#39;ve started making yoga practice part of my lifestyle and it&#39;s something I hope to bring with me even if I CAN leave the house for reasons other than my 1 hour walk and grocery shopping!!! Thank you Adriene. Definitely finishing this 30 day program.,Carolyn Huane,2020-10-19T08:49:47Z,0
&quot;Tokyo 2020 olympic flip&quot; 😪 RIP,E Stern,2020-10-19T03:18:25Z,0
Day 17 was great!,Slimaz01234,2020-10-17T12:27:30Z,0
"I&#39;m hopping I can make it tomorrow, I&#39;m definitely Trying.... Just wanna say Love you Benji 😘😘💖🐕✨ Namaste Beautiful 🙏 Adrienne...",Regina Lynn,2020-10-17T10:03:29Z,0
"Life is stessful right now, glad I actually Made it..",Regina Lynn,2020-10-17T09:33:26Z,0
L,Regina Lynn,2020-10-17T09:32:45Z,0
Got into a small argument with my boyfriend this morning and I just sighed mid-discussion &amp; told him I hadn’t done yoga yet. Now I’m done with today’s practice &amp; he has already apologized 🤷‍♀️,Chantal Ruvalcaba,2020-10-15T18:23:52Z,0
Good stuff.,Sydnie Lee Houghton,2020-10-15T16:28:32Z,0
"Amazing practice this is my favorite so far, pranayama essential thank you",Agnieszka Synak,2020-10-13T11:03:06Z,0
"Whenever I do yoga the only thought I have is thank you Adriene. You have helped me a lot, in today session also.<br />After spending time with you on yoga mat I feel like now, I can do anything.",POOJA RANI,2020-10-01T15:34:23Z,0
"Delicious, georgous, energized!<br />Wow, what a beautiful practice. 💛",kindly,2020-10-01T08:22:30Z,0
Thank you for getting Alan Jackson or whatever into my brain for likely the next day.. Us Texans have it rough,Justus Eubank,2020-09-23T18:42:02Z,0
"Awesome yoga practices,totally addicted thank you adriene",Christina Murray,2020-09-21T07:28:12Z,0
Pure magic! I saved this in my favorites after completing Home earlier this year. It felt like magic to me then and still does! Something about these specific movements gets the stuck energy out of my body. It’s fantastic! Anyone else? Thank you Adriene!,Alphabet Teacher,2020-09-20T14:13:25Z,0
Hey everyone! I&#39;ve been loving this 30 day journey so far. But I&#39;ve been wondering...what would you recommend I do once I complete this 30 days? Is there a specific playlist I should go to next with my new yoga skills I&#39;ve learned in these 30 days?,Laura K,2020-09-19T16:34:02Z,0
Walk + Yoga with Adriene + back rolling = perfect morning :),Tatiana Murphy,2020-09-18T04:31:53Z,0
My legs are noodles after this day!,Therese Jaggy,2020-09-17T06:36:59Z,0
I’ll have whatever Benji’s on,A,2020-09-16T15:10:00Z,0
"Made it to Day 17! Tough, but i&#39;m getting back in the game.",CoDLover7771,2020-09-14T17:06:39Z,0
Thank you,Chasity DeKay,2020-09-14T13:11:46Z,0
"thank you Adriene for being my guide! Today, I started to come to terms with my guilt, fears, and greed. Letting go will be a long process, but I’m happy to have such an amazing yoga teacher to help!",Andrew Holland,2020-09-12T13:19:17Z,0
Love love LOVE this one,Shelby Smith,2020-09-11T15:45:50Z,0
For me. This was one of the most boring days of all your 30 day challenges.,Fridolf Pierrot,2020-09-11T11:49:36Z,0
Love this journey......wish my hips did :( can’t sit very long cross legged without pain.  Any suggestions? :),Jackie Kitchen,2020-09-09T19:43:36Z,0
رwhen you want to give me free class alone?,Amin Abdelhalim,2020-09-08T15:01:02Z,0
"Day 17 done, this was a mental challenge for me!",Forever Temporary,2020-09-05T21:45:36Z,0
"This collection isn’t that physically challenging for me personally, but I love coming here every morning and greet with Adriene. A great way to wake up before a long day of work. Thanks for your contribution to my daily positivity and refreshment",Weiduo Chen,2020-09-04T17:39:27Z,0
Didn’t really enjoy the first part but the second part was easily my favorite yoga experience on this journey so far!!!,Hunter Hernandez,2020-09-03T22:12:43Z,0
I think my back loves you,tatua_gui,2020-09-01T05:17:34Z,0
Day 17 done!,Justine Narro,2020-09-01T03:18:17Z,0
Day 17 done! 🌸,Gulnara Yekayeva,2020-08-31T03:57:57Z,0
I am on Day 17th and very proud of my self. I liked todays Synchronizing session. Felt really good on my back muscles and shoulders :),Deepthi Nukala,2020-08-30T19:33:59Z,0
This was so lovely. The breathwork incorporated with simple movements really help me to get into that deep breath. Wonderful!,FlyDorsch,2020-08-27T08:53:12Z,1
"Thanks, Adriene. Today started off icky, but all the deep breathing and grounding really turned it around. :) &lt;3",Sahsha Baby,2020-08-25T13:56:22Z,1
MAGA Dudes for YWA!,Jeremy Young,2020-08-24T18:14:16Z,0
"I loved how that breath work with the movements, i&#39;m typically not very coordinated but I really got the hang of that. After 17 straight days, can I call myself a Yogi?🤷🏾 lol idk but i&#39;m enjoying this!💛",Raquel B,2020-08-22T05:09:58Z,1
"I&#39;ve been loving Adrienne&#39;s yoga for such a long time now... and this is the first time I&#39;ve read through some comments! WOW what a happy, safe, peaceful place and community 🥰🥰🥰 I love hearing of everyone&#39;s experiences - feeling surrounded by such positivity! What a wonderful thing ❤❤❤",The Suitcase Couple,2020-08-21T06:58:50Z,3
this not day-17,7313miel the gamer56 animation,2020-08-20T13:58:58Z,0
"I just felt so confident and strong at the end of this practise, during this session I just followed my breath and let my mind calm down and OMG the sensation that came from this was... flawless! Day 17 done!! See you tomorrow friends and remember that we are all in this together, namaste!!",Brenda Paola Baltazar García,2020-08-17T14:31:20Z,1
"That Tokyo 2020 Olympics comment really hit me today...I didn&#39;t get to participate in the Home series at the start of the year, and doing it now...so much has changed in the world...but I just wanted to say thank you for continuing to share your gifts &amp; time with us Adriene. It is truly so so appreciated. I chuckled when you said &quot;Celebrating the weird!&quot; as I&#39;ve been a YWA subscriber since...2015 I think...I love your channel so much. Thank you, thank you, thank you! Please give Benji at pat from me. My dog, Bessie, has a long standing crush I think hehehe don&#39;t we all adore Benji though!  :P",Rachel Hinkley,2020-08-17T09:10:21Z,2
"This one did not work for me, unfortunately. It was not pleasant because my body was craving something else today. But hey, I guess that is the whole point: to listen to what your body actually needs. I need a lot of down dogs and forward fold today so gotta head doing those.  Thank you anyways, Adriene!",Rekan Gafur,2020-08-13T11:20:47Z,1
"😊 For all people who read this, I wish you the most beautiful day 🌱 <br />🙏  Cheers Adrienne (from France)  🙏",JE SUIS BIEN !,2020-08-13T09:09:05Z,4
"To me, this practice epitomised what yoga truly is (in my opinion): the connection between the body and breath through mindful movement. Thank you for helping me fall in love with yoga again with this series 💛",Han,2020-08-07T14:23:00Z,0
"On Day 17 it is Day 134 of lock-down in South Africa and <a href=""http://www.youtube.com/results?search_query=%23ywa"">#ywa</a> Home has become one of my survival tools. Thank you, Adriene, for providing this haven of calm focus. May good things come your way today!",Elna Van Der Merwe,2020-08-07T05:24:59Z,0
"Wow, I never knew I could feel so incredibly grounded through syncing up my movements, big or small, with my breath. It feels so good!",Ella Majella Majella,2020-08-05T12:29:41Z,0
"This video is a whole mood. Every time I opened this playlist I hoped this video was next because something about you in those colors is truly inspiring. Adriene, I absolutely loved this one, and I&#39;ll definitely be revisiting this when I need to re-sync. Thank you for creating this content and being our collective spiritual guide. You are truly gifted. I rarely get through 30 days of anything, and although I have spread the first half of this series out over these past weird months I&#39;m finding myself much more motivated to show up every day through the second half. Thank you.",Brittany Basden,2020-08-04T21:29:55Z,0
"I am slowly working my way through this challenge, very slowly but still I will make it and loved this one, feels soo good today! Thank you and blessings to you Adriene!",Katrina Calice,2020-08-03T16:16:31Z,0
"Adriene you have no idea what a positive impact you’ve been on my partner and I. You’ve brought us closer, made us feel healthier and given us something to look forward to every day.  I can’t imagine covid without you and on the other hand, if it weren’t for the lockdown I don’t know if I’d have discovered you in our busy lives. Thank you thank you thank you ( I have done yoga in the past with 3-5 teachers  but your relationship with the class, even via camera, is out of this world.)",TheNinaviv,2020-07-30T21:52:33Z,0
"And lol, since I’m already talking so much- I think this is the first time I’ve ever commented on a YouTube video😹",TheNinaviv,2020-07-30T21:56:09Z,0
I cannot speak highly enough of you. You are literally my idol. The biggest positive energy that always leaves me feeling happier and taking things easier.! Thank you for sharing your incredible gift with the world and bringing so much joy to us!,TheNinaviv,2020-07-30T21:55:11Z,0
I can&#39;t believe how fast that 29 minutes went,Vahe Megerdoonian,2020-07-30T15:31:07Z,1
Hope to see more most like this 👍,Ishvara Dhrishti Yoga meditation holistic living,2020-07-28T05:55:28Z,0
