comment,id,date,num_likes
I have been working out like crazy the last month or so. Very surprisingly I forgot about yoga. I have been using this months yoga for a cool down after my workout. It’s amazing mentally and physically. I feel like my body will recover and show results sooner every time I do a ywa video for cool down! Thank you so much Adriene for this amazing videos as always I love you! (Sorry if this comment did make any since I just finished a crazy workout so my brain is all over the place 😅),Annika Ewing,2021-01-13T21:31:45Z,0
Happy to be back!  Your a wonderful teacher.,eastmansfitness1997,2021-01-13T21:28:09Z,0
New place; a tiny house on a farm in northern germany. I practice with a warm fire and shaky wifi. Thank you for making me stronger and ready to face uncertainties!,Lili A,2021-01-13T21:26:17Z,1
"These everyday yoga practices help me so much. I personally enjoy doing yoga before sleep because it helps me to relax and get settled. Thank you Adriene, namaste &lt;3",Linda Leith,2021-01-13T21:26:16Z,0
"Exactly what was needed after a long stressful shift! I cannot say it enough, thank you Adriene. To everyone who has made it to the mat today, you are the ones that encourage me daily to stick to this. ❤️ It&#39;s 2121 in Scotland. So goodnight, take care and see you tomorrow xx",Collette,2021-01-13T21:22:00Z,0
"This is probably a silly thing to be excited about, but today I was able to go from lifting my leg in down dog and bring it through to a lunge without falling! Small victories...☺️ Sending all the positive energy out to this great community today!",K H,2021-01-13T21:21:36Z,0
"Awesome practice Adriene, just what I needed today ¡Gracias!",DridocdAdri,2021-01-13T21:21:10Z,0
I had a little set back with some inner ear problems and had to miss a few days.  I will try to get back on track.  I need to get back at it!!!,Jeannie Vine,2021-01-13T21:19:57Z,0
Feeling the truth... its our greatest gift if we are available to it... Thanks Adriene... Day 12 was just right!,Emma Manser,2021-01-13T21:16:46Z,0
Made it to the mat today but not feeling as strong. Yesterday’s practice wiped me out so today I had to modify. Glad I showed up today and glad you all did too 🙏🏽❤️,Anissa A,2021-01-13T21:16:12Z,1
Sending love to everyone!💫❤,Lisa Fireheart,2021-01-13T21:15:35Z,0
Ya&#39; Allah - so fine. I&#39;m a swimmer - have been swimming competitively since I was 7 &amp; when a chap was teaching me tummy breathing for stress management it did not come intuitively. I examined how the diaphragm works in breathing &amp; I had to imagine that it going down and pushing my tummy out and the air was sucked down to my belly &amp; I put my hands there to feel them pushed out. This is great. As a BudaPest to an Austonian - keep breathing weird.,Roger Clem,2021-01-13T21:12:35Z,0
Like the Beastie Boys/Pharcyde Drop shout out,Keisha Green,2021-01-13T21:10:46Z,0
thanks for another wonderful session!  My posture has improved significantly since starting this journey!  ☆ many thanks☆,Paloma Thompson,2021-01-13T21:10:46Z,0
Thank you Andriene!,Kathleen Koos,2021-01-13T21:09:43Z,0
Soooo Goooood!,madalena faria,2021-01-13T21:08:37Z,0
Really enjoyed this practice today. Short &amp; sweet ❤️ thank you x,MurielWalsh,2021-01-13T21:08:30Z,0
"That was just what I needed today! Love those twists and loved the ending, “May you always see the truth, speak the truth, and feel the truth.”",Tim francis,2021-01-13T21:01:23Z,0
"Thank you. I am so pleased to be on day 12.  Today, I woke up congested and full of cold so breathing through the nose was... interesting, but I have made it!",Olka Olka,2021-01-13T21:00:32Z,0
Day 12! Thank you!,Lisa B,2021-01-13T20:59:13Z,0
"THANK YOU, ADRIENE!",mona lies,2021-01-13T20:58:37Z,0
A huge thank you for this from a rainy lockdown England. I&#39;ve been practicing before bed and it has cleared my mind and helped my sleep. A moment of peace each day :)  Also.. this kit is dreamy! I love the colour of both the jumper and leggings <b>searches Adidas</b>,Sophive,2021-01-13T20:56:26Z,1
Thank you so much❤🙏<br /> I just love this 20 mins everyday  yoga journey <br />I love yogic sqaud today haven&#39;t done it  for ages <br />I am so curious for tomorrow that what we will be doing on the mat,Bina,2021-01-13T20:55:42Z,0
Day 12 ✅ much needed. Starting new lockdown on friday here in Portugal. At least during practice I really can forget the caos outside🌺,Catarina Henriques,2021-01-13T20:54:02Z,0
Thank you Adriene for this wonderful practice today &lt;3,mand0diao,2021-01-13T20:52:49Z,0
"Day 12: 4:28am to 4:46am Philippine Time. From 176,296 to 183,195 views. 6k people doing yoga with me. Namaste! 🙏❤️",Reyn M,2021-01-13T20:49:49Z,0
I&#39;m feeling so grateful to be here with all the people around the world. It felt really special today ✨,Lea xx,2021-01-13T20:46:20Z,0
"I did both today&#39;s and yesterday&#39;s practice this evening to try and catch up, as I was in hospital yesterday. Found it really hard to let go of the negative self-talk today, but I&#39;m reminding myself that it is a journey. Really working to find a way to make healthy lifestyle changes whilst not engaging in too much self-criticism. Thank you, Adriene, for your commitment and kindness which helps me to model my own self-talk. Namaste ❤️",Nicky Watkins,2021-01-13T20:46:07Z,0
"Showed up for day 12! Reminder to myself: do not have dinner 1,5 hour before yoga. <br />That squat - I have to do it many times more to figure out the balance there, wow<br />Great job, everyone!",Vasiliki,2021-01-13T20:43:32Z,0
Short but sweet! I love your messages of love and guidance!! Thank you so much for your gifts!!,Jane Pierson,2021-01-13T20:41:39Z,0
"Getting on the mat was a real challange today. Did it, breathed, and feeling grateful that I stole this little time to tend to myself. Thank you Adriene  , without forgetting the cutest being , Benji.  I hope everyone had a good day. With love and respect, from my heart to yours.",Nana,2021-01-13T20:36:44Z,0
"Hello friends, grateful for a drop in session today. I am so tired, the heat is relentless this time of year. <br />I try not to have expectations of the practice but I have my moments. Sometimes, the entire practice is a moment and sometimes like today, the last breath at Namaste was just the moment I needed to remind me of why it was important to show up again today.<br /><br />Thank you, Ade. 🤟🏾",Landisiwe,2021-01-13T20:34:54Z,0
Drop your expectations ♥️ Such a relaxing practice it was 🧘🏼‍♂️ Thank you Adriene,Oznur Oznur,2021-01-13T20:32:39Z,0
Felt good 😊 Thanks Adriene x,FloFloFlo,2021-01-13T20:32:34Z,1
Thank you Adriene! :),Belisa Miller,2021-01-13T20:32:15Z,0
Nice to drop by thank you 🙏,Jim Laslett,2021-01-13T20:32:06Z,0
"I LOVE YOUUUUUUU! I always end in a smile, u r the Best!,!",Debi Bird,2021-01-13T20:31:43Z,0
Thank Adriene for this. I have been anxious about my university applications and this practice has given my mind a rest &lt;3,Fiona Farrell,2021-01-13T20:31:04Z,0
"Omg this is so accurate today. 🙏🏼 need to drop all. Especially, dealing with emotional vampire and narcissistic family member today. Thank you! You’re an angel ❤️🌻",AngieBlog,2021-01-13T20:29:22Z,0
Thanks Adriene :),Tammy Hollingworth,2021-01-13T20:29:14Z,0
"So important to rememeber selfcare, selflove, thank you for this time",fanny bernadet,2021-01-13T20:28:51Z,0
"I love this! Thank you so much Adriene, after two years of battling depression and hating myself, my favourite part of my day is coming to the mat and being welcomed by so much love. Love from myself, this amazing community, and your sweet words (oh, and Benji, of course!) This is my self care and self love, and thank you so much for helping me. I wish everyone good health and happiness, namaste &lt;3",Mary Wells,2021-01-13T20:26:59Z,0
"Yay I did it! I broke my finger today but was able, with a little modifications here and there, to do the practice anyway while it was so easy to give up today, i still chose me!",Angela S,2021-01-13T20:26:56Z,1
Well done!,Mary Wells,2021-01-13T20:27:23Z,0
This was yummy:),Barbora Stránská,2021-01-13T20:26:23Z,1
I couldn&#39;t be more thankful to Adriene for making me come to the mat every day. The way she &#39;s recognising that showing up is the real achievement makes me motivated everyday even if I finish work really late at night!:),Stella Tsoli,2021-01-13T20:26:08Z,1
The daily yoga have finally got my heels to meet the ground in downward facing dog. 🙏🏻,Jessica Forsgard,2021-01-13T20:25:57Z,1
You seem quite far away in this video. Great video as always 👍🏻 Video!....Makes me sound old.,titep,2021-01-13T20:21:07Z,1
This was a shorty. Sometimes it&#39;s impossible to breath through my stomach. That&#39;s a really crazy feeling. 🤔,Nick Marien,2021-01-13T20:20:46Z,1
Needed this today. Thank you Adriene &lt;3,Maya Davis,2021-01-13T20:19:44Z,1
"Left out 3 days due to an injury and this is what I came back for. So yummy, my body loved it. Thank you so much.",Blanka Frühwirth,2021-01-13T20:18:14Z,1
Day 12! DROPPIN&#39; WITH ADRIENE BABY! 🤘🏻,Alberto Dagrada,2021-01-13T20:17:19Z,1
"Can I just say, Adriene I LOVE all the outfits you&#39;re wearing in these videos, especially today! I say this as I&#39;m wearing the same saggy  jogging bottoms and hoodie that I&#39;ve been wearing for the past 2 days.",Isa Yanes,2021-01-13T20:16:32Z,5
Love you that was a fantastic check in 💜💜,Rebecca Vinagro,2021-01-13T20:16:18Z,1
"Hello lovely people!<br />Exactly the gentle practice we needed today!<br />Namaste 🙏<br />Stefano, Emiliano &amp; Logan 🙋🏼‍♂️🙋🏻‍♂️🐶💕<br />Love to the world from Italy 🌍❤️",Stefano Scheggi,2021-01-13T20:14:01Z,1
I laughed so hard when Benji started itching like crazy 😂,Hanna,2021-01-13T20:12:50Z,6
Namaste 🙏,Motorcycle Travels Site - lonelyT.W.A.T,2021-01-13T20:10:30Z,1
BEAUTIFUL practice today. My heart is singing!,Corina,2021-01-13T20:09:50Z,1
"My 7 year old joined me today as a little treat before bed, she will sleep well tonight! thank you X",Jo Tiller,2021-01-13T20:06:46Z,2
"This is my first day on this journey. Yes, I joined late but at least I’m gonna proceed with everyone else from now on and it makes me happy.",Sümeyye Atalay,2021-01-13T20:06:29Z,1
"It doesn&#39;t matter when you joined, just that you did. And for that, you are amazing. &lt;3",Mary Wells,2021-01-13T20:29:14Z,1
Adriene is truly amazing,STEPEE MaI,2021-01-13T20:03:55Z,1
"See the truth, speak the truth and see the truth was an emotional moment today...",Joanna Parkes,2021-01-13T20:03:15Z,1
"I feel so sorry that i missed yesterday&#39;s practise because of my stomach problems.... but here I am today!! Stronger than before! Thank you, Adriene, for another beautiful video ♥️",Uniccorn,2021-01-13T20:03:14Z,3
I hope this was a Pharcyde reference.. deeeerrropppp !! Wicked vid as always keep it up erryone,JMaxfield,2021-01-13T20:02:57Z,0
you find a way to just slow things down...thank you!,Shayna Ascher,2021-01-13T20:02:16Z,1
Beautiful. Thank you Adriene 🙏💕✨,Sarah Blossom,2021-01-13T20:00:52Z,0
"&#39;Drop&#39; felt amazing today. My hip flexors specially enjoyed the Yogi squat :) I teared up a little at the end of the practice when Adriene mentioned about seeing, speaking and feeling the truth. It really resonated with me at the moment. Thank you for this practice Adriene ❤️ Sending big hugs to all my fellow Yogis 🤗",Kavya Shekar,2021-01-13T19:58:39Z,0
I love your color of lipstick. It&#39;s a breath of fresh air.,Julia Penman,2021-01-13T19:57:32Z,0
"Yogic Squat Hack! So, I&#39;ve always struggled with yogic squats. I feel like when my heels are on the ground my centre of gravity is a bit behind me, so I end up either having to reach my hands way out in front, or curving my spine to reach my head forward (neither of which feel totally stable, or comfortable). But today I got a little towel and put it under my heels, and BAM! I was balanced, I could lengthen upwards through the spine, and I felt good! Anyone else have experience with this?",Emily is Vlogging,2021-01-13T19:55:08Z,0
Immediately distracted by wanting to get myself that gorgeous Adidas jumper,Harriet Knight,2021-01-13T19:53:43Z,0
Thank you so much Adriene! Namaste from Austria 🤗,a0960242,2021-01-13T19:51:38Z,0
"Day 12 done. &lt;3 I can def. feel that my posture overall has gotten much better already. Kind of magical! Thanks for today Adriene, and all of you doing this with me/at the same time as me.",Malin Stiernborg,2021-01-13T19:51:28Z,1
Thank you for today&#39;s practice 💕 I was feeling stressed and couldn&#39;t focus in the beginning but left the mat feeling peaceful and calm!,Mari Hartikka,2021-01-13T19:49:30Z,0
Thank you for &#39;Breath&#39; Adriene. Every day of this journey with you has been a gift xxx,Shells Music,2021-01-13T19:48:29Z,0
&quot;Drrrrrrrop&quot; was that a Pharcyde reference? 😲,Vladimír Skřivánek,2021-01-13T19:48:23Z,0
"I have never made it to a yoga mat or a gym for 12 days in a row, before this! Loving every bit of this yoga journey. Thank you so much Adriene. I first got introduced to you during the SxSW 2017. I am so glad that I have stayed connected. ❤️🙏🏻🤗🤗",Sakina Fakhruddin,2021-01-13T19:45:44Z,0
Thanks Adriene!,Shana Page,2021-01-13T19:41:54Z,0
"Today was the hardest practice for me. Not physically, but emotionally. I just started crying while opening my hips, I couldn&#39;t contain my tears. Perhaps I am affected by today&#39;s new moon...I don&#39;t know. But thank you for this practice. Waiting for tomorrow ❤",Alex Soraj,2021-01-13T19:40:10Z,1
I thought we would do the frog pose ...I was mentally prepared myself and nothing 😅😅 one more beautiful day of yoga with Adrienne.... I feel that this is the time that I needed the most to connect with my breath (because anxiety is over the top for some months now) and I enjoy it most of all the other 30days challenges we did all the other times! 💖💖💖💖,zoumpik0s,2021-01-13T19:39:58Z,0
"I&#39;ve been doing yoga for a few months now and It is incredible how much yoga has helped me off the mat! With being present, balancing, calming down and keeping my body healthy. Thank you Adrienne and everyone who is joining me in this journey!",Lily Isobel,2021-01-13T19:39:56Z,1
I really couldn&#39;t be more happier with myself for joining this. Can&#39;t thank you enough Adriene,Jasmeet Kaur,2021-01-13T19:37:39Z,0
"After an extremly busy and stressful day ending with headache and feeling cold, I struggled to motivate myself to get on the mat, feeling tempted to just sink in the sofa with a blanket.  Glad I made it and experienced  all the stress gliding off me! Thank you Adriene and to myself for showing up tonight!",Els Dhooge,2021-01-13T19:36:13Z,0
I was waiting for the &#39;drop it like it&#39;s hot&#39; comment!  lol ;),poke1093,2021-01-13T19:35:10Z,1
"&quot;See the truth, speak the truth, feel the truth&quot; 🙏 This could not be more relevant or beautiful. I needed those words yet I ache so much for the value in truth. Namaste 🧘‍♀️",Shelly,2021-01-13T19:33:40Z,2
"What a lovely practice today.  Thank you, Adriene.  Be well yogis.",Debbie Gorenstein,2021-01-13T19:31:57Z,1
"Thank you Adriene for yet another sweet practice. Loved the bit in the end about holding the hand to the forehead, then the lips, then the heart. See, speak and feel the truth.  I am now on the14th day of morning dip in the winter lake, forest walk and evening yoga. I love this routine; makes me feel time/space open up inside, opening up in my life and I feel softly proud for being so committed. A small prayer I often say when doing my yoga: &quot; coming back home to sweet soft love, resting within, at peace with the world, loving kindness&quot; . Namaste. Thank you &lt;3",Kenia Ytterman,2021-01-13T19:31:45Z,1
"I&#39;m having a really low energy kind of  day and this practice fit perfectly. Thank you, Adriene 💐",May,2021-01-13T19:29:25Z,9
Its so serendiptious how “just right” each practice is during the day. I do mine before bed to unwind after work so man.. this is so good thanks Adrienne and benji and everyone too! Love th3e comments!,Lori,2021-01-13T19:28:29Z,1
"Day 12 complete! Feeling proud, calm, and grateful &lt;3",Δημήτρης Χ.,2021-01-13T19:27:50Z,2
"This was very needed, I’ve got a scary appointment tomorrow about the tumour in my mouth and this honestly just helped me to love and care for myself more today as I’ve been feeling very low and anxious, thankyou💙",Bryony Waddingham,2021-01-13T19:27:10Z,4
I wish you well! Take care.,irsute8833,2021-02-12T16:40:09Z,0
"Thankyou both💗 I absolutely love how supportive this community is!! Love and light from Lincoln, England x",Bryony Waddingham,2021-01-17T20:40:51Z,1
"@Bryony Waddingham What a beautiful name you have too! Wow, yes girl, you keep up those positive thoughts and feel all the feelings and then, let them go. You are incredible and incredibly unique. Sending you love all the way from Utah. 💞",Shelly,2021-01-16T04:50:15Z,1
"@Bryony Waddingham Oh gosh, I&#39;m sorry you got that news.  I am so glad this is helping and I hope you get all the care and love you need to help you through.",Lisa Finkelstein,2021-01-15T23:56:13Z,2
"Thankyou lovelies ,turns out I have a rare bone disorder which is scary, but yoga really does help my muscles and my bones and puts my mind at ease  💗",Bryony Waddingham,2021-01-15T16:31:46Z,1
Loved the outfit 💙😊,Lina La,2021-01-13T19:26:08Z,1
"Good afternoon from mexico 🇲🇽 i love this slow practice for today. Im all emotional and a little sad.. this help me be with myself, cry a little bit and be present. Remind me to go with the flow and to not be scared to feel.",valeria,2021-01-13T19:23:29Z,1
I could hear her heart beat @ the end of practice thru her mike.   Pretty cool,kieva skinner,2021-01-13T19:23:14Z,0
I have realized one reason (of a million) why I can’t wait to join all of you every single day. This is the only place on social media or actually in my life where everyone is “for” everyone else! The only place it’s all positive and I feel accepted. So thankful❤️😭❤️,Stephanie Powell,2021-01-13T19:22:31Z,3
"&quot;See the truth, speak the truth, feel the truth.&quot; - beautiful, especially the last one. These practices certainly help me to feel more connected to myself, and to everything and everyone around me. 🥰",Krisztina Erdelyi,2021-01-13T19:22:17Z,1
I love you all!,Gosia Buzzanca,2021-01-13T19:21:55Z,1
Thank you for this delicious practice Adriene. The sequence of these practices is spot on!🧡🙏,Róisín Nelson,2021-01-13T19:19:16Z,1
"This is my sixth year of joining your yoga journey but still there&#39;s days where it feels almost impossible to get on the mat. This was one of those. I felt more dedicated than ever to not miss a single day this year, but I&#39;m so sore from a workout yesterday I can barely walk and tired from a full day of moving around my weary body.<br />I was reading the comments and it reminded me that I can show up just as I am. So I did. This practice was the perfect way to drop into where I was. Tired and in pain. I dropped into what felt good, what was nourishing to my heart and body, I simply showed up and then the rest was so gently guided by Adriene and Benji. Just showing up as I am, today, is always enough. And boy am I grateful I did, and that this is available to us all. 🌱",Joy Aileen,2021-01-13T19:18:47Z,2
It&#39;s day 12 and I have been feeling so refreshed physically and mentally. I wish I knew about Adriene&#39;s videos years ago!!,Sara,2021-01-13T19:15:32Z,1
Twelve days ago even the act of going from cross-legged seat to all fours was so difficult for me and now it is coming with ease. My back pain which I have had for over seven months has so massively improved! Forever grateful for your beautiful crafted practices &lt;3,Sim one,2021-01-13T19:14:29Z,1
"So proud of myself for sticking to this! I must say, it helps that it&#39;s a challenge we&#39;re doing together at the same time because I want to do it with everyone else :D",Jana Six,2021-01-13T19:14:25Z,1
These past 5 days I&#39;ve really started enjoying these sessions. I do them in the afternoon and I always feel great afterward. I can even hold the downward dog a lot longer now!,zippora,2021-01-13T19:13:20Z,1
"Such a great practice today. I&#39;ve been having so much anxiety lately and this TRULY helped me center, calm, refocus and get my blood flowing. Thank you Adriene!! Also.. @adidas how the heck do I get the top she&#39;s wearing in this vid?! 😍",Leah Vail,2021-01-13T19:12:22Z,1
"Thank you again. I love your positive attitude and kindness, it helps us all to feel well with ourselves, with how we practice with you and not judged but encouraged. Muchas gracias por otra magnífica práctica hoy! un abrazo, Ana",Ana Ruilope,2021-01-13T19:11:51Z,1
I bring my grumpiness to the mat today <b>_</b>,Seda İlhan,2021-01-13T19:11:06Z,1
"@Shelly Hi, I feel better now :) Best wishes for you too, hope we all end up well with this journey ;)",Seda İlhan,2021-01-13T20:12:44Z,0
"Yeah me too, felt sad afterwords - I think it&#39;s releasing. Best wishes, hope you find some cheer and happiness. 😊",Shelly,2021-01-13T19:46:53Z,0
"that&#39;s the first time I&#39;ve ever been able to keep my heels down during a squat!! it took me four years, y&#39;all. be patient with yourself.",johanna e. h.,2021-01-13T19:10:23Z,2
"DAY 12 DONE - and it was a delicious one, though I am not sure why it felt better than usual, it&#39;s always really good. Also, I realized that somehow my feet are completely down in downward facing dog, did not see that coming. Well, thanks Adriene.",Josée Baudouin,2021-01-13T19:09:06Z,1
Another sweet practice thank you Adriene! The Breath journey is so beautifully curated and it is a pleasure to join you and the rest of the community each day! xx,Lauraswithie,2021-01-13T19:06:51Z,0
Please tell me I&#39;m not alone in getting the Beastie Boys references? &lt;3,craigdanielmaceacher,2021-01-13T19:04:45Z,0
"I missed it, which part?",Shelly,2021-01-13T19:47:46Z,0
"thank you! &quot;We don&#39;t always need that 90min sweat to get connected to our bodies, to listen to our heart song&quot;. Me today: went jogging to release emotions, I felt good, listening to the music. Me on the mat after just a few breaths: in tears, realizing that I was holding a big package of lost and sadness, the whole day, instead of just feel those emotions and allow them to be here with me. Maybe I am not a wag today, but after the practice, at least I feel some integrity. See you all on the mat tomorrow!",Mar Tar,2021-01-13T19:04:34Z,52
"Who&#39;s still here and loving it? Sending love to everyone in this beautiful, positive, and encouraging community! We are doing great and thank you as always Adriene!",Bijan Love,2021-01-13T19:00:45Z,238
bijan love.....WE&#39;RE STILL HERE :) :) :) and loving EVERY moment :) of this treasured journey,Macey Downs,2021-01-22T01:20:32Z,0
"Aw this is lovely . I was running around all day sorting out life admin / IT problems and I was nudging myself to do this . What you said Adriene , is so true , just make time for self care. Even if you only have time for a few minutes you feel great. I&#39;ll fit in some meditation now and get back on the matt in the morning . Have a lovely evening everyone xxxx",Joanne Fleming,2021-01-13T19:00:12Z,1
"Short but oh so sweet.  Love the advice to show up for yourself every day, even if it’s just a quick connect with conscious breath.  My back was sore today from a long term injury, but I can feel it opening out a little more each time I get on the mat. Thank you for this delicious treat, and the reminder not to get too precious..",Al Orange,2021-01-13T18:59:49Z,0
Excellent class Adriane... Lovely time NAMASTÉ 🙏💕,Sandy bella,2021-01-13T18:59:31Z,0
"I try to comment on every video, but today I have nothing. Clear mind I guess!",Nicole Letourneux,2021-01-13T18:59:27Z,0
I love how this year&#39;s journey is gentle and healing. exactly what we need to start this year after everything we&#39;ve been through. Always grateful for Adriene and her kind soul.,Rola Rola,2021-01-13T18:59:22Z,204
Very true words.,Laura Cobbold,2021-02-02T06:39:01Z,0
and We are grateful for YOU rola rola :),Macey Downs,2021-01-22T01:21:17Z,0
I feel the same way!,Brynn Matthews,2021-01-14T04:03:33Z,1
"That was amazing Adriene, it was just the sweetest practice! Thanks, from France &lt;3",Nina Van De Walle,2021-01-13T18:58:06Z,0
@yogawithadriene Adriene idk if you&#39;ll read this but I need some advice! I have a really hard time taking my breath all the way down to my belly because it feels like I&#39;m not actually breathing so I get panicked and have to breathe into my like my chest. I have been swimming and doing water sports since I was little so maybe it has something to do with that and it&#39;s muscle memory now. is that normal? do you have any tips for it to be a little easier and so my brain doesn&#39;t think I&#39;m not breathing? <br /><br />Thank you!,joanne,2021-01-13T18:57:04Z,0
In the beginning of today&#39;s practice I said <del>out loud😂</del> &quot;today I&#39;m coming on the mat but I&#39;m ALL OVER the place&quot;.....19mins later and I feel restored and ready for the evening.....this was a breath...of fresh air! Thank you for everything you do for us🙏🏼,Ludovica Chiarini,2021-01-13T18:56:17Z,0
"Today you shared a very meaningful concept, thank you!",Maryaz C,2021-01-13T18:55:56Z,0
Thank you.,Pieter Athmer,2021-01-13T18:55:07Z,0
Love ❤❤,Faezeh Khatami,2021-01-13T18:53:45Z,0
