comment,id,date,num_likes
Thanks for suggesting to drop/lower expectations:) Have a beautiful day everyone!,Pia Albinsson,2021-01-13T11:56:13Z,0
"This is the best yoga journey I have seen. The past years I worked uout with Adrienne, and this is the one I&#39;m enjoying more. Thanks a lot!",Danielle Fernandes,2021-01-13T11:54:16Z,0
"Nice one for the archive. Started a little stiff in the quads, left hip and gluteus. Now I feel great! Ready for the day ahead. 😊🙏🏽",Tracy Kato,2021-01-13T11:54:06Z,0
Dropped out of bed at 6am to land on my mat. I’m so happy to be here with all of you.,Alexis Williamson,2021-01-13T11:53:00Z,2
Today I dropped in to visit my friend Breath and together we reconnected.....,Teresa Murphy,2021-01-13T11:52:06Z,0
❤🧡💛💚💙💜🤎🖤,Bebernana,2021-01-13T11:51:08Z,0
Still streakin’ on day 12!  Whoo hoo!,Amanda Armstrong,2021-01-13T11:50:40Z,0
It&#39;s almost 9 am in Brazil. I&#39;m starting my practice and there are almost 50k views already. It&#39;s so nice to imagine how many people around the world are doing it... Maybe you are a little tired today. But don&#39;t give up 🙏🏼,Sérgio Leno,2021-01-13T11:50:32Z,0
💕💕💕,Ruth Valentini,2021-01-13T11:46:56Z,1
Who else can’t wait for the BREATH merch to come?,Olivia Means,2021-01-13T11:42:19Z,2
Today&#39;s practice was nice and quick.  And just enough time to drop in and take my focus inward.,Determined Despite!,2021-01-13T11:41:03Z,0
6am here in Colombia ☺️ feeling so grateful to still be doing this practice and I definitely felt a bit relieved when I saw it was only 18 minutes this morning. Thank you Adriene!,Lucy Mac,2021-01-13T11:39:23Z,0
Day 12 DONE. Lovely practice for my busy and stressed mind.,Baiba Dziedātāja,2021-01-13T11:39:21Z,2
💜 See 💙 Speak 💚 Feel The Truth! Thank you for dropping those into this practice for us! Loved today&#39;s practice!,Clare Loveless,2021-01-13T11:38:27Z,1
💜💙💚,A Lightworker,2021-01-13T11:41:30Z,1
Exactly what I need today... dropping down...thanks for this lovely practice💖,Tina Koeppl,2021-01-13T11:34:47Z,1
Beautiful practice! Thank you!!,Rachel Robertson,2021-01-13T11:34:23Z,1
"Also as a runner, the down dog sequences were amazing for my tight IT band! I feel like I have a whole new leg today :)",Rachel Robertson,2021-01-13T15:08:48Z,0
So grateful for these practices. Thank you. See you tomorrow for some more self love and care,Rachael Reilly,2021-01-13T11:32:10Z,1
Great short practice and my headache is gone 🥰,Agnieszka Synak,2021-01-13T11:29:21Z,1
Great practice.  I love to the green adidas top you’re wearing. Where can I get one.?,Debra Murphy,2021-01-13T11:28:35Z,0
Nice practice I&#39;m enjoying whilst being in full lockdown here. I always follow your January 30 day programmes. I must keep this up! Ps who taught you Yoga Adrienne as your explainations are fabulous and you teach so well. 🙏,K Howard74 UK,2021-01-13T11:26:41Z,0
I was waiting for Adriene to say &quot;drop it like it&#39;s hot&quot; at least once 😆<br /><br />Great practice!,Nico Parks,2021-01-13T11:24:52Z,19
heyo!,Lisa Alves,2021-01-13T16:47:53Z,1
I too wait for heyos and songs and always smile inside and out when we get one!,Happy Farms,2021-01-13T15:13:50Z,1
"I was waiting for that as well, but I&#39;m still not disappointed. 😁",Marie H,2021-01-13T15:03:31Z,0
"Like when we dropped our butts into that squat, tehehe 😆",Tricia Moss,2021-01-13T12:22:48Z,1
"Due to hormones I found myself bawling my eyes out at the end of this practice, I felt like the squat pose opened up some deep stored emotions so I just had to let it all out. Thank you Adrienne &lt;3",Olive Olin,2021-01-13T11:23:55Z,67
"Yeah, I was shaken too in the squat pose.",Lisa Alves,2021-01-13T16:47:14Z,0
"Adriene, today was fire.. I loved today&#39;s practice.. it was just what I needed... I feel so great, awakened even. Namaste!",Jacki Siddall,2021-01-13T11:23:41Z,0
"Really nice practice today, 🙏💞",Dale,2021-01-13T11:22:48Z,0
"Feeling a bit sad and lonely, this practice helps me, like every morning",petite voyoute,2021-01-13T11:20:37Z,19
"you are not alone, aloha from maui",wendy costa,2021-01-14T08:47:56Z,0
@oliyennn ❤️ thanks for the love,petite voyoute,2021-01-13T18:59:23Z,1
"HI! I know the feeling and how hard it must be. Sorry to hear that, however, dont loose hope. And im so proud of you that you got up and did the practice. Sending much love to you beautiful. <b>hugs</b>",oliyennn,2021-01-13T18:00:46Z,1
@Tricia Moss ❤️❤️❤️ Thank you,petite voyoute,2021-01-13T12:35:22Z,0
"You are not alone, I am here with you. I can hear Adriene singing that in my head! We are all doing this together. Love and peace from NC USA.",Tricia Moss,2021-01-13T12:32:59Z,1
Day 12: I dropped into this practice. :) Thank you very much!,Yen Tindall,2021-01-13T11:20:33Z,0
"Of course later in the morning as I was getting into work mode I listened to Intergalactic, as the Beastie Boys <i>have</i> been known to let the beat... <i>drrrrrrop!</i> (Couldn&#39;t not think of that lyric today.)",CaugheyMachine,2021-01-13T11:20:25Z,1
Yeah bro me too<br />🤣<br />🧘‍♂️,A Lightworker,2021-01-13T11:48:42Z,1
Why did Adriene stop introducing benji at the start of the video? 😞he looks very upset 🐿🐾,Kolya M,2021-01-13T11:14:42Z,0
"TREE POSE question after catching up and doing day 10&amp;11.  Can anyone direct me to some leggings where my foot doesn&#39;t slip down my leg.  I have n o problems with my leg above my knee and holding when I take my leggings off!!!! so I&#39;m happy with my posture and pushing my thigh into my foot.  However, when things are normal and I get back to my local Yoga class I&#39;m not sure this would be approved.  I&#39;ve ordered numerous - both cheap and expensive but have not found any where by I can hold my position,  I thinking of moving to loose running shorts so that I can access my bear skin.",Janet Edge,2021-01-13T11:13:06Z,0
"🧡  fr☀️m Se🦵🏽ma,  A❕abama",Justin Baumann,2021-01-13T11:12:52Z,0
Really needed that today. Thank you.,M Cich,2021-01-13T11:12:02Z,1
I had forgotten just how much I enjoyed Extended Child&#39;s pose. Thank you for reminding me @Yoga With Adriene   xx💚xx,Fiona Kearns,2021-01-13T11:10:06Z,1
Who else does a little wiggly dance with the outro? 😆<br /><br />Shout out to 2k yogies who did the practice at the same time with me! See y&#39;all for day 13,nemesmjat,2021-01-13T11:09:40Z,0
Thanks for reminding us to slow down... drop in.... and breathe 🧘‍♀️ 🙏🏻♥️ see y’all tomorrow!,christine wellington,2021-01-13T11:09:35Z,0
"Thank you. Beautiful, quiet experience, today too. Much love to all.",Maria Bovin de Labbé,2021-01-13T11:08:51Z,3
Loved this one - short and sweet. Love the adidas today - those colours look great on you.  Can’t believe I made it to 12. Lower back feels so much better!,Susan Rapin,2021-01-13T11:07:28Z,0
Been questioning alot lately about life and what it all means. Combined days 11 + 12 to try shift this funky energy and it helped. Though my surroundings may not be what I would like I will try look forward and stay focused 🥰😍😘 wish I had a Benji Benji in my life. I think I need animals back again hmmmm,Nicole O Scott,2021-01-13T11:07:16Z,0
"Great session today, thanks Adriene. 12 days into this journey, I&#39;m so intrigued with the progress, like first time we did the extended child&#39;s pose, I was struggeling so much (to be fair i was also struggling just sitting and relaxing), how ever today the extended child pose was a great experience where it felt like my body settled with every breath taken. Looking forward to find out where this journey takes us. All the best and see you tomorrow",Anund Flygare,2021-01-13T11:00:36Z,0
"I missed out on 9 days of this challenge because of my own personal insecurities that I considered a bad start of a new year and wanted to say it’s gonna be a bad year just because these couple of days were not perfect as I imagined. Then I remembered that i don’t have to wait for the new year to become a new me, I can do it anytime and drop in anytime I want to change my life. Yoga alongside dance changed my day and yesterday I made a promise to give myself this time to be vulnerable, to practice with my emotions and feel my body performing what I feel deep inside learning how to be a better version of myself, I wish to transform this year mentally and build a good relationship with myself, build my outer world with my attitude that can change everything. So that I practiced yesterday, did yoga video from day 9 and then I turned out to be on my Matt this morning as well and am already feeling gratefulness for doing this two days in a row. People, be proud of your small accomplishments, do not give up straight away and let yourself find truth inside you. Thank you Adrienne for your guidance and practice. Let All Gods bless you and your subscribers ❤️",Natalia Lipcova,2021-01-13T10:59:49Z,0
"Every day connects differently. At the end when Adriene says “drop your expectations” I smiled, then got chills, then cried. I guess I needed permission to do so.",Changing Cheryl,2021-01-13T10:59:16Z,67
I felt exactly the same way...😔🙏❤️,Maria Papadaki,2021-01-16T17:42:06Z,0
I&#39;ve cried after a few sessions too! I guess we needed the permission to release those emotions! ❤,Claire Waldron,2021-01-14T22:05:50Z,0
I have definitely cried during yoga from the release of emotions. &lt;3,L,2021-01-13T23:33:42Z,0
@Happy Farms The practice helps us to release pent-up emotions. It has been a very tough year indeed. Blessings to you and yours.,Tricia Moss,2021-01-13T15:21:15Z,4
Ive been tearing up lately too.  why did the boot scoot boogie singing two practices ago make me laugh then cry in release. Its been a tough year. Namaste.,Happy Farms,2021-01-13T15:13:18Z,3
♡,Melissa Oosthuizen,2021-01-13T10:57:58Z,0
"‘A little goes a long way’. It really does. Before coming to the mat, my shoulders felt quite tight and I almost couldn’t stand up straight. But after the practice, I got off the mat actually feeling a little lighter and it felt...good, relieving and refreshing. <br /><br />Day 12 everyone ☺️🤗<br />To whoever’s reading this: <br />You are awesome and you are loved ♥️",Raphah Raysa,2021-01-13T10:56:27Z,0
"Today i felt so connected with you... You are pure light Adriene, thank you so much.<br />Namaste🌄❤",Juliet Moonlight,2021-01-13T10:56:16Z,0
"Today is packed full of stuff to do on my to do list. I&#39;m graduating from high school this year after 7 years of not attending school so that&#39;s one yayyy!! So glad to see that today&#39;s practice was a convenient one in length. It really goes to show that a little does indeed go a long way when it comes to loving yourself. No matter howcbusy I get, I always have Adriene&#39;s voice in my head telling me to drop everything and relax because I deserve it. Stay healthy, everybody. Much love. Namaste.",Shadan Zahrooni,2021-01-13T10:53:36Z,0
A little morning to myself: went jogging did some yoga-warm-up before and after and ended with this beautiful practice! Time well spent!!! for ME! Love to ya all!,Katri Gelati,2021-01-13T10:49:05Z,2
It was hard to drop everything and be present today. The ping pong brain was persistent. Thank you for the cues to return and then return again.,Sharon Minigh,2021-01-13T10:38:17Z,2
I loved the message of today’s session and applicable in all aspects of our lives. Another great session to kickstart my day! 🥰,Jumping Joy,2021-01-13T10:38:10Z,1
"The perfect practice for day 12! Way to go everyone, let&#39;s all keep showing up! Namaste 🙏🏻❤️",Lydía Z,2021-01-13T10:37:42Z,2
Great theme for today!  Dropping expectations of where I think I should be in the yoga poses helps so much.  Thanks for the reminder and for this practice Adrienne! (so glad Benji made an appearance too),Ann Terranova,2021-01-13T10:37:23Z,0
"I was soooo waiting for a crow pose after the squat, but from yesterday&#39;s practice and thanks to the insane amount of planks my arms are pretty sore. I know it&#39;s coming tho, I can feel it in the air .. haha",Fanni Scheuer,2021-01-13T10:36:30Z,1
"lol I thought for sure crow was coming after the squat, but it will be here soon I’m sure.😊",Holly,2021-01-13T15:18:09Z,0
"Day 12 the day off dropping my breath into my belly and my belly,hips,knees,heels,hands and hair to the floor.  Benji loved it too.  ❤ the jogi squat .",Benhilda Katsande,2021-01-13T10:35:36Z,0
Another emotional one today for me... I have spent too much time ignoring my body and putting it through a lot so it&#39;s nice to show up and listen (even if the listening is me audibly grunting into forward fold). So much love 🖤,Wuthering Tights,2021-01-13T10:34:20Z,0
"I love that I was so looking forward to this practice this morning. I hope this enthusiasm continues. It feels like you are getting a warm hug from a friend. Thank you Adriene, this badly needed right now. Have a fab day ❤️🇨🇮🍀",jude BURTON,2021-01-13T10:33:34Z,0
This community is so incredibly loving and supportive! I love scrolling through the comments after every practice.,Cara Noé,2021-01-13T10:32:19Z,0
My fave so far! &lt;3,Lizzie Park,2021-01-13T10:32:13Z,0
My favourite so far! &lt;3,Swindleshoes,2021-01-13T10:31:10Z,0
Whenever we are in a low lunge with the back knee lowered I have a little discomfort in the back knee. Apart from padding the knee is there something I can pay attention to in my asana to make sure I’m not crashing down in that knee so much? 😅🙏🏻,Melissa Kroes,2021-01-13T10:31:09Z,0
"I swear to God once corona is over, I’ll be on the first flight to Austin to attend your yoga class in person 🤍",Elizabeth S,2021-01-13T10:30:16Z,25
I was thinking the exact same thing !!! She is going to need a stadium tho&#39;,Robin Byrne,2021-01-17T21:17:56Z,1
Seriously on my bucket list! &lt;3,Irene,2021-01-17T04:46:51Z,1
No joke!! That would be soooo much FUN! LIVE ENERGY would just be too good 😄🥰🤩🏆,J Smiles3,2021-01-16T16:43:27Z,1
What a dream!!!,valeria,2021-01-13T19:25:02Z,4
"&quot;let&#39;s close this puppy out&quot;  technical term, right? <br />:)",Joe Disco,2021-01-13T10:28:44Z,28
Definitely.,Yoga With Adriene,2021-01-13T14:37:42Z,7
"Good morning to everyone practicing all over the world, what a wonderful journey we&#39;ve embraced! ❤️",Cristiana Vescovi,2021-01-13T10:28:08Z,13
Thank you Adrienne 😍,tanya Clark,2021-01-13T10:27:03Z,0
"I started to really tear up at the end where I put my thumbs to my heart. I feel so hard on myself for not being consistent with this. Thank you for the gentle reminder that I may not feel great when I show up, but that it weighs the same to have still shown up.",itloggirl,2021-01-13T10:25:29Z,1
"Thank you.  I needed to hear your words of seeking our truth today as I am fighting not to go against my instinct.  Each time in the past that I have, it ended in a disastrous event.  Maybe this time I have the courage to stand up for my instinct and have enough belief to follow my own interests.  It isn&#39;t as drastic as it sounds, but is important for me personally. X",Keren,2021-01-13T10:23:01Z,2
It felt so great to just drop. A perfect theme for this day where I feel stressed and scattered and it&#39;s only 11 am. Felling much better about the rest of the day now :) Thank you Adriene ♡ P.S. I love your sweater :),Alena669,2021-01-13T10:22:17Z,3
I’m so sad because I just saw this in my subs for some reason and we are already 12 days in so I can’t join with everyone at the same time :(,Anne,2021-01-13T10:22:14Z,0
"Well....you could. Always recommended (I think) to go in order, but be a rebel and join in now if you want 😉",Shannon Pitts,2021-01-13T10:32:55Z,0
I watched worry go right out the door when you reminded me to be fully present for this practice.  This is my favorite time of day.  It&#39;s quiet and still in our home at 5 am.  So beautiful and peaceful.  Thanks for helping me be HAPPY!!!!  Lots of love out to ALL of you!,Ann Jenkins,2021-01-13T10:20:30Z,0
Crap.. I’m 12 days late...,Abraham Tario,2021-01-13T10:19:01Z,1
"Hi community! Dropping here only to say Hi :DD<br /><br />I&#39;m also self-celebrating that today&#39;s my birthday and I&#39;m happy I was already given 22 years of life.<br />It&#39;s definitely not been always easy, as for all of us, but it&#39;s got better since I&#39;ve found a way to be with myself, and that is Adrien and her yoga guidance. <br /><br />I&#39;m so glad I found her channel and that there&#39;s such an amazing community. The comments you leave have been helping me getting back every day during this challenge.<br />I&#39;m super proud of me and also of you. I&#39;m happy that we&#39;re being good humans together ❤️ it gives faith in the future, right?<br /><br />Hugs,<br />Giulia",Giulia Montanari,2021-01-13T10:15:41Z,2
"@Yoga With Adriene oh my, thanks for this 😍<br /><br />And thanks to the others too ❤️<br /><br />A hug to everybody 💓",Giulia Montanari,2021-01-14T02:52:33Z,0
"Happy Birthday, Giulia! xx",Yoga With Adriene,2021-01-13T14:38:52Z,1
Happy birthday dear &lt;3,Miroslav Ivanov,2021-01-13T10:56:04Z,1
Happy birthday 🎉,Shannon Pitts,2021-01-13T10:33:33Z,1
"Happy birthday, Giulia!!",Rumyana Yankova,2021-01-13T10:22:34Z,1
"Cheers to the best teacher I know ☀️ Am not feeling good these times. Loaaaads of expectations, trouble being calm at peace, lots of informations and trouble Sleeping❤️ any advice is welcome ☀️",Aline Rossier,2021-01-13T10:14:49Z,0
That felt cozy and sweet 🤍,toldme,2021-01-13T10:14:47Z,0
Was feeling tired this morning and wanted to go back to bed after sorting out brekfast for family. Then I decided to show up for day 12 nice and early... feeling so much centred now and  energised. It helps a lot a specily during lockdown time... Thank you Adriene for sharing your gift.,Mummy's Retreat.,2021-01-13T10:11:37Z,0
"so important to feel the truth, your truth. it&#39;s the only thing that help you grow as a human. thank you for reminding me mine. ❤",Μαρία Καρπάθη,2021-01-13T10:09:17Z,2
Day 12 &lt;3,Simone Viebke,2021-01-13T10:08:28Z,0
7am here and already did it! Now I will drop some breakfast in my belly =p,Dany Teofaga,2021-01-13T10:06:07Z,0
"Thanks Adriene, I’ve got headache today but I feel like this helped 🤗",Peanut Patterson,2021-01-13T10:04:47Z,0
Just finished heart meditation and followed straight to the mat. Snuggled up to my truth dropped expectations and accommodating that modifying is always ok. Thank you Adriene and beautiful yogi community. ❤💛💚,Bree,2021-01-13T10:04:47Z,0
Thanks Adriene for a wonderful day start! Lots of love!,Asish Joshi,2021-01-13T10:04:44Z,0
"I love today&#39;s practice. So yummy.. Love from Jakarta, Indonesia",Tona Meisya,2021-01-13T09:58:33Z,4
"Thank you for this breath practice.  Dropping in to the breath, feeling the breath, using my breath intentionally, makes such a difference. Have a nice day. See you and Benji tomorrow...",Cathy Sullivan,2021-01-13T09:57:38Z,1
"Today was the hardest day yet for me, not in terms of  the practice being physically challenging, but emotionally. I really didn’t want to come to the mat today, I am feeling all the feelings and spent most of my practice getting distracted and feeling frustrated, but I kept going, I kept trying to arrive at the breath and bring myself back to the present moment. <br /><br />In that dedication I found myself so grateful that even through the hard times I have learnt to show up for myself and within that practice I am forging an even deeper relationship with me. I strive to never abandon myself again, especially when I’m needed most. So I will continue to show up and continue to be here. <br /><br />Thank you for reading yoga family and for being on this journey with me! I hope you have the most magical day and have a wonderful practice. BB x",Benjamin Blak,2021-01-13T09:57:18Z,704
@Anna Wiesenmüller Oh how beautiful :) &lt;3,Nora Jasna,2021-02-15T07:42:02Z,0
"Your words are so beautiful and true, that I want to use them for a piece of Artwork in progress! 🤗❤️🙏",Anna Wiesenmüller,2021-02-14T23:08:47Z,1
"I was on day 12 today, in my own pace, and felt the same way... &lt;3",Nora Jasna,2021-02-01T23:04:26Z,0
"Thank you for sharing, that was beautiful. Sending you lots of love x",Nitroonthem,2021-01-26T10:59:51Z,0
Me too - exactly this.,Jane Adlington,2021-01-17T10:41:05Z,0
Thanks Adriene!,shery A,2021-01-13T09:56:29Z,0
I CAN REACH MY TOES!!! this is the first time in forever i was ever able to do that wtf,Michelle Angela Santos,2021-01-13T09:56:07Z,2
YESSSS,Yoga With Adriene,2021-01-13T14:39:34Z,1
@Joanne Campbell Thank you &lt;3,Michelle Angela Santos,2021-01-13T12:26:29Z,0
@Shannon Pitts Thank you &lt;3,Michelle Angela Santos,2021-01-13T12:26:18Z,0
Yay 😀,Joanne Campbell,2021-01-13T11:34:44Z,1
Well done 👏,Shannon Pitts,2021-01-13T10:35:13Z,1
Every time I do yoga with you I feel as good as new! Thank you for this body and mental journey❤️❤️❤️,Maja Terzic,2021-01-13T09:55:42Z,0
i would have never thought that yoga could helped me this much! Thanks Adriene ❤️,Maryam ZH,2021-01-13T09:55:17Z,0
"I normally practice in the evenings but on Wednesdays I only have time in the morning. I really loved this as the start of my day, it made me feel so grateful for my home, my health and the yoga practice. Namaste everyone, and a virtual hug for anyone who needs it!",Christi Wagner,2021-01-13T09:53:42Z,29
Day 12 &lt;3 this journey is a blessing &lt;3,Dalia Farouk,2021-01-13T09:49:14Z,1
"Hello fellow Yogis, I need some help... I’m thoroughly enjoying this yoga journey as it is my first proper time getting into it. HOWEVER me and downwards facing dog are NOT friends (yet) I get really clammy/ sweaty hands and find my hands always slip around on my Matt making the move that much harder to get in to. Does anyone else have this issue and did it go away?😂 or should I be wearing gloves? Idk please help. Thanks in advance xxx",Amy Jordan,2021-01-13T09:49:06Z,0
@Shannon Pitts I enjoy downwards dog when I’m not slipping and sliding about so I will deffo give a towel a go tomorrow. Thank you for the tip🥰🥰,Amy Jordan,2021-01-13T10:40:40Z,0
"It gets easier, but you could always put down a towel or use yoga blocks. Another person recommended instead of doing downward dog, just bend and lean against your couch/chair, bed, or wall.",Shannon Pitts,2021-01-13T10:37:43Z,0
"Day 12, drop: drop your expectations, make way to your truth.",Lady0asis,2021-01-13T09:48:07Z,1
I’m 3 hours late today but I’m here on the mat DROPping all the weight off of the daily list and concentrating on my breath and this wonderful art of movement meditation. Namaste everyone! 😊,Topher Pendragon,2021-01-13T09:47:18Z,0
Good morning! It is good to see you here once more!,Smirna Costa,2021-01-13T09:47:03Z,0
"Who else does a little dance when the end music comes on (with the drum)? Relaxed, goofy, strong, energized; starting the day feeling like I’m Adriene 😁!",EHuis,2021-01-13T09:42:01Z,0
So poignant were those last few words.  Thanks A.,Korkoi Quaye,2021-01-13T09:40:01Z,2
That Beastie Boys reference in the intro! Hahahaha love Adriene so much!,JenJudy,2021-01-13T09:38:58Z,4
"Good morning everyone, from Wales! Boy, I would be SO happy if one day I could get my feet flat on the floor in a yogi squat! Wishing you all a beautiful day! xx",Annie Dickson,2021-01-13T09:38:29Z,0
"though this was short, i struggled with all the downwad dog/plank, by the time i get into pose, she does something new, need to slow playback speed.",misskundan,2021-01-13T09:38:08Z,0
I&#39;ve showed up everyday and the more I show up the more I am greatful for myself and the more I am greatful for this practice ! <br /><br />This practice is not only life changing... It&#39;s a lifestyle ! Today was one of the best practices yet .. 🙏♥️ thank you Adrienne.,Deepthi Anantha Kumar,2021-01-13T09:37:42Z,0
She is bad🤩😍,Rahat Ahmed,2021-01-13T09:32:08Z,1
Truly😝,LSG,2021-01-13T09:47:36Z,1
This was a sweet one☺🤗,Lisa O'Brien,2021-01-13T09:26:24Z,0
Gratitude 🇧🇷🌻,Thiago Messias,2021-01-13T09:26:23Z,0
"I love how you built your yoga journeys, it feels really like we are in a journey, I feel like I&#39;m connecting, each day, a little more with myself",Joanna Cruz,2021-01-13T09:25:29Z,8
Now yesterday I felt as if I could stay in downward facing dog for ages then today I struggled with the practice a lot.. it is definitely different every day for sure... loving it though. thank you namaste 🙏🏼 💕,Debbie Carter de Bois,2021-01-13T09:22:49Z,0
"Feel like somehow she knows when you need a shorter practice, pretty sure you’re a unicorn or some kind of magical yoga entity Adriene 🤣",sugoi zoe,2021-01-13T09:22:24Z,618
so weird it 1 o&#39;clock in the morning bur i really wanted to show up so i did and its always the perfect practice for that day 😍,Bizzy B,2021-03-02T01:15:20Z,2
Definitely getting unicorn vibes :),Madeleine,2021-02-22T13:17:58Z,1
"She always knows what you need! In the last practise, the pigeon pose, I had a lot of tension in my hips and needed that stretch. It’s amazing 🤩",Laura Cobbold,2021-02-02T06:40:45Z,3
She&#39;s the best! 🌹,Forgotten Palace,2021-01-23T00:29:08Z,1
"Yep, I was not feeling it this morning and knowing that it was a short practice was what motivated me to show up anyway. Phew.",enirethacatherine96,2021-01-18T14:08:40Z,1
