comment,id,date,num_likes
"You may work today to release stress or worries, allowing yourself to be present in this process for the short time we are on our mat. This is our shortest session yet. You are doing great!",Yoga With Adriene,2021-01-13T14:05:08Z,943
Thank you Adriene.,Fer-De-Lance,2021-04-17T15:21:20Z,0
Thank you so much ❤❤❤,Bettina De,2021-03-18T21:15:07Z,0
Thank  you very much🥰,Berry Essam,2021-03-08T10:24:37Z,0
"Yes! Amazing daily practice to check in, to connect within and to take the time to just be.",Rocio Gaborit,2021-02-11T09:21:02Z,0
"Short and sweet, love it!",J Hicks,2021-02-07T16:21:00Z,0
"Namaste, Adriene! xx",Jenin Husseiny,2021-05-08T18:37:52Z,0
Day 12 : SELF CARE,MOMENT,2021-05-08T16:39:03Z,0
May 7th!!! Namaste!,CaffeinatedLady,2021-05-08T01:21:12Z,0
Day 12 on May 7.,Cat Cat,2021-05-07T15:29:28Z,1
Good feeling new,jayasudhan s,2021-05-06T12:23:03Z,0
"i hope everyone is happy, grateful and healing well i love you 💛",shruti s,2021-05-05T12:21:06Z,0
This 30 days practice is so refreshing . I love this connection to the breath and the breath &quot;work&quot;  Thank you Adriene  🙏 Namaste,CHERYL KELLER,2021-05-04T23:02:40Z,0
I was super tired today. Still managed to show up to the mat. And you did a shorter practice today. 😍,Upoma Saha,2021-05-04T17:14:05Z,0
"Once again,thank you🙏❤",karen parr,2021-05-04T07:07:09Z,0
"Day 12 &gt; to all who did it, whether it was on time or not. You did it, with the doubts and struggles along the way. You have come so far, you can be very proud of yourself💙",Suus,2021-05-02T10:15:08Z,0
"Hello Adriane! I don&#39;t usually comment but i wanted to let you know that you are an amazing yoga instructor! I have terrible back pain issues and I am finding relief with your yoga practice, I have never been able to stick to any practice and I made it to day 12 with you. Thank you so much for changing things up and making it interesting.",Jae Kdrama Fan,2021-05-01T21:12:53Z,0
"I did this practice at 3am while eating pepperoni quesadillas, self love or self sabotage?",Olivia Duden,2021-04-29T10:59:20Z,1
Haha I’d say self love😌,Suus,2021-05-02T10:13:09Z,0
"Thanks Adriene. I love sitting down with you (almost) every day and practice. It&#39;s really transformed my life. I haven&#39;t commented before, but I want you to know your work is seen, valued, and so, so appreciated. Much love to you.",Yvon Stokkink,2021-04-26T08:08:55Z,0
"To the yoga community, I&#39;m so glad to be in this journey with you. I now understand why many people are loving yoga. ❤️<br />This is the shortest session so far, but one of the most meaningful sessions I had. Today, I just realized that the gist of my 3 intentions I set for this yoga journey is to drop the emotional and mental baggage that has been with me since last year. This yoga journey that I started 12 days ago was a blessing in disguise as this is the most peaceful state I have been since last year. This is also my first yoga experience, and I’m happy I did it with you, Adrienne.",Faith Gazmin,2021-04-26T00:52:16Z,1
later than usual today but i&#39;m dropping in again. happy day 12!,apple,2021-04-25T21:14:59Z,0
Thank you!! &lt;3,Fatma Yildrim,2021-04-25T18:46:48Z,0
"I&#39;m late to this party I know, but I was wondering if it is bad that I can never get my heels down in downward facing dog.  Are there stretches I can do to help that?",Jessica Williams,2021-04-22T10:28:06Z,0
"Great session... at <a href=""https://www.youtube.com/watch?v=5sTZMSGurlg&amp;t=12m15s"">12:15</a> you say the upper arm bones are externally rotated. What do you actually mean by that? I actually struggle to know what to do with my arms in down dog ie are the elbows locked or slightly bent? Are the palms facing a little outward or forwards? Are the elbows rotated into the body or more outward towards the edge of the mat? Need help :) thx",Andy J,2021-04-22T08:08:03Z,0
Me after every video: &quot;She&#39;s really good&quot; :D Lots of love,Hilal Çapkın,2021-04-20T15:53:20Z,0
Day 12 Completed (April 20 2021) Today I learned that dropping everything that burdens us and allowing and  giving ourself the opportunity to be it and experience a rest time is must. This will allow us to relax and have a refreshing feeling. ❤️,Cherry Lene Hernando,2021-04-20T15:38:18Z,0
Drop expectations well did that <br />Thank you namaste,honest by self,2021-04-15T02:21:45Z,0
"Doing this series a second time and today was difficult with my grandmother knocking every two minutes (she has dementia and doesn&#39;t heed any Do Not Disturb or &quot;go ask <b>insert my brother&#39;s name here</b> signs) and my dog wanting to leave my bedroom halfway through, but this gave me a sense of peace amidst the chaos of my household.",Jae Henricksen,2021-04-14T19:46:09Z,2
was that a beastie boys &quot;drrrrrrop&quot; at the beginning?,Dewey Boonie,2021-04-13T11:43:46Z,0
Sending love to you 🌸🌸 (12/4/21),Salima D'Antuono,2021-04-12T20:52:01Z,0
"Thank you, for another great beginning to my day , see you tomorrow .🖖",David Cates,2021-04-12T15:49:17Z,0
Thank you Adriene❤❤❤ Much needed healing process!!! Take care 😇,Narayanamma M,2021-04-08T06:16:07Z,0
d r o p .,Expressively Yanna Marie,2021-04-08T04:48:20Z,0
Thank you to anyone who did this with me today 👍🏻,Ahana,2021-04-06T03:56:05Z,4
I’m one day behind you! haha,ap13 o,2021-04-08T01:09:26Z,1
🙏❤️,Clare Lora,2021-04-05T23:53:22Z,1
I&#39;m doing this challenge in March/April and am not doing it consistently every day but doing it most days. I&#39;m learning to be kind to myself. It&#39;s ok to not do them everyday. Just as and when you can. I hope you can all be kind to yourselves too!,Lisa,2021-04-04T20:29:34Z,11
I&#39;m there with you.,Luz Zenteno,2021-04-27T20:16:47Z,2
"I’m doing this now too, glad I’m not alone! I’m also not doing it everyday although I seem to be getting closer to it as I’ve only missed one day this week. It’s strangely addictive!",Leona Stevenson,2021-04-17T02:52:11Z,3
Day 12: I started this journey on 21 March. I am inspired by all of you lovely people and I got this idea (on day 4) to leave a comment every day after each session. I rarely finish things like this so if I can do it then you can do it. Look for my comment each day and remember you&#39;re not alone. Breathe.,Stefana Lavinia,2021-04-04T11:43:23Z,1
I&#39;m 3 days behind (it&#39;s been 15 days since I started but I&#39;m on day 12) and I&#39;m trying not to let it bother me. I need to remember it&#39;s not about the streak it&#39;s about listening to my body and showing up as much as I can.,Stefana Lavinia,2021-04-04T11:50:00Z,0
Thank you ...!!!,urmila ramakrishnan,2021-04-04T08:40:14Z,0
When I saw it was just 18 minutes long I thought &quot;ho no...this is gonna be a hard one isn&#39;t it?&quot;,crazytlccool,2021-04-03T19:48:02Z,0
"Day 12 very deep and relaxing. Touching words Adriene 👁 👄 🙏🏻 ❤️ “May we always see the truth, speak the truth, feel the truth.”",Beasehole,2021-04-03T12:00:53Z,1
"Today&#39;s practice was hard for me. I kept getting distracted and couldn&#39;t really focus on my body and my breath, but I&#39;m glad I got to the mat today too.<br />Sending all my love to those who are in this day even months after it was uploaded 💛",Daiana Chaves,2021-04-03T01:50:38Z,1
Done with day 12. ❣❣,Self Love coach,2021-04-02T07:29:29Z,0
"I have some wrist pain during downward dog. Not sure if I&#39;m doing something wrong. Otherwise, wonderful practice :)",Nick,2021-03-31T17:32:04Z,0
Easy workout,Vickie Birney,2021-03-31T15:56:12Z,0
I feel like I am actually going to a physical yoga class and Adriene knows exactly what I need that day. This 30 day challenge is the most fun ive had working out 🥺,Katelynn Lee,2021-03-28T16:39:10Z,0
"I love these 30 day journeys ❤️but sometimes less is more with the talking, so much talking during the practice can be distracting.",Amani Refine,2021-03-27T15:24:59Z,0
i love doing these right when i get home from school or right before I go to bed :) thank u for everything adriene!,Audrey Angle,2021-03-23T20:57:33Z,2
Day 12🤓,Nflower Celik-Alvis,2021-03-23T02:38:29Z,0
"Dear Adriene, thank you for all your love wraped up in your practice. Recently my schedule was overwhelming and I started to feel arrhythmia every day, as if being on adrenaline 24/7. Thanks to my best friend who introduced me to your practice and You, my heart started to act normal after first few days of practice. You are Gold, thank you 🙏",Lara Oven,2021-03-21T18:28:17Z,0
&quot;Droooooop&quot; beastie boys...thats what it reminded me of. Love these thank you so much.,bigbadsharkshow,2021-03-17T17:12:05Z,0
Thank you Adriene. Happy to be &quot;getting to know&quot; you as an instructor. It&#39;s nice to be able to close my eyes and be able to listen rather than watch the instruction. Feeling strong and balanced today. I&#39;m only a few weeks into yoga and already amazed. Simply cannot imagine how much I will learn in the coming months,Taylor Hill,2021-03-17T03:30:18Z,0
"Such a beautiful practice this one. Did most of it with my eyes closed for the first time ever. Not intentionally, just that&#39;s what my body gravitated towards and OH MY GOODNESS every move felt ten times easier! I could have planked for days. What a cool realisation! Thanks Adriene. Sending you love xxx",Davidona,2021-03-16T09:11:02Z,0
"Today I felt really stiff and frustrated with myself, but when I saw that the practice was short I was so grateful! And it helped loosen up my stiff muscles. Still had trouble getting a deep breath into the belly but I’m trying to give myself a little extra grace especially since I’ve been having stomach issues and not feeling so well. 💕✨ I’m also grateful that I can use this comment section as a diary of sorts throughout my journey!",Cira C,2021-03-16T05:52:51Z,0
❤️,lakshmi reshma,2021-03-15T13:34:34Z,0
Thank you 🙏🏾 I really needed this xo,Lola Maven,2021-03-15T09:07:00Z,0
"have a good day to all of you, that did this video with me today &lt;3",tulip.raccoon,2021-03-14T10:15:42Z,0
"Day 12 in March! I&#39;m feeling super tired from my week. I do Spin, walks, &amp; just started Callisthenics in the afternoon, and other body weight stuff during my days, so this weekend I was like REST, please, haha. However, yesterday I did my Yoga and now I&#39;m doing this class. I am so determined to complete this 30day challenge, with the intention of doing Yoga daily. I do BJJ, a martial art, and a lot of practitioners do Yoga. I can see why. The movements in Yoga are similar to what we do in BJJ. I think Yoga could be life-changing for me. Thanks Adriene. Your introduction into Yoga has been enjoyable and mind-opening. I like your energy &amp; spirit :)",Belle Princess,2021-03-14T07:57:48Z,2
"I feel sad and tired today&#39;s evening, but I didn&#39;t even think about not showing up. I actually thought &quot;I need yoga to feel better&quot;, and I do feel better now, both emotionally (still sad, but calmer now) and physically (my legs were sore and it felt good to stretch them). Thank you.",Diana,2021-03-13T21:48:15Z,1
I often feel an intense head rush when we go from forward fold to standing or mountain pose. Sometimes it throws me off for a beat. Anyone else?,Cinejar,2021-03-13T19:28:44Z,1
@Stacy Chrys Thanks. Maybe that&#39;s causing it for me too.,Cinejar,2021-03-18T03:54:11Z,0
Hi! Happens to me as well. I have low blood pressure- I just have to roll out of the forward fold really really slowly. Engaging your core as you do it helps also.,Stacy Chrys,2021-03-16T20:08:04Z,1
doing this while listening to singbowls while stoned orgasmic!,Kaiissad,2021-03-13T17:17:22Z,0
"every session is great, but the ending of this session was sublime for me. thank you",Ana O'Connell,2021-03-13T12:01:39Z,0
Your incredible gentle style made me fall in love with Yoga thank you 🙏,yellysbackgarden G,2021-03-13T10:19:58Z,1
Namaste:),judith martinez,2021-03-12T18:42:00Z,1
Day 12  yayy,Dheeraj Tippani,2021-03-12T07:53:34Z,0
This is the longest I&#39;ve stayed on track with something,Janessa Garcia,2021-03-11T04:49:18Z,0
"Don’t give up, no matter what happens try to make time for yourself, I believe you can do this!!",Sunghoon,2021-03-12T20:31:54Z,0
Your videos make such a difference in the world and in so many lives. Thank you!,Creating_ Consciously,2021-03-11T01:21:24Z,0
i really did it omg now I do yoga squats all day just because I can,Melina Borque,2021-03-10T16:39:57Z,0
"Benji excused himself, he had 2 make a couple of phone calls during this vid 🤣",Belly O'So Pregnant,2021-03-10T15:31:19Z,0
I absolutely LOVED that! 🙌 That malasana was incredible! Thanks Adriene! 🙏,Just BE,2021-03-10T14:02:02Z,0
Thank you Adriene! Do you teach online yoga classes?,Roxana Diaz,2021-03-09T21:03:52Z,0
Here in March doing this wonderful practice &amp; It feels so great!!,Osana Wasut,2021-03-09T17:01:21Z,3
If you look at the view counter before and after your practice you can see how many people you were in this class with! For me it was 55 today and i wanna thank all 55 of you for being there with me ☺️ Namasté.,BOEF_BIR,2021-03-08T14:02:16Z,1
That is so cool. Thanks for sharing that. When I am behind in the practice it often feels like I am alone. However 68 people practiced at the same time as me today and that makes me feel more connected to this community.,Julia Kiefer,2021-03-08T15:14:46Z,0
wtf is Adriene sponsored by Adidas now? Really hate that I&#39;m being marketed to during a time when I&#39;m trying to connect to some inner peace and spirituality. Very disappointed in Adriene,N C L Haupt,2021-03-08T08:52:51Z,0
Wow didn&#39;t expect to cry after yoga practice! It came out of nowhere but definitely felt damn good to release!,Indrutee Sypt,2021-03-06T09:41:13Z,0
"i cant seem to breathe through my belly when sitting down. every time i inhale, my belly feels tight.",Julie Jalaluddin,2021-03-06T05:51:09Z,0
Cultivating a beginner&#39;s mind is a very beneficial practice. Thank you for reminding us of that. I bow to you sweet Adriene. Thank you for sharing your wisdom and beautiful practice with us.,Dani Hall,2021-03-03T14:45:36Z,0
"some new muscle feelings today - when i started this made me anxious because i thought it reflected how out of shape i was, but now it&#39;s exciting to discover new parts of myself that i will eventually grow familiar with!",ari koontz,2021-03-03T04:29:18Z,0
Thank you,Bubsonline,2021-03-02T00:53:08Z,0
Trying to enjoy the process instead of thinking about how my belly gets in the way 😂🙏,Holly Dolly,2021-03-01T22:46:04Z,1
"thank you Adriene, you&#39;re exceptionnal!",Louis-Frédérik Gélinas,2021-03-01T13:09:39Z,0
This was wonderful 🙌🏿😍,Aisha Williams,2021-02-28T02:00:08Z,0
"Every time I come to the mat to do yoga with Adriene, I feel like I&#39;m getting together for a rejuvenating moment with a dear friend. Thank you Adriene for being that dear friend. You are a bright part of my daily routine.",Emily Hincks,2021-02-27T17:14:38Z,0
"Ok, as someone whose central value is the truth and who lives surrounded by lies, what she said in the end made me tear up. Thank you for seeing, speaking and feeling it Adriene. &lt;3",skymeli,2021-02-26T14:03:58Z,0
What modification can you make if you can&#39;t squat like that? I have a knee reconstruction that won&#39;t allow me to squat down like that on one side,Karin Duncker,2021-02-25T21:55:10Z,0
"Almost every time when the small talk of Adriene is about self-love, I immediately start crying. Tears coming down because I remember how I forget to practice love for myself and how I mistreat myself by self-judging, toxic relationships. Thank you Adriene and this beautiful community for having my back, encouraging me and doing all these without knowing me personally. I am grateful for this channel and everything about it. Have a nice breath everyone.",Aylin Pınar,2021-02-23T23:20:22Z,2
"All your classes inspire me with nice warm feelings, i always end up with a smile stamped on my face",Claudia Bonaro,2021-02-23T19:12:38Z,0
Thank you so much Adriene for these practices - I thank you for helping us or encourage us to take some moments in our day to connect with ourselves.,Carolina P,2021-02-21T15:33:19Z,0
Another great day. Thanks 🙏,kikt kikt,2021-02-21T14:41:54Z,0
"Hahah, had to do this class  with headphones &#39;cause there was too much noise around, but realized that I could hear your heartbeat at times due to the mic. Funny feeling while focussing on my own breath.",Jacqueline Friebe,2021-02-21T10:02:31Z,0
"Four and three and two and one, when Adrien hits the mat the yoga people come.",Josh Eichen,2021-02-21T02:40:59Z,0
Now I know why last practice was so bad. I got sick. Which for my body means absolute rest is necessary. But I&#39;m back now after a Whole Lot of sleep and ready to tackle what comes. Thank you.,Holly,2021-02-21T02:31:48Z,0
"Thank you, Adrienne- 4 days in a row- yay for me!",Evelyn Mellichamp,2021-02-21T02:23:40Z,0
day 12 !,Amera Ahmed,2021-02-20T14:20:02Z,0
Thanks Madam,himalaya ahuja,2021-02-20T06:11:35Z,1
Adriene you are such an incredible teacher not just of yoga but of being yourself and true self love which isn&#39;t based on image... Just wanted to say you&#39;ve been my teacher for years and I really appreciate you.,erica Bowe,2021-02-19T17:30:32Z,0
Day 12:✔️<br />Doing yoga everyday....is such a beautiful way to love yourself....,Sejal Dhanta,2021-02-19T11:13:34Z,0
"Has anyone noticed that there are no comments with dislikes? Its amazing. Everyone is so kind and genuine here, i love it &lt;3",Nicole,2021-02-19T03:56:51Z,0
"i aspire to have the level of calming, positive presence that adriene has. &lt;3 this series is so good i&#39;m doing it twice! would love if she was to come out with another 30 day journey that&#39;s more intermediate in the future. keep up the great work everyone :)",j_lalune,2021-02-18T17:22:41Z,0
Is it normal my back refuses to straighten doing the &quot;yoga squat&quot; position? Is it better to still do the position without my back straighten or to do a variation? Thank you:),Romane Bergeron Levesque,2021-02-18T04:05:47Z,0
"Day 12, Drop the mic... Adriene, another awesome class!",Artisto Waye,2021-02-18T01:54:39Z,0
Day 12. Late day with making it to my mat. Glad I could make it happen without skipping. Its always just what I needed. I feel I am getting stronger in my poses and feel the overall benefits. I am so thankful. Good day all my yogi friends 💜🧘🏽‍♀️🙏🏽,Lovely Lady,2021-02-17T17:24:58Z,0
"Sending love to anyone and everyone on this Day 12, whether you&#39;re experiencing it now, in a week, or already completed this day... &lt;3",julie tentler,2021-02-17T16:29:54Z,0
Thanks!,Evelyn Mellichamp,2021-02-21T02:21:03Z,0
&lt;3,Fernanda Vieira,2021-02-17T09:17:58Z,0
"Really needed to hear &quot;it&#39;s not the same every day.&quot; I&#39;ve been feeling tired this week: Had a crazy full weekend, lots of physical and emotional work, then top that with hormones, I&#39;m just tired. I&#39;ve been trying to get my groove back and fighting the lethargy, but ya know what... I&#39;m just tired today and that&#39;s okay.<br /><br />Thank you Adriene for the wholesome reminder.",Merissa Kelley,2021-02-17T00:48:41Z,0
"Really needed to hear &quot;it&#39;s not the same every day.&quot; I&#39;ve been feeling tired this week: Had a crazy full weekend, lots of physical and emotional work, then top that with hormones, I&#39;m just tired. I&#39;ve been trying to get my groove back and fighting the lethargy, but ya know what... I&#39;m just tired today and that&#39;s okay.<br /><br />Thank you Adriene for the wholesome reminder.",Merissa Kelley,2021-02-17T00:48:34Z,0
Done!,Chiara D,2021-02-15T21:42:35Z,0
"I love you, Adriene❤️",Gennie V,2021-02-15T16:43:06Z,0
Thank you Adriene 🙏🏼☀️🌺,So,2021-02-15T13:03:27Z,0
"This series of daily practice is really my anchor point right now, I’m feeling low but making it to the mat routinely is helping so much, thank you and may you keep safe, namaste 🙏🏻 Tilly x",Tilly C,2021-02-15T12:42:01Z,0
Wow 😍 really wonderful practice.   I feel amazing!,Kelsey Cameron,2021-02-15T04:29:41Z,1
thank you.,CLUB DE MOTIVACIÓN JC,2021-02-15T00:58:05Z,1
"I wanted to drop a note that although I&#39;ve missed some days due to health complications, I am consciously deciding to show up and catch up. Today I did day 11 and 12 and I&#39;m feeling so energised and ready to go with the flow ;) Thank you Adriene!",Mina Nihei,2021-02-14T15:44:10Z,3
Love you too🤎 thank you for today,xSoReckless,2021-02-14T10:21:52Z,0
"Could&#39;t get the day 11 in yesterday so did 11 and 12 today as the were short enough to squeeze them in my morning schedule and i feel so ready for the week-end !! i love all those practice, they are os great",nola byrne,2021-02-13T12:04:18Z,0
I go a bit slower through the 30 days... this felt so good after a long work day/week!,Maria Moyser,2021-02-13T01:05:54Z,3
Thanks for this practice Adrienne. And thanks for your channel. I’ve been following along with your practices for a few years now and I really enjoy and appreciate what you do. Namaste :),Layer Cake,2021-02-12T23:26:10Z,0
"Anyone else here late to the game and doing the daily challenge in February? Anyways, my body feels amazing after these first 12 days, can&#39;t wait for more! Thank you Adriene!",Emily Mauelshagen,2021-02-12T18:11:17Z,48
@Morgann Kesler same!,ap13 o,2021-04-08T01:08:18Z,0
Doing it in April!!,Morgann Kesler,2021-04-04T20:53:30Z,1
@Ingela Johansson same here,Priyanka Choudhury,2021-03-05T14:22:40Z,0
@Julia Hildmann Same here...,Ingela Johansson,2021-03-04T11:05:06Z,0
"February, sure, March...",Julia Hildmann,2021-03-03T21:16:47Z,3
Love you toooooo Adriene and Benji♥️♥️🥰🙏🏻,Debi Bird,2021-02-12T17:27:03Z,0
"This process is so rewarding. Like many others, I was kicking myself for not finishing the 30 days within the 30 days of January, but when I jumped back into practice, it kinda felt like I never left. Today&#39;s practice challenged me a little but I ended up feeling really proud of myself by the end. I can tell that my body is getting stronger and seeing that is motivation to keep going. I didnt really struggle with the yogi drop which shocked me because it was my first time doing it. I still can&#39;t get my feet flat in downward facing dog yet.",Brittany,2021-02-12T16:20:31Z,1
Día 12 ✅,Víctor Gauto,2021-02-12T15:18:42Z,0
Thanks !,irsute8833,2021-02-12T13:32:18Z,0
Absolutely loving this each day and thank you Adriene for giving us this practice. It’s making a difference xx,Nina Bains,2021-02-12T09:39:49Z,0
"DAY 12: Drop-- &quot;A little goes a long way!&quot; Adriene&#39;s sweet mantra . . so true! The repetition of many moves and postures in this 30-day series is great. I can feel the growth again--on and off the mat. Thank you, dear Adriene!",Patrick T. Randolph,2021-02-12T04:40:18Z,1
"My goala over these 30 days are to be able to touch the ground in forward fold and to drop my heels in downward facing dog. I&#39;m getting there, steadily. Thank you for your wonderful guidence!",Matthew Daltrey,2021-02-10T16:16:54Z,0
"I love how supporting you are, and how you speak with so much love. Thank you for this!",Julie Jenkins,2021-02-10T15:39:02Z,0
"the ending of todays practice made me feel so emotional... not sure why, started crying lol",zoo wee mama,2021-02-10T11:52:24Z,1
"Drop expectations of what something is and seeing the practice for what it is as it unfolds with each breath &lt;3 To see, to speak, to feel the truth... I need to practice this with my heart. Hello heart, I&#39;m here for you. I love you.",shenyen,2021-02-10T06:45:28Z,0
"oh wow, - flow, flow, quick, quick flow :-)......that was energising day 11 :-)",Teresa Harris,2021-02-10T06:20:26Z,0
This is one practice I keep coming back to. It might be my favorite. It&#39;s a little shorter but perfect at the end of a long day when my legs need a little extra attention. Endless thanks for helping us get through the pandemic!,Nora McDonald,2021-02-10T04:46:23Z,0
"Made it to day 12 and I REALLY needed this practice. Today was so stressful with work, but now I feel like a weight has been lifted off of my shoulders. Thank you, Adriene!",Jessica Hale,2021-02-10T01:34:56Z,0
So i&#39;ve found I like to take things just a little bit slower so I slowed the video down to .75 speed and I cant stop giggling because you sound drunk! Love ya Adriene!,Emily Sauer,2021-02-09T16:00:00Z,1
I fell off for a few weeks but picked back up today and it felt so great!!! I’m determined to complete this 30 days!!,Marcus Jamison,2021-02-09T15:19:53Z,0
Gosh how I love you,Morgane,2021-02-09T09:53:56Z,0
Ah I love you lol,Chloe Cox,2021-02-09T07:32:15Z,0
"I really needed  to hear today that sometimes is ok to drop my expectations. Just this morning I felt a little discouraged because has been 12 days and I don&#39;t see any improvement, it&#39;s still too little time, I have to be patient and enjoy the connection with my body. Thank you Adriene 💕",Grazia Di Nola,2021-02-09T06:22:08Z,0
Wonderful thank you 🙏🏻🧘‍♀️😍,Joanna Johnston,2021-02-08T10:53:51Z,0
"Oh I am so much behind, took 36 days to do 12 sessions...","Love, Earth & Christina von Dreien",2021-02-08T08:54:21Z,0
"Ugh, super bowl sunday.  still made it.  Thank you.",Will Larson,2021-02-08T03:33:21Z,0
Thank you for sharing your bright loving spirit!  You truly are touching my soul...sending much love ❤️,Mara Levene,2021-02-07T19:25:34Z,0
