comment,id,date,num_likes
"I just want to say how thankful I am for the yoga content. I first discovered this channel about 2 years ago while recovering from chronic back pain,  hepatitis and addiction, over the last year, I have practiced everyday, and from the bottom of my heart I know that practicing yoga with you has helped me on my journey of recovery. Namaste",jacob cook,2021-01-15T07:30:10Z,0
"I love your outfit, Adriene! &lt;3",Empyreal White Rabbit,2021-01-15T07:16:34Z,0
"&quot;No matter what&#39;s going on, no matter what it looks like, let&#39;s raise the thumb to the third eye&quot;. Always serving our best, highest self. Love this! I shivered with the truth on this one!",Alejandra Pro,2021-01-15T05:29:13Z,0
depechemode,monyque lima,2021-01-15T04:58:11Z,0
I been a student of yours for a year already and the changes are visible both in my mind and body. Your kind reminders of using this time of practice as an expression of self love have me wanting to spread your message of positive and kind understanding myself. This is a year when I want to become a yoga teacher and spread your lesson of self love and feel good yoga. Thank you Ariene for guiding me on this path of self discovery and love. I hope I have the chance one day to tell you this words in person but for now many blessing and stay safe,PXL,2021-01-15T03:42:40Z,0
I definitely felt sore today and honestly did not want to come. I feel alot better now that I did it and I am glad I did 😌,Alyson G,2021-01-15T03:41:14Z,0
Yesterday I was dealing with terrible menstrual cramps so I couldn&#39;t make it to this practice :( I did my own little practice to try and ease them but I&#39;m here today feeling better to catch up!,Charlotte Daum,2021-01-15T02:58:23Z,0
"I don&#39;t workout for the longest time and this year I decided to do yoga everyday and been following your videos everyday. I am so much happier physically, emotionally and mentally. Coming to the mat everyday and hearing your voice keeps me sane and feel like seeing a friend even though, you don&#39;t know me. But it&#39;s so pleasant and comforting. God bless your soul Adriene. Thank you for your awesomeness ❤️❤️❤️❤️",Tao Mskn,2021-01-15T02:48:17Z,0
"lovely, Adriene! Thank you so much.",Kray Hey,2021-01-15T02:25:02Z,0
love that high pony braid !,Zeff Llamas,2021-01-15T02:05:40Z,0
🌼🌼🌼🌼🌼🌼🌼🌼🌼🌼🌼🌼🌼😘😘😘😘😘😘😘😘😘😘😘😘😘,Hussien Alsafi,2021-01-15T01:29:12Z,0
Apres une bonne séance de YOGA   ..... une méditation en complément et vive la vie et le bien être absolu !,ZEN7 Méditation-Musicothérapie & Sonothérapie ASMR,2021-01-14T22:54:03Z,0
Day 10 of hotel quarantine in Australia today - this is helping me through it! THANK YOU 🙏🏻,Iris Verschoor,2021-01-14T22:14:28Z,0
"Ahhhhh! I have always struggled with boat pose and when Adriene said boat pose, I thought &quot;UGH! I can&#39;t even...!&quot; But guess whhhaaaat?? I was able to stay in #3 for the whole 10 second count down! Happy Day! Hope everyone can find at least a sliver of happy today! Love to all of you!",Kerry Backes,2021-01-14T22:04:51Z,0
Been practicing since day òne and feel great. I have no expectations but practice because it all comes along!,Yossa YSU,2021-01-14T21:53:30Z,0
🙏🏼❤️,R,2021-01-14T21:46:45Z,0
why drop expectations when you can expect to feel good and then do it and wah la you do feel good,Vincent Himself,2021-01-14T21:46:09Z,0
adrieneee i love this one,Idalis Molkera Ibrahim,2021-01-14T21:11:37Z,0
Thank you Adriene!,Allison Ehrhart,2021-01-14T20:34:43Z,0
These January practices have been a blessing. Thank you so much Adriene and Team.  The best part is that my 15 year old niece is doing it too and she is enjoying it.,nicsummer66,2021-01-14T20:29:28Z,0
I took my time to drop in and get on to my mat for this practice. I&#39;m glad I did and I am very grateful for Day 12 DROP Practice.,Charmaine Castanos,2021-01-14T20:07:21Z,0
"first time I did the yogic squat this easily! its usually frustrating and painful for me, feeling my muscles to be very tight. but today suddenly it really felt like a drop, unexpectedly open :) love being on this journey with everyone. thank you adriene &lt;3",birdinafishtank,2021-01-14T20:04:05Z,0
"Pretty cool today.   That felt GREAT,",SportsDoc DC,2021-01-14T19:49:47Z,0
"I&#39;m so proud of me. I&#39;m doeing this, yyyeeeessssss. I love it.",Lydia R,2021-01-14T19:23:03Z,0
"We showed up. You did amazing. Little changes, give big results. <br /><br />If you&#39;re new here, remember to be patient with yourself. Go with the flow. Be present. You got this 💛 <br /><br />Thank you Adriene ⭐ namaste 🙏 x",Clare Cavalli,2021-01-14T19:07:34Z,0
Short and sweet but it was perfect thanks 🙏🧘‍♀️,Karen Bygate,2021-01-14T19:06:25Z,0
"I am overweight, sedentary, totally un-flexible, and not going to lie - I still struggle to sit cross legged and have not yet mastered the downward dog for more than a few seconds. But somehow Adriene, you make me feel that this is okay. I just need to keep &#39;turning up&#39;, keep attempting the moves, and I will get there, hence I still haven&#39;t thrown in the towel. In fact for the first time in my life, I actually look forward to this exercise, and that is a complete about turn for me. So thank you SO much Adriene. My sister put me onto you, and although she is in a different time zone, as are you, our &#39;carved out time&#39; still makes me feel so connected to both of you. You are a wonderful human being, and it shines through the screen.",Tina Goodship,2021-01-14T18:54:32Z,0
You always touch my spirit and keep my calm. I would so much love to be tough as a yoga teacher by you 🙏🏻,tinzstar,2021-01-14T18:54:15Z,0
"I Love your yoga!  You are a guru so humble and sweet, lively and full -  thank you for sending your love and i send you mine!<br /> i live in Prague my bfriends are in Florida, Toulouse France, and Frankfurt Germany ... we see each other but once a year and now in this pandemic we havent and wont for a while-  so  weve decided to do your yoga practice together-  it  has made us so much closer.  We share some time and movement together  i also love the fact that im doing it with so many of you!  Somewhere somone is doing it too, it feels good especially  during these european lockdowns to feel others around, you are a wonderful medium,  thank you thank you thank you!",Katja Krizek,2021-01-14T18:22:07Z,0
"I heard that Yuh! Yuh! Oh, Adriene",Talon Florig,2021-01-14T18:18:26Z,0
Merci 🙏,Evelyne Turgeon,2021-01-14T18:00:51Z,0
"a day behind of schedule... anyone else with me? 😅 i skipped yesterday because the last practice was really hard for my lower back, maybe it was too rough and i was too sloppy i don’t know.. but here i am now! the slow pace was perfect for me and i really tried to listen to my body and be mindful about my core and foundation and how i move. :) namaste",Tiia Vallinkoski,2021-01-14T17:59:14Z,2
"I&#39;m doing Breath along with four friends and family.  We created a little Messenger group so that every day we can report in, encourage one another, and comment on how we found each day of Breath.  It&#39;s been an amazing experience in these isolated times.  While the bigger YWA groups are fine, being accountable to people I already know well is particularly motivating.  Already more than once someone messaged that they were just too tired or stressed to do Breath, and the rest of us encouraged them to the point that they found the time, and then posted that they were so thankful for showing up on the mat!  We get to laugh together, too--when one of us complained about how they kept blowing snot out during alternate nostril breathing, or another about the fact that we can hear your heartbeat through your mike during the quieter parts of the practice :)  This is the next step for me with yoga--one of the friends in this group told me about you at the start of the pandemic, and I&#39;ve been appreciating your approach and your wonderful videos ever since.  Doing Breath live, with others, is helping me get more comfortable, as well as stronger and more flexible, in my own skin and muscle and bone...and spirit!  Thank you for always reminding us to listen to our own bodies and not discouraging us with impossible pretzel goals.  And thanks for all your thoughtful, generous work, Adriene!",Heather Looy,2021-01-14T17:54:21Z,1
"I’m a day behind on this journey. As always, this was exactly what I needed today. Adriene, you are such a needed light in the world! You are making this “older” body feel “younger” again! 😊",Sandie Mack,2021-01-14T17:53:22Z,0
"I had to miss 3 days over last weekend, and felt so disappointed, but I was able to make up the classes this week and an back on track. I am truly loving this 30 day series with you!",Susan Tomaine,2021-01-14T17:42:41Z,0
"I am just trying to get into this one today but I am so distracted by my feelings about my body. I am currently isolating with covid. Before xmas I put on some weight. I thought I would do the 30 days of yoga as a mindful way to move my body and hopefully connect with breathing, love for myself and moderate eating etc. So with being isolated and moving less, and having no taste or smell, I feel very depressed. I just sat on the mat and could feel my boobs and belly hanging over and crushing together and I feel so disappointed in myself for letting my body get to this level of discomfort. However, I also know that wellness begins in love. Does anyone else struggle with this? I will just push through it but needed to reach out. I am sitting here just so upset with myself for letting the fat onto my body. With love",Shonet Hockley,2021-01-14T17:24:29Z,0
"Thank you so much, Adriene. I am loving this 30 day challenge yoga.   You have been a god send in these challenging times. The last 10 days have miraculously helped me, having had trapped nerve in the neck from working from home since last April. The last 3 days I have been able to sleep must better!!!! Thank you!!!!",Rita Patel,2021-01-14T17:11:15Z,1
"I did this practice after my workout. I was feeling sluggish and frustrated today but this really lifted my mood. Thank you Adrienne, see you tomorrow",Anna Felicity Ewing,2021-01-14T17:05:17Z,0
Loving this journey so much.  Getting me through these dark January days.  Thank you so much.  Sleeping better too after months of poor sleep,Chris Veats,2021-01-14T16:58:09Z,0
"I fell a day behind because I got sick. I credit the last 90+ days of daily practice with allowing me to know I needed to take the day off and let my body rest. No shame. Just love and gratitude for myself, Adiriene, and all of you!",windjourney,2021-01-14T16:32:43Z,2
Thank you Adriene! Feeling good. Feeling bright! Keeps my rhythm smooth even on the harder days. Enjoying so much. Peace and Joy to you.,Beth Strenkoski,2021-01-14T16:24:46Z,0
"Doing this practice a day after, but still persisting on showing up at the mat, anyone with me? .<br />Thankful for being part of this community. Namasté",Pao Aja,2021-01-14T16:16:37Z,24
"...and even much later after you! ;) It`s beautiful to think that there will always be people that do that exact sequence before, with and after you, like you`re moving in a secure net woven out of love and breath all around the globe. Hope you are enjoying your journey! &lt;3",Nora Jasna,2021-02-01T23:08:47Z,0
11 days behind! Sticking with it and showing up even though I have missed some days. Namaste,Ida Lovise,2021-01-23T10:48:54Z,0
I&#39;m three days behind but still showing up!,Kaycee Nay,2021-01-16T18:51:52Z,1
Forgot to ✅ yesterday as done. Love those yogi squats!!!,raelyn earnest,2021-01-14T16:03:13Z,0
"Today was my day 12, and it starts my day in the most fulfilling way by dropping into my breath. I don&#39;t remember the first time I heard you say Adriene &quot;breathe love in, breathe love out,&quot; but it has always stuck with me and brought me an extra sense of calm and a reminder we are all loved.",Ashley Downton,2021-01-14T15:13:45Z,2
Love you to Adriene! 💕,Candi Haas,2021-01-14T15:00:31Z,0
I love the yogi squat! Thank you for all you do!❤️,Anita Beckner,2021-01-14T14:56:14Z,0
💖💖💖🙏🏼,Dawn Schenk,2021-01-14T14:00:21Z,0
Yes - this was just what I needed today - my first early am practice and extra special to share this one with you all  -,Candace Shelley,2021-01-14T13:53:44Z,0
How do you know it should be a short and sweet day? How? It was a perfect petite sized session today with focus on the most challenging area for me- Hips. Thank You Adrienne!,Anuradha Srikantan,2021-01-14T13:48:58Z,0
I got this done yesterday. I dropped it like it&#39;s hot. 😂,Jessica Steinman,2021-01-14T13:45:32Z,0
I had a really hard time showing up yesterday but it was exactly what I needed!,Danyll Donnell,2021-01-14T13:34:41Z,0
May we always see the truth... may we always speak the truth.... may we always feel the truth. Yeah.... simple but oh so powerful words... thank you Adriene. ~namaste sending love to everyone! xoxo,A Lochetto,2021-01-14T13:27:49Z,0
"Day 12 <br />Drop<br />I drop in a lot today...<br />Thank you Adrienne, have a great day :)<br />Namaste<br />Dosia",Dorota Misiewicz,2021-01-14T13:25:23Z,0
"you speed my day with all the goodenergy after my practice, LOVE YOU ADRIENE! YOUR YOGA IS AMAZING GOOD IN PEOPLE LIVES !!!",Tayri Castro,2021-01-14T13:19:33Z,0
lots of love to you and benji!,Aránzazu Ascunce,2021-01-14T13:12:49Z,0
What a lovely close today.,Rae K,2021-01-14T12:44:39Z,0
Thank you 🙏 lovely practice and glad it was short today energy low so just enough to bring myself into this daily practice 🧘‍♀️💝🙏,Alex Mellon,2021-01-14T12:43:30Z,0
thank you!!!,Tilsa Ponce,2021-01-14T12:37:17Z,0
THANK YOU !,colormetruth,2021-01-14T12:02:21Z,0
Really enjoyed the bit at the end about seeing speaking and feeling the truth. I will be incorporating that more into my practices 😁,Megan Wilkes,2021-01-14T11:52:49Z,0
Today’s practice brought so many emotions to the surface. Thank you for leading this beautiful journey.,Anika Johnson,2021-01-14T11:43:56Z,0
Day 12 done!!! Yaaaayyy<br /><br />Question for Adriene: do you have bloopers of Benji blocking the camera while you&#39;re recording? He seems to be used to seeing you doing yoga in front of a camera so he&#39;s always chilling at the back 😆,M,2021-01-14T11:20:23Z,0
He knows the frame. Total pro.,Yoga With Adriene,2021-01-14T20:17:50Z,1
yesterday i was very low and turned in early and suddenly thought OMG I skipped on my yoga today. so I did the 6 minute sleep yoga and this morning chcked in for yesterdays class. still going!,M. Alexander,2021-01-14T11:04:23Z,0
The end was just perfection. Thank you 🥺🥺🥺,Shmyla Khan,2021-01-14T10:57:32Z,0
Thanks a lot ! From Malaysia to France your nice energy is supporting me in all my life challenges and happiness.,AUBIN DELPHINE,2021-01-14T10:49:40Z,0
"Adrienne, I just want you to know how much you are helping me in my mourning of my husband this past year.  I found you on You Tube and I&#39;m so glad to start my yoga practice again.  Love to you!💓",Cherie Calvird,2021-01-14T10:20:30Z,0
Thank you. Once more. 911pm day  12. Jan 14. It feels different in the evening than the morning. I will now move knee to center in that lungie twist. Good for me to integrate that into other practices.  I&#39;m always doin&#39; the lungie twist.  ♥️🙃,Caitlin Byrne,2021-01-14T10:15:20Z,0
"Since this series is all about breath, it may be interesting to note that the diaphragm is a dome-shaped muscle of inspiration attached to the bottom of the ribs - when you  inhale, the diaphragm actually contracts (not expands) and pushes the abdominal contents down and outward (hence the feeling of expansion). When you exhale, the diaphragm relaxes and the abdomen is naturally drawn inward.",R Al-Mutairi,2021-01-14T09:59:30Z,0
"Dear Adriene, I feel so lucky for having found you and so grateful for the yoga sessions you share with us, so thankful for this journey. All love to you and Benji. Thank you!",wanna arkd,2021-01-14T09:58:35Z,0
"I wake up at 5am everyday, an extra 30mins to an hour earlier to be able to show up for myself and for this beautiful journey we are undertaking. So worth it!!! Thank you A!",Cria Lorenzo-Del Castillo,2021-01-14T09:37:46Z,0
"I really enjoyed today’s practice! Whenever I think of the word ‘drop’, I imagine myself falling into this giant, watery teardrop and it’s as if I can hear that ‘plop’ sound and being surrounded by water, and then floating, in a really quiet and nice way. It makes me feel safe and at home.",Qian Hui,2021-01-14T09:34:01Z,0
Everyone is doing wonderful! Im so blessed to be doing this with all of you. Much love 💛,Jory A,2021-01-14T08:52:55Z,0
"Much love to you, Adriene &lt;3",Amy O,2021-01-14T08:50:04Z,0
"I was pleasantly surprised today to realize how much strength and control I’ve gained already - holding the short planks today was not torturous, and down dog actually felt like a resting posture for the first time!",Mara Kenyon,2021-01-14T08:23:51Z,0
🙏🏻🤍,Mary Rabêlo. S. Wagner,2021-01-14T08:10:32Z,0
"I was a little apprehensive about the title &quot;Drop&quot; for today. I saw the picture of Adriene&#39;s squat and thought all the things. &quot;Oh no. Squats.&quot; &quot;Ugh, my knees are not going to let me do this.&quot; and on...but then during the practice, my thoughts turned into, &quot;Wait, this feels strong.&quot; &quot;I&#39;m totally doing it!&quot; &quot;OMG, my heels are even touching the ground...whaaaaaaaat?!&quot; and &quot;I think I just enjoyed a squat. Who even am I anymore?&quot; Sorry for doubting you, Adriene! (Sorry for doubting you, body of mine!) I am so grateful for this community and for this Breath journey right now!",Mandy Duncan,2021-01-14T08:03:53Z,0
"Thanks for bringing me to this place and time. I am learning lots and realising that, led by your practises, I am accepting my limitations without frustration. Wishing I’d met you when I was in my 30s, but you were a babe in arms ☺️. Please continue to help us to help ourselves to find what feels good. This in turn will help the society we live in. Thank you again 🙏🏼",Marion Yeaman,2021-01-14T08:01:32Z,0
Plank pose is not my forte but today I did it ... That last yogi pose brought so much peace that cannot be defined. Forever grateful.<br />Thankyou Adriene 🙏🙏 Sending love to all from India,Palak Jain,2021-01-14T08:01:02Z,0
"I love this flow, but I did find the low squat at the end almost impossible.  I strained my left quad and hamstring just over a year ago and whilst flexibility is improving this proved very uncomfortable in a bad way 😣.",Allyson Chorlton,2021-01-14T07:49:18Z,0
so proud of us for making it to the mat today!!! sending immense amounts of love!!!,soahfrom5to7,2021-01-14T07:37:18Z,1
Wow I generated some heat today 🔥,Karen Garry,2021-01-14T07:32:41Z,0
"Since 1st january, I do yoga with Adrienne and it is sooo delicious...I try to be présent everyday. We love u❤",invest in women,2021-01-14T07:26:42Z,0
Who else was feeling a bit down or not wanting to practice but was so glad they ended up coming to the mat! Great job everyone were all in this together! 💕💕💓✨😇💛🙏🏻,Gingeram !,2021-01-14T07:10:28Z,1
So inspired to continue on this beautiful journey with you. I eagerly await every daily session. Feeling blessed!🥰,Connie Sanchez,2021-01-14T07:08:55Z,0
Day 12 was small but good,Tabassum Wazir,2021-01-14T07:07:16Z,0
Caught up and it feels so good. Shocked at how well my knees did in the yogic squat! Yay! Namaste 🙏,Malisa Mendez,2021-01-14T07:01:13Z,2
Thank you 💚,Patricia Hogan,2021-01-14T06:52:55Z,0
"Just when I thought you were going to go with some “See the truth, speak the truth…” I was thinking “…hear the truth,” and you said “feel the truth.” That moved me, and I realized anew why it is I love yoga. Thank you. 🙏🏻",Malcolm Forbes,2021-01-14T06:51:32Z,0
Heart: *smiles&quot;,Andrea Yanase,2021-01-14T06:37:03Z,0
"See the truth, speak the truth and feel the truth... I need it, raise awareness at this point in my life 🙏",Jule R,2021-01-14T06:24:44Z,0
Good but hard and relaxing at same time if that makes sense,Lillian Coghill,2021-01-14T06:20:46Z,0
"First, thank you so much for all these videos, super helpful! certainly keeps me going. I love all the tops you wear, including this green sweatshirt, can you please share where we can get these?  thx again!",Riki Cohen,2021-01-14T06:20:18Z,0
I waited expectantly hoping Breath Day 12 would arrive in time for me to follow it before my serious day of heart checks. DROP arrived. So good and so apt. Thank you. <br />Im repeating it today before more tests. (Day 13 will wait..)  Really need it. <br />Lots of love. Big thanks. Stephanie. <br />Im thousands of miles from home and solo.<br />Send me love and hugs please.,Stephanie Spiers,2021-01-14T06:15:03Z,0
Short but fulfilling ❤ it&#39;s always a good decision to show up on the mat!,blessieva,2021-01-14T06:06:26Z,1
i don&#39;t think i&#39;ve ever gotten so low in child&#39;s pose before,Lauren Oglesby,2021-01-14T06:02:03Z,0
I missed yesterday so I did that one this morning and this one tonight. I was looking forward to it all day and brought out the mat after I put the kids down to sleep. Am so thankful for this practice today!,Rene' Yeung,2021-01-14T05:58:29Z,0
I hope these get longer 😓,Liz,2021-01-14T05:51:03Z,0
Wonderful practice today!!! Thank you as always for bringing your full self to these! ❤️,Jessie Threlkeld,2021-01-14T05:37:56Z,0
What a gift you have given all of us Adriene,Mieka West,2021-01-14T05:29:56Z,0
"Guard and protect your beautiful spirit, lovely Adriene.  I hope you have someone to help.",Jeffrey Riley,2021-01-14T05:26:37Z,0
Magic,Juniper Antares,2021-01-14T05:23:11Z,0
"Really love all the videos, it&#39;s super duper helpful. I&#39;ve been watching videos from this channel since a really long time and i love it. Been doing the 30 days challenge and its feels like a breeze.<br /><br />Suggestion: sometimes there&#39;s too much voice over in the videos. It would feel really great if there was some music instead which helps in focus",Anshu,2021-01-14T05:21:44Z,0
I was waiting for this froggy position:) Thank you Adriene ❤️,Kateryna Mashchenko,2021-01-14T05:20:11Z,0
"Just did yoga at home with 2,212 other people! 😀🤗🙏 what a great feeling! Thank you Adriene 💗",Melissa May,2021-01-14T05:17:57Z,0
"Exactly what I needed today: short, sweet, calming, and grounding.",Elizabeth Mei,2021-01-14T05:15:13Z,0
This practice made me smile 🙏❤ Thank you adriene💫,thepretty rose,2021-01-14T05:14:01Z,0
"Great practice today! I was have been sore and achy the last couple days so I was not looking forward to today&#39;s session. However, the practice you designed for today actually targeted those areas and I feel a bit better already.",k64632,2021-01-14T05:05:16Z,0
"Adriene, I woke up late this morning and didn&#39;t have time to do your session in the morning, and got caught up in my day so that I didn&#39;t think about doing it until it was time for me to go to bed. I really wasn&#39;t feeling it, but I saw it was 18 minutes and I got myself on the mat and it turned out to be just what I needed before I went to sleep. ty for this journey!! it&#39;s my first time doing this with you, but it&#39;s already helped me so much and I feel so much calmer and centered after every session.",Victoria Knight,2021-01-14T04:59:26Z,0
I feel taller after this practice! 😆,Anastasia,2021-01-14T04:51:23Z,0
Thank you. I feel so much better,Trish Page,2021-01-14T04:49:15Z,0
Great yogo lesson! And such a cute doggy!! &lt;3,Kaylah Davis,2021-01-14T04:49:06Z,0
Thank you!!!!!!,T D,2021-01-14T04:48:46Z,0
my favorite practice so far! I didn&#39;t want to do it because it was a very long day and I got home from work really late but I did and I am so glad I did because it was so worth it! Thank you!,Alexis Fiorentino,2021-01-14T04:48:12Z,0
"I loved this practice, short and sweet! thank you so much 💗🙏🏼",Myra L,2021-01-14T04:47:01Z,0
"Your yoga has saved me during covid and exercising from home. You are my go-to person for grounding and guidance. I&#39;ve been practicing yoga for over 10 years, but never so consistently as with you online. Thank you! (Always LOVE seeing Benjie come and go in your videos!)",Linda Anderson,2021-01-14T04:45:23Z,0
"I&#39;ve been doing yoga since I was a kid, like 10-11. I&#39;ve been watching you since high school. This is the farthest I&#39;ve ever gotten in the yearly challenge. I&#39;m so ready to do this whole month! Thank you for helping me learn a little more discipline",Sophia Casanova,2021-01-14T04:44:20Z,0
Did I...? Did you...? Was that a Beastie Boys reference?,Chris Tollinger,2021-01-14T04:43:29Z,0
"Only 11 days of straight yoga and I am sleeping sounder, waking more rested, experiencing less back and joint aches, slower to anger/frustration, and feeling/practicing more gratitude. Thank you Adriene.",Kari Mackey,2021-01-14T04:39:05Z,0
Almost didn&#39;t make it but then I diiid.,cara sheridan,2021-01-14T04:38:44Z,0
How did you know that i needed that &quot;I love you guys&quot; today. And the crazy thing is that I know you mean it!,Chani Lior,2021-01-14T04:30:36Z,0
Loved the class today! &lt;3,Sadie Wolfe,2021-01-14T04:18:45Z,0
