comment,id,date,num_likes
Here are some writing prompts if you would like to take some time to write a few words about your journey:<br /><br />So far my experience is best described as….<br /><br />I am learning to honor… <br /><br />I am learning to celebrate....<br /><br />I felt/I am feeling…<br /><br />Almost to the halfway mark!,Yoga With Adriene,2021-01-15T14:40:21Z,625
I am learning to honor my soul...🌸<br /> I am learning to celebrate  my inner  serenity..🌸<br /> I am feeling  new evolved me..🌸<br /> I&#39;m  glad that we have completed  half  of our journey🌸,Kumkum Singh,2021-04-29T05:35:58Z,0
Thank you.,Fer-De-Lance,2021-04-19T15:43:44Z,0
Enjoying the 30 days of yoga. I love your purple adidas yoga pants in day 14. I’ve been searching for them online. Where did you get them? Thank you and thanks for the calming yoga.,Debbie Smith,2021-04-14T20:08:20Z,0
Anyone know what the intro/outro track is? No luck with google.,Jesse Kaltenbach,2021-03-24T18:23:18Z,0
"I am feeling frustrated that my knee still hurts. I want to learn to honor my body for what it can do, not punish it for what it can&#39;t.",Serena Collins,2021-03-15T17:26:12Z,0
This was my favorite practice so far in the 30 day journey! So I did it 2 days in a row... 😊🙏❤️,"Barbara Gail - The Drum, The Song, The Dance",2021-05-08T03:48:08Z,0
"when we laid down and you said to just receive al the nutrients this practice has given, I FELT THAT. new mantra and intention for each yoga practice! this is what gets me out of bed every morning, thank you.",Roisin Sousou,2021-05-07T14:28:21Z,0
Wow! Thank you. 🙏,Yvette Bennett,2021-05-05T17:45:40Z,0
Adriene you make my day. I Thank you every day!,June Haynes,2021-05-05T14:41:15Z,0
"I never thought Yoga could have such a profound impact on my daily life. But I am so glad that I was wrong. The past two days have been rough, so the short practices were appreciated. But Adrienne always knows when you can handle a longer practice again. Thank you, namaste 🙏 💙",Suus,2021-05-04T08:05:03Z,0
"Thank you for such an incredibly well informed knowledge of the practice, the body and the heart of yoga. I really appreciate the way you let the asanas and the breath be the teacher. I am recovering from long COVID and an autoimmune glitch. The thirty day series of all varieties have been a true gift in building back strength and joy. Thank you!!!",Leslie Whitcomb,2021-05-04T02:32:37Z,0
So far my experience is best described as REVELING,Adriana Zamora,2021-05-03T11:41:19Z,0
"I&#39;ve started my yoga journey with you (a bit late) and I certainly don&#39;t regret it ! I couldn&#39;t believe I would go so far, and keep going ! Thank you for everything. Quick question though. The pose at <a href=""https://www.youtube.com/watch?v=PVJtNPVq26Q&amp;t=16m15s"">16:15</a> is really hard to keep because it hurts my knee. Any advice to make it better ? Thanks !",bzzbzzz,2021-05-02T07:50:23Z,0
Best lesson so far! Thank you!,Fabiana Mei,2021-05-01T16:19:11Z,0
yummilicious practice &lt;3,Samarpita Roy,2021-04-30T02:49:28Z,0
"Gracias, gracias, gracias!!",Felipe Vallina,2021-04-30T01:45:25Z,0
Thanks a lot Adriene! Yoga change my life,Michelle Mesri,2021-04-29T23:26:50Z,0
Really enjoyed this one. It was more difficult on my wrists than usual. Going to have to go back and practice this one again another day to figure out how I can improve my poses to reduce the affects on my wrists. Overall enjoyed it even with that,Lora Edmiston,2021-04-29T16:37:35Z,0
so good,Özlem Altun,2021-04-24T21:06:38Z,0
It was so yummy and inspiring! Thank you &lt;3,Sümeyye Kavuncu,2021-04-24T18:55:13Z,0
Absolutely in love with this practice &lt;3 &lt;3 So super yummy!,Tereza P.,2021-04-23T21:01:17Z,0
This one was tough. some days more of my energy goes to managing my thoughts than doing the poses. i got caught up in this voice in my head shouting I DONT WANT TO BE HERE. but the mental peace in corpse pose is always worth it,Zoe Kim,2021-04-23T20:54:14Z,1
Today it was really difficult to start and I got grumpy when I noticed it was 36 minutes. But I am so happy I pressed play! This was a really nice one and it made my day much better ❤ Thank you!,LittleMissTotoro,2021-04-21T15:54:43Z,1
there’s no way that was 36 minutes,leah,2021-04-20T19:45:24Z,0
"Whenever I come back to these videos, they&#39;re always what I need that specific day. Thank you so much, Adriene and the YWA-community. Your videos have truly changed my life!",Anna Eline,2021-04-20T17:24:29Z,0
"Adriene, thank you. &lt;3",Sarah Lalande,2021-04-20T00:13:09Z,0
Let go of negativity through each exhale <br />Thank you namaste,honest by self,2021-04-17T03:47:50Z,0
"This is a great one! I did it in the semi-dark, in my daughter&#39;s room (she&#39;s remote schooling today in the living room) and it&#39;s raining...so peaceful. Thanks so much Adriene!",Amy Carroll,2021-04-16T13:29:15Z,0
Sending love to all! Namaste,petithobbit,2021-04-14T23:49:13Z,0
I&#39;m a beginner at yoga and I started following you and believe me every time I finish I feel like I&#39;m free I&#39;m happy and I can&#39;t wait for the next day thank you so much for everything you&#39;re doing it ❤❤❤,racha mery,2021-04-14T22:33:03Z,1
Sending love to you (14/4/21),Salima D'Antuono,2021-04-14T21:49:56Z,0
Enjoying the 30 days of yoga. I love your purple adidas yoga pants in day 14. I’ve been searching for them online. Where did you get them? Thank you and thanks for the calming yoga.,Debbie Smith,2021-04-14T20:05:27Z,0
"Whew ! Made it to the mat , 🤔ne never knows how much comes up when it&#39;s time to get to this mat .But I got here and made it though.",David Cates,2021-04-14T20:04:52Z,0
"2 weeks down, baybeeeeee! Sending out wonderful thoughts to anyone else currently doing this for April and all those in the future or the past that are going to do it or have already done it! :)",SugarsipWoodlouse,2021-04-14T13:44:46Z,1
"This was my favorite session you&#39;ve done, ever! All my favorite poses, and such a helpful theme to focus on. Thank you!",Joanna Nadeau,2021-04-14T13:15:28Z,0
I feel incredible after this practice. Thank you so much for this.,Mikaila Hamilton,2021-04-14T04:35:14Z,0
Namaste :),judith martinez,2021-04-12T17:49:47Z,0
Love love love this practice! Namaste!,Bruna Cavalcanti,2021-04-12T12:32:10Z,0
Thank you Love!!❤❤❤ ✨,Narayanamma M,2021-04-11T03:16:34Z,0
"Thank you so much for your brilliant yoga videos, I love them and I love yoga. I&#39;d love 30 day night time challenge, that would be extra awesome xxx",CARMEL ASHMORE,2021-04-09T07:22:09Z,1
🙏❤️,Clare Lora,2021-04-09T03:05:53Z,0
TODAY WAS AWSOME!!!,Negin Msh,2021-04-08T16:09:29Z,0
Thank you..!!!,urmila ramakrishnan,2021-04-07T04:55:12Z,0
Those 36 minutes flew by!,crazytlccool,2021-04-06T02:33:27Z,1
"Dear Adriene, everything in your videos are perfect except for the &quot;E&quot; ´´s with this font. I love your swagger your kindness and your dog. Greetings from Germany.",Felix Anton Faller,2021-04-05T13:24:41Z,0
hey to the 87 people who practiced with me today 🥰🥰🥰,Renee Aharon Art,2021-04-04T20:55:04Z,1
I’ve been having a lot of pain in my right shoulder so came back to this practice. Wow! Exactly what I needed.,Samantha Simmons,2021-04-04T17:04:08Z,0
thanks adriene xx,Em Q,2021-04-04T09:59:34Z,0
"<a href=""https://www.youtube.com/watch?v=PVJtNPVq26Q&amp;t=35m57s"">35:57</a> &#39;all most at the half way mark here guys&#39;<br />me : mini panic thinking it was half way through the practice not week.",Em Q,2021-04-04T09:59:24Z,0
Enjoyed todays so much! I was having a hard day and really needed to remind myself I don&#39;t need to feel small. Cheers to the 58 others who did this with me just now &lt;3,Sarah Carter,2021-04-03T21:50:27Z,0
"Thank You for this practice,I feel the new is coming to this fresh creating space.&lt;3",H B,2021-03-30T10:09:33Z,0
"Good Morning, thank you for the practice! Wish everybody a nice day!",Anastasia Babenko,2021-03-30T03:25:58Z,1
This lovely practice is going to my Save folder; it is perfect to add Space whenever needed...,Shelly Keyes,2021-03-29T01:47:59Z,0
"Wow, today&#39;s practice was absolutely incredible! If you told me I&#39;d be doing all of this two weeks later on day 1, I wouldn&#39;t have believed it! My body is holding up much better than I thought it would, can&#39;t wait to continue tomorrow!",Kally,2021-03-26T15:24:27Z,1
"Started sobbing at the end when you talked about accepting the love that’s to come. This morning I was listening to a year-old episode of Unlocking Us podcast. Brene Brown and Turana Burke were talking about how HARD it is to accept love. The coincidence feels divine. Here’s to accepting love for ourselves, as much as we give to others &lt;3",Stephanie Carvalho,2021-03-26T03:09:17Z,1
Day 14😊,Nflower Celik-Alvis,2021-03-26T00:00:27Z,0
"I haven’t followed day to day, especially since my sciatica was killing me for the last week, but the journey is awesome. I feel so much better when I do my yoga everyday, thank you! Feel is so important too, need to listen and feel what is right for you always",Nancy Morin,2021-03-24T19:30:59Z,0
Anyone know what the intro/outro music is?,Jesse Kaltenbach,2021-03-24T18:24:00Z,0
Adriene teaches me to have compassion for myself. I didn&#39;t realise how hard I was on myself until I started this journey and started picking up on how I talk to myself on the mat. It&#39;s usually so negative but I&#39;m working on that now.<br />I am incredibly grateful for this. Thankyou and bless you ❤,Regina Mbeu,2021-03-24T11:14:25Z,0
I came back straight to day 14 after a while not doing routine. It was definitely heavier compared to doing it consistently from day 1.,Im Oka,2021-03-23T23:56:47Z,0
36 minutes has never gone so quick,Angelica Gayle,2021-03-23T18:08:32Z,0
Hi Adriene! I just keep on going back to these amazing practices. Practicing yoga has brought me a lot of benefits in so many aspects of my life and I can see how important it is to breathe and to remember that we are sometimes just a breath away from feeling a little better. I love you all!!,Claudia Lamprea,2021-03-23T17:06:53Z,0
"Thank you Adriene. I have to confess that it&#39;s becoming harder to come to the mat. I don&#39;t love it any less, but something in me is offering resistance. I will still show up nonetheless because it is always the best part of my day. I am feeling more connected to my breath, and it&#39;s even happening off the mat. Both emotionally and physically I find power through my breath as I go about my day. Finally, I wanted to note that I attempted to touch my head to the ground like you and... misjudged... How much farther the ground was and it was quite the tumble, so thank you for the opportunity to laugh at myself :)<br />Namaste",Taylor Hill,2021-03-21T04:08:34Z,0
Thank u Adriene💝Namaste🙏,Łamar Peace & Love,2021-03-20T19:08:51Z,2
this was honestly a perfect practice. thank you!! &lt;3,Pernille Mortensdatter Mo,2021-03-18T17:06:56Z,1
"Don’t know why but this one particularly hit the spot, big gratitude for you and what you do!",Jonathon Holmes,2021-03-18T03:12:55Z,1
For some reason my knees have been tender for a few days now so unfortunately I couldn&#39;t do the poses that required kicking my foot into my hand as well as doing the bridge. So maybe this wasn&#39;t the best session for me today. I still participated though,Severn Fox,2021-03-17T21:00:11Z,0
"I reached the half-way to my challenge :D :D :D In just 14 days, no more wrist pain. My downward dog is so much better. First class I struggled so much with it, wobbling and hurting. Now it feels so good. Amazing how much progress can be made in daily practice. It&#39;s no longer a 30 day challenge. I will do Yoga daily. It&#39;s part of me now :) Thanks Adriene.",Belle Princess,2021-03-16T13:07:53Z,0
"16.03.2021 spent 2 days to finish this one~~ I feel very relax, thank you so much.",Jessica Tan,2021-03-16T09:28:35Z,0
"Thank you for this! As women, we constantly receive messages to be small(er), be quiet(er), take up less space.  Thank you for the invitation to and lesson on taking up space. We are worthy!",Emily Johnson,2021-03-16T01:29:01Z,1
"Space , my favourite practice 🙆",Evangelia S.,2021-03-14T10:38:42Z,0
That was beautiful!,Carla Anderer,2021-03-13T09:05:05Z,0
"I&#39;m finally getting what she means when she says push away in table top, plank, etc. I can really feel things open up now and realize how slouchy I&#39;ve been in these positions before!",Bri W,2021-03-13T05:03:23Z,0
"Day 14 - beautiful practice. Very measured, and contained and enjoyable. The whole Breath series I am finding very valuable. Learning to consciously take that breath, both on and off the mat, carry it into the world in relationship and communication. I receive the daily email that compliments each day practice. Today that encouraging intro from Adriene was accompanied by a poem. I loved it. It was perfect. If anyone wants to look it up, it&#39;s &#39;Storage&#39; by Mary Oliver. Enjoy!",chokki one,2021-03-12T20:40:47Z,0
Such a good practice today!!,Quinci Woodall,2021-03-12T17:15:28Z,0
Love this journey with you.... i could hear your beautiful heart beating:),Kristine Simonson,2021-03-12T16:32:25Z,0
This practice was sooo good... my body feels brand new and so like so much space has been created within for the love and energy I desire. Thank you Adriene🙏🏾,bekahradics,2021-03-11T18:58:35Z,0
My hips are stubborn but I can finally do reclined cobbler&#39;s pose!,Miranda Braun,2021-03-10T20:44:40Z,0
The stretches in this video felt SO so good! And somehow I worked up a sweat.,Miranda Braun,2021-03-10T20:43:55Z,0
My favorite practice so far in this series. Worth all the work up to this day.,Beatrice Hatcher,2021-03-10T01:23:56Z,0
"Man when I was a kid I had a great gymnastics teacher. But ever since middle school I didn&#39;t really have any sports/physical activity teacher. Now that I&#39;m practicing with the help of Adriene, I can remember the good memories of having someone to guide you in learning and doing smth. A &quot;sensei&quot;,  you know. Feels good. Thanks Adriene &lt;3",Javad Siavashi,2021-03-09T16:48:33Z,0
"This was amazing! Loved it! Some new stuff in there for me, which is always nice!! :))) Thanks a bunch! &lt;3",Maria Elena,2021-03-09T16:32:20Z,0
anyone else&#39;s cat come lay on their belly during savasana?,Leah White,2021-03-09T14:39:00Z,0
I felt challenged but up to it.,Majda Attar,2021-03-08T23:29:04Z,0
"Somehow, I was at the flat back position, just easing my head to the mat then found myself doing a roly-poly onto my dog whom was asleep on his mat! I’m just hoping I haven’t put my dog off yoga now as he always finds the videos very relaxing!",Emily J,2021-03-08T19:37:02Z,0
"Soon, I turn 57 and at the end of the month I retire. Today&#39;s practice helped my say goodbye to a very hard year (loss of my mother, lockdown, working from home...) and feel hope and gratitude for the future. Very timely. I&#39;m so happy to have discovered your offerings, Adriene. Thank you!",Kate Alexander,2021-03-08T15:11:52Z,1
"In shavasana at the end of this practice, I intuitively focused my awareness on my heart, which was taking up new space in my chest. I then realised that we could hear Adriene&#39;s heartbeat in the microphone throughout those silent moments. I felt so connected. Thank you Adriene. This is my first ever time commenting on Youtube, I&#39;m too shy to do so normally. But this journey has moved me so much, I must share my gratitude. I feel like I&#39;m finding a heart friend, every time I get to the mat.",Emily Caruso,2021-03-08T08:18:19Z,0
"<a href=""https://www.youtube.com/watch?v=PVJtNPVq26Q&amp;t=33m41s"">33:41</a> there’s the heartbeat again. Somewhat soothing.",reinc83,2021-03-08T03:41:29Z,0
way late to this party but this practice was truly amazing!,Evelina H,2021-03-07T17:21:54Z,0
"Bro/sis if you missed a day or two or even an eternity - YOU’RE AWESOME to get back, DON’T FEEL BAD for yourself. I often miss a practice and then spending days regretting about it. This is wrong - you feel bad cause you care, and the best way to show it is to continue practicing without being angry at yourself🌞❤️🌞❤️🌞❤️<br />P.s. Adriene Rulez)",Ne Vazhno,2021-03-07T14:12:31Z,0
Yoga with Adrienne has changed my life. This episode has been one of my favorites.,Tammy Bruce,2021-03-06T17:24:58Z,1
My second time going through Breath. And discovering depths I hadn&#39;t known on this second time through. Love this session.,nom sola,2021-03-06T12:49:48Z,0
My favorite so far❤,Melanie Marquess,2021-03-05T07:26:49Z,0
"today was a lot about taking up space, but i found as i practiced that i also felt myself really becoming aware of (&amp; part of) the space around me - we are not just taking space, we are being with that space and letting it be with us. &lt;3",ari koontz,2021-03-05T03:21:36Z,0
"Feeling so good , just what I needed today ! Woke up feeling a bit blah this morning, no reason, even coffee didn’t help! Feel way less blah now, ready to take on the rest of the day with more joy &amp; energy. Thank you Adriene 😌🧘‍♀️❤️",Debra Taylor,2021-03-05T01:55:43Z,0
i&#39;m crying reading the comments and i haven&#39;t even done the practice yet :&#39;),free britney,2021-03-04T08:41:19Z,4
Day 14 is a wrap :),Jessica Hale,2021-03-03T22:41:40Z,0
"hi adriene. I&#39;d love to see you give more suggestions/adjustments for people in fat bodies. many of the poses you do don&#39;t account for bellies, back fat, etc. When you don&#39;t account for this, you are sending the message that you only wish to give your offerings to thin people.",Emily Volkar,2021-03-03T18:17:09Z,0
Just do what you can and if you can’t do it just don’t do the class,Guai Yao,2021-03-06T03:47:03Z,0
This practice was too good.. Specially coz it was for longer duration than usual..,Parul A Kumar,2021-03-03T15:01:13Z,0
Fantastisch body exercise! 🥰,Supairclaudia,2021-03-03T12:50:58Z,0
Must have those leggings! Do you have a link?,zobee1kanobe,2021-03-02T20:36:55Z,0
I absolutely LOVED today&#39;s practice!! Thank you!,Chelsey Molineaux,2021-03-02T14:29:17Z,2
Thank you next! I love how you incorporate our favorite jams from here and now into the sessions. I love your series. Thank you Queen 👑,Real REALTOR,2021-03-02T03:17:23Z,0
"Fell a little behind, but picking up this week with all the attitude. Listening to your heartbeat towards the end of the session was simply soothing! Loving it!!",Luis Alfonso Martínez Rangel,2021-03-02T01:36:45Z,1
Loved this practice.  One of my favourite so far.  Thank you.,Barbara Pearce,2021-02-28T16:29:02Z,0
"Dear Adriene, thank you for being gentle with us in the practice and reminding us to smile or go at our own pace. I am slowly starting to implement this attitude with most learning experiences and I&#39;m sure many very self-critical people like myself appreciate you teaching us kindness.",Aria Ibraheim,2021-02-27T01:19:01Z,1
hi to the 120ish people doing yoga with me today! :) what a dreamy one. I work at a grocery store and my low back was FEELING it today so this was magic.,Alyssa Stadtlander,2021-02-27T00:51:19Z,2
Thank you Adriene for all these fantastic yoga workouts. If feel that both my breath and flexibillity has improoved. I do my yoga as the first thing in the morning and every day I look forward to seeing what is in store for the days practise :-),Marie Heselaa,2021-02-26T08:26:02Z,0
"Thank you so much for this wonderful practice BREATH has taught me to be more patience, to be present  on every pose, to be more grateful and at peace. Gracias, gracias, gracias!",Dalia Garduno,2021-02-25T18:50:11Z,0
"Thank you again!! Sooo needed exactly  this today.. everyday... you make the difference in my life every moment I visit with you...❤️ ..again, you are an angel.",DeBonoJo,2021-02-25T16:21:04Z,0
"Words cannot explain how wonderful this practice was for me today. After several days of feeling tension in my neck, upper shoulders, and head, really trying to move through it with breathwork, I finally feel free of it after doing this session. It was so yummy and spacious and I feel so connected to my body in this moment. I am finally listening and presencing what I needed to let go of. Thank you so much Adriene. I remember now the importance of doing yoga daily, and I am motivated to keep showing up daily.",Emily Beauchamp,2021-02-25T14:15:25Z,0
Benji says “ Mamma when is it walkie time?” 🐶🤗,xanasantos1,2021-02-25T13:51:50Z,0
Always so wonderful and beautiful to ear your heart,stéph sémo,2021-02-25T09:45:47Z,0
did anyone else get really dizzy during the panayama?,Francesca Helen,2021-02-25T09:15:43Z,0
You are truly my online therapist,WhatsOnHerMind,2021-02-24T16:57:52Z,0
Awesome 😊,WhatsOnHerMind,2021-02-24T16:57:43Z,0
I loved listening to your heartbeat in the end 💜,Gazelle,2021-02-24T11:14:34Z,0
Thank you Adriene !,Carolina P,2021-02-23T13:11:57Z,0
I am feeling my breath how it runs through me,Barbara Gryczon,2021-02-23T08:27:51Z,0
"Space, a place I create for God to enter. &lt;3 Loved this one.",Jeannette Marasco,2021-02-23T04:11:45Z,0
"176 beautiful people joined me today in this practice, sending my prayers to all of you 🥰🥰<br />This day was a really good practice day for me , now when I fall down I just laugh and get up again. Thanks Adriene . SENDING LOVE .🥰🥰",Amera Ahmed,2021-02-22T13:19:53Z,0
i can hear adrienes&#39; hearth at the end of the session...,Φ T,2021-02-22T08:55:17Z,0
Done!,Chiara D,2021-02-21T21:45:01Z,0
Day14:✔️☺️<br />Everyday and every moment becomes beautiful with doing yoga here!!!!<br />Keeps me motivated and optimistic for day!!!<br />Thankyou Andriene💖,Sejal Dhanta,2021-02-21T11:58:13Z,0
"That was perfect, really! I had a migraine yesterday and over night all muscles seems toshorten, so this was great for giving them space again!!! It is getting warm again in Texas, isn&#39;t it? Namaste!",Gabkath Offbro,2021-02-21T09:26:43Z,0
🙏🙏🙏,Vikash B,2021-02-20T12:03:23Z,0
Thanks Madam,himalaya ahuja,2021-02-20T06:12:17Z,1
DOES ANYONE ELSE HEAR HER HEARTBEAT OR AM I JUST CRAZY?? THANKS FOR THE YOGA!!,Jeff Gruber,2021-02-20T02:15:41Z,0
thank you.,CLUB DE MOTIVACIÓN JC,2021-02-20T02:01:13Z,0
Just did this the day after the Mars rover landed... traveling through inner and outer space!!! 🌟,Maria Moyser,2021-02-19T13:20:47Z,0
Yoga day 14 and I made it!!! Some of the poses felt scary but I breathed and powered through and I feel amazing for it. So proud of myself. Great day yogi friends 💜🙏🏽🧘🏽‍♀️🥰,Lovely Lady,2021-02-19T11:55:07Z,0
Thank you so much for being such a great teacher and human being💜🙏<br />2....1...Liftoff!!! 🤣,TheGanjuri,2021-02-19T10:02:54Z,0
Thanks Madam,himalaya ahuja,2021-02-19T06:26:11Z,1
"I did this practice on 2/18/21, the day the Perseverance rover landed on Mars. A very different kind of space, but very fitting none the less!",Hannah Elder,2021-02-19T00:24:28Z,1
Adriene is srsly magic. I&#39;m doing her 30 days like two months later and the first time we ever do extensive shoulder stretches in the beginning is the exact day my shoulders were sore from some shots I got yesterday. Everyday is exactly what I need and idk how she always knows,alisa funke,2021-02-18T13:27:41Z,0
"I&#39;m with Debela Barbara below - this is one of my favorite days. So far my experience is best described as .....sporadic, yet consistently impactful i.e. I&#39;m not doing practice everyday, but I find the effects stay with me even on my off days. This is helping my body and head during the grimness of a UK lockdown. I am very grateful to you Adriene. Namaste.",Sue Frost,2021-02-18T12:17:32Z,0
"this  journey has been my first experience doing yoga, at 20. I moved out of parents house last summer, and have been missing my friends, community, and family during this very long year. This channel, and this Breath program has done more for my mental and physical health in the last 14 days than anything else has in the last 11 months. Thank you Adriene, and thank you to everyone else who is practicing with me. I read your comments every day, and feel less alone. Sending lots of love out &lt;3",Riley Williams,2021-02-18T03:16:45Z,0
I actually hearing adriene&#39;s heartbeat by now 💗💓💗💓,ssymck,2021-02-17T19:45:49Z,0
"So far my experience is best described as one of a bada**, as I have been doing YWA on and off for almost a couple of years now and this yoga journey has by far increased my strength! Today I was at my best friend&#39;s house and I accidentally slipped on a step, without thinking I felt my hands catch me. This is normal, but unlike other times, I didn&#39;t hurt my wrists! I felt that upward push and I can&#39;t thank you enough, Adriene! I am thankful for this practice.",Kenya Arroyo,2021-02-17T18:31:55Z,0
my favourite so far!,Camila Gherardi Fuentes,2021-02-16T22:45:28Z,0
It’s always so great to practice yoga together with our Benjis ❤️,marisa sasaki-shah,2021-02-16T14:25:04Z,0
Best day -best practise so far!! Loved it!!,eleni zoura,2021-02-16T05:40:36Z,0
Wow I really loved this one! Thank you Adriene!,Evana Mauriz,2021-02-15T19:42:22Z,0
I think this felt like the best pracyice since the beginning of this journey ! also i&#39;m so proud because now i can almost straighten my legs when in downward facing dog !!!!,nola byrne,2021-02-15T17:34:47Z,0
