comment,id,date,num_likes
Thank you for so long yoga practice! I love it!,Ilona Savchuk,2021-01-16T19:26:16Z,0
I feel space. Very Nice.,Smirna Costa,2021-01-16T19:22:12Z,0
This was one of my favorite asana sequences thus far🧘🏻‍♀️thank you Adriene 💕🙏🏼,Sheryl Beamer,2021-01-16T19:20:16Z,0
"This was a funny one, I wanna do it again with my niece and nephew.",vivalaflav,2021-01-16T19:08:30Z,0
Accountability check: I finished Day 14! Did this practice go super fast for anyone else?? And it was longer in time. Starting to feel like I can do this beyond 30 days 🥰,Michelle Culbert,2021-01-16T19:08:17Z,0
"Oh wow! This was the best practice so far. Felt so strong,  calm and full of self-love so the last minutes when  I layed on the mat I couldn&#39;t stop smile. Thanks to the body of mine and thank you, Adriene for guiding me and make me love yoga! &lt;3",Linnea Svensson,2021-01-16T19:04:28Z,0
loved the whole practice today and the lovely savasana at the end solidified the practice. thanks so much!,Sharon P.,2021-01-16T19:03:52Z,0
This one was my favourite so far. So playful. And the taking up space part - I had no idea how much I needed that. Thank you!!!,Carolyn,2021-01-16T18:59:19Z,0
This practice helped me so much because it&#39;s exactly what I needed always! My hunched shoulders always cause my chest tightness and part of the reason I started doing yoga. Thank you Adriene this one is bookmarked forever. 🙌✨❤️,Win Liu,2021-01-16T18:55:28Z,0
"I am catching up today, this one this morning and the next one later today. I am feeling excited each day to fit in my YWA practice and feeling lifted up by my friends embarking on this journey as well.",Karen Watson,2021-01-16T18:53:35Z,0
I’m ready to receive all the good things in this world ✨💕,marwa hassan,2021-01-16T18:50:14Z,0
"Today when I read the mail of the day I got teary eyed and almost started to cry. Over one sentence, &quot;Take up space darling, You are so worhty of it all.&#39; I always feel so small and onworthy. No matter how much work I put into myself I can&#39;t shake that feeling. But when i read it, I don&#39;t know, I guess I believed it. Adriene I don&#39;t know how you do it but first with Home and now with Breath, you make me feel worthy. So thank you for making me see my own worth with your kind words and this amazing yoga practices.",Miranda,2021-01-16T18:46:46Z,0
"taking up space in the star pose made me think about my childhood. I used to be much taller than my peers, had wide shoulders, big hands, long fingers. as a girl, I used to be ashamed and always tried to hide myself by wearing baggy clothes, even crouching when taking photos with friends so we&#39;d seem to be the same height. as I opened my arms wide and spread my fingers in star pose today, I realised how much space I can take and this felt so freeing and grounding, expansive. I remembered wanting to be small and unnoticed. today, I am letting go of this need and opening myself up for taking up space. I am so grateful for this journey. namaste.",birdinafishtank,2021-01-16T18:44:51Z,0
This is one of my new faves! Thanks so much Adriene and ywa team,Six Pence,2021-01-16T18:29:13Z,0
Day 14 tried to do it thrice finally able to finish on the third time feeling good feeling relaxed,Tabassum Wazir,2021-01-16T18:22:54Z,0
"This has been one of my favourite practices ever so far! I loved the soothing stretches and openers. I&#39;ve been following along for a couple of years now and it has been an amazing journey. I&#39;ve always loved to work out and usually I&#39;m always set on trying to get the best result, and go as hard as I can. But this gives me the time to just be kind to myself and be okay with my limits which also change from day to day. No matter how I feel, your yoga practices always manage to make me feel better :) Thank you so much Adriene for taking the time to share yoga with everyone!! xxx",Kismet8Angel,2021-01-16T18:13:42Z,0
"As always, love the time spent on my mat with your guidance! Guide + Dance = Guidance 😍 I did’nt see that one come...maybye it’s bad spelling, sorry if so!",Lotta Davidson-Bask,2021-01-16T17:57:07Z,0
Wonderful!!! 🔥🌟,Deborah Vought,2021-01-16T17:54:55Z,0
"I’ve officially made it 14 days, 2 whole weeks. I can’t wait to finish 30 days. Thank you for this piece of peace.",Elizabeth,2021-01-16T17:52:31Z,0
"Loved, loved, loved this sequence today &lt;3",Tammy Blancato,2021-01-16T17:36:25Z,0
My elbows didn&#39;t want to kiss today lol. I might have to start standing in star pose as a battle move.,Dymund,2021-01-16T17:31:22Z,1
"Today was powerful! Felt so strong, confident and invigorated! Space - One of the Panchabhootas (Wiki it!), one of 5 elements (Earth, Water, Air and Fire being the other 4). Space is what brings it all together! I felt the force today. Also, had another first in that my feet were fully grounded in the Downward Dog stance. I did not have to grimace and push my heel down. Thank you Adrienne for the Space!",Anuradha Srikantan,2021-01-16T17:30:00Z,0
"Today has been the first day I really struggled with getting myself on the mat, letting go of the day and arriving in the here and now... But I did it and I am so proud of myself and all of you guys out there, for keeping it up! The love in this community helped me get through this today, so thank you!!! Namaste ☀️",Johannafrog,2021-01-16T17:28:40Z,0
"I am feeling more free... not to have a &quot;perfect&quot; pose. Free to see and feel my surroundings. Free in how I react or don&#39;t react. <br /><br />Thank you, Adriene! &lt;3",Katherine Hornsby,2021-01-16T17:26:38Z,0
This one was so good. The table top balance had me feeling all new work and stretches in funny places.,fox hound,2021-01-16T17:26:31Z,0
ah Bliss. It was my birthday yesterday and somehow I didn&#39;t find time for practice so I am a day behind. This is just what I needed.. but could i locate my foot with my leg in the air - no!! It made me laugh .. there it was - visibly up there hovering but connecting my hand to my ankle - a little beyond me.. I nearly caught it one side... Looking forward to progression with that. What has been noticeable is that I no longer have pain in my left buttock just walking around. Now it&#39;s painless.. I&#39;ve lived with that pain for about 5 years. This fortnight is the best gift I could give myself. Namaste x,Gabriella Buckingham,2021-01-16T17:16:09Z,0
“Make space for all the love you’re worthy of...” ❤️<br />I love Mary Oliver and the poem. Such a gift. <br />I feel I am becoming unapologetically me.,Michele Trisler,2021-01-16T17:15:13Z,1
"woke up with my left front side tightened real bad. a lot of pain. watched the exercise from the mat, with just a few movements. humbleness practice",Mira Nof,2021-01-16T17:08:49Z,0
"i especially loved this yoga journey today!  I appreciated that there was less talk, but the same wonderfully gentle prompts and encouragement.<br />Thanks Adriene!!",Barbara Dalton,2021-01-16T17:07:26Z,0
I was thinking the same thing.... thank you... next!!! 💜💙,Jessica Daniel,2021-01-16T16:53:21Z,0
I thoroughly enjoyed the moment of silence today toward the end of the practice. The silence helps me focus on the breath and my body.,Maggie and Johnny Howland,2021-01-16T16:52:17Z,0
I really loved today&#39;s practice. Adding this to my favourite yoga practice playlist ❤️,Divya B,2021-01-16T16:49:32Z,0
"Wow, feeling a big emotional release at the end of this. Literally bawling in shavasana (sp?). I didn’t realize how much I needed this consistent practice and I had no idea how it would work out my physical, emotional, and mental body. Sending love from the frosty mountains of North Carolina.",Walter Hill,2021-01-16T16:45:18Z,0
I&#39;m a day behind and also exactly where I need to be. This practice allowed me to be present with challenging stuff that&#39;s coming up. And what wonderful invitations to take up the space I deserve and let go of what no longer serves me. Blessings!,windjourney,2021-01-16T16:40:18Z,0
that crunch to a toe stand was literally the best thing i&#39;ve done all day wow,anja,2021-01-16T16:34:19Z,0
"thank you. my back has been hurting the past 3 days and today seemed to open it right up. space! Plus, i let go of that (back pain) which did not serve me. Feeling better after this practice. thank you!",jennifer ward,2021-01-16T16:34:11Z,0
This was my favourite class of Breath so far. These stretches are great if you&#39;ve been sitting at a desk all week!,Chelsea Cummings,2021-01-16T16:29:12Z,0
Love the sound of you heartbeat during shavasana. Funny how corpse pose is where the sound of being alive comes ringing through.,Tessa D'Atch,2021-01-16T16:14:35Z,0
"I LOVED this practice! Thank you so much for your wise words! At the end, as we were breathing lots of love in and lots of love out, I had a visual of all the love being breathed out by everyone practicing washing over me like a giant, peaceful, loving wave. I have been practicing with this community for awhile and this was the first time I have experienced that. My heart is full!",Kelly Caffee,2021-01-16T15:57:49Z,0
"So far my experience is best described as best self care, self love and self honouring journey in many many years! I am humble by this awakening.<br /><br />I am learning to honor my breath, my space and my present moments. <br /><br />I am learning to celebrate my breath, my health, my fitness and my awareness during this journey. <br /><br />I am feeling alive, aware, open, curious, self acceptance, able to let go and grateful. <br /><br />Thanks for these prompts! Love from Singapore ;) Namaste",cherylyeo25,2021-01-16T15:56:16Z,0
"I LOVED today&#39;s practice. Even though I woke up sore and slow, this helped stretch out my muscles and get myself ready for a beautiful Saturday. &lt;3<br /><br />I am learning to honor every moment, even the ones I need to take deep breaths through because they are just hard.<br />I am learning to celebrate myself for just showing up.<br />I am feeling strong.",Ashley Downton,2021-01-16T15:53:57Z,0
"Loved the shoulder pranayamma twists! Very cleansing. Really prepared more space for me to move with more fluidity. Loved the release of something no longer serving. Thank you, Adriene. I love having you visit my home every day!",Kendall Bramblet,2021-01-16T15:44:36Z,0
Same work,Romiyo Romz,2021-01-16T15:37:12Z,0
"Your programs, Adriane substantially improved the quality of my life and those around me! Every time I finish, first thought that comes to mind is how grateful I am to you for doing what you do for many of us here. Thank you! This is the only yoga practice that is right for me. The balance of physical exercises, ever changing flow, creativity around poses, level of difficulty and breathing are great for body and mind! I’ve been practicing with you for over two years. ❤️",Live Today,2021-01-16T15:33:30Z,0
Half way in and I didn&#39;t need a block yet. That&#39;s very satisfying.,blackimp88,2021-01-16T15:28:00Z,0
"Wow.  So I&#39;m a day behind again but I had to share how perfect today&#39;s practice is.  Today marks the official day 1 of my separation from my husband.    So weird to write.  Blessedly it&#39;s amicable.  I hope you read this Adriene b/c your words are and have been like a balm to me from January 1.  I find myself drawn to the mat because of it, so thank you.",Allison Dossett,2021-01-16T15:23:09Z,0
Loved this it is uncanny how Adrienne always knows what I need. Like space and shoulders loosened after long drive in the snow and reminding me to drop my shoulders when I didn&#39;t notice them creep up. Thank you!!,Jennifer Firenz,2021-01-16T15:22:27Z,0
"I&#39;m a day behind. I received some disappointing news this week and I let it get to me, I was not in a good place yesterday. So this morning - catching up. Toward the end of the video, I realized that I needed this video today. Yesterday I would not have received the benefit of the movements and Adriene&#39;s words, which are always what I need to hear, even when I don&#39;t know it. So again the universe has provided me with what I needed, when I needed it. Today - reset. Off to a fresh start.",Trish,2021-01-16T15:04:58Z,0
Adriene you. are. so. good.<br />Your direction<br />Your guidance<br />Your support <br />Your love ❤,Rae K,2021-01-16T14:48:31Z,0
Thank you for the shoulder love today... i really needed that! 🙏🏼💖🙏🏼,Dawn Schenk,2021-01-16T14:34:03Z,0
Merci 🙏,Evelyne Turgeon,2021-01-16T14:33:39Z,0
"Loving the whole series and really needed &amp; loved this one.  I need to create space in a lot of areas of my life.  Thank you, thank you, thank you!  So far my experience has been awesome, inspiring, motivating (love starting my day with this!!!).  I am learning new ways to feel poses &amp; my breath.  I am inspired to make time for myself.  I am feeling good, motivated &amp; thankful.",Veronica Grim,2021-01-16T14:30:27Z,0
Inhale lots of love in and exhale to let something that doesn’t serve you go. Love it and it’s ringing in my mind after 14 days of breath. Thank you ❤️💚✨🥰☺️,VidyaGanges,2021-01-16T14:27:03Z,0
"Day 14<br />Space.<br />It was so good today, I have a lot of space around me.<br />Thank you Adrienne :)<br />Dosia",Dorota Misiewicz,2021-01-16T14:24:00Z,0
"By far, my favorite day so far.....very therapeutic, exactly what I needed.",elizabeth agius,2021-01-16T14:08:41Z,0
"Time ago I thought yoga is not for me since it is to slow and calm. Now I&#39;ve changed and time changed and I love it. I love my feeling practicing, I love how I feel after. I love that I better understand and feel my body.",Aija Tasmane,2021-01-16T14:04:02Z,0
"Oh, those stars! I felt like a giant Gumby!😀",Kathleen Kaar,2021-01-16T13:57:10Z,0
Loved it so much creating a spece to let prana flow through thank you <br />Namaste ❤🙏,Bina,2021-01-16T13:55:02Z,0
"I don&#39;t know why, but this one was especially good. Thanks a lot!",Виктория Козлова,2021-01-16T13:19:39Z,0
Anyone else on the 1-day-behind-but-still-worthy-crew?! :D <br />Loved this one.,Simone Viebke,2021-01-16T13:13:11Z,6
"Yup, right with you!",Dee O' Leary,2021-01-16T14:06:10Z,1
"Yes, even next day, still looks like I practiced with 2K others!  ❤️",Carolyn Smith,2021-01-16T13:59:13Z,1
My creaky old floor misses your creaky old floor.,KCMinPS,2021-01-16T13:09:31Z,1
"I&#39;m 1 day late with this class, but I&#39;m here :) Thank you ever so much, Adriene!",Ms Bunny,2021-01-16T13:03:41Z,0
such a yummy practice &lt;3,hasan,2021-01-16T12:43:23Z,0
My experience through this &#39;hop on your mat lifestyle is being very holistic&#39;<br /><br />I am learning to live my illness with a spiritual mind that it is stronger than the physical body<br /><br />I am learning to let go of my fears<br /><br />..to exhale profoundly and chuck a lion&#39;s breath away wherever I am to get me back to calm<br /><br />To want to find the time to connect and learn more and more never mind how many children are jumping over my tommy :) Namaste,Ana Chao Ruiz,2021-01-16T11:53:22Z,0
"I&#39;m feeling very energetic and grateful to do yoga every day, I love it!!! Also the classes are so diverse in both exercises and intensity, it really helps a lot to keep up and show up day after day. Thnx Adriene!",petra tak,2021-01-16T11:39:34Z,0
"After today&#39;s practice, I feel my back and shoulders wider :)).  That pose with the head top on the floor OMG!",Perinaz Ashrafi,2021-01-16T11:28:22Z,0
"Many thanks, Adriene!",cindy Lou,2021-01-16T11:19:38Z,0
I love when she said to look over your right shoulder and then Benji looked over his shoulder 😜,Rebecca Pecoraro,2021-01-16T11:16:26Z,0
"as always this practice and your words come in divine timing 🕉❇✳✴ i am so excited to be keeping up with this challenge in real time 💖 also!! Adrienne I tattood a little heart on each wrist, one facing toward me and the other facing out, for lots of love in, lots of love out",April C,2021-01-16T11:13:15Z,0
Felt bad because I missed this one yesterday  :( but I came back and did it today :) going to come back this evening for day 15 xxx,Nina Attridge,2021-01-16T11:07:35Z,0
"I felt it today, my favourite so far, Thank you.",M D,2021-01-16T10:58:50Z,0
This practice was def my favorite one (right after the snuggle one)! ❤️,Alicja,2021-01-16T10:56:51Z,0
akmost didn-t make it due to a migraine but so glad I did because it really helped release so much tention. Thank you!,Taste Georgia,2021-01-16T10:43:42Z,0
"One of my favourites so far, really enjoyed this practice. Thank you!",Tanja Möller,2021-01-16T10:04:26Z,0
What a beautiful yoga journey this is. I feel strong but loose and free. A glorious feeling!,kate hampshire,2021-01-16T10:02:11Z,1
This was my favorite so far as well! Perfect way to end the day! Thank you.,Sarah,2021-01-16T09:58:44Z,0
"I am one that struggles to even sit cross legged. My knees are so high (been this way for as long as I can remember). I have two damaged ankles now so I struggle even more with this. But I love the challenge its giving my core. Hands to shoulders, rotating left to right... that was so hard but a few pauses and I did it!! I&#39;m loving my journey. THANK YOU! 🥰",pamela viner,2021-01-16T09:50:47Z,1
Well done.,M D,2021-01-16T11:00:20Z,0
"Awesome, I loved it!!!!!!",Yossa YSU,2021-01-16T09:49:28Z,0
One of my favorites today. I didn’t sleep well and was thinking maybe I shouldn’t do it today to conserve my energy levels but I am just so glad that I did. I still feel tired but nowhere near as groggy! Just loving how I feel in body and mind ❤️,Anna Hughes,2021-01-16T09:45:41Z,0
A lot of people commenting on the star pose - totally felt that moment too. Big smiles. I got this. We got this.,Arwen Eleanor,2021-01-16T09:33:03Z,0
"My first comment - decided to use my voice and put myself out there. My favourite day so far. Loved the shoulder stretches, allowing myself to take up space (that&#39;s something I don&#39;t allow myself to do often!) and happy baby at end was perfect. My little ritual is to read the comments afterwards (most recent first) and its wonderful to feel connected with people practising around the world at the same time. Thanks all and thank you Adriene! x",Zoë Arden,2021-01-16T09:20:49Z,1
@susan fletcher Enjoy it! I agree. Was a good notice for me in terms of breathing into who I am rather than allowing my mind to always make me smaller. You&#39;ve inspired me to go big today too :-),Zoë Arden,2021-01-18T08:57:02Z,0
I do the same and yours is the first comment I read. Taking up space is so important and made me realise I spend too much time tucked away. Today I&#39;m going big!,susan fletcher,2021-01-16T09:30:06Z,1
"This 30-day journey is amazing, it is the best way to start my day path. Thank you Adriene, and the whole yoga team 😍",Ester Crespin Gunz,2021-01-16T09:09:01Z,0
Skipped this one yesterday so doing 2 today which is totally fine! 😂,Deen Dondersteen,2021-01-16T08:59:20Z,1
I am very proud that I was able to COMMIT to something fully everyday. As Adriene said: &quot;A little goes a long way&quot;.,Chak Hin Leung,2021-01-16T08:57:55Z,0
"This was probably my favorite practice of Breath so far! It had everything I needed today! Namaste, Adriene, Benji, and everyone else practicing! 🙏🤍🌌",Sara F,2021-01-16T08:56:37Z,3
You don&#39;t realize how tight you are until reaching back to grab your heel ends in a leg cramp 😂,Elza Kinde,2021-01-16T08:51:33Z,1
"Couldn&#39;t stay longer to finish the shavasana. Sorry.<br /><br />I am learning to recognize that I am worthy of this space... 🥺<br /><br />Thank you, dear Adriene and team. ❤️",Tonie Santos,2021-01-16T08:44:28Z,0
Just what I needed today 🙏,Wren Invests,2021-01-16T08:42:43Z,0
Definitely my favourite day so far in this 30 day series!  And that is not just because I was excited that i could reach my foot lying on my stomach and reaching back with my  other hand.  I don&#39;t think I&#39;ve been able to do something like that for years.  Trying the same thing from table top...another story... severe cramp!  Something for me and my body to work towards!  🤣🧘‍♂️✨,Barbara N,2021-01-16T08:36:28Z,1
"I&#39;m starting to feel so condifent and so much stronger! Just trusting Adriene and my own body and the integrity I bring thanks to her guidance, makes me just go into a pose. Lift my right leg? Ok. Lift my left arm? You got it. Oops, almost fell over - but as i grab my foot, I notice how i can create the balance and stay afloat. I can. This boosted me so much that I did a chaturanga without even thinking about it. I did a boat pose with legs up for the first time yesterday. Thank you Adriene for believing in me long enough (almost a year now) for me to start believing in myself too. Namaste. &lt;3",Ruby,2021-01-16T08:35:12Z,0
"I love the “real time” connection with this month’s challenge.  <br /><br />When you get a “personal” email and then get to practice the concepts outlined in the email, it really makes you feel connected to Adriene but also to the large YWA family.",Mindy Burgert,2021-01-16T08:34:28Z,0
This was definitely my favorite so far. Thank you Adriene for this amazing journey. Lots of Liefde (Love) from the Netherlands.,Karine Philipsen,2021-01-16T08:19:07Z,1
"This one was such a spiritual experience. I feel like I&#39;m walking off the mat both heavier and lighter all at once. Like I can feel the relaxation in my muscles, but also this intense, warm energy. Absolutely loved this one, Adriene! Thank you!!",SoulShineDreamSmileOn,2021-01-16T08:13:39Z,0
"I&#39;ve been doing these videos every morning when I wake up, and wow! It really sets me up for a more conscious, peaceful day. I really look forward to each morning&#39;s practice. Today was one of my favourites. Thanks so much, Adriene.",Lauren Davis,2021-01-16T08:05:05Z,0
☑️Día 14<br />I LOVE SPACE.<br />🌋,Esperanza de la Paz,2021-01-16T07:58:36Z,0
Thank you Adriene!,Nicolas Di Matteo,2021-01-16T07:46:32Z,0
"Hello, <br />My name is Isabel from Australia.<br />I&#39;ve been practicing yoga with your videos for a while now and I totally love it. Unfortunately 2 months ago I shattered my right wrist, and I just starting to get a bit of strength back and a bit of rotation. I&#39;m just wondering if you have videos that I can do without using my wrist to much. I really miss being able to practice regularly.<br />Thank you so much.",Isabel Tyrer,2021-01-16T07:41:00Z,0
"I normally don&#39;t comment on YouTube videos but if sharing my day in the life of story will not only support this channel but hopefully inspire someone else, I will def do it!<br />I read the themed Breath emails at the beginning of the day, and then several times throughout the day and each time I decide what else I need to make this practice the best it could be! I spent the day really focusing on aligning head, over heart, over pelvis..and then did the Inner Space practice on this channel before the Space practice, and topped it off with the Mental Balance and Meditation practice. It was a WONDERFUL journey for me,and with all that space I filled up by inhaling lots of love it,and then letting that exhale travel back through so much love and goodness!",Kelly Anderson,2021-01-16T07:24:24Z,0
"this was the best practice so far for me. ended up crying after letting go of some guilt i&#39;ve felt deeply for about a year now. thank you adriene, and sending all my love to everyone else on this journey.",Mercy Hallman,2021-01-16T07:16:22Z,0
"I woke up exhausted this morning and was worried that I would have to push this practice until tomorrow. However, I am grateful that I found the energy to complete this one!",Carissa Nichols,2021-01-16T07:14:46Z,0
"after the spins<br />Adriene: how do you feel?<br />me: sick, where is the bucket",Christian Gullans,2021-01-16T07:05:36Z,0
Beautiful practice! I&#39;ve created a lot of room for all the good that has to be. Thank you.,Maryaz C,2021-01-16T06:46:38Z,0
"I’m practising  in country Victoria, Australia. I often wonder if I feel well enough for yoga, telling my husband I’m going to try to do the day’s class. But guess what? I always can, and I always feel better after. Today’s class was particularly good. Thank you, Adriene. Changing the world, one yoga pose at a time.",Jo du Buisson,2021-01-16T06:46:00Z,0
This was my favorite practice so far. I started it by humming NASA by Ariana Grande and Starman. I resonated with everything that you said today. Thank you Adrienne :) today I understood that it&#39;s okay to take up space. I read the comments and it&#39;s funny because I feel that collectively we all felt great during Star pose,Denise Poveda,2021-01-16T06:39:57Z,1
"I am learning to honor myself through grace. Meeting each day on the mat to receive and extend my heartfelt gratitude 🙏🏼 for the breath. It’s the anchor, the rock and the pillar of which I am learning to relish! <br /><br />Thank Adriene! <br /><br />Ps I caught the most delicious and biggest wave 🌊 in that 🌟 pose!",JAMIE Servin,2021-01-16T06:37:17Z,0
"This was the first day of Breath so far that I considered skipping. Very upset, felt ready to burst at tears any moment. I couldn&#39;t see myself making the time for yoga in such a state. But I showed up anways. I play the video, go to sit on my yoga mat, ended up sitting on a plate on my coffee table. I laughed out loud - what irony! I pushed the table back to make SPACE for my practice today and started off with a grin. Today&#39;s practice felt great and even though I don&#39;t feel perfect right now, it was nice to have 36 minutes to just be in my body at pay attention. Thank you once again Adriene.",Jenin Ahmad,2021-01-16T06:30:45Z,0
Beautiful ☺️ love lots of space 🙌,Nature Witch,2021-01-16T06:30:27Z,0
