comment,id,date,num_likes
My favorite class so far!! I love love love this practice and the whole 14 days so far. Can’t wait to get to day 30 ❤️,Amanda Lawrence,2021-01-15T14:44:29Z,0
"This was a perfect session for me today as I clear through almost 60 years of S*@t, loved the poem included in the email.... so true and has given me more motivation to create space! Love light and endless possibilities from Bermuda! ❤️💥🇧🇲",Ardleigh Young,2021-01-15T14:43:37Z,0
There&#39;s some days when I can just stay in the practice all day - today was one of them.  My mind and body connected. 🧘🏻‍♀️🙏🏻,Melissa McNally,2021-01-15T14:39:48Z,0
That was perfect thanks Adriene x,Eleanor Martin,2021-01-15T14:39:29Z,0
"Adriene matches Benji, oh my god!!! How wonderful and this was my best video yet.  I absolutely loved it and laughed out loud when I completely crashed on the mat trying to hold my foot, I couldnt even find my foot!!! but after pausing and repeatedly trying, I got there in the end with a lot of laughter.  A great way to start the day.  Thank you so much Adriene for providing this course for us xx",Marion Exley,2021-01-15T14:37:59Z,0
Just soooo good! Namastê 🙏🏻!,Josiane da Silva,2021-01-15T14:37:43Z,0
easily my favorite practice yet.,reagan l,2021-01-15T14:37:26Z,1
"“Thank you, next!” 🤣😜 I love your sense of humor and random remarks throughout your practices... makes every session all the more fun! Also, my flexibility has been improving at rapid rates since I started this challenge. I can’t thank you enough for helping become a better person, hope I get to take one of your classes some day in person. God bless you and Benji!",Carlos,2021-01-15T14:36:25Z,3
Day 14!So needed those stretches!! Thank you!!!,Marg Milburn,2021-01-15T14:36:10Z,0
Finally about to start! So so thankful for this practice 🙏🙏 let&#39;s go!,Ashley Gerhart,2021-01-15T14:34:57Z,0
"Well this was just beautiful. My inner child was delighted with all the love we got to breathe in, I hope you felt our love right back 🥰",What's eating you?,2021-01-15T14:33:04Z,3
I really needed this today. My birthday is tomorrow and I&#39;ve been struggling this week with feeling like I don&#39;t deserve the space I take up. I&#39;m thankful for this opportunity to feel the sensation of physically taking up as much space as possible without worrying about whether or not I earned it.,Charity,2021-01-15T14:29:32Z,10
Happy Day Of Birth!,circe&calypso,2021-01-17T00:12:01Z,0
happy birthday!!,Zhané,2021-01-16T05:38:33Z,0
happy birthday :)),liviifries,2021-01-16T02:40:58Z,0
I allow myself to feel the space. Thank you Adrienne!,Linda Harder,2021-01-15T14:29:14Z,0
"Thank-you thank-you...today I reached back to catch my right ankle and &quot;pop&quot; ...relief in my shoulder, that&#39;s been impinged for days. Yoga and Adrienne I love you. I can lift my arm up with no pain ahhh 😃",K Howard74 UK,2021-01-15T14:28:56Z,1
"I&#39;ve been doing these videos in the morning before I get ready for work every day so far. I always make sure to leave time to scroll through the comments afterwards as well. It&#39;s been so much easier to get out of bed in the morning when I know a new video and this sweet community are waiting for me. This is easily my favorite part of the day. But it&#39;s also so wonderful knowing that no matter what happens today after I leave the mat, I&#39;ll have this waiting for me tomorrow. I hope you all have an awesome day 💕",Mikayla Edwards,2021-01-15T14:28:34Z,1
Girl you cound do podcast yoga. Just listening to your voice calms me down ❤️🎯🥰,Jana Reed,2021-01-15T14:27:14Z,0
This was an amazing practice. It was very hard for me to get to the mat this morning and I am so grateful I did! Happy Friday!,Katy Foster,2021-01-15T14:25:40Z,0
So awesome! Thank you Adriene!,Veronica Chavez,2021-01-15T14:24:35Z,0
looking good today,Melissa Oosthuizen,2021-01-15T14:22:23Z,0
"This was my favorite!  It made me so happy!  I was grinning by the second star pose.  For those of us who have been glued to the news, this was perfection.  Love from Michigan.",Juanita Westaby,2021-01-15T14:22:14Z,0
You and Benji were matching today:),Rich,2021-01-15T14:21:44Z,0
"When you said &quot;take up space&quot; during the star pose, I totally lost it. Even as a child I was always told to keep myself as small and unnoticeable as possible. To date, I am so envious of people who claim their space but today you changed that for me Adriene and I will be forever grateful. I let go of the shame and the guilt and claimed my space today. Watch me grow world xx Love this journey so damn much.",Melanie Andrade,2021-01-15T14:18:24Z,421
Good for you! Own that space it’s yours for the taking!,Laura Cobbold,2021-02-07T08:53:36Z,0
The star pose really got to me to!!,kexetish,2021-02-02T07:46:58Z,0
I feel you so much Melanie. I am supporting your growth and sending love!,Jade Boyd,2021-01-17T02:10:43Z,2
Awwww I know what you mean. We deserve space 🙏😌,Nature Witch,2021-01-16T06:31:50Z,4
"I felt it too. I think this sequence just scratched the surface for me despite practicing for quite some time, the words just finally broke through to my soul....I had an interesting experience playing with height/width, only just realizing that I over expand my voice and my....opinions? as a way to compensate for being made small in SPACE",Jess Spain,2021-01-16T06:30:15Z,5
"Zip-a-dee-doo-dah, zip-a-dee-ay<br />My, oh, my, what a wonderful day<br />Plenty of sunshine headin&#39; my way<br />Zip-a-dee-doo-dah, zip-a-dee-ay!<br />That was my favorite song I would sing with my Dad. He was a super awesome man, (I have a super awesome mum too), and super spiritual. My mum gave me his yoga bell/chime. I love it. I love this practice. I&#39;m changing. I feel it in my heart and soul. Many blessings dear ones.",Penny Kazmierski,2021-01-15T14:16:26Z,0
"Your &quot;Thank U, Next&quot; joke had me literally laughing on my mat. You are such a beautiful dork and so fun to be with, in the weird way we&#39;re with each other.",Kalysta Fern,2021-01-15T14:16:21Z,3
"&quot;Thank you, next&quot; - A journey in mental heath and meditation.",Kaitlyn Burton,2021-01-15T14:15:03Z,129
I loved that,drinkmoreágua,2021-02-25T13:51:34Z,0
Loved the Ariana Grande reference :),Meaghan Gates,2021-01-18T01:59:42Z,0
That had me cackling😂😂 wasn&#39;t expecting Ariana here,The Cotton Candy,2021-01-17T22:49:03Z,0
Loved this reference :),Catherine Simpson,2021-01-16T19:49:44Z,0
Yoga with Ariana xx,Teresa Sloupova,2021-01-16T18:22:20Z,3
"Wow today was powerful for me. When I expanded into star pose, I began to cry. Something opened. As I focused on the remaining poses I gripped back up tight. Then when I let go again in Shavasana I cried again. Even now I feel very vulnerable and like I want to close back up tight. This is interesting. Today requires some attention and allowing.  I might go back and do this practice again later to see what happens. Thank you, Adriene, for the can opener.",Lauren Pickens,2021-01-15T14:10:36Z,0
That was challenging but oh so beautiful. I tend to cramp under pressure and stress and to create space felt so good.,C. Weidenmann,2021-01-15T14:10:07Z,0
Creating space for love and getting rid of that which no longer brings joy.,Janet Cushing,2021-01-15T14:09:33Z,0
It is INSANE how much space I was able to create when i slowed everything down and really thought about it. I need to do this ALL THE TIME.,Liz Mongrello,2021-01-15T14:09:26Z,0
"I really loved today&#39;s practice. I&#39;ve been having difficulty with focus, and just surrendered to it today. What a reward. Hope to carry this floaty feeling into the rest of my day.",Barb Drosey,2021-01-15T14:08:49Z,0
"&quot;Just Be.&quot; Such a simple thought that can be so difficult to practice. A lovely mantra for today. Thank you for the beautiful energy you share with all of us. I love that I get up feeling so awesome that I&#39;m getting up early and visiting this practice first thing, then I see that almost 50,000 sweet souls have already experienced that loveliness...I can feel the energy. Happy Friday everyone.",Phaedra Winton Wilkinson,2021-01-15T14:08:25Z,1
Lovely practice! That 36 minutes went by fast. Loved finding the space and getting the energy flowing right again. Such a nice full body practice! Namaste everyone 🥰🙏,Emma Holt,2021-01-15T14:07:20Z,0
"<a href=""https://www.youtube.com/watch?v=PVJtNPVq26Q&amp;t=12m49s"">12:49</a> blast off to space! Hell yeah, like a 🚀 and then reach the sun the 🌞..... hell no 🥵☠ Namaste! 😇🙏🏽",Noah Liasam,2021-01-15T14:07:12Z,0
"Loving my 5 am practice and today was my favorite so far. The message is perfectly timed for my journey, I am letting go of things to prepare for my future. Thank you does not seem enough Adriene. Namaste",Michelle Wick,2021-01-15T14:06:26Z,0
That was craaazzzyyyyy beneficial to every corner of my body,Lisamichellerss,2021-01-15T14:05:40Z,0
"Today&#39;s and also yesterday&#39;s practises were hard for me. Yesterday I was in my mood and just &quot;did it&quot; but as I saw that today&#39;s video was 36 minutes long I told to myself &quot;you know what, we&#39;re gonna get on the mat and not just &#39;do it&#39; but do it mindfully&quot;. And I really enjoyed!",Heleen Kenna,2021-01-15T14:04:29Z,0
"Oh that was fantabulous.... i don&#39;t know what opened where ,,, lol   Thank you Adriene",Prasseedha Raghavan,2021-01-15T14:04:18Z,0
"So far my experience is best described as….challenging, I am learning to honor… effort,  I am learning to celebrate....changes, I feel relaxed and pleased with myself I am Grateful for these sessions. Thank you very much Adreine.",Lesley lynch,2021-01-15T14:03:59Z,0
Wow!  I just did that with 7258 other people!  Amazing.🥰🥰🥰. Thank you Adriene xxxx,Kim Ivory,2021-01-15T14:01:30Z,1
Truly wonderful. x,Yoga With Adriene,2021-01-15T15:11:51Z,0
"Wow, a practice so full and nourishing, with so much to explore! Thank you, thank you, thank you.",Stephanie Lundquist,2021-01-15T14:01:27Z,0
Had my best day so far of keeping the breath and movement synced! Not sure why but it was welcomed. Looking forward to the rest of the journey,Dennis Coomer,2021-01-15T14:01:00Z,0
I am allowed to take up space. I am allowed to take up space. Repeat that... wow.,Corie Feiner,2021-01-15T14:00:30Z,37
Was very hard to get on the mat today but I&#39;m glad I did!!!,A Yagu,2021-01-15T13:57:53Z,1
"&#39;Thank you, next&#39; is a big yoga mood, gently displacing my former #1 yoga mood, &#39;excuse me I need a quick forward fold&#39; 😂",Vasundhara Sridharan,2021-01-15T13:57:10Z,0
I was sore and tight from another workout yesterday. I&#39;m so glad I started my day with today&#39;s practice. Now I&#39;m ready for the rest of the day. Thank you!,Carol Spaeth-Bauer,2021-01-15T13:54:13Z,0
That was just fabulous...so renewing. Thank-you,nom sola,2021-01-15T13:52:38Z,0
Thank you for today!!!!,Glory-Anne Harvey,2021-01-15T13:49:22Z,1
"Hello Cherubs of love! I can hear the birds flying south..can you the birds, too? and this love being cultivated for showing up for myself and with all of you.  Another super lovely class with Adrienne.  💐🌸😚🖖🐿🐦🐢 Namaste and sparkle on!! ✨✨✨",SparkleOnWithJoyfulJon,2021-01-15T13:48:35Z,2
My dogs love to come and stand over me during the final posture haha,Danielle Saunders,2021-01-15T13:47:10Z,0
The subtle energies in my body feel extended to send out so much love to everyone watching and tending to their own self care with Adriene and Benji. You are allowed to take up space. Own it. Hold it. WOW!  I feel it. Shared space and shared grace. Love to all.,Krystal MacKnight,2021-01-15T13:44:33Z,3
Space is the place! Thankyou Adriene ❤️,Trinity Sarratt,2021-01-15T13:44:12Z,0
The electricity went half way through the video but I still made it! Today&#39;s practice was super yummy💜 Adriene have you heard de una vez?,Jasmeet Kaur,2021-01-15T13:43:58Z,0
"this practice was so yummy for the body, just added it to my playlist of YWA favorites 😊 namaste to all who are sticking with the journey, in their own time 🙏🏽",Sabah Siddique,2021-01-15T13:43:51Z,2
"Feeling awesome with my commitment to me this January Breath journey. Also knowing there are others out there in the universe sharing the breath makes for a connection so needed right now. Thank you Adriene, for your kindness and encouragement.",Amy West,2021-01-15T13:43:47Z,1
"I am spaced out, thank you 😊❤️🙏",katekin61,2021-01-15T13:43:38Z,1
Each day I am finding my love for Yoga is growing I am so grateful to you Adriene for giving me this gift to myself everyday. I also echo other comments about the positive difference to my mind &amp; body after each practice Thank you X,Jan Singleton,2021-01-15T13:43:28Z,0
So far my experience is best described as….Loving kindness<br />I am learning to honour… Easy practise <br />I am learning to celebrate....Improving <br />I felt/I am feeling…In love with Adriene Mishler xxx,Easy Squeeze,2021-01-15T13:43:17Z,1
"Favorite YWA video I&#39;ve ever done!! Struggled with letting go of crazy productivity after finishing my engineering degree and allowing myself to ever have a break and had therapy and counselling all trying to work this out last year, Adriene saying &quot;it no longer serves you&quot; &quot;to honour it&quot; and &quot;thank it for what it served you and let it go&quot; made me cry hahahahahah, thanks internet mom",Paul Jenkinson,2021-01-15T13:43:15Z,2
"Girl, we got different definitions of what TikToking means!!! :P",Alec Wilcosky,2021-01-15T13:41:29Z,0
I had to take a few days break and I wondered if I should pick up where I left off or jump back in with everyone else. Decided the latter and so pleased I did! Just what I need for this tightness that has developed in my lower right shoulder after being hunched over my laptop writing an essay for a week straight! <br />The image of tearing the mat apart during the bridge was really helpful as well.,roxodee,2021-01-15T13:40:40Z,1
Loved this practice!  A little something of everything in a beautiful package.  Thank you!,Rebecca Watson,2021-01-15T13:40:37Z,1
Something about Star pose gets me every time. I love that pose so much!,Mado,2021-01-15T13:40:10Z,4
🙌🏼🙏🏼♥️,Leena Launay,2021-01-15T13:40:09Z,1
"You get everything with Yoga with Adriene - yoga, meditation and laughter - chuckling as I imagined myself as a 73 year old cherub. Hey, laughter is a tonic, need something in this UK lockdown. Love and encouragement to all fellow yogis out there, young and old, wherever you are at this crazy time. 🙏 💕x",shirley quinn,2021-01-15T13:39:44Z,24
"Lots of love from a 21 year old a couple hours away from Toronto, Canada! I rediscovered (and became obsessed 😁) yoga 6 months ago after remaining adamant for as long as I can remember that I hated it.. well, hate is a strong word, and there&#39;s always new things to explore in the world. YWA has been incredible and Adriene&#39;s kind words and fun humour never fail to stick with me. Much encouragement to you Shirley, wishing you wellness and happiness during these crazy times - oh how much you must have seen throughout your lifetime!",Lauren Tuttiett,2021-01-17T06:15:42Z,0
"@liviifries thankyou, to a 22 year old in washington dc from this 73 year old in washington UK - small world !!!",shirley quinn,2021-01-16T08:04:36Z,1
lots of love from a 22 year old in washington dc :),liviifries,2021-01-16T02:38:44Z,1
"Same here. Lots of Love from Munich, Germany. What would I do without this...",Sabine Voss,2021-01-15T19:40:29Z,1
Lots of love from Belgium 🙏💐💕,Greet M,2021-01-15T15:59:33Z,1
Thank you. Namaste 🙏❤,Sarah L,2021-01-15T13:38:20Z,1
"For the first time ever I&#39;m managing to keep pace with a &quot;30 days of&quot;- challenge. Each day I wake up looking forward to the new session. And even though I am continuously sore (but not much), I still see such an improvement. Managed to put my hands flat in a forward fold today. First time in my life, thanks Adriene",Mechteld Bous,2021-01-15T13:38:13Z,136
Huzzah!,Sati Brown,2021-01-15T15:13:08Z,2
❤🧘‍♀️,Erica Walker,2021-01-15T13:37:37Z,1
"So far my experience is best described as a celebration <br />I am learning to honor my body, mind and spirit<br />I am learning to celebrate my being<br />I am feeling so much grateful 🙏",Ananto Joy,2021-01-15T13:36:48Z,0
"Hard day out of the mat but the practice brought me back to center. Thank You Adriene, namaste :)",Magda M,2021-01-15T13:36:10Z,0
"Phew. Really wrestling with the &quot;shoulds.&quot; I&#39;m finding space this month in letting go of the idea that yoga doesn&#39;t &quot;count&quot; as a workout. My commitment to this daily practice feels like enough for me right now and I&#39;m giving myself permission to let go of the idea that I also need to fit in strength training, cardio, etc. I&#39;m feeling strong (and sore!) after these 14 days. And trusting my process.",MJ Mathis,2021-01-15T13:35:21Z,0
Everything was snapping and popping today lol but I found what feels good in my twist 🧘🏾‍♀️,Ashley Mathews,2021-01-15T13:34:35Z,0
"I ended practice with a huge smile on my face because that was awesome! I spend hours sitting at a laptop on my dining room table as I’m working from home, so my body can feel very heavy. Being able to break up my day with yoga is perfect and guides me back to what’s important.<br /><br />Thank you again Adriene!",Vardagaladhiel,2021-01-15T13:34:10Z,1
Adriene looks so much like natalie portman. I love her😍,Kashish Kukreja,2021-01-15T13:32:05Z,2
"Ahhh, needed that today! <br />Lovely. 👌 🙏 🧘🏼‍♀️💗 Thank you 😊 😇🥰",Lorraine Brooks,2021-01-15T13:30:41Z,1
"Blissful practice once again, enjoying this journey SO much &lt;3",Jon Read,2021-01-15T13:30:02Z,1
So I gained a new hole in my foot recently. Needless to say the crouch pose stimulated my creativity ;D see you all tomorrow. Lots of love.,M Cich,2021-01-15T13:29:05Z,1
@Vardagaladhiel That&#39;s very kind. Thank you!,M Cich,2021-01-15T16:07:07Z,0
Woah! That’s amazing that you worked to adapt. Sending you love and see you tomorrow!,Vardagaladhiel,2021-01-15T13:35:20Z,1
At the end of today’s yummy practice..<br />Adrienne: Namaste <br />Me: I’ll be busy for the rest of the day cleaning out my closet!,Laura B,2021-01-15T13:27:18Z,33
I would argue that&#39;s just more very important self care!!!!,Jess Spain,2021-01-16T06:38:29Z,1
Yes... and my basement! Lol glad I&#39;m not the only one who was thinking about that!,sophemy2,2021-01-16T04:22:15Z,1
I keep putting it on my to-do list and end up cleaning out other things instead lol.,InvdrDana,2021-01-16T03:11:47Z,1
"Haha, me too!",Rafield corn,2021-01-15T16:15:38Z,1
"I don&#39;t know what it is about the lunge twist, but I just love love love it! I love how this series has consistent and familiar poses throughout all the videos but also gives you some spice with new and exciting poses to try. I really enjoyed the toe stand pose today!",Melanie H,2021-01-15T13:26:36Z,1
It just keeps feeling better and better as we go on!,Vardagaladhiel,2021-01-15T13:35:49Z,1
"This was one of my favorite practices I’ve ever done with you! Totally stretched my shoulders and hips while still making me feel strong. You’re magical, Adrienne",Anne Meyers,2021-01-15T13:25:54Z,2
I&#39;m really getting into doing yoga first thing in the morning (maybe after a quick shower); before the cell phone or emails. It&#39;s sacred time for myself before I go on to the rest of the day. Thank you!,Logan G,2021-01-15T13:25:53Z,0
This one is my favorite so far too.  Thank you!!!!,Paula Herrington,2021-01-15T13:25:26Z,0
"When I started breath, I hadn&#39;t done yoga for a few months. I felt very creaky and unhealthy after Christmas. I told myself I would feel amazing in 2 weeks time and I was right! Thank you!",Emily Outram,2021-01-15T13:25:23Z,0
Awesome. This is one I will come back to often in 2021. Thank you. Namaste,John Durante,2021-01-15T13:24:11Z,0
I am taking this time and these practices to learn how to slow down and properly breathe. It feels good!,Juanita Dewberry,2021-01-15T13:23:35Z,0
There were a few things I couldn&#39;t do today (grab my foot behind me) BUT I&#39;m ok with it.  I am a work in progress.  Thanks Adriene (&amp;Benji) for a fabulous forgiving feeling I would never have had before.,Colleen G,2021-01-15T13:23:16Z,0
This is the first day I had to make myself do it. So glad I did!,Jo Homan,2021-01-15T13:21:43Z,0
"Hello, Yoga with Adriene community! I LOVED today’s practice, and I’m so glad so many of you did, too. <br /><br />Adriene, if you see this, I was wondering if you could maybe include some more modifications/supports for those of us who might have knee trouble? In particular, I’ve found hand-to-opposite-foot grabs and Bridge pose to be slightly painful. Thank you so much for all you do!!!",Sarah Scott,2021-01-15T13:21:27Z,0
Wow. What a beautiful beautiful session. Thank You so much Adriene for all the love you have in your heart &lt;3<br />Love and Gratitude. From India &lt;3 Namaste  :) and this was the fastest 36 minutes of my life. Felt like 3 minutes &lt;3,Bharath R,2021-01-15T13:19:13Z,0
"Came into the mat today feeling incredibly anxious and tearful. Leaving it feeling so much calmer, relaxed, grounded etc. Can’t thank you enough for all your yoga practices Adriene and especially your 30 day yoga journeys ❤️ they have been a lifesaver for me and i’m sure many others!",Anna Bee,2021-01-15T13:18:39Z,0
"I am fully convinced that Adriene is a mind reader, every practice fits so perfectly with each day and how i’m feeling/what i’m thinking about❤️",Ellie Ireland,2021-01-15T13:16:47Z,0
Breath has been about returning home and cleaning the room. I honor my time and space here. I celebrate my breath. I feel good. :) 🙏🏾,Celine Fabie,2021-01-15T13:16:33Z,0
Adriene making an Ariana reference just made my day two true queens,Mackenzie Knox,2021-01-15T13:16:09Z,0
Another incredible practice with Adriene and Benji today. Day 14 Space. I opened up wide and claimed my space in body and spirit. I also let something go that was not serving me anymore. I wonder what will move into that space? Thank you Adriene. Sending you a hug and a smile. And gratitude. Have an extra lovely day.  xoxo,Michael Lewis,2021-01-15T13:15:45Z,0
"particularly lovely practice today, thanks Adriene :)))",Erin Townsend,2021-01-15T13:15:28Z,0
This practice was right on time. I really needed this after such a long and challenging week and left the mat feeling 100% better. 💜💜💜,Jessica B,2021-01-15T13:15:12Z,0
"To have your eyes closed and your heart open as someone gently speaks into your ear requires sooo much trust, thank you so much for always honouring that trust, Adriene. Happy Friday!",Raquel B,2021-01-15T13:15:03Z,0
"Just broke down crying after I finished today&#39;s practice. I struggle with taking care of myself so doing something for myself is a huge win, no matter how small. Thank you very much, Adrien.",N. Nana,2021-01-15T13:14:44Z,6
43k views and 47k when I finished the practice..goodmorning to all but especially those 4k peeps that joined me...namaste❤🌞,Megan Moseley,2021-01-15T13:14:18Z,0
Only had time for 1/2. Other half later. Or whole later.🤔,Jim Salvati,2021-01-15T13:14:17Z,0
🤩 Wow! Success for me in today’s practice. Pranayama created the ultimate space in my thinking. 💭 Have an AMBITIOUS day ahead.🙏🏽🤗,Tracy Kato,2021-01-15T13:13:20Z,0
"This practice is always the calm amidst the storm. Thank you for providing such a beautiful, hopeful way to start each day.",Pamela Caine,2021-01-15T13:13:12Z,0
"When your head touched the floor at <a href=""https://www.youtube.com/watch?v=PVJtNPVq26Q&amp;t=23m37s"">23:37</a> I was like 👁️👄👁️<br />I&#39;m going to make it my goal to do that!",Accidental Emma,2021-01-15T13:12:03Z,0
Showing up for day 14/14 and hey!  I can do a toe stand!  Who knew?!  There are some health issues in my body so seeing myself do things like this makes me especially grateful for what my body CAN do!,Amanda Armstrong,2021-01-15T13:10:58Z,0
"I spent a lot of my life folding in on myself, almost to hide.  During the starfish pose, you said take up space and I deserve it.  Epiphany!  Yes, I do.  Open up and don&#39;t be afraid to say, this is me; because then I can give myself to others and help them unfold too.",Pam McCarthy,2021-01-15T13:09:38Z,2
"Create so much space for lots of love in and spread it out thru yoga with Adriene. Thanks so much, Adriene.. Wishing everyone a lovely day ahead. Namaste 🙏❤️",Rini Chudri,2021-01-15T13:09:14Z,0
I think I finally understand where the psoas is!! Definitely felt some space there 🙂,Rachel Robertson,2021-01-15T13:09:12Z,0
Loved this session!!,Marilyn Everett,2021-01-15T13:08:49Z,0
💛,Valeria Trotta,2021-01-15T13:08:21Z,0
Hi classmates :) I’m curious - how many of you would be interested in a 45/60 day journey? I’ll be so sad to see this month end ...,Victoria,2021-01-15T13:05:09Z,2
@Yoga With Adriene oh!! Do you do one every month? I just thought it was every January!,Marion Exley,2021-01-15T18:17:25Z,0
@Yoga With Adriene yay!! Does each calendar build up over the course of the month difficulty wise?,Victoria,2021-01-15T15:26:35Z,0
"Let&#39;s keep going! We can continue to meet on the mat with our free monthly calendars. You can always find the newest one here - <a href=""https://yogawithadriene.com/calendar/"">https://yogawithadriene.com/calendar/</a>",Yoga With Adriene,2021-01-15T15:16:01Z,2
absolutely.  I was just wondering what we could all do together when this ends? maybe we could all do another one of Adriene&#39;s journeys that is already on youtube?,Marion Exley,2021-01-15T14:34:04Z,1
