comment,id,date,num_likes
"This worked wonders for my shoulders! At the end I was able to stretch my arms right up over my head which I can&#39;t normally do, it was a lovely surprise that the space was there! 😃 Thank you as always, each session is more amazing than the one before as the layers build on and beneath one another, beautiful 💜",Natalie Hammond,2021-01-15T20:42:31Z,2
wuhu♥,Bebernana,2021-01-15T20:42:17Z,1
Wow awesome practice today..I can&#39;t believe how much strength I&#39;ve already built since day 1. I literally couldn&#39;t do a plank before! Thank you Adriene!! 🙏,hannah blanco,2021-01-15T20:41:29Z,2
"Loved this practice, I feel sad at the beginning for personal issues but this practice, your voice and humor made me feel much better and make more room inside.. thank you!",Mono oulin,2021-01-15T20:41:10Z,9
Day 14 done! Thank you!⭐,itssohardtosign,2021-01-15T20:40:45Z,2
"I was feeling super cranky today, restless and stuck at the same time. So I decided to clear out my closet and got rid of everything that didn&#39;t serve me anymore...only to arrive to my practice at the end of the day and read the lovely mary oliver poem in your letter and receive your encouraging words at the end of this video, lovely serendipity! ♥✨",Mijke Van Leersum,2021-01-15T20:38:13Z,8
"Loved this one!  Practicing with almost 16,000 people.  What an amazing thought.  Thank you!",Olly Holscher,2021-01-15T20:35:01Z,5
"This was incredible, thank you from the bottom of my heart Adriene. Really felt myself there. !4 days! Woohoo! We are so awesome.",Gosia Buzzanca,2021-01-15T20:34:43Z,2
"This practice was so yummy, definitely my favorite so far. Yesterday was specially hard for me, I just wasn&#39;t feeling up to it, but I did it anyway and I was proud. But today was a surprise, it was almost like a dance, and it is true, every day is different, every day will be new, and sometimes that is the best part.",mariana campos,2021-01-15T20:34:10Z,8
Absolutely loved today&#39;s practice!  Not sure what it was about it but it just worked for me and I felt so good at the end.  Looking forward to tomorrow!,Rochelle Noel,2021-01-15T20:34:08Z,2
This has been my favorite so far! 🤩🤩🤩,Eila Zalles,2021-01-15T20:32:32Z,2
"I am still here with you, Adriene! And with all the lovely people practicing Breath 💕",Margo,2021-01-15T20:31:37Z,4
"2 weeks with Breath, my body and mind are so grateful 🙏😁",Juli V,2021-01-15T20:30:50Z,2
"Adriene, I never feel more comfortable in my day than when I am on the yoga mat with you.  I&#39;ve been practising yoga for 50 years and must confess that your warm feelings wrap me in such comfort and peace.  Three cheers for you,  Adriene! (I celebrated my 76th birthday on January 2nd.)",Helen Valenzuela,2021-01-15T20:30:36Z,764
I’m a Jan 2 birthday girl too!! Happy belated birthday!!,Khushi Kaur,2021-03-05T01:29:51Z,1
This is so empowering to read. Three cheers for you from a 24 year old woman!,Nora Jasna,2021-02-07T20:26:30Z,0
What a lovely message!!! Congratulations and happy birthday 🎈,Laura Cobbold,2021-02-07T08:51:07Z,0
happy late birthday and wish u lots of joy &lt;3,Nino Gogua,2021-02-04T07:29:33Z,0
Happy Birthday!,Maddalena Cevese,2021-02-01T12:35:05Z,0
"Feeling a lot better than I did yesterday and love that I&#39;m able to carve out this daily practise making me feel like I can do everything better, manage my workload and get things finished on time, respond not react to situations and overall feel mentally and physically better within myself. Thank you. Namaste from New Zealand x",Motorcycle Travels Site - lonelyT.W.A.T,2021-01-15T20:29:54Z,2
"perfect friday yoga , love breath yoga, thank you Adriene",Cynthia Hart-Jones,2021-01-15T20:29:09Z,1
"Aaaaah I like it so much! I&#39;m new to Yoga and this journey already does a lot of good things to me, for me. Thanks a bunch!!!",Kath Moon,2021-01-15T20:28:30Z,2
Have I mentioned how much I am enjoying this journey????? 😍,Nancy M,2021-01-15T20:28:01Z,8
Things are getting a little bit easier each day and I am so excited and so so grateful! &lt;3,Corina,2021-01-15T20:26:53Z,2
"So, I&#39;m pretty exhausted because of my depression. Just, you know, one of those days when you stare at the wall and wonder why the hell you&#39;re so fucking exhausted and you begin to think you&#39;ll get stuck in this powerlessness and tiredness forever. Insomnia doesn&#39;t help to fight this feeling either. <br />And when I saw this 36-minute-long video I thought to myself &quot;no way, not today&quot;. I just wanted to lay in bed forever and sleep, because that&#39;s the closest state to being dead that I can get like NOW. But I remembered Adriene saying &quot;a little goes a long way&quot; so I decided just to press start and do like 2 minutes. During the practice I was like &quot;I&#39;m so done with this, I can&#39;t&quot; but then something changed and I caught myself... smiling. And then, the video ended.<br />I&#39;ve survived this day and done a 36-minute-long yoga session with Adriene. Yep, I guess I&#39;m a hero now :D",Lizzy Mad Hatter,2021-01-15T20:26:41Z,3
@emlalaa thank you! &lt;3,Lizzy Mad Hatter,2021-01-16T07:51:04Z,1
"@Ia Jes I&#39;m speechless, thank you so much! I hope those tears are happy tears, namaste &lt;3",Lizzy Mad Hatter,2021-01-16T07:50:55Z,0
"@Mary Wells thank you so much, my heart is melting right now, you&#39;re so sweet! sending love back &lt;3",Lizzy Mad Hatter,2021-01-16T07:49:05Z,0
So proud of you! 💗,emlalaa,2021-01-15T21:36:38Z,0
I cried a bit reading this. You just moved a mountain right there.,Ia Jes,2021-01-15T20:59:02Z,2
Thank you for that Ariana reference! 😂,Natalie Giannotti,2021-01-15T20:26:32Z,2
Today’s practice was divine and I felt strong and totally in tune with my body! Thank you! 🤗🙏🏼,Kenia Kennedy,2021-01-15T20:23:20Z,8
Really enjoyed this practice 💕,Lina La,2021-01-15T20:23:03Z,2
I had been having intermittent tension headaches and just realized how they have slowed down and had less intensity. Thank you.,Joyce Daneke,2021-01-15T20:22:15Z,19
"lately, under the influence of the cold weather, I was yawning at the beginning of the class. passes after a while. I still continue my lesson. because I know I&#39;ll be a better me in the end. Thank you🙏🏻💕",Güneş,2021-01-15T20:19:57Z,1
"That happens to me too, can&#39;t help but yawn at the beginning of the practice! I guess it&#39;s some sort of a release. :)",emlalaa,2021-01-15T21:38:10Z,1
Glad to know someone who was there with me. Take care.,Joyce Daneke,2021-01-15T20:20:36Z,3
"I like how the intensity increases slowly from day to day, bulding strength :3",Mark Firman,2021-01-15T20:19:07Z,1
"Curiosity , energy and lots of love for this creative practice muchacha...graciaass!Enjoy fellow yougies!Namaste!",hajlana,2021-01-15T20:18:35Z,1
Should I take this 30 days yoga if I suffer from scoliosis and Kyphosis? I am 61 years old.,Patricia Colin,2021-01-15T20:18:14Z,1
"I&#39;m not a doctor by any means but I would say listen to your body. :) If there is pain during the practice, then of course stop, but if not, go for it, just be gentle and take breaks if you need to. Adriane has a wonderful way of giving tips on how to adjust and make the positions easier, if needed.",emlalaa,2021-01-15T21:41:16Z,1
"This is one of my favorites of the challenge. I was feeling really down today and wasn&#39;t sure I would be able to make it especially after I saw that it was a little bit of a longer one. I was really dreading the length but I am so happy to say that I made it and I feel great. If anyone is feeling like they may not make it today, I want you to know I was right there with you but this one really lends itself to meeting you at your level and by the end I was ready for more. Thanks Adriene!",Karli Blank,2021-01-15T20:18:08Z,2
"Two weeks in and feeling notably less anxious, the little routine I have in the evening of setting up my space, getting changed and hitting play is so comforting during this crazy time. Thank you Adriene.",Sara Byrne,2021-01-15T20:16:20Z,3
"Really complete practise, I love it, I feel it, Namaste",fanny bernadet,2021-01-15T20:16:18Z,1
This was so great.. Al hamadlelAllah .. 🌸💚,Haneen Hassan,2021-01-15T20:14:07Z,1
This one was the best yet! I loved it. 🦋🦋🦋,roots & clauds,2021-01-15T20:11:26Z,1
Really enjoyed the pacing and stretches in this video! Thank you so much for sharing this wonderful series with everyone!,Andrew Bowen,2021-01-15T20:11:15Z,1
"This was super refreshing, I feel ready for my night shift now!",anzuanias,2021-01-15T20:09:48Z,1
"So far my experience is best described as life saving activities.  It is just so difficult to deal with the anger, frustrations, and despair of everything happening now.  These practices have encouraged me to open my heart to those things where I can make a difference and know yoga and especially Adriene have my back.  Thank you so much.",Rebecca Whipple,2021-01-15T20:09:26Z,2
Thank you so much Adriene for bringing happiness and strength. I really appreciate and enjoy your humor and thoughtful guidance in our yoga practice together. Everyday I look forward to your class. Have a wonderful day.,Sheryl Frey,2021-01-15T20:08:39Z,1
"I was supposed to do the Day -13 first since I wasn&#39;t able to do it yesterday, but I accidentally clicked on this video and realized it after finishing 🤦🏼‍♂️🤷🏼‍♂️😂😂😂",Oznur Oznur,2021-01-15T20:07:36Z,1
That was super delicious and freeing wow ❤️❤️can&#39;t wait for day 15 😍,Aya Aly,2021-01-15T20:07:04Z,1
"This is also my first 30day yoga journey that I&#39;m following along live. Everytime I enter the practice it&#39;s as if I&#39;m entering a timeless space, it feels amazing. Thank you Adriene, and see you tomorrow!",Yellow Toad,2021-01-15T20:06:25Z,1
"I loved this practice--it really flew by! Thanks for another awesome day, Adriene :)",Claire Maby,2021-01-15T20:04:04Z,1
"Adriene, do you know East Forest music? it goes along so well with your classes! Thanks for another day, sending lots of love. xxx",Flávia Andrade,2021-01-15T20:02:01Z,1
"today was the hardest for me to show up... headache. strep throat body ache fever i couldn&#39;t get a single move right except for 2 downward-facing dogs and a plank i was so out of breath the whole time always ended up in child&#39;s pose actually watered up when i reached corpse pose BUT what&#39;s important is that i tried and modified and pushed myself as best as i can. so tired! looking forward to tomorrow though :&#39;(🤍 i will enjoy, hopefully, a peaceful sleep. goodnight friends ✨",njoud al,2021-01-15T20:01:46Z,1
"@emlalaa thank you for the kind words, i&#39;m feeling much better 🙏🏽",njoud al,2021-01-16T02:47:48Z,1
"So proud of you for showing up, I hope you feel better tomorrow! Good night!",emlalaa,2021-01-15T21:43:50Z,1
Oh my goodness I was so chilled at the end of that. I couldn’t move. It’s so good to own the space deeply &amp; to stop in our busy lives. I loved the star pose - reminding us that we are worthy to take up space. That really spoke to me today 💙. Namaste Adriene.,Liz Curran,2021-01-15T19:59:23Z,10
You are an absolute treasure to our species. Thank you for making this world a better place. 💚,Poppy Banks,2021-01-15T19:59:12Z,1
"Today I practiced with 15,800 of you!",SireSpidey!,2021-01-15T19:58:24Z,2
"I think everyday I have come feeling depressed, because...I am depressed, haha. But I&#39;ve been able to come each day and there&#39;s always a moment where I feel ok. Sometimes the good feeling goes on after the practice, sometimes it doesn&#39;t fully form, but I still come everyday... which is a really good sign I believe.",Tanya White,2021-01-15T19:57:54Z,2
@emlalaa thank you &lt;3,Tanya White,2021-01-16T07:40:56Z,1
So proud of you for showing up! 💛,emlalaa,2021-01-15T21:45:02Z,1
"New mile stone for me! Reaching behind me and holding onto my feet for the entire time Adriene was too. I could never do that before, and the fact that I held it impressed me. It was a really good stretch ❤ loved today&#39;s practice",Christina Van Klink,2021-01-15T19:52:38Z,0
Is it possible to have a favourite class in this journey? Because I think today&#39;s was it. Not only was it exactly what I needed for my laptop-crunched neck and shoulders but I just couldn&#39;t believe how incredible star pose felt. I can&#39;t remember the last time I stood and threw my arms out. So liberating and emotional. Was channelling Julie Andrews running around the hills in The Sound of Music - a far cry from lock downed London. Thank you again Adriene. Added to my &#39;Awesome Adriene Classes&#39; playlist 💫🌈🌸,Helen Daly,2021-01-15T19:52:09Z,0
"Showed up for day 14! Today has been full of thoughts, but this practice was such good service to the body. The only thing I have yet to manage to even start mastering is that I furrow my brows ALL THE TIME and i&#39;m already getting the wrinkles. I&#39;m 28! So it&#39;s a blessing when Adriene says &quot;relax the face&quot;. I wish she could remind me repeatedly throughout the day. <br />Nice practicing with you all!",Vasiliki,2021-01-15T19:49:26Z,0
"It was very yummy. I like how she curated this one even more. I could have focused on more space in almost every movement that I was doing. It was balanced and there was a nice flow to it. Lots of love to inner space, lots of love to outer space. <br /><br />I feel relaxed and ready to continue studying. Was a recharging break.<br /><br />So far my experience is best described as joyful, eye-opening, appreciating, and exploring.<br />I am learning to honor my body and myself. <br />I am learning to celebrate every moment and every breath is a reminder.<br />I felt/I am feeling freer, happier, more loved than the first day I started yoga, 53 days ago.",Pooya Valinataj,2021-01-15T19:48:39Z,0
I&#39;m having a lot of hand pain today unrelated to yoga. Has anyone completed this practice today? Looking for an opinion to try this practice today or wait till tomorrow. Was it very hand/wrist intensive?,Lydia Kelley,2021-01-15T19:48:29Z,0
"Thank you, Adriene!",luumalu,2021-01-15T19:47:46Z,0
Thank you for reminding me with this practice that is ok to just be and pay attention to what I feel and let go with the exhale and accept the level I can do today without forcing myself into a shape. This session has struck a chord with me and I thank you for the resources and hope you&#39;ll be healthy and have further energy to continue to give! Namaste🙏🏻,v.anila,2021-01-15T19:47:13Z,0
"<a href=""https://www.youtube.com/watch?v=PVJtNPVq26Q&amp;t=22m00s"">22:00</a> loved this! Really creating space today.. just in time for the weekend.",Jaime Tan - Enlightened Spoon,2021-01-15T19:45:27Z,1
The Wide Legged Fold... The Toe Stand... Adriene always somehow knows what I need in my practice on any given day! So amazingly thankful for this practice today 🙏,Karolyn Anderson,2021-01-15T19:44:58Z,0
Day 14 ...opening up...feeling stronger...ready to receive😊💗🙏,Snoozy 1,2021-01-15T19:44:37Z,0
👌🇨🇦,Bill Taylor,2021-01-15T19:43:57Z,0
Awesome practice today.,Sharon Howley,2021-01-15T19:43:39Z,0
"This exactly practice was everything that I was needing today! Oh, I feel so good right now! I was feeling pain in my arm and back, now everything is soft and refreshed! Thank you so much again and again, Adriene! I loooove your videos! ❤️",Carolina Ogushi,2021-01-15T19:43:11Z,0
Another Excellent Yoga Class Namaste`- Your Detroit Student,Nzingha Masani-Manuel,2021-01-15T19:42:01Z,0
This session was so relaxing :),denlolify,2021-01-15T19:40:34Z,0
I surprised myself today!<br /> great practice!❤,Nadia Ramirez,2021-01-15T19:40:34Z,0
Had such a hard time focusing today but trying to be kind to myself :),Jana Six,2021-01-15T19:40:13Z,0
Feeling refreshed and ready to take on the rest of the day. Favorite part: if you can bring your head to the ground and I’m saying yeah you’re funny Adrienne 😏💕,Joyce Mebed,2021-01-15T19:39:53Z,0
Absolutely delicious practise for my Friday evening ! Thanks a lot Adriene 🙏🏻❤️,Olivier Lala,2021-01-15T19:39:09Z,0
"When Adriene asked us to become quiet at the end of practice in savasana, my 13 month old started pushing buttons on one of her loud toys and brought it over to me right in my face and was yelling with happiness. I just started laughing and allowed her space to be a sweet darling little human, a true yogi. She takes up any and all space and has no absolutely no concept of boundaries. It’s phenomenal how breath can clear the fog from your sky and drop scales from your eyes and allow you to see truth all around you. Thanks, Adriene, for reminding me to clear the fog. ❤️",J J,2021-01-15T19:38:06Z,40
@Lauren Smith You’re welcome! I’m happy to read that! 🙏🏾,J J,2021-01-18T01:56:00Z,1
"@Jess Spain I totally hear you! I used to get fairly irritated and aggressive about things that disturb my quiet...then I had a child and nothing has been quiet in my life for a while 😂But no, seriously: Being zen or calm or being in a mediative state is not about being checked out, and ignoring all the things around you that may or may not be pleasant or quiet. It’s about being able to check in and being able to notice “that really bothers me and I stay bothered for a while”. To meditate is to contemplate, to notice, to take stock of what is. You approach those noises and disruptions and they are a challenge. They are meant to throw you off balance and see how well you regain yourself. My baby interrupting my quiet IS my practice, she is my yoga instructor for she teaches me what it means to just be with what is happening at the moment. The loudness you experience during meditation IS meditation. ❤️",J J,2021-01-18T01:53:16Z,2
This made me smile inside. Thank you for sharing :),Lauren Smith,2021-01-18T01:40:14Z,1
"Wow. Props for your practice allowing you to see this, mid sequence too! I still struggle with loud/jarring noises, inside practice especially, but even outside practice. They can make me defensive, aggressive, and irritable for some time after fairly regularly. It&#39;s like &quot;OHM, I am zen&quot;-loud noise -&quot;COULD YOU STFU I&#39;M TRYING TO BE ZEN!!!!&quot; <br />......that wasn&#39;t very meditative.",Jess Spain,2021-01-16T06:49:22Z,4
"Thank you! &lt;3 This was exacly what I needed right now. I just finished my first full time week of work experience at a grocery store, my shoulders and feet are falling off haha",Josef Loberg,2021-01-15T19:36:04Z,1
"hey adriene 😊<br />was here yesterday, too, but didn’t check in. in a bit of health challenge, but yesterday my angels helped as i thanked them. and today is better, still weak, but i felt my way through. even when my body is faced with struggles, doing yoga with you always makes me feel better. thank you ❤️",MK's Love and Big Hugs,2021-01-15T19:35:26Z,0
Day 14. Keeping on keeping on. Thanks Adriene,Joanna Wilkinson,2021-01-15T19:30:30Z,0
wearing socks was a wrong idea :&gt;,Sirjana Ale,2021-01-15T19:29:06Z,4
They make yoga socks with a little tread on the bottom. 🙂,sunclover,2021-01-16T03:42:21Z,0
Can’t believe I’ve got this far. Loving it!,John Finnerty,2021-01-15T19:28:48Z,7
"Thanks, Adrienne, the FWFG team, and all 9865 people who practiced with me today! This was my favorite day of the series so far. It is an honor to share this time and space with you. Namaste! 🙏",Michelle N. Collins,2021-01-15T19:28:25Z,3
So far my experience is best described as therapeutic.,Martha Lutz,2021-01-15T19:27:07Z,0
"Day 14! ❤️ I found it ironic how when I was feeling super mellow at the end of practice a horror movie ad just lovingly decided to pop up <br />😂  I was so chilled out I just smiled dopily at it. Today&#39;s practice again showed me how much progress I&#39;ve made - happy baby pose for instance, I remember doing a beginner&#39;s yoga class around 6 years ago and my legs were so bent that it was beyond painful and impossible for me to do - today? no issue, legs straighter than I&#39;ve ever seen them. I even managed to get my palms flat on the ground in that forward facing fold and do a toe rise with no issue. I&#39;m just - flabbergasted. Proud of myself and everyone doing this today!! ❤️",Lauren,2021-01-15T19:25:36Z,1
I LOVED this session. Thank you so much Adriene.💚❤️💙 It was timed perfectly for a Friday too. What a release. My neck agreed &amp; did a massive “C-R-A-C-K”!!!! just to show it’s approval. 🤣🤣,Emma & Tim Fisher,2021-01-15T19:25:32Z,0
LOVED this practice! Possibly my favorite of the Breath series so far (but I love them all so much its hard to say I have just one favorite!),Katelyn Crow,2021-01-15T19:24:54Z,0
So far my experience I realize that I don&#39;t get night time anxiety anymore. That&#39;s so huge for me... AND of course I&#39;m slowly getting stronger &amp; more flexible...this my 3rd year doing 30dys with Adriene and I think this is the best one yet❤Amazing,Ms.Enjoli,2021-01-15T19:23:33Z,1
"So far, time feels slow and fast at the same time. I&#39;m much more present than last year&#39;s journey where some days felt like a chore. Now it&#39;s just a beautiful treat everyday and it feels like I&#39;ve been gifting myself this for such a long time, but it&#39;s not. I guess I&#39;m feeling all the love. Thank you.",Lucie Aidart,2021-01-15T19:23:18Z,0
I&#39;ve had issues with my left shoulder for years and the last few days of practice have been amazing for my shoulder pain.<br /><br />To go with one of the prompts I want to add that I am learning to honor and celebrate my body. The practice has really made me feel more comfortable and confident in myself. <br /><br />Have a wonderful day everyone!,Marvin Jansen,2021-01-15T19:20:42Z,0
"Such a great session, my favourite one yet thankyou Adriene ❤",Aimee Williams,2021-01-15T19:20:21Z,0
more than 10 000 people have practiced with me right now - you are all loved. what a refreshing practice today. love this so much!,Jana Vaas,2021-01-15T19:19:26Z,2
"Hello and all the Love from San Diego!!! I have been enjoying your 30 day yoga for few years now. Thanks to you and my daughter who started me in doing this. I appreciates everything you are doing to help everyone, young and old to feel GOOD! I love your sense of humor and your singing. Almost Halfway....OMG! See you all tomorrow!",Mimi Jimenez,2021-01-15T19:18:59Z,0
"After a really rough day for my mental health I did not want to push myself at 9 in the evening. But Adriene, your mantra of showing up popped its way into my head, and I decided to do just that. Thank you.",Liriand,2021-01-15T19:17:56Z,0
WOW,Sara Landare,2021-01-15T19:16:42Z,0
"Everytime, in a warrior pose, when Adriene tells us to &#39;pivot on the back foot&#39;, I hear Ross Geller yelling in my ear.",Renske,2021-01-15T19:16:17Z,121
Hahahaha! This will forever enhance my future yoga experiences!,Evana Mauriz,2021-02-15T19:43:52Z,0
I thought I was the only one 😅,Clarissa Nitihardjo,2021-02-03T15:42:31Z,0
I love this and know I will always here it from now on,sali morris,2021-02-01T14:48:57Z,0
TOTALLY!! hahaha! Ross is my favorite &lt;3,Ane Lützhøft,2021-01-22T18:51:08Z,0
hahha omg that just made me laugh so hard thanks :),Helene Schröter,2021-01-22T17:07:30Z,3
This one was so lovely! My fav so far!,Nikola Mrázová,2021-01-15T19:16:04Z,0
Lovely!,madalena faria,2021-01-15T19:15:55Z,0
"That felt so good! Thank you, Adriene. Take good care, namaste. 🙏🏼🧘🏻‍♀️",Julia Wolson,2021-01-15T19:14:49Z,0
"Aaaah that felt amazing! I didn&#39;t want to come to the mat today because I was feeling so jittery, but so glad I did! Nice to see everyone!",Bgm L,2021-01-15T19:13:52Z,0
"So far my experience is best described as blossoming, opening, encouraging, enlightening, lightening, freeing, restoring and energizing.  I am learning to honour my breath and all the places in my body that I haven&#39;t spent time with before.  I am learning to honour the place I am at right now and the time I have finally given myself to engage in a yoga practice.  I am learning to celebrate my body and its movement and simple presence in space and in the present moment.  For the past three months, I have felt pain in my left arm (had some diagnostic tests this week) and some hip discomfort ( a little osteoarthritis) but I feel more aware of my body now and an overall sense of comfort and elongation and space and more openness --despite the fact that yoga is new for me and some of the postures are difficult for me--along with the movement from one into another.  After this 30 day series, I am looking forward to working through Adriene&#39;s Foundation Yoga videos.  I feel so supported by Adriene&#39;s approach, her commentary, her sense of humour and her humanity --and happy I am here!  Thank you!   (and I LOVED Day 14!)",Susan Beaumont,2021-01-15T19:12:08Z,0
O sweet Adreiene. I don´t know how to thank you for what you are creating here for us. I really love what you are doing. You make such a huge difference in my life. I really love all of the days but somehow this was my favourtite day so far. I am so sure I will do this session again and again. Sending lots of love from Austria to the community and especially to you and sweet Benji.,Verena Bousek,2021-01-15T19:09:15Z,0
"Over 9,000 people did this with me!!!",Christina Yocca,2021-01-15T19:07:52Z,3
Incredible!,Yoga With Adriene,2021-01-15T22:20:12Z,0
Today’s practice felt awesome. I definitely will come back to this one in the future. Thank you Adriene.,Sümeyye Atalay,2021-01-15T19:07:32Z,0
