comment,id,date,num_likes
"Want to travel with your pup? In this video, I share everything you need to know to travel with your dog. From the pre travel planning to in flight must knows and even what to do once you arrive at your destination!",Kristen & Siya,2019-01-16T17:07:48Z,20
"There&#39;s one thing not covered was those put in the cargo hold, what do you do in that situation?",Bobspineable,2020-12-09T04:18:01Z,0
How big is your dog?,Alin Ropero,2020-08-19T15:39:01Z,0
I brought my dog from Medellin to Mexico and it was 8 hours of customs and waiting and paying. You have to use an agency it’s a pain in the ass. And expensive good luck,Atlas Chavó,2019-12-21T21:25:44Z,0
@Alonso Rodriguez Did you get any info regarding this? and all other lay overs in general? :(,Trixia G,2019-10-30T03:33:16Z,0
If I do a hour lay over in panama from colombia heading to Mexico do I have to see what laws and regulations are for panama or don’t matter if panama is only a lay over,Alonso Rodriguez,2019-09-18T10:09:49Z,1
Can my german shepherd stay in a crate for 13 hours once a week?,André Menezes,2021-04-24T16:42:32Z,0
How much does getting the certifications cost?,Emily Chandler,2021-03-25T01:20:35Z,1
"Where do you leave your dogs when travelling? Would recommend leaving them for a longer period of time? I would like to travel and take my dog with me but I can&#39;t, she is a 19Kg dog and  I would have to put her in the cargo, I had to do this once and apparently she would not move at all for the whole time she was inside the aeroplane because she was too scared and I don&#39;t want to cause her to be scared or anxious again. She is an anxious dog by nature but she is very loving and very attached to me,  we like to be together and explore new places but she can&#39;t handle too many stimulations, she can&#39;t be in an overcrowded place because she would get anxious and overstimulated, she likes to be in natural places where she can be free, even though she is always checking up on me to make sure I&#39;m not too far from her. <br />I could leave her at my parent&#39;s house, which she knows very well, but they can&#39;t take her out much and she feels very sad when I&#39;m leaving her, even for just a few days, what should I do? should I give-up travelling?",Lucy Crivella,2021-02-22T14:35:25Z,0
"Thank you for the video, I&#39;m traveling with 3 little ones to Guatemala from texas I&#39;m still a little lost but I still have 10 months to figure out",BB CC,2021-01-30T14:10:58Z,0
How about traveling with your 🐈?,Scott Pool,2021-01-11T11:54:31Z,0
Gruff growel. and my guys are my 80 lbs a pc. German Boxers. planes hate these guys unless I buy a seat for them. Or.. A Container ship.,Christopher Mair,2021-01-08T06:52:43Z,0
"There&#39;s one thing not covered was those put in the cargo hold, what do you do in that situation?",Bobspineable,2020-12-09T04:18:03Z,0
Can a vet provide any anxiety meds for dogs ?<br />Our dog is very sweet but a tad neurotic and going into cargo is likely going to terrify her.,Banana Patch,2020-12-06T01:29:38Z,0
so helpful...I wouldn&#39;t have thought to click the livestock on the declaration! I am going march 2021 to pick up my puppy in Europe and this has been super helpful!,Kelly-Lynne Reimer,2020-11-27T02:05:03Z,0
I forgot what airlines do allow bulldogs but under certain circumstances and conditions,HayleyLovesLife 101,2020-11-17T21:09:44Z,0
Where would the dog be left if quarantine is needed?,HayleyLovesLife 101,2020-11-17T21:08:32Z,1
Did your dog travel with you under the cabin or in cabin?,fred pimpsin,2020-11-12T11:15:54Z,0
Kristen - how tall is Atlas exactly? &lt;3 Can he stand up fully in his crate when it&#39;s under the seat or are they OK with him only being able to lie down then?,Saphyre Studios,2020-10-28T13:49:44Z,0
"People who have taken their slightly oversized dogs as hand luggage (meaning, not complying with all the height requirements of the airline), how strict are they when it comes to the dog being able to stand up fully in the crate? I want to buy a crate that allows my dog to stand up fully when expanded, but then, if it&#39;s to be put fully under the seat my dog will have to lie down during this time and the crate is made of mesh so it folds. He is able to turn around easy enough it seems. He is a dwarf poodle, 32cm/12.5&quot; tall, 5kg/11pounds. The flight will be in Europe so not longer than 4.5 hours.",Saphyre Studios,2020-10-28T13:46:14Z,0
"Thank you for this valuable information. You mentioned service dogs being allowed in the seat with you but this is inaccurate. Your service dog is required to fit under the seat in front of you. This is gonna be interesting because my service dog is a German Shepherd and I&#39;m pretty tall.... And some airlines will discriminate against you and prohibit you from flying in business or first class. This is totally against the law in the US but I&#39;ve had friends forced into economy seating and even kicked off the plane for refusing to be moved from the class they paid for to the lesser class. In most cases because the flight attendant hated or was afraid of dogs. Again, thank you for this valuable information. I had no idea about the Rover app and we&#39;re going to the Dominican Republic so I&#39;m hoping it comes in handy. Also, the information about the health certificates is spot on. Most countries I&#39;ve traveled to require a health certificate issued within 10 days prior to travel before they&#39;ll allow you to take your pet/service dog.",Dr. Michael Commini aka Dr. See,2020-10-23T07:48:29Z,0
"I plan to backpack europe for several months later in life, and I want to bring a dog. I&#39;m planning for that dog to be a breed such as a Belgian Malinois or a Border Collie. I will most likely be traveling solo for the most part, so I want it with me for protection and company. What types of rules are there for moving through a whole bunch of countries with a dog?",Neveah Baranko,2020-10-04T19:17:34Z,0
What airline do you go on? I&#39;ve been looking for an airline that allow pups in the cabin that goes back to my country,Mango the hamster,2020-08-19T08:24:23Z,1
Jetblue is one,DJay Stream6000 Live,2020-08-29T07:15:19Z,1
Korean air only allowed all banned dog breeds,Floyd Niño Simblante,2020-07-26T11:00:43Z,1
Its the video I wanted to watch. Great work and video!!!!,Lazluz,2020-07-14T03:06:04Z,1
"I don’t have a dog but I am soon gonna get one, just wondering where do u throw away the puppy pads once they poop or pee? Do you flush it or do u throw it away in the bathroom trash can? Because if u do keep where do u put it?",Kit,2020-07-11T17:43:06Z,2
"@Blu Fishy lol just making sure because some idiot probably bottled some people and said to flush it down the toilet, there was like 6 people who said to do that, I think they probs deleted there comment. I’m definitely not gonna bring my dog on a flight in a long time because corona. Spade (my dog) sent kisses.",Kit,2020-10-31T01:39:18Z,0
I know this is late sorry but NEVER flush the pad down the toilet if you want you can throw the poo in the toilet and put the actual pad in a plastic bag and throw it away or just put the whole thing in the plastic bag to reduce smell and toss it hoped this very late comment helped lol,Blu Fishy,2020-10-24T02:45:12Z,0
What breed ist atlas?,glo1505,2020-06-20T19:09:35Z,0
after watching vlogs nonstop ifinally kno how to fly w my pup w and wo a carrier. just put a service dog harness on w ur leash if they r too big for a baggie. and get the extra leg room space pay a little extra. or get a regular seat. or even first class space to keep it safe. iwas having panicattacks about my flight taking my dog w me but ohh i feel so relieved to see so many take their big dog and small dog on flight and not have to put them in that bottom part of the plane,violadash,2020-06-03T11:02:31Z,0
"Maybe I misunderstood but I think you said you would put a SERVICE DOG vest to fly your pet dog? Let me explain something....only so many canines are allowed in the cabin. I WOULD LOVE TO SEE A FAKE SERVICE DOG go thru the TSA scanner. To suggest someone buy a vest or patch for their pet so they can save a few dollars shows just how many pieces of 💩 people there are. I HAVE A SERVICE DOG &amp; ITS SORRY ASS PEOPLE lying about their furbaby being a SERVICE DOG really pisses me off AND I can easily tell the difference. There&#39;s 2 things 99.999% of pet dogs will not do that only a properly trained SD does. TSA agents SHOULD BE EDUCATED to spot the &quot;fakes&quot;. My Berner is the poster child for a service dog in flight. He is NOT a pet. He is assistive medical equipment. He is my lifeline. He performs several lifesaving duties every day and knows 40+ commands. NOT TRICKS. I&#39;m not counting those. Tricks are what people teach their pet dogs. A service dog MUST know many commands and often the command isn&#39;t even spoken. So, If you ever run into me and my SD in an airport.....you can count on meeting me bcuz when I see somebody faking a service animal I have no problem calling them out on it &amp; I dont care who hears me!!! If I have to buy an extra seat bcuz of my SD&#39;s size when we fly on smaller planes, then you can bet I&#39;m watchful of people and their pets.",Tales from the Leash Bernie & Amy,2020-08-27T04:10:25Z,1
"I know you&#39;ve got a smaller pup.... but I have a big german shep/chow mix and don&#39;t know how to travel with him. I am going moving to France in 2 or 3  years. and am taking my dog and cat with me. I&#39;m honestly clueless.. do I have to renew all of the papers every single month If I am living there? I am going there on a working visa for someone I know and will be working for them., I&#39;ll be staying with her and her sister...  and we are staying there for quite a few years.. I am going to be sending my luggage on a ship over a few days prior and they&#39;re picking it up. it takes longer but it&#39;s less expensive (I have a good idea of the actual moving process) but I need help on that grey area... my cat can prob go in the cabin, but my very motion sick, anxious, separation anxious dog is what I am confused about! thx so much for any tips",Phae Starr,2020-04-20T21:42:42Z,0
Hello!! I’m wandering if my dog is a little more heavy like 500-600 grams they will but me on cargo or they will be a little flexible?,george apostolopoulos,2020-03-16T23:39:39Z,0
"Great video... .thank you so much for taking the time to post all this super helpful stuff.  We are planning on traveling to Spain with our dog.  Do you (or anyone reading this) happen to know if the USDA health certificate (and other documentation) needs to be translated into Spanish?  If not, do you know where we can find out?  Thanks in advance...",Lola Y Paco,2020-03-08T19:41:36Z,2
Let me know if you find out please!😊,Talia Verburgt,2020-06-08T21:11:23Z,0
Love this... We&#39;re looking at traveling with pups. And I get such anxiety about our two little pups and travel.,olivia marmalade,2020-01-27T21:05:53Z,4
My dog is 90 pounds and she is a pitbull mix but she is very friendly very scared of people I do not know what to do after seeing this video I am moving to Ghana Africa but I cannot leave her behind she’s all I have,DeJay jackson,2019-12-14T02:01:44Z,2
Were you able to bring it with you? Im fixing to vacation in ghana and want to bring my cat.,Psychedelic Child,2021-04-17T00:37:52Z,0
"what breed is your dog? my girlfriend got a stray dog, it looks almost like yours, and we were wondering what breed it is.",fahmid siddique,2019-11-13T07:01:19Z,0
"Hi! Thanks for this video! Very informative! Though I would like to know if we are in transit through other countries, do we have to comply with import permits or is there need for that since the dog will just be in relief areas of the airport?? :(",Trixia G,2019-10-30T03:32:16Z,4
"I have a dog just like that, He&#39;s The Duke.",Xanther Blaze,2019-09-28T10:23:44Z,1
"Awesome video! I have a question in regards to my baby boy, Chico Phillip. He’s traveling with me on an airplane for the first time and he’s an anxious dog. I’m having an issue with finding an air line that allows a big enough travel bag that I can make Chico fit into. He’s a standard dachshund so he’s pretty long. I prefer for him to be beside me so he can be more calm. I would really appreciate it if you can give me any tips.",Danny Marcos,2019-09-22T03:08:09Z,0
Question if I’m bringing a dog from colombia and a hour lay over in panama to our final destination Mexico do you have to see what laws and regulations are required for animals coming into panama are ir it doesn’t matter if it’s only a lay over?,Alonso Rodriguez,2019-09-18T09:54:27Z,0
Your dog doesn&#39;t belong on an airplane. Leave it at home. You&#39;ll both survive.,Eric Bedenbaugh,2019-08-17T22:11:39Z,0
"<a href=""http://www.youtube.com/results?search_query=%23Beastialty"">#Beastialty</a>",Jeremy Cornwell,2019-07-21T20:02:55Z,0
"<a href=""http://www.youtube.com/results?search_query=%23Plagued"">#Plagued</a>",Jeremy Cornwell,2019-07-21T20:03:21Z,0
Why can’t certain breeds fly????,Siobhan cox,2019-07-18T04:39:14Z,0
"thier noses are &#39;squished&#39;  (think pug, bulldog) so they have trouble breathing. On planes, with low air pressure, they can really struggle and often become short of breath, panicked, etc.",NarniaFan,2019-09-01T11:56:05Z,0
"<a href=""https://www.consumerreports.org/air-travel/new-rules-of-flying-with-your-pet/?EXTKEY=I175E000&amp;utm_medium=contentmk&amp;utm_source=keywee&amp;utm_campaign=money%7Emobile%7Ex&amp;utm_term=fb&amp;utm_content=395974&amp;kwp_0=1283117&amp;kwp_4=4059965&amp;kwp_1=1691211"">https://www.consumerreports.org/air-travel/new-rules-of-flying-with-your-pet/?EXTKEY=I175E000&amp;utm_medium=contentmk&amp;utm_source=keywee&amp;utm_campaign=money%7Emobile%7Ex&amp;utm_term=fb&amp;utm_content=395974&amp;kwp_0=1283117&amp;kwp_4=4059965&amp;kwp_1=1691211</a>",Dog Doodle Dandy,2019-07-12T17:36:10Z,0
the cuuuuuuutest dog,T M,2019-07-10T00:31:00Z,0
Money thats all.,Fuckstarvin ESKcrew,2019-07-05T17:40:09Z,1
"Thanks a lot for the info,  obrigado 😊",waldo urbina,2019-06-04T09:37:27Z,1
I&#39;m traveling to Spain with my dog and I wanted to see if you had any issues getting in Spain or if he needed to be quarantined?? Besides the health certificates did you need anything else to go to Spain?? I want to make sure I have everything since I don&#39;t want to have any issues. Also do you know how long does the heald certificate is valid in Spain??,Gustavo Adolfo Medina Velazco,2019-05-14T19:28:42Z,0
"Hi!!! Can you tell me about your experience? I want to travel with my dog but I read that if its transatlantic (from america to Europe) the dog must go in the cargo / checked, even if its a small dog. Thank you!!",Cynthia Delgado,2020-01-02T09:41:23Z,0
Thank you for this video. Do you have experience with United Airlines?,Auswandern mit Feder&Foto,2019-04-22T04:36:37Z,1
Well my dog a pit mix service dog . So I&#39;m guessing they won&#39;t allow her.,Michael Stricklin,2019-04-15T03:14:04Z,0
Thank You for this video,Marie A.,2019-03-09T01:12:13Z,0
I love this! So helpful! I am flying to Spain with my dog this summer! I’m nervous and excited!😄,Laura P,2019-02-21T16:56:30Z,14
How big is your pup and what airlines have you traveled on with him?Thanks,ADVENTURE 101,2019-02-19T18:21:28Z,2
"Sadly, I&#39;m not able to watch, cause I&#39;m travelling. BUT, OMG...to cute!!",Naeda Tanner,2019-02-06T03:20:08Z,1
great stuff,simonton piland,2019-01-28T23:23:02Z,0
@las is so cool and calm little G. I have a 4 month old jack russell.. wonder if he can come on to a flight this spring without any hiccups..? Nice vid! =D,Jason Evans,2019-01-17T20:32:07Z,1
This is rlllly good information! I personally dnt think Id ever be able to put my pet through this but its worse for certain breeds (mine being one of them).. Yours is super lucky to travel with you two ❤️🐶,XOh Billie,2019-01-17T20:13:08Z,2
"Good info, plus your dog looks a lot like mine, so he made the video even more interesting!",Maz Zimmerman,2019-01-17T19:10:43Z,0
"I have cats so I can&#39;t travel with them unfortunately but I&#39;m not sure I&#39;d want to anyways! Cats are creatures of habit and they&#39;d freak out with arriving into a new country. But this video is great! <a href=""http://www.thatgirlaway.com/"">www.thatgirlaway.com</a>",Allison B,2019-01-17T15:41:31Z,0
Thank you I was thinking about this just now! Give your dog freeze dried raw food if you want him to be healthy!,Linabella,2019-01-17T05:05:17Z,2
Finally some does a travel with your dog video.  Love it!!! Thank you,Marylin's Adventures,2019-01-17T01:26:29Z,5
What happens if your dog doesn’t stop barking? This is the one and only reason I haven’t traveled with my dog. I have this fear that she would just bark from nerves the entire flight.,supersillyy,2019-01-17T00:52:27Z,3
Talk to your vet about medications. Sometimes a light sedative (only prescribed by your vet) can help,Noelle Oppedisano,2019-01-17T23:24:33Z,1
Mel also what kind of dog / what size,Noelle Oppedisano,2019-01-17T23:23:37Z,0
Mel where are you traveling from? Driving or flying?,Noelle Oppedisano,2019-01-17T23:23:18Z,0
"Oh and yeah, id only do it if he can be with me during the flight",Mel B,2019-01-17T07:42:49Z,0
"Omg SO helpful! Im planning on migrating to Canada later this year and I would love to bring my dog (if not possible, he can stay with my dad). If anyone has any extra tips I&#39;d love to hear them♥",Mel B,2019-01-17T07:41:55Z,1
"As someone who has traveled with my dog on an airline, in cabin. There&#39;s one thing you didn&#39;t mention. Try to make sure that the person in front of you who  is sitting above your dog doesn&#39;t weigh 3000 pounds causing the seat to collapse down on your dog given him an inch of room. Or kids who are kicking underneath the seat. And I pray, I pray you get an airline hostess who doesn&#39;t hate dogs.",B Cobler,2019-01-16T23:48:35Z,56
"Dj Roblox  DJ I&#39;m not rich enough to afford a private jet,  wish I was! If I had the accessibility to a private jet and the dogs could ride in cabin with me I would think that would be the best of both worlds.",B Cobler,2020-11-20T02:58:15Z,1
@B Cobler how bout travelling with ur dog in a private jet? is it safe? (for the dog),Dj_Dobermans,2020-11-20T01:10:46Z,0
{Moonlight Ark}  if the health certificate runs out you will need to find a Vet to issue you a new one.,B Cobler,2020-09-10T02:47:05Z,1
Oh Ik I didn’t travel with my dog that time cause I didn’t adopt him yet but the ppl on there. WAS annoying but besides that I have a question what if I’m moving to a different place using a plane with my dog if what if the health certificate runs out but since I’m moving is it ok when it runs out.,{Moonlight Ark},2020-09-09T19:43:48Z,0
Kassie Rivera no,{Moonlight Ark},2020-09-09T19:40:57Z,0
Thanks for the wonderful video!  Your attitude is the best. Your respect for your pet as a family member. As we do in Finland! Welcome to Finland with your dog and baby. It&#39;s fun in here. And hugs for your lovely Atlas dog !!,helena koivisto,2019-01-16T23:14:27Z,3
"Hello Kristen and Siya,<br />any update on &quot;the little One&quot; and your health ?",Nik Leiser,2019-01-16T19:47:51Z,0
Is the health certification the same as an animal passport?,Alexx renatwin,2019-01-16T19:44:30Z,2
No problem :),Alexx renatwin,2019-01-18T02:03:26Z,0
@Alexx renatwin my bad. i&#39;m from the U.S. and I just assumed you were too! oops!,Noelle Oppedisano,2019-01-18T01:31:04Z,0
"That&#39;s not how it works here, here you get the passport in the country you live in (or are traveling from if you adopt an animal from a ditterent country). And you need to have it too travel between countries.",Alexx renatwin,2019-01-18T00:49:08Z,0
renatwin a pet passport has to be issued in the country you wish to travel to. Example: you must get a passport in Italy to easily travel back to Italy with your pet. They are not issued in the USA. A health certificate is required by country if you do not have a passport . Sometimes the airline still needs a flight certificate,Noelle Oppedisano,2019-01-17T23:21:32Z,0
"And make sure you check out if there are any laws in the country you are traveling to regarding having your dog on a leash. Some countries you have to have your dog on a leash, either parts of the year or the whole year.",Alexx renatwin,2019-01-16T19:41:20Z,0
OMG I loved this video so much! Atlas is such an adorable little world traveler! Do you think it&#39;s gonna be super hard to travel with a dog and a baby?,Lhouse810,2019-01-16T19:31:39Z,4
What are your thoughts on keeping pets in the cargo section of the plane? I&#39;ve heard some pretty bad things from a collegue and it really freaks me out but I&#39;m planning to migrate soon and I&#39;m taking my 2 fur babies (cats) with me. Do you think it&#39;s safe? How do i make sure they don&#39;t suffocate or anything? 😳,Dana Valerio,2019-01-16T19:18:30Z,1
You more than likely can bring cats in cabin due to being smaller size. Check you destination and airline restrictions. Sometimes you need to have an adult pet cat to have them in cabin,Noelle Oppedisano,2019-01-17T23:27:38Z,0
"Dana Valerio i think it’s possible to book another seat for the cats, but both of them have to be in a small travel-cage (?) :)",Vivi Kal,2019-01-16T23:15:20Z,0
Csnt wait to travel this pup some more!,Siya Zarrabi,2019-01-16T19:04:01Z,2
"Can&#39;t wait to see it, my duuudes XD",Jason Evans,2019-01-17T20:39:29Z,0
hi I am a new subscriber and I found it today,Siva Mani,2019-01-16T18:53:30Z,4
"Hi, welcome :)",Alexx renatwin,2019-01-16T19:42:05Z,0
Welcome to HTG!,Siya Zarrabi,2019-01-16T19:03:13Z,0
Awww thank you a thousand times for this video!!! This makes everything more easy! And fun. I wish someone would make a video about travelling (moving countries) with cats. Does anyone knows such a video and could recommend it to me? :-) That was so cool. Thank you so so much again and a have a blessed and happy time with your - now growing - family. Greetings from Germany: Mona,Aly G,2019-01-16T17:39:11Z,7
A lot of what I mention in this video is for cats too!,Kristen & Siya,2019-01-16T18:28:48Z,0
Awesome video! Really helpful. Do you guys think that I can find hostels where they allow dogs? I have a little chihuahua and I am planning a backpacking trip trough South America and I definitely wanna take her.,terry. berrry,2019-01-16T17:38:33Z,22
Kristen &amp; Siya Yeeey that sounds awesome,terry. berrry,2019-02-01T09:00:47Z,0
Absolutly! Just call the hostel ahead of time. There are surprisingly a lot.,Kristen & Siya,2019-01-16T18:29:33Z,5
KRISTEN AND SIYA ARE THE BOMB!<br />HAha I actually started a youtube channel because of Kristen and Siya ALL ABOUT TRAVEL!<br />AND I just posted my first video vlog WITH MY MUM! HAHA<br />would love some support and feedback! and you like then give a subscribe if you fancy!<br />love you kristen and siyaaaa!!!!,Casey Pickup Travel,2019-01-16T17:05:30Z,1
