comment,id,date,num_likes
Prashanth Kumar The XR is at 840p when you put the 1080p setting on YouTube it actually puts it a 840p,Bruh,2020-01-06T18:15:00Z,0
Sc0rpi0nz how is it possible? I’m on XR and watching at 1080p. 🤔,Prashanth Kumar,2020-01-06T18:12:26Z,0
"8K video, and here I am watching in 360p because I have terrible internet connection ahahaha",AlonerCro,2020-01-06T17:05:14Z,0
upload 4k 60 too,pumpuppthevolume,2020-01-06T17:04:01Z,0
"Me after watching GOT season 8<br /><br /><a href=""https://www.youtube.com/watch?v=NbzpwG4n6Vs&amp;t=5m07s"">5:07</a>",Shantanu Maske,2020-01-06T17:00:46Z,6
"I like the idea of more long term hands on use reviews, something where someone just drives a car all day everyday and has real input on it, real use of tech or how I use this item 6 months after use. Love your show and wish I could join your team",Elijah Perrin,2020-01-06T16:59:42Z,0
Yo! Marques is a funny guy!,ANTER,2020-01-06T16:59:13Z,0
Kyo : what are you goals for next decade?<br />Marques : that is a big question <br />Me : 123....7 words,Shantanu Maske,2020-01-06T16:58:05Z,3
I tried to watch this in 8K and my iMac said no.,Zero Braps Given,2020-01-06T16:57:13Z,0
Hdr now!!!!,GermanyLovesYou,2020-01-06T16:55:29Z,1
Are you going to ces 2020,Caro .M,2020-01-06T16:54:42Z,0
"<a href=""https://www.youtube.com/watch?v=NbzpwG4n6Vs&amp;t=7m28s"">7:28</a> Is the phone scratched on front??",Prakhar Jain,2020-01-06T16:54:34Z,0
phantom vs Apollo,Aum Pauskar,2020-01-06T16:54:23Z,0
The intro flash by him was definitely 2020!,Akshay Shah,2020-01-06T16:54:16Z,0
I&#39;d love to see a Model S comparison with the new Raven!,Pekirt79,2020-01-06T16:54:13Z,0
"A case for gesture controls- while, for most, of the population they are pretty useless/gimmicky, I can see how they benefit those who may be disabled and need gesture type functionality in order to use their devices. So I wouldn&#39;t get rid of them, but I also wouldn&#39;t market them as they did for everyday &quot;normal&quot; usage. And while google assistant and siri do well enough for accessibility, it&#39;s always good to have more",Michael Poenar,2020-01-06T16:53:47Z,0
“A Lego drawing of my profile picture”<br /><b>*immediately changes profile picture*</b>,Arthur B,2020-01-06T16:53:36Z,0
Why is the 2:1 messed up in this video. Normally it fits my pixel 3 perfectly,Anay Makan,2020-01-06T16:53:14Z,0
"New decade, new confidence for Marques! I like it!",Zeeshan Atif,2020-01-06T16:51:45Z,0
"&quot;I could probably start uploading 8K starting right now, but I&#39;m not gonna do that yet for 2020&quot; - uploaded in 8K",Steamrick,2020-01-06T16:50:19Z,1
"Great to see a happy person seem even more bubblier than normal. Happy New Year mate, and thanks for all the past and future content :)",Michael Snasdell,2020-01-06T16:47:55Z,0
"what is the point of making 8K video, if no one tv or monitor can support that shit ?",Tollymaster,2020-01-06T16:47:10Z,1
Thanks so much for including my question 😁,Yucy42,2020-01-06T16:46:56Z,1
Yo yellow background in new profile picture doesn&#39;t suit you brother,Joel Frans,2020-01-06T16:46:21Z,0
Are you going to go to floatplane?,Rafael Muñoz,2020-01-06T16:44:16Z,0
Just watched this video on 8k resolution on my laptop and its amazing... Consumed 2GB of data 😂😂😂<br />Waiting for more of your videos to watch in 8k res,Monotosh Sett,2020-01-06T16:44:15Z,0
Marques it&#39;s vibing,Pe tri,2020-01-06T16:43:34Z,0
Most overrated tech trend 2019 ? Clearly Google Stadia...,Marc P.,2020-01-06T16:42:16Z,9
Yes to the video about the &quot;new changes and stuff that&#39;s different about Phantom vs. Apollo...&quot;,ANTER,2020-01-06T16:41:24Z,0
"At <a href=""https://www.youtube.com/watch?v=NbzpwG4n6Vs&amp;t=05m07s"">05:07</a> something lags in your video 🤔 Have anyone else seen it.?",Santis Stenkevics,2020-01-06T16:41:06Z,0
"And the same laged screen at <a href=""https://www.youtube.com/watch?v=NbzpwG4n6Vs&amp;t=8m38s"">8:38</a>",Santis Stenkevics,2020-01-06T16:45:46Z,0
y&#39;all be saying it&#39;s only in 1080p but it&#39;s bc of your browser dumb animals,Keyxfendi,2020-01-06T16:40:11Z,0
i want phantom vs appolo,Syed Amair,2020-01-06T16:40:01Z,0
"iPhone is the most overrated, easily. Of course, that&#39;s mostly by people that don&#39;t know tech.",pharaohosam,2020-01-06T16:38:12Z,0
"<a href=""https://www.youtube.com/watch?v=NbzpwG4n6Vs&amp;t=0m49s"">0:49</a> try to blur ur eyes",kerza,2020-01-06T16:38:12Z,0
thoughts on ww3?,Awesom gameplays,2020-01-06T16:38:11Z,0
Great intro 😍,rahul sihara,2020-01-06T16:37:40Z,1
"Wow, indeed it is 👏",rahul sihara,2020-01-06T16:38:27Z,1
It&#39;s dope intro 💯,rahul sihara,2020-01-06T16:38:11Z,1
Indeed it is,rahul sihara,2020-01-06T16:37:54Z,1
I think he got the phrase “point cameras at” from a video The Verge posted on the new Samsung Chromebook.,Imaad Maqsood,2020-01-06T16:36:09Z,0
Only Pixel 4 gesture I enjoy is volume reduction for alarms when my have is over the phone and I&#39;m deciding to snooze or turn off the alarm.,Michael Jolley,2020-01-06T16:30:51Z,0
Name of intro song? It just takes me to Artist&#39;s page and I have checked every song of his/her on Spotify and I just can&#39;t find it. Anyone?,Slasheerr,2020-01-06T16:30:03Z,0
absolutely make the Tesla Update vid,kiprs,2020-01-06T16:29:00Z,0
yes i want to see the review phantom vs apollo,Raiyan Mohiuddin,2020-01-06T16:28:33Z,0
"Yep, this video is available in 8k. My CPU can&#39;t handle this much.",eywhatswrong,2020-01-06T16:28:08Z,0
Hop outside the Apollo and hop up in the Phantom😂<br /><br />I&#39;ll show myself out💀,Sammy Silva-Solis,2020-01-06T16:27:27Z,1
Sammy Silva-Solis Yeah we’re taking you in for the ransom on that one,Jaydenator Gaming,2020-01-08T07:00:21Z,1
Plz make a car review/update for ur model s,Jan Dlugosz,2020-01-06T16:25:30Z,0
1080 viewers rip like me,Ghost,2020-01-06T16:24:58Z,0
"“…since the last decade,…” <br /><br />（＾∇＾）Nice.",Michael Lampell,2020-01-06T16:21:33Z,0
Please bring out more HDR videos!!!,Joshua September,2020-01-06T16:21:12Z,0
"trash frame <a href=""https://www.youtube.com/watch?v=NbzpwG4n6Vs&amp;t=8m39s"">8:39</a> again!",Rafael Valle,2020-01-06T16:21:11Z,0
An overrated tech trend I want to see stop immediately (but obviously won&#39;t) is every freaking phone has a &quot;Pro&quot; or &quot;Plus&quot; version.,Ry Edwards,2020-01-06T16:19:35Z,0
Love the new opening reveal animation!,MCKNZ,2020-01-06T16:17:10Z,0
Even on my mac 8K is like 1080p with 0.5x speed,Henry Zhang,2020-01-06T16:16:40Z,1
Yay an 8k video on my iPhone 11 720p screen :),Frax,2020-01-06T16:16:25Z,0
"Maybe 3-4 cameras is overrated, but 120hz should be the standard at this point.",Mardy,2020-01-06T16:16:05Z,0
"<a href=""https://www.youtube.com/watch?v=NbzpwG4n6Vs&amp;t=8m43s"">8:43</a> ?",antony kolony,2020-01-06T16:15:29Z,0
Defo wanna see the tesla vid,Typhoon 3s,2020-01-06T16:15:25Z,0
How was the Lasik surgery? I&#39;ve heard it&#39;s like getting abducted by aliens,wee ner,2020-01-06T16:15:17Z,0
"<a href=""https://www.youtube.com/watch?v=NbzpwG4n6Vs&amp;t=8m40s"">8:40</a> You might want to check why this content looks really glitched.",denomino,2020-01-06T16:15:07Z,0
Samsung Neon,Smit Shah,2020-01-06T16:14:48Z,0
"My story with 8K: switched to 8k and it kept buffering forever, had audio off a few ms...immediately switched back to 1080p",Marek Šabo,2020-01-06T16:13:54Z,0
What&#39;s the intro?,Phani Siddhartha,2020-01-06T16:13:05Z,0
Where you scared for the laser?,Sander Van Alphen,2020-01-06T16:11:51Z,0
I would like to see all the new changes and stuff different about The Phantom,Andrei Ciobanu,2020-01-06T16:11:40Z,0
"Unpopular opinion: I don&#39;t think it is the right thing to say that its already a new decade. I don&#39;t think we started on the 0th year, when we first started the 1st decade, I think we started years as 1st years and not 0th year. So I think, we should say that the next decade will still be on 2021st and not 2020th following the logic.",K. Montereal,2020-01-06T16:11:40Z,0
Are you using the oneplus concept one in this video,Maria Corte,2020-01-06T16:11:21Z,0
"Hello.  I am blind. My friends are telling me he is black. I have been listening to him for years and am sure he is as white as you can get. My friends are saying he is not, I am convinced they are in a cult of lies!",Syphon Toastie,2020-01-06T16:10:09Z,0
"I&#39;ve seen &quot;Mk PHD&quot; before, I&#39;ve seen &quot;I&#39;m Khabi HD&quot; before, but this is the first time I&#39;ve seen &quot;I&#39;m Kip EHD&quot; ... Well done youtube auto captions. Clap clap",Robert Dugmore,2020-01-06T16:09:25Z,0
Lego portrait could look a little like Kobe Bryant from a distance as well,lexnite22,2020-01-06T16:09:17Z,0
"Yes please, vid on your new model S!",Lance Dome,2020-01-06T16:09:13Z,0
"trash frame at <a href=""https://www.youtube.com/watch?v=NbzpwG4n6Vs&amp;t=5m10s"">5:10</a>",Rafael Valle,2020-01-06T16:08:31Z,0
"Cool. Thanks Marques.<br /><br />See you in heaven, too.<br />God bless, Revelation 21:4",SevenDeMagnus,2020-01-06T16:07:49Z,0
"Well, I&#39;m watching 8K on 1080p monitor. Yes, I do see difference btw this and 4K. It feels like very extremely high bandwidth movie like of 50 gb blu-ray movie",Prateek Panwar,2020-01-06T16:07:35Z,0
"you are the happiest youve ever been, puts a smile on my face",Vishwanath Akhil Kandagiri,2020-01-06T16:06:36Z,0
"Yes, please do Tesla Model S update!",Sailnoff,2020-01-06T16:06:35Z,0
He really did uploaded in 8K,Prateek Panwar,2020-01-06T16:05:09Z,0
like why do people dislike your videos??? so weird....,Nigel Powers,2020-01-06T16:03:30Z,0
"<a href=""https://www.youtube.com/watch?v=NbzpwG4n6Vs&amp;t=5m07s"">5:07</a> and <a href=""https://www.youtube.com/watch?v=NbzpwG4n6Vs&amp;t=8m41s"">8:41</a> is it recorded on video tape? :D :D :D",Tinas Askus,2020-01-06T16:01:14Z,0
Marques: &quot;I&#39;m going to release this video in 8k&quot;<br />YouTube: &quot;stops quality at 720p&quot;.<br />Me: <b>visible confusion</b>,Wilson O Wilson,2020-01-06T16:00:38Z,21
Wilson the rare breed,british rap,2020-01-07T18:31:32Z,0
Because you are watch the video on phone,WPD,2020-01-07T11:45:06Z,0
the intro was dOpe!,Maimul,2020-01-06T15:54:21Z,1
Stop lying to yourself,british rap,2020-01-07T18:34:45Z,0
"8k is really good <a href=""https://www.youtube.com/watch?v=NbzpwG4n6Vs&amp;t=5m05s"">5:05</a>",George Town,2020-01-06T15:53:29Z,0
"<a href=""https://www.youtube.com/watch?v=NbzpwG4n6Vs&amp;t=8m41s"">8:41</a>   ??????? pixelated and stretched pic",László B,2020-01-06T15:52:21Z,0
"Why not upload 60fps, much more noticable than 8k vs 4k.",Stijn van kampen,2020-01-06T15:50:40Z,0
"Is it just me, or are some of the pictures like the Note 10 lite. Totally fucked?",Stonefors,2020-01-06T15:49:39Z,0
"Make a video on , &quot;Difference in video shot on 4k vs 8k camera viewed in youtube&quot;",Cliff Andrew Oliver,2020-01-06T15:49:35Z,0
What’s your Twitter? Follow4follow,Jaden Cresser,2020-01-06T15:48:58Z,0
That Karate kid hoodie is swag af!! I need that in my life,Erik Pacic,2020-01-06T15:48:57Z,0
you have a link?,Schneiderhahn,2020-01-07T12:23:10Z,0
"<a href=""https://www.youtube.com/watch?v=NbzpwG4n6Vs&amp;t=0m23s"">0:23</a> &quot;Stay right here, don&#39;t move&quot;<br /><br />Me, an intellectual : <b>mOvEs</b>",Arsal Ali,2020-01-06T15:47:09Z,30
You should change your name to MKB8K,fremue 93,2020-01-06T15:46:45Z,1
Thumbs up for a comparison of old v. new Tesla Model S!,Mark Newman,2020-01-06T15:46:23Z,0
"Watched it in 8k, in Jamaica.",Jade Delahaye,2020-01-06T15:45:04Z,0
"2020&#39;s first dual YouTube glitches <a href=""https://www.youtube.com/watch?v=NbzpwG4n6Vs&amp;t=5m05s"">5:05</a> to <a href=""https://www.youtube.com/watch?v=NbzpwG4n6Vs&amp;t=5m10s"">5:10</a>...... <a href=""https://www.youtube.com/watch?v=NbzpwG4n6Vs&amp;t=8m39s"">8:39</a> to <a href=""https://www.youtube.com/watch?v=NbzpwG4n6Vs&amp;t=8m44s"">8:44</a>",Noor Tahir,2020-01-06T15:43:24Z,0
nice lego by asus,Engineering comedians,2020-01-06T15:43:16Z,0
Marques: Haven’t done a Q&amp;A since the last decade<br /><br />Also Marques: I wanted to see 2020 in 2020<br /><br />Me: Marques is a Dad...confirmed,Davis Dean,2020-01-06T15:42:59Z,210
"I have a question for the next one. if you could influence a company to add, change or modify a piece of tech and build it how you think was best by using the full power of your social following, would you, and if so, what would you influence?",M8ee,2020-01-06T15:42:02Z,0
my internet isnt enough for even 4K and 8K are you fckin kiddin me? it makes me so angry that there is no isp in my rural area with fiber yet in using ADSL 2+ at 10Mbps,Manjinder Singh Saini,2020-01-06T15:42:00Z,0
That lego picture is so distracting 🙁,Shubam Parajuli,2020-01-06T15:41:21Z,0
Lasik is the best thing ever!! I was 10/10  and still about 20/20 15 years later,James Nelson,2020-01-06T15:40:13Z,0
Folding phones are overrated,Chet Willow,2020-01-06T15:39:47Z,0
Intro was hot,Whizz,2020-01-06T15:38:40Z,0
shhhweeeiiwww,Leon Willett,2020-01-06T15:38:30Z,0
HEY MARQUES! THERE IS A MALL NEAR ME THAT WILL USE A MACHINE TO PICK AND PLACE THESE LEGO PHOTOS!! THEY STILL DO THEM!!,Weapons Grade Gaming,2020-01-06T15:38:23Z,0
The audio is not up to the mark...a lot of &#39;hiss&#39; with the &#39;s&#39; sounds..maybe high trebels and vocals specific audio profile..,Deepesh Katiyar,2020-01-06T15:35:56Z,0
Lol some of the imagen are strecht AF,Juan David Jimenez,2020-01-06T15:35:16Z,0
The more tesla videos the better!,Someone Else,2020-01-06T15:35:12Z,1
"Who the hell edited, reviewed and uploaded this video!!!",Johanna Denny,2020-01-06T15:34:39Z,0
Thanks Marques for the pinned comment. I thought I&#39;m poor.,Debattam Das,2020-01-06T15:32:56Z,0
Dont have twitter but look for the Klipsch noise cancelling headphones at CES. I wanna know if they&#39;re real competitors to the sony wh-1000xm3 and new bose headphones,Shiv A,2020-01-06T15:32:37Z,0
PLEASE check your videos for glitches before uploading.,Anton,2020-01-06T15:32:10Z,0
it&#39;s not the last decade,Pavle Nikacevic,2020-01-06T15:31:59Z,0
"<a href=""https://www.youtube.com/watch?v=NbzpwG4n6Vs&amp;t=5m09s"">5:09</a>  yet render failed again",Piyush Bista,2020-01-06T15:31:25Z,0
HE SAID SHIT<br />HE SAID SHIT <br />YES I HEARD IT TOO,MINERSD OSMAN,2020-01-06T15:31:00Z,0
that was indeed a relaxing calm vid to watch,Krishna Chaithanya,2020-01-06T15:29:02Z,0
"He indirectly says that 8K is overrated in the title, but never mentions it in the video",Michael H,2020-01-06T15:27:46Z,0
I get it! He&#39;s promoting LASIK so the blurred screen is to make us think we need it 😃,MON TOD,2020-01-06T15:25:56Z,0
Loved the video! Keep up the great work. 🙂,Abdul Rafay Saeed,2020-01-06T15:25:51Z,0
New intro is dope,Sulfan Mohamed,2020-01-06T15:25:44Z,0
"Marques, as a Raven owner myself you must agree that the level of autonomy is still very low. Next time you see Elon can you ask him why he keeps saying Full Autonomy every year when it&#39;s no where near ready.",row0111,2020-01-06T15:25:24Z,0
sound fx! sasahhhhoooo,Chris Kelly,2020-01-06T15:24:39Z,0
"Ok, so this video is in 8k uploaded to YouTube, but can you tell me one thing. Why the hell does my YouTube mobile app automatically play videos in 480p?? I can’t find a setting to change this annoying this, every damn time I boot up the app I have to manually select each video as the highest setting, my smart tv app on the other hand always plays in the highest quality.",Joiion,2020-01-06T15:24:35Z,0
Who else is watching at 8k?<br /><br /><br />On a 1080p screen...,Olly,2020-01-06T15:24:06Z,0
Did I really just make it into an MKBHD video?,Raaghav Aadithya,2020-01-06T15:19:13Z,0
Samsung phones.,Me,2020-01-06T15:18:22Z,0
I watched the video in 1440p on my galaxy s8+ and its actually crispier,acidimitrov,2020-01-06T15:18:04Z,0
Phantom vs Apollo ... YES !,Dev,2020-01-06T15:17:46Z,0
yo what’s up guys I’m Kip EHD here,Peter Selie,2020-01-06T15:17:25Z,0
"<a href=""https://www.youtube.com/watch?v=NbzpwG4n6Vs&amp;t=8m40s"">8:40</a> wow world first  F L E X I B L E  phone?",Chewy Gami,2020-01-06T15:15:13Z,1
&quot;you know what we haven&#39;t done since the last decade?&quot; fucking anything except for a phone review,Papa Louis,2020-01-06T15:14:24Z,0
A quick review of this huge place? Is this possible?,Goseo,2020-01-06T15:11:10Z,0
I love my 65 inch LG C6 last of the great curved TV&#39;s !!,Reedith Graham,2020-01-06T15:11:01Z,0
"<a href=""https://www.youtube.com/watch?v=NbzpwG4n6Vs&amp;t=5m07s"">5:07</a> what&#39;s this",Smile Always,2020-01-06T15:09:54Z,1
MKBHD drives the Batmobile.,Brah,2020-01-06T15:07:49Z,0
what&#39;s the final 8k video size ? i mean capacity..,Born Boy,2020-01-06T15:07:26Z,0
"I can&#39;t take my eyes off of your skin when watching in 8k, that&#39;s distracting...",张培丰,2020-01-06T15:06:27Z,0
"its 2020 now, where is tesla roadster!??",Nedews,2020-01-06T15:06:25Z,0
yeah i wanna see a vid of changes between your teslas please,Collin Penn,2020-01-06T15:06:21Z,0
wow nice galaxy note.,Born Boy,2020-01-06T15:06:21Z,0
The intro 🔥🔥🔥,Tuhami Abuobker,2020-01-06T15:05:58Z,1
what&#39;s the song name trying to find it for ages,Tejas Bawa,2020-01-08T20:54:32Z,0
The song???,Ananth A,2020-01-07T18:00:52Z,1
"Me: <b>**makes terrible joke about 20/20 vision in the year 2020**</b><br />Marquess: I have 20/15 vision, which is better.",Michael Augspurger,2020-01-06T15:04:28Z,2
I assume the squiggly white lines in some of the clips are &quot;under embargo&quot; footage... ? ;-)<br />Nevermind ... read the Pinned comment.,Aitchsh,2020-01-06T15:03:50Z,0
"<a href=""https://www.youtube.com/watch?v=NbzpwG4n6Vs&amp;t=5m08s"">5:08</a> Let us all see a $10k computer glitching...😂",Saravanan SAVB,2020-01-06T15:03:00Z,311
he&#39;s just indicating that he will get a green screen,Kesav Lakshminarayanan,2020-01-12T15:32:53Z,0
"I thought it was like him saying there was going to be a huge green screen in the new space, hint hint.",Dammon Burden,2020-01-12T02:30:56Z,0
Final cut has an issue with png files premier ftw,Bunny.,2020-01-09T15:29:41Z,0
@David black mirror green screen,noobmaster69,2020-01-09T14:36:39Z,0
"If He Using a PC he won&#39;t get single issue or glitch, Mac has limited and lower performance compare to PC a much better performance",FantasyNero,2020-01-08T23:52:29Z,0
"I feel terribly missed out... I&#39;ve never seen 4K videos on actual 4K displays, nor have I watched HDR videos. The cinemas here aren&#39;t HDR as well.",G G,2020-01-06T15:02:50Z,0
“I’m Kip MHD here” - subtitles 😂,VirtuaMe,2020-01-06T15:01:00Z,2
Word,british rap,2020-01-07T18:30:44Z,1
Anne Key PHD is my favorite.,petermcraa,2020-01-06T18:10:26Z,1
"The reason you clicked the video <a href=""https://www.youtube.com/watch?v=NbzpwG4n6Vs&amp;t=11m45s"">11:45</a>",ATAD,2020-01-06T14:59:42Z,1
&quot;no ones going to watch this in 8k&quot; - me watching it in 8k on a 1080p screen ;),Joel,2020-01-06T14:59:04Z,21
Gwiber WurmChild why u tryin to ruin the joke man? xD,Joel,2020-01-08T22:02:22Z,0
Sigh,Cikap-kamuy,2020-01-08T08:30:21Z,0
"watching 8k on 2160p (4k) screen here, it looks fucking lit! Much better bitrate",Daniel Troger,2020-01-07T17:34:24Z,0
@Jammol Trumpet i already know that..😂😂😂..thanks for clearing it ..,Lovepreet Singh,2020-01-07T13:36:43Z,0
@Lovepreet Singh just accept the fact that he&#39;s right and move on in life knowing more. 👉🏿,Jammol Trumpet,2020-01-07T13:30:37Z,0
"when you didn&#39;t mention your videos being 8k, I would have never known",Denzyl Casuela,2020-01-06T14:58:43Z,1
"Overrated Trend:  to me that&#39;s Qi charging.  Wireless tech is convenient because the signal finds you almost anywhere in a room.  Qi charging is the first time I&#39;ve ever seen wireless tech where you have to find the signal.  Cool idea, but not convenient in practice.  If you put a USB-C right next to the Qi charger, either one is just as convenient as the other.  I understand why OnePlus has not adopted it yet.  It&#39;ll be better when the signal can find you, even across a room.",X LessThan Z,2020-01-06T14:56:46Z,0
i&#39;m watching in 8K because.,Paul Parabolix,2020-01-06T14:55:10Z,0
When is February 1st ?<br />MKBHD : 2 weeks from now<br /><br />It&#39;s like Marques saying &quot; Hey guys! I&#39;ve been time travelling the whole time when you all thought I got pre production tech for review&quot;,Alagu Sankar,2020-01-06T14:55:00Z,2
Phantom vs Apollo please,ProbablyAFK,2020-01-06T14:54:59Z,0
Unfortunately I have apple and can only watch it in 1080. But I just never understand the whole thing behind like if u film in a higher res is looks better then being filmed in 1080. Or another example I watch on my computer on my 1080 screen but if I click a higher resolution it still looks way better.,Stephen Lozada,2020-01-06T14:54:02Z,0
"<a href=""https://www.youtube.com/watch?v=NbzpwG4n6Vs&amp;t=10m12s"">10:12</a> assuming everyone is on their phone in the morning and opens a bunch of apps😂😂",Simon48,2020-01-06T14:53:26Z,1
"<a href=""https://www.youtube.com/watch?v=NbzpwG4n6Vs&amp;t=2m07s"">2:07</a> that black and gray army design is actually dope. Nice job on the customization, Marques!",Vidyut Krishnasrinivas,2020-01-06T14:53:23Z,0
Make the Updated Model S video,Daison Marks,2020-01-06T14:52:10Z,0
the 8k option actually looks noticeably better than the 4k option on my 40in 4k screen,Datulab Tech,2020-01-06T14:51:19Z,0
Tesla video...yes please,Philippe Alexander Pagan,2020-01-06T14:49:55Z,0
wait in 8k ??? wtf for cameras do u have,SpIKeZz,2020-01-06T14:49:33Z,0
And now y&#39;all Youtubers starts with 8K xD,Liam Jansson,2020-01-06T14:49:15Z,0
Lol super saf got a lego version of him self too,Superior Monkey,2020-01-06T14:47:48Z,0
Curved TVs is the new 3D is the new Plasma is the new Ambient Light is the new shit they sell us as &quot;the next thing&quot; and no one cares.<br />OLED 4K and you&#39;re good.,Sumit Kumar,2020-01-06T14:47:16Z,0
"Can’t you upload 2 versions , sdr and hdr videos?",John Spirou,2020-01-06T14:45:50Z,0
LEGO falls on the floor and shatters,Stephen Lozada,2020-01-06T14:45:20Z,0
Tbh I think foldable phones are overrated because of the price tag. If they can get it below 1k I think a lot of people would consider it.,RoffaboyS,2020-01-06T14:44:50Z,0
cool,NOOBLIKEPOOPDUDE,2020-01-06T14:43:18Z,0
"<a href=""https://www.youtube.com/watch?v=NbzpwG4n6Vs&amp;t=5m06s"">5:06</a>",TranscriptUK1,2020-01-06T14:43:11Z,0
Heyy. I am watching in 8k. Looks super sharp and amazing,Rithwik Basrur,2020-01-06T14:42:20Z,0
Marques: Hey everyone I got a phantom.<br />Everyone: Expects a Rolls Royce and sees a Tesla.<br />Everyone: Silent.<br /><br /><br />But congrats on owning a Model S. It&#39;s probably the coolest car available on the market.,Gavin Feinberg,2020-01-06T14:41:17Z,7
"<a href=""https://www.youtube.com/watch?v=NbzpwG4n6Vs&amp;t=0m31s"">0:31</a> I&#39;m watching in 140p of course, whole video made up of legos isn&#39;t it??",Hari Kishore,2020-01-06T14:40:22Z,8
Imagine if MKBHD died from LASIK.<br /><br /><br />2019 would have been more grim.,TheSpiderGuy,2020-01-06T14:39:59Z,0
Make bloopers at the end of each videos 😁,GrimReaper,2020-01-06T14:36:36Z,0
Yes to the Tesla video please!,HD EDITS,2020-01-06T14:33:26Z,0
"Stills not rendered, output distortion ALERT!<br />Sorry man. You can re-export the images from photo preview, Photoshop of Pixelmator.<br />It will sure solve the challenge.",TMac Inc.,2020-01-06T14:31:58Z,0
love the new intro &lt;3,Mantvydas Staškus,2020-01-06T14:31:14Z,0
lasik was the best thing i ever spent my money on too.,N. Roy Singh,2020-01-06T14:30:05Z,0
Hahaha,british rap,2020-01-07T18:33:36Z,0
Thumbs up,BroCharles,2020-01-06T14:29:33Z,0
my mcbook air 2018 having issues for 8k now,Ram Soriano,2020-01-06T14:29:21Z,0
How is that OnePlus Concept One ? We know you&#39;ve been using it for 2 months 😪,Alassane Sarr,2020-01-06T14:28:09Z,0
Please return back to the iconic red and black ffss this new icon is horrendous <br />No offence (lol),Muhammad Roohallah,2020-01-06T14:27:31Z,0
"<a href=""https://www.youtube.com/watch?v=NbzpwG4n6Vs&amp;t=5m29s"">5:29</a> 🤣🤣🤣🤣 that laugh",fufu _kdf,2020-01-06T14:27:24Z,2
"@mkbhd I know I’ve heard you talk about 30fps as “the right frame rate”, just curious as to why your vids aren’t 60.",Keegan Briskey,2020-01-06T14:27:00Z,0
8k is overrated,Andrei Lupsa,2020-01-06T14:25:32Z,0
"If you are uploading in HDR, then you are just torturing/punishing those like me, who bought an iPhone 11",Andrew Kwok,2020-01-06T14:24:32Z,0
"144p here, you look like lego..",OK Computer,2020-01-06T14:23:41Z,0
Am i the only one that when he talks about the note 10 lite and shows a beuroll shot of it or pic of it my phone just shows black and white lines,Camryn James,2020-01-06T14:22:18Z,0
Mark ass brownie,GS9_adam,2020-01-06T14:21:57Z,0
make a second channel called mkbhdr,lumitry,2020-01-06T14:21:43Z,0
Please upload everything in HDR!!!,Blahblahblahblahblah,2020-01-06T14:21:06Z,0
A month is not a couple of weeks!!!,iamsifo,2020-01-06T14:20:57Z,0
Time for a new channel “MKBHDR” 😂,Undead Knight,2020-01-06T14:20:47Z,503
@Reuben Humphrey not exactly. Most people think so but actually 4K is not the same as UHD. It&#39;s kind of funny that even the big tech companies like Sony and Netflix say that their TVs or movies are in 4K even though it&#39;s actually UHD.,Ein Google Nutzer,2020-01-08T17:30:45Z,1
Hahahaha,british rap,2020-01-07T18:29:24Z,0
MKB8KHDR,Zach Carmichael,2020-01-07T15:56:35Z,3
@Anujayan ultra HD is 4k i think,Reuben Humphrey,2020-01-06T20:01:10Z,2
MKBUHD,Anujayan,2020-01-06T19:20:59Z,5
playing 8k on my qhd monitor.<br />im genius,Velíček,2020-01-06T14:18:47Z,0
"8KBHD, lol",Marko Novakovic,2020-01-06T14:17:41Z,0
I love the intro. Don&#39;t listen to the stupid dark moders,Hamuel Agulto,2020-01-06T14:17:05Z,0
HDR? No Need!<br />→ XDR<br />Jk,Aaron R,2020-01-06T14:16:55Z,0
