comment,id,date,num_likes
&lt;3 Final Cut still not handling pngs. Couldn&#39;t re-render this one because 8K took an eternity to export 😅,Marques Brownlee,2020-01-06T00:49:43Z,11298
Tried it in 8K framerate suckt,Viner Lives,2021-03-21T09:52:07Z,1
HỢP TÁC QUỐC TẾ NGUỒN REN. DA VÀNG. DA NÂU. DA ĐEN. DA TRẮNG ? 2(M)-1.50-1.80-1.65 ?,HIEU LE NGO TRAN,2021-01-19T11:46:28Z,0
@Dhruv Bhat . FE. nấu THAN ĐÁ. KHẮC. BẢNG IN. mạ CR-KÍNH HIỂN VI,HIEU LE NGO TRAN,2021-01-19T11:44:49Z,0
That explains. lol,Dhruv Bhat,2021-01-19T10:47:10Z,1
"Funny story, last time I went to the eye doctor, they said my eyes had actually gotten better. And I&#39;m pretty sure I was at least 2020 for the prior appointment.",Rufus Mainwaring,2020-12-30T06:53:17Z,0
I AM WATCHING IN 8K,Hyperdynamite,2021-04-22T08:15:41Z,0
"Damn, 8k looks really good on a 1080p monitor",BM365,2021-04-15T03:07:08Z,0
TFW your new fibre connection can handle 8K but your iGPU can&#39;t.,Swaraj S. Aggarwal,2021-03-16T10:19:12Z,0
What if you had a second channel dedicated to 8k video?,PhantomPanic,2021-03-03T09:07:26Z,0
phantom 👍🏾,trevor chikotosa,2021-02-18T13:19:45Z,0
"So my internet can handle the 8K footage, but my MacBook Pro can&#39;t. lol, funny how that works.",Eshu Marneedi,2021-02-14T06:14:59Z,0
"I don’t know why, but to me you look like jaden smith on that lego portrait 😅",Justine Layug,2021-01-21T17:57:29Z,1
Me switching the video to 8K - and i oop.,Dhruv Bhat,2021-01-19T10:42:21Z,0
Hit like if you see the green screen,Qaiser Iqbal,2021-01-16T22:50:27Z,0
"The poised vermicelli thoracically miss because faucet conceivably stop until a clumsy swan. wretched, icky message",John Carry,2021-01-11T16:45:11Z,0
me: switches to 8k<br />my family trying to use the internet:,Julian Walsh,2021-01-10T09:48:16Z,0
2021?,SMBO6,2021-01-06T23:21:09Z,0
"<a href=""https://www.youtube.com/watch?v=NbzpwG4n6Vs&amp;t=10m14s"">10:14</a> seeing 2020  by 2020🤣🤣🤣,  and here iam from 2021 telling you we didn&#39;t see anything except my room for the whole year",Abdo AlG0hary,2021-01-06T17:57:33Z,0
Watching this video again but now on 8K!!!!!!!!!!!!!!!!!!!,akshat negi,2021-01-06T09:33:06Z,0
Watching this in 4320p lol,namcicle,2021-01-06T08:41:42Z,0
I watched it in 8k on a 1080p monitor,Yash Patel,2021-01-05T18:36:39Z,0
Watching almost exactly 1 year later,Capalot Cuh,2021-01-04T15:00:56Z,0
"The secretive heron coincidingly delight because passbook visually love like a dispensable thomas. troubled, elastic receipt",zeke zhen,2021-01-04T12:41:14Z,0
"<a href=""https://www.youtube.com/watch?v=NbzpwG4n6Vs&amp;t=3m08s"">3:08</a> welcome to the next episode of......",SGT_ 5WITCH,2020-12-28T23:30:56Z,0
Me Whos Watching This Video In 360p And Maxing Out At 720p (Not Even 720p@60): <br />I n t e r e s t i n g,SecureComic982,2020-12-22T11:14:46Z,0
"there was all green at <a href=""https://www.youtube.com/watch?v=NbzpwG4n6Vs&amp;t=5m06s"">5:06</a> didnt u people see that .it cant be intentional",Manasa Yaramaneni,2020-12-17T11:01:21Z,0
"2160p,4320p, first time seeing these numbers",Snehansh Kar,2020-12-11T12:45:00Z,0
does anyone know what period means?,Harry Official,2020-11-20T09:25:28Z,0
I think everyone agrees that MKBHD has a great taste in music and Beats... awesome intro tracks ❤️,Vinayak Arora,2020-11-04T18:46:42Z,1
How rich <b>are</b> you?,The BIG Channel,2020-10-12T07:08:52Z,1
the ultimate test for my internet speed,Wasif Amir,2020-09-25T09:16:16Z,0
why is th 8k vid running in slow motion for me,Mahesh Jayakumar,2020-09-25T06:26:10Z,0
i think you should,Asher Mwangi,2020-09-23T13:24:55Z,0
When mkbhd will get a friend.. <br /><br />Hi guys mkbhd hrere<br /><br />I. Using this freind  for a week now 😂😂,AnuJoe Mathew,2020-09-23T05:26:02Z,0
I don’t even have 4K,Mike Hunt,2020-09-17T09:14:13Z,0
i only watch in 4k because my gpu cant play 8k and it uses more bandwidth in 4k compared to 1080p,real cartoon girl,2020-09-12T04:21:27Z,1
8k is beautiful,Will Hutchison,2020-09-01T15:01:12Z,0
Wch mic you used in this video.,Lino Johnson,2020-08-27T03:05:01Z,0
"<a href=""https://www.youtube.com/watch?v=NbzpwG4n6Vs&amp;t=5m06s"">5:06</a> green screen",Цане Димитров,2020-08-11T19:48:48Z,0
i am watching in 8k,Je games rubix,2020-08-05T23:09:11Z,0
Was that... Was that a dbrand&#39;d side mirror? I love it.,kotakotakota,2020-08-05T22:47:31Z,0
"<a href=""https://www.youtube.com/watch?v=NbzpwG4n6Vs&amp;t=12m17s"">12:17</a> where is my sanity... (blank meme)",Carl Does Music,2020-08-05T12:44:31Z,0
Marques stop looking at me,anonymous 12345,2020-08-04T15:52:58Z,0
for some reason i can watch this video on 8k with my macbook air from 2016 with 4gb ram CRAZY i know!,DreKonder HD,2020-08-04T11:59:49Z,0
Lol at the end screen being a few seconds late!,Daniel Hough,2020-07-31T23:16:17Z,0
i actually watched part of this vid in 8k.,Tony Shark,2020-07-31T20:46:34Z,0
His hoodie reminds me of Toby&#39;s Costa Rica hoodie from the office.,Sayed Amir,2020-07-29T17:03:55Z,0
MKB: &quot;got lasik to see 2020 by 2020&quot;<br />2020: &quot;I don&#39;t think so!&quot;,harmee patel,2020-07-24T11:30:19Z,0
Didn’t want click on this because they saw a matte black Tesla,Yonatan Levkovitz,2020-07-20T15:54:41Z,0
So I switched to 8k and now my Macbook exploded.,The Political Moderate,2020-07-20T04:45:44Z,0
"Best in the biz, bro. Best in the biz.",Rydenseasalt,2020-07-17T20:21:49Z,0
"If you upload HDR content, won&#39;t your name have to change to MKBHDR?",TheBestIsRandom,2020-07-14T10:40:03Z,1
"Why green screen at <a href=""https://www.youtube.com/watch?v=NbzpwG4n6Vs&amp;t=5m10s"">5:10</a>",ABDul Saboor,2020-07-13T17:34:54Z,1
That microphone is actually insane it picked your voice up all the way back there,Nacryos,2020-07-12T21:03:44Z,39
@Sam Presley oh ok thanks,Nacryos,2020-11-20T18:01:54Z,2
I’m sure that mic is used for pod casting not this video he is probably using an over head directional mic!,Sam Presley,2020-11-20T17:55:59Z,1
nah not really insane,real cartoon girl,2020-09-12T04:18:27Z,3
cool car,Luciano França,2020-07-10T19:50:35Z,0
"<a href=""https://www.youtube.com/watch?v=NbzpwG4n6Vs&amp;t=0m36s"">0:36</a> thank God he didn&#39;t say Legos...",rohaan Omar,2020-07-09T13:51:38Z,1
I am watching this in 240p,Hans Baier,2020-07-03T08:25:48Z,0
En españa tambien lo podemos ver a 8K y en una pantalla 6K no os flipeis jaja,ReminexD,2020-07-01T09:43:53Z,0
who else watched this in 8k ( ͡° ͜ʖ ͡°),Marko McLane,2020-06-30T17:47:26Z,0
"uhm, I watched this in 8K",Zuko Tola,2020-06-30T15:03:33Z,0
me: watching 8k video on 1080p screen,Identity V: Skywalker,2020-06-30T08:30:21Z,0
TeSlA iS nOt OvErATeD<br /><br /><br /><br />wait... what do you mean that&#39;s just the thumbnail????,Nicholas Stathos,2020-06-28T22:25:44Z,0
Thank you for saying &quot;Lego bricks&quot; and not &quot;Legos&quot; 😎,Malcolm Donaldson,2020-06-21T15:05:50Z,0
I can only watch it in 4k,Isaac does gaming,2020-06-19T23:32:29Z,0
using this 8k video to test my burst speed on my 1g connection :) spikes to 202Mb so im loving this,Im MegaDeath,2020-06-15T14:58:58Z,0
Random green screen 😂,Joey F,2020-06-13T01:27:22Z,0
What are your thoughts on iPhone having 8k display with no notch???🙏🙏🙏,Rishikesh Sonawane,2020-06-12T11:37:26Z,0
Really sad my 3570k can&#39;t handle 8k video...,The OldSchoolGamer,2020-06-10T15:59:04Z,0
"<a href=""https://www.youtube.com/watch?v=NbzpwG4n6Vs&amp;t=5m27s"">5:27</a> rofl I love that laugh",LeafSlizer,2020-06-08T16:25:39Z,0
I learned a new word today - Outro (i.e. opposite of intro),Rohit Banga,2020-06-05T16:25:57Z,1
"Hi guys, I’ve be using coronavirus for about 2 months now.",Nathan Hall,2020-06-01T10:46:01Z,0
E-Scooters. Overrated and don&#39;t wanna see in future anymore!,xShibux,2020-06-01T08:06:39Z,1
Enjoying the 8K Vid on my 1080p Monitor with the groaning of my router in the backgroud,RenchesAndSords,2020-05-29T22:49:28Z,0
Wait I can run 8k what,JayVader90,2020-05-29T14:57:45Z,0
who else watched this in 8k,Connor De wit,2020-05-28T07:50:43Z,1
this actually looks great in 8k.,Lwazi Nxam,2020-05-28T07:30:49Z,1
"<a href=""https://www.youtube.com/watch?v=NbzpwG4n6Vs&amp;t=5m08s"">5:08</a> green screen shows. Didn’t think it was supposed to be that way.",Peter Vitale,2020-05-26T01:13:19Z,0
no one  will watch it in 8k<br /><br /><br /><br /><br />me check settings 8k,a bot,2020-05-24T12:14:10Z,0
I love you 😘 bro,Vijay Charlie,2020-05-23T03:56:05Z,0
Woah bro I can only watch in 720 because I have an iPhone XR,Eshu Marneedi,2020-05-23T00:59:44Z,0
Will you guys be doing a feature on Tesla Home Battery and solar options/specs?  I&#39;d like to see more home tech that lets consumers produce and provide energy.,KAON,2020-05-21T20:20:37Z,0
tesla,xavier maillard,2020-05-21T12:56:42Z,0
Will you ever go bald?,Aniruddh Yadav,2020-05-20T15:41:37Z,0
.... you put the profile photo into a program that basically makes it into pixel art. Then since LEGO has so many colors you just order them from bricklink and bam. Easy-ish project made,The Boss,2020-05-17T07:24:03Z,0
Can we get to see a video of Phantom before end of lockdown ?,Titus Joseph,2020-05-15T14:47:18Z,0
"Hear this is in 8k, think woah, i know my 200 dollar laptop cant do that but lets try it... find out i have it in 360p anyway... At least i got so many steps of picture quality to look foward to.",Tim,2020-05-13T04:17:16Z,0
Haha cool,szewei1985,2020-05-09T04:25:00Z,0
aren&#39;t you scared about cover 19,Ishan Bhattacharyya,2020-05-05T07:46:55Z,0
Me watching in 320p on my pixel 2 lol,Mohammed Elbaba,2020-05-05T00:28:09Z,1
So true lol,Mohammed Elbaba,2020-05-05T00:28:29Z,0
first 8k video!!!,AOS_mkwii,2020-05-03T09:55:29Z,0
PNGs render totally fine in FCPX. Not sure what you&#39;re doing wrong but I would gladly hold your hand through the process.,Jeffrey Librebowski,2020-04-18T15:43:18Z,1
Hdr is indeed worst just like gay 60fps,Random Stuff,2020-04-16T19:39:49Z,0
smart dude!!!!!,Marvin Sanzila,2020-04-14T19:48:11Z,0
I have a Samsung curve 4-K HDR TV and still loving it. I will keep it as long as it keep showing excellent pictures...which it is,Herman Jackson,2020-04-07T19:42:41Z,0
👍🏾,Mark Naamara,2020-04-07T15:33:08Z,0
There for a minute I thought Marques grew out his hair into the shape of a diamond but it was just the background image in the next video preview. 😅(2020 Tech I&#39;m ready for!),Johnny O,2020-03-31T07:42:39Z,0
"those vibes you get when Marques says this video is in 8K, turn on 8K on your cheap Chromebook, and experience the quality you get when you re-upload a video 1000 times.",Excel YT,2020-03-29T16:11:52Z,0
watching this in 8k on my laptop.,Luc,2020-03-21T14:18:48Z,0
mkbdh : i will make a video on 8k being overrated<br />mhbdh : resolution of that video will be 8k,Gaurav Kothari,2020-03-18T12:02:02Z,0
I&#39;m watching it just because it&#39;s 8k... even though it&#39;s on a 1280x1024 secondary monitor. :(,Alexander Wood,2020-03-17T20:55:07Z,0
"Saw this was in 8k, and looked: By default, this vid started playing at 720p. I kicked it up to 8k, and it started to stutter. Dropped down to 4k, and that is slick. <br /><br />I&#39;ve got a pretty beafy video card in my desktop, not sure what happened, but I think this was the first 8k video I&#39;ve tried to play. My monitors are old, and certainly not 4k rated. :)<br /><br />BTW, love the matte black look on the Tesla.",Adam Ross,2020-03-11T14:56:41Z,0
I had PRK done about 4 years ago now. The dry eye affect is only felt when I wake up in the mornings.,DM,2020-02-27T06:38:29Z,0
👍🏽,kloparen,2020-02-26T19:01:05Z,0
Please phantom VS Apollo video,Geniusclicks,2020-02-23T16:51:57Z,0
"I wonder what speaking classes Marques has taken, so clear and easy to understand and seemingly effortless.  I gotta learn these skills, so desirable.  I really admire this kid!",Clint Hightower,2020-02-19T22:44:57Z,0
"What&#39;s the best smart watch, measures heart rate, blood pressure etc.",Ronald Armstrong,2020-02-13T09:15:14Z,0
"<a href=""https://www.youtube.com/watch?v=NbzpwG4n6Vs&amp;t=5m05s"">5:05</a>",Inzo Tineo,2020-02-12T02:23:11Z,0
that hoodie is sick af,Evan Maier,2020-02-11T19:32:30Z,0
Marques: 8k<br />YouTube: auto 360p,RadStaz,2020-02-10T15:32:59Z,6
Awesome,joshua ifill,2020-02-10T00:46:43Z,0
&quot;CES is basically a TV show&quot;<br /><br />That turned out randomly meta,QS 26,2020-02-07T04:52:14Z,1
Cool intro,Simon Chainbers,2020-02-04T04:38:28Z,0
Haha. Dude I’m still watching @ 480p. Like how much can your eyes actually see??? 8K seems so overkill!,The Promised Land,2020-02-01T15:13:56Z,1
"Watching this on a 5K iMac. there&#39;s a little hair floating down to our right and behind of Marques at <a href=""https://www.youtube.com/watch?v=NbzpwG4n6Vs&amp;t=10m30s"">10:30</a>. 8K is incredible.",Ethan Harvey,2020-01-28T22:15:27Z,0
Gesture controls are good by concept it just needs more pinpoint tracking,0398 Harshvardhan Mishra,2020-01-28T15:33:34Z,0
Nice video 8K,Khmer Dhamma Page,2020-01-28T11:16:27Z,0
Tesla video please,ishrath mohd,2020-01-28T09:02:53Z,0
Its funny because i think its possible for me to watch in 8k or 4k videos but I dont want to because xfinity is retarded and will charge me extra if i use more than 100gb of data a month which is very easy in my household since there are 5 of us. Yeah they dont necessary tell you about that.,unpossible11,2020-01-28T01:38:11Z,1
"Marques see´s this, changing the profile picture...",vūlgar,2020-01-27T10:12:27Z,0
"You told us, when u reach 10 mio subs you gonna tell us what the K in MKBHD stands for.",vūlgar,2020-01-27T10:11:16Z,0
He did. I guess you found out by now. It has been four weeks.,Jamar D,2020-02-25T20:43:55Z,0
Tesla comparison? Yes please,DSKM21,2020-01-26T23:55:51Z,0
I THINK YOU ARE THE COOLEST TECH GUY IN THE WORLD..MUCH SUCCESS AND MORE VIDEOS PLEASE 🎁,FORDZACHARY,2020-01-26T23:23:59Z,0
WHATS THE INTRO SONG?,MJ Playz,2020-01-26T16:33:02Z,0
Would love to see the Tesla MS changes video!,TheEvanH09,2020-01-25T12:06:28Z,0
where is this pelican case link???,gilbert angelle,2020-01-25T00:35:40Z,0
Video: is in 8K<br />My screen: Decides the best resolution is 360p,ADLG,2020-01-24T17:45:54Z,0
Hey everyone who can help me promote my game?,Game Gang,2020-01-23T04:58:02Z,0
"<a href=""https://www.youtube.com/watch?v=NbzpwG4n6Vs&amp;t=5m06s"">5:06</a>-<a href=""https://www.youtube.com/watch?v=NbzpwG4n6Vs&amp;t=5m10s"">5:10</a> - was that just a green screen for anyone else?...",Giles Deacon,2020-01-22T09:36:15Z,0
I&#39;d love to see a video on the upgrades between your two Model S&#39;s,Roland,2020-01-22T07:31:32Z,0
"<a href=""https://www.youtube.com/watch?v=NbzpwG4n6Vs&amp;t=7m10s"">7:10</a> PLEASE explain more about that HDR workflow/pipeline! It’s super interesting! I can’t really understand how hdr actually works 😁 like is it possible to create a video with a solid color but changing lumen info? 🤷‍♂",Alessio Facincani,2020-01-22T00:06:26Z,0
"<a href=""https://www.youtube.com/watch?v=NbzpwG4n6Vs&amp;t=5m07s"">5:07</a>",Kush Desai,2020-01-21T17:23:12Z,0
i like that you do not do end screens like everyone else lol,Jerry Mancini,2020-01-21T16:57:19Z,0
"hell no we don&#39;t want a video on your new studio! We want a full series on the whole process, your ideas for every room, construction, furnishing... EVERYTHING!",Alex Heiss,2020-01-21T14:03:33Z,0
"Hey Marques, would you like to help me preach Jesus Christ?",The Mountain of Fire,2020-01-21T06:43:50Z,0
that lego portrait can easily be made at any lego store. you order it online and then come in to get it done. i have one of myself,Hein S,2020-01-21T05:10:47Z,0
:thumb-up:,Raikesson Charles,2020-01-21T04:03:08Z,0
Anyone else hear lil pump in the intro???,Alec Hubbard,2020-01-21T01:28:39Z,0
"<a href=""https://www.youtube.com/watch?v=NbzpwG4n6Vs&amp;t=5m06s"">5:06</a>",G&K Travel Videos,2020-01-20T09:41:23Z,0
What&#39;s with the green screen?,Jestin Joshi,2020-01-20T05:33:28Z,0
It took me until the end of the video to notice the difference between watching this video in 480 and in 1080<br /><br />(On an iPad mini 2),1500 Cuber,2020-01-19T23:59:25Z,1
Most overrated tech? Iphone.,Muhammad Shahzaib,2020-01-19T21:31:25Z,0
I am guessing he got the Galaxy S20 that day! The intro felt like the teaser from unpack event!,Gautham V,2020-01-18T18:02:52Z,1
What&#39;s with the errors?,AbdurRabb Watkins,2020-01-18T17:02:57Z,0
Who da fuck are the 1.4k bitches who disliked maques&#39;s videos,Akshay Sudhan,2020-01-17T14:05:00Z,0
"I love your channel buddy, keep up the amazing work.",Daniel The Official Avatar Vlogger,2020-01-17T04:36:33Z,0
What&#39;s the name of the song. I know the artist i just cant find the song&#39;s name.,ShadMatic,2020-01-16T13:25:06Z,0
You have chosen 2 of your questions from your Indian fans.,Sharukh Qureshi,2020-01-16T05:41:24Z,0
Audio is a little slow...,John Hengel,2020-01-15T18:28:59Z,0
"For some reason I thought you were gonna say 8K was overrated and I was totally onbaord with that. 4K was pushing it, 8K is diminishing returns.",Smellbringer,2020-01-15T05:22:09Z,0
switched the video to 8K - computer had an aneurysm,Simon Kahlich,2020-01-14T23:13:56Z,0
"Cool that you uploaded in 8K. I watched for a while, but the video was jerky. No buffering at this end as I have 36Mbps, but I think YouTube are having trouble serving the videos. I also simultaneously opened a Doug DeMuro 4K video on my second screen and that was running fine but your 8K video started buffering, so I think that YouTube is the problem.  They probably need angioplasty.",moviebod,2020-01-14T22:24:23Z,0
Do phantom vs apollo video,Rami Mohamad Talib,2020-01-14T06:17:47Z,0
Watching on a Curved TV. Screams in Samsung,Goutboy,2020-01-14T03:10:44Z,0
1: iphone<br />2: iphone<br />3:Iphone<br />4:Iphone<br />5:Iphone<br />6:Iphone<br />7:Iphone<br />8:Iphone<br />9:Iphone<br />10:Iphone,clickbait master,2020-01-14T01:34:44Z,4
MORE TESLA VIDEOS!,drgroove101,2020-01-14T01:05:53Z,0
Watching in 8k!,iMaajid,2020-01-13T23:59:05Z,0
MKB8K<br />.<br />.<br />.<br />.<br />.<br />.<br />.<br />8KBHDR.,Dairen Naidoo,2020-01-13T22:32:33Z,0
mkb is low key a legit genius,fhumulani makungo,2020-01-13T06:54:20Z,0
MKBHD Can i Work with you?,Rugashan,2020-01-13T05:15:26Z,0
Logo’s dope,none1195,2020-01-13T02:49:04Z,0
“Im gonna upload this in 8k” And Im watching it in 360p on my phone,Vinny Fama,2020-01-13T01:19:17Z,1
Anyone else notice he didn&#39;t fully answer several questions?,Blake Buthod,2020-01-12T18:38:37Z,0
👍👍👍,MrAJWorks,2020-01-12T18:11:06Z,0
New changes on tesla pleaseeeee,Safaid Chirya,2020-01-12T14:02:03Z,0
"I use a 38&quot; ultrawide monitor with the resolution of 3840x1600. Most of the videos are in 16:9 ratio which is a friggin letdown, considering this is my third UW monitor and I literally can&#39;t go back to do anything on a 16:9 monitor... I tried and it&#39;s limiting. It&#39;s 2020 yet still no content for 21:9. I mean watching a high res 21:9 movie on an UW monitor is the best thing also playing games on it is great. Still no content, why ??? 2020 and they pumping out 16:9 like it&#39;s something good for your eyes , even right now as you read my comment, you see more than twice as much horizontally than vertically. So once in a while it would be great to see some ultrawide 21:9/2.3:1 footage from a guy who uses RED cameras all the time. Also when i choose 8k instead of 4k on youtube the quality skyrockets from &quot;okay&quot; to &quot;now we&#39;re talking&quot;.",Remedym Flakon,2020-01-12T09:06:14Z,0
8k on a 720p screen is damn sharp :D,Hoàng Anh Nguyễn,2020-01-12T08:01:48Z,0
Upload on 4K so I can watch the videos on my Oled TV,Julio Paez,2020-01-12T06:26:18Z,0
What’s the intro track from Jordan Edmonds?,Just That Guy :3,2020-01-12T00:31:59Z,0
"<a href=""https://www.youtube.com/watch?v=NbzpwG4n6Vs&amp;t=5m08s"">5:08</a> is why i don&#39;t do mac",Saturn,2020-01-11T23:45:13Z,0
Where did you get your LASIK done?,Richard Witherspoon,2020-01-11T22:47:37Z,0
Please translate for the Arabic.,Ice tech ايس تك,2020-01-11T21:20:44Z,0
"Using a 2019 MBP and a 2019 Ultrafine LG Monitor, I watched this segment in 5K - at least that&#39;s what YouTube indicates on the screen.  I need to earn more money o watch you fab content in 8K :).  Cool, and yes please, more Tesla details would be interesting, particularly, your experiences with auto pilot, mishaps as well as good haps.",Guill Munoz,2020-01-11T20:37:42Z,0
"I&#39;d love to see Phantom vs Apollo and updates to Tesla. Love their cars and because they haven&#39;t made body changes there aren&#39;t many reviews on it. <br /><br />And that 1% scared me enough that I&#39;m not doing lasik. I wanted it so badly though! I play sand volleyball and am just grateful that there are disposable lenses because after a game they&#39;re done for. Still, you only get that one chance. And if they mess up, it&#39;s all over. Just can&#39;t risk my sight. Still, glad you&#39;re happy and it was successful. :)",Loki D. Wolf,2020-01-11T17:55:37Z,0
Nice,Lewis Lanek,2020-01-11T14:19:16Z,0
Which is your mobile phone ????,aaron greggor,2020-01-11T12:27:23Z,0
Goddamn the quality so crisp that it has the soap opera effect,J S,2020-01-11T11:07:05Z,0
Appest Limited probably loves Marques right now,kittiecommittee,2020-01-11T11:04:47Z,0
"Most overrated Tech of the Decade:<br />1. Electric cars<br />2. Blockchain<br />3. 5G<br />Ironically, that is also where you are going to find the most BS jobs, the most VC money, the most YT videos.<br />I&#39;m checking out from all that $#!T.",Nachannachle,2020-01-11T08:33:07Z,0
Cmon. Start travel by train.,Michael Englund,2020-01-11T07:30:09Z,0
"For us normies, 480p on 8K video is pretty substantial. Better than 480p on 1080p somehow. Does that make sense?",MHDIMN,2020-01-11T05:45:07Z,0
when you didn&#39;t know you actually owned a device that could watch this in 8k,Ramso324,2020-01-11T03:25:00Z,0
Looks like it was shot in 4K and upsampled to 8K and then uploaded to YouTube.,firecloud77,2020-01-11T03:22:56Z,0
Autel Evo 2 stealing the light from DJI is the real story.,Daniel Anderson,2020-01-10T22:53:58Z,0
"Please do every video in 8K from here on out. There is no disadvantage, and those who can stream 8K can experience the higher bitrate :D",Guy Marshall,2020-01-10T21:48:59Z,0
"<a href=""https://www.youtube.com/watch?v=NbzpwG4n6Vs&amp;t=4m27s"">4:27</a> take reviewing things to the next level? I smell an AvE collaboration coming where you actually take the tech apart to look at how it chooches!!",tycho,2020-01-10T20:49:22Z,0
You guys gotta stop with the 8k there is literally no discernible difference on my 4k TV between 4k and 8k,Norse Viking Æsir,2020-01-10T19:47:05Z,0
What&#39;s the hoodie you are wearing?  That&#39;s sick!,volistis,2020-01-10T18:52:01Z,0
Looks longingly at my brand new curved 32&quot; gaming monitor that I just watched this video on...,J B,2020-01-10T16:47:46Z,0
Started Tick Tick at work. Huge difference to my work flow so thanks for that one,Theo S,2020-01-10T16:29:00Z,0
Phantom vs. Apollo. Like this comment!,Lyrinize - AD,2020-01-10T15:52:55Z,1
Surface Laptop in the background of the first minute 👍👍,Blake Walsh,2020-01-10T15:11:04Z,0
"I searched for John Morrison to watch the video...bet then the wwe wrestler came out, aparently hes coming back",Hector Alvarado,2020-01-10T14:52:03Z,0
i tried watching in 8k and was afraid my computer would blow,habibm19,2020-01-10T03:36:24Z,0
"We are in 2020 and Marques eyesight is still in 2015 🤣 <a href=""https://www.youtube.com/watch?v=NbzpwG4n6Vs&amp;t=11m25s"">11:25</a>",Anbu Safari,2020-01-10T03:23:39Z,0
Do a Raven vlog plz.,Emily An,2020-01-10T07:35:20Z,0
When is your cyber truck coming,Hamza Shah,2020-01-10T03:20:01Z,0
i wonder how many products with hidden mics have been sent to Marques Brownlee.,MaximMate,2020-01-10T03:13:27Z,0
"Marques, you should see the Lightyears solar-paneled electric car in CES.",Emily An,2020-01-10T07:35:44Z,0
The Tesla Model S is amazing!,John Green,2020-01-10T02:54:34Z,0
I dream of uploading my videos in 8K. I hope the new flagship phones support 8K video. 📱,West Coast Chicano,2020-01-10T02:36:27Z,0
Would love to see a video on your new Model S!,Elliott Lowe,2020-01-10T02:24:48Z,0
Ive been watching your stuff for months. Idk why i waited so long to subscribe. Your content is always top-notch.,Mallory Scott,2020-01-09T21:46:38Z,0
on CES pls checkout Withings watches,Krzysiek Kowalski,2020-01-09T20:59:51Z,0
&quot;I uploaded this video in 8K&quot; * video defaults to 480p *,fouoii gyhh,2020-01-09T20:48:26Z,1
Your watch tells week durations too?,Timi Aiyemo,2020-01-09T18:55:55Z,0
"Green Screen of death @ <a href=""https://www.youtube.com/watch?v=NbzpwG4n6Vs&amp;t=5m07s"">5:07</a>",Robert Rennie,2020-01-09T18:41:27Z,0
What&#39;s with the green screen,Arshishan Nayudu,2020-01-09T18:11:23Z,0
What was the green square that popped up?,A P,2020-01-09T17:41:07Z,0
"This idea for the future of reviewing is most likely going to be a &quot;How its made&quot; sorta thing, with in depth factory walk arounds, been done before but still alright. If that is true then the reason he can&#39;t really say much now is because he doesn&#39;t know which companies are gunna be up for that or if it will work out.",Jamie F,2020-01-09T16:41:01Z,0
Lucky to have gigabit Internet so watching in 8k on a 4k monitor... ;-),Jason W,2020-01-09T16:36:42Z,0
does anyone know the name of the intro song?,Rodolfo Vera,2020-01-09T16:27:20Z,0
"Marques, you should see the Lightyears solar-paneled electric car in CES.",廖景云JayceeR,2020-01-09T16:04:06Z,0
Do a Raven vlog plz.,Eric Lorick,2020-01-09T16:03:08Z,0
I can watch this video in 8K but the internet and my laptop screen won&#39;t cooperate. I&#39;m just watching this in 1440p.,廖景云JayceeR,2020-01-09T16:00:37Z,0
