comment,id,date,num_likes
"all the people with iphone 11 and/or xr...cant view the 8k, not even 4k, wait not even 1080!!!",Juraj037,2020-01-06T02:25:46Z,0
End screens on YouTube mobile need to have a toggle feature.,Volcomintality,2020-01-06T02:25:42Z,0
Imagine if that tech from OnePlus can work on a screen. Would get rid of notches and punch holes when you could just turn the screen off around the camera when you need it. That would definitely be the future.,Shehban Patel,2020-01-06T02:25:11Z,0
that audio be everywhere,Avery Rhinerson,2020-01-06T02:25:01Z,0
its at 8k and im watching at 480p lol,IanDotexe,2020-01-06T02:24:39Z,0
put a turbo on your tesla and feel some real power for once. ;),Andrew,2020-01-06T02:24:36Z,0
Marques:I don&#39;t wanna see gesture control on next pixel phone<br /><br />Pixel gesture team: gets fired,Tanish Kogta,2020-01-06T02:24:24Z,0
The new intro is sick,Silas Alberti,2020-01-06T02:24:23Z,1
"8K TV must be the most overrated Tech that&#39;s coming. Since you cant see the difference in &quot;pixels&quot; sharpeness on a 4K 65&quot; TV and a FullHD 65&quot; TV if you sit more than 2,7 meters from it.... And that is usally what people do....  If you sit more than 1,8m from a 55&quot; 4K TV you cant see the difference from your old Full HD 55&quot; TV.  <br />So... we dont have any 8K format on discs and after all these years the 4K UHD format is selling 7% of the 3 formats (dvd, bluray, uhd).... <br />But streaming is the new.... Yeah sure.... Do you really want to compress the shiiiet out of the HDR (contrast is more important over 8k) and compress the Atmos sound..... NO YOU DON&#39;T!  :-)<br />So the industry will push for 8k. A lot will hop on that emperors clothes train. But not you. No. You now know better.  ;-)",Tesladude,2020-01-06T02:24:20Z,0
You can’t even see the new Samsung is scribbled out wow @MKBHD,Ackielee,2020-01-06T02:24:06Z,0
I love that he&#39;s getting a little playful while talking and stuff 😂,Dwarkesh Jangid,2020-01-06T02:23:47Z,4
😅😅😅😅😅😅😅😅😅😅😅😁😁😁😁😁😁😁😁😁😁😁😂😂😂😂😂😂😂😂😆😆😆😆😆😆😆😆😆🤣🤣🤣🤣🤣🤣🤣🤣🤣🤣🤣,idkthetime,2020-01-06T02:23:45Z,0
I don’t get the phantom vs. Apollo model s.....are they like secret different versions?,Patrick McDermott,2020-01-06T02:23:05Z,0
"am i the only one who only has the option of viewing on 1080p? i have a 4k monitor, but youtube won&#39;t give me the option to stream higher even though the vid is in 8k?",Azerawth,2020-01-06T02:22:37Z,0
my computer can&#39;t load 8k,Michael Choe,2020-01-06T02:22:17Z,0
mans going 8k WOAHHHHHHHH,Jordan F,2020-01-06T02:22:00Z,0
Get the tech you tubers together for a “what phone is in your pocket” video,wade keslering,2020-01-06T02:21:57Z,0
btw &quot;dark&quot; mode on any app/os/theme blows.<br /><br />Light or bright mode or GTFO,Travis Boyko,2020-01-06T02:21:50Z,0
🔥🔥🔥🚒🧯YO THIS NEW INTRO IS LIT FAM🧯🚒🔥🔥🔥,idkthetime,2020-01-06T02:21:32Z,0
You&#39;re overrated man,Zain,2020-01-06T02:21:09Z,1
Samsung s4 gesture control fale<br />Google and lg like lets do it,Tintin,2020-01-06T02:20:57Z,0
Apple is not making a flexible phone yet. So you are not using one.,Tetete Tetete,2020-01-06T02:20:04Z,0
Where can I get that hoodie 😯?,RBV,2020-01-06T02:20:04Z,0
Your new intro is the DOPEST thing on the planet right now !,Bullet Time,2020-01-06T02:19:57Z,0
Pamu slide,SAKETH KUMAR,2020-01-06T02:19:05Z,0
In the 10 years I have watched this channel that&#39;s the worst edited video yet. Still gets a like though.,Rhys Butcher,2020-01-06T02:18:45Z,0
"First Video I seen with tech problems not that I complain i just wonder as I never have seen this before, 10.1Million did you win or did Linus Win and what are the loser going to do on CES ?",Jasper Waale,2020-01-06T02:18:42Z,0
🔥,Shuhair Lateef,2020-01-06T02:18:38Z,0
You can get those LEGO things at the LEGO store in NYC!,Ricky Marin,2020-01-06T02:18:26Z,0
"&quot;<a href=""https://www.youtube.com/watch?v=NbzpwG4n6Vs&amp;t=8m10s"">8:10</a>  Enjoy the 8k video&quot; and he uploaded max. 1080p. To be honest, I started watching this video and wanted to select high quality in the beginning but found the max. quality is 1080p so I checked again if its really MKBHD or someone else stole his content. But now I know the reason for him to upload 1080p video. Watch the video to understand. Anyway, i always watch 1080p videos because my laptop screen is 1080p and my VPN speed isn&#39;t good enough for 4k video.",Jawad Khalid,2020-01-06T02:18:20Z,0
Quality content. Nuf said.,rainmakr20,2020-01-06T02:17:10Z,0
What??!! I just got &quot;pulseway&quot; app ad which had linus in it on mkbhd video 😂😂,Ahmed Sobhy,2020-01-06T02:17:03Z,0
That is the best hoodie I’ve ever seen! I want one!,Everyday Family,2020-01-06T02:16:53Z,0
So glad knowing i&#39;m not the only person from New Jersey on the internet.,Critty,2020-01-06T02:16:45Z,0
Thank you. Lego peices not Legos,Joseph Jiang,2020-01-06T02:16:26Z,0
This guy is awsome,The1Survivor,2020-01-06T02:16:25Z,0
"I tell people all the time LASIK was one of the best $4,000 i&#39;ve ever spent lol.",David Runyon,2020-01-06T02:16:16Z,0
does anyone see will smith in that lego &quot;marques Brownlee&quot; that Asus sent?,Nicholas Kidston,2020-01-06T02:16:04Z,0
"<a href=""https://www.youtube.com/watch?v=NbzpwG4n6Vs&amp;t=5m07s"">5:07</a>. Bruh what am I looking at?",m h,2020-01-06T02:15:38Z,0
Whew! 2020 vibes off the fucking chart! ❤️✌️,NomadicCleric,2020-01-06T02:15:37Z,0
Keep your eyes peeled for MicroLED TV(s). I think TCL is rumored to bring one out this year.,Ananya Gupta,2020-01-06T02:15:27Z,0
"¿Does HDR in video means something else than High Dinamic Range? Because I can&#39;t tell the difference or actually I haven&#39;t tried it, I don&#39;t know if it&#39;s a new feature in YouTube or what, I need help xD",Dante Terreros López,2020-01-06T02:15:08Z,0
I would love to see a &quot;Nope&quot; Tech of CES - all the worst and most rediculous products.,MorrisMagic,2020-01-06T02:14:54Z,0
Watching so early that YouTube hasn&#39;t even processed this video into 4K yet 😂,John Ferreira,2020-01-06T02:14:28Z,0
Ngl you looking fresh,Pooky On Glass,2020-01-06T02:13:57Z,1
Leaving a thumbs up because I want to see the difference between Penguin and Apollo!,Mike Devinsky,2020-01-06T02:13:55Z,0
Gesture control seems legit tho.. it may be a good innovation for VR and things related 🤔🤔,Nathan Eleazar,2020-01-06T02:13:55Z,0
Tesla video plz,Wajahat Shahid,2020-01-06T02:13:23Z,0
Under display fingerprint readers,Quna •,2020-01-06T02:13:23Z,0
Please make a video about best smartwatch of 2019,shafeeq saidmuhamed,2020-01-06T02:13:09Z,0
It&#39;s not the new decade. Stop please I&#39;m starting to really dislike you.,Vukadin MC,2020-01-06T02:12:44Z,0
"&quot;What we haven&#39;t done since the last decade&quot;<br />... uh, this is just about everything you have done last decade",Nathan,2020-01-06T02:12:28Z,0
Thumbnail made me think Tesla video when you said overrated tech lol I&#39;m so tired,Hannah Okoniewski,2020-01-06T02:12:23Z,0
Telsa overrated,I am The one,2020-01-06T02:12:13Z,0
"Marques it&#39;s so easy........second channel, MKBHDR. upload normal to this channel, HDR to MKBHDR.",Harry_09,2020-01-06T02:11:55Z,0
Why do some of your videos not allow 1440p video? I watch on 7 pro and like the extra crispyness,amazamations,2020-01-06T02:11:27Z,0
hi,Meimou,2020-01-06T02:11:09Z,0
That Samsung Galaxy Note 10 lite looks a lot like your new studio space!,theFrizzleFry,2020-01-06T02:10:35Z,0
"<a href=""https://www.youtube.com/watch?v=NbzpwG4n6Vs&amp;t=5m10s"">5:10</a> is video rendering glitch",Clark pies,2020-01-06T02:10:17Z,0
"End screens are annoying. Do not do that, ever again. I’m just kidding but without is better imo.",Gustavo de Caires Anhaia,2020-01-06T02:10:16Z,0
Play the video in 144p lol,Sharjeel Mirza,2020-01-06T02:10:14Z,0
"Em lately your videos got some pic error in it, looks like pic distortion or what ever it is",Seta,2020-01-06T02:10:13Z,0
"I think yours isn’t the only one, Austin got one",Prashant Mehta,2020-01-06T02:09:56Z,0
"Anything weird happen at <a href=""https://www.youtube.com/watch?v=NbzpwG4n6Vs&amp;t=5m07s"">5:07</a> for anyone else?",Jason Green,2020-01-06T02:09:49Z,0
MKBHDR?,J Bergski,2020-01-06T02:09:34Z,0
Marques: “last QnA was in the last decade”<br /><br />What a god tier dad joke😂,Martir Paredes,2020-01-06T02:09:30Z,2
Mkbhd :- releases video in 8k <br /><br /><br /><br /><br />Me :- watching the video in 360p 😐,100 subscribers with only r and s challenge r s,2020-01-06T02:09:14Z,1
marques is so techy.His watch shows no. of weeks too,Amit Singh,2020-01-06T02:09:06Z,0
Overrated : Galaxy fold,Jonathan Banks,2020-01-06T02:08:46Z,0
PLEASE YES TO THE MODEL S DIFFERENCES.,BloodyIron,2020-01-06T02:08:37Z,0
Damn that intro be fire 🔥🔥🔥,Ryan Rumambi,2020-01-06T02:08:27Z,1
What is your opinion in Tesla model x being the second most unreliable car in consumer reports?,Ehsan Siam,2020-01-06T02:08:26Z,0
You&#39;re an overrated tech,Mohd Firas Mohd Fuad,2020-01-06T02:08:12Z,0
Nice intro btw,Israel Berrios,2020-01-06T02:08:08Z,0
you need to reduce saying decade,It’s Neel,2020-01-06T02:07:28Z,0
Please do autofocus in HDR! I think the car review community is lacking in this department. <br /><br />Also it might be true that the majority of consumers doesn&#39;t own a HDR capable decide but how about your followers? I wouldn&#39;t be surprised if at least 40% are ready for HDR content.,Giuseppe Pellegrini,2020-01-06T02:07:24Z,0
Pelican Case (and foam cutout) link please?,Ian Granados,2020-01-06T02:07:14Z,0
"If you upload HDR video please upload two versions, a HDR and a non HDR",Tommi H,2020-01-06T02:07:11Z,0
What is your true work(money resources) actually <br />I&#39;m very curious?,Nagi-san,2020-01-06T02:07:10Z,0
Gesture controls need to get to Iron Man HUD  level. That would be dope.,Chris Hamilton,2020-01-06T02:06:56Z,0
You said &quot;Tesla is never on time:<br />then you said &quot;the Model Y is ahead of schedule&quot;<br />bro,Matt,2020-01-06T02:06:33Z,1
Susscribe to my channel please,Sanjay Godara,2020-01-06T02:06:32Z,0
New intro do be kinda fresh doe😳😳😳,Sparky The Giraffe,2020-01-06T02:06:31Z,1
Love that intro,DedoGamingONE,2020-01-06T02:06:29Z,0
Susscribe to my channel please,Sanjay Godara,2020-01-06T02:06:24Z,0
Susscribe to my channel please,Sanjay Godara,2020-01-06T02:06:18Z,0
Susscribe to my channel please,Sanjay Godara,2020-01-06T02:06:08Z,0
Why &quot;last decade&quot;?<br />Isn&#39;t supposed that the decade ends at the end of this year?,Israel Berrios,2020-01-06T02:06:07Z,0
I actually have my annotations off by default on YouTube. It&#39;s just noise to me. I find that if I enjoy the video I will seek out another by myself.,Kyle Culver,2020-01-06T02:06:06Z,0
The Head of CES is a known republican and he&#39;s bringing Ivanka Trump to speak at CES this year. Enjoy supporting her,BlueHen123,2020-01-06T02:06:03Z,0
"Off topic question, what sweatshirt are you wearing? Looks nice.",Umar Safdar,2020-01-06T02:05:36Z,0
He he... It is soli,Anil Mhatre,2020-01-06T02:05:20Z,0
OVERATED <br /><br />&quot;WHOS WATCHING IN COMMENTS&quot;<br /><br />THAT SHIOULD DIE NOW,NoLightz,2020-01-06T02:05:16Z,0
Marques: I&#39;m uploading this in 8K. Even though most of you wouldn&#39;t watch it in 8K even if you had an 8K screen.<br />Me: Searches for 8K and sees that it&#39;s only in 1080p<br /><br /><br />lostjohntravolta.gif,iamillasfuck,2020-01-06T02:04:53Z,0
"Hey Marques, I was curious about the lasik thing you had, and I&#39;m not sure if you&#39;ll reply here but if so, cool! How do the lasik people do it anyway? was there any pain during the surgery and whatnot? was there anything to it? I think I want to do it eventually, so I want to know what it felt like before anything, hehe. Thanks if you do end up replying!",Trevorcraft71,2020-01-06T02:04:44Z,0
Model S video 🤞🏿🤞🏿,Berean Smith,2020-01-06T02:04:41Z,0
I’m Batman!,KNIGHTFALL,2020-01-06T02:04:30Z,1
I am so late with 16k.  Its not Zhu.,Apple Kid,2020-01-06T02:04:10Z,0
"New year, new Marques",Pranay Madavi,2020-01-06T02:03:53Z,0
"The LEGO thing looks like Dwayne the rock, will smith and you at the same time",No Username,2020-01-06T02:03:50Z,0
Wow he&#39;s not awkward anymore.,eiffi,2020-01-06T02:03:49Z,0
Should I get the oneplus 7pro?,KennyTheKrazed,2020-01-06T02:03:21Z,0
Video on Phantom 👍,Arun,2020-01-06T02:02:49Z,0
"Thanks Asus, Very cool!",Dallin Porter,2020-01-06T02:02:38Z,0
Love the new intro screen<br />Want it as a wallpaper,Jorge alfredo Rodriguez najera,2020-01-06T02:02:27Z,0
"<a href=""https://www.youtube.com/watch?v=NbzpwG4n6Vs&amp;t=8m42s"">8:42</a> ?",Alberto Vences,2020-01-06T02:02:24Z,0
Ok either this video giving trouble... or my Samsung  nu6900  tv getting worse.. time to return this TV and get a lg tv,hungrynapps,2020-01-06T02:02:19Z,0
"umm, its only 1080p (for me at least and i also tested like 3 different browsers, still 1080p)",Marcos8760,2020-01-06T02:01:18Z,1
Where&#39;s the pelican case link?,Matthew Sabio,2020-01-06T02:01:08Z,0
Next Level is your own CNN SHOW!!!,TheSoundPainter BKNY,2020-01-06T02:01:08Z,0
MKBHD: drags png file into timeline<br />FCPX: <b>automatically clicks on distort</b>,DJTech,2020-01-06T02:01:03Z,477
"They render fine on my machine, maybe MKBHD should hire me to do his editing. He needs to trash his render-data and start fresh. Crazy, you can have as many subscribers as him and not know FCPX like the back of your hand. Wild",Jeffrey Librebowski,2020-04-18T15:46:33Z,0
"<a href=""https://www.youtube.com/watch?v=NbzpwG4n6Vs&amp;t=5m07s"">5:07</a> and <a href=""https://www.youtube.com/watch?v=NbzpwG4n6Vs&amp;t=8m38s"">8:38</a> I don&#39;t think he will re-upload this video because it is an 8K video.",Giyan Vice,2020-01-06T08:01:33Z,0
TechGeos1019 I noticed it looked odd. Wasn’t just me. So dope,StrongSemps,2020-01-06T07:17:44Z,0
I can see 8k in 2020,A Little Hair,2020-01-06T02:01:03Z,0
I only get 1080p in Chrome.,LonelyFans,2020-01-06T02:00:47Z,1
Tesla video please,Tommi H,2020-01-06T02:00:23Z,0
This is the second time I&#39;ve seen a problem in your video,Zyad Abaza,2020-01-06T02:00:22Z,0
WOOOOAH IM SO EARLY !!!!!!❤️❤️❤️,Dovah Kiin,2020-01-06T02:00:01Z,0
С новым годом,Тимур Алиев,2020-01-06T01:59:53Z,0
"Comments: <a href=""https://www.youtube.com/watch?v=NbzpwG4n6Vs&amp;t=5m07s"">5:07</a> and <a href=""https://www.youtube.com/watch?v=NbzpwG4n6Vs&amp;t=8m40s"">8:40</a><br />Me: What? <b>Goes check those times and realizes</b><br />Also me: I didn&#39;t even realize the first time I watched it lol",MrMarcello,2020-01-06T01:59:49Z,2
Sometimes I See YouTube Videos That Uses End Screens At The Worse Possible Times.<br />Music Videos?,King Charming,2020-01-06T01:59:24Z,2
"Guess even owning a 50k USD Mac Pro is not enough to re-render and export 12 minute of 8K video. Watching this on 65 4K OLED, my main display for a long time, i say go for HDR. 8K will make sense when 77+ inch TVs go mainstream, cant tell difference on 55 or 65 inch.",Ryoga Hoshino,2020-01-06T01:59:16Z,0
I remember back in 1991 CES in Chicago I was watching the NBA finals Lakers vs Bulls  on the very first 55” rear projection TV by Mitsubishi 😳,Allan Delos Reyes,2020-01-06T01:59:15Z,0
What was the price for Lasik,Mr. Ash,2020-01-06T01:59:14Z,0
"The video is still processing even after 1 hour after being uploaded. So it&#39;s still in 1080P.  But 8K is a big time gimmick as well. So no loss in not seeing it. Anything beyond 4K is pointless except for capturing video to render out to maximise 4K screens. 8K was never intended for home use. But what is cool, is that my internet is fast enough to watch 8K videos without buffering on YouTube. :D",Scootaloo,2020-01-06T01:59:00Z,0
👍🏽👍🏽👍🏽,Dwayne Phillips,2020-01-06T01:58:46Z,0
&quot;Shoooooo&quot;,Sharon Yoo,2020-01-06T01:58:29Z,0
"MKBHD: “you guys remember curved TVs”?<br />Me, watching this on a curved TV: “Pshh no who owns a curved TV these days”",amsinaph0509,2020-01-06T01:58:00Z,348
Whenever I get the chance I watch YT on my TV as well lol especially since it has a much better looking screen lol,K Francks,2020-01-06T07:11:15Z,0
@Theonlydezman sameeee,narnianman,2020-01-06T06:21:39Z,1
Curved Tv&#39;s are the best,Paul Meyer,2020-01-06T06:13:48Z,0
@A Communist that&#39;s what I watch most of my YouTube videos on 😂,Theonlydezman,2020-01-06T06:12:22Z,0
My gaming monitor is curved. Not changing it for the world!,Theonlydezman,2020-01-06T06:11:18Z,2
Asus should have sent Lego version of Zack to him,chyavan bhat,2020-01-06T01:57:36Z,0
That swoosh Hand gesture was a cute touch in your intro.,Xavier Mathews,2020-01-06T01:57:18Z,0
Wait ..did YouTube make a end of year video?,hungrynapps,2020-01-06T01:57:12Z,0
I&#39;ll come back to this video when i have a 8k screen,Chukdeyphata 13,2020-01-06T01:57:11Z,1
Leggo mkbhd,TheLionGod,2020-01-06T01:57:11Z,0
S20 much?,Carlos Tay,2020-01-06T01:57:00Z,0
👍🏿 tell us all about your new Tesla!,Leo Horthy,2020-01-06T01:56:46Z,0
Most overrated? PNGs in videos,Matthew Y.,2020-01-06T01:56:34Z,0
"What happened at <a href=""https://www.youtube.com/watch?v=NbzpwG4n6Vs&amp;t=5m08s"">5:08</a>?",Ayush Prasad,2020-01-06T01:55:58Z,0
"IDK if youtube isn&#39;t working right, but I had to suffer through &quot;2k&quot; res. Ooof.",Ben Schlea,2020-01-06T01:55:51Z,0
"Was there a break in the video when you watched it? <a href=""https://www.youtube.com/watch?v=NbzpwG4n6Vs&amp;t=5m07s"">5:07</a>, <a href=""https://www.youtube.com/watch?v=NbzpwG4n6Vs&amp;t=8m41s"">8:41</a> on the video. Lol",Ike Gaming,2020-01-06T01:55:44Z,1
Wow 3yrs already...sigh time flying... the only thing I changed in 3yrs was my phone...lol,hungrynapps,2020-01-06T01:55:25Z,0
Damn! Packing that iMac Pro was satisfying to watch.,Radiowala,2020-01-06T01:55:11Z,0
MKBHD: I&#39;m gonna upload video this in 8K.<br /><br />Me: I&#39;m gonna watch this video in 1080P..,Hiluxtaco,2020-01-06T01:55:01Z,1
i 100% need that Tesla comparison video.,ghostsNcamo,2020-01-06T01:54:35Z,0
New changes please for model s please,Gordon Patterson,2020-01-06T01:54:26Z,0
Who is your favorite tech YouTuber? Obviously you can&#39;t choose yourself.,Nathan Garay,2020-01-06T01:54:12Z,0
I never hear the M in MKBHD when he says his name...,Melanco,2020-01-06T01:53:50Z,1
Why no matt black intro,Vamsi Reddy Ayyappaneni,2020-01-06T01:53:48Z,0
1.  Most of the apple product....,whatcost,2020-01-06T01:53:30Z,0
Moving vlogs!!! 3 part series.  Easy content and interesting :),Drew Michel,2020-01-06T01:53:21Z,0
What&#39;s so good about Tesla?<br /><br /><br /><br /><br /><br /><br /><br /><b>Elon Musk memes</b>,Geric John M. Olivar,2020-01-06T01:53:01Z,2
"You know I just really love the term, “point a camera at it.” I don’t know why.",Mr. Golden Pigman,2020-01-06T01:52:50Z,2
Hi,bad meme,2020-01-06T01:52:36Z,0
I&#39;ll never forget when I saw your review for the Galaxy Note 2 way back when. Been here ever since then. Congrats on all of your success! You deserve it man,Matthew Bailey,2020-01-06T01:52:28Z,0
Did he just make a swish sound?,Calvin Hayer,2020-01-06T01:52:28Z,0
Why dont you ever review samsung laptops????,Daniel Roscoe,2020-01-06T01:52:26Z,0
Mkbhd : I close the alarm app first in the morning.<br /><br />I thought you would check geekbench score of your phone,sunil choudhary,2020-01-06T01:52:26Z,2
Right after he runs an Internet speed test,bliph,2020-01-06T03:17:08Z,0
"watching this on my 720p Laptop. oh, its actually not a new decade. when you start to count you start with 1, not with 0. at least i do.",fanjapanischermusik,2020-01-06T01:51:24Z,0
"looking at a thumbnail, i thought Doug uploaded",XSunacX,2020-01-06T01:51:21Z,0
8k not showing up for me :(,nazart,2020-01-06T01:51:20Z,0
Does anyone know which brand makes the sweatshirt he&#39;s using?,Rodrigo,2020-01-06T01:51:20Z,1
Rodrigo ... Team Trees merch. Go buy some trees,Johan S,2020-01-06T04:15:22Z,0
What&#39;s all this &quot;Last Decade&quot; talk? 10 is the final number of 1-10.,Smarty Pants,2020-01-06T01:51:18Z,0
I&#39;ll watch it in 8k,Jhustine Provido,2020-01-06T01:51:13Z,0
First one of your hundreds of videos i am disliking! STOP WITH THE PURPOSE WHITE SCREEN FAKES.,Eric Maedgen,2020-01-06T01:51:08Z,0
Tesla video please,Vincent Mutasa,2020-01-06T01:50:37Z,0
"<a href=""https://www.youtube.com/watch?v=NbzpwG4n6Vs&amp;t=00m00s"">00:00</a>/<a href=""https://www.youtube.com/watch?v=NbzpwG4n6Vs&amp;t=12m40s"">12:40</a>",Super Duper Paratrooper,2020-01-06T01:50:30Z,0
"Seeing 20/15 by 2020! Dude, you can let yourself get so far behind like that!",Weaseltube,2020-01-06T01:50:04Z,0
"Why not google put that gesture feature in their google NEST lineup or in Smart TVs, much better.",Tobi Tonda,2020-01-06T01:50:01Z,0
"<a href=""https://www.youtube.com/watch?v=NbzpwG4n6Vs&amp;t=8m40s"">8:40</a> does anyone else has this weird pic ?!",Ragheb Ismail,2020-01-06T01:49:56Z,0
Cool,Emmet Garcelon,2020-01-06T01:49:38Z,0
Tesla videos 👍,Drew Michel,2020-01-06T01:49:30Z,0
Mkbhd is a very good guy becuz he is wearing the team trees merch,NT Animates,2020-01-06T01:49:26Z,0
"Hey, I have that shirt! 👊😃👍",Josh Zaring,2020-01-06T01:49:25Z,0
I see you with that soft-ui/neumorphic design for the logo 👌<br />Very 2020,Yann Cedric Ngadeu,2020-01-06T01:49:24Z,0
I want a Lego pic of me lol,Jackson Ruble,2020-01-06T01:49:23Z,0
Lg vs samsung fridge,Brayden Lee,2020-01-06T01:49:19Z,0
👍🏽👍🏽,Abhiram S,2020-01-06T01:48:46Z,0
"Son, you are only 25 years old.",Lucky Strike,2020-01-06T01:48:43Z,0
Who else watches these vids at 480 because your WiFi is trash?,madison ham,2020-01-06T01:48:31Z,1
"when you said that you focus on the next video rather than an end goal, that is why you&#39;re successful, quality control, making great videos that are new and fresh, so many YouTubers start to drift over time until they&#39;re no longer the channel that you subscribed to, thanks for being consistent 👍🏻",mark smith,2020-01-06T01:48:25Z,0
I wanted to see 2020 by 20/20...nice!!,praveen rawat,2020-01-06T01:48:22Z,0
That into transition was toooo smooth,Aaron Melamud,2020-01-06T01:48:07Z,0
That intro graphic was TIGHT,Hayden Allee,2020-01-06T01:47:59Z,0
YO I F**k with that new intro Marques,Teylor Patterson,2020-01-06T01:47:24Z,0
"<a href=""https://www.youtube.com/watch?v=NbzpwG4n6Vs&amp;t=8m37s"">8:37</a> what&#39;s wrong",Sanu,2020-01-06T01:47:10Z,0
Which is that phone you held in your hand??<br />A OnePlus??,Rajesh Kp,2020-01-06T01:46:39Z,0
I want to see a video of the Tesla,Help Me Get 1000 Subscribers,2020-01-06T01:46:28Z,1
"Don’t know who this guy is , but he always makes cool vids..",Daniel Kleinmeier,2020-01-06T01:46:16Z,0
Lego you is awesome.,Infinite G Dimensions,2020-01-06T01:45:57Z,0
No offense but your Model S is HIDEOUS,zak g,2020-01-06T01:45:55Z,0
"There was a weird “intro” like glitch between <a href=""https://www.youtube.com/watch?v=NbzpwG4n6Vs&amp;t=5m07s"">5:07</a>-<a href=""https://www.youtube.com/watch?v=NbzpwG4n6Vs&amp;t=5m12s"">5:12</a>",Jean Mesa,2020-01-06T01:45:51Z,9
"I thought it&#39;s a problem on my phone , so came to the comment section to confirm it.",Sakib Shahriar,2020-01-06T06:53:26Z,0
"There&#39;s a glitch at <a href=""https://www.youtube.com/watch?v=NbzpwG4n6Vs&amp;t=8m38s"">8:38</a> aswell",Witness me,2020-01-06T06:10:42Z,2
"Jean Mesa thought the problem was on my end, cause no one is talking about it, it happened at a later point too",Hafiz Patwary,2020-01-06T04:10:33Z,2
Make a video about raven model s,underscore37,2020-01-06T01:45:34Z,0
Phantom vs Apollo review!!!!! :D,Jorge Berrios-Colon,2020-01-06T01:45:32Z,0
MKBHD: uploads in 8k<br /><br />My Internet: THERE IS HIGHER THAN 480?!,Tyrese H,2020-01-06T01:45:21Z,0
"IMHO, the most overrated tech goes to Tesla and EV vehicles if all manufacturers.",Mick Psyphon,2020-01-06T01:44:56Z,0
Who the hell is editing these videos that keeps leaving bad frames in the videos,Chewy V,2020-01-06T01:44:54Z,0
What phone are you using right now?,Communications En Français,2020-01-06T01:44:34Z,0
2020 I’m calling the Jordan 1s your wearing the mkbhd 1s.... future collab ? MAKE IT HAPPEN,DRO CONTRO,2020-01-06T01:44:17Z,0
"8K What?  1080p is the highest available quality.  P.S. <a href=""https://www.youtube.com/watch?v=NbzpwG4n6Vs&amp;t=5m07s"">5:07</a> <a href=""https://www.youtube.com/watch?v=NbzpwG4n6Vs&amp;t=8m42s"">8:42</a>",Adam,2020-01-06T01:44:07Z,0
"<a href=""https://www.youtube.com/watch?v=NbzpwG4n6Vs&amp;t=2m50s"">2:50</a><br />1) Remove headphone jack.<br />2) FORCE people to buy dongles and BT<br />3) ???<br />4) Profit!!<br /><br /><br /><a href=""https://www.youtube.com/watch?v=NbzpwG4n6Vs&amp;t=5m06s"">5:06</a> \ <a href=""https://www.youtube.com/watch?v=NbzpwG4n6Vs&amp;t=8m38s"">8:38</a><br />Are you rendering on Stadia?",Matt B,2020-01-06T01:44:01Z,0
Try to make a video on Motorola one zoom 1,babulal Mangilalji,2020-01-06T01:43:53Z,0
"is it only me, the only option i have is 1080p <br />and i have a 4k monitor :/",shankh,2020-01-06T01:43:38Z,0
I like the new aspect ratio. It’s nicer for iPhone X style phones with the notch because it doesn’t cut off as much when you zoom in.,Kendric Santos-Briggs,2020-01-06T01:43:36Z,0
"MKBHD: &quot;I don&#39;t spend money for anything, but tech&quot;<br />Complex:  am I joke to you",moimoi,2020-01-06T01:43:29Z,16
Lasik is the best selfish use of money ever!,Nathan and Shelly Donahoe,2020-01-06T01:43:07Z,0
I appreciate so much how this video is in the perfect aspect ratio for the iPhone 11 why aren&#39;t all youtube videos like this,Ryan Crane,2020-01-06T01:43:06Z,0
"Bro, who you think you foolin? We saw that video where you spent 10k on shoes😂",Philasande Mntungwa,2020-01-06T01:43:03Z,0
