comment,id,date,num_likes
I&#39;m watching this in 8K 😁,Shaun Roselt,2020-01-06T06:46:55Z,0
I agree wight the gesture controls on phones. It’s fine for vr or maybe as a way to control a tv not a screen that’s already in your hand.,Inky Kitsune,2020-01-06T06:46:43Z,0
You’re inspiring.,Levi Nelson,2020-01-06T06:46:19Z,0
We need a video on phantom !!!!!!!!!,Sahil Garud,2020-01-06T06:45:04Z,0
"What happened there at <a href=""https://www.youtube.com/watch?v=NbzpwG4n6Vs&amp;t=5m08s"">5:08</a> ?",Paulo Angelo Vitacion,2020-01-06T06:44:58Z,0
Bhechoo Acha bata hai,Novo op,2020-01-06T06:44:45Z,0
this man has my heart on the youtube as a platforms . MOST genuine and totally worth content!,Sagar Sharma,2020-01-06T06:44:45Z,40
"Realizes video is in 8k, goes to settings, video is currently in 8k!",jetjodh,2020-01-06T06:43:09Z,0
If he waited for 2 hours 360hz screen would have been in this video,HARISH JOSHI,2020-01-06T06:42:25Z,1
That thumbnail sucks,Shahriar Saif,2020-01-06T06:42:16Z,0
8k video huh<br />I am watching your video in 480p 😑,A Happy Soul,2020-01-06T06:42:16Z,0
Id enjoy a video about the differences in the Tesla&#39;s that you&#39;ve noticed,Noah Cook,2020-01-06T06:42:11Z,0
New Model S update please!,Stefan Smuts,2020-01-06T06:41:44Z,0
Anyone else feels he&#39;s gotten a lot more confident recently?,Dhruv Ambashtha,2020-01-06T06:41:42Z,1934
@Nikos video pro. 😔wise man you are,Wiggy Tjihenuna,2020-01-07T10:32:22Z,0
@J R popped his first cherry😔😂,Wiggy Tjihenuna,2020-01-07T10:31:20Z,0
"@Wiggy Tjihenuna Who knows right? By the way, that &quot;2020 vision&quot; you wrote earlier, it is clever and funny!",Nikos video pro.,2020-01-07T10:00:20Z,1
@Nikos video pro. never ever thought of this🤔😂,Wiggy Tjihenuna,2020-01-07T00:47:49Z,0
It&#39;s the Lasik surgery,mention,2020-01-06T17:11:00Z,0
I think 8K is good for me but i cant see the video with 5FPS hhhhhhh,Haider Anbori,2020-01-06T06:41:33Z,0
Ummm why do i only notice the team trees merch,WEWWC,2020-01-06T06:41:09Z,0
"Did you render and upload the 8k video?<br />Marques: Yes<br />What did it cost?<br /><a href=""https://www.youtube.com/watch?v=NbzpwG4n6Vs&amp;t=5m07s"">5:07</a>",Abhi Vasudev,2020-01-06T06:39:14Z,474
Lol 😄🤣,Siddharth Takkannavar,2020-01-13T08:54:50Z,0
didn&#39;t he put that intentionally? I think i put that to indicate that he&#39;s getting a green screen,Kesav Lakshminarayanan,2020-01-12T15:38:21Z,0
"Abhi Vasudev there is morr 😆 <a href=""https://www.youtube.com/watch?v=NbzpwG4n6Vs&amp;t=8m40s"">8:40</a>",Salar Pro,2020-01-06T10:45:23Z,15
whats at 5.07?,Pratik Chatse,2020-01-06T06:38:59Z,0
"<a href=""https://www.youtube.com/watch?v=NbzpwG4n6Vs&amp;t=8m40s"">8:40</a> was that intentional?",Kashyap Chonekar,2020-01-06T06:38:22Z,1
"Hol&#39;up, aren&#39;t you using the OnePlus Concept One phone to read the tweets or am I crazy?🤔🤔",Abiola Olayinka,2020-01-06T06:37:59Z,0
FUCK...<br /><br />now i gotta get LASIK,Deuce Devious,2020-01-06T06:37:52Z,0
I didn&#39;t even know those were glitches 😂😂 I thought he was intentionally doing it.,Prasad N,2020-01-06T06:36:54Z,1
petition for Mr beast to giveaway 8k screens,Kaustubh Kadu,2020-01-06T06:36:06Z,0
MKBHD : makes a video in 8k<br />Me: tries switching from 480p to 144p to reduce buffering,Abijith Jayakumar,2020-01-06T06:35:47Z,0
1080p is good enough you can definitely tell the difference between 4k and 1080p but the only time you read need 4k etc is when your watching movies or visually stunning content. Start saving ya data foo lol 😂,Denton Anderson,2020-01-06T06:35:26Z,0
Amazing Answers BRO 👍,JEETU HARDASANI,2020-01-06T06:35:24Z,0
"<a href=""https://www.youtube.com/watch?v=NbzpwG4n6Vs&amp;t=11m27s"">11:27</a> best review for lasik <br />“I can see better than 2020... 2015”<br />😭😭😭😭😭😭😭😭😭😭😭",Matt Da Homie,2020-01-06T06:35:05Z,1
Putting Marques on 8k makes me realize how behind I&#39;m on tech.,Sorenmy Valdez,2020-01-06T06:34:54Z,1
"He looked so freaking happy in this one, idk what he’s been up to or who he’s met but stick with it man. 😎👍",Grant,2020-01-06T06:34:53Z,1
Make moving Vlogs,Meet Patel,2020-01-06T06:34:36Z,0
👍👍👍👍👍,jesus Garay,2020-01-06T06:34:34Z,0
Cool Intro...!!!,Didacus Moses,2020-01-06T06:34:32Z,0
I think you missed the point for the overrated tech question. Overrated tech could be 4k+ mobile phone screens or the new smart wearables and he is asking you to &quot;guess&quot; based on your experience. Looking back years later and making fun of those trends that we find cool now is not the point.,LeMeBucallion,2020-01-06T06:34:25Z,0
Calendar: 2020<br /><br />MKBHD: Alright I&#39;ve been using this year for about a month now,SANVEER SOOKDAWE,2020-01-06T06:33:03Z,54
underrated comment 😂😂,Fadel,2020-01-06T13:57:20Z,2
Windows HDR is Trash. Microsoft needs to fix this.,Kareem H.,2020-01-06T06:32:34Z,0
"Next 10 years: Think bigger, less consumerism, do tech for philanthropy.",Chris Hernandez,2020-01-06T06:32:07Z,0
I would love to see a video about NeuraLink,Paul Hanneforth,2020-01-06T06:30:20Z,0
I live the new intro Graphic!!! :o,Powi,2020-01-06T06:30:11Z,0
MKBHDR,SWAPNIL MULAY,2020-01-06T06:29:18Z,0
He takes himself so seriously,Bossitronio 03,2020-01-06T06:28:34Z,1
Make a video about phantom,mackósajt,2020-01-06T06:26:59Z,0
"<a href=""https://www.youtube.com/watch?v=NbzpwG4n6Vs&amp;t=6m36s"">6:36</a> Please do.  Some of us desire it.",Zack C,2020-01-06T06:26:39Z,0
"Somethin weird happened at <a href=""https://www.youtube.com/watch?v=NbzpwG4n6Vs&amp;t=5m09s"">5:09</a>... :O",George Dömse,2020-01-06T06:26:35Z,0
That intro had me going crazy,Alexander Engstrom,2020-01-06T06:25:36Z,0
When are we going to understand that the next decade starts 2021 ffs🤯,Endrit GJ,2020-01-06T06:25:13Z,0
"I DO WATCH 8K, but have 4K display. 8K is GOOD because looks NICE on 4K monitor like there&#39;s no YouTube compression, so, please, keep the 8K because of the compression so we can watch 4K properly!",Lohk's,2020-01-06T06:24:51Z,0
Why do some people give their cars names...? sounds very silly,mrsepox,2020-01-06T06:24:27Z,0
"<a href=""https://www.youtube.com/watch?v=NbzpwG4n6Vs&amp;t=12m25s"">12:25</a> did Marques got 2020 inspiration from Unbox Therapy",Shubham Kumar,2020-01-06T06:23:51Z,0
yes please make a video about Phantom!,StockSoul,2020-01-06T06:23:09Z,0
Please don&#39;t promote your videos at the end I love your outros without them,Dani,2020-01-06T06:23:03Z,0
"@<a href=""https://www.youtube.com/watch?v=NbzpwG4n6Vs&amp;t=8m38s"">8:38</a> was that on purpose or is that clip like corrupted or something ?",Zoo9a,2020-01-06T06:21:39Z,0
Nobody: <br /><br />MKBHD: So I’ve been testing Apple’s proMotion 120FPS display for about a week now,Jake Gonzalez-Waite,2020-01-06T06:21:24Z,1
just out of curiosity: why do you name cars?,Roberto,2020-01-06T06:20:51Z,0
Car video please,Primz1,2020-01-06T06:20:34Z,0
Marques: It&#39;s been almost a month.<br /><b>looking at his month counter watch</b>,Thando January,2020-01-06T06:20:27Z,58
Nice samsung unpacked like intro.,Vinamra Parashar,2020-01-06T06:20:03Z,0
So I dropped the video quality to 144p to see if I could get a different result with that glitch.Then I read the comment.,Alex Pages,2020-01-06T06:19:59Z,0
But curved monitors are becoming a thing.🤔,iamchillydogg,2020-01-06T06:19:47Z,0
I thought that were the actual renders and photos and my device is too old to show it.<br />Thank God I came to comments section 🤷🏻‍♂️,Aditya Shukla,2020-01-06T06:18:24Z,3
Last words showed off some Peter Mckinnon,VKGSBR,2020-01-06T06:18:12Z,0
oh my GOD 8K LOOKS SOOOOOO GOOOOOOOOOOOOOD,Lohk's,2020-01-06T06:17:37Z,0
I liked the opening vid 😉,Maor Portman,2020-01-06T06:17:12Z,0
I&#39;m watching this on a curved tv. I guess they dumped all the curved TVs here...Africa. LOL,Thando January,2020-01-06T06:16:54Z,0
I love this new look of yours. Specially the haircut. 👌🏽👌🏽,Razlan Ramlan,2020-01-06T06:15:37Z,0
"when I saw the glitches, I remembered them from the other video lol.",Keith Mpuya,2020-01-06T06:15:33Z,0
Watched in 8k with 0 buffering 💪,Freddy Bell,2020-01-06T06:14:40Z,0
"It&#39;s 2020, not 1920. Who focuses that much one a single screen anymore to appreciate 8k anyway?",aznfratboy1,2020-01-06T06:13:56Z,0
Switched to 8K then realised I was trying to watch it on a 720 screen.,Ivor Davies,2020-01-06T06:12:44Z,0
Is that a b lated Xmas present?Looks like a Santa head 😎🎅🏽,MTR,2020-01-06T06:12:20Z,0
You’re a fucking genius,fbwthe6,2020-01-06T06:11:44Z,0
<b>*Looks at the Glitch*</b><br /><b>*Realises that I&#39;ve been living in the Matrix*</b><br />Marques: So I&#39;ve Been out of Matrix for 2 months now. Here are my thoughts,Rishav Dev,2020-01-06T06:10:55Z,43
Omg stop,Yennefer,2020-01-06T08:54:51Z,1
Marques said February 1 is a couple weeks . Which means he is actually living 2 weeks in the future. For a normal person February is 2 couple of weeks away. The theory of Mkbhd living 2 weeks ahead of time is true.,Sajeev Pillai,2020-01-06T06:10:36Z,0
YES! Tesla update video pls! 🙏🏼☺️,CuriousGeorge,2020-01-06T06:10:28Z,0
February 1st is in a couple weeks?   You were planning on waiting till mid January to release this video?  (This is 12 days early.),Thomas Kelly,2020-01-06T06:09:39Z,0
wow love the new intro ! looks CLEAN !!!,Andy Salinas,2020-01-06T06:09:38Z,0
Wow watching this video in 8k dsr on a 1080p display is actually quite a bit of a difference. Looks amazing and crispy clear.,Sivert Solheim,2020-01-06T06:09:08Z,0
Currently watching at 144p,Lecoq Grande,2020-01-06T06:08:50Z,0
👍👍👍,Victor Onwuhafua,2020-01-06T06:07:24Z,0
These &quot;last decade&quot; jokes 🤢,Hosein Mohamadzadeh,2020-01-06T06:07:05Z,5
CES was <b>always</b> a “TV show.” That was the original point. The dumb gadgets that nobody buys that VCs are desperate to flip to get their wasted investments back didn’t come until the late nineties.,Ryan Ruark,2020-01-06T06:07:02Z,0
U need to almost close ur eyes to see the Lego picture clearly,Anshuman Jain,2020-01-06T06:06:56Z,0
"Huh, I&#39;m surprised MKBHD published a video with a failed render. Doesn&#39;t seem like Marques. I was going to ask if other people were seeing the glitched, but he posted himself that he knew, and decided that releasing on time was more important than fixing the video. Huh.",Nick B,2020-01-06T06:06:54Z,0
"Doesn&#39;t matter, of course. Still love the video and the guy, just surprised.",Nick B,2020-01-06T06:09:18Z,0
i would always love to see more car videos.,Nick Rajaie,2020-01-06T06:06:40Z,0
"It&#39;s only me or galaxy note lite photos in the video are not showing pause the video at <a href=""https://www.youtube.com/watch?v=NbzpwG4n6Vs&amp;t=8m39s"">8:39</a> I am seeing lines",Sahuji Tech Tips,2020-01-06T06:05:18Z,0
Yes for Tesla comparison video,Paul Walker,2020-01-06T06:05:06Z,0
Im all for a new Tesla Tour,L Rolfzen,2020-01-06T06:04:02Z,0
Phantom is my dream car 😍😍😍,Dylan D,2020-01-06T06:03:41Z,0
Please make HDR Displays explained video!,Cillu Magellan,2020-01-06T06:03:30Z,0
"Not sure how you have 10M subs, but LTT turned me onto your channel and I’ll give it a shot.",S T,2020-01-06T06:02:36Z,0
who else has been looking at the Lego photo the whole vid?,TyroneDagreatX,2020-01-06T06:01:40Z,0
"This may be just me, but who else got a static picture on <a href=""https://www.youtube.com/watch?v=NbzpwG4n6Vs&amp;t=5m08s"">5:08</a>??",Sy Legacy,2020-01-06T06:01:33Z,0
Most overrated tech is for sure every Apple device.,kevyn kollom,2020-01-06T06:01:22Z,0
MKBHD : Uploading in 8k <br />Lol i am watching in 360p 😂😂😂😁🤣🤣🤣🤣,SG Gamer,2020-01-06T06:00:39Z,2
Dark mode intro ??,Aayush Jain,2020-01-06T06:00:34Z,0
Do you even read the comments?,Mayank Parashar,2020-01-06T05:59:35Z,0
Watching this on my 720p iPhone 11,shiraz khan,2020-01-06T05:59:16Z,0
Bro that&#39;s where I am with my Lasik. So glad I went through with it in 2019! #20/20for2020! Let&#39;s go!,Sumanth Sriramoju,2020-01-06T05:59:08Z,1
👍,Emma Ik,2020-01-06T05:58:30Z,0
"<a href=""https://www.youtube.com/watch?v=NbzpwG4n6Vs&amp;t=8m38s"">8:38</a> does anyone else see the screen like blurred/distorted not clearly? wish i could share my screenshot in the utube comments",Ashwin,2020-01-06T05:58:18Z,0
"wtf happened and <a href=""https://www.youtube.com/watch?v=NbzpwG4n6Vs&amp;t=5m07s"">5:07</a>?",Cadenita Del Nazareno,2020-01-06T05:58:05Z,0
ITs NoT tHe NeW DeCaDe,Hello,2020-01-06T05:57:52Z,1
I&#39;d like to see the difference between Apollo and phantom,Jamz 4 Your Ears,2020-01-06T05:57:19Z,0
Change your name to mkb8k,MTRXishere,2020-01-06T05:57:10Z,0
"anyone get a funny frames at <a href=""https://www.youtube.com/watch?v=NbzpwG4n6Vs&amp;t=5m08s"">5:08</a>",zpe1200,2020-01-06T05:56:38Z,0
lol mkbhd needs to hire editors that can use FCP,Karan Harsh Wardhan,2020-01-06T05:56:23Z,0
I&#39;d be nice if you can make a detailed video about the story of Tesla.,Benzoato De Potasio,2020-01-06T05:56:04Z,1
"I love the fact that this channel doesn&#39;t have endcards. Please never succumb to that habit, Marques!",Pikminiman,2020-01-06T05:55:51Z,0
"Never thought we&#39;d see the day Marques would release a video that wasn&#39;t a hundred percent perfect. Those weird PNG&#39;s reminded me that you aren&#39;t a robot, thank you. Also, I tried watching this video in 8k and it made my laptop real hot so don&#39;t think I&#39;ll do that again.",Slowburn,2020-01-06T05:55:36Z,0
&quot;Overated tech&quot; <br />marques pulls out a flashdrive,Ahmed Ibrahim,2020-01-06T05:54:58Z,6
Nobody:<br /><br /><br />Marques: So I have been in WW3 for 2 weeks now...,Paras Jagtap,2020-01-06T05:54:32Z,11
Phantom VS Apollo,Vijay Ganesh,2020-01-06T05:54:30Z,0
"<a href=""https://www.youtube.com/watch?v=NbzpwG4n6Vs&amp;t=2m51s"">2:51</a> OK wht phn is that👀👀👀👀👀",Pranshu Anand,2020-01-06T05:54:14Z,0
"I tried to play with 8K, now my laptop has crashed.",Tony Mushi,2020-01-06T05:53:21Z,0
"Did anybody else see the glitch during <a href=""https://www.youtube.com/watch?v=NbzpwG4n6Vs&amp;t=5m06s"">5:06</a>..or is it jst my mob..🙄😒",Soumen Dutta,2020-01-06T05:53:12Z,0
Ok,MinerGate,2020-01-06T05:51:33Z,0
What&#39;s the intro track?,Nikhil Raj,2020-01-06T05:51:28Z,0
I want 8K and HDR vídeos.,Nicolas Garnica,2020-01-06T05:50:45Z,0
Is he using new Oneplus concept design??,Pradumna Saraf,2020-01-06T05:50:39Z,0
i see glitch .. es,Mr Kozhe,2020-01-06T05:49:55Z,0
Keep growing nerd 🤓,Just_Idea,2020-01-06T05:49:26Z,0
"do a 2nd channel re up in hdr, channel name MKBHDR!",BVLVI,2020-01-06T05:48:35Z,0
"Not sure, I definitely feel like you’re pretty overrated tho",Ben Krupa,2020-01-06T05:48:16Z,0
"<a href=""https://www.youtube.com/watch?v=NbzpwG4n6Vs&amp;t=5m06s"">5:06</a> it´s my computer or I am seeing all the screen white?",Fede Aguilera,2020-01-06T05:47:53Z,39
"Felix Safford thx, my fault",Fede Aguilera,2020-01-06T16:16:24Z,1
I&#39;m*/I am*,TuxidoFrog,2020-01-06T15:13:18Z,0
thought it was because I was watching in 4k,cohletrain,2020-01-06T13:12:12Z,1
Fede Aguilera it’s part of the video,Basil Minhas,2020-01-06T10:10:31Z,1
Same,Nathanaël S,2020-01-06T09:49:50Z,3
I was blessed with 20/15 20/15 vision at birth.,lifematch,2020-01-06T05:47:43Z,0
"Trend that I would like end, is displays with high view angle in phones and PC/Laptops, increase privacy. Also another trend is this Tagging stuff to be cool, even if POV is cool, it&#39;s not clear, people just start saying this taggs and then is just a few minutes of doubts for then giving up. This is a very irritating trend, could say that is fast, but videos are better if you understand them, not that you make them faster. Also is not a SMS short message Era where you have a limit in letters to make messages cheaper. Just a waste of time. Yes I prefer Marques Brownlee than the in comprehensive  MKBHD.",WolfoxBenny,2020-01-06T05:46:34Z,0
"on my 1440p display, 8k looks SO much sharper. Youtube lets me choose 8k and it looks like all of the compression is gone",Rfrbz12,2020-01-06T05:45:36Z,0
yes please raven vs model x,Hamdan Abdullah,2020-01-06T05:45:23Z,0
"<a href=""https://www.youtube.com/watch?v=NbzpwG4n6Vs&amp;t=12m16s"">12:16</a> .. wtf?",Abdul Muiz,2020-01-06T05:45:19Z,0
Normal people: I am very much focused ...........<br /><br />Marques: I am laser focused .........<br />😂😂 Now I am gonna use that too.,Aritra Daspoddar,2020-01-06T05:45:14Z,8
"<a href=""https://www.youtube.com/watch?v=NbzpwG4n6Vs&amp;t=5m07s"">5:07</a> what happened there?",Lukas Rohrmoser,2020-01-06T05:44:56Z,0
"Hey Marques, I just watched this video on my Pixel 3a. Twice when something was supposed to be showing, the screen was scrubbed like someone scratched white paper.",Sebastian Grama,2020-01-06T05:44:36Z,0
"Hey Marques, I just watched this video on my Pixel 3a. Twice when something was supposed to be showing, the screen was scrubbed like someone scratched white paper.",Sebastian Grama,2020-01-06T05:44:12Z,0
I actually thought he was being sarcastic about the end screens😅😅😅😅,cazterk,2020-01-06T05:43:59Z,0
any reason for glitches,Haresh Patel,2020-01-06T05:43:56Z,0
"<a href=""https://www.youtube.com/watch?v=NbzpwG4n6Vs&amp;t=3m34s"">3:34</a> - <a href=""https://www.youtube.com/watch?v=NbzpwG4n6Vs&amp;t=3m48s"">3:48</a><br />Rare footage of wizard guy trying to use his magic on a phone.",Joonatan Lass,2020-01-06T05:43:41Z,2
"I tried watching it in 8K, but my 700 dollar gaming PC wouldn&#39;t let me. Maybe if it was 7K? 🙃",Aaron Sutton,2020-01-06T05:43:32Z,0
Love love love hdr,Treavor Barnhart,2020-01-06T05:43:29Z,0
"Wtf happened at <a href=""https://www.youtube.com/watch?v=NbzpwG4n6Vs&amp;t=8m40s"">8:40</a>?",lifematch,2020-01-06T05:43:24Z,0
"Most Overrated tech of 2019, Cybertruck... That truck can&#39;t used for work..",zulfikangga,2020-01-06T05:42:58Z,0
"<a href=""https://www.youtube.com/watch?v=NbzpwG4n6Vs&amp;t=5m05s"">5:05</a> what?",Saksham Agrawal,2020-01-06T05:42:45Z,0
"If someone already having a non HDR display should mean they have older phones, so why does it matter anyways . They already have 1080p displays or less.",Xonuc,2020-01-06T05:42:27Z,1
Answer to 3rd questions? Easy. Square camera bumps and if that still counts as tech: TikTok,Lukas Rohrmoser,2020-01-06T05:42:25Z,0
Watching this video while my doc doing circumcision on me. All I feel is tech. 👍👍👍,Heyli Nisala,2020-01-06T05:42:16Z,1
Don&#39;t know if they&#39;ll show the new PS5 at CES,Eduardo Soto,2020-01-06T05:42:04Z,0
Marques the s10 lite is a must buy phone for you,Ankit Immadi,2020-01-06T05:41:50Z,0
Hey sexy I see you sexy chocolate. 😘😘😘😘😘🤗🤗🤗😉😉😉🤗,Raz Cane,2020-01-06T05:41:04Z,0
"Me: Finally buys a 4K TV:<br />MKBHD, one week later: Uploads in 8K",Jimmy Danly,2020-01-06T05:40:46Z,20
Jimmy Danly he uploaded an 8K video a few years ago as well,Basil Minhas,2020-01-06T10:11:27Z,1
Video quality is bad,Anish Shah,2020-01-06T05:40:43Z,0
Yes to a Tesla / Phantom video!,mattarc,2020-01-06T05:40:24Z,1
Can you please give a 2020 tour of your camera &amp;microphone setup?,SoCalDallasKid,2020-01-06T05:40:05Z,0
I&#39;m watching in 8K on a 1080p monitor,kendokaaa,2020-01-06T05:39:49Z,0
I was more asking about like the rolling/flexible tv prototype of LG 😝,ProDutch7,2020-01-06T05:39:38Z,0
"We&#39;re still in the 2010s, Marques. It&#39;s not that hard to grasp. The first year in this era was 1 A.D., thus the first decade was 1-10, and the 2010s are 2011-2020 accordingly.",George Emerald,2020-01-06T05:38:21Z,0
I hate end screens!,Clifton Taylor,2020-01-06T05:37:24Z,0
"Uploading to youtube in 8K <i>is worth it</i> because youtube allows a higher bit rate. Even watching on a 1080p screen, selecting &quot;8K&quot; looks markedly better than &quot;1080p&quot;. Even upscaling a 4K source to 8k before uploading delivers better quality.",Cameron Dindal,2020-01-06T05:37:00Z,0
Yes Tesla video,Alberto Munoz,2020-01-06T05:36:36Z,0
YouTube only showing me 1080p here in Africa.,Fotozones,2020-01-06T05:36:34Z,0
YAASSS do the Tesla Video!,C M,2020-01-06T05:36:07Z,0
So basically Tesla updates vehicles like Apple updates phones🤔🤔🤔🤔?,SoCalDallasKid,2020-01-06T05:35:53Z,0
Im watching it in 8K but on a 4K DIsplay.... :D,Saikat Biswas,2020-01-06T05:35:34Z,0
Im watching with 720 😂 not even 4k,陈fendy,2020-01-06T05:35:29Z,0
"But you know, what is not overrated tech?<br />60fps. Your Hollywood grade camera is capable of 8K@60fps. We ALL have 60fps screens (even phones have).<br />It makes day and night difference.<br /> Please, it is 2020 already, use proper frametate.",Glitchy Soup,2020-01-06T05:35:13Z,1
Dat intro clean dawg,なみ,2020-01-06T05:35:03Z,1
Apollo and Phantom comparison sounds amazing!,Vara Teja Theeda,2020-01-06T05:34:56Z,0
DAMNIT! I want a Tesla IDC what model it is!,CASUAL MAC,2020-01-06T05:33:07Z,0
&quot;no ones going to watch this in 8k&quot; - Switches to 8k on a 4k laptop screen 😂,Justin Kelly,2020-01-06T05:32:11Z,166
@Justin Kelly It looks better than 4K when you switch to 8K even if you have a 1080p screen,Youtube Kullanıcısı,2020-01-06T15:06:03Z,1
and it&#39;s better than 4k due to bitrate,Sam White,2020-01-06T14:31:41Z,1
same here😂🤣,Nabin Prajapati,2020-01-06T13:54:09Z,0
This video is back to the future,spamtelevision,2020-01-06T13:05:56Z,1
* phone screen,ZAVADICH R,2020-01-06T12:01:12Z,0
Neomorphizm is gonna be 2020 design trend i guess.,Ziyo Shams,2020-01-06T05:31:44Z,0
8k is not necessary at all crackhead.,ofahia,2020-01-06T05:31:36Z,0
The most overrated tech of 2019 is the 737 max and 777x.,Jeff Luo,2020-01-06T05:31:24Z,60
Definitely but top place goes to 737 max,Elios,2020-01-06T13:10:56Z,3
Bruh,Karim,2020-01-06T12:45:40Z,0
I literally choked on my food reading this,To Create,2020-01-06T11:58:44Z,1
Title and thumbnail do not go well with each other.,Black Knight,2020-01-06T05:31:14Z,0
Phantom review video please,Josiah Kasper,2020-01-06T05:30:56Z,0
This is the most overrated Youtube Channel. The info is OK but not that great. Sometimes the clickbaity title reeks of ostentacious grammatical errors.,RDG Spam,2020-01-06T05:30:55Z,0
We still in this decade dude next decade starts at 2021,Roy Giesbrecht,2020-01-06T05:30:48Z,0
Bad Thumbnail...,Dawit Gizachew,2020-01-06T05:30:37Z,0
"So uh, your graphics are distorted as hell",Dynasty1K,2020-01-06T05:29:31Z,0
The Lego picture is so cool!,Knapppers,2020-01-06T05:29:30Z,2
What phone was he using...?<br />Could be the OnePlus Concept One you know..,Sushant,2020-01-06T05:29:14Z,0
Gg niggatech,milkeito,2020-01-06T05:29:12Z,0
The blue in the picture might be a callback to MKBHD&#39;s video of uploading the same video several times into youtube until he became a mess of purple. As if the lego rendition was the result of having MKBHD&#39;s logo ran through that same process.,comrad707,2020-01-06T05:28:17Z,0
ASUS: Makes Profile picture from legos<br /><br />MKBHD: Changes it<br /><br />ASUS:  😑,HK Gaming,2020-01-06T05:27:42Z,0
Have a great 2020 Sr! Thanks for your Work! Keeps me updated ! I have forwarded you to a lot os people that don’t know much about tech,Noel Borroto,2020-01-06T05:26:55Z,0
Foldable phones are overrated,Jonathan Pabon,2020-01-06T05:26:27Z,0
Definitely wanna see that Model S vid,Spencer Farrell,2020-01-06T05:26:23Z,0
8K looks better than 4K on a 4K Monitor - higher bitrate and it&#39;s a form of antialiasing,othervt,2020-01-06T05:25:50Z,0
"I have actualy watched all of your videos on 8k samsung qled tv, which produce 8k resolution out of at least 1080p.",Anže Levec,2020-01-06T05:25:15Z,0
Watching this on 360p resolution,Sandip Shaw,2020-01-06T05:24:10Z,0
"<a href=""https://www.youtube.com/watch?v=NbzpwG4n6Vs&amp;t=3m49s"">3:49</a> I thought people stopped asking this kind of cliché question, it is now obnoxious to do so.",l2etranger,2020-01-06T05:24:09Z,0
Man your car and my name matches!!,PhantomX,2020-01-06T05:23:51Z,1
"What&#39;s up with <a href=""https://www.youtube.com/watch?v=NbzpwG4n6Vs&amp;t=5m07s"">5:07</a>?",Volodymyr Sytnyk,2020-01-06T05:23:37Z,0
New video of 2020 unwatched from mkbhd..  new opening logo!,Anan G,2020-01-06T05:23:36Z,0
"The Motion sense feauture in Pixel 4/4XL has other uses like sensing if the user is nearby, and only turn on the ambient screen if the user is near. I like that.<br /><br />Although the gesture to skip songs does not work half the time so I just disabled it.",Sehajpreet Singh,2020-01-06T05:23:27Z,0
What about 60fps!!!???,Ricardo Valdés,2020-01-06T05:23:27Z,0
Matte black everything,Rebel,2020-01-06T05:23:17Z,0
Please review samsung Galaxy Tab s6,Yamikani Kadzombe,2020-01-06T05:22:44Z,0
ASUS: makes a picture made out of LEGO <br />Marques: shows us the picture*<br />Marques: changes his profile picture*,Emilio Allison,2020-01-06T05:20:24Z,0
"Tesla video, yes please!",Austin Clark,2020-01-06T05:20:11Z,0
what is th most anticipated tech of 2020?,Milan K Budha,2020-01-06T05:19:39Z,0
You seemed pretty optimistic and happy in this video. Good for you 👌,Saem Sarguroh,2020-01-06T05:19:22Z,0
"New tesla model S (phantom) YES please, also make more car videos this year!!!!",Rohan Joshi,2020-01-06T05:19:20Z,0
"<a href=""https://www.youtube.com/watch?v=NbzpwG4n6Vs&amp;t=5m11s"">5:11</a> Mac Pro effect (again)... On picture .. And again... Geez Marques...",Andres Cabezas,2020-01-06T05:19:07Z,0
MKB8K here. So I&#39;ve been making 8K videos for about an year now...,Roobar,2020-01-06T05:18:45Z,0
Maybe 1+ is going to make the &quot;hide the camera&quot; feature into a built-in ND filter for phones. 🤯,Emmanuel,2020-01-06T05:18:39Z,0
"<a href=""https://www.youtube.com/watch?v=NbzpwG4n6Vs&amp;t=1m14s"">1:14</a> thought it was a pic of will Smith bruh",HΛM3UR9ΞR,2020-01-06T05:18:27Z,1
