comment,id,date,num_likes
Dangerously close to Linus territory,dhrx7,2020-04-17T00:19:45Z,0
"Of all the mainstream tech YouTubers, MKHB is simply the best. Yeah he says some things I don&#39;t agree with but when compared to the other guys, he comes from an authentic place that comes from his experiences. <br /><br />I can respect that over someone like Lou and Linus who try to sound smarter than they are and end up sounding really stupid. <br /><br />Keep up the good work bro, stay safe!",Josef Aguilar,2020-04-17T00:19:40Z,0
Stopped caring about Oneplus after I got my 5T. Used it rooted for 2 years then switched to an iPhone XR. I miss the days that the Oneplus One was competing with the Nexus 5 and Moro X...,Siren,2020-04-17T00:19:38Z,0
OnePlus 7 (non-pro) in India was ~$500 last year. Does OnePlus 8 add $200 worth of features? I don&#39;t think so.,Vivek Roy,2020-04-17T00:18:52Z,0
How are the portrait samples?,Atanu Bose,2020-04-17T00:18:46Z,0
How can i get the wallpaper?,Fahmi Ismail,2020-04-17T00:17:47Z,0
So IDK if any one noticed this or if you did this on purpose but your shirt is the opposite of your keyboard ok the desk niceee,Chronos XIII,2020-04-17T00:17:46Z,0
You can buy 7T 🤷🏼‍♂️,bañDìT XaM4,2020-04-17T00:16:57Z,0
From flagship killer to budget flagships killer,Ultimate,2020-04-17T00:16:54Z,0
"who actually wants wireless charging? it&#39;s so slow that it&#39;s pointless. Either you have a wireless charging mat somewhere and want to leave your phone there all day, or you won&#39;t need it because you can charge it at home due to its battery life.<br /><br />if OP ever released a phone with wireless charging, everybody would be like &quot;you have warpdash charging. why have wireless?&quot;",PG Plays Video Games,2020-04-17T00:15:07Z,8
you are so right about that.<br />I once bought a samsung charging pad for 70€ thinking it would charge as fast as using a cable or 30 mins more. I would be completely fine with 2 hours of charging but guess what in reality it needs 4 fucking hours to charge my phone from 0-100.<br />They could Invest the money to polish some things like better face registration on my s9.<br />the only thing samsung does is push as many as gimmicks possible in a phone and sell that for 1400€. They never polish or optimise their phones. The only thing I like about my s9 are the speakers (I love them) and the screen. But I can&#39;t use my screen properly because my battery will die in 4 hours thanks to that fucking exynos soc,Alichan,2020-04-17T01:44:57Z,0
Lol guess you didn&#39;t know the 8 pro has wireless charging.,Aevyn,2020-04-17T01:39:23Z,0
"The pro version has wireless charging, I don&#39;t think anyone is complaining",Hachimane,2020-04-17T01:39:13Z,0
Is that ventilation sound in the background or Mac Pro fans ? xdd,Mohamed Kadhem Mansour,2020-04-17T00:15:05Z,0
That colour makes it look like one of Tiger king&#39;s shirts,Holm86,2020-04-17T00:14:33Z,0
Is it just me or has one plus done everything to their phone no one wanted,Dan Seitler,2020-04-17T00:14:03Z,0
"Honestly, I&#39;m curious about a OnePlus tablet. What would it run? Android or chrome OS? Would it be more like a traditional Android tablet or more of an Ipad killer, or even surface X killer 🤷🏽‍♂️? I think they should go for it.",Jay Bugatti,2020-04-17T00:13:44Z,0
Your the best!! Can’t wait for the se video,ben cove,2020-04-17T00:13:30Z,0
Wallpaper link please?,Navdeep SINGH,2020-04-17T00:12:50Z,0
Apple slow down their phones after 2 years since the phone was launched via a software update to &quot;preserve&quot; the battery.,Leco GTI,2020-04-17T00:12:45Z,0
Entry music could be so much better,Sujay Jadhao,2020-04-17T00:12:42Z,0
"With all this covid19 situation=nightmare, priorities and values are shifting dramatically. Smartphones over $500 becoming super expensive, near $1000 and over - make no sense anymore. Upgrading the smartphones every year as I did before isn&#39;t an existing and possible thing anymore either.",Victor Rumyantsev,2020-04-17T00:12:35Z,0
Hi I’m mkbhd if it not a iPhone.... it nothing special about this phone.,Thi Henry,2020-04-17T00:11:52Z,0
1080p phone in 2020. Uh oh.,NET Alliance,2020-04-17T00:11:35Z,1
Casually listening to a 3000 dollar speaker  during recording,Donovan Hall,2020-04-17T00:10:41Z,0
Wished OnePlus 8 had a better pricing!! You could get a Flagship 7T pro for a lesser price than the BUDGET OnePlus 8.. Oneplus will surely lose their community if they keep increasing the price..,akshaf mulla,2020-04-17T00:09:47Z,0
"I have 3 wireless charges incl one for in car, and use None 😏",Jennifer,2020-04-17T00:09:10Z,0
A90 5G vs OnePlus 8?,Toilet bowl,2020-04-17T00:08:24Z,0
Marques: So I been playing around this new phone and let me tell you it&#39;s the OnePlus 2023 and OMG!!! WOW !!!.... and it&#39;s not even out yet,Malik Allen,2020-04-17T00:08:14Z,0
Review the Moto G Stylus.,selw0nk,2020-04-17T00:08:09Z,1
I love how Apple literally forsed OnePlus to sell new phones with the notch instead of notchless 😂😂😂💀 because apple will have the notch for face id for long long time further,Max Leon,2020-04-17T00:06:33Z,1
Say it with me guys<br />NOBODY CARES ABOUT WIRELESS CHARGING,Aldo Serrano,2020-04-17T00:06:26Z,0
shot out to that mat black devialet speaker on the background  x_x  $_$,Yassine Ghouil,2020-04-17T00:06:24Z,0
"<a href=""https://www.youtube.com/watch?v=OHP1rLwR6r8&amp;t=8m00s"">8:00</a> - <a href=""https://www.youtube.com/watch?v=OHP1rLwR6r8&amp;t=10m00s"">10:00</a> best comment of tech video. Totally Agreed. Loved it 👏",yash chauhan,2020-04-17T00:06:04Z,0
Ive got a feeling they won&#39;t sell a lot of those,Eduardo Hernandez,2020-04-17T00:05:45Z,0
Are you for real you piece of shit! Who&#39;s paying you.,David Crick,2020-04-17T00:05:44Z,0
I have no idea what One plus was thinking before releasing these 2 phones 😒<br />Literally 7T and pro are better offerings,Mayank Gupta,2020-04-17T00:05:10Z,0
Loving the quarantine hair! You’re not the only one!,Lowery02,2020-04-17T00:05:07Z,0
One plus 8: $699<br />iPhone 11: $699<br /><br />One plus 8 will face extremely difficult time to get sold. You can’t beat iOS in same price at least in the US. Of course iPhone has much better camera.,FREE SPIRIT,2020-04-17T00:04:38Z,0
I love the &quot;dangerously close to Linus territory&quot;  bit. Even Marques struggled to keep a straight face on that one.,MY TV,2020-04-17T00:04:34Z,274
"@MY TV yeah that does make sense. Thanks man! (Thanks to everyone else as well)<br /><br />P. S.  I know who Linus is, I just don&#39;t watch him that much to know him well 😅",Pranav Flame,2020-04-18T03:11:32Z,0
Thanks for the likes everyone.,MY TV,2020-04-17T19:58:01Z,0
"@Pranav Flame people have answered it  but basically Linus Tech Tips ( a YouTube tech channel ) the main person behind it, is Linus. It has now basically now a brand/company. But in EVERY video he does a sponsored/ad part at the start and at the end of the video. So he was having a slight joke by saying he is doing what he does by putting in a ad. I hope we have helped you out.",MY TV,2020-04-17T19:57:32Z,0
So What About <b><i>Nubia Red Magic</i></b> 5G 😒<br />Only <i>$499</i> 144Hz 12GB Inbuild cooling Fan 8K recording Snap 865 everthing in <b>OnePhone</b>,Cage Rally,2020-04-17T06:01:29Z,2
The caption says Lioness Territory,Dibbendu Koley,2020-04-17T05:56:55Z,1
"A high refresh rate and resolutions higher than 1080p on a cellphone are a waste of your battery life.<br /><br />Cellphone screens are small, and the Netflix or Amazon prime videos you&#39;re going to be watching aren&#39;t going to be played at higher refresh rates.  Those videos are locked.<br /><br />The only thing you should care about is the camera.",mangaas,2020-04-17T00:04:26Z,0
انت بصراحه روعه Arabic comment for the best one from Egypt,elmo. egy,2020-04-17T00:04:10Z,0
I fucking loved the new section at the end where you rank particularly strong phones by price. Definitely keep that going.,Francisco Coronado,2020-04-17T00:03:26Z,0
Can Samsung sue one + for copyright infringement. Its literally a galaxy phone,Omar Lopez,2020-04-17T00:03:19Z,0
"The more OnePlus tries to compete with the price of iPhones and Samsung Galaxy phones, the less special they become.  It&#39;s funny to see people on eBay trying to sell them for over $1000 when they clearly aren&#39;t worth that much.  Unless they are going to spend a ton on marketing and trying to make people forget they are a Chinese company, they should focus more on being budget killers instead of inching their way into being budget breakers.  Especially given the economic times in which we live.",Waygookin Way,2020-04-17T00:03:05Z,0
"They probably wanted to remove 5g and the extra cameras and sold it for $549, but the snapdragon 865 is only available with 5g which makes it very expensive. And oneplus&#39; brand is built on having the fastest hardware so they didn&#39;t have much choice",Finlay McEwan,2020-04-17T00:02:51Z,0
"<a href=""https://www.youtube.com/watch?v=OHP1rLwR6r8&amp;t=7m47s"">7:47</a> this is not the most lowest price 5G phone did you saw K30 Pro 5G?",Imran Hossain Rohit,2020-04-17T00:02:34Z,0
Oneplus died for me as a brand.,Oscar Andrés Galindo,2020-04-17T00:02:32Z,0
compare this phone to last years galaxy 10,Darkertime2,2020-04-17T00:02:25Z,0
✌️✌️ brand new iPhone XE 🤣🤣,AYUSH KUMAR,2020-04-17T00:02:23Z,0
The don&#39;t earphones and they don&#39;t give dongles. Shitty move by oneplus every year..,Rahi Narang,2020-04-17T00:02:17Z,0
"Why in getting the iphone se 2 over the oneplus 8...... more power, cheaper, and it actually supports verizon unlike oneplus",YourAnimeOtaku,2020-04-17T00:02:00Z,0
Des from T-Mobile unboxed this puppy and put it under water and touted IP68. What’s the deal?,Lowery02,2020-04-17T00:01:56Z,0
True about that price S10e 369.00 on. Amazon,luis cruz,2020-04-17T00:01:16Z,0
"I still don&#39;t buy the claim that phones have doubled in price. There are new categories, trying to justify themselves, but I don&#39;t see the value. What does a $800 phone do for people that a $500 doesn&#39;t? Is it just puffery and the draw of shiny things, like fashion? Is it driven by deceptive marketing and purchase plans that hide the real cost? Would people really spend $500 to upgrade from a $500 phone to a $1000 phone if they could feel it in their wallet at the point of sale? I imagine it&#39;s a combination of both.",Nick B,2020-04-17T00:00:46Z,0
But then they release a T variant later so I don&#39;t think its worth it to buy right now!,yo yo,2020-04-17T00:00:39Z,0
Hahahaha that line &quot;this thing catches more fingerprint than a CSI agent of the month&quot; 😂😂 as always shots fired MB🔥,Syed Bilal,2020-04-17T00:00:33Z,17
I thought the next video title would be <b>I&#39;ve been using iPhone SE 2020 for a month and here&#39;s my review</b> but damn I was wrong,Ahmed Eltahan,2020-04-17T00:00:33Z,0
Where&#39;s the iPhone SE 2020 video at?,Wazih Sharar Ihsaas,2020-04-17T00:00:18Z,0
Wao! 700$ for cheap one,zeezeebo,2020-04-16T23:59:58Z,0
I am not here to watch tech. I am here to distract myself from the madness of 2020.,jaded1122,2020-04-16T23:59:49Z,0
you forgot the wide angle camera,Rutger,2020-04-16T23:59:43Z,0
7pro is literally better than this,ryanoco7,2020-04-16T23:59:18Z,0
Wallpaper????,Ignacio Revaliente Alfaro,2020-04-16T23:59:04Z,0
Great phone as always w sensible cuts done right eg the screen. Shame it&#39;s no longer really a &#39;flagship killer&#39; anymore tho,Luke Sullivan,2020-04-16T23:58:57Z,1
"<a href=""https://www.youtube.com/watch?v=OHP1rLwR6r8&amp;t=9m30s"">9:30</a> a iPhone SE + a pixel 3a",Código comentado,2020-04-16T23:58:47Z,0
Hey! My last shiny phone was the Nokia 8860!,Derek Toronto,2020-04-16T23:58:44Z,0
"My OnePlus 5 camera is still amazing because of one thing: built in raw photo capability. Using Snapseed to edit raw photos gives me better photos that look exactly the way I want them to, without having to pay a lot for a flagship phone. Also, installing the Google photo app gives HDR+ raw photos, which is insanely easy to edit, with plenty of dynamic range and lots of flexibility. Learning to use a phone&#39;s camera, flaws and all can give better results than just buying a more expensive camera.",Daniel Newton,2020-04-16T23:58:38Z,1
Bro where did you get a Keychron shirt?!?! That’s so sick!,Matthew Quinn,2020-04-16T23:58:30Z,0
Does Sony even exist?,MrGonzonator,2020-04-16T23:58:29Z,1
Another good review! I was thinking about getting this but I think I will pass..,ArgentStudios,2020-04-16T23:58:20Z,0
Man I have never seen any YouTubers production better than yours and you improve faster than anyone,tiger oats,2020-04-16T23:58:15Z,0
This fool became a joke,TheCambra,2020-04-16T23:58:14Z,0
What do you think of the new iPhone SE after two and a half weeks of already using it?,Ethan Wells,2020-04-16T23:57:40Z,0
"Can I just say that I admire your set. The keyboard in your shirt, then the keyboard on the side. Then the screen on your computer, then the colors of the make up  kit (?). Well balanced. Hahaha. Thanks for the great review!",Emmanuel Jr. De Leon,2020-04-16T23:57:30Z,0
One plus 8 is 9...,YARIK Chuvak,2020-04-16T23:57:23Z,0
When 6.5&quot; is a smaller phone.,Samuel Benson,2020-04-16T23:57:22Z,0
Don’t you mean the nine review?,Parker Caron,2020-04-16T23:57:21Z,0
Mi10 vs Oneplus 8 Wich one should i buy?,D Nied,2020-04-16T23:57:17Z,0
Shots to Linus LOOL,Winston Phavivongkorn,2020-04-16T23:57:07Z,0
Almost 100k views in an hour🤯,Luke Sullivan,2020-04-16T23:57:04Z,1
This OnePlus 8 is kind of weird price I get it that 8 Pro has good display waterproofing and many more but I don&#39;t think OnePlus 8 price should around 550 or 600 cause there are many more less things than OnePlus 8 Pro .<br /><br />If you want some examples reply I will give you some.,Imran Hossain Rohit,2020-04-16T23:57:02Z,0
"The only thing i like about the new 1+ phone is the glow, rainbow-mirror phone color. I wish more smartphone companies release this kind of colour, i think only 1+ 8 and Note 10 have this kind of colour so far",moon night,2020-04-16T23:56:55Z,0
OnePlus: IP rating and wireless charging not included to cut down the cost<br /><br />Apple: IP67 and wireless charging at almost half price<br /><br />We&#39;ve seen quite a role reversal in the past 2 days 😅,Sanketh BR,2020-04-16T23:56:44Z,8
@Sinus Lebastian still at 700$ it&#39;s a Joke,Mastergrey Skull,2020-04-17T04:45:23Z,1
"one plus also has wayyy faster charging, way bigger battery, faster refresh rate screen and higher quality oled screen. Please think slightly before you comment",Sinus Lebastian,2020-04-17T04:31:31Z,1
Enter 2020 iPhone SE. 🤦‍♂️,C. Evans,2020-04-16T23:56:29Z,1
you only say good things about Samsung.  Shame on you!!!!!,L W,2020-04-16T23:56:11Z,0
"It feels like classic OnePlus photo because Op8&#39;s main 48mp sensor is IMX586 which is exactly same sensor used as Last year&#39;s Op7 series&#39;s main sensor.<br />It also use as Op8pro&#39;s wide camera sensor too.<br />No wireless charging, no telephoto camera, exact same sensor from last year, No IP rating 😂",김대윤,2020-04-16T23:56:11Z,0
never was special since it was made and designed in China,r r,2020-04-16T23:56:10Z,1
The only thing One Plus is killing is my wallet.,Fong Man,2020-04-16T23:56:10Z,0
You and your stupid finger print comments,Jackal Prince,2020-04-16T23:55:26Z,0
"<a href=""https://www.youtube.com/watch?v=OHP1rLwR6r8&amp;t=1m45s"">1:45</a> That speaker... wtf xD",Vladimir Žunić,2020-04-16T23:55:13Z,0
thanks for the price break down,M,2020-04-16T23:55:05Z,0
why you always start with Hi what’s up guys and end with peace?,Yi Xia,2020-04-16T23:54:16Z,0
"SE has the lens that we use the most<br />Has wireless charging<br />Flagship processor<br />And supposedly a long battery life<br /><br />Only trade off is the screen and the bezels, but the cost kind of justifies it. Did Apple just pull off an OnePlus? 🤨",Sanketh BR,2020-04-16T23:53:54Z,1
I really don&#39;t know how people manage to even last their iphone for more than a year. Battery degradation is a serious issue in my opinion but nobody talks about it since these reviewers don&#39;t use phone for more than 6 months .,NEERAJ BUTOLA,2020-04-17T05:19:25Z,0
"@ryan owen yeah and also guaranteed 4 year software updates for a 400$ phone, pretty cool!",Sanketh BR,2020-04-17T00:03:20Z,0
Sanketh BR yeh the iphones last for 5+ years whilst other tend to go old in a couple,ryan owen,2020-04-17T00:00:28Z,0
Did you film this in your new studio?,T.Watcher,2020-04-16T23:53:44Z,0
"K30 pro, for me is a better phone., Can U check it out?",ChristdamicoHD,2020-04-16T23:53:22Z,0
Forget about phone reviews and enjoy a YouTube video edge to edge in a perfect aspect ratio. Thanks MKBHD,Omar F.W,2020-04-16T23:53:13Z,0
"OnePlus 8 (not pro) DOES have IP68 certification for carrier exclusive models. So the unlocked version is too. Since carrier exclusives are treated as other models, they can keep costs lower by only certifying thosr alone. Also, I&#39;ve showered with my OnePlus 5T and left it outside while it rained so I&#39;m not tripping about it not being certified.",Mr. Popo,2020-04-16T23:53:00Z,0
"This looks great, but if a OnePlus X 2 was released for around $399, I would buy one in a heart beat.",Daniel Newton,2020-04-16T23:52:48Z,0
Imagine covering this beautiful phone with some cheap ugly aftermarket skin from d🤢🤢🤢 brand,I HAVE THE DOCUMENTS,2020-04-16T23:52:42Z,0
"<a href=""https://www.youtube.com/watch?v=OHP1rLwR6r8&amp;t=7m48s"">7:48</a> IQOO 3 &amp; realme X50 Pro am I joke to you?",Rudra Ditya,2020-04-16T23:52:38Z,0
Almost too coincidental that I got an ad by Linus (for Pulseway) on your video,Henry Mpofu,2020-04-16T23:52:33Z,0
My mans need a haircut,F L A S H Y,2020-04-16T23:52:31Z,0
2020: when Apple launched an iphone cheaper than oneplus.,Feet and Health,2020-04-16T23:52:24Z,2346
They did it. OnePlus Nord.,TheSuperiorOne,2021-03-03T12:32:17Z,0
056_FaqihAhmadHamami one plus 8 lasts more than twice as long as the se,Cococunt TM,2020-09-17T02:00:43Z,0
oneplus 8 is cheaper than iphone SE in India....oneplus 8 costs 550$ whereas the SE costs us 570$.... so it&#39;s not even an option for us.... since oneplus 8 is better and also cheaper,Sonali Dutt,2020-08-08T05:15:59Z,0
@JollyNuggs 6,Ash Coronado,2020-08-05T16:37:01Z,0
I ve heard the battery is horrible with the se soo I don&#39;t even consider that a phone,Lone Beast,2020-07-16T19:02:00Z,0
OnePlus 8 = 9,RpM_Rain,2020-04-16T23:52:17Z,0
Enjoyed that one quite a bit. Good job Marques!,Sherwin Bothello,2020-04-16T23:51:55Z,0
"<a href=""https://www.youtube.com/watch?v=OHP1rLwR6r8&amp;t=7m04s"">7:04</a> shoutout to Linus&#39; orange box!",Nick Phan,2020-04-16T23:51:53Z,0
"“New iPhone SE, as soon as I get my hands on it.” Two weeks from now: “So I’ve had the new iPhone SE for a month”",Ethan Turner,2020-04-16T23:51:40Z,7
I want the Interstellar Glow color way from the 8 on the 8 Pro.,Ramon Rivas,2020-04-16T23:51:25Z,0
ALSO I LIKE THE CHANGE YOU&#39;RE MAKING IN THE REVIEW,DoniStunts,2020-04-16T23:50:48Z,0
One of the best reviews I&#39;ve seen about this phone right now.,Ivan Henrique Tavares Pauletti,2020-04-16T23:50:40Z,0
He&#39;s in the new studio! congrats!,UnderEztmated,2020-04-16T23:50:32Z,0
The colour looks so beautiful. Love it.,justaman,2020-04-16T23:50:21Z,0
MKBHD: “Stay tuned for the brand new iphone SE when I get my hands on.”<br /><br />Tomorrow: “So I’ve been using the brand new iPhone SE 2020 for two months now.”,"100,000 Subscribers For COVID Funds",2020-04-16T23:50:04Z,1354
@Sajjan Singh no,Rahul Tanvir,2020-04-17T08:44:25Z,0
U got him,rahil inamdar,2020-04-17T05:17:17Z,0
You are over doing it lol,Anubhav Trivedi,2020-04-17T04:39:48Z,1
Does apple give review units??,Sajjan Singh,2020-04-17T04:36:49Z,0
@Zaiquiri why do you expect Instagram models to make original jokes,Dante's Inferno,2020-04-17T04:07:09Z,0
I like how the covid19 lockdown got your hair lookin like the fresh prince of bel air 🤦🏻‍♂️😂,TheCambra,2020-04-16T23:49:57Z,0
"Why android don&#39;t have a feature where it can only be switched off when password is entered and not while the device is locked where thief can steal the phone and switch it off even though the phone is locked, you should make a video on this topic, do company are profited when phones are stolen....",Jayesh Chavan,2020-04-16T23:49:53Z,0
"Why android don&#39;t have a feature where it can only be switched off when password is entered and not while the device is locked where thief can steal the phone and switch it off even though the phone is locked, you should make a video on this topic, do company are profited when phones are stolen....",Jayesh Chavan,2020-04-16T23:49:49Z,0
"Please review the LG V60 before you jump on the Oneplus bandwagon, the V60 is very similar in price to the Oneplus 8 and has almost all the features of the Galaxy s20 ultra. The V60 has wireless charging, a headphone jack, a bigger battery, and great cameras!",Josiah Kasper,2020-04-16T23:49:47Z,0
"Why android don&#39;t have a feature where it can only be switched off when password is entered and not while the device is locked where thief can steal the phone and switch it off even though the phone is locked, you should make a video on this topic, do company are profited when phones are stolen....",Jayesh Chavan,2020-04-16T23:49:44Z,0
meh. gonna have to pass on any oneplus.  I managed to get an unlocked s20 5g with 12gb ram and 128gb storage for $689 before taxes.  can&#39;t complain.,cram,2020-04-16T23:49:40Z,0
"Why android don&#39;t have a feature where it can only be switched off when password is entered and not while the device is locked where thief can steal the phone and switch it off even though the phone is locked, you should make a video on this topic, do company are profited when phones are stolen....",Jayesh Chavan,2020-04-16T23:49:40Z,0
That font used in the logo is AWFUL,Benjamin Abarca,2020-04-16T23:49:37Z,0
I&#39;m gonna stick by the Never Settle statement. I&#39;m not buying phones for the better half of a grand with missing and/or downgraded features!! OnePlus died with the OP5t,-Vance- Dun,2020-04-16T23:49:09Z,0
so what would you guys get: oneplus7T or oneplus8?,LOVER LINK,2020-04-16T23:49:02Z,0
like the color,Sheila Marie Wee,2020-04-16T23:49:01Z,0
Anyone notice the new one plus logo 🤔🤔,Scott Gay,2020-04-16T23:48:47Z,0
You can&#39;t see any difference after 120. That&#39;s all the human eye can see.,Christopher Haynie,2020-04-16T23:48:45Z,0
"Poco X2 5G version might interest a lots of people.<br />It has good processor SD 765G,<br />Fast charging and charger included in the box,<br />Not the best but good quality 120HZ Ips LCD panel,<br />And the price is also really cheap compared to others.<br />.<br />.<br />Also, poco has the best android development support like Custom Rom and stuffs.<br />Also has probably  the most Stable GCAM Mods and pictures comes out real sweet. <br /><br />.<br /><b>Peace</b>",Sulaiman Ahmed,2020-04-16T23:48:43Z,0
watchin from india....here the time is 5.00am in d morn,mukesh ramu,2020-04-16T23:48:37Z,0
Whoa marques recommending the iPhone SE 2 even when he didn&#39;t get his hands on it yet,Faiz Frez,2020-04-16T23:48:32Z,4
He probably got it,Prasad,2020-04-17T04:00:28Z,1
Good flex on the Phantom at full volume. Nice choice of  Bluetooth speaker options.,Dan M.,2020-04-16T23:48:23Z,0
Your intros are just so 😎 like literally,Femi Joel,2020-04-16T23:48:22Z,0
MKBHD: Catch you guys on the next one very soon<br /><br />So it&#39;s true you&#39;ve had iphone se for 2 weeks huh,Haziq_411,2020-04-16T23:48:20Z,4
The iPhone SE is actually iPhone 6ssss.,Hakimi Hazizan,2020-04-16T23:48:11Z,0
I kinda like this phone. I think I&#39;ll upgrade to this from my OnePLus 6.,TheLonelyAstronaut,2020-04-16T23:47:54Z,0
Who&#39;s gonna buy this when the Samsung S10 is going for $500 now.,Tausif Samin,2020-04-16T23:47:51Z,58
"@rcx M The point of my previous comment was that this &quot;piece of mind&quot; offered by IP68 is kind of illusory. Have you watched the video, I mentioned. It talks about an IP68 device getting water damaged. Read carefully, an IP68 device getting water damaged. So, there goes your piece of mind.",Hari Sankar,2020-04-17T07:01:47Z,0
"@rcx M First of all, I never said Oneplus 8 is a perfect phone. I have mentioned in all my previous comments that S10 may have a better camera than Oneplus 8. As far as Samsung saturation is concerned, I stand by my comment. Do you know why Mkbhd always puts Samsung flagships at third place when it come to cameras?, it is because Both Pixel series devices and Apple iPhones produce more realistic colours and even better dynamic range compared to Samsung flagships. I have also never talked about Oneplus 8 Pro. Why are you unnecessarily bringing that up?<br /><br />P. S: You brought Linus up. So, iam saying this. He has always praised Oneplus for not over saturating images. &quot;What you see is what you get&quot;, that is his exact words. See his Oneplus7pro review for reference.",Hari Sankar,2020-04-17T06:55:46Z,0
@Ed Lim I said 30w warp charging (I mean wired) is faster than 15w wireless charging.,Hari Sankar,2020-04-17T05:57:59Z,1
