comment,id,date,num_likes
I literally got a linus ad while watching the video,Joshua M,2020-04-18T14:43:15Z,1
One plus is now launching expensive smartphones 😠😠😠😠😠😠,Vicky Kumar,2020-04-18T14:42:45Z,0
iPhone SE will literally destroy this phone..,CoLoNeLC4,2020-04-18T14:41:30Z,0
"Thanks to corona virus, not going to buy anything from Chinese companys ( born to lie). Even if they make time machine I dont want it. China is a country every one should keep away,  they cannot be trusted in any way.",Prathamesh Bhalerao,2020-04-18T14:29:58Z,0
What was that Bluetooth speaker you had in the background?,Damon Works,2020-04-18T14:20:48Z,1
The Design isn&#39;t copy of MI 9T???,Azad Ansari,2020-04-18T14:19:30Z,0
It fit on my screen!,Amirul Adam,2020-04-18T14:16:36Z,0
"You might not know, but he is currently testing/using iphone13. Review is gonna be up when apple officially launches it.",Hk Physics,2020-04-18T14:11:10Z,0
Can you talk about the microphone? Is it the same as the 8 pro? How is the quality?,Ben Hauser,2020-04-18T14:07:49Z,0
The regular OnePlus 8 is not worth buying. If you are going to buy an OnePlus phone you need to buy the OnePlus 8 Pro,Official Filmilen,2020-04-18T14:05:58Z,0
Love that shirt!,Sherard Yu,2020-04-18T14:02:30Z,1
"But it&#39;s a Chinese company, so ... nope.",James Campbell,2020-04-18T13:42:13Z,0
"Very few people use the wireless charging, so labeling it as &quot;not special anymore&quot; while calling iPhones &quot;best iPhone&quot; even though it&#39;s the same trash every year is kind of shady, and makes you lose credibility.",Roc,2020-04-18T13:37:48Z,0
How can I get those wallpapers????<br />Thanks in advance 😊,Mushfiq Rahid,2020-04-18T13:30:20Z,0
"Hey @Marques, why aren&#39;t your videos 4k60? I have seen other channels do it. If anybody provides 4k60 videos, it should be MKBHD!",Jonathan Ritter,2020-04-18T13:30:05Z,0
Flagship price fast and fast no more love to oneplus  more price,gaurav rawat,2020-04-18T13:29:50Z,0
"Why do people care about wireless charging, pointless feature get over it.",A B,2020-04-18T13:28:33Z,2
"Wait, did they just change their logo design? It&#39;s different than what is on the back of my OnePlus 6!",Darshan Shah,2020-04-18T13:22:33Z,0
1+ finally enter in flagship race<br />I phone enter in budget<br />We r in endgame,akki,2020-04-18T13:19:47Z,0
Worst Smartphone Oneplus...,SAUZAB SHAIKH,2020-04-18T13:17:03Z,0
I&#39;d like to know if it&#39;s enough to upgrade from the 7pro or the 7T... Seems like the 8 and the 7t are the same phone!,nookiewacookie1,2020-04-18T13:16:48Z,0
i hope OnePlus fails n come to thier senses,Tech Lover,2020-04-18T13:07:14Z,0
They copied Samsung,Kabineh kabba,2020-04-18T13:01:39Z,0
Don&#39;t know what&#39;s the obsession with wireless charging. It&#39;s one the most stupid features. You can use your phone if it&#39;s wire charging. Can you take your phone in your hands and will it still charge wireless?,Jay Mandliya,2020-04-18T13:00:37Z,0
$399 iPhone SE came with wireless charging!!,Steve C.,2020-04-18T13:00:19Z,1
Could u please tell what&#39;s really the best Android phone u can use.,tasim1725 12,2020-04-18T12:52:42Z,0
I have Asus Rog 2 - there is a difference between 90hz and 120hz. 120hz is just too fluid and when scrolling at 90hz there is little blur,Sherlock Holmes,2020-04-18T12:25:32Z,0
"Oneplus will scratch their heads why the phones didn&#39;t sell well until they see the comments here.<br />To me, its a glass cannon.",Aaron Tan,2020-04-18T12:25:08Z,3
7 Pro is better for much less,Chris B,2020-04-18T12:23:56Z,0
"I was going to get the 7t, but I&#39;m confused between 7t and 8. I don&#39;t want to pay for 5G , knowing it&#39;ll take a while for 5G coming here, but the aesthetics of 8 keep distracting me from 7t.<br />The display looks amazing, and it&#39;s smaller than 7t, plus looks better imo.<br />The price in China is around 43,000 so I guess indian prices could be 44-45k hopefully. <br />Then would it be better than 7t ?",Anjali,2020-04-18T12:23:18Z,1
didnt he just made a video of the op8pro &quot;finally a flagship &quot;,Imperiom,2020-04-18T12:11:48Z,0
Please Review Redmi K30 Pro and K30 Pro Zoom,Htoon Lynn Kyaw,2020-04-18T12:06:44Z,0
Omg ENOUGH with the wireless charging gimmick!! Its not really wireles. Yoh have to keep your phone on a stand. Leave it!!,mianmenu,2020-04-18T12:06:28Z,0
"FYI, this phone is a “decoy”. It’s a marketing tactic. We as “humans” find it hard to justify value of something without having something else to compare with (a standard). By having this goofy oneplus 8, you will feel satisfied when purchasing oneplus 8 pro, that you made the “right” decision. This tactic is more widely applied than you think. Apples deploys this quite often by adding “upgrade versions” while they could easily launch just a single version with great/ perfect specs instead.<br /><br /><br />Plain english: they make versions like this so that you will buy upgrade versions ..",Holmes,2020-04-18T11:49:13Z,15
@Holmes personnaly would either go for the 7T pro or the 8 but absolutely not the 8Pro,Harper55,2020-04-18T22:16:12Z,0
"@Harper55 You paid over €600 for a phone, would 10% makes a difference? there are plenty of other good options for much lower price. And I suspect 128GB version of XR dominates the 64GB version. <br /><br /><br />And those bezels in SE in 2020?? with that &quot;seemingly lower&quot; price, they could already make better design. $400 for a piece of metal, its not likely that cant remove those bezels (I personally don&#39;t like them). <br /><br /><br />I have an ipad, and used to have an iphone. But I&#39;m conscious and not a fan of Apples AT ALL. And this is very case specific. Setting up decoy as I said is a real tactic. Just like this Oneplus 8.<br /><br /><br />It&#39;s a great phone still, don&#39;t get me wrong. Just $100 extra for the Pro with wireless charging, I will take that. I would already pay $800..<br /><br /><br />Simple question: would you buy this Oneplus 8 or Oneplus 8 pro?",Holmes,2020-04-18T21:54:58Z,0
"@Holmes well I also read that the 64Gb variants are more successful on iPhones even the Pro ones , I&#39;d say that all those variants are made for a more important reason and that&#39;s reaching most of the market . The 70€ difference for storage is pretty big so that&#39;s not really feeling like having the best value.  Having a cheaper but still attractive device will undeniably give you more reach that&#39;s exactly why apple is launching the SE 2nd gen",Harper55,2020-04-18T21:12:47Z,0
"@Harper55 I don&#39;t think that&#39;s the case. I just checked the store price in Finland as an example, iPhone XR 64GB is €629, and XR 128GB is €699. Doesn&#39;t it make &quot;more sense&quot; and reasonable to buy the 128GB version with €70 extra for a complete feel, that you got the best of value, the best specs possible? Not to mention then you have iPhone 11, pro, pro Max, different RAM, ROM, like come on... There are more strategies to this (Apples is  largest companies on PLANET by revenues at times!!), And I know setting up &quot;decoy&quot; is a thing. I&#39;m not just making it up. It is not necessarily EVIL, it&#39;s just tricky to change the way you perceive value of something (else).<br /><br />Welcome to marketing world. You are fooled more often than you think. From the toothpaste you use (tinkling feeling it creates), beer you drink (foams, fizzy gas), crunchy bites from snacks, &quot;eco-friendly&quot; consumption to help the earth, etc. There are people being paid millions to make all these to manipulate how you feel. But it&#39;s another story. :)",Holmes,2020-04-18T21:02:00Z,0
The iPhone 11 and xr are the best selling iPhones of their generations despite being the &quot;worse&quot; your point is invalid,Harper55,2020-04-18T16:47:50Z,0
waiting for motorola edge and plus 🤩,Rishav Thakur,2020-04-18T11:46:42Z,0
Was a flagship killer. <br />Now it&#39;s a flagship with compromises.<br />I loved my 1+3t and wanted to upgrade but they&#39;ve killed my desire for a new 1+ with those prices. The 8 is €719 (nearly $800) and the green 8 pro 256gb is €1119....crazy. My 3t was €430. That difference is ridiculous.,martyfriedman666,2020-04-18T11:44:37Z,1
"Stop buying products by China. By China, and Made in China are two completely different things. Stop buying products by Chinese companies. They HATE us. F*** them. F*** their viruses. F*** Communism.",Frankamentise,2020-04-18T11:38:42Z,0
My very simple theory &quot; I will never buy Chinese ph&quot;,TUHIN SUVRO ghosh,2020-04-18T11:28:27Z,0
Then which phone do u buy little bitch.,Indian Masala Videos,2020-04-20T13:29:38Z,0
p40 pro and oneplus 8 pro ，which one Ｉshould  buy,Mahatma Gandhi,2020-04-18T11:23:16Z,0
"Bro , s10 e or s10 lite ?",Rohan Mehta,2020-04-18T11:18:14Z,0
still no shout out for the oppo reno ace the fastest charging smartphone for 500 bucks？,John Contralis,2020-04-18T11:10:06Z,0
This is the new studio or old??<br />Mkbhd : whats up guys it&#39;s mkhhd here,Ramneet Singh,2020-04-18T11:05:55Z,0
I want a single reason to buy this phone after oneplus 7T....,Gunnu The Great,2020-04-18T11:02:05Z,1
None bro,Gamer lord,2020-05-01T23:57:33Z,0
"<a href=""https://www.youtube.com/watch?v=OHP1rLwR6r8&amp;t=0m54s"">0:54</a> at $699 you can either get wheels or a brand new op8 😂😂",Udit Bhatia,2020-04-18T11:00:12Z,10
This gent does the BEST phone reviews on the net. Hands down.,Veran,2020-04-18T10:58:41Z,0
phone will come and go buut iphone is best in world..,akhil s,2020-04-18T10:48:10Z,0
OnePlus: never settle.<br /><br /><br />also OnePlus: we&#39;re done,maruftim,2020-04-18T10:48:03Z,815
@Johnny_Boi ye,Elias Tapia,2021-03-03T15:47:48Z,0
@Ridzky Asdi it&#39;s a joke,Elias Tapia,2021-03-03T15:47:24Z,0
@Verbosi7y Miata 👀,Badland.,2020-09-14T19:25:24Z,0
BRUUUH 😂😂😂,Archie,2020-09-07T03:03:39Z,0
"@Aɳԃɾҽɯ K rip pop up. still a pretty cute design and in engineering, pretty good. reminds me of the pop up headlights in the older cars.",Verbosi7y,2020-08-28T05:18:06Z,1
and i can already find a s20 for 700,Ali muhammad,2020-04-18T10:42:44Z,0
"I really wish Android phone companies like OnePlus would pick a design language and stick to it. This is why iPhones have the brand recognition even though things like their notch is still the biggest. I have the OP 7T, because I find it&#39;s 90Hz screen with the tiny teardrop notch the most aesthetically pleasing, but it&#39;s round camera bump came outta nowhere. Now they have this beautiful pearlescent  finish and the right camera bump but it looks like a Galaxy phone with the dumb front camera cut out! This phone but with an even more optimised teardrop notch would have been my perfect phone (I don&#39;t care about wireless charging) AND it would have looked distinctly OnePlus. It&#39;s a shame.",Henry Ball,2020-04-18T10:40:10Z,0
Boycott china 🇨🇳,Narendra Choudhary,2020-04-18T10:39:26Z,1
Is there anyone else having problems with OnePlus GPS/location service ? After a year my oneplus is having problem to use GPS..,This is the way,2020-04-18T10:32:04Z,0
Wallpaper?😂,prajwal Prasanna,2020-04-18T10:27:29Z,1
It&#39;s from Backdrops app called &quot;Prime Target&quot;,Gavin Pinto,2020-04-18T12:44:33Z,0
Very happy with my 7T. Got it for £430odd with a trade-in.,AJ P,2020-04-18T10:22:29Z,0
one plus eight is nine,Darkside Rie,2020-04-18T10:20:07Z,0
Video highlights:<br />■1080p screen resolution instead of 1440p<br />■90hz Screen refresh rate instead of 120hz<br />■Small screen in comparision to 8 pro<br />■Camera is not great<br />■But it is still Oneplus.,Tushar Bawari,2020-04-18T10:18:03Z,0
Giveaway 😜,santosh kumar,2020-04-18T10:17:10Z,0
Why don&#39;t they have this color for the 8 Pro?,Michael,2020-04-18T10:12:21Z,0
Why can&#39;t manufacturer make a smaller pocket friendly phone whit size of 6 inch display like Galaxy s10e size or Xiaomi Mi 9 SE this is a good size in my opinion.,Mario S,2020-04-18T10:09:16Z,0
Watching this on my pixel 2XL. Still awesome!,Jobin_ Thomas,2020-04-18T10:07:40Z,0
Seems like a good alternative to Samsung S20 with exynos,Khun Tor,2020-04-18T10:07:26Z,0
OnePlus 7 pro is a straight up better buy than OP8 at the same price. Why would anyone even bother with this. It&#39;s not like SD865 and SD855 have any meaningful difference in performance.,DarkFeels,2020-04-18T10:04:18Z,1
trying to make profit sounds good,Sk Rashid Ali,2020-04-18T09:59:54Z,0
No wallpaper link?,Sahil Doshi,2020-04-18T09:52:55Z,0
It&#39;s from Backdrops app called &quot;Prime Target&quot;,Gavin Pinto,2020-04-18T12:44:49Z,2
Just got this phone. It&#39;s so good!!!,Zoe Cui,2020-04-18T09:49:25Z,10
how is it after 9 months ?,Joel D,2021-02-11T19:43:04Z,0
"Hate OnePlus Price.It&#39;s so sweet journey with OnePlus for last few years as a Indian with OP5,OP6 but this time it&#39;s far more expensive it&#39;s better to go for iphone now.",Mr. Mittir,2020-04-18T09:46:51Z,0
I would have loved to type if that t shirt is worn by a girl,Nitish Bhakat,2020-04-18T09:15:09Z,0
"Marques single-handedly made &quot;fingerprint smudges&quot; on a back of the phone, a thing. It is NOT a thing! It&#39;s a way to to promote those god damn Dbrand skins and i am sick of it.",sponge,2020-04-18T09:08:00Z,0
Taking the ip68 and no wireless charging says 1+ don&#39;t really believe in the hype. They knew they had to bring it this year so they slapped everything in the Pro and forgot about the 8,buster colin,2020-04-18T09:03:47Z,0
One plus is gonna lose it shares in market,Bhavik JN,2020-04-18T09:00:09Z,0
"iPhone SE seem more interesting, idk",Wondering Guy,2020-04-18T08:59:30Z,0
"$700 is little bit too much, pricing aroung $600 would be great. it can not compete with iPhone 11",BRISKY,2020-04-18T08:55:25Z,1
That is what everyone is complaining the Oneplus we all know is no longer special with that high price tag,Nicetea Wizzy,2020-04-18T08:52:38Z,0
"Marques, what&#39;s the link for the speaker at <a href=""https://www.youtube.com/watch?v=OHP1rLwR6r8&amp;t=1m54s"">1:54</a>?",Frank Hutcherson,2020-04-18T08:49:31Z,0
"Why are we still talking about the profit margins as if these manufacturers aren&#39;t making a killing off of each unit they sell? What OnePlus is trying to do is not to keep the costs low, but to keep the profit margins the same while they&#39;re adding or improving on features. We all know how much an iPhone costs to make and that&#39;s as premium as it gets, not because of the top tier tech, but because every part had to be R&amp;D-ed specifically for Apple. Let&#39;s not forget that most other phones, including OnePlus, get the majority of their components from a shared parts bin, so I&#39;m not going to just accept the &quot;cost-cutting&quot;  here. I know it&#39;s tough to keep the shareholders happy, but let&#39;s just call it as it is.",Momchil Kolev,2020-04-18T08:46:34Z,0
Buying 7T was the smartest decision.,Vishwadeep Sonawane,2020-04-18T08:44:34Z,1
For 200 dollars we get  lg g7+ thinq in india,RAJPUROHITH RAGHU NADH,2020-04-18T08:44:26Z,1
Overpriced ! . Nothing like cutoff . Remember 7T it had almost everything and a telephoto camera aswell at almost half price now.,rishabh jain,2020-04-18T08:41:05Z,0
Curved screen = no buy! The price increase makes no sense either. The 7T is honestly a much better buy.,Cereal,2020-04-18T08:39:51Z,0
"Yeah the price is shit, but I love edges😍",Adreot,2020-04-18T09:03:45Z,0
This phone is as relevant as This Year has been so far. 😒,visharad rawat,2020-04-18T08:33:52Z,0
Just for the looks its a 10 🔥🔥🔥,itsSamPra,2020-04-18T08:33:52Z,3
Is that a highway I&#39;m hearing in this vid?,StellarAudyssey,2020-04-18T08:29:07Z,0
im gone wait for the one plus 8t or oneplus McLaren edition,MrCrazy-R,2020-04-18T08:23:05Z,7
Going to,Fred Hand,2020-08-21T02:07:57Z,1
pls do gaming  test in both. of phones,DEVIL X Gamerz,2020-04-18T08:18:39Z,0
Is it only me that just watches this kinda videos knowing u ain’t gonna buy a new phone anytime for now because u can’t afford one but it just good to just watch it,Abdi Wahid,2020-04-18T08:09:44Z,4
Nope u not alone.....,hannah wonsia,2020-08-18T21:07:22Z,0
"Maybe OnePlus is still positioning the OnePlus 8 Lite pretty soon. This will become the flagship killer, or at least, a competition to the iPhone SE 2020",Judiel Jon Aviles,2020-04-18T08:02:10Z,0
Apple: welcome to our family....,S.M. FARHADUZZAMAN,2020-04-18T08:00:54Z,0
Bad state of affairs when the iPhone se2 is better value than a oneplus product,MrAckers75,2020-04-18T07:50:55Z,0
<b>ONEPLUS FANBOIS BE LIKE</b><br /><br />OLDER DDR4X RAM - Its OK<br />Useless 2MP MACRO SENSOR - Its OK<br />NO TELEPHOTO LENS - Its OK<br />Older IMX586 SENSOR - Its OK<br />No IP RATING / WIRELESS CHARGING - Its OK<br />PRICE - $699 - Its OK<br /><br />After all it has Oxygen OS,Manish Kumar,2020-04-18T07:47:10Z,0
I don&#39;t like/need wireless charging. Please advance.,Yair,2020-04-18T07:46:55Z,0
I don&#39;t get these &quot;no wireless charging&quot; whiners 🤷‍♂️,Руслан Мустафаев,2020-04-18T07:38:56Z,0
"Waste of money on this phone, could get a iPhone SE way lower than this price.<br />OnePlus out of sales after new iPhone budget phone📱.<br />If you have money you can buy it or else you can lookout for upcoming budget phone.",Ramachandran K,2020-04-18T07:36:30Z,0
Very Honest Review 👌👌,Sourabh Kansal,2020-04-18T07:35:56Z,0
What is the bakround and Ivan pack that you used on this phone? It looks really nice,Kalle Anka,2020-04-18T07:25:38Z,0
"Honestly for me, Oneplus 8 is leaps tone better than S20 ultra not only for price but also because(I live in Asia) the snapdragon instead of the terrible exynos.",Raze Imaginator,2020-04-18T07:22:01Z,0
MKBHD: taking some random photos.<br /><br />Also MKBHD: I’ll just flex on my Tesla real quick and get back to the office.,ohad arieli,2020-04-18T07:21:24Z,97
Marques video quality is soo good that it looks like a 1080p res video even if it&#39;s a 480p res video,Denden,2020-04-18T07:19:46Z,0
@Adreot I&#39;m on a samsung note 10 lite and it&#39;s showing just 480p for me,Denden,2020-04-18T09:35:17Z,0
@Denden I am on a huawei mate 20 pro. So it is not,Adreot,2020-04-18T09:12:44Z,0
@Adreot I think on mobiles it&#39;s locked to 480p,Denden,2020-04-18T09:09:58Z,0
It is 1440p for me,Adreot,2020-04-18T09:05:10Z,0
"Such a big box, such high price and still no headphone in the box = No buy",Anshul Singh,2020-04-18T07:12:30Z,0
Your review suck,james hardy,2020-04-18T07:08:07Z,0
"Hey marques, my friend own a poco x2 but we cannot see any difference while using in 120 Hz <br /><br />We tried to compare with my redmi K20.<br /><br />Is there any one else with same problem?",piyush koradiya,2020-04-18T07:02:04Z,3
Nice t-shirt bro..,Dhruv Pathak,2020-04-18T06:59:16Z,0
"I&#39;m getting nightmares about the colouring of the F-row on the tee... F1-F5 dark, and F6-F8 light?",proxactual,2020-04-18T06:57:35Z,0
These companies are going nuts. OnePlus is going up and apple came with SE,Ahsan Arshad,2020-04-18T06:55:53Z,0
Clearly a fan of high refresh rate.<br />But never posts a video with high refresh rate.<br />On the irony,Surya Abbisetti,2020-04-18T06:51:36Z,0
Finally settled and no more special 😏,Aksj Sbbz,2020-04-18T06:51:25Z,0
Just wondering onePlus cut features and functions in order to reduce Cost of OP8 i.e.699$.Or else the price would have been out of the world.<br /><br />Lol,Carts & Trolley,2020-04-18T06:50:50Z,0
<b>still I love my one plus 6</b>,KAMAL YARLAGADDA VLOGS,2020-04-18T06:46:23Z,1
"<a href=""https://www.youtube.com/watch?v=OHP1rLwR6r8&amp;t=7m02s"">7:02</a> <b>Laughs in Linus</b>",Yusuf T-Deen,2020-04-18T06:36:08Z,9
I want to know about the purism lap n phones.<br />Is it available in India?,Vikram S R Acharya,2020-04-18T06:30:49Z,0
At least they not play fools with hw specs and cam. Like Chinese product does 😅,Anderson Frans,2020-04-18T06:30:08Z,0
You are so biased!!😂😂😂,Prateek Vij,2020-04-18T06:16:13Z,0
It&#39;s like every company starts out locking horns with iPhone. They imitate Apple and advertise that they are different and better.<br /><br />Soon they make their phones expensive and Apple always has the last laugh.,Mohanish Mankar,2020-04-18T06:15:30Z,0
I&#39;m happy with my OP7 PRO:),Arts D-502 Rohit Joshi,2020-04-18T06:14:57Z,0
Did Apple pay you to mention the SE every and each time posible? I think you arent being objective and fair with that 2016 pone with 2019 internals..,Alexander Uriarte,2020-04-18T06:12:57Z,0
can i boycott this for our fallen victims of covid? my life has suffered because of chinese coverup,TopCarsPH,2020-04-18T06:09:54Z,0
"Pixel 4 XLs are going for 600 right now, has so much more on the One plus 8. I Picked one up. Honesty think it got way more hate then it deserved. Sure it was over priced at the time but at this price its a steel. I love it. coming from an S8. Never going back to Samsung again.",Dylan Zelensky,2020-04-18T06:01:40Z,0
"My 6T has served me well, but it crashes/malfunctions way too often now (almost daily, and daily with the camera app) but I&#39;ll wait on the 8T Pro, I have some hope that with the McLaren Edition of the phone, 65W charging becomes a thing, if it doesn&#39;t then I&#39;ll probably get the regular T and call it a day.",Joaquin RP,2020-04-18T05:56:01Z,0
One plus launched oneplus 8 to beat iphone 11 <br />Apple launched iphone SE 2 at cheaper price <br />Apple is always one step ahead of every phone brand...,Dhruv Pandey,2020-04-18T05:55:56Z,1
Just awesome.,iAZ Vlogs,2020-04-18T05:53:42Z,0
"Yeah I love the colour, but it&#39;s the same problem I had with the HTC u11+ I owned... Looked amazing in videos but a total fingerprint smudge factory",Iad Alazzhr,2020-04-18T05:52:48Z,0
Putting wireless charging on a phone costs like nothing. It&#39;s a wire coil,TheTuneAce,2020-04-18T05:52:21Z,0
MKBHD: Uploaded 11 minutes ago (1.2 million views)<br />Me: uploaded 4 years ago (243 views),Maanasa Prathana,2020-04-18T05:51:24Z,71
LOL,Madhuri Deo,2020-07-15T08:17:02Z,0
@Navid Hussain cuz no one cares,ً,2020-07-10T13:16:29Z,0
I upload 9 years back I have 20 views bro,Navid Hussain,2020-07-03T16:35:21Z,0
This phone is not competing with that dumbass iPhone SE 2. This phone is competing with iPhone 11 (128 GB). Those two are like the exact opposite of each other at the same price tag.,Oscar Simón,2020-04-18T05:49:16Z,0
Best part when your compared 😉,NASSER FARAJ,2020-04-18T05:45:03Z,1
Isn&#39;t wireless charging basically like setting down your phone with charger plugged in except you can&#39;t pick it up? Lol when I think wireless charging I think of a little device you just plug into the usb port while you do your thing..,Devan Vieira,2020-04-18T05:38:41Z,0
Why am i not seeing any 1080p  /720 p resolution to these mkbhd videos!,Sandeepan Panda,2020-04-18T05:37:12Z,0
Plz do poco x2 review,Shanu boya Trickshots,2020-04-18T05:30:51Z,0
"no SD slot, no care",Mudig,2020-04-18T05:28:37Z,0
yeah m agreed with the camera quality talk yeah oneplus dropped quality of camera after ON 5t,Karan Verma,2020-04-18T05:18:22Z,0
Marques I think u need a haircut no?,alvinllol,2020-04-18T05:15:22Z,0
"Woah, so you are telling me a One Plus phone in 2020 costs the same as an Iphone + Air Pods + Wireless charger?? Mind blown",ctrlsoul,2020-04-18T05:14:37Z,0
@MKBHD<br />Hi bro.! I love your videos. ❤️<br />Could you please make a video for comparison between OP7T and OP8,sankalp nanda,2020-04-18T05:11:38Z,2
Should I buy oneplus 8 or should i buy galaxy s20 ... I&#39;m from India and i wanna use my next phone for at least 3-4 years,z Z,2020-04-18T05:04:04Z,0
I am still using a 5T and love it. Not looking to upgrade any time soon,Jasper Cox,2020-04-18T05:03:42Z,0
So should i upgrade from 7t pro to 8?,Football is my Drug,2020-04-18T05:01:10Z,0
no,R,2020-08-20T23:23:16Z,0
Hey marques can we have all the wallpapers you use in your phones while reviewing.<br />Those are quite interesting and eye catchy.,Prathmesh Singh,2020-04-18T04:59:05Z,0
marques: &quot;dangerously close to Linus territory&quot;<br />linus: &quot;speaking of territories...&quot;,Risen King,2020-04-18T04:52:46Z,1534
Wanna protect your territory? Why not protect it with privateinternetaccess,sebrofcram,2020-08-19T16:47:39Z,0
@Muni o It used to be tunnelbear tho,ZenturianTheTrooper,2020-08-03T18:55:34Z,0
"@Skalle No, its tunnelbear lol",ZenturianTheTrooper,2020-07-11T01:34:33Z,0
@Grinch _ segue,John Kevin,2020-04-24T22:17:20Z,2
"Keep your privates in your territory, LTT underwear.",_chaos_ fre4k,2020-04-24T05:56:24Z,17
"I got One+ 7Pro coz of the obvious reasons (no notch, 90Hz, 6.8 inch screen, almost-stock Android OS, fast processor, and many others) . That imho is PEAK One+ , and was THE phone w/ best combo to offer that yr. Everything else is downhill from there. One+, please don&#39;t chase vanity like HTC, right before they gone kaput. No one can be iPhone. Just let iPhone be iPhone, Samsung be Samsung, and stick to your values, One+.",Vincent Putera,2020-04-18T04:51:29Z,0
Wow! You have the most expensive bluetooth speaker in matte black!,Yñigo Muñoz,2020-04-18T04:48:48Z,0
"That colour look dope, but so far nothing exciting , 🤷‍♂️",Ahmed Asssh,2020-04-18T04:43:52Z,0
<b>The OnePlus 8 pro kills flagships by committing suicide</b>,Abhisar Rawat,2020-04-18T04:34:16Z,0
how did you even manage to buy the phone while the world is under lockdown due to corona ?,Vishal Thokade,2020-04-18T04:33:09Z,0
you are the MAN,AniMAYA,2020-04-18T04:32:34Z,0
Which is worth to buy one plus 8 or iPhone Xr,SORA senpai,2020-04-18T04:28:07Z,0
It&#39;s tooooo much PRrrrrrice,Deepak Ranjan,2020-04-18T04:26:36Z,1
The Interstellar Glow is $799. Just a correction.,Siddharth Sahoo,2020-04-18T04:25:31Z,0
