comment,id,date,num_likes
Don&#39;t kid yourself<br /><br /><br /><br /><br />We know he&#39;s got it.,The Aviationist Khizr,2020-04-17T07:48:28Z,0
"Honestly, wireless charging isn&#39;t that big a deal.",Ludger Uri,2020-04-17T06:25:15Z,0
Apple iPhone SE + airpods + wireless charger is ❤️,Inevitable Gaming,2020-04-17T06:24:50Z,6
That screen makes it a fresh no.,Jino 2000,2020-04-17T08:06:28Z,0
One Plus is now not Flagship Killer it&#39;s only Flagship now😠😡😠😡,JEETU HARDASANI,2020-04-17T06:24:44Z,0
s10 is cheaper than this and way better than one+ 8,Traverse Yatra,2020-04-17T06:24:15Z,0
one plus eight equals nine,kuchesezik,2020-04-17T06:23:40Z,0
Plz compare with OnePlus 7T,PVP Nandanwar,2020-04-17T06:23:19Z,0
No Chinese from now on....NOOOO,Udit Garg,2020-04-17T06:23:18Z,1
That wallpaper!!!!!!!!,Diyansh Dave,2020-04-17T06:23:12Z,2
Yeah,Diyansh Dave,2020-04-17T07:21:13Z,1
Looking for it...but can&#39;t find it!,Roopa Achiyanda,2020-04-17T07:18:11Z,1
I would go for apple and samsung any day instead of OnePlus at this price 🤷🏻,Divyesh Dabhade,2020-04-17T06:22:58Z,0
Fast ram?? Nah man,Sakshi Chopra,2020-04-17T06:21:38Z,0
So he is basically trying to say to avoid this phone because it is really not good enough for the pricetag. I think I&#39;ll wait the pixel 4a.,Mario I/O,2020-04-17T06:21:16Z,0
You should check out the redmi k30 pro and the Poco x2,DerpyDoge,2020-04-17T06:21:10Z,0
I peep the matte black Bluetooth,Joshua Franklin,2020-04-17T06:20:58Z,0
I noticed that you&#39;re smiling more in your quarantined videos.,Deep Banerjee,2020-04-17T06:20:48Z,1
"<a href=""https://www.youtube.com/watch?v=OHP1rLwR6r8&amp;t=1m24s"">1:24</a> That&#39;s the right where Xiaomi devices stand.",Phynix72,2020-04-17T06:20:44Z,10
true from poco f1,jithu joseph,2020-04-17T18:03:31Z,0
U got it,Himanshu K,2020-04-17T17:32:09Z,0
xr is much better,Gaurang Agarwal,2020-04-17T06:20:44Z,0
I&#39;m definitely one of those people that don&#39;t care about wireless charging. I totally agree with OnePlus on that. But then also would probably ditch the glass back? I guess that&#39;s just fashion now,cammac,2020-04-17T06:20:19Z,0
Sooo you&#39;re saying (without actually saying it) you like the phone but wouldn&#39;t buy it just for the sake of 5G - so save yourself some bucks and get the identically speced OnePlus 7T 👀,Ruben Hart,2020-04-17T06:19:08Z,0
I don&#39;t get it when flagship phones were 600 dollars oneplus offerd 399 flagship killer it was 40 percent chiper but now flagships are 1000 dollars and oneplus is offering 600 dollar phones so its still 40 percent cheaper when the hardware is pricey they can&#39;t just sell this phone at cheaper prices it&#39;s just dumb to think oneplus is rasing theyr prices<br />Also they are going to release oneplus z so it can fill the gap in price around 400 dollars with a actual phone not an iphone SE,arian amirgholami,2020-04-17T06:18:44Z,0
Fuck only 100 dollars exta for pro model,Samim Khan,2020-04-17T06:18:37Z,0
Took you long enough,ReTRo VeRGiL,2020-04-17T06:18:34Z,1
Think I&#39;ll go with the 7th or the Pixel 4a instead.,Akshay Jumani,2020-04-17T06:18:31Z,0
"please don&#39;t suggest to anyone to buy apple iPhone 8 in 2020. 64GB, ugly design from the past. and the list go on and on.......",J A,2020-04-17T06:18:25Z,0
its ironic how the color is the only reason I wanna buy this phone lol,Ritwik Dhandhi,2020-04-17T06:17:08Z,0
Please review Samsung A51,Logan Fulton,2020-04-17T06:16:18Z,0
MALAYALIES LIKE ADDI BROOS,VAZHIPOKKAN - വഴിപോക്കൻ,2020-04-17T06:14:30Z,1
I mean...just buy oneplus 7 pro (or 7t),Leu Leumas4040,2020-04-17T06:13:52Z,0
Isn&#39;t the redmagic 5g a cheaper 5g phone?,AllFather Man,2020-04-17T06:13:48Z,0
please do a comparison video between Oneplus 7T and Oneplus 8..,Harshvardhan Shrikant,2020-04-17T06:13:45Z,0
<b>One Plus sends their latest smart phone to MKBHD to review</b><br /><br /><b>MKBHD:</b> <i>It is Special No More!</i><br /><br /><b>Smart Phone Fans:</b> Thank you for speaking the Truth!,Nikk,2020-04-17T06:13:09Z,213
cringe,Dragon Emperor,2020-04-17T14:01:25Z,3
LoL,Christo Abraham,2020-04-17T13:43:02Z,0
"Good thing that you&#39;re taking into account price a bit more, thanks",Sokar599,2020-04-17T06:12:55Z,0
Poco x2 review?,SAI Sanjay,2020-04-17T06:12:00Z,0
The op8 seems similar to the op7 pro,LongNightsInOffice,2020-04-17T06:11:35Z,0
you definitely need a hair cut dude.,Mohammad Fahim,2020-04-17T06:10:38Z,0
WHO: A new virus called the &quot;Coronavirus&quot; have just been detected.<br /><br />Marques: So I&#39;ve been living in quarantine for about 2 weeks now...,divyansh,2020-04-17T06:10:27Z,461
"​@Z3U5 I hear this argument all the damn time, and it&#39;s bad. COVID-19 is so much worse than Flu. The flu has a variety of strains that are either dangerous or somewhat safe. COVID-19 is more infectious. It is much more dangerous. Has absolutely no vaccine. Not expected. Can go between certain animals and humans. Has absolutely tanked our world hospitals. <br /><br />It&#39;s very fucking bad. There is a reason we have to go as far as we did for COVID-19.",Chris R,2020-04-17T13:35:08Z,1
5 weeks here,Anankin12,2020-04-17T11:39:43Z,0
"OK, that was funny XD",Blafard666,2020-04-17T07:50:36Z,1
"@Jackub N &quot;Last year 37,000 Americans died from the common flu. Nothing is shut down, life and the economy go on... Think about that.&quot; - Trump",Z3U5,2020-04-17T06:44:57Z,3
yeah that&#39;s kinda how it works,RadRobbie,2020-04-17T06:41:33Z,4
Really prefer the compactness of the 8 than the 8 Pro. The pro is too big...,Melbourne Obello,2020-04-17T06:10:22Z,0
Finally a decent video !!,Dinesh Suthar,2020-04-17T06:10:03Z,0
Looking a lil dusty no haircut lol 😝,Jeff Sanchez,2020-04-17T06:09:56Z,0
Awesome video bro...,Ravi Chavhan,2020-04-17T06:09:44Z,0
"Hi marques,  <br />I found ur videos are very helpful.. <br />Since I previously decided to buy this one plus 8..  I&#39;m quite confused now...  I feel for $699 range.. This phone is quite expensive.. I&#39;m looking for fast phone and good camera quality..  What would u suggest? should I go for new iPhone?",Mayuri Mahindrakar,2020-04-17T06:09:03Z,0
"It was funny for me when OnePlus kept calling OP8 &quot;compact&quot; during the presentation. Lol, it&#39;s nowhere near compact.",greggski,2020-04-17T06:08:29Z,39
@greggski ah that&#39;s a good point. I personally don&#39;t mind a back scanner.,Grape Juse,2020-04-17T10:54:31Z,2
@Grape Juse Actually I&#39;m fine with thicc bezels if that means there&#39;s fast and reliable fingerprint scanner on the front like in my OnePlus 5.,greggski,2020-04-17T10:10:17Z,2
@greggski and smaller bezels,Grape Juse,2020-04-17T10:02:37Z,0
"Elias Singer Yeah I know,,, I’m using my phone the same way (risky life) xD At some point my phone died on me and I bought a used iPhone 6s as a temporary replacement (64GB for 70€ lol) and it was just a great experience because of the smaller screen,,, anyways wish there would be more compact phones :( OnePlus phone with 5.5 screen and no bezels would instantly buy.",max,2020-04-17T09:59:35Z,1
Gregory B yeah sadly Sony discontinued their compact line :/,max,2020-04-17T09:49:58Z,0
What&#39;s wrong with your hair? (Lets confuse the kids from the future),Gaurav Jawla,2020-04-17T06:08:27Z,0
"He said &quot;catch you in the next one, very soon&quot;. He&#39;s already using the new iPhone 🤔",Oloruntomi Ojo,2020-04-17T06:08:10Z,629
We all know😅,Nure Razeen,2020-04-17T17:13:42Z,0
He got the coronavirus vaccine for a while now too.,Garr Trigger,2020-04-17T16:46:22Z,1
He&#39;s probably using the iPhone with Android in it for two weeks now,Marc Angelo Chiapco,2020-04-17T14:46:58Z,0
No... Apple doesn&#39;t send its product before launch,Cancer Called Human Species,2020-04-17T14:02:16Z,0
He will been using that phone for past 2 weeks,Asar Nisha,2020-04-17T10:50:32Z,0
Go review the RedMagic 5G Phone with the 144HZ Screen when you get a chance,Ravi Pappu,2020-04-17T06:07:57Z,8
So what would you recommend  Oneplus 7t or 8?<br />I think 7t has a good price to performance ratio though.,win hlaing,2020-04-17T06:07:40Z,0
When is ur poco x2 video coming ???,divij joshi,2020-04-17T06:07:40Z,0
i see why OnePlus is increasing their price...its because of Robert Downey Jr...<br />his fees for that advertisement is same as the company&#39;s turnover...,Durgesh Sharma,2020-04-17T06:07:21Z,0
Even oneplus 7t is better than oneplus 8 because both are same Ram LPDDR 4X,KRISHNA KUMAR PATHAK,2020-04-17T06:07:06Z,0
"<a href=""https://www.youtube.com/watch?v=OHP1rLwR6r8&amp;t=9m30s"">9:30</a> That&#39;s a OnePlus roast  😂😂😂",Kartik Peddinti,2020-04-17T06:06:51Z,2
Looking forward to the iPhone SE review 👍,Koshy Thomas,2020-04-17T06:06:41Z,0
Hey marques where do you stay in USA?<br />MASSACHUSETTS BOSTON?,Hopping Konkan,2020-04-17T06:06:33Z,0
the  MI 10 and MI 10 pro are far better than these ✌,RAYHAN MALLIK,2020-04-17T06:06:19Z,0
wouls love to see a comparison between 8 and the 7t,Kunal Jain,2020-04-17T06:06:08Z,0
K30 Pro will be a better buy. Xiaomi and Realme are the new flagship killer brands!,faisalleeds,2020-04-17T06:06:07Z,0
Iphone se waiting,K Lokesh,2020-04-17T06:06:04Z,0
Everyone  :  are talking about OP8<br />Me : Poco is on the way To Do Maths🤣🤣,Daily Status,2020-04-17T06:05:35Z,238
@Neo yeah I replaced my s8 battery last year but still crappy battery life,Wei,2020-04-18T01:34:25Z,0
@Drift what you on about buddy you&#39;re talking bs 😆,Ahmed Mansib,2020-04-17T17:47:33Z,0
@Drift lol I use oneplus 7 pro. I&#39;m not like you,Ahmed Mansib,2020-04-17T17:27:21Z,0
@علیIts red magic 5G is good in terms of hardware but the software is trash. And black shark  pro is promising but the price is too high. And after all ROG Phone rules when it comes to gaming phones.,Aeroen,2020-04-17T16:51:07Z,0
Wei All lithium batteries degrade over time Apple just shows you how your battery is doing others don’t,Neo,2020-04-17T16:03:29Z,0
I really love the silver edges of the Interstellar glow. Like apple every company should mess with the back but let the edges remain classic silver . That is just elegant,Azgothe Defiler,2020-04-17T06:05:04Z,5
Lol,女男つき,2020-04-17T06:05:01Z,0
how many dbrand skins have you applied? you must be an expert at this point,noodles6669,2020-04-17T06:03:37Z,0
why they added dead pixel to the top left corner T___T,Roman Yeskov,2020-04-17T06:03:23Z,0
If its like 42000 rupees then its great since OnePlus 6 was 38k,Azgothe Defiler,2020-04-17T06:03:20Z,0
Public opinion request: How would you compare this to OP7 when that came out vs OP8 now? Was 7 a better lowest-of-the-lineup phone of its generation compared to 8?,vm2aros,2020-04-17T06:02:54Z,0
R.I.P oneplus. 5T was the last phone by oneplus worthy of being called budget and flagship killer phone by oneplus. Now they are just making phones which are overpriced.,RAJAT KIROLA,2020-04-17T06:02:48Z,1
Thanks for calling out pricing mania. Can&#39;t afford a decent phone these days 😒,Karthick B,2020-04-17T06:02:35Z,0
120hz or bust,mxdiggitydom,2020-04-17T06:02:18Z,0
Smartphone companies need to realise that not everybody want a disco ball looking back on their phone,Mayur Das,2020-04-17T06:02:14Z,0
So What About <b><i>Nubia Red Magic</i></b> 5G 😒<br />Only <i>$499</i> 144Hz 12GB Inbuild cooling Fan 8K recording Snap 865 everthing in <b>OnePhone</b>,Cage Rally,2020-04-17T06:00:48Z,11
😍 true ✌️,Dinusha Jayaranga,2020-04-17T06:05:12Z,2
"What&#39;ll matter for oneplus is sales and their sales will definitely take a hit due to the price hike. A lot of loyal customers might shift to Asus or Nokia or Xiaomi because of a cheaper price tag. Secondly, due to the coronavirus, spending power all over the world will reduce and people won&#39;t buy expensive phones. This will affect a lot of premium phone brands. But oneplus will take the biggest hit because people expected for them to dish out cheaper phones.",kaushal parekh,2020-04-17T06:00:45Z,0
Dangerously close to Linus territory :DDD <br /><br />*EDIT DUE TO COMMENTS: this was just merely a funny reference from Marques. NO HATE ON LTT! (They do tremendous quality work!) Peace!,flappyurf,2020-04-17T06:00:42Z,767
"@Mariachee Bandidos problem is you&#39;re looking at the tech community sample size. The amount of nerds who own an Android is probably a lot higher than Apple&#39;s nerd base. Most people who care about these tech videos are Android users.<br /><br />In real life/on less tech savvy channels and platforms, it&#39;s different. E.g. on Twitter, you unironically see people screenshotting &quot;Twitter for Android&quot; as an insult. Hating on Android picture quality is also a meme.<br /><br />Either way, fan boys are cringy.",It's Not Time To Stop,2020-04-18T05:00:08Z,0
"@It&#39;s Not Time To Stop yes, he is dependent on it, else he wouldn&#39;t make those videos (he runs a BUSINESS he has people to pay, understandable) <br />anecdotally, &quot;apple fan boys&quot; make up less the 5% of the tech internet (especially the comment sections) and most of their activity is trying to correct outrageous claims by apple haters (aka android fanboys) they are so childish and toxic, they go on apple content (even on Apple&#39;s channel) and dislike or leave negative comments if anything positive was implied. so no, android fanboys are not as bad as... they are 95% of the problem, they are basically all of what&#39;s wrong with tech discussion on the internet.",Mariachee Bandidos,2020-04-18T04:48:20Z,0
Linus is great for entertainment. There&#39;s allot more knowledgeable channels around for actual tech reviews and stuff though.,Kareef Huggins,2020-04-17T16:59:22Z,0
"@Mariachee Bandidos I think Marques could improve by acknowledging the unofficial side of Android. APKs, custom ROMs and the like. He&#39;s too professional, but I still like him. Seems like a good guy.",It's Not Time To Stop,2020-04-17T13:27:06Z,0
"@Mariachee Bandidos thing is, Linus barely does videos on Apple. To say he&#39;s made a career out of it is a lie. Sure it gets clicks, but he&#39;s not dependent on it at all.<br /><br />I agree that others do exploit blind apple hate though. Also, android fan boys are just as bad as Apple fans these days. Makes me embarrassed when I see android fans talk about how much more RAM they have despite them probably not even owning the phone and iPhones optimising RAM well.",It's Not Time To Stop,2020-04-17T13:23:36Z,0
"Watching this from my 1+2, bought  in 2015 invite only.400 € at the time and still rock &#39;n&#39; roll... Except for the camera... Of course...",codicez,2020-04-17T06:00:41Z,0
The question everyones asking: Do we buy the Oneplus 8 or the Oneplus 7 Pro?,Eskil Stenodegard,2020-04-17T06:00:30Z,226
one plus 8 would be cheaper than 7 pro,Karan K,2020-04-18T08:54:20Z,0
@Pranshu Anand okay Mr. Showoff,aryan adarsh,2020-04-17T17:15:20Z,0
@DANIEL CHUKWUKERE same here Mi 9t Pro (same phone),Tresor,2020-04-17T16:11:48Z,0
Mi 9t Pro maeby,Tresor,2020-04-17T16:09:01Z,0
"7 Pro actually has 5G too, I have one",Icecube76,2020-04-17T15:51:56Z,0
I wonder when did the leading edge become bleeding edge? :D,Sumeet Singh,2020-04-17T06:00:00Z,0
I love the color..,Zeratul,2020-04-17T05:59:55Z,0
How come he didn&#39;t compare it to the 7t??,Raviraj Pawar,2020-04-17T05:59:48Z,0
I’m glad my 7T at 499 back in November was a huge deal. Cheaper yet better 🎉,Alessio Facincani,2020-04-17T05:59:34Z,0
"An honest and balanced review - more reviewers should be following your lead! <br /><br />The 8 seems to be an incremental update to the 7T with a faster processor, 5G, hole punch camera and a new paint job. I reckon wireless charging wouldn&#39;t have cost that much to incorporate. As for pricing, it will be interesting to see how western buyers react to the Chinese and Indian pricing. With the new iPhone just launched, one can&#39;t help but feel that the base 8 might not sell so well.",bobsta,2020-04-17T05:59:27Z,0
But still once again you will choose oneplus 8 pro as your favourite smartphone for 2020. Kinda known thing!,ganesh prasad,2020-04-17T05:58:42Z,0
"<a href=""https://www.youtube.com/watch?v=OHP1rLwR6r8&amp;t=7m46s"">7:46</a> it&#39;s not the cheapest 5g phone in the market there are other phones that are cheaper than this with the same Processor and with more features like:<br />Mi 10,Realme x50 pro,Vivo iqoo 3,Redmi k30 pro and so on.... <br />Oneplus 8 &amp; 8 pro this time is not worth buying.",AJIT GUDEKAR,2020-04-17T05:58:14Z,0
"Mi 10 is 799 euros. Significantly more expensive. The others are a bit cheaper though. The 8 definitely seems like worse value than the last year&#39;s phones, but for the features, the 8 pro is definitely decent value",Arjun Choudhry 2K18-IT-031,2020-04-17T06:59:58Z,0
"Personally I don’t mind that OnePlus is growing out of the flagship killer status in the market. As long as they don’t start pricing their phones above other major flagships, I really don’t mind paying for the flagship quality that I always wanted with the unique android skin and community that comes with their “flagship killers” of the past",Ultramoistboi,2020-04-17T05:58:11Z,0
It&#39;s overpriced and you paid enough by OnePlus that&#39;s good for you .,Akash Das,2020-04-17T05:58:10Z,0
One plus<br />2014= flagship killer<br />2020= pocket killer,vishal singh,2020-04-17T05:57:39Z,0
In my opinion one plus phone price always high. Its not fair. They should think customer&#39;s pocket. Some people like it but they did&#39;nt buy.,Gadget & Gear,2020-04-17T05:57:36Z,0
iphone SE has wireless charging!,Rohith Putha,2020-04-17T05:57:33Z,0
"Asus Rog Phone 2 Has 120 Hz refresh rate , 6000 maH battery ,air tiggers , same camera , same price , why should I go for this one plus 😊",anurag sinha,2020-04-17T05:56:57Z,1
Try realms x50 pro one of the cheapest 5g,tejus pulist,2020-04-17T05:56:32Z,0
Please Compare Oneplus 8 pro with Realme X50 pro...,Saeed hossain,2020-04-17T05:56:26Z,0
"<a href=""https://www.youtube.com/watch?v=OHP1rLwR6r8&amp;t=6m23s"">6:23</a> ... That smirk he made ... cause he already has used the iPhone SE and probably made the video ready to be released ....",BloodBrothers,2020-04-17T05:56:06Z,1
"Marques, I can clearly hear the noise behind. Maybe you have shifted the soundproof materials and all.",Nitin Kamble,2020-04-17T05:55:29Z,0
I felt as if Marques words and facial expressions didn&#39;t sync when praising the phone. <br />Looked like unwillingly saying good things .. just an opinion,Prateek Gupta,2020-04-17T05:55:12Z,1
You should have mentioned ROG Phone 2 in the &quot;buy to list&quot;. Its a great Phone for me,Saarthak Bansal,2020-04-17T05:55:06Z,0
plus airpods pro hahahahaha,zenon pereira,2020-04-17T05:54:48Z,0
<b>IPHONE SE</b> - <b>budget phone ever</b><br />.<br />.<br />.<br />.<br /><b>ONEPLUS/mi</b>  - <b>wait that&#39;s illegel</b><br /><br />waitng for se &lt;3,Nara Hitesh,2020-04-17T05:54:04Z,0
Have a look at the RealMe X50 pro with same specs may be higher than the One Plus 8 at a cheaper price point around 550usd,Avinash Mirchandani,2020-04-17T05:53:55Z,0
Love the curves on one plus 8 more than 8 pro<br />8 pro is overcurved,Kishore S,2020-04-17T05:53:55Z,0
Customers : OnePlus should add more colour <br />OnePlus : yes,Prathamesh Rivonkar,2020-04-17T05:53:23Z,0
"hey would u suggest 1+8 or 1+8 pro, i just need 90 hz screen , good camera &amp; good battery life . which phone should i choose or should i wait for 6 months for a T version . currenlty a 1+3 owner .",Krishna Prasad,2020-04-17T05:52:34Z,0
Watching a 90hz phone on a 30hz display,Iam Harssh,2020-04-17T05:52:25Z,1
So nobody noticed marques’ hairstyle? And how quarantine life has taken a toll on it? Lol,conrad K,2020-04-17T05:52:19Z,0
Plzz review redmi k30 pro ....!plzzzz,Take Boy,2020-04-17T05:52:17Z,0
"Nope, not buying this overpriced brick.",Harish Gupta,2020-04-17T05:51:46Z,0
On my Oneplus 7 pro watching this vid. And honestly i think i will stay with the Op7pro. The Op8 and Op8pro are not worth it. And The dot front camera is a big no no.<br /><br />Now if it was the Oneplus Concept together with a pop up front camera now that would have got my money.,Bojan Todorovic,2020-04-17T05:51:37Z,0
Oneplus 7t vs oneplus 8 pls!,Ananay Gupta,2020-04-17T05:51:28Z,0
¿Mi 10 pro vs Oneplus 8 pro?,miguel santos lópez,2020-04-17T05:51:24Z,0
You are simply the best reviewer,rgs vasan,2020-04-17T05:51:23Z,0
&quot;Dangerously close to Linus territory&quot; 😂😂😂😂 nice,Victor Oyeyemi,2020-04-17T05:51:05Z,1
We need iPhone SE review,Shubham Z,2020-04-17T05:50:58Z,0
"@OnePlus, please cover the low/mid end, you&#39;ll make more money.",coremaven,2020-04-17T05:50:54Z,0
Me watching this video in 6s and realising that he is differentiating a phone using refresh rate 🌚,Free Thinkers,2020-04-17T05:50:51Z,1
lol.  linus territory,Tam Nguyen,2020-04-17T05:50:46Z,0
Bullets Z video please?,Athul Sujith,2020-04-17T05:50:35Z,0
ONEPLUS : finally becomes flagship <br />APPLE: now becoming flagship killer 😮,Siddhesh Kharat,2020-04-17T05:50:27Z,0
Exactle right-one plus 8 is special no more-hugely disappointing- give wireless charging thats all i need to upgrade with iphone 11 and one plus 6 with a headphone jack which still seems better than 8,Mr Memoji,2020-04-17T05:50:02Z,0
Rather than the Apple SE or Google Pixel 3a I would like you to also compare and suggest the RealMe X50 Pro (Same Parent company as One Plus),Avinash Mirchandani,2020-04-17T05:49:38Z,0
Is it just me or has OnePlus came out with 15 phones in the last 6 months,Caleb Stimmel,2020-04-17T05:49:10Z,0
Never settle... never buy ?,Tech Tagged,2020-04-17T05:48:47Z,0
Give me one phone 📱 bro please 😢😢,ŤÂĽHÂ Omne,2020-04-17T05:48:26Z,0
Apple- Launches SE for $399 <br />.<br />OnePlus- Launches a flagship killer for $699<br />.<br /><b>2020 has been the year of opposites</b>,Hisan Kidwai,2020-04-17T05:48:00Z,0
&quot;I&#39;m using an iPhone SE 2020 for a week&quot;,Alfi Aflahal Muflih,2020-04-17T05:47:57Z,0
"<a href=""https://www.youtube.com/watch?v=OHP1rLwR6r8&amp;t=1m42s"">1:42</a> What is that woofer?",user975bg,2020-04-17T05:47:30Z,0
"Ohho OnePlus 8 arrive, now i will watch ur review in 2021 and buy then",Deepanshu,2020-04-17T05:46:52Z,0
Should i go for one plus 7t pro or one plus 8 ?,Aaron Dhanwar,2020-04-17T05:46:38Z,0
"Still waiting for a phone with:<br />- &gt;100hz<br />- fast charging + wireless charging<br />-good camera (normal and umtrawide)<br />-good battery<br />-fingerprintsensor below display<br />-bezelless display with a max size of 6&quot;, preferably 5.5&quot;<br /><br />And all of it below 1k",Lavithan,2020-04-17T05:46:12Z,0
@Xplosio i guess yeah...,Lavithan,2020-04-17T06:56:50Z,0
Sounds like the Galaxy S20 to me,Xplosio,2020-04-17T06:52:20Z,0
What about xiaomi mi 10 pro 😑,9itat,2020-04-17T05:46:12Z,0
Where is SE? WHEN its coming,Next Big Thing,2020-04-17T05:46:10Z,2
@Milele 😜 this time apple played smart didnt,Next Big Thing,2020-04-19T17:52:34Z,0
He has already got it and has been using it for the past 2 weeks,Milele,2020-04-17T14:16:06Z,1
"Still waiting for a phone with:<br />- &gt;100hz<br />- fast charging + wireless charging<br />-good camera (normal and umtrawide)<br />-good battery<br />-fingerprintsensor below display<br />-bezelless display with a max size of 6&quot;, preferably 5.5 <br /><br />And all of it below 1k",Lavithan,2020-04-17T05:45:49Z,0
"@Fapral Plus its 6.65&quot; tho :/<br />I really hate big phones, the max Id buy is 6&quot; and its getting really hard to find those :(",Lavithan,2020-04-17T06:27:19Z,0
You  r  wellcome Nubia Red Magic 5G<br />Only <i>$499</i> 144Hz 12GB Inbuild cooling Fan 8K recording Snap 865 everthing,Fapral Plus,2020-04-17T06:08:24Z,0
<b>drives an electric car</b> <b>*takes a picture of a gas station*</b> 🤣,Orlando Alvarez,2020-04-17T05:45:25Z,269
Pro gamer move,Master Yoda,2020-04-17T11:09:59Z,2
nostalgia,Marius Doru,2020-04-17T06:58:57Z,6
iPhone users: The Snapchat camera probably still trash tho lololol,Ferdz,2020-04-17T05:44:55Z,1
Its waste :),shon joseph,2020-04-17T05:44:38Z,0
"“Fast charging, INCLUDED IN THE BOX” <b>cry’s with iPhone 11</b>",Nitesh Sonar,2020-04-17T05:44:18Z,0
"<a href=""https://www.youtube.com/watch?v=OHP1rLwR6r8&amp;t=6m35s"">6:35</a><br />OnePlus team: spent hours to decide the colour<br />marques: it&#39;s a nightmare...",Durgesh Sharma,2020-04-17T05:44:06Z,1
@Aryan J 😂😂,Durgesh Sharma,2020-04-17T06:04:48Z,0
hours? more like weeks if not months lol,Aryan J,2020-04-17T05:58:30Z,0
Hmm OnePlus 8 or 7 Pro?,Marimba Maurice,2020-04-17T05:43:37Z,0
Watching MKBHD&#39;s video at SD quality is real sad! :(,Saif Shaikh,2020-04-17T05:43:12Z,0
I looks ugly,Sahitya Sharma,2020-04-17T05:43:12Z,0
Nope! Waaaay to expensive!👎,Oualid Trabelsi,2020-04-17T05:43:08Z,0
6t was $550 1½ years ago. That was already pushing the top of what I was willing to pay for a phone. Sadly it&#39;s no more OnePlus for me it seems.,Mads Feierskov,2020-04-17T05:42:54Z,1
Please make a video on poco x2,Amaan Mohammad,2020-04-17T05:42:24Z,0
Money makes you forget to mention that it has lpddr 4x Ram instead of lpddr5 Ram which is going to bottleneck sd865 for sure..,SHA WRECK,2020-04-17T05:42:04Z,0
"699$ in USA , 565$ in China , different markets different pricing",Avinash Mirchandani,2020-04-17T05:41:49Z,0
Honestly the iPhone 11 or the new SE would be a better deal imo if you don&#39;t care about 5G and want a smaller phone (of course given you would prefer iOS,Christopher Liang,2020-04-17T05:41:39Z,0
These two keyboards â re same,Sudhir Shinde,2020-04-17T05:40:50Z,0
They even chose to copy the ugly punch-hole from apple and samsung so that they can fit in... instead of keeping the ingenious pop up camera...<br />OnePlus are but a shell of their former selves.,vhyles,2020-04-17T05:40:09Z,0
