comment,id,date,num_likes
My Dream phone😪,Rahul Aj,2021-05-03T03:37:22Z,0
I want tis wallpaper can anyone provide me a link,purnaabhinav abhi,2021-04-27T11:57:54Z,0
Would it be a good purchase for 499$ in 2021?,Mohamad Wahba,2021-04-19T23:03:59Z,0
Never heard of this guy before. His net worth is 2mil!,DogofW0r,2021-04-19T15:04:32Z,0
A $2mn net worth is meh in 2021.,Tom Stevens,2021-04-19T17:25:16Z,0
"pixel 3a camera &gt; oneplus 8. Well done oneplus, next time remove completely the camera",ampalos95,2021-04-10T13:08:42Z,0
how is that a surprise? the pixel 5 camera is also better than the 1500 dollar s21,Ye,2021-04-25T16:30:10Z,0
I need a phone. Please give me a phone.,Umme Arabi,2021-04-08T18:27:36Z,0
"I bought 3 motnhs ago and its broken, I dont recommend this if you think to buy",Mehmet Yener Yilmaz,2021-04-04T13:39:12Z,0
Most underrated phone of Oneplus.,Techy Rockz,2021-03-26T09:19:33Z,0
Having a glass back without wireless charging is like using a condom that doesn&#39;t prevent pregnancy. Why even pay to have glass back if you don&#39;t have wireless charging?,Jerb Sherb,2021-03-25T01:12:00Z,1
Thats fair enough. I would rather have a plastic back if it doesnt have wireless charging.,namcicle,2021-03-29T12:45:23Z,0
Marques saying <b>fast charger included in the box</b> hits different now.,Vinayak Gupta,2021-03-23T06:10:01Z,1
Its $499 now,Jiahe Ai,2021-03-23T02:03:52Z,0
"The slippery gas steadily cry because scorpion eventually kick till a internal hawk. wealthy, robust debt",Pawit Ninnabodee,2021-03-22T18:47:45Z,0
"The disillusioned temper focally bat because cheque certainly divide towards a insidious kitten. physical, animated vegetarian",Joan McGarity,2021-03-22T17:32:17Z,0
Watching on my oneplus 8. Loving it,JJ The Ronin,2021-03-20T18:26:55Z,4
It 400+ in my Country,The -PoliteX,2021-03-15T13:22:25Z,1
"Just looked at a bifold android phone for $2000. Nice review. I ended up buying Oneplus 8 5g UW locked to Verizon. The price was half what verizon was charging. Like new condition on Amazon for $375. Proud of the savings! Solid review here. I&#39;m going to put the camera to the test. I&#39;m excited about warp charge. Coming from Essential Phone Ph-1, everything is an upgrade",Edward Tredo,2021-03-14T00:56:41Z,0
Thanks for the clip. I am returning my one plus 8 today. It&#39;s a rubbish phone.,creatives,2021-03-12T10:06:03Z,0
What&#39;s wrong with it ?,tgl cam,2021-03-20T10:54:58Z,0
"I am still using my OnePlus 6 and I still love it,  OnePlus phones are anything but rubbish! You are clearly a hater",Arnab Kar,2021-03-12T10:51:53Z,0
Anyone else hit the app drawer instead of recent apps on gesture control? It&#39;s so annoying,James Stones,2021-03-08T05:14:03Z,0
I highly doubt he can&#39;t tell the difference between 90 and 120 he sounds like such a prick saying that,art ibarra,2021-03-07T04:56:47Z,0
"<a href=""https://www.youtube.com/watch?v=OHP1rLwR6r8&amp;t=7m50s"">7:50</a> marques: Cheapest 5G phone for 700$<br />Oneplus Nord: Allow me to  introduce myself.",Alexandre Lacroix,2021-03-06T16:11:19Z,12
haha!,Ali Farag,2021-04-26T10:47:28Z,0
Anyone knows what&#39;s the version IN2010 and what&#39;s the deference with the IN2013?? Because in my country (Greece) I&#39;ve found a version of OP 8 interstellar Glow that comes with 125GB &amp; 8 Ram.(and obviously it is cheaper) but this versions does not exist in the official site and I&#39;m kinda confused about what&#39;s going on ..,Maria Pnk,2021-03-04T14:06:56Z,0
Different versions are sold in different regions,tgl cam,2021-03-20T10:55:30Z,0
"I&#39;m on this phone rn 😌 I love it, but yes, GET A CASE BECAUSE FINGERPRINTS ARE YOUR ENEMIES!",Julian Kushman,2021-02-26T19:35:21Z,1
My brother bought a One Plus 8 and he didn&#39;t know that it had WIFI 6 and when I told him that he was VERY IMPRESSED just because I heard from you! Thanks so much Marques Brownlee!,Ranveer Bhavsar,2021-02-24T21:02:59Z,1
"my family is very poor. need a mobile phone because to read online. If I study get a job, I will be able to take care of the people in my house. help me, i live in Bangladesh.",أحمد رياز أولاد,2021-02-23T04:39:09Z,0
"just bought this today for $367 , can&#39;t beat it",Ken Guidry,2021-02-18T19:25:38Z,1
A 6.2 display 4k phone with fast processor 120hz<br />Nowadays phones are tooo big <br />Could somebody please do that,Khalid Almohammed,2021-02-15T20:38:31Z,1
"The cluttered money cumulatively arrest because thistle amazingly kiss toward a shaggy dirt. hard, squalid comparison",Bill Nalder,2021-02-15T11:32:36Z,0
you have a big hand...,Adriana Bahia,2021-02-11T20:03:17Z,1
He&#39;s tall af,Marcus Meeks,2021-03-08T14:57:09Z,0
That special phone comment 🤔,M Gapps,2021-02-05T19:45:33Z,0
9 months later..... Flagship which still doesn&#39;t support 5g in Switzerland because oneplus isn&#39;t unable to release the correct firmware in order to make it happen on all three swiss carrier. Additionally sms does not work correctly so forget any banking or two steps verification as you will receive your sms 10 min late..... Swiss customer be warned!,pristavni,2021-01-26T16:55:23Z,0
"My biggest complain about the phone is the screen. Its too narrow for me wich makes it hard to type correctly + the touch near the edges of the phone are less responsive. I thought this was some issue they could fix with an update, but is seems like it&#39;s gonna be this way. This is the most annoying oneplus i&#39;ve owned, after op 5, op 6, op 7 and now 8.",Nicho Wins,2021-01-20T10:52:44Z,0
Wireless charge is useless to me,iSSA VIBEZ,2021-01-18T01:40:47Z,0
Iphones trash,iSSA VIBEZ,2021-01-18T01:38:11Z,0
Camera wise samsung is better,iSSA VIBEZ,2021-01-18T01:37:41Z,0
DO NOT BUY THIS PHONE FROM T-MOBILE,Fmbr,2021-01-14T22:54:03Z,0
i did lol,EpicVids,2021-03-11T21:37:06Z,0
Never heard of this phone I swear 😭😭😭but it looks good,Anthony,2021-01-14T20:36:07Z,0
"So what, you didn&#39;t say if it&#39;s worth it or not, A review is to say if a product is worth it or not, you didn&#39;t do that",sami houmaira,2021-01-11T16:18:28Z,0
"Bad camera, poor wifi connectivity, software issues also battery life is bad. worst experience after 6 month of usage.please don&#39;t recommend.",Avinash Varma,2021-01-08T21:18:42Z,0
"@Raghav Gupta don&#39;t know man, bad luck for me.",Avinash Varma,2021-01-22T13:24:07Z,0
Dude you have a faulty phone...🙄 Nothing has happened to mine...,Raghav Gupta,2021-01-22T13:14:46Z,1
Honestly I keep my 7 pro at Full HD instead of quad HD just to keep the 90 hrz battery drain not noticeable. Warp charge 30 is crazy to me and kiss in the box 🤷.  I&#39;m so happy I got it for$445 new.,Cornelius Smith,2021-01-05T01:22:03Z,0
When we go to heaven.<br /><br />Marques: So I’ve been in heaven for a week and you guys will love it.,Mostafa Azadegan,2021-01-04T17:18:33Z,5
You can get the 7 Pro with almost the same specs and experience with a lesser price. Really should have looked have out for OnePlus differentiating themselves...,Asad Farraj,2021-01-04T08:53:07Z,0
"Thanks for info,  got my sub bro 👍",BNE Exotics,2020-12-30T08:18:43Z,1
"Knowing how much of a joker and sarcasm masters my friends are, I can already imagine a conversation scenario. <br /><br />Friend: what phone are you using?<br /><br />Me: Oneplus 8<br /><br />Friend: 9",Imagine Wagons,2020-12-27T16:39:45Z,0
"I only like OnePlus just because of their software, it&#39;s much better than those unoptimised,buggy UI of Xiaomi,vivo,oppo,samsung",VINOD KUMAR,2020-12-24T20:33:33Z,0
If OnePlus removed that curve screen and macro camera then add a flat screen and a telephoto camera I would be great,VINOD KUMAR,2020-12-24T20:25:08Z,1
Which is the intro song?,Shaheel Mohamed,2020-12-23T15:57:25Z,0
"Please explain me, why do people need/like wireless charging, because I don&#39;t get it. With a simple wire you can use it while you are laying in a bed and etc, but with wireless it needs to sit on some device and it&#39;s slower.",theGipper,2020-12-23T13:46:50Z,1
Would you guys take this? A pixel 5? Or the older 7tpromc,Godz Gift,2020-12-22T18:24:05Z,0
"<a href=""https://www.youtube.com/watch?v=OHP1rLwR6r8&amp;t=0m38s"">0:38</a><br />Phone price starts at 699$<br /><a href=""https://www.youtube.com/watch?v=OHP1rLwR6r8&amp;t=0m52s"">0:52</a> <br />Showing apple wheels cost 699$ <br />Perfect comparison 😂😂😂",Harsha Adithya,2020-12-21T11:43:08Z,0
"I have iphone se 2020, i hope its a good phone",Juan Garcia,2020-12-20T17:38:46Z,1
"I bought  my oneplus 8 back in July, it was functioning really  well, but all of a sudden today while I was using  the screen, it went black. When I took it to the store they told that there might be a display issue which costs half the price of the phone :( truly disappointed",Lakshithan Ravikumar,2020-12-17T16:05:20Z,0
"Worst camera, battery life and wifi connectivity.",Avinash Varma,2020-12-16T19:29:37Z,0
Honorable mention to the king of the Safeway’s to transit to our sponsor -Linus,TMZ BrriingBroo,2020-12-15T06:31:11Z,0
"Another one is that, each company could have different prices in different countries. 1+s r rly expensive here. For example, 8pro has the same price that S20 Ultra has !",Moein Mirjalili,2020-12-12T08:00:08Z,0
it&#39;s pretty obvious that you are talking waaaayyyyyy to much to make the video long enough...nothing in this review that matters...moving your thumb up and down doesn&#39;t show me anything feature wise....I feel like I watched this video and didn&#39;t learn anything about this phone other than what I could have learned from reading the specs....oh and the weight comparison...it feels better...oh and you want to get blind tested...ugh...,Jamie Villa,2020-12-12T05:53:15Z,0
I want this bro this silver color in India this not available you can support me to purchased that,ak jayaganesh,2020-12-10T08:44:00Z,0
Is the pixel 3a really better than the pixel 4a when it comes to camera or overall phone quality :o ?,Niyala,2020-12-09T16:27:20Z,0
Yes,tgl cam,2021-03-20T11:00:09Z,0
No.,Awesome Airplanes 2.0,2021-01-04T14:06:37Z,0
the king?? For this price,Midhun Madhusoodhanan,2020-12-06T08:33:25Z,0
such an outdated phone already,imicca,2020-11-29T12:41:26Z,0
“It’s a smaller form factor”<br /><br /><b>laughs in iPhone 4s</b>,a plastic bag,2020-11-28T11:28:08Z,3
"Hello! I am planning in switching from an old iPhone to a OnePlus 8. I’ve read a lot about the phone and I am generally really excited to switch. However, I have noticed a couple reviews indicating new OnePlus 8 users experienced issues with sending texts, receiving texts, and calls dropping. I figured this was related to their cell carrier but many of these reviewers mentioned they had never experienced issues like this with any other phones. I did want to ask if other people have experienced this issue with their OnePlus 8? Would it be better to order the phone directly from OnePlus’ website instead of buying it in store?",Laura Montoya,2020-11-26T05:00:30Z,0
@Laura Montoya 😁,Hakimuddin Darshaal,2020-12-23T02:40:20Z,0
@Hakimuddin Darshaal oof that&#39;s sad about the software problem. I ended going for another phone but thank you for letting me know.,Laura Montoya,2020-12-22T21:36:04Z,0
No don&#39;t buy it <br />I have OnePlus 8 its very good but <br />In the software there is issue it will be solved but <br />Wait for two or three months and buy OnePlus 9 which will be a big different from OnePlus 8,Hakimuddin Darshaal,2020-12-20T07:54:06Z,0
idk man just buy it its black friday,Atomez,2020-11-28T04:48:19Z,1
"What I hate in this phone, is why they put the macro camera, it should have been a telephoto.<br />As a consumer we need. 48mp primary not more than that. 12 mp telephoto and 12 mp ultrawide.",Pranav Choudhary,2020-11-24T10:50:10Z,1
"<a href=""https://www.youtube.com/watch?v=OHP1rLwR6r8&amp;t=1m44s"">1:44</a> Strange how Marques is playing music on a phone like certain other phones... that doesn&#39;t have a headphone jack.",Fairyball,2020-11-22T06:47:53Z,0
"@Atomez oh, I missed the speaker. Fine, I won&#39;t complain about how Marques chooses to play his music.",Fairyball,2020-11-28T06:22:13Z,0
@Fairyball I meant he was playing the music on a Bluetooth speaker that u can see clearly bouncing in the background,Atomez,2020-11-28T06:18:42Z,1
"@Atomez no but I guess it doesn&#39;t matter now if a phone has a headphone jack. Sorry I keep complaining about this jack issue, MKHBD can play music if he wants.",Fairyball,2020-11-28T05:03:32Z,0
are u fucking dumb m8,Atomez,2020-11-28T04:48:57Z,1
"All of oneplus 8,Huawei p30 copied galaxy note 10 design of cameras jus change small small point of line,bt confusion",Ghonzhauri Gonzaga,2020-11-22T04:21:49Z,0
Ohhhhhhhh so smart boy,Hakimuddin Darshaal,2020-12-20T07:55:45Z,0
I love this phone,Overclock,2020-11-22T01:03:09Z,0
Me serviria si supiera ingles :(,Luis Espinoza,2020-11-17T04:36:00Z,1
&quot;Dangerously close to Linus territory&quot; :))),ciupenhauer,2020-11-14T18:52:04Z,1
Marques : I can defenitly see the difference between 90 hz and 120 hz<br /><br />Me : <b>Can&#39;t tell difference between 60 hz or 120 hz</b>,Ranting Commenter,2020-11-12T10:31:30Z,2
"@Fairyball im running at the lowest, maybe my vision is just bad coz I notice no difference except the badass battery",Ranting Commenter,2020-11-22T11:59:48Z,2
Would lowering the pixel response times allow you to tell a difference?,Fairyball,2020-11-22T06:48:52Z,0
9,Senpai Momo,2020-11-11T05:43:24Z,0
I don&#39;t get why wireless charging would be an issue.  No point to it really.,Mark Crites,2020-11-09T20:54:23Z,0
@Atomez I have tried it.  I just don&#39;t see the point.,Mark Crites,2020-11-28T19:35:37Z,0
lol for normies like u but for rich guy marques big issue,Atomez,2020-11-28T04:49:54Z,0
"I&#39;ve always had HTC smartphones, no other brand. Sadly, HTC is no longer making phones for the US. (Maybe worldwide, but 🤷🏼) My U11 has died, so I have to find not only a new phone, but a new brand. Sucks! I was searching TMobile&#39;s phone lineup and this was actually the first one after filtering/sorting. My only since the beginning problem with the U11 was the width... I have tiny hands, and holding it with one hand was always a chore, but one I was able to work around with a ring holder/stand. From first glance, this phone is a little smaller @ 72.9 vs 75.9 for the U11. However, it&#39;s a longer @ 160.2 vs 153.9 U11. I don&#39;t think the length will be an issue. If anyone has any insight on the HTC U11 comparison to this, or any current phone, please let me know. I&#39;m happy we have choices, but this many choices is a lot for my ADHD brain. lol",Dexy83,2020-11-09T18:32:32Z,0
buy 7t for tmobile only 300$ from their website oneplus,Atomez,2020-11-28T04:50:57Z,0
so it&#39;s basically a OnePlus Nord?,rez,2020-11-08T16:33:39Z,0
I will choose 1080p90 over 1440p60 anyday,azrul nizam,2020-11-07T04:46:52Z,2
In india oneplus 8 series is selling at the cheapest price in the world at about $599 and on the other hand there is apple selling its phones at the highest... 🙄,Raghav Gupta,2020-11-06T05:13:50Z,2
Colors shouldn&#39;t matter bro stfu spe s matter more,MC FatCat,2020-11-05T20:12:59Z,1
What&#39;s are you talking about?,tgl cam,2021-03-20T11:00:58Z,0
burh,Atomez,2020-11-28T04:51:27Z,0
This dude flexing his tesla,Blazefuture,2020-11-05T18:38:29Z,0
I just dont get the fact that the garbage iphone se is better phone than this,Mouha Limani,2020-11-04T11:03:41Z,0
its not tho?,Atomez,2020-11-28T04:51:46Z,0
wallpaper?,Nitin Shetye,2020-11-02T16:10:22Z,1
This old Google Drive link that Marques tweeted out in 2012 wasn&#39;t of much help either...,Fairyball,2020-11-22T07:31:11Z,0
I&#39;m drawing a blank and taking screenshots and using Google Images isn&#39;t helping...,Fairyball,2020-11-22T07:23:12Z,1
@Fairyball 1.58,Nitin Shetye,2020-11-22T06:53:28Z,0
"Wait, where?",Fairyball,2020-11-22T06:49:20Z,0
Do you know anybody that&#39;s done a review on the OnePlus 8 chatbots feature,leotheewiz,2020-11-01T21:56:23Z,0
1+ 5G is a POS !!!!!!!,Jim Carroll,2020-11-01T18:56:00Z,0
Stop obsessing about iPhone brother. The era is gone. Oneplus is the future. And also in 1000 countries except the United States.. IPhone cost a kidney when compared to oneplus. So Oneplus wins every single time.,Sunny borah,2020-10-30T09:55:20Z,0
This is wrong,tgl cam,2021-03-20T11:01:26Z,0
Just like I can see the difference between 1080 and 1440. Samsung has 1440 Apple has 1080,Steven Corbo,2020-10-27T14:10:53Z,0
Apple pro displays are actually at 1284p,tgl cam,2021-03-20T11:01:58Z,0
Watching on my OnePlus 8 😍,Dhananjay Kumar,2020-10-26T07:08:23Z,2
7tpro would still be fighting to be in someones pocket <br />1440p too,Godz Gift,2020-10-26T03:56:01Z,0
I still feel the 7 Pro has the best design out of all their phones.,Steadfast Whiplash,2020-10-24T19:57:58Z,0
Bro I have bought OnePlus 8 but I m facing volte issue. it&#39;s volte automatically disappear in a week so I have to restart my phone.because of this issue I cannot make call or recieve call but my internet is working does anyone is facing same kind of problem,Sam Gangurde,2020-10-24T18:30:42Z,0
Very big dissapointment camera and gallery app,doxor85,2020-10-23T17:54:24Z,0
Airpods pro... How can you even recommend that..,Aristocrafied,2020-10-22T12:46:55Z,0
@tgl cam You don&#39;t need to own a pair to have listened to them.. I dunno if the concept of trying out before you buy something is foreign to you but I like to know what I&#39;m buying before it disappoints me.,Aristocrafied,2021-03-20T13:17:50Z,0
"@Aristocrafied Wait, so you&#39;re saying is you don&#39;t have the AirPods pro but you&#39;re still putting your input on the sound quality.... Even though you don&#39;t have them-",tgl cam,2021-03-20T12:56:32Z,0
"@tgl cam No I have actually good headphones, wouldn&#39;t waste my money on airpods. Yes they fit in your pocket but they&#39;re also lost easily so that upside to packaging is not a pro compared to mediocre sound quality compared to similarly priced headphones. Especially when you can get some older model headphones for half the price of airpod pro&#39;s.",Aristocrafied,2021-03-20T12:49:43Z,0
@Aristocrafied my pros sound fantastic maybe you have a faulty pair,tgl cam,2021-03-20T12:03:50Z,0
@tgl cam yeah if you want to pay extra for shit sound..,Aristocrafied,2021-03-20T11:51:07Z,0
Just ordered one I live in Canada so it&#39;s really hard to very excited to see what it brings!,Lucas Almeida,2020-10-22T01:02:35Z,1
"Who cares about wireless charging?!! It’s slow and inconvenient. I couldn’t use my Nexus 5 on my wireless charger but I could with a 10 ft cord... I’m shopping around now to replace my pixel 2xl and the one+ 8, pixel 5, or Samsung a71... what do you think guys? They all have their pros and cons.",Ricky Marasigan,2020-10-21T02:11:11Z,0
"<a href=""https://www.youtube.com/watch?v=OHP1rLwR6r8&amp;t=1m54s"">1:54</a> i see that ikea pillow",Elias Korawy,2020-10-18T20:16:54Z,7
hi<br />can u please review agm x3 rugged phone,TEK REVIEW SWAHILI,2020-10-17T22:02:56Z,0
Does gcam improve the camera quality? upgrading from a pixel 3a xl,Adam Szuszkiewicz,2020-10-17T20:09:58Z,1
I have the phone but idk,EpicVids,2020-10-22T21:06:15Z,1
Okay so I just bought this.. and I’m kinda sad about what he said about the camera..What can I do to improve it?,Shubhankar Patil,2020-10-16T21:11:23Z,0
Install Gcam apk,Heythumb88,2020-10-18T07:37:14Z,0
Have 3 wireless chargers. Never used one on any phone. It&#39;s a gimmick. If the wireless charger was actually wireless and didn&#39;t require an outlet then it would serve a purpose. To me it&#39;s a waste.,Serby Waffles Tech,2020-10-16T20:38:56Z,0
what would you choose between OnePlus 7pro and OnePlus 8,Incognito,2020-10-16T10:26:59Z,0
I bought the oneplus 8 for 530€,isi_.photography,2020-10-15T15:22:19Z,2
if you have any doubt before buying a phone just watch Marques review it so it looks 20X better<br />checkout: <b>click</b>,Lawrence Pinda,2020-10-15T13:34:10Z,0
Its cheaper than iPhone 11 in india like wayyy cheaper,Udit Tewari,2020-10-14T06:58:37Z,0
Thanks for the review. And the Dbrand plug without being sponsored by it. Unless I missed something.,HATAPROOF HD,2020-10-12T21:56:57Z,0
I wish they had given that look to the pro.<br />It just looks so awesome omg!,RVIU11,2020-10-12T19:06:35Z,1
This man is so rich he has 2 Mac Pro Xdr displayed,SSRadeon 1,2020-10-12T15:04:12Z,0
Bro please help me oneplus 8 or samsung s10 which I select?,whats app status status,2020-10-12T14:11:20Z,0
"before smartphone exist,all nokia brick phone is flagship cellphone 😑",Aqil Zuraidi,2020-10-12T09:53:57Z,0
Oneplus 7T pro vs oneplus 8? which makes more sense keeping the chipset aside and 5G doesn&#39;t matter,Ninad Bolinjkar,2020-10-11T17:47:05Z,0
OP 8 bcuz bcuz there is very lil price difference if you go with base variant,Tanvir,2020-10-13T21:49:55Z,0
"Worst product, not worth at all. In short OnePlus 8 is a bug box and OnePlus doesn&#39;t give support once they get our money.<br />I have OnePlus 8 top model. Purchased in July and now every week gets one new issue.<br />1. Incoming calls issue. Not able to receive calls and person calling doesn&#39;t hear any ringing their side.<br />2. YouTube crashing.<br />3. While using Microsoft Teams auto rotate issue.<br />4. Touch issue while using WhatsApp. I have screen recording available.<br />5. Hangs in between multi tasking.<br />6. OnePlus tech support not responding at all. Chasing them on twitter and email.<br />This is the top model.. 12GB Ram and 256GB internal space. <br />Not at all reliable to buy OnePlus. <br />It&#39;s your hard earned money. Choose wisely.",PRATEEK GARG,2020-10-11T10:43:48Z,0
"I&#39;ve got that exact phone with that same interstellar back &amp; Idk what you have on your fingertips but I hardly ever see prints on mine. First time trying this company &amp; I&#39;m very happy so far. We still have an original portable bag phone in a closet. A few Nokias laying around. LG, HTC Motorola &amp; Samsung. Always seem to find some old phone somewhere. Lol. This one is very nice for my needs.",Slave To The Rhythm,2020-10-11T05:22:01Z,0
You are 110% right !!!! Peace!!,Fernando Filipe,2020-10-10T22:31:25Z,0
Everything about this phone is great but it eats through the battery a bit fast..,Dave turbo,2020-10-10T16:36:45Z,0
One plus 8 is 9<br />1+8=9,steve jobs,2020-10-10T03:27:01Z,2
It&#39;s 9 guys,steve jobs,2020-10-10T03:26:34Z,2
Awesome video MKBHD.👍🏽,Techonupnow,2020-10-08T22:56:21Z,1
"I&#39;m a OnePlus 6 owner. Going to upgrade soon. Do I go for the 8, or iPhone 12. Help",Cian Foskin,2020-10-08T19:56:26Z,0
this is how many  different screens marques has looked at.<br />↡,Noah Lazar,2020-10-08T15:35:13Z,0
Great phone but wireless charging is a deal breaker,Ujval Tanna,2020-10-08T04:02:24Z,0
My question is what phone is his main? Android or iOS?,Jose M,2020-10-08T00:25:07Z,0
"Pixel 5 is not just better, way and way better than 1 plus 8....its just a garbage",Wasi Ahmed,2020-10-06T11:47:51Z,1
I just bought this phone as an upgrade from the Pixel 3 XL and so far it&#39;s absolutely amazing. Like the only thing I can complain about is the lack of wireless charging but warp charging should work just fine.,AlphaCodexx197,2020-10-06T04:49:17Z,0
Nice brother,EpicVids,2020-10-22T21:07:14Z,1
they should provide a mkbhd intro template,Technical Vishnu,2020-10-05T12:22:39Z,1
Pramod 😂😂😂,Parth Agrawal,2020-10-05T08:09:56Z,0
Anyone know where I can download that wallpaper?,Ben,2020-10-03T12:52:22Z,2
Any one can get me that wallpaper please,Musnad B.A,2020-10-02T19:27:10Z,0
I like oneplus so much and you guy?,Khmer Song4U,2020-09-30T23:16:35Z,0
"Strange, it says IP68 on T-Mobiles spec info for it.",einsp227,2020-09-29T18:17:34Z,0
OnePlus 8T. Review video please 😀,HARI'S ART,2020-09-29T06:15:13Z,0
Which type of black back case u r having,Dhanush Gowda,2020-09-29T05:57:09Z,0
Pllzzz giveaway please 🙏🏻 please please,Prayas Ray,2020-09-27T10:27:36Z,0
What a beautiful design 🤤<br />I feel like i should exchange it with my 5T.😅,arpit soni,2020-09-25T14:53:18Z,1
I absolutely hate this phone. Their best phone will always be 7t,Pranav Choudhary,2020-09-25T07:35:36Z,1
Now what if I could get the one plus 8 at 350,Jakey June,2020-09-25T03:56:13Z,0
What&#39;s that wallpaper in the phone he&#39;s set on?,Strongflamingo,2020-09-24T19:56:58Z,0
What&#39;s the icon pack that you use on oneplus,109 SreeRam,2020-09-24T06:32:16Z,1
if you use tmobile new free line promotion you can double dip use the new line promotion to get this phone for $350 i just did it today. This phone is amazing for $350 lol,Jeremy,2020-09-22T21:22:08Z,0
Woh,Saad Shaikh,2020-09-22T11:43:12Z,0
"I embraced the love, I&#39;m now a proud owner of a OnePlus 8.",ermocrate,2020-09-21T14:35:37Z,19
"@Kristy Watkins well what i feel is buying a phone in western side of world is more cheap and easy going compared to the people like us living in the asian countries especially like in india if you buy a smart phone you need to pay tax price which intern is more than the product price sometimes , u guys get it duty free there😅 (buying i phone ,one plus ,samsung isn&#39;t really a big deal to you 🙄 i guess so ) , what i see is almost everyone from your counrtyside are attracted to apple ecosystem (i iPhone,mac book,i watch ,etc) saw many times the iPhones owned by kid to homeless person  well i dont know is 700$ a heavy money for you ?🤔",prithvi patil,2020-12-03T19:33:58Z,1
@Kristy Watkins no objections my lord i rest my case here ❤🖤!  #1+fam,prithvi patil,2020-12-03T19:28:56Z,0
