comment,id,date,num_likes
"@JOSE L PEREZ American people voted him into the white house. He still(2020) got around 49% of the vote...by Americans. Russia may have tried hard to influence them but they still voted.  Oh, and fuck off with the all caps. Thx. Be happy",ConcreteLand,2020-11-20T03:59:50Z,1
Sadly it&#39;s Trump and 70 million American nut bars,Dean Cuisine,2020-11-13T23:15:17Z,0
Trump Barcating himself in the white house doing nothing but hate!  A scared little boy who is a loser! He knows that when he is out of office he will be indicted for his crimes! The prosecutors are just waiting!,Red Threads,2020-11-13T23:15:08Z,1
"The world is still laughing at the USA, 72 millions morons voted for Trump.",stephen h,2020-11-13T23:14:22Z,1
You are so completely right. We couldn&#39;t wait to ignore him...it&#39;s bliss...Congrats from down under.,Jennifer Jacobs,2020-11-13T23:13:56Z,5
Thrump who??,Mohd Hafiz,2020-11-13T23:13:40Z,1
"No in my humble opinion people are so tired of the horrible politics! I refuse to listen to these or any other hateful debates about anyone, anywhere, and any time, for any reason what so ever!!!! I refuse to play the game! Just stopped here to tell others how this sick, tired, and boring immature political satire has sucked intelligence and impartiality and dignity from normal rational people. Are we suffering from a twisted messiah complex? Wake up!!!! Move on. Get over it! You all sound like poor losers and bad winners.",Lisa Rand,2020-11-13T23:13:21Z,1
"All these attorneys and lawyers acting for Trump must be stupid as they will not get paid. Would you give him credit for 500k , would you f..k",Keith Powell,2020-11-13T23:12:53Z,0
Time to take out IQ45 bodily....he needs to be held accountable for everything he has done against the people of this country.,MegaSickcat,2020-11-13T23:11:51Z,1
"&#39;The world&#39; has just exhaled in a deafening sigh of relief!!! At last America has woken up to what the rest of the world knew the second he came down his tacky gold-plated escalator... namely that they were heading for a national disaster iftheir broken politics elected this poisonous clown!!! <br />So yes! We are relieved.... but we&#39;re not stupid enough to think Trump&quot;s Reign of Terror is truly over until we see Joe Biden puts his hand on that Bible and swears his oath of office in front of his people and the rest of us! <br />Then, and only then, will we cheer for America and start to trust you enough to begin rebuilding the hurt and damage this dangerous cartoon villain has caused to the friendship and respect we used to have for America!  It will take time. Possibly a very long time, but hopefully this kind, softly spoken, well mannered man will be able to mend what Trump so ruthlessly and gleefully broke!  Get your house in order America, so we can start to invite you back into ours for a cup of tea, or a glass of wine,  or a glass of water!<br /> P.S. Please let Putin, Kim Jong Un and their pals know that manipulative little dictators, like the Trumps, are not invited to the victory  celebrations!!! Stay strong Joe... were on your side!!!!",Christiane Carson,2020-11-13T23:11:42Z,1
He needs to be ignored 4ever!,Traveling Pair,2020-11-13T23:11:27Z,3
"I wonder what OAN will do now that donald trumps little balls are off the menu?<br /><br />That&#39;s where the army of big breasted men and Karen&#39;s get their news now. They&#39;ve gone full anti-Fox News, absolutely hilarious.<br /><br />The republican party is going to have a hard time drumming up support on OAN, unless they are prepared to embrace Qanon baby eating reptilian overlord conspiracies.",Branjo Snow,2020-11-13T23:10:47Z,0
"<a href=""https://www.youtube.com/watch?v=dZWPJpEi0ww&amp;t=1m25s"">1:25</a> - you forgot Canada, 1st off the mark to congratulate Biden!  and also France!  (Remember the whole interior of the US was once New France?)",Pierre Vincent,2020-11-13T23:10:35Z,10
Maybe we should hope everything goes well with Joe Biden transition.and all the Republicans in government job must be treated like the criminals they are,jay williams,2020-11-13T23:10:30Z,2
Instant mood lifter.<br />Four seasons. 😆,wesley rodgers,2020-11-13T23:10:27Z,1
"Don’t worry. Trump is leaving the White House for the Big House. The bars will drive him insane as they will remind him of his A.G. Barr. Donny, don’t drop the soap.",Howard Pavane,2020-11-13T23:10:05Z,1
This is how Populism dies: Being ignored and disappearing. And the people conned by them will only have regret and complete lack of understanding how it could ever have gone so far for the rest of their life acompanied with some kind of shame but that&#39;s okay it&#39;s human. This shame helps preventing this happening again.,Aaron Okeanos,2020-11-13T23:08:42Z,0
Trump has the brain of a 5 year old.,Fat Cat,2020-11-13T23:08:35Z,1
"Grab the Drumpf and lock him up NOW, there is a fair chance that he will escape to one or another sh*thole country that will welcome him..",Hans Huisman,2020-11-13T23:08:29Z,0
I look forward to news media not being dominated by his latest controversy. I think people all over the globe have become fatigued by it. Love to my American cousins from the UK 🇬🇧,Alex Storr,2020-11-13T23:08:08Z,0
Biden already getting stuff done why Trump is crying like a baby,Thomas Pumalpa,2020-11-13T23:07:48Z,19
EXIT Stage LEFT?,Stray Cat,2020-11-13T23:07:05Z,0
donald trump who ????,Jun Rodas,2020-11-13T23:06:57Z,0
My question is...Do We The People have to Continue to  PAY for this Fool&#39;s Security after he is THROWN OUT...bc every President continues with Govermental  security once they leave office...and We Pay that tab. I Don&#39;t Want to PAY another Dime towards this Crime Family!!😷😷👎👎👎,C G S,2020-11-13T23:06:52Z,1
But of course BLOTUS came  out today and took credit for the Pfizer vaccine and hinted that he may still be in power next year. Same old crap !,John in Poughkeepsie,2020-11-13T23:06:09Z,1
Why not leave Adolf Trumpf in the old White House and just build a new modern White House?,TONY COLLYWESTON,2020-11-13T23:05:51Z,2
I guess Trump is starting to ignore the world because it&#39;s no longer fun when he&#39;s not in the spotlight anymore.,woowooNeedsFaith,2020-11-13T23:05:41Z,4
Oh I can feel the pressure release,Dylan Young,2020-11-13T23:05:29Z,1
"And it&#39;s about time you, the American media, started to do the same. I know he is your cash cow, but you need to stop feeding him.",Man Bearpig,2020-11-13T23:05:28Z,6
tRump who !,Tom Running,2020-11-13T23:05:24Z,1
"If Trump is arrested, he may not get time out of jail to be President in 2024.",Charles Ramsey,2020-11-13T23:05:15Z,23
One can only hope,deltavee2,2020-11-14T07:41:35Z,6
"Maybe other parts of the world is sick of him, but 71 million nuts thought he deserved a 2nd term! How pathetic they are!",Dee Dee Mann,2020-11-13T23:05:00Z,1
Not just that they want him a permanent president,Vampire Prince,2020-11-13T23:14:38Z,0
So if let&#39;s say Trump runs again in 2024 and wins would that be his last term or can he run again in 2028?,curbotize,2020-11-13T23:04:35Z,0
Was never licked over here buffoon,Noel Colgan,2020-11-13T23:04:20Z,0
Michigan has been doing this since 2018,Davon Reeves,2020-11-13T23:04:10Z,0
"You Dems only see what you want to be leave, but never the truth.",bigota,2020-11-13T23:03:13Z,2
Keep telling yourself that,Vampire Prince,2020-11-13T23:15:54Z,1
"He can leave the country.  Good riddance.  Hope he realizes how many people in this country despise him.  Biden&#39;s win is pretty significant in size.  And if that wasn&#39;t enough then people singing, dancing, and cheering in the streets--and one of those streets being right in front of the White House, should have driven the point home in a very humilating way.",MitziK,2020-11-13T23:03:11Z,0
"Here, this is just a thought.  Give Trump his own padded white house.  It can have a cell phone in it with a secured network so he thinks he&#39;s constantly tweeting when in fact no one can read what he&#39;s saying and uhh... Oh, give him a golf club and a ball to putt around.  That should be everything needed to keep a captive Trump under control.",BladesofElysian,2020-11-13T23:02:29Z,0
The WORLD is starting to ignore trump? GOOD!<br />This nightmare is almost over and we can get back to normal in January.,bigmike4758,2020-11-13T23:02:14Z,0
DIRTBAG DONNY was a monstrosity that the Nation wants to forget about. I never want to be reminded of him ever again,Samuel Denton,2020-11-13T23:02:11Z,6
"No, you&#39;ll be a laughing stock for a while. Almost half of your voters sided with racist, misogynist, stuck in debt, Russia loving America First Orange One.<br /><br />And more seriously: Europe has woken up to the near-dictatorship crony-state solistic loser state that the USA has proven to be. <br /><br />Maybe president Kamala will be able to change that. But there are no more credits in the bank.",CJ Mol,2020-11-13T23:01:53Z,0
Thats what people liked about him he didn&#39;t give a shit,Chris mcclure,2020-11-13T23:01:44Z,0
we are not beginning to ignore trump.  we always had :) / one guy from Sweden,ChuckyGang,2020-11-13T23:01:38Z,0
when I talk to an american I usually avoid talking about trump as you never know.   when talking to someone in europe. I default to that the person thinks that trump is an idiot!.    works 99.99% of the times :),ChuckyGang,2020-11-13T23:06:12Z,0
Is Trump the only president who lost the popular vote twice?,Bill Vogel,2020-11-13T23:01:35Z,0
"Take away his platform and he has nothing, take away his mic, he’ll shrink up and die from memory.",Marcy Jacobs,2020-11-13T23:01:09Z,1
"I do that with my dogs, when they don’t behave. Ignoring them works great.",Sabine Dalianis,2020-11-13T23:01:08Z,0
Beings deranged Donnie’s. Broke I’ll chip in on his one way ticket to anywhere.,Robert Murrell,2020-11-13T23:00:42Z,1
Centre of the sun would be a good destination.,deltavee2,2020-11-14T07:45:19Z,0
"apparently, Shi Jin Ping congratulated Biden for his win. Interesting???",william francis Collett,2020-11-13T23:00:40Z,2
"Trump in 2024:  &quot;The whole thing&#39;s rigged -- but I&#39;m running anyway and uh...where&#39;s uh, what&#39;s his name?  It&#39;s gonna be huuuge, okay, huge, some might even say, kinda small..I mean huge...and uh what am I doing here?&quot;",Koniving,2020-11-13T22:59:58Z,0
I THINK TRUMP DEFINITELY FEELS SPURIOUS....?,Tecumseh Sherman,2020-11-13T22:59:53Z,0
The trump horror show is over.,michael bailey,2020-11-13T22:59:43Z,1
"We&#39;re still concerned, but in a more empathetic way.",groovyengineer,2020-11-13T22:59:39Z,0
"Sorry, but the &quot;duck&quot; didn&#39;t deserve any respect since the beginning of his days in power, anyway.",Ad_ Zark,2020-11-13T22:59:02Z,0
The bully feels bullied.,Ryan O'Brien,2020-11-13T22:58:57Z,0
I had to really swallow my pride a little bit.  I emailed the White House and tried to appeal to his ego and vanity to concede.  That if he did that it would really make him look really good in everybody&#39;s eyes.<br />I lied through my teeth.  Other than wanting him to concede everything else was the biggest set of exaggerated compliments I have ever said to anybody.  I felt so icky even writing it but if it works then I accomplished something for President-elect Biden.<br />Gosh it feels good saying that.,Patricia Hayden,2020-11-13T22:57:51Z,0
"The Whole Entire World are Finally Able to &quot;Breathe&quot; a Sigh of Relief!!! They Really Need to take tRump, his family and administration&#39;s Passports, Seize their Finances and get busy with Bringing Charges Against Them All!! After 4 years I can Finally say again &quot;God Bless America&quot;!!! God Bless Joe, Jill and Kamala!!🙏🙏🤩🤩🇺🇸🇺🇸💖💖🇺🇸🇺🇸👍👍💛💛🎉🎊🎉🎊🎉🎊🥳🥳🥳🥳",Dreama K. Flanagan,2020-11-13T22:57:27Z,0
"I already feel like “man, wasn’t it crazy that Donald Trump was the President for 4 years? What a dumb time, what was anyone thinking back then???”",gm346553,2020-11-13T22:57:14Z,258
"@Judith Bonofiglio What?? There was a FLOTUS? Oh yeah, I kind of remember his illusive, do-nothing trophy wife who wore the jacket that said, &quot;I really don&#39;t care. Do U?&quot;.",Jan Alexander,2020-11-28T21:17:40Z,0
@newmoment You again?! You&#39;re not convincing anyone here of your BS. Biden won because most people disagree with you. Deal with it.,Jan Alexander,2020-11-28T21:12:29Z,0
@newmoment You can fill your prescription; the pharmacies are still open. Go now....,John Doe,2020-11-18T05:12:58Z,0
"@newmoment yes, he did the most in tarnishing USA name",Marmaidena,2020-11-16T07:55:41Z,1
newmoment tell me again what he did? And FLOTUS was the worst in history.,Judith Bonofiglio,2020-11-16T04:14:48Z,2
What The heck have them pack up and leave now all The entire circus that&#39;s what this whole thing has been and hope that the loss of Life begins to stop! God bless America,Rene Rodriguez,2020-11-13T22:57:10Z,2
"be quiet little donnie , the adults are trying to govern the most powerful country in the world.",don west,2020-11-13T22:57:00Z,6
"@newmoment funded by cardi b, right?",Nick Naylor,2020-11-16T02:13:24Z,0
"LOL! Prior to Trump, your adults are trying to hand over the most powerful country in the world to China.",newmoment,2020-11-15T19:06:54Z,0
"History is going to be really be unkind to him. He came in with a BAM, but he is going  out in a bim.",Joyce Headlam,2020-11-13T22:57:00Z,1
trump is preoccupied on how to amass dollars to pay for his loses. it is business for him. he is bankcrupt.,Gregg Villanueva,2020-11-13T22:56:48Z,1
"His press conference about the vaccine was very enlightening, it is a shame he did not get off his butt earlier in the week to announce, we found out here in the UK 3 days ago.",robin grogan,2020-11-13T22:56:32Z,2
"Great news. Keep in mind that 5% - 20% of the military service members are hardcore Trumpists which is a huge minority by American standards. Unfortunately, Trump has purged the higher ups of the military &amp; other departments w/yes-men who are more competent. This is good news for Trump &amp; his Republican pals. As a result, even if 5% -20% of the military service members &amp; other key departments go along w/these commands, that&#39;ll be enough for these institutions to be weakened such that they can&#39;t stand up to Trump &amp; Trump can conduct his coup d&#39;état. Plus, his militia members will be jumping on board. I don&#39;t know if his plans will work. Like David said, let&#39;s keep our eye on the ball. Don&#39;t ignore these possibilities (this is one of my main beefs w/David, here), but nonetheless, we move along anyway. We march to protect the results &amp; not allow Trump &amp; the Republicans to punish &amp; gaslight us anymore.",Cody Crouse,2020-11-13T22:56:09Z,1
You are delusional. What you are saying has effectively been said all over twitter by Biden supporters. Let&#39;s keep the focus that Biden has done zero in 47 years.Trump has achieved many things that Biden would never have done to benefit the most.<br />Biden wants men dressed as women in classrooms teaching children to hate other and sharing bathrooms with strangers is showing you are good. TRUMP PENCE 2020 🇺🇲🇺🇲🇺🇲🇺🇲👍👍👍👍 GOD BLESS AMERICA.,Nightshift,2020-11-13T22:56:00Z,0
I like ur podcast David greetings from Germany,stayingloyaltonay mencke,2020-11-13T22:55:35Z,4
I&#39;m blown away by Trumpys press conference an hour ago. This clown went on about the vaccine without once talking about the election. It was as if the election never happened. Lol.. America is a laughing stock at the moment. All because of Trumpy.,Rikhi Kang,2020-11-13T22:55:13Z,1
just grab his ear and drag him out of the office....he is shattering the image of the US on the international stage,ictfc,2020-11-13T22:55:06Z,3
I ate when god was a woman book.,WetPawet,2020-11-13T22:55:04Z,0
"Hmnn,, Well , this still stands, Back off from Palestine! , Israel , and stop your ethnical clensing of Palestines. So Israel happy not a good sign for Palestine (sad) Free Palestine. But for Trump , well Game over, mate , just deal with it. Israels regim is just happy because their best friend Trump got sacked and they tried to flirt with the new one so they can continue murdering Palestines, day out and day in.",Erika Luleå,2020-11-13T22:54:23Z,1
"David, have you read &quot;Last and First Men&quot; by Olaf Stapledon?",Andrew Rigg,2020-11-13T22:54:12Z,0
I can see more division 😬,Bexsta,2020-11-13T22:53:49Z,0
Everyone sees the irony right?,Jon,2020-11-13T22:53:34Z,0
"I agree this turd needs to go and I will not be happy till he leaves voluntary or dragged out. When Biden takes over they better give Pamela Harris a big role from the start. Because Biden may not be able to have a second turn due to age. They need to start grooming her now, to show the people she can handle the spot.",Mike Arroyo,2020-11-13T22:53:34Z,1
And that is how you stop Trump. Don&#39;t give him the attention he graves.,W-James,2020-11-13T22:53:26Z,46
"The truth is, that he didn&#39;t give the media any attention by not giving any interviews or do any public appearances for over a week.<br />Not the other way around.<br />The media just has no material to talk about, because Trump hasn&#39;t given them any.",nokia3210fuck,2020-11-16T16:15:26Z,0
W-James  Toddler Donnie well go even more insane without attention.,TheTRUTHmatters!,2020-11-14T14:12:12Z,0
"Need to ignore his idiotic  supporters, enablers and his whole  GOOFY family too",kpax45,2020-11-14T03:12:22Z,1
Being a Biden supporter and voter it&#39;s difficult having politic conversations with my mother. She&#39;s a Trump supporter who believes the voting system is a fraud and was rigged. When I show her all the evidence and explain that Trump has 0 evidence she still denies it and supports Trump. Through out these 4 years I&#39;ve discussed things involving Trump and things he&#39;s done wrong and she still supports him and denies his wrong doing. She blames the media and says they&#39;re just lying and making it up and trying to make Trump out to be this bad guy.... Unfortunately she voted for Trump to get another 4 years. I love my mother but it&#39;s heart breaking to know your loved ones can be ok with Trump getting another 4 years with everything that&#39;s happened.,Bopples,2020-11-13T22:53:21Z,0
Can&#39;t wait to not think about my neighbours the USA every single day and opening our border when you (50% of you) start taking the pandemic seriously. ✌️from 🇨🇦,muadhib001,2020-11-13T22:53:17Z,0
Hello here from Denmark 🇩🇰 same here 👍 we cooperate with Biden,grop66,2020-11-13T22:52:47Z,9
"<a href=""https://www.youtube.com/watch?v=dZWPJpEi0ww&amp;t=3m43s"">3:43</a> David: ...Unless Trump runs in 2024, but we&#39;re not even dealing with that right now<br />Me: He&#39;s in his 70&#39;s, survived COVID-19, his mental health is deteriorating, and many people will be coming for his scalp when he&#39;s out of office. Frankly, I&#39;ll be amazed if he even lives to see 2024.",Storozhevoy 75,2020-11-13T22:52:45Z,0
"Honestly, how embarrassing is this for trump? This is like a made for TV story: make fun of the other guy and you get your ass kicked 😄<br /><br />Loses the election, Fox brands him as a loser in Arizona before any other network, half of his inner circle catches covid....embarrassing as hell.",Tyrone Paulin,2020-11-13T22:52:32Z,0
"A Norwegian journalist called Trump &quot;lame Donald Duck&quot; after Biden was the presumptive winner. 😂 We are sooo ready to talk about a normal, adult POTUS! Besides, we know Biden after his eight years as Obama’s VP, and we trust him. That&#39;s refreshing. Maybe we can get a good night&#39;s sleep again. We won&#39;t have to worry about him carrying Putin&#39;s water, and we know that our American ally is in good and caring hands again. I am sure we will get along with Kamala Harris just fine. In a normal situation, I would have preferred Warren or Sanders, but for right now, Biden was the right choice. At least for Europe. Peace and quiet instead of constant chaos, and competence instead of moronic, toxic conspiracy theories and idiocy. We can hardly wait to get back to that!",Kari F,2020-11-13T22:52:20Z,1
The world has been ignoring Trump for the last 4 years. Only his mindless klansmen have been giving him any attention.,Mack Jr Bell,2020-11-13T22:52:12Z,50
"As I watch.....and listen....I truly believe that Trump is having an emotional breakdown. He is not a man who likes to lose. Listen to what his niece says about him. She should know...she grew up around him. <a href=""https://www.yahoo.com/huffpost/mary-trump-donald-trump-2024-043336729.html"">https://www.yahoo.com/huffpost/mary-trump-donald-trump-2024-043336729.html</a>",Sheila Jones,2020-11-13T22:52:08Z,1
We all knew he&#39;s gonna do it but seeing this pathetic little crybaby denying reality against everything and everyone is absolute madness...the man seriously needs professional help,Chris G,2020-11-13T22:51:57Z,5
CANADA IS VERY HAPPY TRUMP IS GOING!!!!!?,Brenda Barron,2020-11-13T22:51:56Z,3
starting ?!? are you kidding?,betabenja,2020-11-13T22:51:54Z,0
"Naturally we are, he is an irrelevance.",David Mitchell,2020-11-13T22:51:39Z,1
"Woah, conflicting evidence? You say the world is done with Trump, but in another video you said that 86% of Republicans think Biden stole the election, or certainly did not win fairly. Since Trump is the only other significant political opponent, this same evidence would be proof of the opposite, that America is not done with Trump. Might be true to say the world is done with Donald Trump, but unfortunately the US is not yet, not by a long stretch.",Marwin Steiner,2020-11-13T22:51:31Z,0
The world was done with trump 4 years ago.,Neil Shearer,2020-11-13T22:51:19Z,6
I wish people should stop giving him a platform to spew his nonsense.  Fox&#39;s PM natzi crew needs to be shutdown.  They are spreading such propagandists which is a disservice.,Nan S,2020-11-13T22:51:10Z,5
"I really think that Trump&#39;s defense team is going to try the &quot;Dementia&quot; clause.  That is if Trump will stay in this country after the holidays.  I wouldn&#39;t put it pass it, that despot, to try to leave the country.",Grace Robertson,2020-11-16T14:29:14Z,0
Do you know what would be the cherry on the cake? Russia releasing the Pee tapes!,Noblemann,2020-11-13T22:51:08Z,5
"That might spoil the frosting, don’t you think?",Sandra Shaw,2020-11-16T12:20:22Z,0
o yes please,eifion jones,2020-11-14T20:57:48Z,0
Thank you. i have just experienced a wave of gratitude and patriotism over your comments of how the world is reacting to President elect Joe Biden.  It is bringing back a warm pride that we can be respected in the world arena and our allies are so welcoming to Biden. The dark cloud is lifting.,Kathleen McGinley,2020-11-13T22:51:06Z,9
"Let the public be the mirror: Of course, we want to be some person that we have in our imagination; however, each person&#39;s language, the way that person behaves to others, is how the public sees. Yes, for many other countries, the way Trump talked and behaved, they did not respect and he became a joke.",Mustafa Mathiasen,2020-11-13T22:51:03Z,2
"With one point I disagree, the media here in Germany has covered Trump a lot, but for what a clown he is.",Tim,2020-11-13T22:50:59Z,1
"You mean, there is another country that may want him? 🤣🤣🤣🤣",Mary Anne Kain,2020-11-13T22:50:52Z,0
Trump said if he lost the election maybe he would leave the country.!!<br />Bi den    😆😅😂😁😀<br />Saw this on Facebook <br />SO effing funny,Roberto krebbers,2020-11-13T22:50:41Z,0
The world has woken up to the Faker and now know what comes out of his mouth is only Vomit. He has truly &#39;Fallen on his face&#39;.,Peter.,2020-11-13T22:50:20Z,0
Hit the road jack.🤣🤣🙏,Roxanna Bowers,2020-11-13T22:50:12Z,0
"Hi David, Good day. We have one common enemy that is Satan. Whoever serves, worship, adore  God and who stands on the side of God who is the Creator and and the Owner of the world wins the race. Let us pray  to St Michael the Archangel he will defeat all the dragons such as communism, satanism, atheism, the idolatry of islamism, freemasonry etc. The St Michael the Archangel prayer is prayed like this : St Michael the Archangel defend us in the battle, be our defense against the wickedness and snares of the devil.  May God rebuke him, we humbly pray. And do you, O prince of the heavenly host, by the power of God thrust into hell Satan and all the evil spirits who prowl throughout the world seeking the ruin of souls. Amen. God bless. David...I hope this helps.",Jean Mauro,2020-11-13T22:49:59Z,0
I love how mad all you liberals are that he is still OUR PRESIDENT OF THE UNITED STATES,Micah Ivey,2020-11-13T22:49:55Z,0
Samuel Denton if you’re talking about the lords will you definitely shouldn’t want sleepy joe in office! Talk about a white supremacist,Micah Ivey,2020-11-13T23:01:27Z,0
"<a href=""http://www.youtube.com/results?search_query=%23micah"">#Micah</a> Ivey If it&#39;s the Lord&#39;s Will come January 20,2021 he won&#39;t be our president any longer. Tired of that clown.",Samuel Denton,2020-11-13T22:58:23Z,0
Trump isn&#39;t the important guy in the room any longer.  He&#39;s more of a annoying fly.,Lee Williis,2020-11-13T22:49:50Z,0
"It’s a fair point: Here in the UK, Trump hardly featured in the news over the past four years EXCEPT when it was a slow news day and they needed a filler to show his eccentric behaviour. I suspect Biden will get more air time...",Stewart Cowley,2020-11-13T22:49:49Z,0
It&#39;s true. A lot of Trump&#39;s blunders are unknown in Belgium because the media never really bothered covering him (which ironically might have helped his image here).,Vicsor,2020-11-13T22:49:31Z,0
