comment,id,date,num_likes
"I live in Japan but am English. I’ve been having interesting chats with an older (maybe 70) Japanese guy, who I’ve started working with recently. We talked about Trump’s Corona virus first, but then he said he was worried about Biden because he is a friend of China. It seems a lot of (older) Japanese people are very wary of China and want a strong US president as an ally. A lot of them think grump is that person. <br />However, I tried to talk him around, and he suddenly said yesterday “Congratulations on Biden’s win;). He was also happy with it, because Biden has already assured Japan it will stand by its agreements, especially with respect to Okinawa. <br />In Japan, they know and are fine with Biden being president. Pity some republicans in the senate can’t be more honorable.",Trevor Jones,2020-11-14T08:50:58Z,0
Ignoring a narcissist is the worst thing that you can do to him 🤣,Mathilde Wesendonck,2020-11-14T08:50:23Z,1
Donald Dump is a joke he will always be a joke,Johnny Ortiz,2020-11-14T08:27:02Z,0
"David, thank you for all the work that you do to thoroughly inform your viewers in an intelligent and analytical manner about the issues that matter. I live in UK and endorse your comments about other countries&#39; response to the present occupant of the White House and the President-elect. Well done!",Sheila Dyson,2020-11-14T08:15:40Z,0
"You could say Trumps ratings are crashing, people just don&#39;t want to deal with him, and would rather ignore him.",Ashley Povey,2020-11-14T08:14:22Z,0
"He and his friends are just not relevant anymore, he is a joke.  And this is trump&#39;s nightmare come true.",Debra Roy,2020-11-14T08:13:02Z,0
"The world is not ignoring trump, they are laughing at the fool, he has been the laughing stock of the world from day 1 as the ignorant, uncouth liar that he is, the only countries that love him for as long as he is in power are russia and north korea as they know they can run rings round him.",TravelAddict,2020-11-14T08:01:54Z,2
"For some reason, DP uses the phrase, &quot;the corona virus&quot; instead of the specific descriptor, Covid-19. There are many, perhaps hundreds, of corona viruses; the one that concerns us now is Covid-19.",Autodidact2,2020-11-14T08:00:06Z,0
Who is this Trump that you speak of ? 🙄,fletch61,2020-11-14T07:55:51Z,0
Donald Lame Duck 😂😂,Powker The Veriest,2020-11-14T07:53:02Z,0
"Lawsuits, sub poenas and writs!<br />Oh my.<br />😋",PercivalBlakeney,2020-11-14T07:44:19Z,0
He might take his family and move to Mexico 🇲🇽 😂,kelvin foster,2020-11-14T07:34:51Z,0
The world 🌍 left him longggggggg ago and his family and side kicks .,kelvin foster,2020-11-14T07:31:36Z,1
Pakman your voice is so valuable now.  Keep us moving forward!,Justi Siempre,2020-11-14T07:31:35Z,0
"No..media in usa is vias..people in america likes him <a href=""http://www.youtube.com/results?search_query=%23trump"">#trump</a>",TLMS Taal Lemery Medical Society,2020-11-14T07:31:25Z,0
"I&#39;m sorry, Donald who?",Rabid Fanboy,2020-11-14T07:30:30Z,0
Yep!  It&#39;s time to watch West Wing again!   LOL  BIDEN/HARRIS 🎺🎺🎺☀️🎆☀️🎆☀️🎆,Justi Siempre,2020-11-14T07:30:26Z,0
"You can see Trump sycophants try to admit he lost while also trying to placate him by saying that the overall result cannot be changed by investigating voter fraud, but we need to still use all these resources to seek it out.",golden taco,2020-11-14T07:28:56Z,0
"From Australia. <br />The United States of America is not a laughing stock to the rest of the world. <br />Trump and his sycophantic mob are  the laughing stock.<br />The decent world is with the USA, not Trump.",Roger Kleemann,2020-11-14T07:25:45Z,0
t****...,Benito Butafuco,2020-11-14T07:24:53Z,0
"You are so right  David,  thank you.",Patricia Yauger,2020-11-14T07:23:45Z,0
"The World listen Trump the great man, not sleepy Joe",Van lal Peka,2020-11-14T07:23:10Z,0
"I bet he doesn&#39;t take any of his followers with him wherever he goes, but I bet they think he is, lol...crazy folk are the best entertainment!",Benito Butafuco,2020-11-14T07:22:43Z,0
45 is done. Bad loser with an an attitude. Looking forward to seeing him either fleeing the country or going to jail.,Tilmana Boeck,2020-11-14T07:13:39Z,0
Still can&#39;t believe Trump will have a presidential library.,XxSaruman82xX,2020-11-14T07:10:53Z,0
"Not only Trump, but America!.... the USA&#39;s  standing worldwide is down the shitter, after all, still 70 million think he&#39;s &quot;the man&quot; Trump is a true representation of America, sorry.",schick,2020-11-14T07:07:10Z,0
This is one of the most inspiring and deflating videos I&#39;ve seen in 4 years.  It&#39;s not over yet but I&#39;m so happy for the US right now.,Jake Bracey,2020-11-14T07:04:14Z,1
We’re just plain sick and tired of the immature clown who thinks himself the “best thing in history”.  We’d rather focus on the adult in the room.,Kidd Faith,2020-11-14T07:02:51Z,0
This just shows who&#39;s an actual adult and who pretends to be.,Absolutely Tiffany,2020-11-14T07:02:06Z,0
"i will be glad that trumps name is not mentioned as much,on news ,late night shows. ralleys,interviews,and i wish fox news would leave with trump and trump jr and his girlfrien,eric and his wife,ivanka and her husband <a href=""http://jared.so/"">jared.so</a> tired of trump,,melania and barron and the blonde daughter that gaetz has the hots for are ok ,dont have to listen to Kayleigh any more i thought sara and spicer were bad kay has such a brown nose kissing trumps arse",rodolfo ramirez,2020-11-14T07:01:16Z,0
"Correction.  The world.has been ignoring him for the better part of the last 25 years. Only YOU USA, enabled him. Keep the world out of it..",jaymtl79,2020-11-14T07:00:45Z,0
Yall be drinking the liberal coolaid. Gonna be pooping ur pants soon.,Skunk Shalayli,2020-11-14T06:53:56Z,0
Maga is a cult,WHAT YALL SCARED TO SAY TV,2020-11-14T06:51:35Z,0
"True. Did anyone watch UK PM Boris Johnson&#39;s comments on the election? That <b>has</b> to hurt if you&#39;re Trump. The world couldn&#39;t care less about <a href=""http://www.youtube.com/results?search_query=%23bunkerbabybonespurs"">#BunkerBabyBoneSpurs</a> whining about the election. They are treating him like a toddler in need of a time-out, which is <b>exactly</b> what he is.",Justin Shim,2020-11-14T06:51:33Z,0
He should be in Jail by then and he will be to old and probably wearing Depends .,Trina Marino,2020-11-14T06:43:51Z,0
Transition into normalcy! We need to stand up come together as a great nation and coordinate to become a sane member of the global community. <br /><br />We will conquer this virus and open our country again and everyone will benefit as soon as we mop up all the political toxic waste that has prevented adult dialogue and commonality amongst all Americans.,J Men,2020-11-14T06:39:26Z,0
"@<a href=""https://www.youtube.com/watch?v=dZWPJpEi0ww&amp;t=3m47s"">3:47</a> He&#39;s been threatening to leave the country a lot lately, so it appears legit when he does flee the country, to avoid prosecution.",Sic semper tyrannis,2020-11-14T06:34:42Z,0
"We were done with Trump 3 years ago after trying to deal with him rationally and diplomatically, down to giving the minimum of attention to him to mitigate all the damage, this idiot has been doing. He has been completely irrelevant at all summits, sometimes not even invited. Now we can finally stop with even the nominally necessary diplomacy. Good riddance.",Dfuher D,2020-11-14T06:32:51Z,0
"Should he decide to run again, we will rise up again and put a stop to that foolishness!",Brenda Schultz,2020-11-14T06:22:59Z,0
..... name an aircraft carrier after him ..<br />And you will quickly be laughed at by the world again..,Jason Ross,2020-11-14T06:22:16Z,0
It is going to take months for the cleaners to wash the orange makeup out of the White House. Hopefully they get hazard pay !,John Dupreez,2020-11-14T06:10:28Z,0
Joe Biden is the adult in the room and Donald Trump is the dolt in the room.,RedPhroggz,2020-11-14T06:10:16Z,0
"The Mexican Wall should be made a monument of shame about the Republican Senate and Trump. Yes, those fifty three Senators that acquitted Trump for abuse of power. The wall needs to be embedded with LED lights,  bright for eternity, glimmering more than a thousand points of light as a beacon of hope for all of South America. ~ that means for all the Trump Republican Party  lies too. Engraved on all those tall monoliths forever to commemorate the grief to America and the plight and bias to Mexicans the Republican Senate imposed upon society, and the turmoil to South American countries.  Is that anger? No: Justification? Yes.",John,2020-11-14T06:09:13Z,0
Poor old Drumpfy,Luke Chandra,2020-11-14T06:08:31Z,0
I was ready to leave the country if Trump won.,Amanda Adkins,2020-11-14T06:01:35Z,0
"Trump needs to accept defeat and stop making America an embarrassment to the world, Republican senators know that Trump is not going to win this one in the courts, Republican SENATORS need to  grow a spine and stand up to Trump so fight the fear of Trump, lets really make MAGA again and not pretend.",Daniel Diaz,2020-11-14T05:56:42Z,0
"David misunderstands one little detail about the world outside America.<br />Just because Americans elected Biden, this does not mean that America will no longer be the global laughingstock.<br />Look at what is going on in America right now. Look at how many Americans voted for a lying narcissist.<br />Look at your election system where you use an electoral college instead of total popular vote to elect the president, mind you a person who is supposed to be president for all of The United States.<br />America will remain to be the global laughingstock until enough Americans grow brains and start to behave like normal, intelligent human beings.<br />As long as Americans fail in doing the above, America will remain to be the global laughingstock.<br />America has forever lost the right to lecture anyone about democracy. The democracy in American has failed miserably and America is left looking like a complete joke and a disaster of a democracy.",TheChiefEng,2020-11-14T05:49:37Z,0
Trump is a cheat and liar. How can one deal with a President like that.... Ignoring is the only way instead of provoking him. May God bless Joe Biden and The United States of America.,Danny Bourne,2020-11-14T05:35:15Z,5
Hey dummy? You got it backwards. Joe Biden is a career corrupt politician. Joe Biden cheated his way through school. Trump is man of integrity who does what he says.,newmoment,2020-11-15T18:48:00Z,0
"We still have serious work to do! Eyes on Georgia for the Senate!<br />Georgia Senator (D) candidates  upcoming vote January 5, 2021<br /><a href=""https://electjon.com/"">https://electjon.com/</a>  Jon Ossoff <br /><a href=""https://warnockforgeorgia.com/"">https://warnockforgeorgia.com/</a>  Reverend Warnock",GODEED,2020-11-14T05:31:42Z,0
"There must be a law that can be brought in or hold a special senate meeting to bring about a &quot;no confidence&quot; vote in Trump ......................Literally thousands of Americans can be saved, simply be getting Biden&#39;s coronavirus team in NOW............. not in two months time.  Even if it only allowed laws to deal with coronavirus, let common sense rule at least once.",Garry Learmonth,2020-11-14T05:25:46Z,0
Lets ignore the noice!,Dean Casper,2020-11-14T05:22:05Z,0
"If that happened with the tensions in this country, I&#39;m pretty sure there would be another Civil War.",neht ml,2020-11-14T05:18:28Z,0
"so blinkist is 21st century Cliff notes, cool",david wright,2020-11-14T05:17:57Z,0
"They should have lock Trump up , when they tried to impeach him.,There is no way he should walk away? Trump is a Criminal along with his conspirator, may they all go to jail in due time. Those so called Holy Rollers ,wii bust Hell wide open using the name of the Lord.for their sins.",Linda Blunt,2020-11-14T05:15:16Z,0
I can not rest until Satan Trump can no longer go to Our White House it BLOWS MY MIND that they haven’t 25th him they say he walks around acting depressed WELL isn’t that a REAL reason To DO IT?????,Ann Magness,2020-11-14T05:10:57Z,0
So leave the country already.,Devon Boulden,2020-11-14T05:09:01Z,0
Newspapers are good collecting crap Ina  pets cage.,Cindy Mulvey,2020-11-14T05:07:32Z,0
Anyone seen Merlin with Sam Neil and Miranda Richardson? We need to pull a Merlin and ignore Mab and she’ll (he’ll) lose all power,Lee Sal,2020-11-14T05:01:16Z,0
"<a href=""https://www.youtube.com/watch?v=_q5kwu-1924"">https://www.youtube.com/watch?v=_q5kwu-1924</a>",Ginger Miller,2020-11-14T04:58:08Z,1
Trump for 2024?<br />Didn&#39;t know you could from prison,Chris Decavalla,2020-11-14T04:57:37Z,0
"tRump, Biden and a hippie kid are on a small plane when the pilot suddenly dies. With only 2 parachutes on board, tRump quickly grabs one and as he exits the plane he exclaims &quot;I&#39;m the only one that can save the country!&quot; After pondering the moment, Biden turns to the hippie kid and says &quot;Son, I&#39;ve been blessed with a long and fruitful life. Please, you take the other chute&quot;. To which the hippie kid says, &quot;Dude! We&#39;re all good! donnie just jumped out with my backpack!&quot;",Ginger Miller,2020-11-14T04:57:19Z,1
Are you laughing world?  Well consider the fact that there are only two countries on the earth that has enough thermo nukes to destroy every living human being on the face of the earth IF they wanted to.  One is of course Russia and the other is of course the US.  <br /><br />World remember we aka the US could kill all of you in cold blood if we or Russia wanted to. IF I were you I would take both countries very very very seriously.,Raymond Arceneaux,2020-11-14T04:51:38Z,0
Please start covering bide. Stop covering trump,Kathy Roberson,2020-11-14T04:48:14Z,0
There is a feeling of hopefulness that has been missing the past four years. I feel it in the air. A huge sigh of relief for the whole world.,goulash64,2020-11-14T04:47:47Z,26
Trump can run in 2024?! ... damn,Barnaby Wentworth,2020-11-14T04:44:22Z,0
Moving on feels wonderful sometimes...,Mr. Lumbergh,2020-11-14T04:33:36Z,0
His outfit will match his complexion,D Ryan,2020-11-14T04:32:13Z,0
This is the trump most of this country knew was there.   The Big Baby.  This is not a surprise to the majority of this country.,Rck Keller,2020-11-14T04:31:55Z,0
"4 years ago, someone put the toddler on the phone, with the rest of the world asking &quot;Can we speak to your daddy?&quot; - and now, finally, it looks like there&#39;s going to be an adult on the phone.",Tzisorey Tigerwuf,2020-11-14T04:31:05Z,1
Who?,It's Kenny Kell,2020-11-14T04:24:29Z,0
We laugh at him in Panama....yep.....little old Panama.  Just likw when we  hammered away his Trump sing off his tower.,Regina Polo,2020-11-14T04:23:58Z,0
"I love your verbage..., &#39;Adults are in the room&#39;; and then, &quot;Mind-virus&quot;, brilliant! Now, that should be the title of Trump&#39;s legacy... &quot;Mind virus&quot;! You are on point!",VEE,2020-11-14T04:22:07Z,0
A,Melodie Abson,2020-11-14T04:13:58Z,0
"Trump knows he is finished. He will never run again because his fear of losing again would completely destroy him.<br /><br />Secondly, at the press conference today, he looked like a roasted pumpkin with fungus. He didn&#39;t even bother to dye his hair. Trump really looked like a deflated balloon.",Just Human,2020-11-14T04:12:52Z,1
"This has been the best reality tv show I&#39;ve ever watched,  Tune in tomorrow and see what  happens next. Very exciting time to be alive. Thanks guys, best entertainment ever.",EJ watcher,2020-11-14T04:09:33Z,0
The corporatist won again,Eduardo Maxwell,2020-11-14T04:04:48Z,0
"Trump is the LOSER who wants to become a Winner by Cheating! But the Hammer of Justice is coming down on Trump after Jan. 21, 2021.",Roland Mousaa,2020-11-14T04:02:50Z,0
Here in Australia Trump is a laughing stock.the media make fun of him,Tammy Buckingham,2020-11-14T04:02:15Z,0
"After Biden was declared victorious, pretty sure we heard:<br /><br />&quot;Trump.exe.exe has stopped working. We&#39;re sorry. Your call could not be completed as dialed. Please leave DC, and never come back.&quot;<br /><br />Also, anyone notice that he forgot to dye his hair during his address?? Went from a Stupid Super Saiyan to a mutated El Blanco with Xtra baldness.",a g,2020-11-14T03:56:46Z,0
Trump who?,adamfilip,2020-11-14T03:55:02Z,0
Actually Russian president Vladimir Putin and Brasilian president Jair Bolsonaro also believe that Biden won by fraud.,playnochat,2020-11-14T03:52:16Z,0
The world has been ignoring the cartoon President for years.,David Chadderton,2020-11-14T03:46:55Z,12
Moonlight as militia?  White male CosPlay.,Sean Morgan,2020-11-14T03:43:19Z,0
I’m so sad about all the people who voted for him. I see it in my office every day. There are so many loyal to him it’s scary. And I’m talking about educated people that’s even scarier,Diane Guy,2020-11-14T03:43:10Z,0
Biden is the adult 🤣😂😂😂<br />Thanks man I needed a laugh today.,Elongated man Forever,2020-11-14T03:41:57Z,0
This is plain as the nose on your face :  Biden beat Trump by 5.3 million popular votes.  Biden beat Trump 306 to 232 electoral.  I don&#39;t see what the fuss is about.  He got his ass kicked.,mvtelectra,2020-11-14T03:40:24Z,0
The Chinese are relieved that the Mandarin Dynasty is finally coming to an end. Free egg rolls for all Americans!,m kay,2020-11-14T03:39:28Z,0
Nah trump lives forever in our hearts.,Elongated man Forever,2020-11-14T03:39:06Z,0
"to be honest, I&#39;m not worried about Donald Trump pulling a Grover Cleveland, he&#39;s way too unhinge, and honestly, I think once his presidency is over he will try to ignore it ever happened at least the last year of it, it might happen but right now I don&#39;t think he will do it.",Jenni Roesberry,2020-11-14T03:38:18Z,0
What about Canada?  We were the first foreign nation to officially congratulate President Elect Biden!,DJRY,2020-11-14T03:30:24Z,0
Please stop talking about the BIG CRY BABY.,TY2 S.,2020-11-14T03:30:05Z,0
I really wish our press had just ignored him too.,aclamkhidda,2020-11-14T03:29:20Z,0
"Please make sure Trump is not allowed to be a leader, not even a Boy Scout leader.",Tommy Thompson,2020-11-14T03:29:03Z,2
"What happens if faithless electors sway the election? Not an American, just genuinely interested. Thanks to anyone that would answer.",Mojhune Gabriel Manzanillo,2020-11-14T03:24:45Z,0
"Soon after George Washington entered office and courts and offices were filled, a Supreme Court justice named Chase was <br />Sent packing because he favored a Republican standing in all his cases. The president with council initiated the first impeachment  and since chase 13 Supreme Court Justices were impeached. Non of this was reviews when Amy was going through her interviews.",Bob Petrowski,2020-11-14T03:22:51Z,0
"America can change its president (at great cost} but NOT ITS POLICIES. China can&#39;t change its president, but they can change their policies.",Johan Labuschagne,2020-11-14T03:16:57Z,0
America will finally will be great again good riddance.,DERIK IRIE,2020-11-14T03:14:19Z,0
"Hey Alfred E. Neumann, I mean Pakman, why don’t you stop posting like you did the nite of the election, when it looked like Trump was going to win, until Biden’s minions started fabricating and dumping votes for him at <a href=""https://www.youtube.com/watch?v=dZWPJpEi0ww&amp;t=3m30s"">3:30</a>  in the morning ?  After they told all the observers to go home ? That was so cute, and obviously fraudulent. Now you have a second wind, eh ? It ain’t over buddy.<br /><br />Now go shill a product.",Rainman270,2020-11-14T03:13:59Z,0
"Trump: &quot;I WON THE ELECTION! I&quot;M THE PRESIDENT!&quot;<br /><br />Everyone else: Yeah, yeah, cool. By the way, have you seen Biden?",Sageoftruth,2020-11-14T03:13:40Z,97
"@Jonathan David 3 things that are certain in life. Death, taxes(which Trump might be in trouble over soon), and Trump losing the election. He lost!! Deal with it!!",A Franks85,2020-12-02T19:13:31Z,0
@Jonathan David <br />Please  tell  that  clown <br />New York state ls waiting <br />For  him on January 20 2021.,Samuel Lopez,2020-11-27T07:06:08Z,2
"@Jonathan David Only for 2 more months, thank god. I&#39;ll take &quot;sleepy joe&quot; over Trump any day. Gave Trump an honest shot for 4 years, do not approve. America agrees. It is what it is &quot;bruv&quot;",Trevor Gibson,2020-11-16T03:41:10Z,5
@Trevor Gibson Excuse me bruv but you got your party lines crossed.   &#39;sleepy joe&#39; I was referring to.  You need to read Sageoftruth&#39;s comment.  This is my response.  And Trump is still President...your President...Get used to it!!!!!,Jonathan David,2020-11-15T23:07:55Z,0
"@Jonathan David Yes, Trump is hiding in shame ignoring a pandemic. You&#39;re right.",Trevor Gibson,2020-11-15T02:50:45Z,4
"Welcome to Trump&#39;s own personal Hell, where absolutely no one give a damn about him whatsoever. It&#39;s beautiful.",Sageoftruth,2020-11-14T03:12:02Z,0
"This was airways the case.  The moment that silly chanting stopped and  people can hear themselves think, it was over. The REST of the world has been desperately waiting for this clown to leave the room so the grownups can talk sensibly.",D Art,2020-11-14T03:11:44Z,0
Trump has class...class action suit waiting  for the conman baby 😁😁😁,P C,2020-11-14T03:10:34Z,0
I have been wondering if trump will pull a Hitler and order a scorched earth policy,Kid Kootenay,2020-11-14T03:09:27Z,0
Wise guy,Abraham Obasuyi,2020-11-14T03:08:27Z,0
Viet Nam news still believe Trump somehow,Ryo Nam,2020-11-14T03:04:37Z,0
"Thankfully Biden despises England&#39;s little Trump, Bojo.",Patrick Hodgins,2020-11-14T03:03:29Z,0
Moving forward is awesome❣️,Lavelle Klobes,2020-11-14T02:57:02Z,0
"It has been days since Americans have heard from the turd and i say hallelujah. I am now sleeping without grinding my teeth, have quit having night mares and actually feel better mentally. I sure hope other Americans feel as joyous as me. Two steps forward and never look back.",Janice Sedwick,2020-11-14T02:55:00Z,0
If trump goes to prison he would have to be in like adx or some super crazy shit just for his own protection lol imagine going to supermax for tax fraud lol,beer shits,2020-11-14T02:52:28Z,0
Can see your listeners are about enlightened as you are.,Wink Dinkerson,2020-11-14T02:50:33Z,0
"He loves winning but hate losing<a href=""http://www.youtube.com/results?search_query=%23gimmiemybasketball"">#gimmiemybasketball</a>",Bob Davis,2020-11-14T02:48:26Z,0
"The only time he gets a mention here is when someone tells a joke about him...as in Putin and Trump are talking and Putin asks him what the J stands for in his name, Donald J Trump. And Trump says the J stands for genius...",Paul Hartstone,2020-11-14T02:46:16Z,0
Why do you give him any attention or air time? He is the X President ...who cares what he thinks or says?,Paul Hartstone,2020-11-14T02:42:54Z,0
Trump can&#39;t run in 2024 as be will be rotting in prison,Marc Kloosterman,2020-11-14T02:41:23Z,0
His so called network they said he might start will fail 2 like everything else he&#39;ll f it up,david arnold,2020-11-14T02:40:13Z,0
"Please stop talking about this frigging ugly, mean man... I can&#39;t stand it anymore 🤦‍♀️ stop calling his name and giving him free press. Let&#39;s scratch his name out of history.",catrionaakacat,2020-11-14T02:38:18Z,0
If Trump leaves the country we should make that day a national holiday.,Dave,2020-11-14T02:35:54Z,0
"How can TRUMP/Pumpkin Head run again in 2024, if he ends up as a convicted felon after he leaves or escorted out of the WH ??",Paul Moriarty,2020-11-14T02:35:09Z,0
"Bro‘, you rock. Loving your plane analytical instincts. So refreshing. Watching you many days during the week, love from Germany, wishing the best to U S and you. Joe",Johannes Krüger,2020-11-14T02:34:14Z,1
Get the workout and take your tweaker sons with you,Armando Salinas,2020-11-14T02:31:56Z,0
Trump wears diapers,Armando Salinas,2020-11-14T02:31:33Z,0
"Effective January 20, the US media needs to ignore Trump and not give him a platform for his stupidity.",Peter Newton,2020-11-14T02:31:33Z,0
Why is David talking about that random guy from home alone 2 he had like two seconds of screentime I think.,Elias,2020-11-14T02:30:48Z,1
This is making me so happy💕😷🇨🇦,Dawn Gardiner,2020-11-14T02:30:20Z,0
He didn&#39;t have to go down in history as a disgraced world leader. He&#39;s choosing this. It&#39;s just so unfortunate.,Dana Jones,2020-11-14T02:28:47Z,14
Ha I’ve been ignoring him for almost 4 years,ChopperBob S,2020-11-14T02:27:35Z,0
The world has been done with Trump and the Republicians for the last 4 years .  At least 74 million US voters are done with Trump&#39;s  antics.,Barbara Christiansen,2020-11-14T02:26:28Z,0
Canadian here. Yes he’s been a joke here the whole time. Our media has treated him like that. The Toronto Star kept track of his lie count actually.,tnargskoorb1,2020-11-14T02:24:48Z,21
@Anela Devine Same to you. Hopefully it’s better days ahead for all of us. You guys really are the best neighbours to us too !!,tnargskoorb1,2020-11-25T02:49:07Z,2
That&#39;s what GREAT neighbors are<br />for !<br />Have a joyous holiday season !<br />🇺🇸,Anela Devine,2020-11-25T02:01:24Z,1
"So what if Trump is out?! <br />72million of you voted for him, AGAIN!!! I think You can not be fully trusted!! Trump is such an obvious con man but somehow half of your nation can not see this!!🤨",Robot Stonka,2020-11-14T02:23:12Z,0
