comment,id,date,num_likes
"Hey, 2016, who&#39;s a CEO? Not Trump. He is merely a branding impresario.",Pequod Express,2020-11-16T19:41:45Z,1
Who?,CptCodpiece,2020-11-16T12:17:15Z,1
"Trump and the Trumpeters are essentially being looked at as toddlers throwing a tantrum in the freezer section of a grocery store. People are rolling their eyes, shaking their heads, sticking their fingers in their ears, putting on their headphones and turning on music and cranking up the volume.",Aja Christian,2020-11-16T11:44:02Z,0
"trump* is calling, Mr. President. &quot;I&#39;m not here&quot; he says.",Danny Bolman,2020-11-16T11:28:30Z,15
Doing what he does best....play golf....and then he also cheats lol,alkiebythesea,2020-11-16T15:36:12Z,2
"The problem is, the world may have to step in if he decides to start a civil war, he&#39;s already picking a fight with China and honestly right now, he should be removed from power immediately but again, his loyalist Trump cult would start something so as you can see, right now the US is in dangerous times, and that danger should worry people in other countries too.",Tsukasa Hiiragi,2020-11-16T11:27:26Z,0
"Those fake-ass cosplay idiots are not militias. They&#39;re wannabes. Comicon is over.<br />When the FBI and ATFE come after these guys we&#39;ll see who&#39;s tough.<br />The government is allowed to defend itself from exterior and internal insurgents.<br />That means the military can come in, bun your crops and smoke out your neighbors.<br />They can starve you into submission. The govt. has a storied history of winning these uprising attempts.",Baba Ganush,2020-11-16T11:13:19Z,0
Trump was never recognised in Australia. He was and still is a laughing stock. A President who cannot talk policy........a joke.,80ZX,2020-11-16T11:12:03Z,239
"@Ralph Hunt hmmm, needlessly brought about the death of  a few hundred thousand people too (and still counting) through choiceful inaction despite expert advice being available within his administration and well beyond the USA.. That much stands out to the entire world. Very sad for your great country and will go down in history.",bluebird28tl,2020-12-04T18:34:42Z,0
Ralph Hunt that’s such a untrue statement,Judy Hogan,2020-12-04T07:27:29Z,0
Strawberry Princess no we hated trump,Judy Hogan,2020-12-04T07:24:29Z,0
"Ralph, bless your heart... tRump wants to overturn a legitimate election, wants to jail his political opponents, declaring media enemy of the state and inciting his looney tune followers to commit violence. Finally his chickens are coming home to roost and karma will bite Trump in big fat ass.",Casey,2020-12-03T02:24:11Z,1
@Ralph Hunt he&#39;s a wannabe dickTator,Casey,2020-12-03T00:32:00Z,1
Trump started setting up the media as &quot;Fake&quot; so to sow doubt when they held him accountable and he needed an excuse.  He set up the idea that the election was rigged because he knew that he would lose and he needed an excuse.  He&#39;s setting up the &quot;I&#39;ll leave the country!&quot; because he&#39;s a FLIGHT RISK and needs an excuse.,Okima Wilcox,2020-11-16T10:59:51Z,6
@EllieG <br />North Korea or Russia.. Let him leave!!,Angee C.,2020-11-27T06:49:46Z,0
"lf he did flee the country, l  doubt he will get far, no other country would have him...",EllieG,2020-11-22T11:03:40Z,0
"Yes,we are Done.",Annette Grönberg,2020-11-16T10:48:12Z,0
In the UK a lot of us think he&#39;s a narcissist racist idiot - he has similarities to a nazi in my opinion...maybe an overgrown toddler version...,Naomi Sherred,2020-11-16T10:40:48Z,67
As another brit the anxiety this man gave me. The facts someone so aggressively arrogant is so highly praise by Americans has put a really bad name on Americans here...,Rob Hull,2020-11-29T03:01:31Z,1
@Ms. B. W. I have to say all the judges concerned Republicans or Democrats have dealt with his cases admirably 😊😊,Naomi Sherred,2020-11-25T03:41:21Z,1
"Agreed, Trump has Nazi characteristics. A Frontline program recently showed how Hitler bribed high ranking officials to be in cahoots. One attorney general had proof Hitler&#39;s henchmen were illegally executing Jews at Dacha. The case went to higher courts until a &quot;federal&quot; judge shut it down, locking the case with forensic evidence in a drawer. If all the courts had stood against government murders, Hitler could have been stopped. What the U.S. courts have done to Trump&#39;s bogus &quot;fraud&quot; cases is to call them out with scathing opinions like baseless, frivolous,  and highly speculative. Then judges dismissed the cases. Our courts recognized how meritless Trump&#39;s claims have been. Thankfully, our Judges could not be bought off or intimidated. Truth has prevailed!",Ms. B. W.,2020-11-25T01:57:03Z,1
@jacob harris yep lol...,Naomi Sherred,2020-11-18T09:45:35Z,1
@alabhaois sadly yes - it truly saddens me so many people have been so duped by him and support him so blindly 😔,Naomi Sherred,2020-11-18T09:45:07Z,0
Let’s start by erasing his name...........at best he’s the “ex-president”!,Mike Hutchison,2020-11-16T10:34:11Z,146
He&#39;s the squatting pResident of the White House.,Harlow Jade Mermaid,2020-11-28T21:21:22Z,0
"Let&#39;s hope this is David P.&#39;s last video abt trump. Yeah, right.",Lexicron,2020-11-25T18:25:39Z,0
"Let&#39;s make the Four Seasons Landscape Company into the Trump Presidential Library.  The porn shop next door could be part of the library, we could have a special Stormy Daniels section.",david charles,2020-11-21T01:39:33Z,0
@Tomas Viane Trump is fake news no matter what because of his lies,Dwayne Earles,2020-11-20T20:06:10Z,0
"Guess what he&#39;s going to try to run in 2024, whatever you do votes for Joe Biden, if you&#39;re not satisfied at any reason with Joe biden&#39;s service we can always elect somebody else but I think Joe Biden I think Joe Biden will be great for the United States as president",Dwayne Earles,2020-11-20T20:05:00Z,0
Good!  The creature needs to be ignored.,DeityFree Dee,2020-11-16T10:32:44Z,0
A,MrShi786,2020-11-16T10:28:06Z,0
This guy really hates Trump. You can feel the hate in his voice.,jen diamond,2020-11-16T10:11:33Z,0
"Feels to me that he’s just reporting the truth. Basically, agreeing with every logical human that the man who shall not be named will forever be known as “the Worst “leader” in world history.",Kevin Watkins,2020-11-16T14:46:01Z,0
I don&#39;t understand this guy if I was Trump I&#39;d be so embarrassing humiliated it keep on going when he already lost he&#39;s such a weasel and a sore loser Trump I hope you hear that you&#39;re a loser get out of the White House we don&#39;t want you there,Doris Goodyear,2020-11-16T10:00:01Z,0
If I knew I left him go I feel sorry for people overseas see his face and their got out of them cuz he&#39;s a nightmare,Doris Goodyear,2020-11-16T09:58:32Z,1
"The presenter of this programs is a satanic agent,Trump is good why are you bunch of evil against him.Illuminati,Globalist,Chinese,NWO,and the rest of you devils.whether you demons likes it or not,Donald J Trump is a two time president",tony okoafor,2020-11-16T09:40:17Z,0
"Unfortunately for us, nearly half the US voted for Trump. What do you do with that? To me, that is the danger",cobar53,2020-11-16T09:06:05Z,8
@Erik Van Gelder Yes indeed. As I cannot find one positive adjective to apply to Trump I cannot fathom why ANYONE would vote for him. What was the gain they saw? is what I keep asking myself. I have yet to find an answer. We have had some dud leaders too but I can usually find an attribute or two. But Trump? He has me beat,cobar53,2020-11-17T10:31:52Z,0
"Agreed.<br />As strange as it may sound, it&#39;s really not Trump we worry about.<br />Trump is too stupid to be a real danger.<br />It is however the people who voted for him. And the reason, those people voted for him. That is the real worry.<br />For that can easily lead to the election of a new version of Trump, with an IQ larger than that of a drunk strawberry, this time.",Erik Van Gelder,2020-11-16T15:05:18Z,0
Congrats to Joe Biden for winning the Presidency for the fourth time this week with recount😂😂,Top Gun,2020-11-16T09:05:46Z,27
"Half of Americans voted for him.  Calling him Nazi,corrupt or kkk helps those 70 millions love him more. Trump promotes them and vice versa they promote him. So Biden has alot to deal with. His people should stay beside him and work together. Stay strong people.",TNzi nabi,2020-11-16T08:44:39Z,0
I think big parts of the world has just adjusted to Trump the whole time. They never took him seriously,Strakkan Kolle,2020-11-16T08:43:34Z,62
Oh yes they did-- they were scared to death of him (as well they should have been) -- still are,alabhaois,2020-11-18T03:51:41Z,0
"David, you are so cute!!!",Herrick Inman,2020-11-16T08:42:34Z,0
America would be a lot more healthy if they let the World decide who is President,Ian Roger Burton,2020-11-16T08:38:47Z,11
@Ann Beth The same is true of no-longer-Great Britain,Ian Roger Burton,2020-11-16T15:52:55Z,0
The world has lost trust in the Americans too make a sensible decision,Ann Beth,2020-11-16T14:26:41Z,1
How could Trump able to get the 70m supports with his garbage ways of running the WH like his family business. He only worried for himself not the 70m,Edwin Leo,2020-11-16T08:38:44Z,0
I’ve been done with this obscene ghoul since before he moved in on the Oval Office like a bitch.,Richterdgf,2020-11-16T08:30:39Z,0
You know this &quot;the world is laughing at us&quot; is getting a bit old David......,Jesse Palmer,2020-11-16T08:29:37Z,1
@Differing Designs well I certainly  wasn&#39;t defending Trump just pointing out David is exaggerating at best.,Jesse Palmer,2020-11-16T22:24:45Z,0
"@Jesse Palmer ok, maybe “the rest of the world” is a bit of a stretch, let’s just say the vast majority of the world. And I know this because it’s very obvious, when you consider the news and opinions from outside the UnUnited States. Face it, trumpty dump is only the ‘superhero’ in the deluded minds of his followers.",Differing Designs,2020-11-16T21:25:09Z,0
@Differing Designs no it isn&#39;t. There&#39;s no way either you or David could know that. Besides &quot;the rest of the world&quot; doesn&#39;t speak with a single voice ... It&#39;s the height of arrogance to believe otherwise.,Jesse Palmer,2020-11-16T14:18:40Z,0
"May be getting ‘a bit old’, but still an entirely accurate statement. The world will finally stop laughing once trumpty dump is out of the White House, and into the ‘big house’.",Differing Designs,2020-11-16T09:23:48Z,1
"That&#39;s right, Thanksgiving is coming put him at the kiddie table where he cant bother the adults",Lance Kincaid,2020-11-16T08:20:26Z,26
@chippy 77 not to mention Pence&#39;s ineptitude on the pandemic Disgusting,Shary Galloway,2020-11-26T12:22:14Z,1
"It kills me how Pence walks around acting so holier than thou. He tries to act like he is so above the fray when he just sat back and kept mum on many important topics where he could’ve intervened and tried to help. He constantly pushed Trump’s nonsensical crap for four years. He tries to act like he has no fault. Where are his scruples??? He is supposedly religious? Yeah, right! Get real! Our God does not like what you have been doing to the American people and especially what you did to those separated children. Poor babies.",chippy 77,2020-11-24T00:55:10Z,1
"Don&#39;t ever forget the treacherous support given to Trump by Pence, McConnell and co., ....their total lack of integrity and principal exposes them too for what they are &quot;traitors&quot;",maurice crotty,2020-11-22T14:22:15Z,0
"When Trump withdrew from Obama&#39;s Trans-Pacific Partnership (TPP), which was intended to help check China&#39;s global economic expansionism, he not only broke with our Asian partners in the agreement but handed Chinese leader Xi Jinping a big win. China has a global expansion policy that its plan is projected to achieve by 2025. In comparison, Trump has essentially withdrawn from the world arena with his isolationist &quot;America First&quot; policy, leaving a political vacuum of leadership that America&#39;s adversaries are now filling. <br /><br />With the new 15-member RCEP trade pact led by China (which the United States has been locked out of), the successor to the TPP plan that Trump chose to abandon, America&#39;s position in world trade has been seriously compromised. Both Trump and decades of hard-earned American international achievements abroad are being left behind by other countries who see the Democratic model as one of instability.<br /><br />Global warming, economic problems, and the pandemic have made the world desperate for reassurance. The United States was once the gold standard of Democracy, but the current administration continues to undermine this on a daily basis. In less than four years White House and Congressional policies have managed to weaken U.S. relevance on the world stage to a frightening degree.<br /><br />With a fractured partisan party relationship, fragile economic domestic situation, social upheaval, and an exploding pandemic that the White House has chosen to turn its back on, the incoming administration will really have its hands full.",MiddlePath360,2020-11-16T07:32:53Z,1
Democrats always seem to have to clean up after the Republicans leaves America in shambles. It’s disturbingly predictable.,ManicPandaz,2020-11-16T14:29:10Z,0
"From Canada, most of us hate Drumpf, and we&#39;re glad that Man-Child lost the election.",Alb Vas,2020-11-16T07:11:11Z,245
@Sophie W Thank you!,S H,2020-12-17T16:12:08Z,0
"@Sophie W <br />I have been denouncing Trump for the past five years,  and calling him Adolph Trump.  Lol.  Ding dong the idiot is gone.",Ramon Rodriguez,2020-11-27T00:11:16Z,2
@Sophie W The only ones upset in the entire world are the Little Hitlers that voted for that orange scum.  Our problems didn&#39;t go away with Trump&#39;s loss.,Mystery Meat,2020-11-25T01:21:11Z,5
Well we&#39;re in lockdown here in England but the mood has been jubilant now that Orange Hitler&#39;s regime set morte😂✌,Sophie W,2020-11-24T22:03:31Z,12
As a Canadian i agree  he should have been ousted long ago,Heather Brown,2020-11-22T20:20:41Z,12
I wonder if Hillary is laughing to herself about how things  are turning out for Trump ? He lost at around the same numbers she had.🤔,Nico Estelle,2020-11-16T07:00:25Z,56
Com on she is having a field day,Devon Morris,2020-11-21T18:27:21Z,1
Definitely is,D. S.,2020-11-16T12:36:35Z,3
Trump Sore Sore Sore Loser. Karma is around the corner.,GLORIA GUTIERREZ,2020-11-16T12:25:49Z,6
"The media should also ignore trump, until his criminal trials and convictions occur.  If nobody covered him, he might finally realize he should take his toys and go home!!!",CJ Mac,2020-11-16T06:36:17Z,1
Love what you&#39;re doing great job,Tess Stewart,2020-11-16T06:25:14Z,0
America will remain a global laughing stock for decades - 47% of Americans voted for him! WTF? This humiliation won’t just be swept under the carpet. No one outside the US respects or fears the US now. The spell has been broken.,Mike N,2020-11-16T06:17:12Z,0
"I hope that trumps militias understand that Biden’s gang will consist of the Whole of the justice department, the U.S. Military, State and City officers. Law abiding  gun toting citizens. As more people from the trump train learn of his lies in the next two months, more will shift to the left. Just a little heads up.",Carlos P. Jr,2020-11-16T06:12:09Z,0
thanks for this video,Shimron Netia,2020-11-16T06:04:19Z,0
Funny that&#39;s all it takes .like a baby just ignore em,ashwhole666,2020-11-16T06:00:45Z,0
Then you should also. Do not give him any more air time. He is no longer relevant.,cottonware,2020-11-16T05:58:34Z,85
I agree entirely if the media give him any attention in the future it will just give him narcissistic satisfaction,Fuad Al Qahtani,2020-11-20T13:29:19Z,2
"We still have some sixty days with him in office-- you watch, he&#39;ll continue digging his heels in-- he&#39;s the most outrageous narcissist that&#39;s ever ruled as &quot;president&quot;-- he&#39;s also psychotic (a deadly combination)",alabhaois,2020-11-18T03:53:44Z,2
If he decides to leave the country all I have to say is BYE 👍👍👏👏,Laura Luffman,2020-11-16T05:58:28Z,1
No one is above the law. Trump will not rest and he will continue to tweet everyday to address his stupid followers unless he is jail for life for all the crimes he has done. Humanity will be better off without this evil creature.,Fox,2020-11-16T05:43:10Z,0
I plan on ignoring him until he goes to prison.  I want to know when that happens.  Then I never want to hear his name ever again.,Sue Jones,2020-11-16T05:21:04Z,0
So he going to milk as much as he can,Mary Swann,2020-11-16T05:13:03Z,0
I have heard and believe that he is not conceding because his followers are still sending in money to fight the election,Mary Swann,2020-11-16T05:12:16Z,0
Trump is now like a fart odor dissipating from an elevator.,Greg S,2020-11-16T04:13:38Z,2
consume an entire book? mm fiber.,Timothy Mathews,2020-11-16T04:00:27Z,0
My daughter lives in Ireland.<br />She said they were dancing in the streets there.,Gina Kay,2020-11-16T03:54:24Z,257
Thats because Biden is catholic and has roots and family in mayo.,WayneSnr,2020-12-04T01:19:17Z,0
brexit comes to mind,RAY pitts,2020-12-02T15:13:52Z,0
they are smarter then US. they must have realised how insane it was to listen someone who has...NEVER WON A POPULAR VOTE.,Logan Feeney,2020-11-29T00:34:45Z,2
@Laika24102007 “,Lucia Pudlao,2020-11-28T12:36:51Z,0
@manchesterblue2007 <br />?,Lucia Pudlao,2020-11-28T12:34:02Z,0
What a relief! Don&#39;t want to hear T. horrible voice again. He should go to Saudi Arabia.,E. G.C.,2020-11-16T03:52:25Z,0
Too good and too comfortable for him.,Sandra Shaw,2020-11-16T11:52:38Z,0
This is an unintentional comedy show 😂,A B,2020-11-16T03:51:28Z,0
"I hope the world understands that Trump was not America.  As for those 72 million people that voted for him, they voted for a compulsive liar, grifter, sexual predator who lacks any sense of morality and couldn&#39;t brainstorm his way through a fourth grade history test.  How is any of that okay for a United States president?",JJ Walter,2020-11-16T03:47:48Z,0
"I wish he would give Joe the shit he needs , and quit holding it hostage!",Monie Love,2020-11-16T03:46:59Z,0
"If the old fool leaves the U.S., that will be the best day of the year!!",Tessie O'Shea,2020-11-16T03:38:42Z,0
It was a Saturday I’ll never forget- when Biden won. Relief!!,Donna Skaggs,2020-11-16T03:35:57Z,39
"You silly young man again David, Trump is only getting started!  Corruption &amp; fraud is only just starting to come out !!Just wait until Sydney Powell gets going !!",Wesley Gordon,2020-11-16T03:35:14Z,0
Once Trump becomes a citizen I’ll take good care of him. I’ll serve my patriotic duty believe me. Some dark alley type shit for reals,Nike Dri-Fit,2020-11-16T03:34:22Z,0
I think the world was done with trump after the first season of the apprentice.,Hadwell,2020-11-16T03:32:49Z,161
@Hadwell.  I agree with you 100%.  Saudi Intelligence  went over TRump&#39;s dossier just prior to his visit.,the1trueblack god,2021-01-17T04:11:22Z,0
"@the1trueblack god I think they saw him as a tool to get what they wanted, and they knew the best way to work their new tool was to flatter him... trump loves ass kissers, and you don&#39;t have to be too smart to understand how to trick people like that.",Hadwell,2021-01-17T03:33:17Z,0
"I wonder how the Saudis feel about him now.....after all, they were the ones who gave Trump this grand reception right after he was elected.  If Trump had bent over and told them to kiss his tush, they would have.",the1trueblack god,2021-01-17T03:30:15Z,0
Never even watched that show never caught my attention,Gary Crossman,2020-12-02T16:48:39Z,1
Amen,T airdudeusa,2020-12-02T10:57:24Z,0
"Bye, Bye Bye ....Singing Justin Timberlake&#39;s classic song . He may be found out what he is really up to .",Lisa Mathis,2020-11-16T03:28:32Z,2
Biden is facing a very steep uphill climb clearing up the aftermaths of Trump&#39;s destruction of US&#39;s credibility on the world stage. The world has moved on but the US has regressed and withdrawn into its bubble under Trump&#39;s watch.,Alex T,2020-11-16T03:25:20Z,0
Kaleigh MACenany,Gary Johnson,2020-11-16T03:20:48Z,0
"“Starting” to ignore Donald Trump?<br /><br />Am I the only one that’s still wondering why you’re still yammering on about him?  I’m sorry, the guy’s history.  Terrible, shameful, embarrassing American history.<br /><br />I’m simply waiting to hear about charges.  Nothing else.",ferox Iasyx,2020-11-16T03:02:22Z,21
People should have been ignoring Trump 4 years ago. He thrives on the stage. He would have gone nuts if people didn&#39;t give him the air time he has gotten over the last years. Sane people don&#39;t want to hear about him anymore.  Sane people didn&#39;t want to hear about him before.,KC,2020-11-16T02:51:50Z,0
"There&#39;s something that people are not talking about. For Biden to win. The vote was 2× what is shown. Republicans have gerrymandering, voter suppression and straight up intimidation. Let&#39;s hope we get the all branches of government. It&#39;s time for change. Electoral college must go.",patrick davis,2020-11-16T02:49:02Z,0
"Trump Quote People Magazine 1998.”If I were to run, I’d run as a Republican. They’re the dumbest group of voters in the country. They believe anything on Fox News. I could lie and They’d still eat it up. I bet my numbers would be terrific.”",James Trif,2020-11-16T02:39:28Z,0
Finally... now let the legal system have him...,James Sabatini,2020-11-16T02:28:31Z,0
"Unfortunately, Trump tearing up the Transpacific Partnership when he first got into office was one of the WORST decisions for the future of America. <br /><br />Here’s the headlines today: “Asia forms world&#39;s biggest trade bloc, a China-backed group excluding U.S.”<br /><br /><a href=""https://www.cnbc.com/2020/11/15/asia-forms-worlds-biggest-trade-bloc-excluding-us.html"">https://www.cnbc.com/2020/11/15/asia-forms-worlds-biggest-trade-bloc-excluding-us.html</a>",Funky Fungi,2020-11-16T01:48:44Z,0
Canadian. Damn near cried (from relief) the minute it came across that Biden Won.  The World NOW has a Chance!,timothy wettlaufer,2020-11-16T00:58:00Z,1
No and considering you have made your money from this antagonistic relationship I would imagine it will go on for quite some time ...unless you chose to stop isolating the population,Philip Merewood,2020-11-16T00:56:38Z,0
Exactly. I am from and live in Spain and your video shows that you have taken your time to read and watch European media. Trump has only been material for comedians and parodies these last for years in Europe. Here in Europe people don&#39;t have time to waste paying attention to Trump&#39;s BS . There&#39;s a road ahead and a lot of work to do together with the US now that everything is going back to &quot;normal&quot; mode.,Angela Navarrete,2020-11-16T00:41:46Z,2
"Hey, Frump golfed all weekend... he’s not worried. 😆😆😆",Vicki McCalpin,2020-11-16T00:32:33Z,0
tRump just concede already!,Phyllis Strider,2020-11-16T00:23:22Z,0
"Disagree that Trump has not been covered much in Europe.<br /><br />Source, me, an Iirishman who lives in Spain, consumes news from Portugal, and is a junkie for British political news.",Joseph Sexton,2020-11-16T00:09:44Z,0
I&#39;ve been trying to ignore him for years.,Nancy Levine,2020-11-16T00:03:44Z,0
He must have been a horrible child.,michael tipton,2020-11-15T23:55:41Z,63
He still is...,rob dt,2020-12-01T15:22:31Z,0
@Ralph Hunt How he turned out as an adult.,michael tipton,2020-11-30T13:27:17Z,0
He was spoilt rotten by his father.,elizabeth shannon,2020-11-20T21:25:27Z,5
He has the brain of a 10 year old.,Anita Visram,2020-11-18T17:37:54Z,5
"At 13 his parents sent Trump to military school because of his behavior.  13 years old.  Even then Trump was unlikable and got into trouble.  And no he wasn&#39;t intelligent, he was just pig- stupid and mean. Trump parents were no prize as human beings either.",Grace Robertson,2020-11-16T13:52:42Z,12
Many people voted for tRUMP because they believed his lies. The Democatic party didn&#39;t do enough to get the truth to Americans.,Desert Dragon,2020-11-15T23:44:34Z,0
"Trump got just what he deserved for screwing over VETERANS!.....<br /><a href=""https://youtu.be/UyWdOQpKwDU"">https://youtu.be/UyWdOQpKwDU</a>",Rick,2020-11-15T23:44:30Z,0
Interesting perspective on the European press. Too bad US press did not follow the same approach.,Donald Parker,2020-11-15T23:19:33Z,0
Trump is threatening to leave the country if he lose the election? He MUST leave the country if he&#39;s losing it and he knows that.,1986 Die wilden 80ger,2020-11-15T23:12:47Z,0
"The problem for Trump is that he had no idea what he was doing when he took office so needed to be walked through it by Obama, but Biden’s already been in the WH so knows what to do.",D B,2020-11-15T22:49:21Z,1
It’s about time we ignore this toddler.,David Cochrane,2020-11-15T22:43:55Z,0
"It is sad and always inevitable. Nothing personal, Trump. You just don&#39;t have it. Blessings!",griselides martinez,2020-11-15T22:14:55Z,0
Watch the media ratings plummet after trump leaves. CANT WAIT,St1ckCraft Games,2020-11-15T22:14:33Z,0
What is sad is that those people who follow him simply won’t see the facts!  In 2016 Trump was ranting the same thing when he thought Clinton was winning... election is rigged!  He is doing it again.,Denise Beilfuss,2020-11-15T21:49:53Z,0
"&quot; I,  the COward  COn,  doesn´t  COnceede nothing &quot;  /   T-RUMP - CRIMININAL TRAITOR",Olle Lundström,2020-11-15T21:44:25Z,1
