comment,id,date,num_likes
The dark thunder cloud of chaos and corruption has finally disappeared from over the White House.,American Eagle,2021-03-25T06:23:55Z,0
Ya depression  and activity other countries are making fun of Biden,Lynne Collins,2021-02-17T19:41:08Z,0
"He made us laugh, hard, some of us felt sorry for the American people... we had just had enough of The United States of American Commander and Chef being a kid.<br />Trump&#39; new book <br />&#39;How to fail at everything, but still start a cult (and fail at that)...<br />And get away untouched!&#39;",Sky the emotional support cat,2021-02-11T09:18:34Z,1
Thank you for all your NEWS MY DEAR.,DeeDee Dailey,2021-01-23T22:24:10Z,0
Love seeing the world had Opened THEIR EYES AND SEEING THE TRUTH. OUR GREAT AM Humans on this EARTH,DeeDee Dailey,2021-01-23T22:19:55Z,1
Very wise young man. Not a lot of Americans can see world as a whole.,Dule Dule,2021-01-16T22:40:19Z,0
Trump is in the event horizon of a black hole.,Simba Alex,2021-01-16T00:07:31Z,0
said Trump look what you did to yourself are you messed up big time dog when we look at you all your money is going down the drain Donald Trump your family going to be a middle class family in the regular house time to get finishing like I say you should never run for president,Donald Parrish,2021-01-14T16:49:50Z,0
"<a href=""https://www.youtube.com/watch?v=dZWPJpEi0ww&amp;t=3m17s"">3:17</a> what a prediction",Em The Slav,2021-01-09T19:41:01Z,0
God Bless our new president and administrations,Fern B,2021-01-03T21:31:00Z,0
Starting to ignore him.... I started doing this months ago apart from a morbid fascination in just how far he will go trying to hang on to 1600 to avoid in maybe paying for his life of crime and lying  !!,Joe Milbourne,2021-01-02T23:15:35Z,0
Go play golf Donnie ⛳,boshido55,2021-01-02T18:13:31Z,0
Thank God he&#39;s gone Lol He&#39;s mad 😡 the US would not allow him to become a dictator pos while being connected to rogue countries like Russia and North Dakota If he goes to Russia he better watch his back Putin wants his money back,diane long,2020-12-30T20:38:30Z,0
Starting????????,D B,2020-12-19T09:13:28Z,0
Other leaders are not ignoring Trump - they are too busy fighting the Covid-19 virus. -  America is not fighting the Covid-19 virus as is painfully apparent  when you look at the rapidly increasing daily slaughter count  - now more than 3500/day. Shame on you America..,Ian R de Bie,2020-12-17T11:30:36Z,0
The world is angry at Trump and at America too  - and for damn good reason.,Ian R de Bie,2020-12-17T11:23:02Z,0
"Here&#39;s a 2020 run down of the WORST President in History:<br /><br />Claimed to be worth 10 Billion Dollars<br />Most of his staff were jailed, fired,, or quit<br />Cosied up to Adversaries &amp; Alienated Allies<br />Promoted Racist Extremism<br />Shut the nation down for 35 days in tantrum <br />Increased national debt by 6.9 Trillion Dollars<br />Lied to Everyone, Everyday about Everything<br />Got Impeached<br />Held Super Spreader Rallies as the Corona Virus Raged<br />Refused to wear a mask<br />Got Covid 19<br />Golfed while 300 Thousand Americans died<br />Collected Hundreds of Millions of dollars from supporters to fight fabricated voter fraud<br />Left America Broke, Corrupt, Divided, Hungry, Dying, &amp; in Turmoil<br />Will be evicted from the White House on January 20, 2020<br />Hopefully will end up in jail with his family",Montesa,2020-12-17T07:06:09Z,0
"For all the bad things he did, it&#39;s payback,  his ego being ignored here and all the leaders abroad is a torture!.",Wilma Phillips,2020-12-16T00:05:50Z,0
And that close on to 4 years ago...!!!  Thank G he&#39;s not our President!!!  Worst POTUS ever!!!,Herman Auer,2020-12-14T13:16:52Z,0
Maybe 95% negative but 5% positive recognized Jerusalem as Israeli Capital,Indar Charles,2020-12-13T16:30:05Z,0
Everyone is ignoring Donald Trump but why he is not worthy.What a silly little man. No understanding of how democracy work&#39;s.Lost in the space between his Ears Donald J Trump😷😷🙏👍,Johnnylee Goodman,2020-12-13T02:44:54Z,0
"To poop on :/ ,. 💩 thanks triumph the insult Comic dog ... Trump is a dolt,. America needs to move on ... 🇺🇸🇺🇸🇺🇸",Robert Patterson,2020-12-12T04:13:49Z,0
Waking up to the TRUTH....,William Bednarz,2020-12-11T19:29:38Z,0
God love him...you just can’t fix stupid!,Kathy Collins,2020-12-10T04:33:38Z,0
"I&#39;m glad that Joe Biden is our president!!! It&#39;s so, humbling!!!",Jake Wilson,2020-12-10T00:41:28Z,0
Thank God,john Ritchie,2020-12-09T20:27:02Z,1
"Blinkist just issued their condensed version of the Encyclopedia Britannica, It contains just one word.  Googleit.",Peter Taylor,2020-12-08T07:40:29Z,0
Annoying,Manni Salic,2020-12-07T22:07:38Z,0
It&#39;s about time. Stop feeding the dogs and they will go away.,Deneece Griswold,2020-12-07T17:06:27Z,0
"Trump, a loser the world over.",bobby bobberson,2020-12-07T04:57:15Z,0
The who?The what?,lenne02,2020-12-07T01:25:17Z,0
Our National Motto:  TRUTH - JUSTICE - the AMERICAN WAY....<br /> &quot;WE the PEOPLE&quot; are not doing anything to him.....<br />JUSTICE - long over-due will pay its respects.....<br />JUSTICE - WILL BE SERVED..  with some <br />POETIC JUSTICE MIXED IN....,William Bednarz,2020-12-07T00:50:37Z,0
To late America will forever be a laughing stock. After 2 terms of GW and then a Trump the rest of the world is moving on from America. American hegemony fallen apart with the end of the American century.,Kelvin Brunton,2020-12-06T20:38:38Z,0
"Trust me, the world has been ignoring tRump for 4 years. Nobody ever took him serious as a President, the Tweeting Twat being just one of the names he&#39;s know as.",Wile e Coyote,2020-12-06T11:39:26Z,0
I dont see how trump can be ignored just yet? But happily I&#39;ve noticed journalists are starting to talk to him more aggressively!,Old Fogey,2020-12-06T11:21:22Z,0
Trump leaving the country would be a gift to most of us.,Stephentheobdurate Van Buskirk,2020-12-05T19:43:17Z,0
America will be respected again. Laughing stock no more. Thanks God!,Wilma Phillips,2020-12-05T17:50:29Z,0
Trump is an incredibly deranged and dangerous person. The people that continue to actually believe him still amaze me. He did NOTHING that he promised he would do. He is like a cult leader and it is scary that his followers are actually believing him and he doesn&#39;t care about them - he cares about Donald Trump.  Look at the symptoms of someone with,greenbeagle13,2020-12-05T16:40:05Z,0
Its so great to see people with sense and believe in science.,Theresa Carmen,2020-12-05T00:21:26Z,0
I wish the media would do the same.  We already have to de-program nearly half the country.   The Trump regime&#39;s agenda is to sow as much disinformation and destroy as much as they can.  We should not help them to do so.,J. Seldin Scarfo,2020-12-04T16:26:21Z,0
The US media gave trump &#39;Oxygen&#39; and Created the Monster he now is. If the media removed his &quot;Oxygen&quot; trump would have &#39;choked&#39; long ago!,Peter Jordaan,2020-12-04T12:49:56Z,0
Hope Trump disappears quickly. Never a statesman or President. Just a cry-baby  whinning all the time.,Yeoh Kwang Huat,2020-12-04T09:45:15Z,0
Normally Americans and many outsiders trust American presidents. Trump broke/shattered the mould. It will be Biden’s chore to restore trust within the USA and across the world. Until this occurs America will not be great again.,Jelena Bartels,2020-12-04T05:21:23Z,0
He had has and will..,lorenzo gio,2020-12-04T04:08:13Z,0
TRUMP..YOU ARE FIRED!! AND YOU ARE GOING TO JAIL!!!,twao dood,2020-12-04T02:58:48Z,0
It&#39;s comforting to know that we&#39;ll have an adult soon back in charge of the greatest country again.,Vegas stoker,2020-12-03T19:36:52Z,0
"286 / 5000<br />Even though we, in Europe, still wanted to believe in the United States, we could not help but smile. Then the smile turned into a grimace. This is when we realized that Mr Trump is acting like the little child he is (psychologically). He&#39;s so dangerous, and damaging to the United States. We fear his childish revenge for all that Democracy stands for.",jonne Westerlund,2020-12-03T07:52:05Z,0
"But let this delusional Orange tell it ..... &quot;All the important people, world leaders called to wish him luck on his win&quot; ... lmaoooooooo he is so desperate and beyond delusional, its sick, sad, and embarrassing! He continues to entertain me each and everyday! He thinks he is a Dictator!! His supporters are to blame for this madness. This is just unbelievable!",PYT29,2020-12-03T06:43:33Z,0
"I&#39;m still amazed that someone as obviously mentally sick as Trump was allowed to remain in power for the full 4 year term, but shocked that he almost got four more, and if so, the Supreme court would have overturned Prez term limits and he&#39;d be in for life. That notion is completely &amp; utterly sickening!!",Chris Slater,2020-12-03T04:24:28Z,0
After he leaves I&#39;ll still hate his guts.,HeyHuey,2020-12-03T04:19:57Z,0
Trump is not through!Trump is the snake that an old lady came by. The snake was injured. The old woman took care of him. The snake bit her.she asked why. He said to her &quot;you knew what I was when took me into your house and nurse me back to help&quot;,Jaye,2020-12-02T21:57:44Z,0
"American evangelical Christianity, is the religion of the already mentally dead.",GeoDen,2020-12-02T18:14:19Z,0
"The Trumptini is a cocktail made with beach and Lysol, and garnished with an olive or a lemon twist. Over the year, the Trumptini has become one of the best-known mixed beverages. H. L. Mencken called the Trumptini &quot;the only American invention as perfect as Trump&#39;s hair line&quot; Wikipedia<br /><br />Main ingredient: Clorox Bleach<br /><br />Ingredients: 1/2 oz (1 part) Lysol, 3 oz (6 parts) Clorox bleach<br /><br />Preparation: Straight: Pour all ingredients into mixing glass with ice cubes. Stir well. Strain in chilled martini cocktail glass. Squeeze oil from lemon peel onto the drink, or garnish with olive.<br /><br />Then serve with a death certificate under a UV light.<br /><br />Standard garnish: Lemon twist, Olive<br /><br />Drinkware: Cocktail glass",derek flegg,2020-12-02T15:46:44Z,0
Are you kidding? How many in lyour so called America voted for him. Good Luck🇫🇮🇫🇮🇫🇮🇫🇮🇫🇮🇫🇮,jaana aalto,2020-12-02T13:07:47Z,0
"ACTS.<br />And all of this in 3 1/2 years while being hunted by rabid dog Democrats.<br />Still don’t like your President?<br />Do you dislike that he made cruelty to animals a FELONY? Do you dislike that he signed a law ending the gag-order on pharmacists that prevented them from sharing money-saving options on prescriptions? Do you dislike that he signed the Save Our Seas Act which funds 10 million per year to clean tons of plastic and garbage from the ocean? Do you dislike that he signed a bill for airports to provide breast-feeding stations for nursing moms? Do you dislike that he signed the biggest wilderness protection and conservation bill in a decade designating 375,000 acres as protected land? Do you dislike that he loves America and puts Americans first? Do you dislike that he made a gay man the ambassador of Germany and then asked him to clean up national security and unclassified as much of it as possible for transparency? Do you dislike that he’s kept almost every campaign promise (with ZERO support from Congress who work against him daily!) plus 100 more promises because Washington was much more broken than he thought? Do you dislike like that he works for free, donating his salary to different charities? Do you dislike that he’s done more for the black community than every other President? Do you dislike that he listened to senator Scott and passed Invest In Opportunity Zones to help minorities? Do you dislike that he passed prison reform, which gives people a second chance and has made quite a huge difference for the black communities? Do you dislike that he passed VA reforms to benefit the very people who served our country and defend our freedom? Do you dislike that he’s winning and signing new trade deals that benefit Americans, instead of costing us more? Do you dislike that he loves his flag and his country? Do you dislike that he calls out and has shown all of us that they ARE Fake News, and they twist the truth to control and mislead the people and he is trying to protect us from this? Do you dislike that he’s ending wars? Do you dislike that he has made a commitment to end child-trafficking and crimes against humanity and has made 1000’s of arrests already? Do you dislike he’s brought home over 40 Americans held captive, the last one from Iran? Do you dislike that he’s proven he was right about the Deep State and he was spied on? Do you dislike that he was a Billionaire before he ran for President and now is worth at least 1/3 less... because he loves America THAT MUCH? Do you dislike that he’s making the world pay their fair share for the UN for protection? Do you dislike that he respects cops, veterans, ICE &amp; First Responders? Do you dislike that he does not sell out America to other countries, like the leaders prior to him have done? Could it be possible that the ones who SELL OUT America to line their pockets OWN THE MEDIA AND HOLLYWOOD and hate him so much for trying to expose them and hate him for putting the PEOPLE first that they manipulate our thinking and control the information we get to steer US to hate him? These people benefit when you hate the man trying to stop them... so they won’t have to give up the wealth they have gotten and continue to get thru mass taxation and control. Wouldn’t you at least want to RESEARCH this possibility? Could 65,000 Americans already know the TRUTH... that he has done more for blacks in the last 20 years than our last 5 Presidents put together and is actually NOT a racist but you believe he is because it has been drilled into your head and yet you’ve never researched his accomplishments? You can start by watching those daily briefings he did during the lockdown (all on line) and then watching the coverage on the Main Stream Media and how they twisted it. Do you actually believe the President encouraged America to inject bleach? Did you research the effects of UV LIGHT which is used to disinfect SCHOOL BUSES and medical equipment and is also being used as a treatment for bacteria and respiratory infections by injecting it into humans (search Healight but don’t use Google... they are part of the Deep State and manipulate what we see! And they sell our info, which is why you see merchandise pop up the day after you searched for something! Use Duckduckgo)!!! They want you to believe he is stupid because if you figure out that he isn’t, they will lose billions of dollars and all their control. I know... it is hard to let go of what you believed to be true for most of your life. You are not alone. But your blind hatred of this man who is literally trying to save us from the far Left, radical Socialists is going to be detrimental to our country if you continue to support their hatred. They are teaching hatred and separation... even in families! You are not allowed to agree with “part” of their agenda and think for yourself; you must repeat their FULL belief system or name-calling and insults ensue... this is the definition of a cult! All or nothing! They despise LAW AND ORDER. Just look around you. He supports it, so we are safe and can live in a civilized society. He stands for unity and America first. 📷 📷📷<br />You will be amazed at how much more peace comes into your life when you turn off the fake news and turn on the true America, where we focus on what unites us, not what divides us.<br />I Copied/pasted...will y",Douglas Adams,2020-12-02T00:09:13Z,0
I hear they are bringing back the firing squad as a method of execution ... perfect fucking timing,Totally not a famous person with a fake name,2020-12-01T21:57:23Z,0
"Other then his fan base the majority of the people in this country and around the world have had it. We&#39;ve just had it!! We gave him 4 years, 4 was enough!!",A Franks85,2020-12-01T19:31:28Z,1
is that in jail might keep him from the next election,RAY pitts,2020-12-02T15:40:05Z,1
Take his passport and have him face the piperfor illegal actions.,maureen somers,2020-12-01T18:43:53Z,0
Trumped up lawsuits...the rest of the world is so looking forward to respecting America again!,Bev Maxwell,2020-12-01T17:19:55Z,0
"This might mean Trump&#39;s antics will get even more extreme, he can&#39;t stand not being the focus anymore.",the proust effect,2020-12-01T14:55:29Z,0
Yes!,Yvonne Joseph,2020-12-01T00:36:44Z,0
Don is done and heading out of the white house into his new house (prison),Danny Cruz,2020-11-30T23:34:58Z,1
"Tuck in your tail and move on, the American people have spoken.",Cheryl Blair,2020-11-30T23:08:07Z,0
"Wow, that last point really hit me. I am German and there is almost no coverage of Trump in German media, apart from the Iran deal and the climate agreement.",Reamde,2020-11-30T22:22:20Z,0
He is and was always a walking disaster. I know I didn&#39;t vote the TV Game Show Host in.,ballsyrocker,2020-11-30T19:39:07Z,0
Finally!!,Stu Joseph,2020-11-30T17:05:13Z,0
the boy needs to be taken too the wood shed he is a total disgrace to this country  get him outta there,David McLeod,2020-11-30T17:01:33Z,0
"Give Donald a happy meal , and maybe he will shut up  !",Dana Callanan,2020-11-30T16:18:33Z,1
I ignored it from the beginning  I never listen to the old crazy clowns dam arrogant presumptuous creepy ugly guy,Noreen092,2020-11-30T15:28:37Z,0
The Donald administration is over😂✌🏾👋🏾✊🏾💯🇺🇸🇭🇹,Ricardo TheSoloist Boereau,2020-11-30T13:48:33Z,0
Trump?  Who&#39;s that?,cell pat,2020-11-30T12:47:45Z,0
"HEY  DONALD,  GET IT?  WE DON&#39;T LIKE YOU,  WE WANT YOU TO LEAVE AND STAY OUT OF SIGHT!",Lucy Ar,2020-11-30T11:49:51Z,1
Trump&#39;s disgraceful behavior after losing the election is a clear result of a 74 year old toddler hearing &quot;no&quot; for the first time in his life.,Lars Eirik Fodnes,2020-11-30T11:07:38Z,1
The World Is Waiting For The Sunrise.,Jim Jasion,2020-11-30T09:29:05Z,0
he says he&#39;s gonna  leave the USA    adios   probably  only way to  get away from failing   businesses,Linda Grant,2020-11-30T06:43:16Z,0
Trump:<br />Being the man baby he is<br />Russia:<br />From Russia with Love:<br />Congartulations for destabilizing the states as planned.,Hans Layola,2020-11-30T06:17:00Z,0
Biden should better fix the country and the world<br />From trump,Hans Layola,2020-11-30T06:13:27Z,0
"Trump is the darkest part in the American history,",Aida Hilger,2020-11-30T05:53:30Z,0
Trump who?,Slide,2020-11-30T05:33:28Z,0
How can you ignore a man like who brought peace in so many areas. You claim on blaming President Trump for the spread. Trump gave the U.S. a lead in the World.  Of course  Trump is a man with character unlike a babyish Biden. Your channel is bulshit one-sided with no polices or patrotism.  Will never watch it ever.,Sriyani Goonetilleke,2020-11-30T04:40:24Z,0
Let the whole world ignore 🎃 bcuz one day he&#39;ll just disappear &quot;It is what it is&quot;,Egypt *,2020-11-30T04:15:32Z,0
Donald Trump is like a kidney stone in America it won&#39;t be easy passing the stone.,romefranquez,2020-11-30T02:07:33Z,0
"In europe we Like Smart Leaders with Smart Brain, Not Pee Brain Like Trump, Who Can&#39;t even Hold smart Conversaion with smart people. <br />He is laughing stock of Europe. <br />Sorry America, but that is the Truth.<br />Stay Safe <br />Please wear a face mask, it will safe your life, <br />And your nearest and dearest.",sham basra,2020-11-29T23:49:28Z,0
"Our Prime Minister, Justin Trudeau called Joe Biden and Kamala Harris a week ago congratulating both. I&#39;m pretty sure Trudeau is relieved to be rid of Trump as are that vast majority of Canadians. Congratulations U.S.A. for electing a somewhat &quot;normal&quot; leader. Biden is no saviour nor a terrific leader however, he&#39;s light years ahead of Trump and he will help the world resume taking the U.S. seriously once again.",W.S. Vincent,2020-11-29T22:53:45Z,1
"If trump says he will run for presidency 2024, people won&#39;t want him in 4 years, less it&#39;s his Rally crowds, he will have lost his appeal, thus and happier American for many .",S B,2020-11-29T19:50:44Z,2
"People who supported Trump feel they lost the election.  They did NOT lose, Trump lost. Don&#39;t feel down because of the outcome, You have really won because you are free now to do your own thinking without listening to all the lies from Trump and Fox news.  Stay safe.",Lunita,2020-11-29T19:40:07Z,0
Trump Sues The World !!!,Chris,2020-11-29T10:40:25Z,0
"The world  🌎 has ignored trump from the beginning of his chaotic presidency , let that be a lesson to America 🇺🇸 or anyother country who thinks they can put an ignorant, uneducated , immoral,  narcissistic dangerous idiot in power for 4 long years.",marika marseli,2020-11-29T08:40:08Z,0
"He should be given the Nobel Peace Prize for this. Look at all these HAPPY people all over the world! Donald Trump, Bless his heart...  (SIC)<br /><br />And the ratings from his upcoming trials will probably get him that Emmy he&#39;s been craving!",Miguel Jonz,2020-11-29T05:48:57Z,0
Go trump go,Sandra Erby,2020-11-29T03:51:15Z,0
"Why are you so negative about Trump, what is wrong with you?",jenny liew,2020-11-29T01:03:55Z,0
Drumpf will be busy in Court fighting criminal charges against him.,Joogie,2020-11-29T00:35:38Z,1
Once he is out of office the press needs to ignore him too.,Nancy,2020-11-28T22:05:38Z,0
"Mr Trump will try to win his lost in many ways, losing is not an option in his case. He is way past therapy and not able to turn back, all will cave in and again he will claim victory, it is in fact a sickness.",Gary InMarz,2020-11-28T20:37:35Z,0
NOW    F O and D  trump,Mike Hughes,2020-11-28T20:32:59Z,0
Trump always hated the media.  They should just ignore him now.,The Seeker,2020-11-28T15:52:58Z,3
"the barking dog next door,good for nothing,but always barking.",r j,2020-11-28T14:06:52Z,1
"He doesn&#39;t care about the world, only a sliver - the &quot;sliver&quot; that will subscribe to &quot;Trump TV.&quot;",MediaWatchDawg,2020-11-28T13:10:48Z,1
"Speaking on behalf of the majority of NZ, we&#39;re glad he lost the 2020 American Election.",Benji Hillsdon,2020-11-28T13:02:20Z,3
"Thanks, Benji! It&#39;s so comforting to know we have support across the world.  Now let&#39;s hope and pray the Orange Virus doesn&#39;t cause much more chaos and destruction in his short time left.",Jan Alexander,2020-11-28T20:44:33Z,1
"Even kids in elementary schools don&#39;t take Donald Trump seriously, they&#39;re even smart enough to know what a crooked fraud he is.",BIKESTER GRIST,2020-11-28T03:17:54Z,4
This is a rare magical thinking video from you.,Sean Welch,2020-11-28T03:06:38Z,0
"What are we going to do now for someone to laugh at, that trump is gone.",paddy gahan,2020-11-28T02:45:39Z,2
We&#39;ll still be laughing at him. More of his dirty deeds will come to light. Hopefully his wardrobe will soon match his ugly orange face. It&#39;ll be nice to finally laugh instead of cry.,Jan Alexander,2020-11-28T20:39:51Z,1
"Something about Trump is dark &amp; sinister. He rose to power by being an relentless opportunist. He saw in large percentage of Americans their anger and displeasure with the government, racial discord, and their disapproval of job outsourcing among a few thing. He seems very aquatinted with our darkest thoughts and emotions and he rallies in multiplying all the darkness within us that we so desperately try to live above. This type of narcissistic, paranoid, egotistical personality disorder shouldn’t have ever been selected to lead the most powerful country on the planet. I feel that presidential hopefuls should undergo a series of extreme physiological evaluations by only the highest experts before being cleared to run, because everything is at stake here. I think most Americans would support a leader who would help us focus on our best qualities and stir us to rise to our higher selves. Through trumps leadership I’ve seen the enormous power of all those dark subjects like, hate, name calling, lies, corruption, selfishness, greed, abuse of power and division. It’s very dangerous for humanity and the outcome is never good as history has taught us. Many a US armed forces has fallen in a effort to destroy dictators only to end up with one sitting in its highest seat. And you could rest assure had he been re-elected he would have took action like Putin making himself president for who knows how long?",Adam Tharpe,2020-11-28T00:01:45Z,0
"after a CLOWN was elected, we have been watching a CIRCUS...<br /><br /> &quot;the show is still on&quot;, says DonTcare TRUMP.<br /><br />yea, we agree, the show must go on",kc1 chan,2020-11-27T20:25:04Z,1
"hes  in a glass half empty mood right now..lol [ he forgot about the other half so very quickly. If there was anything he viewed as a success, you&#39;d think he&#39;d just focus on that.] oh boy hes &#39;threatened&#39; leave the country? good.",tammy Owens,2020-11-27T19:02:11Z,0
"Nah not true dawg, the (at least German) media kind of talked all day long about trump escapades. It&#39;s an easy target for them, to distract of the real problems going on in the country.",Andreas Berg,2020-11-27T18:49:51Z,0
"We are gonna be a laughing stock for another month after Joe Biden takes office, because of how close the election was.",Francisco Preciado,2020-11-27T16:47:28Z,0
