comment,id,date,num_likes
"Sound-proof booths and mute opposite mics during the answering of question, let them hash it out as usual when it&#39;s time to &quot;debate&quot;.",anjairis,2020-10-02T01:09:57Z,0
SILENT BOOTH WILL WORK.,Diana Caycedo,2020-10-02T01:09:46Z,0
I&#39;m completely for that idea david!!,命,2020-10-02T01:09:43Z,1
I am all for the sound proof booths with a mic switch as long as they keep both booths on camera.  Watching trump wail around in silence in a glass box while Biden talked would be SO entertaining,Richard H,2020-10-02T01:09:06Z,0
"No!  Why is EVERYONE ELSE needing to adjust to TRUMP?! His whole life, people give in to his demands, walk on egg shells, placating him.  <br /><br />Tell the childish insane clown p*ssy-grabber that he mis-behaved therefore, it&#39;s over (for him).<br /><br />Hold. Him. Accountable.  Don&#39;t reward him for vile behavior.",Betty Veronica,2020-10-02T01:07:40Z,0
Simple. Just turn off BOTH mics automatically.  So only the person whose turn it is will be heard clearly.  That way it&#39;s not up to the moderator. It&#39;s the same technical process for both participants.,Chris Reher,2020-10-02T01:07:07Z,0
"I think sound proof booths would work.  You mute the one not speaking.  If that person is ranting, he wont be able to hear his opponent&#39;s point to counter.  If one goes over time, they are simply muted and a loud buzzer sounds inside that booth to let him know his time is up.  May be these kinds of game show rules would work with the game show host...",Arthur Melendez,2020-10-02T01:07:03Z,0
"Why not try this. Have the candidates in separate buildings using zoom and the narrator and the two contestants can be seen on the television screen. When the candidate is on the screen, only he can talk and be heard. You can&#39;t see the other candidate or hear anything that he is trying to say until it&#39;s his turn.",Fleetwood,2020-10-02T01:06:24Z,0
"They don&#39;t need to change the rules, they need to enforce the rules they have.  Cutting off the mic is not a change of rules it an enforcement of existing ones.",rwferr2,2020-10-02T01:06:22Z,0
"Good , because I stopped watching the 1st one after 15mins !<br />It was too stressful to watch",Bertha Obilie,2020-10-02T01:04:38Z,0
"Don&#39;t change the rules, change the candidate. If he can&#39;t follow simple rules, he should be disqualified.",Allen Murphy,2020-10-02T01:04:17Z,0
Use  a Dating Game SOUND WALL between them. Let each man be heard fairly.,Johnny Gregory,2020-10-02T01:03:37Z,0
my liver cannot survive another debate,FrySea,2020-10-02T01:03:13Z,1
.make them walk over a path of hot coals and the swallow thumb tax and watch them shit them out then have Mike Pence pic out the race to see who won by the number of race emptied out,Doug Boyer,2020-10-02T01:02:49Z,0
VP debate will be a brutal ass kicking. Pence won’t discuss any substantive policy. He’ll parrot the Trump go to topics that get his cult’s attention and that’s that. Harris will run circles.,Daniel Morse,2020-10-02T01:02:15Z,0
Hi David! Love your show. How about this as a solution to Trump debate.. use a large soundproof plexi barrier between candidates to help muffle mic sounds.. it could work. Thank you..all the best!,paula tyler,2020-10-02T01:02:07Z,0
They should have strict turns with the microphone of the other candidate OFF with no exception.,ContagiousRepublic,2020-10-02T01:01:41Z,1
I&#39;m with you all the way,deborah barry,2020-10-02T01:01:30Z,0
The answer is Joe Rogan,Random Person,2020-10-02T01:01:22Z,0
They should bring in a naughty corner or a naughty seat. Maybe get Max Smart cone of silence. No mask then leave the room,7 eyeswideopen,2020-10-02T01:01:11Z,0
they could try a shock collar,Eliza Almaguer,2020-10-02T01:00:34Z,0
"There should be NO asking if he will agree to the new rules.. Just give tRUMP the rules of the game, if he decides to not show up then allow Biden the floor for 90 minutes.",Bullzeyez,2020-10-02T01:00:30Z,1
interesting video.  keep up the good work. love the channel.,James Haack,2020-10-02T01:00:08Z,1
Trump should be sitting in a soundproof Box,Mikael Tholen,2020-10-02T00:59:11Z,0
Put Trump in a box.,Mr Mullett,2020-10-02T00:59:03Z,0
"With all of the tech we have nowadays , why are they not having them debate from separate rooms. Cut off the mics and they can yell all they want ( by they I mean tRUMP ).",Bullzeyez,2020-10-02T00:58:41Z,1
Put both &quot;debaters&quot; inside soundproofed rooms with microphones &amp; have remote control over which mic to activate,HS W,2020-10-02T00:58:39Z,2
Did anyone notice that Melania was wearing a gangster suit?,TheJoaneD,2020-10-02T00:58:20Z,0
"If 45*&#39;s mike got muted, he&#39;d shout louder to continue distracting Biden. They&#39;d need separate audio booths so neither can distract the other when they speak out of turn. Could be neat if there was an alternate audio feed with 45* and Biden on separate L/R channel regardless of mute status - listen to all of the inanities 45* says while he&#39;s muted off if you want to, listen to Biden uninterrupted if you want something less toxic for your sanity.",Teardown Dan,2020-10-02T00:57:34Z,0
Will there be duct tape  for Mr presidents pie hole?,Doug Boyer,2020-10-02T00:56:37Z,0
The Next Debate should be on Zoom then Mute is complete silence,Kevin Edie,2020-10-02T00:55:29Z,0
"Playing with time won’t work. Those politicians can talk for hours. What you do is cut the microphones, and enable noise cancelling to the live microphone. That way even if he talks, you can’t hear him. You put a big green light on the stands so everyone knows if the mics are ON.<br /><br />If DT don’t like those rules. Well... the host can ask his questions to an empty stand.",Sirius Enigma,2020-10-02T00:55:13Z,0
I believe it actually hurts Biden if Trump stays silent during Biden&#39;s time. That way Biden&#39;s stutters will be way more obvious.,Frank Artanis,2020-10-02T00:53:47Z,0
"Because of the temperament of the President, he would not be able to handle any controlled in person debate. They should be at different venues with a dual in person moderator team to parallel the questions. The broadcast team and producer would be in control of time with the ability to switch between candidates to give them absolute equal time. Same as the talking heads on the news.",RB 151,2020-10-02T00:53:24Z,0
When a candidate pulls this use 3 strike rule #3 they are flat disqualified,MARIE Kirk,2020-10-02T00:52:32Z,0
Sound proof barriers and mute mic,nightshine5,2020-10-02T00:51:21Z,0
"Yeah, that was what I was thinking, too! My version was to have a chess clock. Anytime Trump (to pick a random candidate) is interrupting is taken off his overall time. Same goes for Biden. So in the last debate, Biden would have had the whole second half of it to himself, and Trump would have to just stand there and take it, and if he interrupts with his time out, he is escorted off of the stage. Very embarrassing for him.",David Kendrick,2020-10-02T00:50:43Z,0
Shock collar?,kong xiong,2020-10-02T00:50:42Z,0
Shock collars.  All I got.,Bill McDonald,2020-10-02T00:50:19Z,0
Introduce detention for petulent behavior during the presidential debate.<br /><br />Seriously guys... can you hear China and the rest of the world laughing their ass off at the American leadership? &quot;ISIS... stand down and stand by!&quot;,K Khalifah,2020-10-02T00:49:23Z,0
"Put them in sound isolation booths, and cut the mics when it’s not their turn. Problem solved.",Death Rattle,2020-10-02T00:47:37Z,1
Muting any candidate would be even more of a national embarrassment than what we saw,Kimi,2020-10-02T00:47:26Z,0
"Spare a thought for foreign viewers who had to listen to Trump yammering on and Chris Wallace trying to rein him in, or Joe Biden attempting to finish a sentence being interrupted by Trump AND the three respective interpreters. I hope the Trump interpreters in various news orgs around the globe are having a few days off now...",Modern Day Warrior,2020-10-02T00:47:25Z,0
Have the debate on Zoom and mute him when he interrupts.,Amy Girl,2020-10-02T00:46:22Z,6
"Even if Trump is muted the main problem is that Biden will be able to hear him and let&#39;s be honest, it&#39;s not hard to break Joe&#39;s train of thought. To be fair with that kind of savage, ape-like constant noise I would have a hard time myself. They would need to be in soundproof boxes or straight up different locations for it to work.",reezlaw,2020-10-02T00:46:16Z,0
It would work to change the rules to have a conversation between two adults but then of course you would need two adults.,Joe Bradner,2020-10-02T00:45:52Z,0
"Every time he wants to interrupt, he should simply be shocked with high voltage. Can entice him to stay quite by stopping off at McDonalds in the way home.",Tom Blackfyre,2020-10-02T00:45:42Z,22
Let&#39;s make that everytime he interrupts or LIES....would be a short debate.,Frank B,2020-10-02T05:07:31Z,0
"If I were the Dems I would call off future debates.we all know by now what we have had for 4 years,and it hasn&#39;t been pretty.",Kelly Baumann,2020-10-02T00:45:31Z,1
The age of politeness officially ended in 2016. Somebody should tell the Democrats and the mainstream media.,Tiger Dogg,2020-10-02T00:45:08Z,0
LOVE your idea!,Danyelle St.Marie,2020-10-02T00:44:58Z,0
The Trump&#39;s are living garbage,Chris Kline,2020-10-02T00:44:55Z,0
What&#39;s wrong with vaping?,Cool Guy Jim,2020-10-02T00:44:43Z,0
Yeah right. Like this orange buffoon is going to follow any rule.,15anerachoreographer,2020-10-02T00:44:29Z,0
I say put a shock collar on the candidates. Interrupt...get zapped.,Roger McCaslin,2020-10-02T00:44:00Z,0
Your debate rule change is exactly what I was thinking! Best idea I’ve heard. 👍🏼,pamcuny,2020-10-02T00:43:42Z,1
You have one omni-directional mic. It can only pick up sound when pointed at you.,Marcus Wardle,2020-10-02T00:43:36Z,0
Keep Trump mouth shut —- <br />Good idea ..,Biên Hòa Memories,2020-10-02T00:41:42Z,0
"How would muting mics prevent Trumpturd from continuing to interrupt, distract, deflect points being made by Biden? It wouldn&#39;t, even if inaudible on the air. A sound proof glass chamber is needed for the tantrum throwing spoiled brat, visible for all to see.",Stardust Stardust,2020-10-02T00:41:36Z,0
"Just have one mic live at a time. Each with a timer to ensure equal opportunity, and a light to show whose is live.",P Smith,2020-10-02T00:40:45Z,0
I still think doing them from remote locations online is the only way to go.,Bob Mac,2020-10-02T00:40:28Z,0
Give Trump an earpiece that has a direct feed to his mic that doesn&#39;t get cut when the mic cuts to everyone else.,tintinaus,2020-10-02T00:39:43Z,0
"Wow, who figured you had to plan how to pacify a baby?",Calisa Hardy,2020-10-02T00:39:43Z,0
Kamala is going to crush it.,KC Nicky,2020-10-02T00:39:42Z,0
Wasn&#39;t as bad as Pete Buttigieg lol remember that mess,eward0,2020-10-02T00:39:09Z,0
How about a Shock Collar for tRump??,Bobbi Garrison,2020-10-02T00:38:49Z,0
I had the same idea as you!!,KC Nicky,2020-10-02T00:38:40Z,0
They should give Biden another 2 minutes every time rump opens his mouth.,KC Nicky,2020-10-02T00:38:19Z,0
"Hypothetically, Trump could complain how his 1st Amendment is being taken away, or that he&#39;s being forced into silence, if he were to be muted. Also hypothetically, his base could fall for how (poorly) he&#39;s being treated, even when the mic muting suggestion is a direct consequence for his interruptions and rule breaking. A good &#39;ol gavel might do the trick, but who the hell knows.",bubu,2020-10-02T00:38:06Z,0
Put both candidates in a sound proof booth with an on/off mic controlled by whoever is in charge.,Patricia Leja,2020-10-02T00:37:33Z,0
"PUT THE DEBATERS IN BOOTHS WITH SEPARATE MICS.  INTERRUPTIONS MUST BE EXTINGUISHED..  I ,. FOR ONE , WILL NOT BE INTIMIDATED FURTHER BY TRUMP..  IF HE CONTINUES TO INTERRUPT I WILL NOT WASTE MY TIME  WITH HIM.  I WILL DISCONNECT MY LISTENING DEVICE AND VOTE FOR BIDEN.  END OF PROBLEM.",douglas hoffjr,2020-10-02T00:37:29Z,0
"Tweety&#39;s strategy was to keep Biden from being heard, but our fake weak president came off looking like a whining out-of-control infantile moron.",klondike316,2020-10-02T00:37:07Z,0
"These people have gotten away with everything and anything so what’s gonna stop them, rules?  Trump doesn’t play by any rules, it was his plan to act crazy, why cuz people are now saying, wow I don’t even what to bother to vote, n since he can win the swing vote he want to make them not want to vote at all!",ceci edwards,2020-10-02T00:36:17Z,0
"These people have gotten away with everything and anything so what’s gonna stop them, rules?  Trump doesn’t play by any rules, it was his plan to act crazy, why cuz people are now saying, wow I don’t even what to bother to vote, n since he can win the swing vote he want to make them not want to vote at all!",ceci edwards,2020-10-02T00:35:44Z,0
"All Trump wants is a 90 minute jackboot bark-a-thon; a free Trump ad. You can&#39;t debate complicated policy if you have a brain the size of a chick pea, so he just yells insanity.",Joe Strat,2020-10-02T00:35:40Z,0
"The overspending your talking time and having to pay that tax on your own time later - that&#39;s better than anything else I&#39;ve heard except for muting the mic&#39;s - which I think they should do whether they agree or not.<br />-Biden will welcome it and will agree.<br />-Donald really might love to have it as an excuse for him to quit the debates<br />-Donald&#39;s campaign would be desperately fighting him to stay in the debates as he has such bad poll numbers to recover at this point.<br />-It all leads to some chaos for Donald for ONCE, instead of him just sitting in his ivory tower dumping chaos on all of US, instead.<br /><br />I&#39;m also curious about the opinion of Harris slaughtering Pence. While Harris is a better debater than Biden, Pence is a better debater than Trump. <br />And I think the gap between Pence and Trump is significantly WIDER than the one between Harris and Biden.<br />So in a mathematical sense, I just don&#39;t see how that works out to a much bigger win for Harris, than Biden.<br />I could be wrong, but MOST were wrong when they predicted Donald mopping the floor with Biden - which statistically, 2 of every 3 people polled agree Biden won by a significant margin, by simply acting like a mature adult, more so than anything else.",Freight Train,2020-10-02T00:35:40Z,0
Put trump in a sound proof booth,Bobbi Garrison,2020-10-02T00:35:40Z,0
How about having a naughty step? Any candidate that interrupts the other is then banished to the naughty step for the same length of time as the interruption. <br />If the candidate behaves himself then he can be rewarded with a sticker and a cookie.,wetfishbits,2020-10-02T00:35:36Z,0
Other than making &quot;shock collars&quot; mandatory – I think your suggestion is a good one. I don&#39;t think it would be that hard to manage. Except it would give tRump an out – by claiming he &quot;didn&#39;t get any airtime&quot;,John R Armantrout,2020-10-02T00:35:29Z,0
What makes anybody thinks Trump will be the same in the next debate? He is going to do the same thing he did in the the first debate. He has no choice. He cannot discuss his record because he knows he is a failure.,Ellis James,2020-10-02T00:35:22Z,0
"How about: Same seating arrangement, but Trump &amp; Biden are in glass, soundproofed enclosures - big enough that we see only the seam. The booths are otherwise invisible, with the glass walls and doors out of camera range. Doors are locked during debate, so no stomping out or approaching anyone. During each 2min statement, only the speaker&#39;s mic is on. During discussion segments, both mics are on but any disruptive interrupts will get your mic turned off until opponent completes thought and/or you cease and desist. Technically, Trump can interrupt and bully all he wants. Biden can do the same. But when they do, they won&#39;t be heard by us or each other. They&#39;ll just be seen to interrupt and gesticulate silently in their respective enclosures.  After the debate, three recordings can be posted online: 1) the live debate as we saw it 2) full, isolated recording from trump&#39;s mic during entire debate, even when it was muted 3) full, isolated recording from biden&#39;s mic during entire debate, even when it was muted. The last two are partly for entertainment, because the world could use a laugh and those commentary tracks could inspire some great memes.",Thomas Terranova,2020-10-02T00:34:53Z,0
"America has lost respect from this circus. Why doesnt anybody take control of these easy to predict failures. They all stand around complaining but nobody takes control!  I could have predicted trump would handle the debate like this, he has nothing of substance to say because he isnt a political figure. Why elect tv stars,movie stars,etc in these high profile jobs? You need political career people to lead in politics duh! Trump will waste time talking over &amp; lambasting Biden because its all he can do. Where is the Republicans manifesto? What are trumps policies? What exactly has he achieved? This is what you ask about an incumbent potus. The mike should be turned off after 2 minutes period. Trump trying to fluster Biden was totally going to be his MO in the debates. He should have been drug tested as he was so jacked up on uppers to achieve this. Americans should stop this nightmare as they are headed for a war by trumps hand. He must be stopped before anybody else dies.",Kate,2020-10-02T00:34:35Z,0
"Because of his childisch behavior And the way he embarrased the USA. Like a todler<br /><br /><a href=""https://vimeo.com/221380805"">https://vimeo.com/221380805</a>",Yael Bailey,2020-10-02T00:34:19Z,0
Biden could have just let Trump speak over him and then make the point that what the American people are seeing is the reason why the US has become so dysfunctional. They are seeing the President in action unable to listen to anyone. He creates chaos wherever he goes.,Alan Whittington,2020-10-02T00:33:59Z,0
"Turning off the microphone is not changing the rules midgame, it is simply enforcing them. The rules are still the same.",thatniceguynick,2020-10-02T00:33:38Z,0
The candadates should  have shock collars.....,Ancient Heart,2020-10-02T00:33:32Z,0
"You must wear A Mask, When TALKING","""Cancer What Is It Good For ! Making Friends ? """,2020-10-02T00:33:23Z,0
"I think real- time fact checkers are a must, I guess there would need to be time between the answers so the fact checkers would have time to check. Would make the debate longer, but at least then most of the info we got would be true (well, truer). And maybe it would be a real debate. But Drumpf would never agree to any of this, and somehow his refusal to participate would be Biden&#39;s fault.",Gwen Martinsen,2020-10-02T00:33:18Z,4
"In Trump&#39;s case those fact checkers would end up having to talk nearly as much as him , contradicting every other sentence 🤣",Diarmuid Kuhle,2020-10-02T01:45:37Z,0
I have an idea to make Trump shut up while it&#39;s Bidens turn to speak. Gag him as long as Biden speaks. He&#39;ll shut up and it will even be funny to watch.,Luke Dylan,2020-10-02T00:33:07Z,0
"The mic should simply be disabled when the other persons is speaking.<br />The person not speaking then have time to compose rebuttal, etc.<br />Place a very visible stop watch so everybody can track their time.<br />Use noise cancellation mics and software.",Sam Chiu,2020-10-02T00:32:46Z,0
"Durring his last rally, trump said that Biden canceled the next debate.  Which isn&#39;t true. He is setting up and convincing his supporters that canceling was not on him. They ate it up as usual.  He doesn&#39;t want to debate again. And wants to make Biden look weak.",Nan S,2020-10-02T00:32:31Z,0
My solution when Trump talks out of turn. Trap door under each candidate. Pull the trapdoor open and drop the candidate. 💥 gone,Willow Downs,2020-10-02T00:32:31Z,0
Your boy was wearing a wire! FU!,Rodney Huff,2020-10-02T00:32:11Z,0
"The Cone of Silence. Or better yet, Zoom meeting.",Anthony Losego,2020-10-02T00:32:10Z,0
"And maybe ,,, who ever doesn&#39;t agree to the &quot;mute rule&quot; loses their alloted time to the other debater. Means they would have to cooperate ,,,or,,, give the other a huge advantage. A lot of free prime time. Also would love to see some fact checking.",Wendy Faith,2020-10-02T00:32:06Z,0
I would put them into little cabins next to each other with headphones on...so that they can answer the questions seperatly from each other while the other one is listening to music...,The Flavourist,2020-10-02T00:32:04Z,0
Will he be sent to his room for disorderly conduct in the next debate??,Karen Nicholls,2020-10-02T00:30:54Z,0
"In addition to a &quot;kill&quot; switch on Trump&#39;s mic, Trump needs to be isolated in a sound-proof booth (think 1950&#39;s TV &quot;Quiz Show&quot;). In the middle of posting this comment I Googled [TV, 1950&#39;s, Quiz Show] to make sure I cited the correct game show and under the &quot;Images&quot; category the &quot;Presidential Debates&quot; were shown. I guess many people came to the same conclusion on how to deal w/this despicable man..Silence him.",REVIEWS CREWS,2020-10-02T00:30:06Z,0
Tazers?,Uncle Spicey,2020-10-02T00:28:06Z,0
Maybe security guards with duct tape when Biden is talking.,Paulette Mackenzie-Dubuc,2020-10-02T00:27:17Z,1
Lets not invite him.  It wasn&#39;t a debate the first time.  I don&#39;t think he knows how a debate works. Once he antics started moderator should have dropped the show.  You can&#39;t reason or explain to a person that is deaf.,cher,2020-10-02T00:26:52Z,0
If the tRump team wants instruction on how to act more civilized they should look at old Roller Derby videos!,TheMerryPup,2020-10-02T00:26:48Z,0
Soundproof booths,Randy Igou,2020-10-02T00:26:41Z,0
For get the Mic kill switch... Use a taxed.,judith Rix-Brown,2020-10-02T00:26:41Z,0
That&#39;s TAZER,judith Rix-Brown,2020-10-02T00:29:21Z,0
"The &quot;debate&quot; was a sh^t storm.  With Covid, Fires, Economy, Election, etc.; Now is NOT the time for people to quit smoking.  I like your show.  Stuff Lucy.",Mike Laffoon,2020-10-02T00:26:20Z,0
"mute won&#39;t work, trump still gonna be disruptive. you&#39;ll just see joe biden loose his train of thoughts with some background noise. What we do in our country is timing each canditate speech time, at the end of the debate, the one who spoke less can make it up.",aesir,2020-10-02T00:25:48Z,0
&quot;Never wrestle with a pig you both get dirty and the pig enjoys it &quot;<br />Its pointless to debate because he doesn&#39;t answer questions.  Even at the town halls.  He uses it as a platform for more lies and disinformation. You need to go at this and coach Biden on dealing with a malignant narcissist,Carolynn Marie,2020-10-02T00:25:44Z,10
"I criticized Chris Wallace.   I now take that back.  It is very difficult to control an asshole.  And that was tRUMP.  Yes,  cut off his mic.   <br />Can’t wait for Kamala to take on Pence.   She will slaughter this weeny.",joy dove,2020-10-02T00:24:48Z,1
"The answer is that both candidates are placed in separate isolation booths. The question is put to each candidate, and then the moderator starts the clock while choosing either Trump or Biden to answer the question. After their time is up, the moderator turns off the mike, presses the buzzer, and moves to the next candidate with the same category. The only problem that exists is if one of the candidates relies on deception. Who&#39;s going to correct that candidate unless the moderator brings it to the forefront with the other candidate when it is that candidates turn.",Stitch in Time,2020-10-02T00:24:44Z,0
Trump will say the debate rules changed cause of Biden. That fat orange pumpkin is so predictable.,Kenny Tan,2020-10-02T00:23:53Z,0
just mute the childs mic when the adult speaks,Benji Tre,2020-10-02T00:23:48Z,2
"The debate could work like a chess game with timers and muted mics. Each debater is given the same total amount of time that they use as they want to answer questions and make points. Each takes turns and taps the clock when they’re finished speaking. The mics are muted when it’s not their turn.<br />When one debater runs out of time, the other gets to use up the rest of their time. <br /><br />Acoustic dampening, partitioning or noise canceling could also be used to prevent distraction. <br /><br />There would be no talking over each other and hopefully a more constructive debate.",Alan Whittington,2020-10-02T00:23:21Z,0
Give them each a chess clock.  If he interrupts - then his time is deduced.,jb03hf,2020-10-02T00:23:07Z,0
I like David&#39;s idea!,nursingnotes212,2020-10-02T00:22:50Z,0
"My idea: when it’s Biden’s turn, trump get escorted to a sound proof booth where he can only hear the moderators and Biden but no one can hear him....but we can still see him, when it’s his turn he gets out.",Stephanie K.,2020-10-02T00:22:49Z,1
I don&#39;t know if that would be scary or very funny&#39; to see him rant in silence might be funny,Da the great,2020-10-02T00:26:37Z,0
Shock collar it will work and give us a laugh also,Delores Kotlarz,2020-10-02T00:21:24Z,0
Great now he&#39;s gonna be crying that his 1st amendment rights are being taken away if they cut his mic. I&#39;ve never seen a grown man act like such a child. It&#39;s so gross.,P. consuela banana H.,2020-10-02T00:21:16Z,0
"I say give Biden a button that mutes Trump, and give Trump a button that mutes Biden. That way they can both say nothing, as well as not be annoying.",N G,2020-10-02T00:20:55Z,0
Separate them completely. Give them equal time on internet streams.,Renegade Wolfhound,2020-10-02T00:20:45Z,0
