comment,id,date,num_likes
"I actually had a person tell me that Biden interrupted more than Trump did.....I don&#39;t even like Biden, but what the hell debate were these people watching? Did FOX News air an &quot;alternate fact&quot; version or something?",David Mayberry,2020-10-01T23:19:09Z,1
You could have them each in their own booth (like a puppet show) then mute the mike when time is up.,William Eaton,2020-10-01T23:18:27Z,0
Thank you Mr. Pakman. That was exactly what i said in your last video. Mrs. Harris is going to dominate Pence. She is a force to be reckoned with. See you Wednesday. Great work! Keep it going.,Lovely C,2020-10-01T23:18:00Z,0
Mute the mic and build a big wall between them ;),Nando Abel,2020-10-01T23:17:39Z,0
put him a a soundproof cage<br />with bars<br />he&#39;ll have to get used to the view,lindsay jennifer,2020-10-01T23:17:34Z,0
Good idea .<br /><br />Trump gets way out of control he forfeits   his night and Baden wins the nights debate. <br /><br />And Visa a versa,Karen Reese,2020-10-01T23:17:28Z,0
2 sound proof booths. <br /><br />2 minutes of time each. The others box is “shut off” during one candidates time. <br /><br />2 minutes each. One minute free time. Both mics open.<br /><br />All controlled by moderator/computer.<br /><br />“Your two minutes starts now.”<br /><br />“One minute free discussion. Go”,Giordano Bruno,2020-10-01T23:16:57Z,1
I agree with your suggestion was just saying this. Also this will hopefully make the candidates use restraint or in 45 case fail,LazyCat40,2020-10-01T23:16:54Z,0
"Of course they&#39;ll think muting is unfair, interrupting was 100% decided tactic. It&#39;s like sports banning steroids.",John Pfaff,2020-10-01T23:16:51Z,0
"I like this new rule, but I  think it would be even better and more fair to connect a taser to Trumps microphone and whenever the law and order president breaks the rules and speaks out of his time he automatically gets some electroshocks.",Jeany Luisa,2020-10-01T23:16:33Z,0
"Love your work David, however I can&#39;t watch you commentate the debate, you talk too much bro.",Syro,2020-10-01T23:16:31Z,0
"Also, yes, I&#39;m looking forward to Kamala crushing Pence. Like Trump, he doesn&#39;t know how to deal with intelligent women. But where they make Trump angry, they just make Pence short circuit.",Truffle85,2020-10-01T23:16:28Z,0
The problem is Trump...not Chris Wallace. Trump is the TUMOR and he must be surgically removed from the stage.,lrn,2020-10-01T23:16:15Z,0
"Here is what I am proposing! Each candidate will have 2 hot mic on them at all time once they are on stage.  The hot mic is only to record sounds - even their mumblings.  Transmission of sounds is up to the Moderator of the Debate, he can mute your transmit mic when it&#39;s not your turn but your hot mic will show what you actually mumblings or saying -- so beware.  👁👀👁",Julie Wynn,2020-10-01T23:15:59Z,1
"Here&#39;s my take. They introduce the &quot;mic muting&quot; solution which causes Trump to explode in an orange frenzy. When pressed he will finally pullout of the debates,citing the media,commission,etc as all against him. Once again,he is the victim,the martyr. Let&#39;s face it,he didn&#39;t want to debate anyone anyway. When you look at it this way his &quot;performance&quot; actually starts to look like a strategy.",lash larue,2020-10-01T23:15:43Z,0
"electric SHOCK COLLAR to those tiny little Trump nuts every peep that squeaks out, when it&#39;s not his turn!!  Also hit him again if he tries to dodge Questions!  Keep that baffoon on subject wether he likes it or not!",frie jemi,2020-10-01T23:15:29Z,0
Why is my drug that is brand for Astra Zeneca  does make a generica. No other company makes  it and now it for 30 days $424.00 USD.<br /><br />The drug used to cost $75.00 <br /><br />This with  insurence.<br /><br />Drug went up and Astra Zeneca manufacturing facility is in India.<br /><br />Explain that!,Karen Reese,2020-10-01T23:15:09Z,0
"Set up a digital debate, with the candidates in soundproof booths, kinda like a Zoom call. When it’s not your turn to talk, the mic gets muted.<br /><br />If Trump won’t agree, then the networks should tell him that he is free to show up or not, but the broadcast is happening. If he shows up, he agrees to the changes to the rules. If he doesn’t, Biden will get the 1.5 hours of airtime to present his policies.",Sylvie,2020-10-01T23:14:55Z,0
He ruins everything,puddin cup,2020-10-01T23:14:49Z,0
Place both candidates in soundproof booths and open the mics only when their time to speak is due.  Both candidates just to be fair; if both candidates behaved like Biden this would be unnecessary.,ed da,2020-10-01T23:14:23Z,0
Joe Biden did pretty well considering he had a 74 year old toddler shitting himself and yelling into the mic constantly on the other side.,A T,2020-10-01T23:14:07Z,0
"Let&#39;s hope the idea of a mute button becomes accepted across the media.  For decades, the media has allowed politicians to essentially filibusterer interviews with rambling non-answers.  If a question isn&#39;t being answered, the host needs to immediately shut down the talking.  The incessant lies Trump tells is a direct result of the media having reduced their own roll to that of a mic stand.",SteveQ,2020-10-01T23:14:02Z,0
Shock collars.  That is the answer,Federico Barrio Linares,2020-10-01T23:13:57Z,0
Put them both in sound proof rooms. Turn off the mikes when they are not supposed to be talking.,Sage Agbonkhese,2020-10-01T23:13:55Z,0
"They aren’t moving the goal posts, both sides agreed to give each other two minutes and Trump did not follow the rules.",Sister Harris,2020-10-01T23:13:51Z,0
"Not all microphones are omni-directional.<br /><br />Cut the mics if a candidate interrupts and change microphone types to ones that only pick up in one direction, maybe with foam on the back of the microphone so that sound from the opposite direction gets blocked. (I have a similar setup in my office for recording voice acting for my videogame but I don&#39;t know the proper terms for that stuff.)<br /><br />With the kind of budget they have for these debates there is no excuse that &#39;well tRump might get picked up in Biden&#39;s microphone&#39;... Even an armature like myself could figure it out with a $300 budget... sigh...",Cal The Robot,2020-10-01T23:13:28Z,0
What should be done is sound proof booths be installed  where neither candidate can hear the other and each one could answer his questions humanely without interruption.,Barbara Cook,2020-10-01T23:13:26Z,0
When Trump interrupts you just shove a pacifier in his mouth,DaGr8 Pudgy1,2020-10-01T23:13:24Z,0
"Cause the Trump family feel that it&#39;s all about them. And if you don&#39;t agree with them you get fire. And the American people either you vote and agree with Trump, or he will use his power to distory your life any way he can.<br />He is the laughing stock of the world. Which means that the world is laughing at the American people for allowing this to happen.<br />With the way he is distorying our relationship with other countries, would could we depend on to help us out if a war brakes out in this country, or in any other country that decide to attack us. And it could happen. Since this ass hole is sending 40 troops and 10&#39;s of thousands military equipment to I believe Taiwan. Who has a disagreement with China. Plus we already have hundreds of military ships in the area. Between the China Sea, Philippines, Japan, and Arabian sea. He is getting really to start a war. So that our troops will be out of the way. Think about that.",James Poore,2020-10-01T23:13:09Z,0
I think a big bucket of fried chicken or a plate of cheeseburgers next to the Petulant Turd&#39;s podium could be effective,dabyco,2020-10-01T23:12:09Z,0
You fools elected your five year old son to handle the nation and have command of our nuclear codes.,john frank,2020-10-01T23:12:06Z,0
Put both of them in a soundproof booth.,Truffle85,2020-10-01T23:11:40Z,0
"Maybe we should have 3 moderators. One up front, and one standing behind each candidate,..... with a stick!",Gerald Trudeau,2020-10-01T23:11:27Z,0
"What&#39;s so weird about Trump&#39;s behavior? He has been doing this for 4 years. What else could be expected but: unculture, primitivism, arrogance.He is a ruthless and heartless lunatic, who tramples over corpses to achieve his goals. We Europeans hope you will not repeat the mistake of 4 years ago.",Halil Nukic,2020-10-01T23:11:06Z,0
"You can stop him from talking if you don&#39;t debate him, he doesn&#39;t understand the concept of a debate he thinks it is an opportunity to throw insults at his opponent similar to a schoolyard &quot;Yo, Mama&quot; session.",john frank,2020-10-01T23:11:06Z,0
Maybe a killswitch on the mics and a glass partition to act as a buffer so the person speaking isn&#39;t bombarded when trying to speak.<br />Could also add 1 minute to the time of the person speaking for every 5 seconds of interruption... <br />That would really tick off someone!,spriken,2020-10-01T23:10:58Z,0
Trump needs a shock collar.,dennis vradenburg,2020-10-01T23:10:47Z,0
"I like your idea, pass it on, thanks.",gerri speratos,2020-10-01T23:10:44Z,0
They need to do it via a satellite and cut the feed. Don&#39;t even broadcast outside the 2 minutes.,J. C.,2020-10-01T23:10:25Z,0
"A Christmas Story, stick his tongue to a frozen flag pole.",bradley sanford,2020-10-01T23:10:15Z,29
"Managing time won&#39;t work....trump will just ignore it.  Good friend of mine, Fischer, suggests soundproof booths with controls on microphones.  Each candidate can hear the other during their turn to speak, and the moderator. When it&#39;s one candidate&#39;s opportunity to talk, the other candidate&#39;s microphone is turned off.",Tom Shimko,2020-10-01T23:09:51Z,0
//P.S. Shock collar.,YTPartyTonight,2020-10-01T23:09:51Z,0
Put a shock collar on Agent Orange,JD SHARP,2020-10-01T23:09:50Z,0
"David Pakman Show...my idea is To pute each of them in a soundproof cabin , the moderator will be connect To each of them for questions but only him can hear the trump bla bla  and wont be able To bother Joe.",Maëva T.,2020-10-01T23:09:33Z,0
"Just use a couple dunk tanks.  If someone interrupts, they drop into the tank.  Trump would shut up because he wouldn&#39;t want to get his 70k hair wet.",Matt K,2020-10-01T23:09:29Z,0
"David, they should be in soundproof chambers. Well, Trump should anyway. But let&#39;s assume they give the moderator a mute button. Unless Trump controls himself, he&#39;ll have the appearance of a washed up old hobo who&#39;s talking to himself and mumbling nonsense (as usual).",Share The Footage,2020-10-01T23:09:28Z,0
The answer to anyone who complains about moving goal posts is Trump already has done that himself; he has proven that he can&#39;t play by the rules.  I hope this triggers Trump into a utter meltdown in the midst of the next debate and he walks out or so he refuses to show up at all from here on out.,YTPartyTonight,2020-10-01T23:09:25Z,1
I think the rules should be changed otherwise it&#39;s like two little kids debating over chocolate,Connie Balmer,2020-10-01T23:09:18Z,0
They each get their own room so you can shut the baby off when he loses control!  He&#39;s in his quite place That will further make him crazier!!!  GET READY 4 THE RIDE Coming to a place near YOU!!! The Trump show is coming to you live! In part 4  All Or Nothing!!?? See the The dick tater really wants/needs the job to save his ass and fuck you if your not with him! The child king wants his way and his kingdom so he can con away his life!      And U Deal with U !!!,John Du4,2020-10-01T23:09:02Z,0
"Put trump in a sound-proof booth, with electronic frosted windows. Problem solved.",bugjuicer,2020-10-01T23:08:50Z,0
#3 wants things the same so he can jump all over and try to intimidate Biden again.   (he wasn&#39;t successful last time) .   Build a sound proof wall between them open at the front so B isn&#39;t so badly interrupted and it would still look ok for tv and the moderator !,Glenn Sibbitt,2020-10-01T23:08:21Z,0
I suggest that put both candidates in isolation soundproof booths like they did back in the early days of tv game shows.,Frank Berlin,2020-10-01T23:08:12Z,0
"I like my solution better. Shock collars. One candidate interrupts the other, zap him. Keep upping the voltage if the interruptions continue. Will it make for an informative debate? No. Will it be fun as hell to watch? Oh yeah.",TC Sam,2020-10-01T23:08:11Z,0
"Harris will destroy Pence, it will be amazing. He’s terrified of women",Anita C,2020-10-01T23:07:52Z,0
As the so-called &quot;Law &amp; Order president&quot; he sure seems to love breaking laws and thrives in disorder.,lxr,2020-10-01T23:07:44Z,116
He&#39;s only the Law &amp; Order pres because he probably watched more of the show than any pres before him.,ShadowFoxSF,2020-10-02T13:34:11Z,1
Man Biden could  💣 trump about that at the next debate! Like seriously 😳🤪🤔,Rach F,2020-10-02T05:10:40Z,3
That&#39;s what makes this presiduncy so laughable,Mogamad Greyson,2020-10-02T05:02:43Z,3
Funny Dems talk about rules. There the ones wanting to blow up government add states and end filibuster.,Dustin Fewell,2020-10-01T23:07:17Z,0
Best solution: Have a big leather daddy loom over trump and only take out his ball gag when it&#39;s his turn to speak.,Jennipoooo,2020-10-01T23:07:13Z,0
Put them in two separate rooms.,Hurri,2020-10-01T23:06:57Z,0
Presidential rules should change too. Anything trump will be involve in the rules have to change. We do not have to do that for dogs . They take training well,Maria Brown,2020-10-01T23:06:56Z,0
I think another factor for all the lunacy is that Trump just likes to hear himself talk.,tahquameken,2020-10-01T23:06:43Z,0
We can&#39;t expect substantitive debe or cooperation with Tantrump.,elaine goad,2020-10-01T23:06:25Z,0
In fairness they knew who Trump was and they should&#39;ve known that he wouldn&#39;t abide by the rules so they should&#39;ve added some countermeasures in case he didn&#39;t. The fact that they didn&#39;t do so was a lack of imagination on their part.,mcostagirl123,2020-10-01T23:06:18Z,0
Next one is town hall style.  Let&#39;s not forget how he stalked behind Hillary last time.  What&#39;s to stop Trump from hip checking Biden.,David Pressel,2020-10-01T23:06:03Z,0
"The only problem with deducting Trump&#39;s time from his next answer is that... He gets to not answer. He has no policy, no ideas, and would have more time to just dodge, insult, and lie- then be out of time. Perfect for him.",Shannon S,2020-10-01T23:05:56Z,0
Just because you shut off the microphone Does not mean that you shut off the mouth,Janet Eggleston,2020-10-01T23:05:45Z,0
"Put a shock collar for dogs on trump, he talks out of turn, zap his ass, he&#39;ll get the message eventually",catman 99,2020-10-01T23:05:31Z,0
put each one in a glass cylinder with Mic cut off a sound proof cylinder,Robert Vincent,2020-10-01T23:05:20Z,0
DONALD never cares about rules. Any rule .....,Medyati Oktarina,2020-10-01T23:04:46Z,1
"Sorry, can&#39;t stomach kamala, not going to watch",Curtis Mathews,2020-10-01T23:04:40Z,0
I think what they should do is give the candidates a high voltage electric shock this would make for great TV,John Hancock,2020-10-01T23:04:26Z,0
I think an electric buzzer would help... Interrupt the moderator or the other debater and you get ZAPPED....,Javalvrs,2020-10-01T23:03:51Z,0
I propose they literally turn the light off on the person not speaking and maybe drop a curtain in front of them.  Then spotlight the speaker. Also use directional mics so you don&#39;t pick up any noise to the side.,Vulpeculae,2020-10-01T23:03:47Z,0
Only a fool would think changing the rules would get Trump to play by them.  Regardless of changes Trump will act the same way.,Unknown Valor,2020-10-01T23:03:42Z,0
I’ve enjoyed having some chuckles reading comments but my god! That we even have to try to come up with ideas to have a civilized debate with tRump just screams: VOTE HIM OUT!<br />ok.. carry on..🥴🥴,Jayanna Kelley,2020-10-01T23:03:21Z,10
"Jayanna Kelley <br />That’s so true, unfortunately.",Shay Lofton,2020-10-02T05:11:27Z,1
❤️❤️❤️❤️,MrLeooreo,2020-10-01T23:03:04Z,0
I didn&#39;t like you muting the debate to do commentary.  Can you stream the vp debate without doing that?  You can make comments afterward.,Beaux Richards,2020-10-01T23:03:03Z,0
Put them in different studios. Let them listen to each other but not on mike when the other is speaking. I don&#39;t know what is so hard about it? It is done on news casts all the time.,JamieMetz,2020-10-01T23:03:01Z,0
enforcing the rules is not changing the rules.  repuglicans is sooooo dumb.,Lorne Hampel,2020-10-01T23:02:58Z,0
I love this show. He articulates so well.,Fatmata Sanusi,2020-10-01T23:02:49Z,1
"Everybody is missing the point.  If trump had to sit there and be forced to answer forthright, he&#39;s well aware he would expose himself as the incompetent  buffoon he is.  It&#39;s much better coming off as an asshole then as a moron.",William Jandrisevits,2020-10-01T23:01:25Z,0
"When trump interrupts turn a wind machine at him and his beautiful head of hair ,what ya think?",Paul,2020-10-01T23:01:16Z,14
Brilliant idea man.,Anita Ortiz,2020-10-04T13:52:38Z,1
Best idea yet!,Jackie martin,2020-10-02T04:00:22Z,0
"&quot;Beautiful head of hair&quot; 😆  <br /><br />Speaking of his hair: &quot;He has acheived a minor miracle, he covers 90 percent of his head with 30 percent of his hair&quot; The late, great, Christopher Hitchens",Theresa Champagne,2020-10-02T02:44:32Z,3
👍👍,Boogie Nights,2020-10-02T02:30:15Z,3
"Sounds a little extreme, but perhaps each candidate could be in a soundproof booth, with doors.  Both can hear, but only one at a time would have a mic on.  The moderator asks the questions.  If a candidate should leave the booth to make a scene or simply choose to create mayhem, that person is ejected from the debate leaving the other candidate the remainder of the time to answer questions.",Jane Kelley,2020-10-01T23:00:59Z,0
how about duct tape,Jim Pinel,2020-10-01T23:00:53Z,0
Have them in two differemt places and have the debate over the screen. It would be easy to mute one person or the other,H Mattson,2020-10-01T23:00:46Z,0
"The problem with the whole system is that it expects people to act properly to their role. This is a dangerous to rely on the tradition of everyone being civil rather than have institution and structures in place to enforce. The electoral college isn&#39;t even a system for elections, States just decide which electors to pick and elections are just tradition on picking them, it&#39;s totally possible for elections to be phased out of American politics, and states just deciding which electors to send. These last 4 years have shown that the system cannot survive incivility, and changes must be made once we get this clown out of the white house, and his crew of cronies in Congress.",TU,2020-10-01T23:00:37Z,0
"Yeah, I thought about the &quot;chess clock&quot; idea too - and it could be implemented without a human having to do it manually by simply having a set-up where whoever&#39;s turn it is, they get their 2 minutes, and if there&#39;s level on the other guy&#39;s mic then the speaker&#39;s clock stops and the interrupter&#39;s clock runs down. The flaw, of course, is: what if the interrupter went first and already had their uninterrupted 2 minutes, so there&#39;s nothing to penalize? I guess you could carry over &quot;penalty time&quot; and take it off their next question, but then you&#39;d run into ridiculous scenarios where Trump wouldn&#39;t be allowed to answer a question at all, having accrued penalty time that wiped out their entire allowance in advance, or the final question would become a lawless free-for-all because he&#39;d have nothing to lose.<br /><br />As it stands, the only really workable way to do it would be to put them both in separate soundproof glass booths on the stage and cut the mic when it&#39;s not their turn. The optics of that would be absolutely terrible, though - it would look like a joint trial of two terrorists or something! And we&#39;d still be able to see Trump frothing and mouthing away in his cube, like some monster out of Cabin in the Woods...<br /><br />Honestly, it would be so much easier all round if Trump could just respect the damn rules and quit yakking. We shouldn&#39;t even need to be having this kind of discussion about how to control an adult - still less one who&#39;s already the President of the United States and is running for re-election!",Blatherskite,2020-10-01T23:00:14Z,4
5 year old man child as president,Miguel Dario Basto,2020-10-01T23:00:07Z,0
Give tRump $100 everytime he tries to interrupt Biden and he will shut up. After looking at his taxes is very clear that he needs the money.,Joe Meza,2020-10-01T22:59:58Z,0
Shock therapy should shut him up,Jose Duarte,2020-10-01T22:59:13Z,0
Here&#39;s a solution they&#39;re each in sound proof rooms. Speak your allocated time where the opponent can hear the other. But when its not their turn they&#39;re muted. Of course spoiled brat wouldn&#39;t agree but temper tantrum trump shouldnt get his way. So sick of his entitled bully attitude and everyone tolerating it. Oh yes the VP debate will be great - can&#39;t recall anything pence the puppet saying much - perfect passive partner trump needs,BeHuman,2020-10-01T22:59:12Z,0
stick him in another room and have him on a monitor,Jason Wolters,2020-10-01T22:59:01Z,0
"Turning off his mic is pointless, he would need to be gagged!",john frank,2020-10-01T22:59:00Z,20
Duct tape for his mouth‼️,terry dever,2020-10-02T02:33:39Z,1
"Separate rooms. As per remote working due to COVid-19 restrictions. Shout as loud as you like, your not on air.",Earth Man,2020-10-01T22:58:59Z,0
"They don’t need to change the rules. Disqualify the candidate whom is interrupting, end the debate, and allow the next “debate” to go directly to the other candidate to speak uninterrupted. High stakes.",spackermen,2020-10-01T22:58:52Z,0
An electrode in the balls every time he interrupts he gets a shock,Francisco Javier Ortiz,2020-10-01T22:58:51Z,0
"Put them in separate sound proof booths, one question at a time, 2 min limit and then cut the mikes",Bob Weber,2020-10-01T22:57:59Z,0
"Need one of those canes, like in the old days on stage where they grabbed the guy by the neck with the crook of cane and dragged them off stage. The man needs to go. I hope my intuition of Biden winning is true. I knew Trump would win in 2016, I knew it would be bad, I had no idea how bad it would be. We really really need him out of office! Thank you, I&#39;ve only just found you on You Tube, David. You are doing a great job!",Lorelei Bell,2020-10-01T22:57:35Z,0
"Put them in separate rooms, and they each get their own chance to answer the questions. Each candidate can watch the other on  monitor, when it&#39;s their turn, so they can respond.",Patti Tortora,2020-10-01T22:57:03Z,0
I wouldn’t do another debate with Trump.  I’d rather Biden do an interview with Joe Rogan.,C Robinson,2020-10-01T22:57:01Z,0
"Put them in different rooms split screen, moderator can talk to them both in real time, mic can be muted.",Real Sugar,2020-10-01T22:56:41Z,0
"No one can control a narcissist who wants to disrupt, I felt sorry for Chris Wallace, try as he may, Trump was simply out of control, as he will be in the next debate, it&#39;s who he is....",Merrily Munson,2020-10-01T22:56:34Z,0
Another precaution would be increasing  the podiums distance. This would help.,SAYITCLEAR,2020-10-01T22:56:25Z,0
Trump thinks it&#39;s &quot;da bait&quot;- a term he uses for the underage girls he&#39;s attracted to.,Li Li,2020-10-01T22:56:20Z,0
They should get Judge Judy to Moderate the next debates!! She doesn&#39;t take any bullshit!! And she will get Trump to shut up!!Guaranteed!!,Ken Leach,2020-10-01T22:56:17Z,0
I say they should include shock collars &amp; a cattle prod,JopesTV,2020-10-01T22:55:45Z,0
Put Trump in a sound-proof box. Cut his microphone and the box will do the rest. Perhaps his supporters/enablers will get the hint: Trump is not worthy of normal treatment.,T C,2020-10-01T22:55:41Z,0
"As Stephen Colbert said, “Trying to debate Trump was like trying to debate a leaf blower!”",artos1955,2020-10-01T22:55:29Z,53
Colbert also said &quot;the definition of insanity is doing the same thing over and over again and expecting Trump to shut up&quot;!,Jodi Fisher,2020-10-02T00:45:17Z,0
"Ah, pieces come together - I always wondered what hair dryer he uses...",Eric Steffen,2020-10-01T23:50:16Z,3
Lmao damn I don&#39;t like his comedy much but that&#39;s a good one.,FerociousPaul,2020-10-01T23:18:27Z,3
A leaf blower is significantly smarter than Donald Trump.,A T,2020-10-01T23:16:29Z,8
"trump supporters have the exact same common denominator as trump, and that is IT IS ALWAYS SOMEONE ELSES FAULT! If you know any trump supporters you will see the common trait.",Alfalfa,2020-10-01T22:55:12Z,1
2 soundproof booths would fix that.,Nancy Omand,2020-10-01T22:55:03Z,0
"Get rid of the debate format. The people want to know what each candidate is going to be doing on different subjects. This is impossible when tRump refuses to let Biden speak.<br />So, have a list of questions to ask each candidate. Bring them on stage individually and ask the questions so they can answer what THEY are going to do.<br />Keep the other candidate in a separate room, with no means of outside communication, so nobody can tell them the questions in advance.",David Edwards,2020-10-01T22:54:53Z,0
"cancel the other two debates, meaningless",Yifei Wang,2020-10-01T22:54:48Z,0
