comment,id,date,num_likes
"I can&#39;t imagine Trump debating, just straight-up discussing policy, in an orderly way. Can you? Can anyone? That&#39;s not who he is, at all. If he has to do that, he&#39;ll not just lose, but be revealed as an ignorant, scatter-minded simpleton. <br /><br />The only way to do this is to have them both in separate sound-proof rooms. When it&#39;s their turn to talk, their mic and camera turns on; while, otherwise, you can&#39;t see or hear them. I&#39;m sorry. But Trump will do the whatever he can to ruin discourse.",ncwordman,2020-10-01T22:22:02Z,0
Trump is a cooter toot,Michael Longoria,2020-10-01T22:21:54Z,0
The fact that we&#39;re having to handle our <i>president</i> like an out-of-control child does <b>not</b> say good things about our country. 🤦,Dane Miller,2020-10-01T22:21:46Z,149
no shit.....,samera ka,2020-10-02T02:33:34Z,2
"I love the USA. However, Trump has given such a bad name to your country in such a short time your international stature will never recover if he steals the election a second time. That would be the end of the &quot;greatest nation on Earth&quot;.",feodoric,2020-10-02T01:45:14Z,6
@Adam A-K Good things are said about the USA when it is under liberal management.,Doug S,2020-10-02T01:04:39Z,5
"Most civilized countries loved President Obama. God, I miss having an articulate and well-mannered president!",Jodi Fisher,2020-10-02T00:43:00Z,8
@reddy44 And to you. And for Nov 3rd.<br />Many thanks!,Earth Man,2020-10-01T23:26:02Z,4
"Sound proof boxes for both candidates. Even with his mic cut, Trump’s still going to run his mouth. Just put him on mute as we should’ve done when he started his birther bullshit against Obama.",WinterWolf216,2020-10-01T22:21:39Z,0
"Maybe they’ll use a spray bottle, like for pets.",Aaron Hamric,2020-10-01T22:21:24Z,0
I like the idea of sound booths. You can hear what the other person is saying but your mic is off. No interrupting.,SeaHag,2020-10-01T22:21:13Z,0
He simply needs to be told he can&#39;t participate if he can&#39;t follow the rules. Shouldn&#39;t change rules to adjust to the brat. Jesus!,northern girl,2020-10-01T22:21:08Z,0
"If his mic gets cut-off, he’ll spin it, and his supporters will buy it, that people are trying silence him and the “truth” 🙄",anxanxanx,2020-10-01T22:21:07Z,0
They need soundproof clear boxes to be in and put them real close together with the normal two minutes.,Aang The Airbender,2020-10-01T22:20:54Z,0
Mute the microphone.  I had to stop watching I caught a headache,kitt 2012,2020-10-01T22:20:41Z,13
Trump&#39;s cheese 🧀 slid off his Triscuit years ago! So he&#39;s not going to be able to handle a real debate.,J Miller,2020-10-01T22:20:34Z,20
😂😂,Russ Hall,2020-10-02T06:10:58Z,0
J Miller<br /> @shaylofton😂😂😂😂😂I always hated Tricuits😂😂😂,Shay Lofton,2020-10-02T04:04:30Z,0
"Trump will never change. He has and will continue to behave like a grown up child, with willful malicious behavior. He said it himself when he referred to his mother saying he was a perfect &#39;child&#39; so he stayed a child and believes he can&#39;t  do anything wrong. He is malicious, arrogant , and believes that his suspicions about those that oppose him are always true, in his eyes, of course.He is in his own world, and his world there is no room for those CV that contradict his will.",Teresa Villarreal,2020-10-01T22:20:30Z,0
"When trump starts interrupting, play the sound of a gunshot and he will be under the podium in a split second.",sylvia carmichael,2020-10-01T22:20:25Z,18
sylvia carmichael <br />@shaylofton-give him a bunker time out😂😂😂,Shay Lofton,2020-10-02T04:05:39Z,6
They need to have control over the microphones and live fact check,Sarah S,2020-10-01T22:20:22Z,0
Solution:<br />Soundproof cubicles.<br />Solves the issue of verbal interruptions for sure.<br /><br />Thing is Tronald Dumb will never agree to that. He is a troll and NEEDS to interrupt people that are talking about him for his (remaining) mental health.,ArschvomDienst,2020-10-01T22:20:12Z,0
I watched the debate with my wife on the national broadcast. I’m gonna use that shit show to convince her to watch it on YouTube with David as our host. It’s like her first introduction to the progressive side. She won’t be disappointed.,Trohelio,2020-10-01T22:19:55Z,0
Sound proof booth and or a cattle prod.,Patrick Mial,2020-10-01T22:19:53Z,0
Or a round table debate.. Trump behaves a little better when sitting,Jennifer Atwood,2020-10-01T22:19:51Z,0
Mike Pantz alone with a woman? How will he ever survive?,Jcewazhere,2020-10-01T22:19:44Z,0
"He tweeted, why would he allow them to change the rules, when he won the debate.",God is Good,2020-10-01T22:19:33Z,0
What about if they debate over  video chat  this way you can  mute the microphone and silent both candidates.... or. Been in a sound  prove cabin or box,Alejo El paisa,2020-10-01T22:19:19Z,0
They should wheel Trump out on a handcart and wearing a muzzle like Hannibal Lecter lol,Doug S,2020-10-01T22:19:14Z,1
"I came looking for this exact comment because if no one had said it I was going to say it!!<br />Maybe get Anthony Hopkins to moderate the next debate, with a nice chianti...",Modern Day Warrior,2020-10-02T00:15:39Z,1
"I feel like some people are going to go &quot;But Biden interrupted too, it wasn&#39;t just Trump!&quot; Of the 90 interruptions that occurred during the debate, Trump was responsible for 71 of them. That&#39;s 78% of the time. More than 3/4 of the time it was Trump. That&#39;s also 71 times in 90 minutes. 71 times in 45 minutes if you look at it as each side was supposed to get equal time to talk.",Gloria Platt,2020-10-01T22:19:11Z,0
"Hi David, a hung up I see with your proposal for the debates is that Trump will only have time for interrupting. As he truly has nothing of substance to say when it is his turn, I believe his strategy is interrupt and berate Biden which he would still be able to do under this structure. <br />I support the muted microphone plan. And I think the commission should present it as a fact and let the candidate drop out if he can&#39;t  rise to the challenge.",Chelsey,2020-10-01T22:19:09Z,0
Every time Trump derails he should be called out and questioned how he believes a self-proclaimed law and order president can&#39;t even follow simple rules.,Tor,2020-10-01T22:19:07Z,0
Soundproof booths for them both. Done.,garyoa1,2020-10-01T22:18:58Z,0
"David.. I think the debate should be broadcasted as if we&#39;re in a pandemic that calls for 10 or fewer ppl to be in a room. The moderator, Biden and Trump should go live from 3 separate places and only allow a split screen of the moderator with Biden and only the moderator and Trump for each 2 minute segment for each topic.. if someone has an ear piece.. I wouldn&#39;t care😶",Jennifer Atwood,2020-10-01T22:18:54Z,0
Making up time for time taken sounds like a perfect remedy to me. It would hold drumpf&#39;s feet to the fire.,Sherry Roberts,2020-10-01T22:18:45Z,0
Maybe they should just be informed that they are role models and should learn to listen to each other because that is what people do that care about others&#39; feelings.,Davids Videos,2020-10-01T22:18:43Z,1
That would work on the average person but.. tRump doesn’t respect people or rules.. sigh..,Jayanna Kelley,2020-10-01T22:31:21Z,0
"I was honestly very impressed with Chris Wallace. He handled the situation he was given as best as anyone could, he oftentimes transitioned to his next question by referencing something a candidate said, and his questions were well thought out. He remained mostly composed and cordial with both candidates even with Donald&#39;s constant whining. Good work for Fox News&#39; last decent reporter.",Joseph Koslov,2020-10-01T22:18:40Z,1
This is pretty much how I feel too. A lot of folks have knocked him but I think he couldn&#39;t have done any more to shut Trump up given the actions available to him. Good reporter who apparently moonlights as a daycare supervisor...,Modern Day Warrior,2020-10-02T00:33:51Z,1
The commission should have known how he behaves. This country is pathetic!,Trish Brown,2020-10-01T22:18:30Z,42
Maybe a mild electric shock every time trump speaks out of turn.,joeconsumer,2020-10-01T22:18:30Z,0
They could use a chess clock.,Erlix Erlix,2020-10-01T22:18:26Z,0
Trump changed the rules when he started talking over everyone,DARRYL PHILLIPS,2020-10-01T22:18:15Z,48
Changing the rules for someone who doesn&#39;t follow rules is pointless.,Brian Campbell,2020-10-02T04:10:52Z,2
There will not be any more debates. Trump said that Biden will not do any more.<br />That means Trump will not do any more. This is for sure.<br />I am sure that was decided from beginning. Only do Fox.<br />And of course no VP debate.,Lasselucidora,2020-10-01T22:17:57Z,0
"Also - first tRumps behavior would have had him disqualified within first 5 minutes- then, as worst as the debacle of the non-debate, how his cronies spin it in his favor",Louise Gamache,2020-10-01T22:17:52Z,0
In a real debate when you break the rules you are penalized time. Every time he interrupts just add two minutes of mute time. After five minutes Trump will have earned himself enough penalties for the rest of the debate and will just have to stand in silence for the rest of the time.,Miguel Cruz,2020-10-01T22:17:42Z,0
Stick a dummy in his mouth!,John Duncan,2020-10-01T22:17:21Z,0
Just to get the story straight. Joe Biden started the interruption. The moderator ‘Wallace’ interrupted trump 76 times and Biden only 15 times. Before you make false and stupid claims you need to see what actually happened.,Henry,2020-10-01T22:17:14Z,1
What about-leave the rules alone; put a muzzle on don,**Rebecca,2020-10-01T22:17:09Z,0
"I think it would work if, the candidates are each in an enclosed booth with speakers to hear the other when they talk, hear the moderators questions but, block the mic of each candidate when its not his turn! Therefore no interruption of the conversation.",AirleadJoe Miranda,2020-10-01T22:17:05Z,0
Put them in sound-proof booths like 60s TV Game Shows...,TheTRUTH,2020-10-01T22:17:04Z,0
Do they really need other rules? How about enforcing those already in place? What does the candidate claiming to represent law and order think about enforcing the rules he has  already agreed to?,Tor,2020-10-01T22:16:44Z,0
Put each one in sound proof booth. NO REELECTS CLEAN THE HOUSE AND SENATE AND TRUMP.,Don Lowe,2020-10-01T22:16:29Z,4
"Trump has been a bully his entire life. It&#39;s what he was taught. The media has also greatly enabled his behavior.  Nothing short of mechanical measures will work. I&#39;ve seen some good ones in the comment section. Here&#39;s a few of mine. Electronic dog collar on high.  A Whack-A-Mole type setup. A circus dunk tank booth filled with juice from rotten fruits and vegetables. Not particularly hazardous, but damn smelly. If he quits, put Alec Baldwin in there and just ridicule him for an hour. It would still be more productive.",BullRott,2020-10-01T22:16:29Z,0
Whats sad is after all this people will still vote for him,jeff jones,2020-10-01T22:16:24Z,0
Give Trump a soother when Biden is speaking,D M,2020-10-01T22:16:19Z,0
What if they go into a soundproof glass booth they can hear each other’s answers but no one could hear them while their booth mic is off?,Terri Tuazon,2020-10-01T22:16:03Z,2
"They need to cut the mics for both candidates, plain and simple.",Taj C.,2020-10-01T22:16:03Z,0
It is difficult for an adult to converse with a child.,Rob Robbey,2020-10-01T22:16:00Z,15
Good idea.,Grace Knopp,2020-10-01T22:15:53Z,0
Put tRump on a naughty step or sin bin if he won&#39;t shut up. Same applies to Biden just to be fair. I know Biden wouldn&#39;t object to that rule.,Kerry Fry,2020-10-01T22:15:43Z,0
He&#39;s going to back out and then lie and say Biden didn&#39;t want to debate.,Zay Mogul,2020-10-01T22:15:18Z,0
Kamala will demolish pence,D M,2020-10-01T22:15:06Z,0
"Put them in soundproof booths or partitions, with mikes that are controlled by the moderator.  You can even put a big clock up that both can see that counts down from the amount of time they&#39;re allocated so they know how much time they have left.<br /><br />Trump would never agree to it because then he would have to discuss policy, and I doubt he has any.",Eric Chin,2020-10-01T22:15:05Z,0
The perfect solution is recreate the format of &quot;Around the Horn&quot; from ESPN.  Have Biden and Trump on a screen and so they can be muted when its the other&#39;s turn to talk.,W.C. D,2020-10-01T22:14:59Z,0
What they need on  humpty trumpty is a shock collar. Every time he butts in  give him a zzapp!,judy dunsing,2020-10-01T22:14:56Z,0
He doesn&#39;t want to change rules?.<br />Have him sit it out and give Joe all the air time.,AnnieFannie PuddinPieKissedtheboys&madethemcry,2020-10-01T22:14:56Z,0
SOUND PROOF BOOTHS!!!  Can&#39;t hear him if the mic is off!!!,Steven Couto,2020-10-01T22:14:35Z,0
Stop and kick out audience members who remove their masks,D M,2020-10-01T22:14:31Z,15
Can do it on zoom/vertually,Grace Knopp,2020-10-01T22:14:15Z,0
"Interruptions, even with a blocked mic, should cost not only the time of the interruption, but also a penalty for even more deducted time.  Also, the moderator can call for a fact check and if there are lies, then that would incur a penalty in lost time--in addition a candidate can call a fact check at least three times if the moderator does not catch it.  If one makes a personal remark of the other, then the remarked candidate can do a 20 second rebuttal. However, it could be that due to penalized time, a candidate may not have time for a rebuttal, or even to answer a question.",Jorge Garcia,2020-10-01T22:14:15Z,0
"Put each of them in a sound proof box, when their time is over the power gets cut.  Like a game show.",Eric Williams,2020-10-01T22:14:13Z,14
&quot;Game show&quot;  how ironic:  reality show star president/game show debate format😆,Theresa Champagne,2020-10-02T02:38:19Z,0
Someone else mentioned this and I think this is a brilliant idea!  It&#39;s crazy that we have to go to these extreme ideas because of this one child president. Ugh!,Theresa Champagne,2020-10-02T02:36:26Z,0
"Just put a covid screen between them both, then have the opposing mic automatically turned off during each candidates allotted time.",Brian Gilligan,2020-10-01T22:14:01Z,0
Put the candidates in sound proof booths.,Terry Webb,2020-10-01T22:13:50Z,0
"How about rubber bullets, or a taser?",iMouse,2020-10-01T22:13:42Z,0
You know as bad as Trump is it&#39;s a good thing because he is so bad that it forces the hand of committees to actually change things.,Non Existing,2020-10-01T22:13:29Z,0
The old &#39;cone of silence&#39;?? It may put a stop (or at least slow down) to all the K.A.O.S,Susan McKenzie,2020-10-01T22:13:22Z,0
"The moderator needs a &quot;Bullshit&quot; button, using clips from every film that ever used the word.",Justin Morse,2020-10-01T22:13:20Z,0
Changing the rules will more likely work in Trump&#39;s favor. Let him talk himself out of the Whitehouse.,Joe Gac,2020-10-01T22:13:08Z,1
"Yes - two more 90 minute periods of him behaving like a toddler is worth the pain, I think...",Modern Day Warrior,2020-10-02T00:13:55Z,1
"Bear in mind the debates are a pointless waste of time, so who cares. At least they’re funny.",David Heffron,2020-10-01T22:13:00Z,0
"😎 Good grief. NEW rules are as useless as OLD ones, to someone who follows NONE, because there&#39;s ZERO accountability.<br />SUGGESTION: the SOCCER ⚽ Solution!<br />First interuption: yellow card. WARNING.<br />Second interuption: red card. DISQUALIFICATION.<br /><br />(But soundproof booths with mics that you can mute seems to be the best idea. Keep &#39;em honest.)",BigMamaDave X,2020-10-01T22:13:00Z,0
"I just don&#39;t understand the hypocrisy<br /><br />Trump will say &quot;Well Joe, it is the tax laws that you formed during the Obama administration that let me get away with not paying taxes.&quot; <br /><br />Yet when anyone DOES try and change tax laws to stop that kinda behaviour it&#39;s all &quot;That&#39;s evil socialism!&quot;<br /><br />USA seems caught in a vicious cycle of looking at anything that strengthens the rights of the workforce or equalising the economy as radical leftism. When really it&#39;s just fairness",Hayden Lafourcade,2020-10-01T22:12:56Z,0
"that depends a lot on the mics. If you use broadcast mics, and most generally dynamic microphones, you won&#39;t hear much the screaming pig in the back. don&#39;t use lapel microphones as they are condenser mics and will capture it. If you separate the candidates by a glass, you will have to put monitors but nothing that a good sound engineer can&#39;t handle.",Of drums and chords,2020-10-01T22:12:55Z,0
are they going to shut off Putins mic when Biden can&#39;t handle the heat?  Pathetic!,Tungsten Wall,2020-10-01T22:12:52Z,0
I hope Pence tries what Trump did with Kamala. He&#39;ll look like a big ol idiot.,Noice one,2020-10-01T22:12:41Z,0
If the debate rules are gonna change they must fact check Trump AND JOE BIDEN no ignoring joe biden &amp; trumps constant lies,Emblemed fate,2020-10-01T22:12:31Z,1
"Separate rooms with control over their screen time.  Trump is such a child!  Sorry, that&#39;s insulting to children, isn&#39;t it?",Susan Lund,2020-10-01T22:12:22Z,0
"I hope that if Trump&#39;s mic is turned off, that Donald will not move closer to Biden to talk really loud and his voice will be picked up on Biden&#39;s mic. Honestly I don&#39;t think they should have another debate.😐",barbara grazer,2020-10-01T22:12:17Z,0
Both candidates should be muted the whole time except when it is their turn to speak. This idea of muting them only if they break the rules will only lead to accusations of favoritism.,Strodie567,2020-10-01T22:12:15Z,0
Regarding Trump being so loud that he would be heard through the other microphones when his is muted:  My understanding is that some noise-cancelling technologies work by picking up the noise with an external mike and &quot;subtracting&quot; that from the earphone signal so in the end the noise gets cancelled out.<br /><br />If that is correct: Both candidates have mikes. So they already have very clear signals from them.  So apply similar signal processing to drastically reduce the volume of the &quot;muted&quot; candidate when the other one (or the moderator) is speaking.,Strodie567,2020-10-01T22:12:39Z,0
"Each candidate stands in a lighted, sound-proof both. When their time is up, the mike is turned off, and the lights also. So they stand in the dark,where they can be neither heard nor seen. Or,each candidate is fitted with a dog training shock collar, ...",Martin Buinicki,2020-10-01T22:11:55Z,0
"How about filming Trump and Biden in separate sound proof sets and then switching to the other after 2 minutes. Wouldn&#39;t that tick off Trump, lol.",brenda mc bride,2020-10-01T22:11:47Z,0
"Right, listen...There&#39;s no way that The Orange Cock-Womble will ever agree to having his mouth cut off in any future debates. <br /><br />And if by some miracle he does...the future moderators won&#39;t have the balls to actually do it.",Jamie Clarke,2020-10-01T22:11:43Z,0
"Trump is playing a simple but dangerous game. He doesn&#39;t have a plan for the future of our country so he creates chaos as a distraction. He doesn&#39;t want to come off as being an inept president, which he is. The thing is, his very loyal followers are prepared to act a fool. What they don&#39;t realize is, Trump doesn&#39;t care about them or the country. He wants four more years so that he can continue to build more acres to his swamp.",Shawn T,2020-10-01T22:11:41Z,0
If moderators would stay neutral it wouldn&#39;t happen,Mauricio Lamas,2020-10-01T22:11:35Z,0
"The world is begging you, get your friends and family members in the purple state counties to vote, the electoral College will swing it.. DO IT",The Painters Painter,2020-10-01T22:11:30Z,1
David u any USA people Texas is about to pass NJ in deaths ether tonight or Friday😢😷👍👍👍!!!!!!!!,Jackson Reid,2020-10-01T22:11:26Z,1
"I agree with Wallace.  Americans need to see the spoiled child brat that tRump is. <br />Watching tRump being a bully having a temper tantrum. Being rude, constantly interrupting. Shows Americans who are undecided that rules don’t apply to tRump. He can’t comprehend the rules of an ADULT DEBATE. <br />This is Biden opportunity to SHINE.",devorah711,2020-10-01T22:11:23Z,0
Trump knows he screwed.....he thinks he can recouped undecided voters in the next four weeks.,Bob Fuhrwerk,2020-10-01T22:11:23Z,0
"Those are just more rules that hes not gonna follow... Cmon, Dave",Yello Duzzit,2020-10-01T22:10:33Z,12
"Mute mics form the start, let Chris Wallace cleanly ask the question. Then unmute the one who answers. After the answer mute them. Then unmute the rebuttaler for their 2 minutes. Problem solved.",H The ERB MAN,2020-10-01T22:10:31Z,0
change the debate format by making it a knife fight,starwarsnerd95,2020-10-01T22:10:25Z,0
No its not,Mauricio Lamas,2020-10-01T22:09:59Z,0
"Here&#39;s my idea: get John Bercow to be the moderator and get him to play the Parliament Speaker role. Whenever someone interrupts - &quot; <b>ORDERRRRRR</b> the president/vice-president must be heard. Continue.&quot;<br /><a href=""https://www.youtube.com/watch?v=H4v7wddN-Wg&amp;ab_channel=tagesschau"">https://www.youtube.com/watch?v=H4v7wddN-Wg&amp;ab_channel=tagesschau</a><br /><a href=""https://www.youtube.com/watch?v=OoHQiRXgMG0&amp;ab_channel=TheSun"">https://www.youtube.com/watch?v=OoHQiRXgMG0&amp;ab_channel=TheSun</a>",Adam A-K,2020-10-01T22:09:53Z,1
"I’m with Nancy, we don’t need anymore debates, Biden should skip both.",BBlack6868 LiveTrading,2020-10-01T22:09:51Z,11
"The debate committee needs to cancel it. Otherwise if Vice President Biden didn&#39;t show, Donald will call him a coward.",Jodi Fisher,2020-10-02T00:47:28Z,0
Dominic Parker - Yes I agree. I do know living were I live (suburban neighborhood) many of my neighbors who haven’t followed tRump were appalled at his behavior! I was secretly cheering inside! 😃😃,Jayanna Kelley,2020-10-01T23:52:27Z,1
"StayGold .....Arrogant only?......how about immoral, incorrigible liar, con man.....imbecile, literally and clueless about any and everything.<br />All talk and no substance. I can go on with more details but I wish to be brief.<br />We as a country need normalcy , stability .....off of this roller coaster train wreck. To at least get our bearings again. Here is the sage saying that was once blundered by another Republican President some time ago.......Fool me once shame on you( Trump) , fool me twice shame on us ( America). I can accept 4yrs ago people were like “give him a chance” .....” he’s a phenomenal businessman “ , although I thought different but the country didn’t know him as well as New Yorkers, his hometown. <br />Now that’s not the case , there is no ignorance to justify this lack of judgment. It’s more poor judgment period. So no I cannot relate to the dilemma of being undecided with these two choices. <br />Peace",BBlack6868 LiveTrading,2020-10-01T23:51:40Z,1
"After 4yrs of his shenanigans, and this atrocious debate , and still undecided....they should have their right to vote forfeited. <br />Maybe it’s time for a Constitutional Convention to address a few issues. Amendments are needed to modernize our Law of the Land.",BBlack6868 LiveTrading,2020-10-01T23:07:22Z,2
"Dominic Parker - Besides, tRump is already bragging at last rally how he ‘owned Joe’ &amp; of course add in numerous other lies!",Jayanna Kelley,2020-10-01T22:43:55Z,4
LMAO!  Republicans - who went insane because Al Gore sighed during his debate with Bush. I say put a shock collar on Trump!,Janpre2001,2020-10-01T22:09:50Z,0
Electric shock might work!,Tony B,2020-10-01T22:09:50Z,1
"Treat it like chess.  If person wants to speak they press the button, then press it again to stop.  They control their own time.  Mike stays off if you dont press the button.",Joseph Holly,2020-10-01T22:09:50Z,0
"Trump&#39;s microphone mute may not help Biden focus on his answer. His ceaseless clowning will still disrupt Biden. It&#39;ll have a negative impact on Biden, too.",Young,2020-10-01T22:09:42Z,0
Remote debates. Put them in different rooms. Let the moderator mute them.,Adam Burns,2020-10-01T22:09:28Z,0
"I dont think there&#39;s anything you can do other than say &quot;If you interrupt 3 times, we&#39;re going to end the debate&quot;",ortomy,2020-10-01T22:09:24Z,3
ortomy - I was just ‘daydreaming’ of how awesome it’d be if trump escorted out of the venue &amp; moderator could just finish up asking Joe the remaining questions without trump around.. <br />Actually I thought he did pretty good with the distractions tRump was causing. <br />One of my friends growing up stuttered &amp; guess I’m a bit protective over that..,Jayanna Kelley,2020-10-02T00:47:49Z,0
"@Jayanna Kelley idk if its a good idea to let Joe keep talking though. It increases the chance of blunders, which he&#39;s capable of doing. Its a really tough situation.",ortomy,2020-10-02T00:38:53Z,0
ortomy - Yes he will.. to bad they couldn’t just escort him to the door &amp; send him on his way.. Joe could finish up answering questions after tRump expelled. I know.. just wishing 🤷‍♀️,Jayanna Kelley,2020-10-01T23:57:20Z,1
"Jayanna Kelley trump is going to just keep interrupting. This “giving more time” is a gentleman’s agreement. No matter which rule you give them, trump will keep interrupting. Even if his mic is off, he’ll interrupt and distract Biden. Like a child",ortomy,2020-10-01T22:36:08Z,4
Or add that the disrupter has to leave &amp; the other gets the rest of the time uninterrupted?,Jayanna Kelley,2020-10-01T22:34:49Z,0
