comment,id,date,num_likes
OAN is just another Faux news!!! Actually worse than Faux news. It is NOTHING BUT TRUMP PROPAGANDA!!!,Anna Jorgensen,2020-08-05T19:34:53Z,0
"Causing a problem, then pointing to it like someone else did it = Every American republican.",TruthAndMoreTruth,2020-08-05T19:31:07Z,4
"When every vote is actually counted, it takes longer.<br />Go figure.",TruthAndMoreTruth,2020-08-05T19:29:15Z,2
If he is so worried about fraud shouldn&#39;t he and Barr being working to insure that there isn&#39;t any as well as making sure the election runs as smoothly as [possible instead of wining about it . Really all he saying is that him and his administration aren&#39;t competent enough to protect the your democracy or am i missing something? Only Trump would use his own incompetence as an excuse for his failure and still have 42% support..i don&#39;t get it.,Shane Whitbread,2020-08-05T19:27:12Z,0
"A petulant egotistical self-serving moron, What more needs to be said.?",Frank Crossword,2020-08-05T19:06:24Z,0
"I live in Montana. We have always been able to vote by mail for any reason, or go in person. They mailed ballots to everyone for the primary this year. It worked fine. I even had moved and thought I had changed my address on my voter registration,  but I hadn&#39;t. I got a letter from the election board that they&#39;d received my ballot returned so I had to pick it up from the election office. The system worked.",Sarah Otto,2020-08-05T18:58:02Z,0
"You can always spot OAN, never have the mask on",kbernacchi,2020-08-05T18:50:59Z,0
Freudians might wonder how many times Trump was called a &quot;disgrace&quot; by his father.,Rich Sackett,2020-08-05T18:50:18Z,1
"In 2000, Bush v. Gore was decided months after the election. I don&#39;t remember anyone calling for a do-over.",Rich Sackett,2020-08-05T18:47:33Z,0
Trump is the biggest KAREN EVER!!😂😂😂,David Brown,2020-08-05T18:45:49Z,0
5 straight minutes of lying.<br />Just the other 23 hours and 55 minutes and we can have &quot;A Day In The Life of Dotard Trump&quot;,Sandy .Smith,2020-08-05T18:42:37Z,0
Donald Trump is so pathetic he’s trying to suppress voting. And the Republican Zombies are all for it. Freedom my ass.,Justin PG,2020-08-05T18:42:10Z,0
"Greatest criminal of all time. He paved his way to white house by deception of very nice Christians .He lies just like that no reason. he is a all  time  all star, he is all time  lying golden boy  ,nobody seen lier like  him in the world, he lies to everyone American or none American. He single handedly distrtriod Christians fate. He once  again him alone  weakened American government so bad that can&#39;t catch up with pandemic . He will cause disturbances in America by lying to his base ,he is relentless to get elected to office one more time  that will be  the end of mighty America that we know, because  SMART Mr. Putin knows him very well. WEAK America is not good news to Democrats countries,ie divided EU , Hongkong . We pray for you",Hossein Sadighi,2020-08-05T18:41:30Z,0
5 min???Is this a New Record??😂🤣,Sparky,2020-08-05T18:37:10Z,0
"What an incoherent, pathetic toddler he is.<br />He is absolutely PETRIFIED of being declared a loser by the American public in the forthcoming election and will do ANYTHING to  stop that from happening.",Sandy .Smith,2020-08-05T18:28:11Z,0
"If Trump is so afraid of fraud, why wouldn&#39;t the White House and the GOP support efforts to help prevent election fraud by foreign powers??!! Trump and his GOP are opportunists and hypocrites!",John Patist,2020-08-05T18:26:00Z,0
So if he wins it&#39;s ok he believes it all but if he loses its a fake and a lie 😂😂 how old is he again hahaa,Nick Jones,2020-08-05T18:24:07Z,0
Before every one of Trump&#39;s lies...    &quot;Kayleigh...  hold my beer!&quot;,2thePtBassTuT,2020-08-05T18:22:05Z,0
"&quot;Why do you think ppl are pushing it[mail in voting] so hard&quot; <br />Gee, covid?",Robin Dawn,2020-08-05T18:18:53Z,0
WE WILL VOTE in NOVEMBER<br />The writing is on the wall;. and<br />it says : YOU&#39;RE FIRED ‼️,Martin Smith,2020-08-05T18:18:20Z,1
Wait if the post office can&#39;t handle mail in ballots how can they deal with tax returns.  Can we cancel those too?,Matt Besser,2020-08-05T18:13:38Z,0
"Keep pushing that idea, less of your own supporters wont vote by mail for you.",Wave Logic,2020-08-05T18:11:15Z,0
Anti-American Trump should be banished from the country.,Lucis Ferre,2020-08-05T18:02:40Z,0
He acts like every ballot will be mailed on the same day and suddenly the post office would be scrambling.,Benjamin Turner,2020-08-05T18:02:01Z,0
Small thousands WTF Ta loco,Pauline Gonzales,2020-08-05T18:01:29Z,0
Small thousands.. ok thats nice. Keep coloring.,Ultimate Dx3,2020-08-05T17:59:45Z,0
"Donny don&#39;t worry yourself the post office will get it done, not like you and the negative liberty republicans always trying to tear everything down.",tim ahlf,2020-08-05T17:58:26Z,0
The only mercy is that it was only 5 minutes of his insane gibberish instead of the usual hour long garbage dump.,Marky E,2020-08-05T17:49:07Z,0
"They say! WTF is &quot;They Say!!!&quot; <a href=""http://www.youtube.com/results?search_query=%23agenttang"">#AgentTANG</a> is at it again! <a href=""http://www.youtube.com/results?search_query=%23lyingking"">#LyingKING</a>",Terry' Davis,2020-08-05T17:45:33Z,0
We should be able to vote online by now,Jonathon Lawver,2020-08-05T17:43:19Z,0
He&#39;s been exceptionally orange lately.,Darin Gooch,2020-08-05T17:33:10Z,0
"You have to take a long deep breath ahead of this to bear watching and listening to HIS ROYAL IGNORANCE as he lies <br />and misleads continuously to trick his his pathetic followers. Please explain voting by gop owned voting machines <br />which the gops have used to steal elections in the past. I remember Diebold from the lying despicable war mongering <br />Bush administration. Is this what we want? No not the majority of us - Just the Orange Demon &amp; his dumb-assed adorers. <br />(AND THE DONORS) Why do they find his sleazy ugliness attractive? Who knows?  At the very least it is horribly, horribly bad taste.<br />(In the case of the donors it&#39;s psychopathic greed as usual)",Regina White,2020-08-05T17:32:53Z,0
Just making up excuses for when he loses,Sarcinotnarci,2020-08-05T17:26:07Z,0
"You have to admit, for people that do not think, do not look things up to see what&#39;s really true, Trump sounds good, just because he&#39;s saying it. All the verbage like &quot;It was a disaster,&quot; It&#39;s chaos,&quot; &quot;It&#39;s all a mess,&quot; gets people all stirred up and because they don&#39;t think or &quot;get&quot; that this guy seems to lie like he wakes up in the morning, they believe and support him.",Margaret Hofstetter,2020-08-05T17:12:48Z,0
"Tactic #1: depress the vote and win (his only chance)<br /><br />Tactic #2: if he loses, he&#39;ll claim fraud and his supporters will never believe it was legitimate<br /><br />I&#39;ll be forever convinced this guy is not working for this country.",binocular rivalry,2020-08-05T17:08:21Z,0
"Trump hopes, that by delaying the healthcare plan for a month, all Americans will have died from Covid so nobody will mind when he says there was no intention to release a plan. Surely, he will find something to blame the Democrats in a month, for not releasing his plan then.",Ivo,2020-08-05T17:07:21Z,0
"Hi all, it hurts the soul to wath him speak. I&#39;m so sorry for the american people 😞 You know, being from Norway, we do really love America and the american way of life, but with trump and all... I really hope it will be a change after November, and I hope all of you are safe! Best regards from Norway 🇳🇴 😍 🇺🇸",ivansen,2020-08-05T17:06:51Z,0
OAN is a threat to democracy,binocular rivalry,2020-08-05T17:05:20Z,0
I had a friend who’s whole family voted for trump in 2016. Her dad worked (or still works) at the post office. Our different political views ended our friendship back in 2018. She was tired of me talking shit about trump. I wonder what she and her family think about him now lol,Armando Ramirez,2020-08-05T16:58:44Z,0
"The more he goes on about that, the more stupid Republicans will be convinced that they shouldn&#39;t vote by mail and many of them won&#39;t be able to vote in person either. Please let the idiot go on his rant for as long as he wants to.",Tim Laursen,2020-08-05T16:57:52Z,0
Ok...that&#39;s ridiculous...,stefanie smith,2020-08-05T16:52:49Z,0
Am I dreaming or is this buffoon still in office... Someone wake me up please...,Shaheeda William,2020-08-05T16:49:54Z,0
"How post office have prepared to christmas??? How americans who live abroad, have been voting before???",Trome Tromme,2020-08-05T16:46:49Z,0
"Donald Trump lies? What else is new?  People are quick to criticize Trump yet they keep Trump around—I’m the type of person that believes that talk is cheap, I get up and do something about the situation—For example, If you see a house on fire, would you stand there and complain about the fire or are you going to get up and call the firefighters—!?  Ladies and gentlemen, talk is cheap—We need to get up and do something about Trump—We all know that Trump is a train wreck and gets in his own way—Instead of complaining about Trump, let’s get up and start a petition to get Trump out of Office—Trump is NOT qualified to be President or to run for the Presidency because he is a Russian who wants to kill us.  Trump has plenty of help in the Senate—Moscow Mitch McConnell sold America to Russia and should get the ultimate punishment for doing such a thing—!!!!",Michelle Swanson,2020-08-05T16:39:54Z,0
"In Australia we call such questions &quot;Dorothy Dixers&quot;. Phony fake president, running scared that his re-election chances are slipping away. Good riddance.",Thor Friis,2020-08-05T16:24:15Z,0
He really is obsessed with the entirely tv concept of knowing the result night of.,J D S,2020-08-05T16:04:08Z,0
oh get a life...,Donna Rasmussen,2020-08-05T16:00:17Z,0
"Trump must LOSE at all costs. There is no other solution, it&#39;s the FINAL SOLUTION.",Dylan Fahey,2020-08-05T16:00:03Z,0
Why is donald even lying about the explosion in Beirut?<br /><br />He is simply pathological.,Ron Mantei,2020-08-05T15:53:56Z,0
Love your channel. OMG that POS is such a total freakin moron.,Anna Paul,2020-08-05T15:51:34Z,0
"Yeah, my lapdog DeJoy is just so stressed about this. Give him a break.... 😆😆😆😆😵😵😵😵🙄🙄🙄🙄Kiss my tutu you lying you know what. Swamp his puppy at PO with SO MANY mail INS that he&#39;ll be forced to quit!",natalie harless,2020-08-05T15:38:08Z,0
"A guy who works for a customer of mine who I like, who seems pretty level headed and reasonable, happens to be a Trump supporter and we got into this big argument a couple of days ago. <br /><br />He literally said “Trump will win in a landslide, and if somehow he loses I guarantee you there will be a civil war....and guess what? We’re gonna win because we have all the guns.”<br /><br />This is real life now. This is our “great America”.",b0nkert0ns,2020-08-05T15:37:03Z,0
"I sure appreciate your breakdowns on Trump&#39;s live blatherings. I always watch your post synopsis. I&#39;m sorry you have to listen to him just to speak truth to power. Thanks, David.",natalie harless,2020-08-05T15:33:16Z,0
Unfortunately his fevered supporters eat it all up. They devour his bullshit and believe every word. He plants these reporters and pre feeds them questions.,zebonaut smith,2020-08-05T15:31:03Z,0
"Is it just me or does he look more orange than usual? A sincere question, not to mock or anything.",pHD77,2020-08-05T15:26:59Z,0
Trump and his people are the only disgrace I see. Pathetic.,Tina RockAnn,2020-08-05T15:16:55Z,0
He laid it on extra thick for this briefing...both the lies and the orange makeup.,Sam West,2020-08-05T14:59:45Z,0
"<a href=""https://www.youtube.com/watch?v=N6rHlX3K9N4&amp;t=12m45s"">12:45</a> YOU LIED!",Donnie Brasco,2020-08-05T14:56:57Z,0
"He is babbling on because he knows he is done, a fat pig in a blanket fry him like bacon. Making excuses for losing while he hasn&#39;t even lost yet.",john frank,2020-08-05T14:52:42Z,0
His new health care plan?He doesn’t have a new health care plan...just wait and see.,Valerie Angell,2020-08-05T14:51:04Z,0
"NOW TELL ME...WHERE WAS SHE STANDING <a href=""http://www.whitehousemuseum.org/west-wing/press-briefing-room.htm"">http://www.whitehousemuseum.org/west-wing/press-briefing-room.htm</a>",Donnie Brasco,2020-08-05T14:50:37Z,0
Geez! They all just sit there and let him lie his off without fact checking in the least. The only disgrace this nation is currently suffering from is waiting three months to get rid of useless ass.,john frank,2020-08-05T14:49:31Z,0
"I will be forever amazed that Trump has the number of supporters he has....and that they all think he&#39;s some tough guy strong man with his business sense. He can barely speak, can&#39;t read, can&#39;t read simple graphs, he whines and cries all the time, lies so much he can&#39;t keep track, lies about things that are easily able to be proven (crowd size for example), doesn&#39;t care about people dying, and is so corrupt. Yet his &quot;base&quot; worships him. That says all I need to know about a person",Jenn Leah,2020-08-05T14:47:36Z,0
YOU ARE THE LIE,Donnie Brasco,2020-08-05T14:41:53Z,0
"ICYMI - at the <a href=""https://www.youtube.com/watch?v=N6rHlX3K9N4&amp;t=3m31s"">3:31</a> mark he&#39;s talking about how the NY PRIMARY should have gone and says &quot;everyone would have loved it&quot;.  He sees Elections as a form of entertainment, a spectator sport to thrill the (low?) class of people that are entertained by such banality.  To him the Presidency is like hosting a game show!",Jerry Dellasala,2020-08-05T14:40:41Z,0
He projects onto other&#39;s exactly what he is doing! It&#39;s So telling.,Angela Hall,2020-08-05T14:35:14Z,1
I am so sick of the DJT ads before every video! It&#39;s either Trump or Trump Jr. Asking for money or tell me how great I am.,Angela Hall,2020-08-05T14:34:38Z,0
"He knows nothing about the post office!! He also the says, &quot;I don&#39;t know, ask the post office&quot; he only cares about the post office because of mail in ballots.",Angela Hall,2020-08-05T14:33:05Z,0
"Go back to the bunker, tRump!",Dorcia,2020-08-05T14:32:44Z,0
"Calling the OAN reporter by name because he shows them respect, but just calls everyone else, fake news..",Angela Hall,2020-08-05T14:27:59Z,0
So Trump&#39;s mail in ballots should all be invalidated.,Kenneth Nash,2020-08-05T14:21:30Z,0
Yes he did!! I was laughing 😆 my ass off!!! I knew he would be caught!! Wow! How many lies now!!!!🇺🇲,Georganna Smaltz,2020-08-05T14:20:19Z,0
But did Trump read the questions they gave to OAN to ask?,Kenneth Nash,2020-08-05T14:20:01Z,0
"We watched this question and response last night, and we could tell by listening to the question and by his response, that it was an OAN question.  Almost like they are leading him to make an executive order to ban absentee ballots.",Josh R.,2020-08-05T14:16:00Z,0
"<a href=""https://www.youtube.com/watch?v=N6rHlX3K9N4&amp;t=0m01s"">0:01</a> &quot;lied for 5 minutes &quot;..if we could be so lucky.",johnpro2,2020-08-05T13:50:16Z,0
He must of been tired sorry he wasn&#39;t his A game he&#39;s gone longer before,Loraine Drosophila,2020-08-05T13:30:29Z,0
"Five minutes of LIES by Donnie, and the ONLY thing he got RIGHT was.....&quot;I guess!&quot;  PLEASE do not debunk this conspiracy it is too much FUN to watch...  &quot;Trump Friendly media...&quot; isn&#39;t the tRUMP organization trying to BUY OANN?",fooman2108,2020-08-05T13:14:22Z,0
"David, I&#39;m not sure but I think you might be mispronouncing Kayleigh&#39;s surname.",Charlotte,2020-08-05T13:09:09Z,0
Virtually all of the recent voter fraud and vote harvesting cases have been Republican in support of Trump.,OccasionalGamer,2020-08-05T13:06:31Z,0
The USA put a man on the fuckin MOOOOOON 50 years ago. And this guy claims it is IMPOSSIBLE to:<br />1) hand out pieces of paper<br />2) collect the pieces of paper<br />3) count the pieces of paper,Zwerker,2020-08-05T12:47:41Z,0
"Trump counts in small thousands, medium thousands and large thousands?",J Bellfield,2020-08-05T12:35:59Z,0
Small Thousands 🤣🤣🤣🤣🤣🤣<br />Darkness of Night🤣🤣🤣🤣🤣🤣<br />Clown show that&#39;s why he called on OAN.<br />Just making up stuff...,Bdawg02,2020-08-05T12:28:08Z,1
Lol since when can u vote more then once?  How do we even elect a republican president 🤔,Marshall J,2020-08-05T12:20:21Z,0
THE GREAT EMBARRASSMENT is in the red tie,Ronald Hella,2020-08-05T12:18:33Z,0
I love that David calls them lies since that&#39;s what Trump tells.  Love you David Packman,Johnny Morris,2020-08-05T12:17:09Z,0
&quot;total disaster&quot; &quot;no clue what&#39;s going on&quot; &quot;rerun the race it&#39;s a mess&quot; &quot;it&#39;s messed up&quot; He&#39;s talking about his campaign?,Harold075,2020-08-05T12:11:41Z,1
Trump - making lying great again - well trying to,Raia Kousary,2020-08-05T12:08:58Z,0
David been dunking on trump so hard he reminds me of shaq,GeorgeKizzle93,2020-08-05T12:00:56Z,0
Can we retire the word tremendous with Donny in November?,Thomas Hassall,2020-08-05T11:57:17Z,0
President is rubbishing America’s abilities.,David Chadderton,2020-08-05T11:54:41Z,0
Red face makeup brighter than the red tie.,David Chadderton,2020-08-05T11:52:53Z,0
What does Amazon have to do with voting by mail?,babygirl Street,2020-08-05T11:52:09Z,0
What part of there&#39;s a pandemic going on that these bastards don&#39;t seem to understand?,Azalea Rivera,2020-08-05T11:47:04Z,0
Hah it would be a whole different story If he could win.,Sami Nevalainen,2020-08-05T11:44:12Z,0
"At least he got one thing right... &quot;Know one has ever seen anything like it&quot; and hopefully will never again <a href=""http://www.youtube.com/results?search_query=%23goodbyetrump"">#goodbyetrump</a>",Dexter Morgan,2020-08-05T11:39:45Z,0
What a slimy push for a private company to collect votes.,Delta Tango,2020-08-05T11:39:20Z,0
Lying and breaking rules is now the mindset for conservatives,Eta Carinae,2020-08-05T11:19:34Z,0
President Trump:  The most UNDER INFORMED president in the history of our nation!,Nick Sower,2020-08-05T10:59:07Z,0
He is a war time president 😂so during a war not everything works as well as can be expected. A short delay may have to happen if you want the right person to be elected.,wallnutt258,2020-08-05T10:55:38Z,0
"Trum didn’t lie, get it right, he just talks barstool politics, not lies, just talking SHIT.",L Barbato,2020-08-05T10:54:10Z,0
"8.50 They arrested a postman for doing something bad.... What, what, what, what? The idiot talks like his audience consists of 4 - 10 year olds.",Arjan D.,2020-08-05T10:35:10Z,0
the way he said &quot;doing.something.very.bad.&quot; Sounds crazy as hell.,Latisha Gray,2020-08-05T10:33:02Z,1
I don’t care who wins Nevada as long as it’s not trump.,Jon Nelson,2020-08-05T10:32:23Z,0
"Remove all the following: probably, possibly, maybe, I guess.",Nixer Doyle,2020-08-05T10:22:31Z,0
"2016 40% of votes were by mail, Trump is an idiot plain and simple.",000FIRESTORM1989,2020-08-05T10:20:22Z,0
"OMG he is crazy...no linear thinking..goes up and down...for and against it...no point to talk if ur definitive does not exist..people use a baseball bat or chloroform, trump uses his mouth to bedazzle u...healthcare plan..if it is in plan...will be bad for everyone except rich and pharma.",spidy9237,2020-08-05T10:13:25Z,0
5 minutes straight? More like 3 and a half years.,Lwaves,2020-08-05T09:58:36Z,0
"Amazon has their own delivery service. The Post Office can handle the mail in votes. They&#39;ve been handling getting Taxes mailed in for at least 75 to 100 years.  TRUMP is scurrying because he&#39;s going to lose, lose, lose.<br />GET OVER IT TRUMP. YOU&#39;RE LEAVING OUR, THE PEOPLE&#39;S WHITE HOUSE. YOU ARE THE ONLY EMBARRASSMENT IN THIS COUNTRY.",Donna Underwood,2020-08-05T09:54:40Z,0
"Instead of wining like a little child about a &quot;broken system&quot;, fix the system (I´m not saying it´s broken, he is) so the American people can safely vote in November, you absolute cretin. Man, there are so many idiots out there who fall for this total BS.",PSV KRK,2020-08-05T09:48:42Z,0
The damage Paedophile Racist Dictator Trump is doing to America is almost unbelievable. The the world over will find it very difficult to trust Americans. Even if Biden wins  it will take decades for  the trust to come  back,music Man,2020-08-05T09:35:39Z,0
Jeez. He&#39;s a one man party. The very epitome of a dictator.,Sukhbir Sekhon,2020-08-05T09:35:10Z,1
It&#39;s now called  The Trump and Republican party virus,music Man,2020-08-05T09:31:36Z,0
"How long did we have to wait for the results between Gore/Bush? 🤔 We survived that wait time. <a href=""http://www.youtube.com/results?search_query=%23hangingchads"">#HangingChads</a>",Crystal Romero,2020-08-05T09:05:39Z,0
Ole Bunker Byatch,Ibuildships WagnerEdmond,2020-08-05T08:05:18Z,0
"If it weren&#39;t so absurdly unbelievable I&#39;d be laughing my ass if.  What an absolute buffoon. Just curious, how long did it take for Bush to be called the winner against Gore? Yawn.",ideal mon,2020-08-05T07:58:24Z,0
On another video just in he was reading Yosemite....He pronounced it YOZZEMIMIGHT...A new level of dumbness from the maestro of dumb.,David harrop,2020-08-05T07:54:30Z,0
"But if the results aren&#39;t presented the night of the election, it will hurt the ratings!!!",Greg Brogan,2020-08-05T07:43:19Z,0
&quot;Caroline &quot; creeeeepy,Wally Dog 2,2020-08-05T07:41:23Z,0
Carolyn ? He must consider her to be a 10,David harrop,2020-08-05T07:37:56Z,0
"Accuracy over speed? Duh, we don’t need results the night of, for any election.",IdolHandz,2020-08-05T06:59:31Z,0
"David, is there a reason why the system cant work where the votes by mail are counted as they come in and released as a dump on election day? Obviously they have to account for late arrivals but most of the vote could be counted before the election.",Taylor Sias,2020-08-05T06:46:57Z,0
OAN is the only network Trump addresses by name,Marcus Intheam,2020-08-05T06:44:06Z,0
"Donald Trump has probably told more lies in a(ny) single day of being President than any other President has in their entire time as President. It would be interesting to know how many confirmed lies other Presidents told to make the comparison accurately. We know Trump has told more than 20,000 confirmed lies since taking office.",Matt Roberts,2020-08-05T06:33:23Z,0
Heroic,Luke S.,2020-08-05T06:26:09Z,0
"Good Lord, how orange is his frickin&#39; face there?!!!!",Truitt Farrish,2020-08-05T06:20:04Z,0
microsoft better put 60 million in his Cyprus bank account if he hijacks Tik Tok for them . that would be a broad daylight heist and he&#39;s earned a slice of that pie if they pull it off . Now China gets a taste on how Latin American countries get done by . if he loses the election he&#39;s going to conduct some serious maneuvers before the end of January . pardons and money transfers will be flying all over the place .,holadonkey,2020-08-05T06:12:45Z,0
His skin and his hair is all you need to about bunker boy,john smith,2020-08-05T06:11:49Z,0
The best thing Republicans can do to save this republic is not nominate trump as a candidate.,Out Burst,2020-08-05T06:02:51Z,0
"I know this isn&#39;t the point, but look at the colour of his face compared to his ears...  who doin that tan...",Michele Smith,2020-08-05T05:51:44Z,0
Wouldn’t know the result for a week? It took a month in 2000.,The Big Picture,2020-08-05T05:23:37Z,0
When trump said someone cheats means he is going to cheat .,Gerald Kueh,2020-08-05T05:13:29Z,0
It&#39;s really &quot;disgraceful&quot; the way he just blatantly lies...smdh,L Moore,2020-08-05T05:06:28Z,0
Small thousands.,Colin Leech,2020-08-05T05:04:15Z,0
Trump use to vote by mail..Now he trying again to rig the election again. He already change the post general. To make the ballots late and uncountable.. He&#39;s really trying to hard..,Beanetrice McDaniel,2020-08-05T04:52:35Z,0
"Wow he&#39;s learning... look at his vocabulary expand... first he calls Nevada a disgrace... then he says mail in voting will be an embarrassment for our country... it&#39;s almost like finally enough people have said those exact words to him, so he decided to search them up... too bad he had to wrap it all up with another &quot;tremendous&quot; in the end",Jay Bee,2020-08-05T04:36:39Z,0
Trump back @ it ! His way to sabotage the election again!,Tanya Badmus,2020-08-05T04:34:12Z,0
