comment,id,date,num_likes
Who?,David Alexoff,2021-01-24T23:47:03Z,0
What?,David Alexoff,2021-01-24T23:46:00Z,0
Trump knew in august he would never win due to his baffoonery,Airroll Tangeeon,2021-01-04T11:33:08Z,0
they need to rename the republican party to the trump party!,Airroll Tangeeon,2021-01-04T11:21:39Z,0
"Here we are with the election come and gone and surprise surprise, no tremendous-or-otherwise health care plan announced.",jevicci,2020-11-22T04:04:30Z,0
&quot;small thousands&quot; oh my god he&#39;s so stupid,Christian Victoria,2020-11-11T09:45:26Z,0
He said &quot;I guess&quot;. Not a lie. Lol!,Larry Dean,2020-11-05T16:53:33Z,0
"He&#39;s just babling on and on with out saing any thig.<br />When did shooting president go out off fasion over there. ????<br />Remember to rake the forest &quot;flore&quot; to prevent forest fires, what a dum s**t head.<br />And he&#39;s the president. I feel sorry for you over there.",Manne Bæk,2020-10-25T20:30:59Z,0
Youll lose another lawsuit,Rose Rowley,2020-10-21T19:49:44Z,0
You talk like ten year old,Rose Rowley,2020-10-21T19:48:33Z,0
Your not gonna win trump,Rose Rowley,2020-10-21T19:45:07Z,0
"Despicable.  There are no other words that apply.  The only fraud we have seen, the only grabbing of posted ballots, the only rumors that have been designed, and the only bullheaded position that this will be a rigged election come from the GOP.  It is trite, since dumpty tried the same position before the last presidential election.  I encourage him to resign after he loses so Pence can pardon him from his federal crimes, even though he has enough pending charges on the state level to keep him in public housing, compliments of SNY prison system.  He is and always has been the biggest sore loser.",Sandra Gruhle,2020-10-18T20:34:48Z,0
The US is already a joke and not because of mail in votes. It&#39;s the great Orange Pumpkin that is the problem. Get over it and admit you screwed up bad tRump,Pam Deppe,2020-10-14T18:02:46Z,0
I wonder how the Post Office ever gets through Christmas?,Pam Deppe,2020-10-14T17:57:48Z,0
You are a liar you just want to win go to jail,Grover Jones,2020-09-19T08:17:18Z,0
so basically your saying fake ballots dont exist and manipulation is impossible this way? interesting...,Aaron Wellington,2020-09-14T23:22:49Z,0
THIS CLOWN JUST DOESNT KNOW HOW TO TELL THE TRUTH !!,Rodney Jones,2020-09-03T04:15:06Z,0
"Why didn&#39;t the republicans put up someone better than trump.  sure he is president, but he sucks because he is a LIAR &amp; continues to lie in every speech.  Does he EVER tell the truth?",K H,2020-09-02T01:40:56Z,0
TRE45ON,mrthebillman,2020-09-01T15:44:46Z,0
His such a charter he can loose fare and square,Carmen Meza,2020-08-31T18:19:46Z,0
Verbal dieriea trump,Hulkgreen Razor,2020-08-29T21:09:36Z,0
NOTHING NEW!!!!!!!!!!!!,Cleo Smith,2020-08-21T23:37:09Z,0
If Trump thinks the Post Office is unable to handle voting--then fix it!  What a loser!,T McAuliffe,2020-08-20T03:00:28Z,1
"T.R.U.M.P. = : Tyrant Republican Undermining, Manipulating, Plundering",Robert Strong,2020-08-18T08:18:06Z,1
You have to be a master of manipulations to creat such chaos and confusion on anything other than facts.<br />The President of the U.S. acting on “I guess.”,Joy-Ann Green,2020-08-17T14:38:17Z,0
It&#39;s strange yes trump lies my question is why listen to him...,Martin Rochejocquelein,2020-08-16T16:27:15Z,0
His supporters believes this crap.  They are like sheep being led to slaughter.  PATHETIC!!!,411richardify,2020-08-15T17:59:02Z,0
He is so so dumb. Goodness me! He thinks that everybody is dumb. His sycophants are helping him to ruin the country. Sad indeed!,Albert Temple,2020-08-15T15:07:44Z,0
a guy in canada got 4 ballots 1 with the name of his gold fish,Jesse Samuels,2020-08-15T08:31:28Z,0
"I hate to admit it but I really can&#39;t watch this prick trump speak. It&#39;s insulting that he refuses to be clear about anything and believes that his circular oral diahrea is a thing. Talking in circles isn&#39;t a real tactic, it&#39;s ignorance.",vlxxx,2020-08-14T23:49:12Z,0
How do the members of the press corp keep from laughing out loud?!,Flower Girl,2020-08-14T21:22:47Z,0
"&quot; it will be the greatest embarrassment to our country&quot;<br />No, you are the greatest embarrassment to our country😬",sillypanda,2020-08-12T18:56:46Z,1
"Dude there has been states voting by mail for fucking years! The only thing messed up is you, you just made a downer the postmaster who’s made things actually bad for the post office! If this is how much he talked about mail in bullshit, did he actually talk about covid at all.",Trick Simpson,2020-08-12T17:21:31Z,0
A fraud loves to claim fraud. Oust this man.,Stephen Kuhn,2020-08-12T16:57:02Z,0
"Show up,show ID.   Vote.<br />No other voting system,simple.",John Brougham,2020-08-12T13:44:09Z,0
&quot;small thousands&quot; lol,anonymous user,2020-08-11T13:23:47Z,1
"liar, liar pants on fire!!",Jackie Anderson,2020-08-10T21:58:11Z,0
David your arguments need to be more solid.,NakedQuark,2020-08-10T20:26:25Z,0
He is rewriting a word &quot;lie&quot; into his dictionary of delusion to mean the truth because he is more used to lying.,Elvis Malakoane,2020-08-10T18:38:54Z,0
"When he loses in November, between November and January the USA will be in a disaster, trump will wreck the country",John Caldeira,2020-08-10T00:47:55Z,0
"Lies, lies and more lies, you horrible man, resign in honor ask fir clemency and we won’t give you jail time",John Caldeira,2020-08-10T00:46:43Z,0
😂😂,Phil Plummer,2020-08-09T19:59:29Z,0
"When he said it&#39;ll be a great embarassment to your country, that was him talking at a mirror right?",Christian Sørensen,2020-08-09T12:58:09Z,0
The more he lies the more he lose votes.He’s dumb Trump idiots supporters are already realizing half of them are ...are already realizing that this man is a Socio pathic monster and an idiot.,Beanie baby Queen12,2020-08-09T06:26:27Z,0
As I read the comments I realized he&#39;s down to all libtards leaving stuff. I&#39;m beginning to think or you left his really want the shutdown I think they&#39;re afraid to go out in the sun. You people need to get away from your electronics once in awhile,bongker g,2020-08-09T04:39:46Z,0
"Wow, only five minutes, you can go on with  your lies for hours!",Tony Smith,2020-08-08T19:50:17Z,0
DeJoy needs jailed for life for treason. Period.,Sideways N,2020-08-08T08:42:51Z,0
Lol,Sandra Mena,2020-08-08T04:58:32Z,0
"Trump&#39;s Ancestry DNA report just came back. He&#39;s full-blooded Italian. Half Mussolini, half Pinocchio.",Greyareas27,2020-08-07T21:56:37Z,1
"“Universal mail in ballots is going to be a great embarrassment to our country” no Trump, you are a great embarrassment to our country.",bobobeeper 2,2020-08-07T20:53:35Z,2
"David knows more about voting than Trump.  There are states that have entirely  mail in voting, and it works just fine.  If you&#39;re not sure who to believe, check it out.  Google it!  Don&#39;t just blindly believe whatever someone says.  Do that, and you may end up embarrassed by it, regretting your decision.",Deborah Walker,2020-08-07T19:28:24Z,0
the USPS seems to have handled the enormous volume of mail every holiday season for decades just fine ... &amp; that&#39;s during extreme weather conditions.<br /><br />i think an influx of expected increases during relatively predictable &amp; mild weather won&#39;t be an issue for the dedicated &amp; experienced personnel throughout our mail delivery system.,Cindi Beauchamp,2020-08-07T17:00:09Z,0
"Ever time they cite a mail in ballot fraud it&#39;s always a republican. Weird. Also: Funny how the state where Trump lives is a good place for mail in voting. Typical republican. Something is bad, until they need to do it, then it&#39;s okay, or it&#39;s okay for them, because they&#39;re different.",MisterNiles,2020-08-07T14:19:47Z,0
Oh I see he is more concerned about his tacky hair and makeup. Putting his fake tan on extra thick will solve everything. He’s melting in front of our eyes. He’ll soon be a pile of crap 💩,Pu Yi Hsieh,2020-08-07T14:01:15Z,0
"Tired of Trump&#39;s constant lying? <a href=""https://youtu.be/tj4pzvdUIyQ"">https://youtu.be/tj4pzvdUIyQ</a>",Katie Kern,2020-08-07T12:58:19Z,0
Doesn’t the post office mail out the census?<br /><br />They don’t keep track of the data though right?<br /><br />Does he think the mailman is gonna add up the votes?,Resin Lung,2020-08-07T07:43:37Z,1
"soooo....&quot;blah-blah-blah-blah, I don&#39;t like mail-in voting, everything&#39;s rigged, we&#39;re suing Nevada, the sky is falling....oh, and we&#39;ll be introducing a healthcare plan by the end of the month...bye!&quot;",superflea72,2020-08-07T07:24:14Z,0
"Predictions: most battleground states with a GOP governer (and maybe legislature) will call a state wide stay home order on the 2nd November and enforce it with the national guard. Basically scsring people to stay in and not vote on the 3rd. Kemp, DeSantis, Abbott will be well up for it. Cant recall exactly who else has GOP govs / legs but i think Wisconsin and Penn are 2. There will be some (like De Wine in Ohio) who wont tow the line and will come out of it well placed to be the 2024 GOP presidential. candidate. Its gonna happen!",Brendan Kavanagh,2020-08-07T07:17:30Z,0
Listening to this speech gave me cancer. I&#39;m from WA and it&#39;s impossible to think of our mail in system being broken when it&#39;s worked the entirety of at least my voting history.,Hannah Hall,2020-08-07T00:19:23Z,0
He could lie all fucking day long,Ronnie Cripe,2020-08-07T00:13:55Z,0
"If the majority of Americans are actually smart enough to see through the BS of this administration, we may have a chance of getting this idiot out of office. Unfortunately, about half the people I speak to, seem to have no more than a 3rd grade level of intelligence, and they relate well with Trump.",John,2020-08-06T21:40:33Z,0
I never believe anything that comes out of  his lying mouth!,Rebecca Duboise,2020-08-06T20:45:59Z,0
Trump acts like there has never been a surge in mail usage aka. the holidays...every year,Spencer Haas,2020-08-06T19:39:47Z,1
"David your titles are getting so good, man...",Robert G,2020-08-06T18:06:45Z,0
I hope Mr. Pakman gets a chance to interview trump. He&#39;d catch and confront all of trump&#39;s ridiculous and Dangerous lies.,Ophelia T420,2020-08-06T17:59:56Z,0
Trump is so orange in this press briefing.,Valheim Viking,2020-08-06T17:58:23Z,0
THIS IS THE BIGGEST GOOF ON THE PLANET,David Swain,2020-08-06T17:06:34Z,0
"Damn I wish he would put super glue on his mouth...first I work for UPS, yes the Post Office does a ton, but we have the contract with Amazon and can most def handle any mail if the Post Office get hammered! I know for a fact we work with the Post Office daily here in CA! Shut up tRump, great lie dick!",Y G,2020-08-06T16:55:06Z,1
&quot;No ones ever seen anything like it.&quot;   -claims the stupidest president we&#39;ve ever had,Barnaby ap Robert,2020-08-06T16:41:11Z,1
Trump is practicing for when he loses in November.,Lazy Kat,2020-08-06T16:15:25Z,3
"No clue Trump, what a joke.",G Hill,2020-08-06T16:09:48Z,0
"I agree, its a disgrace, ...that is,  his presidency is the disgrace!!",Adventure Rider,2020-08-06T14:48:32Z,0
5 min of b.s. and then FINALLY answered question.,T.A. ACKERMAN,2020-08-06T14:39:18Z,0
This BUFFOON has to go.. ☠TRUMP ☠<br />🇺🇸🇺🇸BIDEN 2020🇺🇸🇺🇸👍,Daniel Ramirez,2020-08-06T14:33:53Z,0
Trump is making this up as he goes along. None of this true.<br />Mail ballots have been used since the the civil war,Bob Nethen,2020-08-06T14:32:57Z,0
"I see title, I instinctively think: &quot;Wow... Only 5 minutes?&quot;",Alex Jackson,2020-08-06T14:13:36Z,0
"Americans, please wake up! Vote! At the current situation, you only have two different &quot;parties&quot; to choose in between. But you have to vote. You are one step away from a dictatorship. You have two old men, that should not be near politics. But because of your political situation, that is what you got. You have to choose between cholera and the plague. You have to vote.",milesdust,2020-08-06T12:56:17Z,0
She hot!,Dani Londen,2020-08-06T12:31:37Z,0
"Nobody&#39;s seen anything like it ?  Yes Donald, because it is all bullshit of your own invention. Lie after lie.  All you do is lie !",hifismiffy,2020-08-06T11:18:15Z,1
Small thousands ?  Are they like large hundreds?,hifismiffy,2020-08-06T11:16:33Z,1
Is it my imagination or is he next level orange ATM? It’s a fascinating shade. Custom?,Jen Jen,2020-08-06T10:55:29Z,0
the only embarrassment to the usa is the orange turd behind the mic,Jim-James- Jimbo,2020-08-06T10:51:45Z,1
"If &quot;doing something very bad&quot; is a crime in America, you Mr. President, are in real trouble.",Rj,2020-08-06T10:36:16Z,1
I&#39;m sorry but where is the news here? Trump is lying? Who knew?  You can tell that because he is moving his mouth.,John G,2020-08-06T09:56:44Z,0
As a german I don&#39;t quite get it. Is there a difference between &quot;vote by mail&quot; and &quot;absentee  voting&quot;?,Martin Groh,2020-08-06T08:26:59Z,1
"@Martin Groh Exactly! The difference is miniscule but Trump cannot state anything (good or bad) without over exaggerating the facts. That is, if he isn&#39;t just straight up lying about it.<br /><br />I didn&#39;t vote for this psycho in 2016 and I sure as hell won&#39;t vote for him in November. If by some chance he does win I swear I&#39;m going abroad for the next 4 years..",Miss Vincent,2020-08-07T13:19:52Z,1
@Miss Vincent Thanks! So no big difference actually. Then we have absentee voting in Germany. Just that we do not have to give a reason why we cant vote in person...,Martin Groh,2020-08-07T12:48:18Z,1
"Absentee voting refers to when a voter requests a ballot and are required to provide an “excuse” to qualify for absentee voting, usually pertaining to why they cannot be in a polling place in-person on Election Day.<br /><br />Vote by mail is the process of sending every registered voter a ballot without a request.",Miss Vincent,2020-08-07T11:55:49Z,1
"<a href=""https://youtu.be/rbFJWo3gdRI"">https://youtu.be/rbFJWo3gdRI</a>  The reason I post this link is because I cant see any other way to make trumpists and q supporters see reason.  Can we flood their forums with this? <br />They have no problem throwing Tom Hanks under the bus for far less.<br />I know it&#39;s petty but maybe we need to use language that they understand.",Peta C,2020-08-06T08:18:05Z,0
"Many people are willing to wait 7 more days, Donald, to see you lose. They have waited for a very long time.",Fitzwilliam Darcy,2020-08-06T07:29:43Z,1
"Return you ballot early, folks. 🌊🌊🌊",Fitzwilliam Darcy,2020-08-06T07:27:10Z,0
Noting she is not wearing as mask...others in the press corps seem tobe able to ask questions with a mask.,Lisa B,2020-08-06T06:49:06Z,0
"<a href=""https://www.youtube.com/watch?v=YLyU1WCQQ8A"">https://www.youtube.com/watch?v=YLyU1WCQQ8A</a><br />Delivering our Democracy | US Postal Service",Dani Boro,2020-08-06T06:42:30Z,0
"I&#39;ve got to the stage I can&#39;t listen to him. It&#39;s a torrent of word salad, consipracy, outright lies and stupidity spoken in a childish, whining, slurred, whimsical, and often boastful way. I have to leave the video moments into Trump&#39;s speeches. Please just read out the transcript.",betabenja,2020-08-06T05:49:55Z,0
Team America: World Police - Everyone has AIDS<br /><br />Everyone has AIDS.<br />AIDS! AIDS! AIDS!<br />ADADIS! AIDS! AIDS!<br /><br />RIP Pat: 19XX - 2020,mc1472,2020-08-06T04:26:08Z,0
"Does Trump realise how much he  continually rubbishes the USA? Does he also realise that if everything is a disaster why has he not done anything about it in the last three and a half years instead of golfing and earning money from his minders and others who have to stay at Mara Rip Off. Now the Post Office has old equipment and can&#39;t handle that amount of mail and his mate in charge is stopping overtime. Funny how it handles Christmas cards and boxes. Has the USA not had enough of this you have tens of thousands of people dying and Trump is absolutely obsessed with voting,  ratings,  whether he is liked and him and his staff have not done anything to shut down the Corona19 leaving people to die. He still cannot be removed????  Even when you know he is a reality moron and all he wants is to be on camera lying.",Margaret Har,2020-08-06T04:23:49Z,0
"Well, I guess the P.O. will be overwhelmed, as of course they are every Xmas when they also deliver all those online-purchased Xmas gifts.",Roger Hartwell,2020-08-06T03:48:37Z,0
He&#39;s hoping to get everything electronic so he can have his overseas thugs interfere and make him win again he&#39;s got a Playbook and he&#39;s sticking to it pathetic incoherent pathetic Trump chumps Trump chimps monkey see monkey do,Orlando Acosta,2020-08-06T03:47:49Z,0
How is it that Trump is coming up with some kind of healthcare almost four years into his term that&#39;s a bunch of crap did he not care about the people and their health care until the point where he&#39;s losing the election so he&#39;ll grab at anything what a pathetic want to be leader or should I say tweeter,Orlando Acosta,2020-08-06T03:44:55Z,0
"Ill be sooo glad when we dont have to this lying maniac, TRUMP!!!!",Penny Parks,2020-08-06T02:21:11Z,0
I actually like our postal service.,Megan lovesresearch,2020-08-06T02:07:59Z,0
Only 5 minutes? That&#39;s breaking news...,Phoenix the II,2020-08-06T00:13:53Z,0
Bone spurs is just plain stupid!,ed samms,2020-08-06T00:03:37Z,0
"How can you trust a man who lies so often, never know wha5 is true and what’s not",Uwa Diercks,2020-08-06T00:01:31Z,0
There is ONLY...ONE..VOTE PER ONE REGISTERED VOTER tRump you jackass.,Robert Taylor,2020-08-05T23:58:47Z,0
Has NO ONE told him that it&#39;s the exact same thing? How does he think the absentee ballots end up where they need to be. Hey Scotty fire up the transporter.,theresa shearer,2020-08-05T23:45:08Z,0
The man has constipation of the brain and diarrhea of the mouth. Is it November yet!,theresa shearer,2020-08-05T23:34:04Z,0
Why does Trump keep talking like everything a problem he never has any solutions he never has any answers he just likes to divide all of us and then at the very end he&#39;s going to he said he&#39;s going to have medical for everybody he&#39;s been saying that for three and a half years keep saying it&#39;s going to come out next week next month the man is just the b*<b>****</b> artist,TOWBAR,2020-08-05T23:32:37Z,2
He sure knows a whole lotta voter fraud methods...very detailed methods and ways to commit voter fraud...hmm  it&#39;s like watching him brain storm ways   he&#39;s already thought about doing himself...no one tells on himself more than ol&#39; donny...,Debra Romero,2020-08-05T23:13:08Z,0
Do you think he even realizes that he&#39;s lying? I think he actually believes his own BS. Text book mental illness.,T,2020-08-05T22:48:31Z,1
Small thousands? Really? You make no sense.,akeemshakur,2020-08-05T22:16:11Z,0
"Trump, you are a disgrace!  Liar, liar pants on fire!!  God, please protect us from this fraud!!!!!",John Vaughn,2020-08-05T22:14:58Z,0
What’s with the shoulder tic?,Patricia Savoth,2020-08-05T21:56:22Z,0
"This country has been voting by mail since the Civil War...........he is just setting up a fake &quot;emergency&quot; so that he won&#39;t have to leave office if he loses.......liar, liar pants of fire!! He&#39;s a disgrace!!",Kathie Brown,2020-08-05T21:51:58Z,0
"If the polls where saying otherwise,  none of this would be an issue.",A1aerials Droner,2020-08-05T21:23:23Z,0
It&#39;s so embarrassing... we had votes in Bavaria in March and they had to completely switch to mail-in-voting in the course of two weeks and it was no problem at all... ridiculous!,Thomas Lang,2020-08-05T21:12:21Z,0
OAN:  Only Alternative-facts Network.,C.A.T.,2020-08-05T21:10:23Z,0
The only thing that&#39;s a disaster is your presidency,TOWBAR,2020-08-05T21:06:44Z,2
He just needs to go visit a National Park and give everyone a break and himself a break too.,Mach1 GTX,2020-08-05T21:03:22Z,0
OAN - providing the prompts and feeding him anecdotes,Brandanus Sanctus,2020-08-05T20:56:43Z,0
The only rediculous and confused person is the dump and his court jesters!,Daniel Rodriguez,2020-08-05T20:56:25Z,0
"Trump needs to worry less about the logistics of a post office who has nearly NO workload since the incremental demise of &quot;Snail-Mail&quot; in this country...<br /> <br />The very same internet that he claims is swamping the post office (who shares package delivery with other private carriers such as UPS, DHL, FedEx, etc) is the exact REASON mail has become nearly nonexistent compared to previous decades... <br /><br />Amazon is essentially unaffected by MASSIVE order increases... Walmart and other retailers have no logistical problems supplying products that are supplied to them, via newly implemented curbside websites... Streaming services such as Netflix barely blinked an eye despite a nearly overnight increase of 12% in streaming this February with no warning, whatsoever...<br /><br />Now let&#39;s talk about Don&#39;s administration getting caught with its pants down and failing to supply COVID Tests in a timely manner and a Government-run UNEMPLOYMENT website that can&#39;t keep up with increases in traffic MONTHS into this pandemic... Can we talk about THAT, Donald?... He needs to do his own damn job before second-guessing others who are paid for their prior experience and expertise. This is becoming a habit for him, isn&#39;t it?.",common logic,2020-08-05T20:45:35Z,0
I voted by mail in 2016. Trump still won the election.,Allan Lee,2020-08-05T20:44:56Z,0
Liar for his living,Linda Robertson,2020-08-05T20:44:03Z,0
Did it never occur to him that it&#39;s safer against the virus  to allow people to vote in this way.,Anne Dunne,2020-08-05T20:36:44Z,0
Trump just loves those superlatives.   No one has EVER lied as much as he has.  He&#39;s the BIGGEST liar of all time.  He&#39;s full of more shit than you&#39;ve EVER seen before.,Jerry Velders,2020-08-05T20:13:23Z,0
Wasnt the OANN reporter &quot;kicked out&quot; of the press room?,M & M Farms,2020-08-05T20:06:56Z,0
Is it me or does the reporter for OANN look like 17?,M & M Farms,2020-08-05T20:06:30Z,0
"Anyone want to tell the President that the decision on President doesn’t happen the night of the polls.  It happens when the electoral college votes and they don’t have to vote for what the people want....they usually do but they don’t have to.  So saying we won’t know that night, we never know that night",Truth Seeker,2020-08-05T20:04:27Z,0
"So the post office can&#39; t handle a few hundred thousand mail in votes, but has no problem handling Christmas time mail and mail in tax returns... Got it",Ed Blakemore,2020-08-05T20:03:50Z,0
Interesting thing what did they do before we had our modern polling system. How long did it take for all the electoral votes to be collected  and counted and a winner was called.,Bill St.,2020-08-05T20:00:19Z,0
"I&#39;m not an American, so I don&#39;t get access to US news channels, so I would like to know if Trumps lies are being exposed on US television?",Replicas,2020-08-05T19:57:58Z,0
Trump is flipping moron. What a total douchbag 😣🥊,Stefan Leys,2020-08-05T19:54:14Z,0
"BS! WAKEUP AMERICA! 150,000 DEAD FROM COVID-19!   Dems passed a bill 2 and 1/2 months ago!  These guys are millionaires talking to you!     The GOP does not care about the workers! $4 Trillion to the Stock Market, and $500 Billion to big companies! VOTE THEM ALL OUT!       Mitch McConnell&#39;s GOP Punishing People For Losing Their Jobs!<br /><a href=""https://www.youtube.com/watch?v=ztKzUTPCAA0"">https://www.youtube.com/watch?v=ztKzUTPCAA0</a> <br /><a href=""https://www.youtube.com/watch?v=hxfbikt5BEo"">https://www.youtube.com/watch?v=hxfbikt5BEo</a>",Vote to Count,2020-08-05T19:42:40Z,0
",Way way too many ads.",ted605,2020-08-05T19:42:04Z,0
Small places? &lt; For the gnomes. Trump is F*cking nuts and if you support him you need help! He said the PO can&#39;t do the job then goes on to explain how much they do? Give this buffoon enough time and he will even kill all the people that support him. It is embarrassing for the US to have elected such a nit wit and it is even more humiliating that he remains in office causing death and destruction. The system is not working when it lets a killer keep killing and living in luxury whilst he does it. Make no mistake he&#39;s in office doing all this horrendous stuff because both major parties sold our government to the wealthy.,Dung Teller,2020-08-05T19:42:03Z,0
"Its not that Vote mail is not working. As someone mentions its documented and tracked. It does not work when millions will send in their vote mails during a short period of time. I dont understand whats so hard to understand about this, this would likely be an issue for any state in the world.",Daniel Larsson,2020-08-05T19:38:11Z,0
"<i>It&#39;s not just Amazon, you have to consider their competitors, if there is any, I don&#39;t know...</i><br /><b>It&#39;s not trump, it&#39;s the idiots that can watch that &quot;press conference&quot; and still support him that disturb me.</b>",TruthAndMoreTruth,2020-08-05T19:37:10Z,1
Trump looks kinda cute tbh,Jesus Christ,2020-08-05T19:36:44Z,0
"The corruption in the trump administration is appalling.<br />IT&#39;S A BAD TIME TO HAVE THE WORST PRESIDENT EVER...Trump is a INCOMPETENT MORON, Massive Failure of Leadership. Shame on all those who know this and yet still protect and enable this clown..I’m sickened every time I hear trumps voice uttering a string of lies or self vanity. We have to vote him out, Now that would make America great again.",RonnieSayers,2020-08-05T19:35:38Z,0
