comment,id,date,num_likes
"When people lie they normally make do with just the one lie, in order to then twist a truth. <br /><br />Trump wrote the book on lying, or at least that is what he says, and the only thing he is an expert at is delivering layer upon layer of lies.<br /><br />If the USPS was losing $1.46 on every Amazon package delivered - which it isn&#39;t - but even if it were, as the USPS isn&#39;t funded by the American tax payer it wouldn&#39;t be the American tax payer who is being defrauded and in fact it would be the package recipient who would be ultimately benefactor.<br /><br />The USPS need Amazon and Amazon has more than enough alternative postal suppliers, as well as their own delivery services, should they be prevented from using the USPS.<br /><br />In 2006, Congress ruled that the USPS couldn’t set its prices lower than its costs, otherwise it would be able to unfairly charge less than its competitors like UPS and FedEx.<br /><br />Every year, an independent agency called the Postal Regulatory Commission makes sure the USPS’ deals make economic sense. And year after year, the commission has approved the deal with Amazon. In its 2017 annual report, the USPS even said its shipping and packages business helped the “financial picture of the Postal Service.”<br /><br />Amazon receives a discount, inline with every other high volume customer, as is common practice across the entire business community, it&#39;s generally called a bulk buying discount.<br /><br />The only truth that Trump touts is that the USPS make a loss - but it is a lie to suggest that is because of Amazon as it is more to do with Congress enacted a law in 2006 that required the USPS to prefund its employee health benefits for the next 75 years. And that has cost the post office billions.",Martin Day,2020-08-05T04:31:21Z,0
Of course he says Caroline. Omg he’s freaking nutso!,Di G,2020-08-05T04:26:04Z,0
"If they do cut funding at the Post Office, then some of us could do Volunteer  work at the USPS to help lighten the load.",Dena Mitton,2020-08-05T04:12:55Z,0
“ why do you think some people are pushing so hard (for mail in ballots)?” Might be the dumbest question I’ve heard in a while… ummm Maybe because we’re in a pandemic,dakdak612,2020-08-05T04:11:32Z,0
"Trump is more dimwit then usual, he really is not making sense. Things don’t jive.",Lu Guy,2020-08-05T04:08:07Z,0
Why does he HAVE TO cause problems?   Everything he said was nonsense.,Suzanne Richardson,2020-08-05T03:57:23Z,0
"Got one. Looks fine, fits well in stretch fabric, but cost nearly $70 for one including $9 for shipping.JUST ONE.",James Wilkinson,2020-08-05T03:45:09Z,0
They&#39;re the same damn thing!!! Absentee ballots and mail-in voting is the same thing!!! Trump&#39;s stupidity is beyond measure!,CT,2020-08-05T03:40:04Z,0
"Dude, you are speaking Aramaic to him, he DOESN&#39;T UNDERSTAND THAT!",Ruth V,2020-08-05T03:39:57Z,0
He doesn&#39;t have a problem with mail in voting in Florida. This is just all comical.,Ruben Gonzalez,2020-08-05T03:27:09Z,23
"The post office is a government entity, making it HIS responsibility to &quot;fix&quot; it.",Laurie Van Riper,2020-08-05T03:17:01Z,1
The lying king....,jose carlos,2020-08-05T03:16:35Z,0
Funny how the OAN reporter doesn&#39;t have top east a mask but everyone else does? That&#39;s because she had to kiss his a** and probably had to swallow to get in the press room.,Laurie Van Riper,2020-08-05T03:14:44Z,0
"Post Office does a great job, they drop tons of packages off everyday and we have to sort it to our hundreds of residents....oh and it never stops, old folks ordering stuff everyday!",Getting Smart,2020-08-05T03:14:11Z,0
"WoW he lied, who knew?",Baron Black Dragon,2020-08-05T03:10:35Z,0
So glad I can vote by mail now though!,caroljoywolf,2020-08-05T03:09:35Z,0
It must be OK or he would not be so worried about it.,janet clough,2020-08-05T06:13:28Z,0
The terra cotta traitor. I just can&#39;t listen to his BS. Ugh.,Truth,2020-08-05T02:57:14Z,0
"The <a href=""http://www.youtube.com/results?search_query=%23us"">#US</a> is first to send it&#39;s monitors to monitor voting on other countries. What a joke.",Jeff Hambleton,2020-08-05T02:54:37Z,0
PLEASE STOP MISPROUNCING Mack A Nanny.  She is a despicable human being and misprouncing her name just give her more attention,Rainbow Writer,2020-08-05T02:52:23Z,0
"Just as point of clarity:  The Post Office’s only profit center is parcels.  They break even on Fist Class mail.  Where they loose their shirt is on the third class junk mail which fills our mailboxes.  Congress will not allow them to raise the third class rate, because very time the issue comes up, the Chamber of Commerce throws a fit.  Think the NRA had a hold over Congress, they are a tiny player compared to the CoC.   I find this extremely bothersome, because if anyone should understand the issue it is the CoC.  Which means they are typical selfish Republicans.",Randall Thomas,2020-08-05T02:45:47Z,0
"If the post office can handle the Christmas Rush, they can handle mail in/absentee voting.",lorriy1,2020-08-05T02:41:08Z,0
Trump lies so often it’s almost like he’s telling the truth in reverse,jasonfire34,2020-08-05T02:38:35Z,31
"To admit to watching him speak, lie, rant or pretend to be a President would keep me awake nights.....a desperate man...fielding organized questions he still doesn&#39;t give truth to.....<br /><br />Oh America,  this is getting worse......and he has 90 plus days to ramp up the twisted narrative.....as more people die, he goes podium ....to try to convince y&#39;all he has something worth saying....there are those who say things Donald indeed....what you say is of no consequence at all.",life long,2020-08-05T02:36:31Z,0
This was one of the best video by Packman that I&#39;ve seen. Really good analysis and debunking of Trump&#39;s statements,srelma,2020-08-05T02:32:06Z,0
C&#39;mon America! get rid of this lying orange turd!,73whitezz,2020-08-05T02:29:15Z,0
"Governor of Nevada, should say, &quot;OK, WE WILL SWITCH TO ALL ABSENTEE LIKE FLORIDA MR. TRUMP.&quot;",VR & AR dev.Studio,2020-08-05T02:22:01Z,0
"I will wait for the votes to be counted., no problem there. We may have to wait for a decision. I am thinking , you Trump does not want to wait as he knows he will not win. He just sound ridiculous any more. All lip service.",Suzy bea Land,2020-08-05T02:21:52Z,0
"THEY INDICTED A POST MAN FOR DOING SOMETHING VERY BAD?   What an amazing, articulate account of the incident!",VR & AR dev.Studio,2020-08-05T02:19:47Z,0
"The Post Office having to deal with millions of letters? Oh No! (THAT IS EXACTLY WHAT THEY DO,...)",VR & AR dev.Studio,2020-08-05T02:18:25Z,0
All those things that Trump is saying is about him.,Suzy bea Land,2020-08-05T02:16:36Z,0
"Oh my Lord.  How can someone lie so much, and in public, without suffering from mental issues....oh, wait.",Yanni Giftakis,2020-08-05T02:16:07Z,0
Man I wanna punch him in the face so bad,Jmx2020,2020-08-05T02:15:59Z,0
"Your actually the biggest liar on YouTube.   I&#39;m referring to the kid calling our president a liar. You want a liar look in the mirror. The problem is low IQ talking heads with their own un American agenda. You folks that embrace the left embrace Gods enemies.  Sacrificing babies with their heads crowning-- your accessory to murder. You embrace and demand its taught in school to legitimise an abomination. Mohammed said &quot; What will you say when you stand before the Son of Mary.&quot;  I ask you the same question. You will die, you will stand before Jesus in judgement. What will you say.",Ronald Hess,2020-08-05T02:12:47Z,0
Five straight minutes of lying is nothing for a crook who&#39;s been lying straight for seventy-three years.,chlojoe100,2020-08-05T02:09:44Z,0
"Davjd, we here in Aus have had vote by mail for ever and some elections it may take three weeks or more before the vote result is known, it has not done us any harm. We just wait for the votes to be counted and the results is what it is. We have not had any civil wars about it. Mail votes are all absentee. What a dick. Glad I don’t live in USA. Love your channel.<br />0",Don Watts,2020-08-05T02:07:24Z,0
Does anyone else feel Biden has been really quiet over the past week? Going up in polls just by letting Trump self destruct,Tom Blackfyre,2020-08-05T02:06:10Z,0
i would just start calling mail in absentee so he would shut up,ivyshaolin,2020-08-05T01:58:36Z,0
"If I were him, I would be concentrating on the Tax Fraud charges that occurred when he wasn&#39;t president. He&#39;s got no executive protection for those crimes. He needs to pay attention, he will be arrested along with his kids and taken out in handcuffs and placed in a cop car and &quot;maybe not so carefully.&quot; Focus Don, you need to focus.",Ted Cox TOX,2020-08-05T01:56:08Z,0
Dump knows small.,PabloJ Marron,2020-08-05T01:51:25Z,0
"The root of this falsehood is trump frames it as if ONLY Democrats can or will use mail-in ballots, and Republicans are somehow being denied the option. This is idiocy and/or deliberate deception, period full stop. i.e. there is a specific option to vote, ALL voters can choose to use said option, there is no favoritism, there is no grand conspiracy. This is just more verbal confetti to get his ignorant cultists frothing at the mouth. Five states have had exclusively mail-in-only voting for years and have higher percentages of voter participation and less issues than other states. Don&#39;t fall for the background noise.",D4md Cykey,2020-08-05T01:51:05Z,0
The guy in WV changed the ballots to republican candidates 😂😂😂,AGE WELL,2020-08-05T01:50:26Z,0
The only good thing about Trumps presidency is we can all tell our kids they can be president. Even if they are dumb.,Jake Jhons,2020-08-05T01:49:45Z,0
"Ugh, listening to trump&#39;s rhetoric is exhausting!  Speaks like an imbecile! Oh wait, he us an imbecile!🤪🤥😵😡",Marlene Strickland,2020-08-05T01:47:34Z,0
June 15th Trump put a Republican donor Louis DeJoy as the Postmaster General. He cut overtime and these post people were told to leave mail behind and nobody&#39;s calling Trump out on it.  This is Trump&#39;s way of suppressing the vote. It&#39;s a Federal Crime and Congress needs to call this guy into testify.,Diane Davidson,2020-08-05T01:45:55Z,0
"<a href=""https://www.youtube.com/watch?v=N6rHlX3K9N4&amp;t=8m18s"">8:18</a> There are so many possibilities to speed up the processes at the post offices. You could get some unemployed citizens to do some work and earn some money. The post offices could drop all the mails and packages that are not sent by overnight for 1 or 2 day and then they could take care about the election&#39;s stuff. And so on.<br />Trump is coming up with silly excuses to steal the election.",a Deer from here,2020-08-05T01:45:31Z,0
Trump and De joy are working together to rig the election. Put pressure De joy to do the right thing.,Don Lowe,2020-08-05T01:45:14Z,0
"Trump staring to create new American political storm, TIKTOK suppressing man-oeuvre<br /><a href=""https://medium.com/@sajjadhussain_11869/trump-staring-to-create-new-american-political-storm-tiktok-suppressing-man-oeuvre-863b8db74886"">https://medium.com/@sajjadhussain_11869/trump-staring-to-create-new-american-political-storm-tiktok-suppressing-man-oeuvre-863b8db74886</a>",FIN TECH,2020-08-05T01:43:16Z,0
"Christmas will need to be cancelled because the PO can&#39;t handle all the gifts and &quot;Oh my &#39;Dog&#39;, all those Xmas cards&quot;  Sooooo saaaaad.",Idowebs,2020-08-05T01:42:16Z,0
Post office loses money? We pay taxes for a damned reason.,David Squires,2020-08-05T01:40:46Z,0
USPS works hard and gets Christmas down to a dotted i . The post office is ready to be prepared for this with foresight.,David Squires,2020-08-05T01:39:36Z,0
"Trump has his finger near the Nuclear button, it is frightening they haven&#39;t put this muppett in a strait jacket.",robert taylor,2020-08-05T01:33:58Z,0
The postman was a Republican who was changing ballot request forms from Democrat to Republican,fasteddie,2020-08-05T01:33:47Z,0
Lol! Did he say &quot;Its going to be embarrassing of they use universal mail-in ballots???!!! HE HAS BEEN EMBARRASSING AMERICA SINCE HE SLITHERED HIS WAY INTO OUR WHITE HOUSE!#,L Lange,2020-08-05T01:31:13Z,0
"I lived in uber conservative Wyoming in 2016, and when I went to register to vote they asked if we wanted to vote absentee while right there, several weeks before the election. <br />It’s no real difference than the “vote by mail.”<br />In 2016 it was convenience;<br />Apparently in 2020 it’s fraudulent.",Taylor Carender,2020-08-05T01:31:10Z,0
"Ha, Just got an ad on this video from the Trump campaign telling me, a FL voter to request my absentee ballot, which is &quot;very different from the Democrat-imposed mail-in-voting.&quot; lol",Jimmy Thornseed,2020-08-05T01:29:58Z,0
He needs to be put in a home for the mentally disabled,fasteddie,2020-08-05T01:27:02Z,1
His presidency has been a total disaster,fasteddie,2020-08-05T01:25:03Z,0
Anyone else notice how more and more groggy...froggy...his voice and attitude is getting?,Equality For All,2020-08-05T01:20:08Z,0
The sane world knows he is lying.  Have done for his entire presidency.  Fact.,Anglashock,2020-08-05T01:18:22Z,0
The result of the ballot is still faster than your testing result...moron.,HANNAH HOANG,2020-08-05T01:17:28Z,0
"At <a href=""https://www.youtube.com/watch?v=N6rHlX3K9N4&amp;t=6m57s"">6:57</a> Trumps rants on about how badly the Post Office is run THEN SAYS  &quot;I don&#39;t know. You have to ask the people at the Post office&quot;  What?? Isn&#39;t that his job to find out exactly  how its run , as its part of the government department.<br /> He is like some man at a party who wants to just spout out what he thinks without any actual facts or understanding on the issue. To say &quot;I don&#39;t know you have to ask the people at the Post office&quot;??  Crazy.  It really blows my mind how crazy this all is",Claudia,2020-08-05T01:14:57Z,0
"Trump appoints a possibly corrupt man to be the Postmaster General.  He could help the USPS monetarily, since it will utilized more for sending in ballots.  He casts unnecessary doubt.  Maybe use Fed-Ex to mail your ballot this year?",Sally F,2020-08-05T01:14:49Z,0
Why is Donnie lying even a talking point anymore? Like reporting a dog barking.,russell campbell,2020-08-05T01:12:59Z,2
"He Never stops lying, and he won&#39;t  until WE VOTE HIM AND HIS SUPPORTERS  OUT",Linda Robertson,2020-08-05T20:50:14Z,0
Gggggrrrrrrr. They kill Lincoln and they kill JFK but none of the shitheel nut jobs in this country take a shot at this POS?,Druidic Troy,2020-08-05T01:12:39Z,0
"I know this is a press briefing, but could he stop talking for 3 seconds?!? This is the worst kind of verbal diarrhea. I can smell the rotten stink through the screen.<br />Edit: isn’t it interesting that he only thinks of criminal energy on the side of the Democrats, people who would vote against him? Just like in 2016, when allegedly 3 million people fraudulently only voted for Hillary. (Btw, it is statistically proven, that most fraudulent voting cases were perpetrated by Republicans)",UsernamesForDummies,2020-08-05T01:11:59Z,0
No.  Your the embarrassment.,Linda Smith,2020-08-05T01:08:33Z,0
What ??? Is he rambling on about ???,Kristy Hodgson,2020-08-05T01:06:50Z,0
"Lying, Mr. Trump, mail in ballots are exactly the same as absentee ballots! Exactly the same! You, sir, are the scam, the fraud, the fake news king!!",Barbara Wanlass,2020-08-05T01:02:56Z,0
This is a man who is drowning. And while he claims he took swimming lessons he spews forth garbage. And the whole country will sit by while he gradually slips beneath the waves. No one will throw him a life preserver.,Carbon Unit,2020-08-05T01:02:40Z,0
"He rants on about alleged fraud, and adds. &quot;I guess&quot;?  Can someone please tell this ass to PROVE his allegations!! Unfettered lying!",Barbara Wanlass,2020-08-05T01:00:30Z,0
I&#39;m not sure mentioning Florida in the same sentence as accurate and speedy election results is the best idea.,imasspeons,2020-08-05T00:57:34Z,0
The post office loses money on every package for Amazon - that&#39;s a lie.,KH AKA DG,2020-08-05T00:57:34Z,5
An already unprecedentedly bad situation like the one in NY isn&#39;t enough for Trump - he has to lie about it multiple times anyway. There are lost ballots? No - that&#39;s a lie.  There are forged ballots? No - that&#39;s a lie.,KH AKA DG,2020-08-05T00:56:17Z,0
As with just about every sleazy trick he pulls he gives a tell. He&#39;ll say someone else is doing what he intends. The moron thinks this will put you off his stink.,joel joss,2020-08-05T00:54:53Z,0
"TRUMP HAS TO GO!!! THERE ARE NO &quot;IFS OR BUTS&quot;, TRUMP JUST HAS TO GO!!! STOP THE LIES, STOP THE LACK OF LEADERSHIP. GET RID OF THIS MORON.",Gary Hughes,2020-08-05T00:49:13Z,0
How does this OANN chick live with herself? And Kayleigh Mac too. Everybody sees through them.,Michelle Flynn,2020-08-05T00:48:30Z,0
They had elections during the Civil War and WWII.... how on earth did they manage...?,mrbeast85,2020-08-05T00:47:48Z,4
"TL/DR: it&#39;s about fecking Trump, what more do you need? Except for one or two obvious things that will stick out that you should know if you don&#39;t already. And if you&#39;re wondering why I care about what happens in your country, I have a sister-in-law, a niece and nephew (US dad and born there), and many friends in different states. They mean a lot to me, so I actually give a damn about what happens to you all. But this is going to be a long rant, for which I apologise.<br /><br />&lt;rant&gt;<br />He&#39;d have a fit if he knew about proxy voting as we can do in the UK. I&#39;m essentially housebound - I can go out some days but I can&#39;t guarantee that I can leave my bed on any given day. So years ago, I asked for my husband to vote as my proxy. Initially we voted the same, but he&#39;s changed parties, yet I know that he will always vote my way on my card. He also knows which parties to vote for, in what order, when we have elections with proportional representation (e.g. the EU elections. Don&#39;t get me started on our own idiot in charge... Fricking moron) rather than the &#39;first past the post&#39; that we have in our local and general elections.<br /><br />As a disabled person, I could vote by post if I wanted to. Up until recently voting by post has only been available for those like me or those who aren&#39;t going to be in their ward on election day (on hols, away at uni but still registered at home, that sort of thing), but I&#39;m sure that if we were to have an election soon, voting by post would be made available to all, because it makes sense. And of course the Post Office (in the US as well as the UK) could cope with it - I mean, <b>what the frick does Trump think happens at Xmas?!</b> They&#39;re full of parcels in December, not just envelopes with a form inside them.  Oh, and we have nearly every one of our results (from each ward) declared during the night (there are a handful for whatever reason can&#39;t start counting overnight - so the boxes remain under guard). The polls shut at 10, the boxes are locked and rushed under police guard to the counting centre. There, local council and probably civil servant workers who volunteer to become counters get started immediately. (There are some traditional competitions between a group of different wards up north to see who can count their thousands of votes the quickest. I think the record is something like getting the totals counted <b>and</b> double checked as is necessary in about half an hour!) ^<br /><br />Trump&#39;s appointment of the new Postmaster General should go down as yet another crime. It was done for one reason only, and that is to interfere with the general election results. That is illegal. At least it would be here, and I&#39;m 99.9999% certain it&#39;d be the same in America. It&#39;s a common sense thing if nothing else. The Democrats should be up in arms about this, screaming about Trump&#39;s attempts to cheat on a daily basis.  They should be shouting about his &#39;request&#39; for, iirc, over <b>$300 MILLION</b> to &#39;modernise&#39; the White House. Which was already done TWO years ago. This money is going to come out of any money which eventually (excuse me, <b>finally!</b> ) gets made available in whatever way is planned for Covid relief. McTurtleneck - who helped get that <b>$1 TRILLION</b> of tax cuts for the wealthy is trying to stop it all because of escalating debt... <br /><br /><br />The USA is being turned into a basket case - a banana republic. God only knows that the country would be better off if an actual bunch of bananas was in charge. I&#39;m so scared for my family in NC and friends all over the country, and they&#39;re getting scared for themselves too. You know, there was a time when the USA was respected by the majority of the world, especially when I was born in the mid-60s (and I dare say before that - the 50s would definitely seem to be one of those times), but since the days of Nixon, each time a Democrat gets in, the sanest parts of the world breathes a massive sigh of relief. But your Republican presidents have either been useless, ruthless or barking mad. Or all three. I know I wasn&#39;t the only one who cried with pride in the US, and with relief for the rest of us, when President Obama got elected. More so when the McCain/Palin &quot;competition&quot; was around. God, imagine <i>her</i> as VP now?!<br /><br />Sorry for the essay, I&#39;ve just seen too much Trump tonight and it&#39;s driven me to need to rant. &lt;/rant&gt;<br /><br /><br />^ {As an aside, I assume the counters get paid overtime - being salaried here means that overtime is a) usually voluntary - you can&#39;t get sacked for saying &#39;no&#39;; and b) part and parcel of the remuneration if you&#39;re asked to work extra hours. Time and a half, except for Sundays and bank holidays - official national ones - when it&#39;s double time. There may be some private companies which organise it differently, but it should be to that value, e.g. extra paid time off on top of the standard paid 4 weeks holiday per annum (1.5 or 2 hours extra off instead of the cash. Sometimes that&#39;s more useful to the worker). We don&#39;t have sick days in the way the US does. We only are supposed to call in sick if we&#39;re actually ill. After a few days you get a (free) doctors&#39; note. After a certain number of weeks the payment comes from/via the government (to be honest, it&#39;s been so long since I was able to work that I&#39;ve forgotten/lost track of the current situation regarding long-term sickness payments). It might be a little less than you normally earn, but my hubby&#39;s been off most of this year, even before covid, due to his own disability, and he hasn&#39;t had a change in earnings. <br /><br />I&#39;m honestly <b>not</b> saying this in a &#39;our country is better than yours&#39; way, btw (because we need to change a crap ton of things too. Like booting our own bunch of idiots in charge); this is just to tell you how it is in most of Europe - basically, how a different system works.  It&#39;s what you should be expecting from a so-called democracy in the developed world. A reasonable set of labour laws, and a basic &#39;catch all&#39; for the unemployed - like getting your rent/mortgage interest paid for you until you get another job, as well as some (not enough for fun things) for food, bills etc. If you don&#39;t earn enough - there is a set minimum each type of household should be bringing in (a bit over the &#39;poverty line&#39;) - the housing benefit will top it up. It&#39;s not a way to get rich sitting on your arse, btw. I should know, I&#39;ve been signed off since &#39;95 and I don&#39;t have money to spare, but I also don&#39;t have to worry about the rent or bills should hubby lose his job.  During this time, the govt has been paying 80% of everyone&#39;s regular wage. Some of those people will get it topped up by the Dept of Work and Pensions, the rest should be able to manage. There are also demands for rent/mortgage holidays. My own credit card company offered me a 3 month holiday with no credit score problem if I required it. They&#39;re not the only ones. This should be happening in the US.}",Mandy B,2020-08-05T00:46:59Z,0
"There is a big push for mail in voting now, because we are in a pandemic. Because of this, it is dangerous for larger numbers of people to stand close together in long lines.  How can this reporter and her president be so obtuse? If they are really that stupid, they are to be pitied.",Ian Monam,2020-08-05T00:38:36Z,0
At what point is this criminal?,Keeper of The Lists,2020-08-05T00:36:07Z,0
"I requested an absentee from now and forever because it&#39;s a law in my state. Today I drove right up to city hall and dropped off my ballot. &#39;Great embarrassment&#39;, he can kiss my ass, that was great. Took me all of 2 seconds, no lines, no extra items to fill out, no fraud.",thechief043,2020-08-05T00:33:45Z,0
So if trump wins can we declare cheating? he seems sure there is cheating so it surely works both ways,JPC Joinery,2020-08-05T00:32:14Z,0
&quot;weighing in on e-commerce trends&quot;  lolol  another of a thousand things he know nothing about.  Such a sheltered ignorant person we have in the WH!,MikeyLikesItToo,2020-08-05T00:31:42Z,1
The orange cheeto puff is a moron,Toochie Toochie,2020-08-05T00:27:37Z,0
