comment,id,date,num_likes
The &quot;Tumpated&quot; version.,ChartreuseKitty,2019-10-17T23:14:12Z,0
Oh so we should discriminate against non-normative psychological identities?,J P,2019-10-17T23:13:03Z,0
Dead man.,Nocturnal Recluse,2019-10-17T23:10:37Z,0
Sand??,M Z,2019-10-17T23:07:13Z,0
Trump looks like he shat his diaper. The White House needs an independent doctor that no-one can touch who like in the military outranks everyone if they can prove a president i unfit for duty.,Hillyan,2019-10-17T23:07:07Z,0
And all that adderol &amp; sudafed can&#39;t be helping.,xirsamoht x,2019-10-17T23:05:41Z,0
"<a href=""https://www.youtube.com/watch?v=lpR1DX6_LnA&amp;t=3m00s"">3:00</a> look at the lady in the back that&#39;s fucking hillarious",Alex Thomas,2019-10-17T23:05:35Z,0
&quot;They have lots of sand they can play with&quot; - what??? o.O,The Caffeinated Dreamer,2019-10-17T23:05:21Z,30
@Willow Ashnola their water is very wet from the standpoint of water,Taika,2019-10-18T19:19:18Z,0
"@Taika - If so, then the fact that he&#39;s the biggest child who&#39;s ever been president, even <b>cough</b> trumping Prince George W. Bush II, kind of makes the whole thing backfire in his orange-smeared face.^^",Hazukichan X,2019-10-18T18:58:15Z,1
And Puerto Rico has big water. Get them together and you got yourself a beach vacation.,Willow Ashnola,2019-10-18T04:40:38Z,3
I want to think that he&#39;s trying to allude to them acting like children squabbling in a sandbox but I really don&#39;t think he&#39;s capable of a metaphor.  Who knows....,Taika,2019-10-18T02:09:56Z,3
"What are you talking about, David? This is obviously just a childish, self centered narcissist who never grew up. This is <i>exactly</i> what we all expect out of Trump. Keep calling the stinky onion a stinky onion when we can all smell it. You&#39;re just diluting the message.",Ash Kebora,2019-10-17T23:02:34Z,0
"@<a href=""https://www.youtube.com/watch?v=lpR1DX6_LnA&amp;t=3m06s"">3:06</a> The look on the scribe&#39;s (or whatever they&#39;re called in the US) face is priceless....<br />She&#39;s thinking I CAN&#39;T WRITE THAT, nobody will believe those words came from a POTUS....😂😂<br />It&#39;s funny, but very sad. 😭💔",KLM,2019-10-17T23:02:18Z,0
He needs a bucket and spade to play in the sand.,Jim Mc Court,2019-10-17T23:02:09Z,0
No matter how you cut it.. Pelosi running away was weak move,Name Withheld,2019-10-17T23:01:13Z,0
"The woman in the background <a href=""https://www.youtube.com/watch?v=lpR1DX6_LnA&amp;t=3m04s"">3:04</a> lol",Sean Scanlon,2019-10-17T23:00:45Z,0
"A lot Sand,,,, FFS. Stenographer=😳",Blank Blank,2019-10-17T22:58:48Z,0
"I’m looking for some Anakin Skywalker jokes in regard to sand, but am to uncreative to make one. Anyone wanna do it for me.",THORHAWK17,2019-10-17T22:55:47Z,0
"<a href=""https://www.youtube.com/watch?v=lpR1DX6_LnA&amp;t=3m05s"">3:05</a> that womans reaction to Trump talking about sand says it all",Samir Melton,2019-10-17T22:51:45Z,0
Time for a military coup!,El Rondo,2019-10-17T22:51:39Z,0
As far as his mental health goes this is beyond politics. There is something wrong with him and all the negative attention he gets would not be good for anyone. He needs help and this is coming from someone who hates Trump.,Brandon Porter,2019-10-17T22:50:37Z,0
"Dementia...David, I have been saying the same thing over and over. Please someone get him to a Memory Care Facility he is not well. Regarding the lies and Confused statements he has to say that and do that type of thing because he is a narcissist. They never take responsibility for anything and we&#39;ll blame anyone and everyone but themselves. He never should have come close to the White House.",ArtLuver,2019-10-17T22:48:53Z,0
It&#39;s a narsistic method of keeping his name in the fore front!<br />If America ever beede a loan wolf Lee Harvey Oswald it&#39;s now,Michael Talbot,2019-10-17T22:47:14Z,6
Pacman has a brain tumor. What a asshole. Yea lets get bidden in there or Warren. Pacman the babbling mentally ill stooge. You are a joke junior. Pelosi is a garbling f&#39;king idiot.,Roger Braun,2019-10-17T22:46:16Z,0
"<a href=""https://www.youtube.com/watch?v=lpR1DX6_LnA&amp;t=3m05s"">3:05</a>, lmao, the lady behind Trump was like wtf...?",x0pht,2019-10-17T22:46:13Z,0
He spins everything and his cult slavishly agee (see twitter).<br />I loved the way the blonde lady behind him jerked her head when he talked about the sand!,Fran Tastic,2019-10-17T22:41:43Z,0
"What about the 25th - is that just a joke? It should&#39;ve been used already in 2016 when his lunacy was on display for all to see, and if not on a hundred occasions since. Pretending like he and his doings are is normal is almost lunacy too... The US has a completely broken government, a broken electoral college and largely a broken electorate. The idiocracy is real.",Trottelheimer,2019-10-17T22:40:02Z,0
Hes never been mentally stable.,Ross Trotter,2019-10-17T22:39:58Z,0
"Upper Donald had an unhinged outburst, which is a common symptom of drug abuse.",Nathan D,2019-10-17T22:39:57Z,0
You can’t pass evil off as madness.,Parslow Pongbert,2019-10-17T22:37:59Z,13
Evil begins with mental illness. Psychopathy and narcissism are both mental illnesses. It&#39;s kind of stupid how they&#39;re willing to medicate kids for having ADD or Asperger&#39;s but they won&#39;t medicate the narcissists and assholes.,Save Net Neutrality Anti-Republican,2019-10-18T04:01:11Z,0
"Parslow Pongbert , he can be both and prob is.  Isn’t it time for Article 25 people?",Kathy Cagg,2019-10-17T23:13:31Z,2
"So much sand. They also have a lot of falafel and hummus, so much hummus.",J B,2019-10-17T22:35:06Z,0
Donald T: the answer is SAND! <br /><br />Mr T: Pity the fool and his sand!,Musical Neptunian,2019-10-17T22:33:40Z,0
Were just now concerned for his sanity?,Darmodien,2019-10-17T22:33:14Z,0
"&quot;..lot of sand, lot of sand... They can play with alot of sand over there&quot;",Sam C,2019-10-17T22:33:05Z,10
He needs to go pound sand.,Anna Berry,2019-10-18T04:29:12Z,1
He’s an incredible sociopath and dysfunctional/defective being.  He’s the anti-person of Maslow’s fully human being.,Dutch2go,2019-10-17T22:31:25Z,4
"Tony, I guess you are right....what a mess our country is in!!!!",Myrtle Carter,2019-10-17T22:30:35Z,0
"Here&#39;s the thing...<br />We&#39;ve seen the photo. Trump is a drug addict. He&#39;s BEEN psychotic for a long time. But since he became president, it&#39;s gotten worse because he&#39;s gone deeper into the depths of active use addiction. Unfortunately, his drug of choice makes his mental state decline even faster. What we all know of an addict is that they will use drugs to solve problems. With his stress level, he&#39;s gotta be on his weird uppers so frequently that he&#39;s barely even sleeping. My own grandfather developed similar behavior in his latter years but on codeine based cough medicine. This happens. It&#39;s terrible to watch &amp; I&#39;m sure even worse to experience. What&#39;s really truly sad, is that people in DC know what&#39;s up. And those that do are choosing to let this man suffer &amp; degrade for their own personal gain. They&#39;re letting an addict self-destruct to make $$. That&#39;s sick.",sauceLion,2019-10-17T22:28:45Z,0
"The orange ass hat is dumb as a fox!  He realizes he is done, he is playing mental trying to get away with the least  charges possible.  Don&#39;t trust the fox!",Ledo B,2019-10-17T22:28:29Z,0
&quot;If this is not enough&quot; gimme a break lol,atopermusic,2019-10-17T22:26:13Z,5
&quot;My dog ate my homework Mrs. Pelosi&quot;.....😂,Deus1008,2019-10-17T22:25:58Z,1
I&#39;m calling it:  Trump picked up a antibiotic resistant strain of Syphilis.  It is now eating away at what little brain he had.,Antonius Britannia,2019-10-17T22:23:13Z,0
Politicians are so twisted. They are willing to put the entire country at risk with this man in office just to keep their spot a while longer. Disgusting.,Roger Williams,2019-10-17T22:22:50Z,2
Trump is pissed because we block his attempts to bilk and con the country.,iggy082,2019-10-17T22:22:40Z,48
yankeedoodledandy11  why  do you want Trump as your president. What did he for you and the country.  Fact check first please.,Mieke Bruin,2019-10-20T01:37:11Z,0
Trump 2020 where he wins the house and the senate. Try blocking him then. 😂,yankeedoodledandy11,2019-10-19T08:42:11Z,0
"Luckily for Trump, he has plenty of supporters who want him to &quot;win&quot;, even if it&#39;s at their expense.",Michelangelo Buonarroti,2019-10-18T18:19:12Z,2
Trump is just pathetic,Charles Phillips,2019-10-17T22:22:02Z,0
trump isn&#39;t even crooked used car salesman material,Geo H,2019-10-17T22:21:15Z,0
Someone should build a fake WH with high walls with no door and keep him there permanently 🤪🍊🤯💩🤬,Elson Charles,2019-10-17T22:20:29Z,26
"Love your fruit emojis. Yes, I think Trump is a fruitcake. I think he needs to be locked up in a nice expensive secure private insane asylum where he thinks he is king. He already has a golden throne somewhere. I remember photos of it from before the 2016 election. Right there was proof this man was delusional.",Carol Mello,2019-10-19T04:34:22Z,0
Just hand him a resignation and tell him it moves the White House to Trump Tower.,Mark S,2019-10-18T04:14:18Z,1
He needs to do a Epstein,Jacqueline s,2019-10-17T22:19:25Z,0
This video might have Pakman&#39;s most repetitive headline yet. How many times is it going to be his craziest yet?,Deaf Forever,2019-10-17T22:18:54Z,0
because he continues to set new precedents in the parameters of craziness,Diane Kerrison,2019-10-17T23:14:23Z,0
Since the republicucks didn&#39;t even have a primary what happens if he gets impeached they put up pence? Really he&#39;s been vp this entire time and has done a good job at laying low too good people probably don&#39;t even know who he is I doubt he will have the same level of support as trump though he is just boring. Trumps impeachment would leave the snake with no head during an election no one would be able to beat the dem even if it was one of those boring centrist,legomypancakes,2019-10-17T22:18:42Z,0
"My dad could be pretty argumentative. Some of his pals said he could start an argument in an empty house.  But, in his favour, he never picked an argument with the weather forecasters.  Was it Mulvaney who tried to cover for him then ?",Tony D'Arcy,2019-10-17T22:17:30Z,0
"If this isn&#39;t an adderal addiction, I wouldn&#39;t be at all surprised If it was late stage  ( tertiary ) syphilis..It would certainly explain the brain fuzz..",Anamarie D,2019-10-17T22:11:25Z,5
How much more &quot;concern&quot; can be factored in when considering this drug-addled Lunatic? He&#39;s beyond batshit and heading towards utterly fucked-up.,Marky E,2019-10-17T22:11:13Z,1
He gone cray cray in the head.,Andrew Morgan,2019-10-17T22:10:43Z,0
David FudgePacker is Great,Matthew Photographer at Large,2019-10-17T22:10:21Z,0
"NanCee America Hater needs Acting Classes, This ¨Pray for the President line is getting old",Matthew Photographer at Large,2019-10-17T22:09:22Z,0
Lots of sand to play with!  is he building them a sandpit?!,maxthecat14,2019-10-17T22:07:52Z,1
"Nancy Pelosi should have been removed from the room or taken into custody for disrespecting President Trump like that, David Pakman you are the stupidest mf on the face of planet earth. You ALL need to stop constantly disrespecting the leader of our country this way, no other time in history would this behavior be acceptable. Fake outrage is getting old as fuck, let Trump finish his term and we’ll see who gets elected next it’s not that hard to stfu.",Corey Davis,2019-10-17T22:06:47Z,0
The Republicans DON&#39;T care.,R S,2019-10-17T22:06:31Z,0
I only like Instagram for pretty pictures,Susan Kievman,2019-10-17T22:02:17Z,0
I don&#39;t use Instagram. Is there anything there that you don&#39;t have here?,Susan Kievman,2019-10-17T22:01:35Z,0
If anyone else were to say anything about shooting people on 5th Ave .....the DEA...FBI....would blow their doors off and charge with threats of terrorism if the were joking or not.....,Hootyvon Duke,2019-10-17T22:00:11Z,0
Big sand! Nobody could have know!,dj33036 .dj63010,2019-10-17T21:59:28Z,0
Are any interactions with Trump still being considered weird?  For Trump this is normal.....,Chris Bading,2019-10-17T21:57:57Z,0
"Look, this is no joke. Go to any flat-earther site. You&#39;ll find many of the more suggestible Republicans there, defending the flat-earth cult. I&#39;m not kidding. This is a serious situation, when a good portion of this country has gone back to the eleventh century in intellectual curiosity. Worse still, is the absolute resistance to evidence they can see. I&#39;m not confident in our future.",Tic Tac,2019-10-17T21:56:56Z,0
Any meetings with Trump need to be recorded as proof of what is or is not actually said and by who...,Chris Bading,2019-10-17T21:56:27Z,0
What a comeback for Pelosi.<br />SMH,Sandra Hunter,2019-10-17T21:49:52Z,0
"According to <a href=""https://www.agingcare.com/articles/elderly-temper-tantrums-156852.htm"">https://www.agingcare.com/articles/elderly-temper-tantrums-156852.htm</a><br /><br />&quot;Seniors throw temper tantrums for a whole host of reasons. Often, it’s a result of the personality changes brought on by Alzheimer’s disease and other forms of dementia.&quot;<br />But I lately haven&#39;t seen any of the other neurological issues Trump was displaying, the confusion, wandering off, speech and movement issues. <br />It hard to tell what&#39;s wrong with Trump, there&#39;s so much there.",hrmIwonder,2019-10-17T21:48:57Z,0
Drumpf: They&#39;ve got a lot of sand.<br />Womand behind him: <b>O_O</b>,Dead End,2019-10-17T21:47:24Z,58
Lol,vicki Lawrence,2019-10-18T16:18:39Z,0
I saw that! 😂,Happy Cat,2019-10-18T03:06:10Z,1
I didn&#39;t catch that until you pointed it out.  That&#39;s hilarious,Sal M,2019-10-18T01:30:21Z,1
"If you think that Republicans, the party that actively hid Regan&#39;s obvious deterioration from Alzheimer&#39;s in his second term, are EVER going to put the interests of the people over their own, you may have some delusional problems too.",Celia Lovett,2019-10-17T21:46:59Z,7
"As soon as he tried to buy Greenland, and wanted to nuke hurricanes....had me sold he suffers from some form of mental illness.",Earl Barnes,2019-10-17T21:46:49Z,66
I think it goes beyond a personality disorder. He is crazy.,Carol Mello,2019-10-19T04:29:05Z,2
"Remember raking the forest in California to avoid forest firejust like in France . France President answered back, and that alone is a sign that this man is lacking many marbles .",Estela Fowler,2019-10-18T21:02:50Z,2
@tracy bird no there is hope for a meth head.  Meth heads are drug addicts. Some are evil people like Trump most I would guess aren&#39;t. Trump is narcissistic. He has a personality disorder care less about anybody but himself and extension is crappy children. If he&#39;s a drug addict that is a side note to what he really is,Merri Cat,2019-10-18T12:16:37Z,0
I really don&#39;t think he&#39;s mentally ill. I think he has narcissistic personality disorder. It is not some mental illness they can take medication. This is his personality.  He has no desire to change. This man is a spoiled horrible human being. He&#39;s not stupid he just doesn&#39;t care to learn. He&#39;s a con man.,Merri Cat,2019-10-18T01:49:11Z,8
Nah those are cocaine fueled ideas. I’ve thought about shit like that bonked off my ass.,Only for business,2019-10-18T00:10:54Z,5
"i have worked with dementia sufferers who have a more coherent world-view. i&#39;ve also worked with some who don&#39;t, the difference is none of them have any sort of power over anything, unlike this president",Aspatuary Max,2019-10-17T21:46:28Z,0
What a travesty it is that this joke of a person has to be taken seriously. Being Pelosi at this point is akin to being an astronomer and trying to explain basic geography to a flat earther.,Yomiko Readman,2019-10-17T21:44:21Z,0
"The only thing missing from Trump&#39;s letter was a big, red &quot;D-&quot; grade for such a poorly written letter. This gives the world a look at just how retarded the American president is. Donald Trump stopped learning and maturing around age 8, when his parents simply gave him whatever he wanted. The spoiled, vain degenerate in the White House has never faced real consequences for his constant abuses and crimes. <br />Pelosi, do your damn job. Impeach this stooopid, criminal motherfucker!",Jim Parker,2019-10-17T21:43:58Z,0
All at once simultaneously? Deja vu all over again David. Just kidding.,Mike Wallace,2019-10-17T21:43:56Z,0
"Watch the stenographer in the &quot;sand&quot; clip.  When he says it her head comes up and she stares at him like she can&#39;t believe he just said that.  He&#39;s scary, she was funny.",Mary Hemmann,2019-10-17T21:39:38Z,0
That poor translator has an impossible job. Trumps verbal nonsense needs to be translated into English first!!!,deedrabbit,2019-10-17T21:39:31Z,151
@Pinion325 unless he&#39;s a new york sheister con who grabbs pussies !,Scott,2019-10-19T14:24:57Z,3
Yes and this was the best post I&#39;ve ever read !!!!  Hilarious!,Scott,2019-10-19T14:22:57Z,0
They have a lot of sand. A lot of sand they can play with.<br /><br />Donald J Trump,BJ,2019-10-19T12:31:37Z,3
Just think about future generations who will be reading his &quot;presidential statements&quot;.  What will they think ?,Donee Stoner,2019-10-18T17:46:19Z,8
"deedrabbit no kidding, transcripts of him talking read like somebody had a stroke half way through writing",꧁Lotus Auer꧂,2019-10-18T17:30:51Z,8
Mother Nancy handled trump like a mother  who is dealing with a spoiled child .  Well done Nancy !,judetunes1,2019-10-17T21:38:12Z,0
@Diane Kerrison Maybe she should have .,judetunes1,2019-10-18T00:00:23Z,0
@Diane Kerrison I know  right !,judetunes1,2019-10-17T23:59:52Z,0
and all the other little boys at the table looking uncomfortable thinking it might be their turn next :D,Diane Kerrison,2019-10-17T23:10:03Z,1
I kind of want to see him completely break down on live TV,TheJamie42,2019-10-17T21:37:28Z,0
"No, I would receive no pleasure from that.  I watched the decline of a brother into alcoholism which ultimately ended in his choice of suicide by policeman’s bullet.  At the crossroads of evil and mental deterioration there is only pain and ugliness.  I don’t want to be a part of that.  I want to be a part of the healing.",Kathy Cagg,2019-10-19T03:54:08Z,0
"@Kathy Cagg Yeah, but wouldn&#39;t it be cool to see him lose his shit and charge a reporter?",TheJamie42,2019-10-17T23:26:41Z,1
"TheJamie42 , I want to see people who have the power to do so, step up and process him out of office through Article 25 while there still is an America and Americans to protect from him.",Kathy Cagg,2019-10-17T23:20:15Z,1
&quot; ... it&#39;s a lot of sand.  They&#39;ve got a lot of sand over there.   <b>There&#39;s a lot of sand they can play with.&quot;</b> <br />We [I] in America don&#39;t have a lot of sand.  I want a lot of sand to play with.  I&#39;m talking with my Generals now about bringing back some sand so I can have more sand to play with.  I&#39;m the President of the United States --- I deserve a lot more sand than they do.,Penboy as 'god',2019-10-17T21:35:52Z,1
sand could be a good way to build a wall and that could be tremendous,Diane Kerrison,2019-10-17T23:16:51Z,0
"You know he&#39;s right though. They do say there is a lot of sand and the Russians will be saying &quot;we like playing with this sand&quot; but my father told me when I was young he said &quot;son, the US doesn&#39;t like playing with sand&quot; and he was right y&#39;know we don&#39;t like wars with a lot of sand but Russia doesn&#39;t like wars with sand either. Russia is a big place but it doesn&#39;t have a lot of sand because it has snow mainly and the US has some snow too but the USA has some sand and some snow but Russia only has snow. This is why we are winning but we aren&#39;t really winning now but we have been winning since I&#39;ve been president. But the democrats say we don&#39;t have enough snow we need more snow but that&#39;s FAKE NEWS we have enough snow, what we really need is more sand because that&#39;s what the US likes to fight endless wars in.",TacoDude314,2019-10-17T21:35:50Z,3
TacoDude314 🤣🤣🤣 😳,Janice K,2019-10-18T00:13:55Z,0
"FORGET HIS MENTAL HEALTH. THIS MAN IS HEADED FOR A MASSAVE STROKE. HE IS BLOTED, RED FACED AND SWEATING JUST LIKE ELVES BEFORE HE BLEW OUT HIS ARTERYS . TRUMP  IS ONE IMPACTED  BOWEL MOVEMENT FROM BIENG A VEGATABLE OR DEAD. .  .",ECTOGEOS ZETHIP,2019-10-17T21:35:11Z,1
"Please stop shouting, dude!<br />It&#39;s probably just due to his known skin condition for which he is taking a prescribed medication.<br />Although if he were to suffer a massive heart attack, I&#39;m sure no-one would be in the least bit surprised.<br />Do impeached Presidents get a State Funeral? Just a thought. Might be his best way out of this shit-storm.",Cefn Gwyn,2019-10-17T21:58:30Z,0
COCAINE LOTTERY! <br />Like FOR or comment AGAINST:<br />Will Trump die in office from heart attack?,Gustav Gnöttgen,2019-10-17T21:32:04Z,0
"I have no doubt his lawyers, his supporters and his family will one day claim he can&#39;t be tried because of mental infirmity.  Thing is, that argument is specious.  He doesn&#39;t get to make decisions then get out of the consequences by claiming he was mentally deteriorated.  Really, Trump?  Then as you knew you were, you should have quit then.  Since you didn&#39;t, your claim of mental degradation is invalid.",verilyheld,2019-10-17T21:31:14Z,0
He&#39;s a freek.,no one,2019-10-17T21:30:19Z,1
IT&#39;s LIKE ONE FLEW OVER THE KO-KO&#39;s NEST!!!,the last wild one,2019-10-17T21:30:06Z,1
"The lady doing a double take when Donald starts talking about sand around the <a href=""https://www.youtube.com/watch?v=lpR1DX6_LnA&amp;t=3m00s"">3:00</a> minute mark",Elias Håkansson,2019-10-17T21:29:15Z,0
"I wonder if his mental decline is due to just being much more heavily scrutinized and questioned than in the past, and he can&#39;t handle it?  He obviously hasn&#39;t had that many people in his life, who have questioned him or called him on his bullshit.",LOAblue,2019-10-17T21:28:51Z,0
"Trump tantrums are GOLD!!!!  He&#39;s such a whiny little bitch I love how much he cries.  <a href=""http://www.youtube.com/results?search_query=%23PelosiOwnedTrump"">#PelosiOwnedTrump</a>",itgetter9,2019-10-17T21:27:48Z,0
"Why didn&#39;t the &quot;adults&quot; in the room (besides Pelosi, etc) get up &amp; walk out...or stand up to the despicable words, behavior of trump?",Diana Tutt,2019-10-17T21:26:28Z,0
why is there an ad for the epoch times at the end of your vid,guichar99,2019-10-17T21:26:13Z,0
&quot;And we&#39;re not going to try for an impeachment hearing&quot; she says. What a stupid fucking Cow. &gt;:/,Freeasabird,2019-10-17T21:24:47Z,0
Big Fat Orange Head Go Boom Soon   :),onefatstratcat,2019-10-17T21:23:51Z,0
"At <a href=""https://www.youtube.com/watch?v=lpR1DX6_LnA&amp;t=3m05s"">3:05</a>, the lady&#39;s expression as Donnie Tiny Hands mentions the amount of sand in Syria is priceless.",Maddog Jones,2019-10-17T21:23:03Z,5
"Oh, whatever.  The best thing that could happen is the guy drops dead from a stroke.  But he won&#39;t.  Money will just buy the guy another doctor that will pass whatever he asks for.",Chad Evans,2019-10-17T21:22:01Z,0
"@Chad Evans I never hope anything bad on him. The bottom line is he is looking and acting like he is in decline, his face doesn&#39;t look healthy, he is severely overweight, he is constantly slurring, he is clearly on something and his diet consists of food that should only be eaten once a week as a little treat. I don&#39;t see this ending well for him.",johntrevy1,2019-10-18T15:05:50Z,0
@johntrevy1 There are plenty of doctors in the U.S. that for a few thousand dollars will give you any diagnosis you want.  Your hope that some disease or malady will happen in the next four years to force him out of office will happen is not likely.,Chad Evans,2019-10-18T14:57:40Z,0
"@Chad Evans True, but at the end of the day it is just an illusion. He can pay all the doctors in the world to hush-up the true extent of his physical and mental decline and to even stop investigations. But when  the time comes for him to rejoin Mother Earth his bribes to her will fall on death ears. She will simply say &quot;I don&#39;t want or need your money Donald, I only want you.&quot;",johntrevy1,2019-10-18T14:28:34Z,0
@johntrevy1 No.  But it can certainly buy you enough power to make you think you could.,Chad Evans,2019-10-18T12:25:08Z,0
@Chad Evans Can money buy immortality?,johntrevy1,2019-10-17T23:51:21Z,0
"Watching him become more and more unhinged and displaying increasingly bizarre behaviour I&#39;m convinced he is doped up to the eyeballs. His performance at last weeks rally should be viewed closely- he is slurring his speech  like someone who is high. The longer he is allowed to remain in office without any action being taken to formally address his  condition exposes a fatal flaw in the American political system with regards to checks on Presidential power. At the very least any future presidential candidate should be subjected to stringent cognitive tests. I would also recommend a further age restriction. In many countries there is a legal retirement age, maybe this should be considered for everyone in public office- politicians, judges especially.",Moutton Noir,2019-10-17T21:21:44Z,0
&quot;I know you are but what am I&quot; -45th President of the US,Wilbur Jenkins,2019-10-17T21:18:51Z,1
"&quot;We have no idea.  Only God does, and He doesn&#39;t believe it!&quot;",verilyheld,2019-10-17T21:34:41Z,0
