comment,id,date,num_likes
"I think what is even more disturbing than having an unhinged president, is the fact that all the other leaderships combined have been virtually ineffective in stopping him.",Charlie 313,2019-10-17T21:16:36Z,0
Why hasn&#39;t the speed freak -in -chief dropped dead yet ?,Ro Ni,2019-10-17T21:14:45Z,8
"Hey pencil neck, you mention Trump and Pelosi in the same sentence and then call him crazy? 😂",yankeedoodledandy11,2019-10-17T21:14:42Z,0
@demonorse What is your problem with Fulcrum News?,yankeedoodledandy11,2019-10-26T17:55:47Z,0
@demonorse Err... We can&#39;t purchase firearms.  ??,yankeedoodledandy11,2019-10-17T22:49:19Z,0
@demonorse Shouldn&#39;t you be at home? Street lights are on. 😁,yankeedoodledandy11,2019-10-17T21:43:40Z,0
"lol, keep watching &quot;fulcrum news&quot; there buddy, you shouldn&#39;t be allowed to purchase firearms.",demonorse,2019-10-17T21:35:33Z,1
"the lady behind the &#39; idiot in chief &#39; sums it all up, this is a &#39; kodak &#39; moment, I bet she ran home and got drunk, WTF!",milton james,2019-10-17T21:14:01Z,1
"I missed the letter to the Turkish President......seems like the people that can help him medically, will wait until Trump&#39;s madness and I will be there with my does something terrible....with all of these outbursts, isn&#39;t it time for mental health intervention?",Myrtle Carter,2019-10-17T21:11:45Z,0
"This man is bankrupt on every level possible. Anyone else would have been committed, locked up or both.  Forever. Leader?... Hah",Studio G,2019-10-17T21:11:30Z,160
Y2K intellectually! That’s one you forgot .,Cody Pettry,2019-10-18T19:22:19Z,4
"Oh yeah, he&#39;s bankrupt morally, ethically, financially, politically...<br /><br /><br />...I&#39;m sure there are a few more that I&#39;m missing. XD",Y2K,2019-10-18T01:45:51Z,6
America needs a parlaiment in which the President has to answer to to explain their decisions on a daily basis. The US Pres is way too insulated from responsibility.,Mikey B,2019-10-17T21:10:34Z,2
"&quot;I think I&#39;d take it&quot;&quot;: In an exclusive interview, Trump says he would listen if foreigners offered dirt on opponents <br />--Lucien Bruggeman, June 13/19 <br /><a href=""https://abcnews.go.com/Politics/id-exclusive-interview-trump-listen-foreigners-offered-dirt/story?id=63669304&amp;cid=clicksource_4380645_null%C2%A0"">https://abcnews.go.com/Politics/id-exclusive-interview-trump-listen-foreigners-offered-dirt/story?id=63669304&amp;cid=clicksource_4380645_null </a><br /><br />Future headline, <br />Trump: &quot;When we can, we try not to betray anyone&quot;",Gaetano Vindigni,2019-10-17T21:08:56Z,0
Intro ad!,SamBlue,2019-10-17T21:08:15Z,0
"So, we take pelosi&#39;s word as <b>GOLD</b> 😂 mind you.... this is the same pelosi who has done <b>CLOSE TO NOTHING</b> for my state of california. <br /><br />And, now she&#39;s some bastion of mental wellness!? 😂",TraRob-EastSide,2019-10-17T21:08:00Z,0
"@TraRob-EastSide &quot;A pure one party dictatorship the last 25 years...&quot; Pretty sure that&#39;s a two party problem, neither Republicans nor Democrats have maintained control for that long so I&#39;m not entirely certain to what you are referring to.<br /><br /><br />As for a foreign menace that&#39;s killed far more americans in the last 20 years?  Wars in Iraq and Afghanistan come readily to mind.  Both of those were started by the Republicans if that matters to you.  4,424 military deaths in Iraq, along with another 31,952 wounded.  Add to those totals  2,372 military deaths in Afghanistan, with a further 20,320 wounded.  Oh and lets also include the 1700 civilian contractor deaths. As for legal AND illegal immigrants that totals out to 785 deaths in 2015 according to the Washington post here:    <a href=""https://www.washingtonpost.com/politics/2019/02/21/stephen-millers-claim-that-thousand-americans-die-year-after-year-illegal-immigration/"">https://www.washingtonpost.com/politics/2019/02/21/stephen-millers-claim-that-thousand-americans-die-year-after-year-illegal-immigration/</a>  <br /><br /><br />All that was a quick search on Google, imagine what you&#39;d find if you actually looked for further evidence instead of relying on talking points from those who have an agenda.<br /><br /><br />As for the rest, look into how both parties spent their budgets year by year for yourself. It&#39;s publically available.",Loka,2019-10-17T22:35:51Z,0
"@Loka The question <b>IS</b>  what have we gotten from a pure one party dictatorship the last 25yrs and with a bottomless pit of tax revenue....<br /><br />high taxes<br />illegal immigrants <br />homeless<br />pension liabilities<br />insane prisoner costs<br />poor schools with huge funding<br />pot holes<br />traffic congestion<br />poor housing situations<br />and much more!!!<br /><br />Can u name a foreign menace that has killed and raped more americans than the threat coming from our southern border in the last 20yrs? <br /><br />Here&#39;s a hint.... we have over 2,000 of them in california prisons for <b>MURDER</b> alone. One such induvidual murdered a family friend, jamiel shaw",TraRob-EastSide,2019-10-17T21:44:08Z,0
"Considering Trump&#39;s &quot;I know you are but what am I?&quot; defense, I&#39;d say Pelosi is looking pretty credible.   Granted she&#39;s no paragon of virtue by any means, she does have her own agenda for sure, but what are the people of California getting now under Trump?  Sand? ;)",Loka,2019-10-17T21:27:50Z,0
"listen whoever defends this garbage has issues themselves, we&#39;ve all met people like this throughout our lives the difference is Trump makes these mistakes and we ALL pay for it as a whole, and it&#39;s not just America, it affects the world and not in good ways that is evident.",stephanie cust,2019-10-17T21:07:34Z,0
WTF?  What am I writing ...sand?  Really??? Sand?  OMG....🤦🏻‍♀️,Blue Newt,2019-10-17T21:05:17Z,3
25th for 45*,Dean Purcell,2019-10-17T21:04:59Z,1
TRUE AMERICANS DON&#39;T GIVE A SHIT ABOUT THIS SON OF A BITCH&#39; HEALTH<br />DROP DEAD!!,2468 1357,2019-10-17T21:02:49Z,0
☺Trump is Hilarious 😊,Rhino Bless NYC,2019-10-17T21:02:03Z,0
The president has mental health issues now imagine what it’s like to be a person who has voted for him And continues to support him... idk whether to laugh or just feel deeply sorry for these people.,alexcaymans,2019-10-17T21:01:05Z,0
You can&#39;t survive on speed and Big Macs forever.,rex wall,2019-10-17T21:00:47Z,61
"<a href=""https://www.youtube.com/watch?v=lpR1DX6_LnA&amp;t=3m05s"">3:05</a> this ladies look says it all.  Lol",Jon Kovach,2019-10-17T20:59:47Z,2
Just proof that Pelosi belongs where she is. You go girl. Stand up to them dumb ass bullies for America. I got your back.,NinjaOnANinja,2019-10-17T20:59:06Z,0
It takes a lot to make a four-star general cringe.,rationalguy,2019-10-17T20:58:44Z,77
That picture and Pelosi&#39;s word isn&#39;t enough for you to diagnose him.  This is still a partisan take.,Bishop Pair,2019-10-17T20:58:13Z,0
How about the views of countless recognised psychologists?,Simon Few,2019-10-17T21:23:37Z,0
"But It&#39;s true, syria has a lot of sand. When will lamestream media realise that it&#39;s all true.",Vagabond,2019-10-17T20:57:29Z,0
25th amendment.,L' Kat Morin,2019-10-17T20:57:28Z,0
And I immediately put the image for my banner on my Twitter account.  Awesome how Pelosi made Trump look so small and insignificant. Everyday that goes by Trump becomes mentally more unstable.  He may completely break down in his lunacy and really lose control where he has to be taken away.,100PercentOS2,2019-10-17T20:57:14Z,0
He&#39;s getting to where he can&#39;t snort the adderol fast enough.  Obviously.,rationalguy,2019-10-17T20:56:57Z,121
@Nicholas Maude symptoms of Syphilis,BCA Jr,2019-10-18T21:54:08Z,2
Nicholas Maude one can only hope,bodybalancer,2019-10-18T17:39:14Z,1
"@reldra More likely he&#39;ll crash and have a heart-attack and/or a stroke given his age, health, the fact that he eats junk-food and doesn&#39;t exercise.",Nicholas Maude,2019-10-18T04:39:28Z,8
"I do think there is truth to that. If that is real,  he will crash at some point and need rehab. He won&#39;t be able to function.",reldra,2019-10-18T03:32:12Z,6
"It’s all that, AND ... he’s just a despicable human being, plain &amp; simple.",Michelle Flynn,2019-10-18T02:53:04Z,7
"lol. Poor, silly Dr. Dave. I often wonder what he thinks the word tantrum means. Keep making those armchair diagnosis&#39;. How did the country ever manage without him!",Adam Landry,2019-10-17T20:56:09Z,0
"&quot;A lot of sand&quot; may refer to fact that trump sees the land as worthless because no building can be put on it, therefore having no economic return.  That it has been the &quot;homeland&quot; of many for thousands of years lends no value?",David L Lewis,2019-10-17T20:54:36Z,0
"Syria is a major oil producing country. Plus it sits in an ideal location for a proposed oil pipeline from russia into the far east. Oh and russia maintains an air force and naval base (which stations nuclear submarines) in syria. And it is home to six UNESCO world heritage site. So yeah, a little more then sand there.",Sean Davidt,2019-10-17T22:20:06Z,0
Muh muh muh Mental!!,mercoid,2019-10-17T20:52:39Z,0
"Are “meltdowns” and “diatribes”, along with sexual assault, racism and treason, signs of snorting Adderall?",omar chandler,2019-10-17T20:52:15Z,8
@Jody Silvia I think him being fully aware of having zero money and power for the rest of his life in a jail cell would be enough for me.,johntrevy1,2019-10-18T00:09:50Z,0
@Jody Silvia I never wish death on anyone. But I have been saying for a while now that I think he will win again (unfortunately) but will die 3 years in due to health complications brought on by his lifestyle.,johntrevy1,2019-10-17T22:29:07Z,0
"@Jody Silvia I think they know, they just either don&#39;t care or can&#39;t do anything.",johntrevy1,2019-10-17T22:15:47Z,0
"Well, the meltdowns. The rambling. The conspiracy theories. That can be explained with amphetamine abuse. The rest is just him being a shitty human being lol",Wild World,2019-10-17T21:31:15Z,1
"You guys just love talking yourselves into losing an election. If you actually did something useful instead of using these character assassination tactics, you might actually win one. Nobody likes a loser. 😂",yankeedoodledandy11,2019-10-17T21:30:58Z,0
"Any Republican leader who says they don&#39;t know that something is very wrong with Trump is lying. They know it. They&#39;ve known since before the 2016 elections. The only ones in denial about it are his followers. If you can listen to that man ramble incoherently, or read his bizarre tweets and interviews, and not get the sense that his mental faculties are not all there, you may need to get medical help yourself.",IT'S ME FROM 713,2019-10-17T20:52:04Z,1
"<a href=""https://www.youtube.com/watch?v=lpR1DX6_LnA&amp;t=3m03s"">3:03</a> - Her expression to &quot;sand&quot; comment is hilarious.",J Morris,2019-10-17T20:51:52Z,7
<b>For every tortured small childs tears he should lose his mind to the point of suicide! Fk treasonoustrump!</b> 🖕👽,my music,2019-10-17T20:50:04Z,0
"Trump must understand what&#39;s going on because he recognizes there is sand there. It&#39;s true, they have sand. It&#39;s totally a thing there..",Joe BONES,2019-10-17T20:48:57Z,0
He referenced “Sand” as in that Syria doesn’t have much natural resources,edgar bier,2019-10-17T20:48:19Z,32
If he&#39;d bothered to read any of his briefings he&#39;d know that Northern Syria is actually part of The Fertile Crescent. It&#39;s why the area was first settled.<br />Of course Trump would only care about the area if there was oil or minerals there.,Sue Dent,2019-10-20T20:47:39Z,1
"@Julian Marsh Exactly, if you decide to withdraw the troops, you negotiate and withdraw slowly. Obama also wanted to get us out of the war, but realized the shit that would unfold. Basically,  other countries no longer trust us and realize they, in fact, don&#39;t evenneed us or respect us. We are way down on the list for everything. I&#39;m talking infant mortality, education, maths, sciences, reading. We&#39;re a laughingstock. The people defending that coward would actually kick someone like his ass if he dared entered the local pub. I&#39;ll take decades to get back any respect. The world will move on.",Tomas Kuli,2019-10-19T01:41:18Z,0
"@Tomas Kuli    Trump is doing whatever he can to downplay his betrayal of the Kurds.  &quot;They aren&#39;t angels&quot; as if anyone thought they were (and they were good enough to do our fighting for us against ISIS); they didn&#39;t help us in World War II (totally irrelevant); and another reference to all that sand for Turks and Kurds and everyone else over there, to play in....making war sound like a sandbox fight between toddlers....the bottom line:  he abandoned our allies to their worst enemy and who in the world is ever going to trust the U.S. again?  Abandoning the Kurds is not an impeachable offense; but it could only be done by a dumb s.o.b.",Julian Marsh,2019-10-19T00:27:00Z,2
@Julian Marsh Wake up? Expound.,Tomas Kuli,2019-10-18T22:48:19Z,0
You honesty think &#39;sand&#39; is a reference to a lack of natural resources???  Wake up.,Julian Marsh,2019-10-18T19:12:41Z,0
Even if the American people acknowledge his deteriorating mental status I don`t think anything will change in regards to the upcoming impeachment inquiry,Maraues,2019-10-17T20:47:32Z,0
"D t meets at least 15 of the 20 criteria for being a psychopath...and no, they are not all violent. Research it for yourself and you will see him and his cult in a whole new light and perhaps we can strategize a way to a win/win outcome.",Alex Chavez,2019-10-17T20:46:31Z,0
And they said he needs an anger translator,Gary Turbo,2019-10-17T20:46:26Z,1
"Obama employed one too.<br /><a href=""https://www.youtube.com/watch?v=HkAK9QRe4ds"">https://www.youtube.com/watch?v=HkAK9QRe4ds</a><br />Funny as fuck, man!<br />Look at what you had, America!",Cefn Gwyn,2019-10-17T21:34:57Z,0
"<a href=""https://www.youtube.com/watch?v=lpR1DX6_LnA&amp;t=3m05s"">3:05</a> - lady behind trump, her reaction to &quot;there&#39;s a lot of sand&quot; ... couldn&#39;t have been more perfectly timed.",Beez Neez,2019-10-17T20:46:25Z,8
"&quot;It&#39;s a lot of sand. They&#39;ve got a lot of sand over there, so there&#39;s a lot of sand that they can play with&quot; - <i>Donald Trump, The Actual President of the USA 2019</i>",Citizen of Nowhere,2019-10-17T20:45:43Z,115
"Trump is an idiot and anyone that supports him,I hope there is an end insight",Erika Hutton,2019-10-30T14:12:32Z,0
Please edit to read The Actual Illegitimate President of the USA 2019.,Lizzard Breath,2019-10-18T23:19:12Z,1
@Emerald kat I&#39;m Canadian and what I think when he says shit like this is the same thing you think. What a fucktard! 25 #45 before he pushes the nuke button!!  We shake our heads in disbelief that he is still there!!  Get on it already.,Kim Fortin,2019-10-18T21:26:07Z,4
"I just want him to walk under one of the windows from Spec Ops: The Line so someone can shatter that window with a bullet and just bury him in a sand avalanche.<br />...Okay, it&#39;d have to be a big window...",Hazukichan X,2019-10-18T18:52:12Z,1
@claire bigelow Trump should negotiate a deal beteeen Syria and Puerto Rico to trade water for sand.,lobserve1,2019-10-18T12:19:38Z,1
"<a href=""https://www.youtube.com/watch?v=lpR1DX6_LnA&amp;t=3m04s"">3:04</a> Her face. <br /><br /><br />Yeah, that&#39;s what we&#39;re thinking too, lady.",Citizen of Nowhere,2019-10-17T20:44:41Z,9
this is horrifying and in the same time max entertaining. Trump reminds me of Peter Griffin,jacky laibach,2019-10-17T20:43:23Z,1
"@Citizen of Nowhere yeah, perhaps I was unfair towards Peter  but they both have some crazy ideas X)",jacky laibach,2019-10-17T21:17:28Z,0
"Except Peter Griffin forms coherent sentences, has a moral compass and bangs his wife once in a while.",Citizen of Nowhere,2019-10-17T20:58:50Z,1
The look on the faces of those three to his right. Tells the whole story. Jesus.,Citizen of Nowhere,2019-10-17T20:43:05Z,1
"@Karen Byrd Thanks for the info. Ironic, because Steve actually looks like he&#39;s thinking &quot;please shoot me now&quot; in that photo...",Citizen of Nowhere,2019-10-17T20:55:47Z,0
"For those of you who doubt Chump is on drugs, go to the David Pakman show where he talks about the time they showed a picture of Chump eating a taco salad, and right behind him was an open drawer and in the drawer were Sudafed and other drugs in boxes. One of the boxes is for a product that is not made in the USA, but they carry other products that are. Basically, uppers and downers. He also has a history of grinding up Adderall and snorting it according to people who are close to him in the past. Maybe that&#39;s why he doesn&#39;t sleep more than 3-4 hours a  night. I hope we get rid of this maniac before the next election. There are theories going around that say once he learns he may not be the Republican nominee, or that his approval rating is down so much that he might as well give up, because he won&#39;t allow himself to look like a donkeys butt. We shall see....",kitkat75,2019-10-17T20:42:40Z,1
"I am praying God will heal the Republican&#39;s brains and they will work with the Democrats and remove Mr. Trump from office before he does any more harm.  So far he has given Syria to Turkey,  what country is he going to betray next and to whom will he be giving that country?  Some days Mr. Trump thinks he is President of the USA other days he thinks he is King of the Jews.  This is not a well man.",TREIZE CORBEAUX NOIR,2019-10-17T20:42:28Z,1
And the Trump Cult cheers and applaudes ...,Erik,2019-10-17T20:41:15Z,0
"I wonder if those advisors are really looking down in embarrassment, they seem kinda pissed to me.",SylvasASH,2019-10-17T20:41:11Z,0
"Have you ever attended a business meeting? Staring down is unmistakable for &quot;yes, we&#39;re responsible for this fuck up, please finish yelling so we can leave&quot;.",demonorse,2019-10-17T21:27:10Z,0
"Love your videos and point of view, but aslong as this crazy person keeps getting away with everything and now allowed to host G7 at his property, I cant really say he has it bad. Keeps doing whatever he wants.",Grant Shuster,2019-10-17T20:40:15Z,0
Lol at the blonde woman who jerked her head up when he mentioned sand.,K K,2019-10-17T20:37:05Z,0
Anybody who prays instead of taking practical action is no use in government. Pelosi has wasted years failing to get Trump removed. She needs to go as well.,Grimbeard,2019-10-17T20:36:57Z,0
"&quot;If this is not enough&quot;, but as far as evidence for mental illness or substance abuse goes, I&#39;d say this is one of the weaker pieces. Is there video of the meltdown? Any details beyond Pelosi&#39;s perception that it seemed pretty bad?",Lifragen,2019-10-17T20:36:40Z,0
To much dopamine drug&#39;s maybe ?,void main {void},2019-10-17T20:35:42Z,0
"True narcissism (not just some trades) is much more demented than people think. Serious cognitive deficiency. I&#39;ve fought these types in court. It&#39;s amazing that these types exist in all sorts of positions. I&#39;ve seen some baffling memory problems and messed up thinking, also chronologically. Very short thoughts. Poor object constancy. They mostly react to language and not to facts. I recognise such a letter with threats and appeasement, flip-flopping line by line. Typical way they effectuate themselves, unable to form constructive thoughts.",Planet de la Tourette,2019-10-17T20:35:13Z,1
Look at all those hands folded together on Trumps side,Ilnath,2019-10-17T20:34:48Z,71
I was noticing that too. I wonder what the body language analysts would say that means?,Dollingitup,2019-10-20T15:03:24Z,1
They are hanging their heads in shame.,Donee Stoner,2019-10-18T17:44:25Z,8
The note-taker&#39;s reaction behind Trump when he mentioned sand says everything.,MrSaltphone,2019-10-17T20:32:25Z,57
"Dan1984 good grief it would be torture. I can’t even stand listening to him speak, his tone, his constant bragging how he’s doing the greatest job, and the rest of his stupid ass comments. You couldn’t pay me enough to translate for that ignoramus.",Janice K,2019-10-18T00:06:53Z,2
"MrSaltphone <br /><br />To me, it looks like she wasn’t sure if she’d heard him right first; then realised, when he repeated himself, that yep, the damn lunatic did indeed say:<br /><br />“There’s lots of sand” <br /><br />Being a note taker for Trump would drive me to either drink, or suicide: imagine having to listen to him mangle the English language for hours at a time, and be expected to memorialise it...I hope the White House stenographers have good therapists haha.",Dan1984,2019-10-17T22:20:24Z,6
She&#39;s greasing the wheels for Amendment 25! That&#39;s a signal to the cabinet to do it.,Shawn Newell,2019-10-17T20:32:04Z,20
I hope they do.,Carol Mello,2019-10-19T04:38:19Z,0
This is just vile anti-Trump propaganda. Goebbels would be proud of such a good student.,Robert Aspindale,2019-10-17T20:31:19Z,1
@lyssword Whence this lunacy about Russia?,Robert Aspindale,2019-10-17T21:02:12Z,0
"propaganda is posting memes with 0 thought, facts or accountability on facebook. Like 30% of those groups are managed by russian agents",lyssword,2019-10-17T20:56:35Z,1
Meth head.,C Dunk,2019-10-17T20:31:19Z,0
"<a href=""https://www.youtube.com/watch?v=lpR1DX6_LnA&amp;t=3m05s"">3:05</a> That woman&#39;s reaction to the presidunce blaming the sand was hilarious.",The Great Dragon,2019-10-17T20:31:18Z,21
He may never face appropriate consequences for his actions...but here&#39;s to hoping that perhaps the stress of the presidency is enough to seriously expedite a mental disease like Alzheimers or dementia.,Tyme Taylor,2019-10-17T20:30:42Z,0
hahaha that reaction from the woman behind trump has to become a meme!,Reaching Evans,2019-10-17T20:30:28Z,1
"Don&#39;t get your hopes up for that, I&#39;m convinced that nothing at this point will be enough to turn the diehards away from him and most Republicans in government are willing to play along because it aids their long-term goals. They gave up putting the well-being of the American people and country ahead of their own interests a long time ago.",Saphrone Seidel,2019-10-17T20:29:58Z,0
"What you miss is that his 60,000,000 followers believe WHATEVER he says.",John Miranda,2019-10-17T20:29:56Z,35
"John Miranda <br />Stop worrying about his base. <br />1. Plenty who voted for him in ‘16 won’t vote for him in ‘20.<br />2. There are over 200,000,000 registered voters in the US. Concentrate on getting them out to vote.",Q. E. D.,2019-10-19T21:21:26Z,0
"Dump the Chump  it time brings reality to the surface, just believe right always wins in the end",the bub,2019-10-18T12:06:33Z,2
It’s a cult.,Janice K,2019-10-18T00:03:24Z,5
"A quote attributed to HL Mencken. “Nobody ever went broke underestimating the intelligence of the American public”, comes to mind and judging from the number of Trumptards leaving incoherent messages, it leads me to believe he was right.",The Chumps been dumped.,2019-10-17T23:56:55Z,6
"John Miranda sadly there will always be a group of idiots forming the lowest common denominator in society, Trump managed to join them into one clan.",the bub,2019-10-17T23:47:03Z,5
"Unmatched wisdom from a very stable genius, just like a smart person!",Rob Duncan,2019-10-17T20:28:54Z,21
Gotta watch out for those creatures from the stable. They can be dangerous. <br /><br />Then there are self proclaimed geniuses...the worst kind.,Carol Mello,2019-10-19T04:36:20Z,1
"With a very very large... a-brain. (that&#39;s non-brain, for all theetymology fans out there!)",Hazukichan X,2019-10-18T18:56:36Z,0
"Basic parenting trust is earned not demanded good leaders command and lead by experience, the generals know that. Power recognizes and respects other power.",no way,2019-10-17T20:28:50Z,0
The man is a sociopath....check his track-record......,in551125do,2019-10-17T20:28:33Z,0
Of course not. We&#39;re never ready...,Michelle M,2019-10-17T20:28:29Z,0
I don&#39;t think Trump has gotten any worse. It just seems worse because the entire institution has become corrupted to the point where there is not enough people left willing or able to stop Trump from doing stupid things and the consequences have become more dire.,James Firmiss,2019-10-17T20:27:37Z,0
"He not mental ill, he&#39;s a criminal with a guilty conscience and is laying an insanity plea with the help of Nancy.",Pranay,2019-10-17T20:27:28Z,0
Nope. He is mentally ill. My psychiatrist and psychotherapist pegged him as a narcissist in 2016. I asked because certain behaviors of his remind me of my narcissist dad.,Shawn Newell,2019-10-17T20:36:35Z,1
The advisors look exactly like guilty dogs.,Bryan Turner,2019-10-17T20:27:23Z,205
Bryan Turner  They look more like cockroaches in taxpayer-funded suits to me.,TheTRUTHmatters!,2019-10-19T20:02:04Z,0
They literally look like they&#39;d rather be ANYWHERE but there.,Kevin D. H.,2019-10-18T15:46:03Z,2
LOL 😃,amexjam55,2019-10-18T05:19:03Z,0
Aren’t they?,Timothy Keough,2019-10-18T01:34:31Z,1
Well...Trump did shit on the carpet.,Robert Dougherty,2019-10-17T23:44:42Z,4
The looks on the people&#39;s side of Donald Trump is called in German &quot;Fremdschämen&quot; = second hand embarrassment.,Pippa vom BR,2019-10-17T20:26:57Z,0
He is going to have a very public and very serious breakdown at the latest when he has to have a live debate with whoever wins the Democratic nomination. That person only need to stand there and list all Trump’s bad decisions and their negative consequences to the average American one by one until he goes off in an obviously insane anger tantrum. It is going to be a great spectacle.,Tim Laursen,2019-10-17T20:25:45Z,0
